page,p
13,"laxminagar village cascade, 3."
13,"tummala tank, 4."
13,ganugapadu and thungaram tank) field data collection and cost-benefit were determined during the interviews.the assessment: focus group discussions were approximate seasonal volume was determined carried out with a semi-structured questionnaire by both depth and surface area of each tank.
13,the survey to assess the status and opinions of survey has brought out the farmers’ perception farming households on these tanks (figure 6). on ws and how to enhance it through tanks survey was focused on the tanks characteristics restoration.
13,"the respondents across all the such as existence of technical information villages proposed interventions to improve (area, depth, and command area) maintenance storage capacity of tanks by rehabilitation. and present condition of the tanks (tables 4 and 5)."
13,"the selected tanks were visited and rehabilitation of a tank’s ecosystem their specific pre-and post-monsoon depths is considered as one of the best options journal of rural development, vol."
13,"38, no."
13,"1, january - march : 2019"
14,"68 sumit anand, krishna reddy kakumanu and u."
14,amarasinghe to improve the performance of irrigated also report that the area under tank restoration agriculture.
14,"the cost of tanks desilting varies has increased from 19-107 per cent for large, from 33 to 76 inr/m3 (palanisami, 2014)."
14,"past middle, small and marginal farms.the european experiences show that physical modernisation economic committee (eec) had attempted to alone improved irrigation efficiency by 32.25 modernise irrigation tanks in tamil nadu during per cent and subsequently increasing the yield 1984-85 to 1994-95 periods."
14,"the approximate by about 30 per cent (sindhu, 2010)."
14,"deivalatha cost for the modernisation during the aforesaid et al. 2014 also show that the crop yield has periods was inr 21,000 per ha (palanisami, increased between 2 to 19 per cent (average 2008). 10 per cent) due to tank restoration.the authors journal of rural development, vol."
14,"38, no."
14,"1, january - march : 2019"
15,"use of remote sensing and gis for identifying tanks and rehabilitation benefits to the rural areas 69 figure 6: surveyed tanks journal of rural development, vol."
15,"38, no."
15,"1, january - march : 2019"
16,"70 sumit anand, krishna reddy kakumanu and u."
16,"amarasinghe table 4: farmers’ perception on tank statistics village tanks area pre-mon- post- pro- proposed sluice channel under soon mons posed increase condi- condi- irrigation volume oon desilt- in bund tion tion (ha) (m3) volume ation height (m3) depth (ft) (ft) pagidaru sambai gudem 4000 327881 5559145 6 2 fine fine ayyarkunta 20 4443 37635 4 2 poor fine (no gates) ippgadda 80 9000 442508 3 3 not well not well ponchampalli 1 240 175218 778130 5 not not well fine required ponchampalli 2 20 22387 172986 3 2 not well fine kodichala 60 2643 39379 5 2 poor fine (not working) chinna (individual) 200 41681 827635 3 9 not well no channel laxmi- chinnarulagubal 800 222750 1744887 full 2 not well fine nagar needed kothuru 40 43031 221085 4 2 fine fine kamalapuram 20 13331 77970 partial 2 fine fine needed rajupeta 10 marshy 30884 full not not well fine needed required table 5: individual tank statistics area under tanks proposed pre-monsoon proposed sluice irrigation (ha) increase in volume desiltation condition bund height (ft) (million m3) depth (ft) ganugapadu 120-160 not required less water partial needed fine (marshy) thungaram 120 3 less water 10 fine (marshy) tummala 2000 not required 7.5 required fine in the present study, the pagidaru area of 4,420 ha (table 6)."
16,"however, the actual cascade from bc was identified for rehabilitation, area under cultivation in the cascade is only i.e., desilting, strengthening tank bunds, canal 3,536 ha, which is about 80 per cent of the actual and repairing sluices in the cascade."
16,the area of command area.
16,the area under the cascade was the tank cascade is 272 ha with a total command reduced due to siltation over the years.
16,"farmers’ journal of rural development, vol."
16,"38, no."
16,"1, january - march : 2019"
17,"use of remote sensing and gis for identifying tanks and rehabilitation benefits to the rural areas 71 perceptions through personal discussions also additional yield, water and area due to the reveal that there is a need for rehabilitation of rehabilitation of tanks (deivalatha et al., 2014; the existing tank cascade."
17,"studies from various palanisami, 2008; arumugam et al., 1997). researchers also show that there will be an table 6: pagidaru cascade area and crop details village tanks tank area depth actual area under cotton paddy (m2) (m) command cultivation (ha) (ha) area (ha) (ha) pagidaru sambai gudem 1,588,327 3.5 4,000 3,200 2,560 640 pagidaru ayyarkunta 25,090 1.5 20 16 12.8 3.2 pagidaru ippgadda 147,502 3.0 80 64 51.2 12.8 pagidaru ponchampalli 1 222,323 3.5 240 192 153.6 38.4 pagidaru ponchampalli 2 69,194 2.5 20 16 12.8 3.2 pagidaru kodichala 19,689 2.0 60 48 38.4 9.6 source: field survey in the bhadrachalam."
17,the major crops grown in the command with the available information and area are paddy and cotton.
17,"paddy is cultivated estimates, a cost-benefit analysis was carried out in 80 per cent (2,828.8 ha) of the area and the for different cropping and irrigation patterns. rest with cotton (707.2 ha)."
17,"based on the socio- the lifespan of the tank rehabilitation is assumed economic study conducted in the area, paddy to be 10 years at an interest of nine per cent. and cotton yields are found to be 58.25 and 20.5 an annual maintenance cost of inr 30,000 was qt/ha, respectively."
17,"the net income from these also considered for the analysis to maintain the two crops are inr 7,175 and inr 10,708 per ha, cascade."
17,seven scenarios were considered for the respectively. cost-benefit analysis (table 7).
17,"scenario one is assumed to have the the total cost for tank rehabilitation same/actual irrigated area (a) (paddy - 80 per was estimated to be inr 10.36 million (inr 50 cent and cotton - 20 per cent) without any per m3 for desiltation, which is an average of change in the area (∆ a) and yield (∆ y)."
17,cost of 33-76 inr/m3 as reviewed above).
17,the estimates the tank rehabilitation is considered to be 50 project that the cost of rehabilitation will be inr/m3.
17,"the net benefits generated from the inr 29,300 per hectare."
17,"the desilted soil is also paddy area (80 per cent) and the cotton area considered as a viable fertiliser for the main (20 per cent) are the only ones considered for fields, and some farmers actually purchase this analysis."
17,"in addition, soil desiltation revenue it."
17,"hence, the revenue generated due to the was also added to the benefits for the first year. desilted soil was estimated to be inr 2.59 in the following years, only crop benefits were million (inr 5 /m3). considered for the analysis."
17,"journal of rural development, vol."
17,"38, no."
17,"1, january - march : 2019"
18,"72 sumit anand, krishna reddy kakumanu and u."
18,amarasinghe scenario two is assumed to have the amount of 76 inr/m3 keeping the rest to the same yield (y) but the area is considered to actual situations in scenario 5.
18,"in scenario 6, have increased by 20 per cent (∆ a), which additional benefits (i. e., increase in area by 20 covers the actual command area."
18,the rest of per cent and the yield generated from it) were the components remain similar to scenario also taken for analysis.
18,the increased area was also allotted with the present cropping pattern one.
18,the yield was increased by 30 per cent of 80 per cent paddy and 20 per cent cotton.
18,"in (∆ y) in scenario 3 without having an increase in scenario 7, additional benefits with the 50 per area."
18,scenario 4 was taken up with an increase cent paddy and 50 per cent cotton were used of 20 per cent in area (∆ a) and a 10% increase for analysis. in the yield (∆ y).
18,"on the other hand, the cost of rehabilitation was also taken to the maximum table 7: scenarios for the cost-benefit analysis s.no scenario particulars 1 s1 actual irrigated area+ desilt cost 50 inr/m3+actual yield+ paddy area (80%)+cotton (20%)+revenue from desilted soil 2 s2 increased area by 20% + desilt cost 50 inr/m3+actual yield + paddy area (80%)+cotton area (20%) + revenue from desilted soil 3 s3 actual irrigated area+ desilt cost 50 inr/m3+increase in yield (30%) + paddy area (80%) + cotton area (20%) + revenue from desilted soil 4 s4 increase area by 20% + desilt cost 50 inr/m3+increase in yield (10%) + paddy area (80%)+ cotton area (20%)+revenue from desilted soil 5 s5 actual irrigated area + desilt cost 76 inr/m3+actual yield + paddy area (80%)+cotton (20%)+revenue from desilted soil 6 s6 additional benefits only due to increased area (20%) +desilt cost 50 inr/m3+paddy area (80%) + cotton area (20%) 7 s7 only additional benefit due to increased area (20%) + desilt cost 50 inr/m3 + paddy area (50%) + cotton area (50%) the results from the analysis show that actual cropped area due to desiltation."
18,"but the with the present cropping pattern and net area can also be increaed due to rehabilitation. benefits (s1), the cascade would have a benefit hence, scenario 2 shows that with the increased cost ratio (bcr) of 1.84 with an internal rate of area (20 per cent) under the cascade the return (irr) of 23 per cent (table 8), assuming bcr can have 2.21 with an irr of 35 per cent that the water supply would be sufficient for the (table 6)."
18,"journal of rural development, vol."
18,"38, no."
18,"1, january - march : 2019"
19,use of remote sensing and gis for identifying tanks and rehabilitation benefits to the rural areas 73 table 8: bcr and irr for the pagidaru catchment s1 s2 s3 s4 s5 s6 s7 bcr 1.84 2.21 5.91 3.83 1.45 0.38 0.43 irr (%) 23 35 740 115 12 -19 -17 source: authors’ estimations.
19,increase in yield (∆ y) by 30 per cent of this study.
19,"but considering the benefits from according to sindhu 2010, would have further the total command area in the catchment and benefits in the command area with 5.91 bcr and with the increased area and yield, the cost- 740 per cent irr (s3)."
19,"however, increase in yield benefit and irr have positive values (i.e."
19,s3 and by 30 per cent would depend on various factors s4).
19,"the s4 is found to be a good investment such as variety and management activities option in the study areas when compared to on field (alternate wetting and drying, direct the other options. seeding of rice, bt cotton, etc.)"
19,"hence, increase conclusion in the yield is considered to be a minimum of 10 per cent in scenario 4 with sufficient water in order to face the growing threat of due to rehabilitation."
19,"the bcr for s4 is 3.83 with water scarcity, it is required to rehabilitate an irr of 115 per cent. and improve the existing irrigation systems resulting from deferred maintenance."
19,"this in case, where the rehabilitation cost study is conducted towards the identification is at inr 76 per m3, the bcr with the actual of water bodies/tanks and the rehabilitation irrigated area will be 1.45 and irr 12 per cent of individual tanks and tank cascade systems."
19,all the scenarios from s1 to s5 have higher remote sensing and gis are found to be a returns with the rehabilitation.
19,"but, considering suitable means to detect small tanks and the additional revenue and area with the accurately measure their surface areas."
19,"the rehabilitation, (i.e., ?"
19,a and ?
19,"y) the bcr is 0.38 combination of satellite-based measurements and irr is -19 per cent, which is not feasible and field survey data has allowed for monitoring for investment (s6) due to the negative values. of tanks."
19,"identifying such tank cascades or similarly, with changes in the cropping pattern bigger tanks for rehabilitation to improve to 50 per cent paddy and 50 per cent cotton have the water storage and making decision on increased returns over s6 with 0.43 bcr and -17 the investment options can reduce water per cent irr (s7)."
19,"nonetheless, considering the scarcity with increased benefits."
19,"the improved other ecological and environmental factors water security benefits would also help in (groundwater recharge, agro forestry, fish improving the household livelihoods."
19,"the field culture, etc.,) the stabilised tank irrigation would surveys helped to assess villagers’ perception have more benefits, which is beyond the scope of rehabilitating tanks for enhancing water journal of rural development, vol."
19,"38, no."
19,"1, january - march : 2019"
20,"74 sumit anand, krishna reddy kakumanu and u."
20,amarasinghe security.
20,the study provides information that through kakatiya mission during 2014-15. there is substantial potential for augmenting investment on desilting of tanks at inr 50/m3 the water supply by increasing the potential and increased yields have better economic storage facilities.
20,the state governments are feasibility as per the assumptions made in the also investing on the rehabilitation of irrigation study.
20,"therefore, identifying the small tanks in tanks."
20,"for example, the state government of the catchments and making investments for telangana has initiated tank rehabilitation water security is the need of the hour."
20,"journal of rural development, vol."
20,"38, no."
20,"1, january - march : 2019"
21,"use of remote sensing and gis for identifying tanks and rehabilitation benefits to the rural areas 75 references amarnath, j.s., karthik raja, p."
21,"(2006), an economic analysis of tank rehabilitation in madurai district of tamil nadu, agricultural economics research review, 19, 187-194."
21,"anuradha, b., ambujam, n."
21,"(2012), impact of tank rehabilitation on improved efficiency of storage structures, international journal of engineering research and application, 2(4), 1941-43."
21,"arumugam, n., mohan, s., ramprasad, r."
21,"(1997), sustainable development and management of tank irrigation systems in south india, water international, 22(2), 90-97."
21,"asian development bank (adb) (2006), rehabilitation and management of tanks in india: a study of selected states, https://think-asia.org/bitstream/handle/11540/5073/rehabiliation-management-tanks. pdf?"
21,"sequence=1 (last accessed on december 17, 2017)."
21,"babu, k.l., manasi, s."
21,"(2008), estimation of ecosystem services of rejuvenated irrigation tanks: a case study in mid godavari basin, http://agris.fao.org/agris-search/search.do?"
21,"recordid=ql2012002254 (last accessed on september19, 2016)."
21,"brower, b.v., laben, c.a."
21,"(2000), process for enhancing the spatial resolution of multispectral imagery using pan-sharpening, united states eastman kodak company (rochester, new york)."
21,us patent 6011875.
21,"cwc (central water commission) (2014), godavari basin, http://www.india-wris.nrsc.gov.in/publications/ basinreports/ godavari%20basin.pdfcwc, new delhi: cwc."
21,"deivalatha, a., senthilkumaran, p., ambujam, n.k."
21,"(2014), impact of desilting of irrigation tanks on productivity of crop yield and profitability of farm income, african journal of agricultural research, 9(24), 1833-1840."
21,"dillon, p., pavelic, p., page, d., beringen, h., ward, j."
21,"(2009), managed aquifer recharge: an introduction, waterlines rep no."
21,"13, national water commission."
21,"dwivedi, r."
21,"s., ramana, k.v."
21,"(2005), remote sensing in inventorying and monitoring irrigation tanks in andhra pradesh, ed."
21,"reddy, m."
21,d (ed.)
21,"proc. of workshop on agricultural research and demonstration under tank irrigated areas of andhra pradesh, acharya n g ranga agricultural university, rajendranagar, hyderabad."
21,"falkenmark, m."
21,"(2001), the greatest water problem: the inability to link environmental security, water security and food security, international journal of water resources development, 17(4), 539-554."
21,"frazier, p.s., page, k.j."
21,"(2000), water body detection and delineation with landsat tm data, photogrammetric engineering and remote sensing, 66(12), 1461–1468."
21,"fung, t., le drew, e."
21,"(1987), application of principal component analysis to change detection, photogrammetric engineering and remote sensing,53, 1649 - 1658."
21,"gale (2006), managed aquifer recharge: lessons learned from the agrar study, http://www.sahra.arizona. edu/unesco/allepo/gale.pdf. (last accessed on december 29, 2014)."
21,"journal of rural development, vol."
21,"38, no."
21,"1, january - march : 2019"
22,"76 sumit anand, krishna reddy kakumanu and u."
22,"amarasinghe goap (government of andhra pradesh) (2012), district statistical tables, andhra pradesh: government of andhra pradesh."
22,"goi (government of india)(2014), annual report 2013-14, department of agriculture and cooperation, ministry of agriculture, government of india, http://agricoop.nic.in/annualreport2013-14/artp13-14eng. pdf, last accessed on february 5, 2015."
22,"goi (government of india) (2012), population census 2011, new delhi: government of india."
22,"grey, d. and sadoff c."
22,"(2007), sink or swim?"
22,"water security for growth and development, water policy, 9: 545–571."
22,"hadjimitsis, d.g., papadavid, g., agapiou, a., themistocleous, k., et al."
22,"(2010), atmospheric correction for satellite remotely sensed data intended for agricultural applications: impact on vegetation indices, natural hazards and earth system science, 10(1), 89–95."
22,"jackson, b.b."
22,"(1983), multivariate data analysis: an introduction, irwin, homewood, illinois, usa."
22,"jensen, j.r.,lulla, k."
22,"(1996), introductory digital image processing: a remote sensing perspective, prentice- hall inc."
22,"kääb, a., huggel, c., fisher, l., guex, s., paul, f., roer, i., et al."
22,"(2005), remote sensing of glacier-and permafrost- related hazards in high mountains: an overview, natural hazards and earth system science, 5(4), 527–554."
22,"krishnaveni, m., sankari, s., rajeswar, a."
22,"(2011), rehbailitation of irrigation tank cascade system using remote sensing gis and gps, international journal of engineeering science and technology, 3(2), 1624-1629."
22,"lillesand, t."
22,"m., kiefer r."
22,"(2000), remote sensing and image interpretation, 4th ed."
22,wiley & sons.
22,"moore, g."
22,"k., north, g."
22,"(1974), flood inundation in the southeastern united states from aircraft and satellite imaging, water resources bulletin 10 (5), 1082-1097."
22,"muchoney, d.m., haack, b.n."
22,"(1994), change detection for monitoring forest defoliation, photogrammetric engineering and remote sensing, 60, 1243 - 1251."
22,"mulla, d."
22,"(2013), twenty-five years of remote sensing in precision agriculture: key advances and remaining knowledge gaps, biosystem engineering, 114(4), 358-371."
22,"nagarajan, r."
22,"(2013), tank rehabilitation index for prioritization of lakes in semi arid regions-geospatial approach, international journal of geomatics and geosciences, 3(3), 525–537."
22,"pachauri, r., reisinger, a."
22,"(2007), ipcc fourth assessment report, ipcc, geneva."
22,"palanisami, k."
22,"(2014), economics of irrigation investment options in dryland system: south asia, iwmi internal report (not published)."
22,"palanisami, k."
22,"(2008), water resource management with special reference to tank irrigation with groundwater use, iwmi-cpwf report on strategic analysis of india’s national river linking project, http://publications.iwmi. org/pdf/h042698.pdf (last accessed on july 7, 2016)."
22,"journal of rural development, vol."
22,"38, no."
22,"1, january - march : 2019"
23,"use of remote sensing and gis for identifying tanks and rehabilitation benefits to the rural areas 77 pietroniro, a., prowse, t.d."
23,"(1996), environmental monitoring of the peace-athabasca delta using multiple satellite data sources, in: applications of remote sensing in hydrology, proceedings of the third international workshop, nhri symp.no 17, national hydrology research institute, saskatoo, canada."
23,"reddy, g."
23,"(1973), agriculture under kakatiya of warangal, journal of andhra pradesh, 1, 56-65."
23,"rodrigues, l.n., edson, e.s., tammo, s.s., denilson, p.p., et al."
23,"(2012), estimation of small reservoir storage capacities with remote sensing in the brazilian savannah region, water resources management, 26(4), 873–882."
23,"senseman, g.m., bagley, c."
23,"f., tweddale, s.a."
23,"(1995), accuracy assessment of the discrete classification of remotely-sensed digital data for landcover mapping, usacerl technical report en-95/04."
23,"shah, t., raju, k.v."
23,"(2002), rethinking rehabilitation: socio-ecology of tanks in rajasthan, north-west india, water policy, 2002, 3(6), 521–536."
23,"sindhu, j."
23,"(2010), water pricing and sustainable surface irrigation management, indian journal of science and technology, 3 (8), 932-936."
23,"vörösmarty, c."
23,"j., mcintyre, p."
23,"b., gessner, m."
23,"o., dudgeon, d., prusevich, a., green, p., and davies, p."
23,"(2010), global threats to human water security and river biodiversity, nature, 467(7315), 555-561."
23,"xu, h."
23,"(2006), modification of normalised difference water index (ndwi) to enhance open water features in remotely sensed imagery, international journal of remote sensing, 27(14), 3025–3033."
23,"tou, j.t., gonzalez, r.c."
23,"(1974), pattern recognition principles, addison-wesley, reading, ma,377."
23,"journal of rural development, vol."
23,"38, no."
23,"1, january - march : 2019"
