page,p
1,"journal of rural development, vol."
1,38 no. (1) pp.
1,"55-77 use of remote nirdpr, sensing and gis for identifying tanks and rehabilitation benefits to the rural areas hyderabad."
1,"55 use of remote sensing and gis for identifying tanks and rehabilitation benefits to the rural areas sumit anand*, krishna reddy kakumanu**and u."
1,amarasinghe*** abstract water storage is crucial for water security (ws) in countries with monsoon-driven climates.tanks significantly contribute to ws by augmenting water supply to agricultural production in parts of south and southeast asia.the present paper assesses the potential locations of small tanks for rehabilitation to enhance ws.
1,"the bhadrachalam catchment from the godavari river basin, india was selected for the study."
1,remote sensing and geographical information systems techniques were used to identify the small tanks and water spread areas for augmenting storage.
1,"the cost -benefit analysis was also carried out for the identified tanks with various scenarios, cropping pattern and management options.the returns from desiliting, increase in area under the tank command with paddy and cotton crops are found to be beneficial."
1,"it concludes that rehabilitation of small tanks should be considered a priority investment as it will not only enhance ws and financial benefits to local communities, but also augment river flows in the non-monsoon season."
1,"keywords: water security, geographical information system, remote sensing, cost- benefit analysis, godavari river basin."
1,introduction september contribute to 80 per cent of the total water storage is crucial for water security precipitation in many indian river basins.
1,many (ws) in the monsoon-driven climatic countries of the surface storages have been built since like india.
1,"the utility of storages will be more 1950’s, mainly to meet the water requirements prominent with increasingly variable rainfall of irrigation, domestic and industrial sectors and climate change (pachauri and reisinger, (shah and raju, 2002)."
1,"in india, the net irrigated 2007)."
1,"the monsoon rains between june and area is 63.6 million hectare (mha), with water * researcher, world resources institute india (wri india), new delhi, 110030, india."
1,"** associate professor, national institute of rural development and panchayati raj (nirdpr), hyderabad, 500030, india."
1,"*** senior researcher, international water management institute (iwmi), colombo, p.o."
1,"box2075, sri lanka."
1,"journal of rural development, vol."
1,"38, no."
1,"1, january - march : 2019"
2,"56 sumit anand, krishna reddy kakumanu and u."
2,amarasinghe being supplied from multiple sources: from for investments.
2,"hence, the present study uses canals (26.4 per cent), tubewells (61.7 per cent), geo-spatial techniques to identify small tanks tanks (2.5 per cent) and other sources (9.3 per that can enhance ws of the rural villages."
2,"it also cent) (goi, 2014)."
2,"although tank irrigated area analyses the present status of the water spread is low, tanks are one of the most important and area of the tank using remote sensing and gis oldest traditional water harvesting structures. technology (rs & gis)."
2,"remote sensing data are and traditional village tanks have sustained efficient and can make precise measurement for agricultural production and provided domestic delineating water bodies (kääb et al., 2005)."
2,"the water needs to millions of rural people over the water boundaries of tanks can be delineated past 2000 years (nagarajan, 2013). with satellite remote sensing techniques village tanks, some of which were (frazier et al., 2000; xu, 2006)."
2,"multi-temporal constructed by ancient kings and village satellite imageries can be used to identify communities, create buffer storage to mitigate tanks and estimate storage potential in the the impacts of floods in the monsoon months catchments."
2,"in the following sections, the and of droughts in the non-monsoon period methodology followed in identification of such (rodrigues et al., 2012)."
2,"tanks in the indian water bodies/tanks, study area details, review context are also inextricably linked to the of literature on water security and benefits of socio-cultural aspects of rural life and have tanks and rehabilitation are provided in detail. historically been an indispensable part of the literature review village habitat, sustaining its socio-ecological balance."
2,they play a major role in the livelihood water security (ws) is defined as the of people and ecosystems services.
2,"however, reliable availability of an acceptable quantity it has been noted that tank storage has and quality of water for health, livelihoods and begun to decrease to less than half over the production, coupled with an acceptable level years due to various factors."
2,"some of them of water-related risks (grey and sadoff 2007). include development of large-scale gravity ws is high in the global development agenda. irrigation systems, technology development often, population expansion, economic growth in groundwater pumping, poor community and climate change increase water-related risks participation and sedimentation."
2,"to enhance (vörösmarty et al., 2010)."
2,"ws requires attention the ws at the village level in rural areas tanks in many dimensions: for food production and need rehabilitation and restoration (babu and livelihoods, for good health of people, and for manasi, 2008). culture and environment (falkenmark, 2001)."
2,"funding agencies also require accurate w s o f te n d e p e n d s o n q u a nt i t y information of the present status of siltation, and quality of water use, return-flows and damages to link channels or tank bunds, etc., interactions with upstream and down-stream journal of rural development, vol."
2,"38, no."
2,"1, january - march : 2019"
3,use of remote sensing and gis for identifying tanks and rehabilitation benefits to the rural areas 57 users.
3,"the climate change and the rainfall are the source of small timber and domestic fuel variability also exacerbated the situation and (dwivedi and ramana, 2005)."
3,tanks also play lead to delayed cropping seasons and farmers an important role in the ecological system and finding themselves with no or less water for help maintain biodiversity. their farming activities.
3,these dry seasons have since the major irrigation system ultimately affected the yields in the agriculture has reached its maximum potential and sector.
3,"issues are further complicated with the groundwater has been over-exploited, minor resulting competition from the other sectors irrigation systems, which not only recharge of water use: drinking and sanitation, energy, groundwater but also eco-friendly, need to industries and environment."
3,there has been be developed.
3,"this calls for restoration and tremendous increase in the amount of water maintenance of the existing tanks that are in required for irrigation, drinking and industry poor condition and construction of new tanks."
3,"(dwivedi and ramana, 2005)."
3,"so then, what the study dating back to the 11th and 12th is the solution to this vexing issue?"
3,"storing centuries describe tank construction activities of water in water harvesting structures is one in warangal district in andhra pradesh (reddy, way of reducing the dependence of agriculture 1973)."
3,"in southern india, under the chola, on being solely rain-fed."
3,"interventions like pandya, pallava, chera, vakataka, kakatiya and development and rehabilitation of traditional other dynasties, a vast network of tanks and tanks, farm ponds, managed aquifer recharge canals was developed that served to irrigate (mar) structures and climate change adaptation crops and enhance agricultural production practices are essential to circumvent the ws (adb, 2006)."
3,"for assessment of the potentials of issues(dillon et al., 2009)."
3,"the mar is also used irrigation tanks, maintenance and management to address a wide range of water management of the existing tanks, information on number, issues which include storing water in aquifers spatial extent of water, storage capacity, land for future use, smoothing out supply and use/land cover in the anicuts and ayacuts, demand fluctuations as part of an integrated status of land degradation is a pre-requisite."
3,an water management for water security.
3,gale et intimate knowledge of the spectral response al. (2006) describes managed aquifer recharge pattern of water bodies is a key to detect (mar) as intentional storage and treatment of small irrigation tanks using remote sensing water in aquifers. data.
3,"remote sensing has been found to be however, the multiple uses and benefits quite effective in finding water spread tanks of tank systems is playing a significant role in the and development of agriculture in tank country."
3,"tanks are used as a source of water for command areas (dwivedi and ramana, 2005). irrigating crops and pisciculture."
3,"silt from tank the characteristic absorption feature of water beds has been used for improving fertility of bodies can be utilised for detection of water agricultural land and trees grown on tank bund bodies from multi-spectoral measurements journal of rural development, vol."
3,"38, no."
3,"1, january - march : 2019"
4,"58 sumit anand, krishna reddy kakumanu and u."
4,"amarasinghe made by lamdsat-mss/tm and spot-mla paper will bridge the gap with different (moore and north, 1974; rose and rosendahl, scenarios and identifying the tanks by rs-gis."
4,"1983; pietroniro and prowse, 1996)."
4,krishnaveni et al. (2011) identified the drainage course methodology problems in the tank cascade system using gis.
4,"the focus area of the study is a small as many tanks are found in cascade form, they catchment in the downstream of the godavari are hydro-geologically and socio-economically river basin.the godavari is the third largest river interlinked in terms of storing, conveying and basin in india, with 110 billion cubic metres utilisation of water."
4,"previously, walk-through (bm3) of total renewable water resources."
4,"the survey was conducted to identify the cascade catchment area of the basin—31,281,200 ha drainage problems.the rs-gis can now help (312,812 km2)--spreads across seven states: the irrigation departments, policymakers maharashtra, telangana, andhra pradesh, and corporate sectors in decision-making for madhya pradesh, chhattisgarh, odisha and rehabilitation of the tanks based on the satellite karnataka (cwc 2014)."
4,the basin is subject to imageries. seasonal climate with highly variable rainfall the very recent mission kakatiya regimes.
4,floods and droughts within the programme taken-up by the government of same year are a recurrent phenomenon.
4,"the telangana, india in 2014 is also recording the catchment area is reported to have many tank information by geo-tagging."
4,in addition individual tanks but few tank cascades.
4,"a to identification of tank and rehabilitation, cascade system is formed by the interlinking of there is also a need to understand the costs and tanks, where the surplus runoff of upper tanks returns that can benefit the rural community. becomes a source of water for the lower tanks."
4,"studies have shown that the rehabilitation they are managed generally by tank-based activities are benefiting the landlords and village communities (sengupta, 2013)."
4,many of landless agricultural labourers marginally as these tank systems require rehabilitation and wages.
4,the per-capita income in the rural areas restoration.
4,"this study assesses the potential of was able to increase by about 66 per cent due small tanks, with a special focus on cascading to rehabilitation (adb, 2006)."
4,"the investments tanks, for the purpose of enhancing ws in on different tank management systems reveal the bhadrachalam catchment (bc), which is that the net present worth to be positive and situated in the khammam district of telangana the bc ratio to be more than 1.5 (amarnath and state , india (figure 1)."
4,"the khammam district raja, 2006)."
4,"application of silt also increases the is bounded by krishna, east and west godavari yield, water recharge and enhanced livelihood and nalgonda districts from the east, south, options by and large (anuradha and ambujam, west and north and by the state of chhattisgarh 2012)."
4,"however, there is a gap in analysing borders towards the north."
4,the area is situated different scenarios with alternative cropping on the banks of godavari river and is about patterns and benefits to derive.
4,"the present 312 kilometres (194 miles) to the east of state journal of rural development, vol."
4,"38, no."
4,"1, january - march : 2019"
5,"use of remote sensing and gis for identifying tanks and rehabilitation benefits to the rural areas 59 capital, hyderabad."
5,"the bc encompasses section between dummugudem tail pond approximately 322,300 ha, which is about and bhadrachalam bridge."
5,the major tributary one per cent of the total area of godavari within the bc is kinnerasani river. basin (table 1).
5,"the focus area of bc is the river figure 1: bhadrachalam catchment in the godavari basin table 1: demography and land area factor units bhadrachalam khammam godavari catchment district river basin land area ha 322,300 1,602,900 31,281,200 population in 2011 1000s 1,027 2,797 70,510 rural population in 2011 1000s 723 2,141 50,860 sources: population census (goi 2012) the bc has a population of one million in for their livelihoods."
5,"overall, 17 per cent of 18 mandals in the khammam district."
5,"majority the population of the khammam district of the population (70 per cent) are rural, belong to scheduled castes (sc), and 27% and depend on agriculture-based activities belong to scheduled tribes (st), of which the journal of rural development, vol."
5,"38, no."
5,"1, january - march : 2019"
6,"60 sumit anand, krishna reddy kakumanu and u."
6,"amarasinghe bhadrachalam revenue division has the largest rice, maize, pulses, cotton and tobacco st population (51per cent), and the lowest sc are the major crops grown in the bc, of which population (12per cent) (goap 2012). rice, maize and tobacco are the major irrigated crops (table 2)."
6,"the bc depends mainly on table 2: cropped and irrigated areas in 2010-2011 sources of irrigation irrigated area (1000 ha) cropped area (1000 ha) and major crops bhadrachalam khammam bhadrachalam khammam catchment district catchment district major crops grown rice 40.3 184 69.8 218.2 jowar 0 0 1.8 2.5 maize 6.1 22.6 6.6 35.1 gram 0 0 14.4 45.0 cotton 0 15.3 22.8 148.6 groundnut 0.8 4.6 2.5 6.4 tobacco 4.1 4.5 4.1 4.5 other food 13.2 44.3 25.3 81.0 other non-food 2.1 3.8 10.5 29.0 irrigated area by different sources canals 7.6 89.3 - - tanks 18.7 58.5 - - tube wells 26.3 63.5 - - shallow wells 0.9 44.2 - - lift irri. (river) 12.5 18.8 - - others 0.7 4.6 - - total area 66.6 279.1 157.8 570.3 source: directorate of economics and statistics, andhra pradesh (goap, 2012). groundwater, tanks and direct lift from the river the tank water spread areas of pre-monsoon for its agriculture water use. rains (where tanks are almost empty), and post- monsoon rains (where tanks are almost full)."
6,"data this study mainly focuses on the status for the year 2013, pre and post-monsoon of tank in the year 2013 using geospatial tools. imageries of landsat 8 were taken."
6,the landsat it estimates the storage capacity and the 8 satellite images the entire planet earth every actual storage.
6,"to obtain such data, processing 16 days and captures approximately 400 scenes of satellite images of pre- and post-monsoon a day, which can be downloaded online (http:// seasons is required."
6,this also helps in assessing earthexplorer.usgs.gov/).
6,"the image consists journal of rural development, vol."
6,"38, no."
6,"1, january - march : 2019"
7,use of remote sensing and gis for identifying tanks and rehabilitation benefits to the rural areas 61 of six spectral bands with spatial resolution of the study area was covered by two 30m and a panchromatic band with a spatial landsat scenes per season.
7,"therefore, the resolution of 15m."
7,spatial resolution refers to images of may 1 and may 24 were used for the size of the smallest possible feature that pre-monsoon season.
7,november 9 and october can be detected from an image and spectral 31 imageries were used for the post-monsoon bands refer to the range of wavelengths that season (table 3).
7,the two scenes of pre- and an imaging system can detect (lillesand and post-monsoon were mosaiced.
7,"kiefer, 2000)."
7,"table 3: description of the rs images satellite year of spatial spectral bands data acquisition resolution (m) 01-05-2013 24-05-2013 0.450 - 0.515 µm (blue band) 0.525 - 0.600 µm (green band) 0.63 - 0.680 µm (red band) landsat 8 30/15 0.845 - 0.885 µm (nir band) 1.560 - 1.66 µm (swir band1) 2.10 - 2.30 µm (swir band2) 31-10-2013 0.500 - 0.680 µm (pan band) 09-11-2013 in order to identify links between tanks, sensory devices on board the terra satellite topo sheets (scale 1:50000) of the study area orbiting the earth. were obtained from survey of india, hyderabad."
7,"methodology digital elevation model (dem) for the study area was extracted from advanced space borne the methodology adopted for processing thermal emission and reflection radiometer the rs imageries for the identification of tanks (aster) at 30m spatial resolution, which is is illustrated in figure 2."
7,"the steps involved for a japanese sensor and is one of five remote the analysis are as follows: journal of rural development, vol."
7,"38, no."
7,"1, january - march : 2019"
8,"62 sumit anand, krishna reddy kakumanu and u."
8,amarasinghe figure 2: methodology for identification of tanks and quantification image pre-processing : the effects of the the landsat 8 images were pan-sharpened atmosphere are part of the signal received by by the merging of high-resolution panchromatic the sensing device.
8,"it is, therefore, important with lower resolution multispectral bands, to to remove the atmospheric effects from the create a single high-resolution colour image rs images."
8,"the dark object subtraction (dos) (brower and laben, 2000). method was used to remove the haze from the image processing: image processing and top of satellite images (hadjimitsis et al., 2010). analysis techniques have been developed to the dos searches for the darkest pixel value interpret remotely sensed images and to extract and assumes that the dark objects reflect no as much information as possible from the light."
8,any value greater than zero must result images.
8,"the image processing techniques assist from atmospheric scattering.the scattering was the analyst in the qualitative interpretation, i.e., removed by subtracting this value from every visual interpretation as well as the quantitative pixel in the band. interpretation of images, i.e., image classification."
8,"journal of rural development, vol."
8,"38, no."
8,"1, january - march : 2019"
9,use of remote sensing and gis for identifying tanks and rehabilitation benefits to the rural areas 63 i.
9,area delineation tank water classification.
9,this method uses a maximum-likelihood decision rule to calculate extraction of the extent of the water class means that are evenly distributed in the body by using remote sensing is an important data space and then iteratively clusters the step in the methodology.
9,"there are various methods for the extraction of water information remaining pixels, using minimum distance from remote sensing imagery."
9,in this study techniques.
9,"each iteration recalculates means area, mndwi (modified normalised difference and reclassifies pixels with respect to the water index) enhanced the open water features new means."
9,this process continues until the (tanks) efficiently.
9,a threshold was determined number of pixels in each class changes by less from bands to discriminate water from land.
9,"it than a selected pixel change threshold or until has been analysed that the mndwi enhanced a specified maximum number of iterations is tanks, by suitably suppressing the noise from reached. land."
9,"in simple terms, unsuper vised ii."
9,image classification classification groups the pixels of the image into separate clusters depending on their classific ation is used to assign spectral features.
9,each cluster will then be corresponding classes with respect to groups assigned a land cover type.
9,unsupervised with homogenous characteristics.
9,the aim classification (using isodata algorithm) is an here is to discriminate multiple pixels within effective method for extracting land cover the image.
9,the first method was subjected information from the remotely sensed data.
9,the to a principal component analysis (pca) and isodata classifier provided a relatively quick then applying clustering to the first principal and easy way to delineate landform elements component to classify and enhance the tank and broadly seven major classes were identified. area.
9,"in the second method, original remotely sensed satellite images were classified using (b) pca based classification: unsupervised isodata algorithm."
9,and these the pca is an approach that transforms two methods were used to validate and to the remotely sensed data into a new set quantify the tank area dynamics and to estimate of uncorrelated variables that capture the tank area losses as well.
9,further two approaches essential information of the rs data.
9,"the pca were also analysed to choose the best method. is essentially a mathematical technique for (a) unsupervised classificationఛ: reducing the dimensionality of a data set (jackson, 1983)."
9,"in remote sensing (rs), it aims one of the most widely used to reduce the number of bands to reorganise unsupervised clustering algorithms is the isodata (iterative self-organising data the information."
9,"pca can be used as a change analysis) technique (tou and gonzalez, 1974). detection technique in remote sensing (jensen, the isodata procedure has also been used for 1996; fung and ledrew, 1987; muchoney journal of rural development, vol."
9,"38, no."
9,"1, january - march : 2019"
10,"64 sumit anand, krishna reddy kakumanu and u."
10,"amarasinghe and haack, 1994)."
10,"pca is typically used to and google earth were overlaid on classified identify factors that describe spectral variance, satellite images (figure 3)."
10,aster (30m) dem to reveal the underlying dimensionality of was used to generate stream network and the multivariate data and to compress image data toposheets were geo-referenced.
10,"these layers and concentrates almost all the information in were overlaid on google earth to identify the the first two or three components (mulla, 2013). links between tanks."
10,the first principal component was classified the images were classified into different using isodata algorithm to generate seven land use and land cover classes.
10,this helps in major land cover classes. identification of possible water bodies in the 3.3 tanks interlinking study area.
10,"to identify the links between tanks - the stream network thematic layer, toposheet layer figure 3: methodology for identification of linkages journal of rural development, vol."
10,"38, no."
10,"1, january - march : 2019"
11,use of remote sensing and gis for identifying tanks and rehabilitation benefits to the rural areas 65 results classification shows that overall accuracy is 86 accuracy assessment: accuracy assessment per cent and 92 per cent and kappa coefficient was performed on classified images for is 0.78 and 0.86 for pre-monsoon and post- validation.
11,"the overall user’s accuracy (ua), monsoon, respectively."
11,"from the assessment producer’s accuracy (pa) and kappa statistic of unsupervised classification, overall accuracy is 88% and 96% and kappa coefficient is 0.73 were calculated on a classified image to and 0.86 for pre-monsoon and post-monsoon evaluate the classification accuracy (jensen et respectively. al., 1996)."
11,"the pa is a measure of commission error indicating how well the training set the satellite imageries are classified pixels of the given land cover type have been into agriculture, forest and water bodies."
11,"the classified, and the ua is the omission error area under agriculture, forest and water bodies indicating the probability that a pixel classified in the bc are 48.7per cent, 44.5 per cent and on a map actually exists on the ground."
11,"the 3.8 per cent, respectively."
11,"figure 4 shows the kappa is a measure of agreement between the water spread area of tanks in the bc in pre- model’s predictions and reality (senseman et monsoon and post-monsoon seasons.there are al., 1995). approximately 13 major tanks in the bc within an area greater than 40 ha and approximately it has been observed in this analysis 370 small tanks within an area between 1 ha to that both methods provided almost the same 40 ha."
11,"the major tanks in the bc are tummala, result with more or less the same variations."
11,"sambai gudem, chandralagudem, morampalle, the accuracy assessment of pca-based etc."
11,"journal of rural development, vol."
11,"38, no."
11,"1, january - march : 2019"
12,"66 sumit anand, krishna reddy kakumanu and u."
12,amarasinghe may 2013(pre-monsoon) oct/nov 2013(post-monsoon) figure 4: processed images before and after monsoon selected cascade and individual tanks: the individual tanks (figure 5) were selected and cascades tanks systems are very limited in the links between tanks were identified for further bc.
12,"therefore, two cascade systems and three analysis: journal of rural development, vol."
12,"38, no."
12,"1, january - march : 2019"
13,use of remote sensing and gis for identifying tanks and rehabilitation benefits to the rural areas 67 figure 5: potential locations for tank rehabilitation (1.
13,"pagidaru village cascade, 2."
