page,p
1,"article mapping of potential fuel regions using uncrewed aerial vehicles for wildfire prevention maria eduarda andrada 1,2, *,† , david russell 2,† , tito arevalo-ramirez 3 , winnie kuang 2 , george kantor 2 and francisco yandun 2 1 institute of systems and robotics, university of coimbra, 3030-290 coimbra, portugal 2 robotics institute, carnegie mellon university, pittsburgh, pa 15213, usa; davidrus@andrew.cmu.edu (d.r.); wkuang@andrew.cmu.edu (w.k.); gkantor@andrew.cmu.edu (g.k.); fyandun@andrew.cmu.edu (f.y.)"
1,"3 department of mechanical and metallurgical engineering, department of electrical engineering, pontificia universidad católica de chile, santiago 8331150, chile; tito.arevalo@uc.cl * correspondence: duda.andrada@isr.uc.pt † these authors contributed equally to this work."
1,"abstract: this paper presents a comprehensive forest mapping system using a customized drone payload equipped with light detection and ranging (lidar), cameras, a global navigation satellite system (gnss), and inertial measurement unit (imu) sensors."
1,the goal is to develop an efficient so- lution for collecting accurate forest data in dynamic environments and to highlight potential wildfire regions of interest to support precise forest management and conservation on the ground.
1,"our paper provides a detailed description of the hardware and software components of the system, covering sensor synchronization, data acquisition, and processing."
1,"the overall system implements simultane- ous localization and mapping (slam) techniques, particularly fast lidar inertial odometry with scan context (fastlio-sc), and lidar inertial odometry smoothing and mapping (liosam), for accurate odometry estimation and map generation."
1,"we also integrate a fuel mapping representation based on one of the models, used by the united states secretary of agriculture (usda) to classify fire behavior, into the system using semantic segmentation, lidar camera registration, and odometry as inputs."
1,real-time representation of fuel properties is achieved through a lightweight map data structure at 4 hz.
1,"the research results demonstrate the effectiveness and reliability of the proposed citation: andrada, m.e."
1,"; russell, d.; system and show that it can provide accurate forest data collection, accurate pose estimation, and arevalo-ramirez, t."
1,"; kuang, w.; comprehensive fuel mapping with precision values for the main segmented classes above 85%."
1,"qual- kantor, g."
1,"; yandun, f."
1,mapping of potential fuel regions using itative evaluations suggest the system’s capabilities and highlight its potential to improve forest uncrewed aerial vehicles for management and conservation efforts.
1,"in summary, this study presents a versatile forest mapping wildfire prevention."
1,"forests 2023, 14, system that provides accurate forest data for effective management."
1,1601. https://doi.org/10.3390/ f14081601 keywords: semantic mapping; simultaneous localization and mapping (slam); lidar; forest inventory; autonomous drones; forest monitoring; remote sensing; flammable material detection; academic editor: chong xu vegetation classification received: 16 june 2023 revised: 19 july 2023 accepted: 3 august 2023 published: 8 august 2023 1.
1,"introduction the number of uncontrolled wildfires around the globe is increasing due to a rise in global temperature and extreme weather brought on by climate changes in recent copyright: © 2023 by the authors. years [1,2]."
1,"longer periods of high temperatures lead to drier seasons and the accumulation licensee mdpi, basel, switzerland. of combustible material in the forests."
1,these conditions yield an increase in uncontrolled this article is an open access article and harmful wildfires which can be worsened by strong winds or thunderstorms.
1,"without distributed under the terms and active and stringent measures to monitor and manage forest regions, it can be difficult to conditions of the creative commons prevent and contain uncontrolled wildfires and the resulting irreversible damage."
1,"this is attribution (cc by) license (https:// an especially challenging undertaking due to the vast size of typical forests, the danger creativecommons.org/licenses/by/ posed, and the demand for highly intensive labor to fight fires or execute preventive 4.0/). maintenance actions."
1,"forests 2023, 14, 1601. https://doi.org/10.3390/f14081601 https://www.mdpi.com/journal/forests"
2,"forests 2023, 14, 1601 2 of 20 information collected using remote sensing methods (e.g., satellites or aircraft) can accurately monitor forestry environments while reducing labor and operational costs [3,4]."
2,"in particular, uncrewed aerial vehicles (uavs) have gained attention in forestry research and operations (among other industrial applications) since they are easily deployable, provide a time-flexible operation, and can produce excellent spatial resolution measurements with different sensing modalities (e.g., visual, thermal, spectral or laser range) [5]."
2,"uavs have garnered interest as a promising remote sensing modality due to their accessibility, rapid maneuverability, operational range, low operational costs, and ability to provide high- resolution data."
2,"environmental reconstruction of sensor data collected from uavs can help create higher fidelity virtual copies of the environment (digital twins), holding the information that may be beneficial for inventorying and mapping purposes."
2,uavs are also especially suitable for assisting humans when working in large dangerous areas where access is limited.
2,"these characteristics have made researchers put significant effort towards using uav-based solutions to aid in fire fighting tasks [6,7], scout of fire detection [5,8] or fire behavior analysis and prediction [9]."
2,"a promising approach is to mitigate wildfires by reducing the accumulation of highly combustible biomass ranging from smaller biomass, such as dried pine needles, grasses, and small twigs, to larger wood pieces."
2,"robotic forestry maintenance can play a key role in prevention tasks, especially when teaming aerial and ground vehicles."
2,"recently, researchers have proposed and investigated a collaborative system in which a uav will be used to survey the environment to generate a multi-layer map."
2,this map comprises information including traversability and areas with an accumulation of combustible material.
2,an uncrewed ground vehicle (ugv) will receive this information and remove the highly combustible material from the forest [10].
2,the integration of fuel mapping plays a vital role in ensuring the quality of forest management and the conservation of local flora and fauna.
2,"by accurately identifying and categorizing flammable materials based on the united states department of agri- culture (usda)’s fire behavior fuel model [11] (the anderson model), we can improve the precision of heavy-duty machines used for mulching and minimize the risk of false positives [12]."
2,"this comprehensive approach, encompassing geometry, semantics, and temporal information, allows us to create a global map that captures the different fuel models of grasslands, shrublands, timber, and slash areas."
2,"with this valuable knowledge, we can implement targeted strategies and conservation to protect our forests and promote sustainable practices."
2,"this study seeks to expand on previous works [13,14] by developing a perception system for uavs in wildfire prevention efforts."
2,"to enable the implementation of such a system, we have designed a custom payload that contains different sensing modalities and a framework that includes simultaneous localization and mapping (slam), semantic segmentation, and fuel mapping."
2,"in our work, we have extensively tested our system on two study sites and validated our slam implementations and semantic mapping with qualitative and quantitative results."
2,"related work developments in remote sensing technology allow conditions and changes over large geographic areas to be monitored and analyzed, at a given time or period."
2,remote sensing has been useful for forest wildfire applications and has been extensively studied.
2,"previous efforts have successfully applied remote sensing, in the form of satellite imagery, in all stages of forest fire efforts, such as mapping efforts for fuel type [15–17], burned area [18,19], vegetation recovery [20], assessments of fire risk [21,22] and fire/burn severity [23,24], and detection of fires [25,26]."
2,"in the agricultural domain, uavs have been used to map diseases [27,28], and im- plement precision agriculture tasks [29]."
2,"when applied in the forestry domain, uavs are especially appealing since they allow regular, frequent, and on-demand data acquisition, can host a diverse range of sensors according to the application, and can be used in real-time"
3,"forests 2023, 14, 1601 3 of 20 operations [30]."
3,"since forest environments are dynamic environments, data acquisition must be accurate and up-to-date."
3,"uavs provide a significant advantage over traditional remote sensing techniques such as satellite imagery, notably in this area."
3,works in applying uavs for forestry applications have gained traction over the years.
3,"one author hyyppä et al. [31] explored the use of uavs and a slam system to collect information using a light detection and ranging (lidar) sensor, including stems of individual trees, stem curves, and the diameters at breast height (dbh)."
3,another author corte et al. [32] employed machine learning techniques to design accurate predictive models from the lidar data collected using the uav to conduct forest inventories.
3,"previous works have also used low-altitude aerial images and lidar data to construct a local scale model of the forest canopy surface, with information about the elevation of vegetation, through photogrammetry and structure from motion approaches [33]."
3,"researchers have also examined using uavs to monitor fire and its effects [34,35], identify spatial gaps [36], and assess soil disturbances [37]."
3,"due to the large scale of forest environments, past research which used uav data for forest inventory applications opted for using uav data on small areas [31,33,38,39]."
3,results from these works have demonstrated the promising potential of using uavs to map and estimate forest resources.
3,"further, [40] have investigated integrating partial- coverage uav data with field plots to estimate forest resource parameters (i.e., volume, biomass, etc.) as a means to address the issue of mapping large-scale environments."
3,fusing semantic information is especially important for forest fire mitigation efforts as it allows a 3d representation containing classification information such as the location of flammable vegetation and other classes for a globally-registered map of the forest environment.
3,"while semantic mapping has gained traction over the recent years and has been applied in areas such as autonomous driving [41,42] or assistive robotics [43,44], implementing semantic mapping directly into the forest domain is still a work in progress, to the best of our knowledge."
3,"past research in this area has investigated using high-resolution rgb images acquired by uavs to classify shrubs [45], and tree species [46] in a heterogeneous forest environment."
3,"more recently, researchers have used classification approaches to target the forest wildfire issue."
3,automating survey methods that involve deploying autonomous robotic systems to navigate in the field requires the robots to have a robust simultaneous localization and mapping (slam) system to estimate their state in 3d space.
3,"over the years, slam research has matured with the development of different systems based on various combinations of sensor modalities [47]."
3,lidar odometry and mapping (loam) [48] is a state-of- the-art loosely-coupled lidar and inertial-based slam algorithm.
3,"in tightly-coupled sensor fusion frameworks, sensor data from different modalities are jointly processed and combined at a lower level, usually through a filtering or optimization framework, to estimate the robot’s pose and update the map."
3,"however, tightly-coupled frameworks require more complex algorithms and computational resources to achieve joint estimation and optimization."
3,the lidar odometry via smoothing and mapping (lio-sam) [49] is a tightly-coupled lidar and inertial-based slam algorithm which expands on the loam framework by including loop closure methods and feedback from absolute measurements such as the global positioning system (gnss) and compass heading.
3,"works have also looked into fusing lidar, visual, and inertial modalities, such as [50] which featured visual- inertial odometry (vio) system and a lidar odometry (lo) system."
3,the vio subsystem is tightly-coupled and serves as a motion model for the lidar mapping which dewarps lidar points and registers the scans to the global map.
3,"various works have implemented slam systems, primarily lidar and inertial-based, in the forest environment, for tree detection and tree trunk estimation [51], and 3d forestry inventory mapping [52,53]."
3,materials and methods the design and development of the complete system included customized hardware and software components.
3,the hardware includes a payload designed to allow easy
4,"forests 2023, 14, 1601 4 of 20 mounting on diverse types of drones."
4,"it also contains different types of sensors that provide spectral, visual, and range information."
4,"the software stack includes synchronization of the sensor data acquisition, data logging, and processing."
4,details of the individual components are discussed in the following sections.
4,"sensing payload we designed and deployed a sensing payload with different types of components that include an inertial measurement unit imu (vn-200 rugged gnss/ins), a three- dimensional light detection and ranging scanner (lidar) with 32 channels (velodyne vlp-32), a 20.2 megapixel stereo camera with 8.5 mm focal length lenses (allied vision alvium 1800u-2040c), a multispectral camera (mapir survey3w, red+green+near-infrared channels), and two onboard computers (nvidia jetson xavier development kit and the intel core i7 nuc)."
4,"given the highly unstructured, dynamic, and changing forest environment, this sensing payload was designed to have robust sensing capabilities and is lightweight while also taking into account future research work."
4,"due to the lack of perception work in forestry, the sensors chosen allow for future work and ablation studies regarding the best sensory combination for important decision-making modules such as semantic mapping, navigation, and slam."
4,"the lidar, stereo cameras, and imu are chosen to have different sensing modalities on board with different fields of view and spectral characteristics."
4,this helps to account for conditions that may render either of the sensors susceptible to poor performance.
4,"for instance, the stereo cameras have a horizontal and vertical field of view of 60.4◦ and 44.9◦ , respectively."
4,"the lidar has a horizontal and vertical field of view of 360◦ and 40◦ , respectively."
4,we also opted for two onboard computers to divide the computing load for recording and processing the data.
4,"the xavier board is intended to run machine learning models, while the nuc computer handles all the heavy cpu calculations (e.g., slam processing)."
4,figure 1 shows a 3d rendering of the payload and the mounting of its different components.
4,nvidia jetson xavier development kit power distribution board time synchronization board power supply converter multispectral camera intel core i7 nuc ethernet switch rgb cameras imu lidar figure 1.
4,sensing payload.
4,the sensing payload was designed for easy mounting on any aerial platform and can be tilted at different viewpoints ranging from horizon to nadir.
4,"furthermore, the components are mounted in a modular way, allowing easy integration and removal of each one, if necessary, for operational constraints (e.g., limited weight capacity)."
4,"in order to minimize weight, the sensing payload is configured to be powered using the uav’s batteries."
4,"hence, a power distribution board was used to distribute the appropriate voltages to each component."
4,table 1 shows all the sensors in the payload and their operational frequency.
4,"the total weight of the payload is 3.832 kg, without factoring in the weight of the landing gears and the mounting plate."
4,"altogether, the electrical and mechanical"
5,"forests 2023, 14, 1601 5 of 20 properties of the payload allowed for an operation of 18–20 min when mounted on a dji matrice 600 (using six tb47s batteries, each with 4500 mah) and 30–35 min when mounted on an alta x (using two 16,000 mah batteries)."
5,table 1.
5,sensors and operation frequency.
5,frequency voltage sensor name sensor type (hz) (v) vn-200 rugged gnss/ins imu 400 3.2–5.5 velodyne vlp-32c lidar 10 10.5–18.0 allied vision alvium 1800 u-2040c rgb camera 10 5.0 mapir survey 3 multispectral camera 15 5.0 3.2.
5,"simultaneous localization and mapping we used the lidar, imu, and global navigation satellite system (gnss) measure- ments to estimate the uav’s 6 degrees of freedom pose (odometry) during the flight."
5,"thus, the estimated state of the robot is represented as a 6-dimensional vector corresponding to the drone’s position and its orientation in space."
5,we employed the estimated odometry to incrementally build a three-dimensional (3d) environment map in the form of a point cloud.
5,accurate pose estimation is crucial for a global map such as fuel mapping implemented in section 3.3.
5,"in this work, we used fast lidar inertial odometry with scan context, fastlio- sc, [54,55] and lidar inertial odometry smoothing and mapping, liosam, [49], which are two state of the art slam implementations that fuse the sensors measurements using a tightly coupled approach."
5,we decided to focus on lidar inertial-based slam systems be- cause cameras are greatly affected by lighting conditions and motion blur.
5,results from [14] have also reported that the visual odometry had higher rmse compared with the lidar odometry.
5,liosam performs state smoothing and mapping scan matching using a factor graph that introduces relative and absolute measurements as factors [49].
5,"relative measure- ments, such as imu and lidar data, are fused to optimize the calculation of the odometry, further improved by gnss absolute positioning (when available)."
5,"in particular, the imu information allows liosam to estimate an initial guess of the lidar’s position, velocity, and orientation by a preintegration stage, which integrates imu measurements over the lidar scan rate."
5,liosam uses this lidar pose initial guess for de-skewing lidar point clouds and computing the optimized odometry.
5,odometry prior optimization is obtained by performing a local scan matching between consecutive lidar scans using corner and surface features.
5,the gnss measurements are included in the lidar optimization stage for enhancing pose estimation.
5,"finally, the optimized pose is used as feedback to the preintegration stage for determining the imu bias (providing the tight coupling)."
5,"conversely, fastlio-sc fuses lidar and imu measurements by a tightly-couple- iterated extended kalman filter, which enables robust navigation in fast motion, noisy or occluded environments [54]."
5,"specifically, the iterated extended kalman filter is imple- mented using the iterated kalman filters on manifold’s toolkit, based on the premise that the robotic system evolves on a so(3) manifold [56]."
5,"thus, fastlio-sc proposes a new formula to compute the kalman gain that depends on the system state instead of the dimension of the measurement."
5,"in this context, the iterative extended kalman filter uses lidar and imu measurements as input for estimating lidar odometry."
5,"next, the lidar odometry is improved by gnss measurements and movement restriction imposed by a scan context approach [55]."
5,this information is fused using a factor graph strategy which outputs an optimized lidar odometry.
5,"in contrast to liosam, the optimized lidar odometry is not used as feedback for estimating imu bias."
5,a visual representation of the architecture of these two approaches is depicted in figure 2.
5,time synchronization among the sensors and computers is a critical issue and signifi- cantly impacts the quality of the slam system.
5,"we designed a custom time synchronization board featuring a teensy microcontroller that synchronized the computers, the lidar, the"
6,"forests 2023, 14, 1601 6 of 20 imu, and the cameras by generating pps signals that simulate the ones obtained from a gnss."
6,"these signals comprise squared signals used to trigger the cameras, lidar, and are encoded using the national marine electronics association (nmea) strings protocol for serial communication."
6,having the microcontroller mimic gnss signals is desirable in this application since forest environments can contain certain areas which would cause unreliable gnss readings (and thus its pps signals).
6,figure 2.
6,general scheme of the implemented localization and mapping approaches.
6,note that liosam and fastlio-sc outputs are odometry and a 3d map in the form of a point cloud.
6,3.2.1.
6,photogrammetry photogrammetry is a technique in computer vision used to estimate the structure of a scene from a collection of images with optional gnss information.
6,"most modern approaches do not require any prior sensor calibration, which makes the tools robust and easy to deploy."
6,"over the last decade, both industry and academia have developed easy-to- use software which enables wide-scale adoption of this technology to perform surveys in diverse domains such as agriculture, construction, or forestry."
6,"an important characteristic of photogrammetry is that it is solely an offline process, which requires all the images to be available before computation begins."
6,we use photogrammetry as a benchmark to evaluate the performance of the online methods we developed in this work.
6,"in this work, we used agisoft metashape [57] 2.0.2, a common commercial structure from motion software."
6,we downsampled our images temporally so that they were at least a half second apart because they would be highly redundant otherwise.
6,"for our collection in the most representative site (see section 4.1), this resulted in 886 images."
6,each image was tagged with the rtk gnss position which most closely matched the image timestamp.
6,"for the initial step of estimating the camera parameters and computing the sparse geometry, we use the parameters which were optimized for forestry as found by [58]."
6,then we performed meshing using the “high” quality and “high” face count settings.
6,"the pose estimation took 10 min and the meshing process took 32 min on a cloud server with a cpu amd epyc-milan processor, 60 gb ram, and a grid a100x-20c gpu."
6,"fuel mapping in this work, fuel mapping involves three tightly coupled modules: semantic seg- mentation, lidar camera registration and odometry, and global map representation."
6,"to achieve accurate semantic segmentation, we employ the segnext network, a transformer architecture was specifically chosen for its state-of-the-art performance on popular bench- mark datasets and excellent generalization capabilities, which is particularly beneficial given our limited real-world training images [59]."
6,this network identifies the predicted
7,"forests 2023, 14, 1601 7 of 20 class for each pixel in the image, providing a semantically labeled image for three com- pressed classes, fuel, canopies, and background."
7,we trained this neural network (nn) with pre-trained weights from the cityscapes dataset [60] and 40 rgb images collected in our deployments.
7,"while 40 images were used for training, the actual number of instances is higher, since a class can appear multiple times in a single image."
7,the rgb images have a higher resolution than our multispectral and it allows for pre-weight transfer learning from other datasets.
7,"while there is current research on using grn (green, red, near infrared) images with pre-weights from rgb datasets, due to the the lack of state-of-the-art research and the scope of this paper, we decided to use rgb images instead."
7,"as mentioned in section 1, we used the anderson fuel model [11], which is comprised of 15 classes as included in table 2 to train our semantic segmentation model, which is publicly available (all models are available at https://github.com/kantor-lab/safeforest_ cmu_data_dvc/tree/public_models (accessed on 15 june 2023))."
7,"however, the classes were aggregated into three compressed classes at the post-processing steps given we did not observe all of them in the testing sites and fine-grained training has shown to improve convolutional neural network’s performance [61]."
7,"additionally, aggregated classes allowed simplifying the validation mapping labeling for the qualitative comparison."
7,"we chose these three classes based on easier visual inspection for fuel regions, as the site’s bare earth paths and a cluster of canopies allow for clearer boundaries between the chosen classes."
7,"moreover, the other non-forest related classes were aggregated as background as it falls outside the scope of our current proposed system."
7,table 2.
7,classes used in semantic segmentation.
7,these are inspired by relevant classes from the anderson fuel model [11] and also include additional classes relevant to our application.
