page,p
7,"fine-grained class coarse-grained classes dry grass fuel green grass fuel dry shrubs fuel wood pieces fuel litterfall fuel timber litter fuel green shrubs canopy canopy canopy live trunks canopy bare earth background people background sky background blurry background drone background obstacle background subsequently, to transform the semantic image into a global map, we integrated lidar and camera data."
7,this step is essential to ensure that the map projection of the semantic classes is accurate for the ground robot to mulch all potential flammable materials as our main goal is to prevent harmful wildfires.
7,"through lidar camera registration and odometry, we determined which lidar points correspond to the camera’s field of view, enabling the registration of image pixels into the global coordinate system."
7,"by leveraging the extrinsic of the lidar relative to the camera, we transform lidar measurements into the camera’s coordinate frame."
7,"using the calibrated camera intrinsic parameters, we project each lidar point onto the image plane."
7,points falling within the camera’s field of view are assigned classification labels from the corresponding pixels in the semantic model.
7,the resulting semantically-textured point cloud is then transformed into the inertial reference frame using the drone’s current pose estimated by our slam system.
7,"this integration of lidar, camera, and slam data allows us to create a comprehensive global representation that captures the fuel characteristics in the environment."
8,"forests 2023, 14, 1601 8 of 20 to ensure the efficient creation of a large-scale global map in real-time, it is necessary to utilize lightweight map data structures that can handle the voluminous information generated."
8,"various methods such as octree [62], truncated signed distance function (tsdf) [63], and openvdb [64] were considered for our research."
8,"after a careful cost- benefit analysis considering factors such as map resolution, semantic information, and computational efficiency, we identified two methods as the most suitable for our scenario: semantic octomap [65,66] and unknown free occupied map (ufomap) [67]."
8,"among them, ufomap emerged as the preferred choice due to its significant speed advantage over octomap, being 26 times faster and reducing memory consumption by 38% [67]."
8,"both methods use the octree data structure, which offers a significant reduction in mem- ory requirements compared to point clouds while maintaining high map quality."
8,"they convert the point cloud into voxels with a resolution of 0.1 m, while preserving valuable information about the predicted classifications."
8,the global octree is continuously updated by incorporating newly generated semantic point clouds.
8,"by leveraging the lightweight octree map data structure from ufomap, we can create a comprehensive semantic global representation of the environment in real time."
8,"results in order to evaluate our localization and mapping methods, we conducted two data collection campaigns in semi-urban and rural sites (figure 3)."
8,"the semi-urban site is located in coimbra, portugal (40◦ 110 05.900 n 8◦ 240 50.500 w)."
8,"the rural site is located in pittsburgh, united states (40◦ 270 24.600 n 79◦ 470 22.100 w)."
8,we choose these two locations in order to test the quality of the generated maps in scenarios with relatively low and high complexities see figure 3.
8,"as the coimbra test site is a semi-urban environment, it contains more structured- like landscapes making it a low-complexity scenario for our application."
8,"in contrast, the rural test site is unstructured and wild, posing a more challenging condition for the feature extraction and subsequent scan matching of the employed slam approaches."
8,the flight plan of the surveys performed at the coimbra test site was controlled by an experienced uav pilot.
8,"on the other hand, for the rural test site, which covers a larger area, we decided to use the uav’s autopilot."
8,"for each survey the altitude, ground speed, and lateral distance were about 30 m, 3.0 ms−1 , and 20 m, respectively."
8,figure 3.
8,"the study sites are located in coimbra, portugal, and pittsburgh, united states."
8,the magenta line depicts the path followed by the uav.
8,it is important to highlight that the uav was operated remotely by a human expert during the aerial surveys conducted at the coimbra study site.
8,"in contrast, for the pittsburgh study site, the uav flights were carried out using the uav autopilot system."
8,"simultaneous localization and mapping (slam) in order to evaluate the quality and suitability of the slam approaches for mapping forest regions, we separated the localization and mapping results."
8,the system localization
9,"forests 2023, 14, 1601 9 of 20 was evaluated by comparing the pose estimations given by liosam and fastlio-sc with position measurements from a centimeter-level accuracy real-time kinematics (rtk) device."
9,the main metric employed in this case is the root mean squared error (rmse) calculated over a complete trajectory.
9,"in all the surveys, it was found that liosam outputs lower rmse than fastlio-sc, as table 3 shows."
9,"regarding translational rmses, liosam outperforms fastlio-sc, showing errors between 0.28 m to 1.92 m."
9,a lower rmse indicates that the implemented algorithm can estimate the vehicle’s odometry closer to the current trajectory.
9,"consequently, the drift between the vehicle’s current position and the estimated position by liosam is lower than that achieved by fastlio-sc."
9,"specifically, from figure 4 one can observe that liosam produces optimized odometry that closely aligns with the gnss measurements."
9,"conversely, fastlio-sc’s odometry significantly differs from the actual ground truth measurements at the beginning of each survey."
9,"this initial deviation is attributed to the heading initialization utilized by fastlio-sc, which differs from the true yaw orientation of the platform."
9,"as a result, the rmse of fastlio-sc increases, leading to comparatively lower performance when compared to liosam, as shown in table 3."
9,table 3.
9,quantitative odometry results of liosam and fastlio-sc approaches on forested regions.
9,bold values denote the lowest rmse.
9,the last row shows the average rmse as a percentage of the flight distance for each survey.
9,study sites coimbra pittsburgh survey 1 survey 2 survey 1 survey 2 survey 3 flight 175.2 424.4 1535.5 2421.1 1188.6 distance m liosam fastlio-sc liosam fastlio-sc liosam fastlio-sc liosam fastlio-sc liosam fastlio-sc xm 0.26 1.79 0.67 42.51 1.33 2.67 0.73 0.750 0.72 1.80 ym 0.24 3.49 0.90 27.50 0.79 5.39 1.51 5.70 0.40 6.02 zm 0.33 4.13 0.63 7.88 1.60 4.64 3.53 3.00 1.91 5.88 average m 0.28 3.14 0.73 25.96 1.24 4.23 1.92 3.15 1.01 4.57 % 0.16 1.79 0.30 10.70 0.08 0.28 0.08 0.13 0.08 0.38 (a) (b) figure 4.
9,qualitative odometry results of liosam and fastlio−sc approaches.
9,"to avoid figure over−stacking, two representative cases of the study sites are shown. (a,b) shows the odometry of survey 2 for the semi-urban area and survey 2 for the rural area, respectively."
9,"the black solid line represents the rtk measurements, the cyan dotted line is the liosam odometry, and the magenta dashed line depicts the fastlio−sc odometry."
9,yellow arrows depict the odometry direction estimated by fastlio−sc.
10,"forests 2023, 14, 1601 10 of 20 based on the before mentioned, noting that previous works have reported that in forested regions, one could anticipate rmse values ranging from 0.32 m to 2.90 m [68], and considering that the rmses yield by lisoam in both study sites account for less than the 0.3% of the overall trajectory, we decided to assess the liosam’s mapping outcomes further."
10,"specifically, liosam was tested using data collected from study site 2, a rural environment that closely resembles a forested area due to its predominant composition of low and high vegetation."
10,"at this point, we employed the mesh generated by the agisoft photogrammetry software as the baseline, as mentioned in section 3.2.1."
10,"in order to have a strong indication of the quality of the generated map regarding its morphological, visual, and geometry aspects, two approaches were used: (i) using a cloud-to-cloud comparison with the photogrammetry output and (ii) measuring geometric variables (i.e., distances and areas) in different maps."
10,the cloud-to-cloud evaluation is mainly quantitative and consisted in first converting the mesh into a point cloud (i.e. reference cloud ).
10,"subsequently, the point cloud generated with liosam was translated and rotated so both of them were spatially aligned."
10,"finally, we measured the geometric difference between them using a nearest neighbor criteria similar to the hausdorff metric [69]."
10,"the key difference is that to improve accuracy, a local model around the closest point in the reference cloud is computed to approximate its surface and thus have a more accurate estimation of the distance."
10,this calculation was done using the cloud compare software [70].
10,"figure 5 shows the reference cloud (top left), and the raw slam cloud in two formats: colorized according to its height (top right) and colorized according to its distance to the reference (bottom)."
10,"in general, it can be seen that various parts of the generated map are similar to the reference under this metric (blue-colored points), but the distance increases on some of the treetops."
10,"furthermore, the boxplot shows a median of 1.51 m, with outliers for errors above 5.54 m."
10,these outcomes indicate that height in the maps is one of the main uncertain variables to measure in these maps.
10,this outcome is somehow expected since the treetops in the liosam point cloud are less dense and more noisy.
10,"also, the height estimation derived from photogrammetry can be subject to large errors, which makes vertical distances in higher structures (like trees) more uncertain [71]."
10,"for this reason, we consider this evaluation qualitative."
10,an important thing to note in figure 5 is the size of the maps.
10,"since the baseline uses only the left camera images, the map is limited by their field of view."
10,"in contrast, the slam map spans a larger region since the lidar has a range of up to 200 m (in this work we limited the lidar range to 100 m) with a wider field of view."
10,"given that the previous evaluation is mostly qualitative, the second evaluation of the maps consisted of measuring two main geometric variables: the area of characteristic regions and the length between two landmarks."
10,"since the photogrammetry map is prone to errors given by the feature matching and geolocalization (see section 3.2.1), we considered measure- ments taken in google earth software [72] as the main baseline."
10,"its satellite imagery provides a resolution of 0.15 m, which is accurate enough considering the total testing area covers around 3.000 m2 ."
10,"on the other hand, the reference and slam maps have a resolution of 1 cm and 30 cm, respectively."
10,"considering that the baseline and the slam maps span a different area, we chose regions and landmarks that appear in both, as figure 6 shows."
10,"the results of this evaluation show that in general, the measurements obtained using the liosam map are closer to the ground truth, as table 4 summarizes."
10,"this outcome, along with the qualitative evaluation and the assessment of the odometry estimation, allows us to infer that the geometry and scale of the liosam algorithm are suitable for generating accurate 3d models of forest regions online."
10,"in our tests, we also observed that using the gnss signal as an additional observation in the estimation scheme of liosam greatly improves its odometry estimations and, consequently the map generated."
10,"finally, it is also noteworthy that having larger errors using the photogrammetry map does not imply that it is unsuitable for this application."
10,some practical strategies can be used to improve the accuracy of such maps.
10,"for example, having geo-referenced landmarks in the form of"
11,"forests 2023, 14, 1601 11 of 20 ground control points greatly helps to improve the optimization process during the feature matching and reprojection stages. (a) (b) (c) (d) figure 5."
11,"point cloud maps of the (a) photogrammetry baseline, (b) slam outcome."
11,"the two maps were compared using the hausdorff distance, whose result is visualized as (c) the slam map colored according to this metric and (d) a boxplot showing the error distribution."
11,"note that the baseline and the slam clouds colormaps correspond to rgb and height values, respectively. (a) (b) figure 6."
11,landmarks and regions used to validate the spatial correctness of the slam map.
11,"given the photogrammetry baseline and the slam map span different areas, we chose regions that appear in both. (a) shows the specific areas we used to validate the slam map which in intersect between baseline and slam, (b) shows the specific segments or landmarks for detailed comparison"
12,"forests 2023, 14, 1601 12 of 20 table 4."
12,quantitative evaluation of the map resulting from our slam implementation.
12,all of the area regions are measured in m2 and length segments are measured in m.
12,measurement type google earth photogrammetry absolute error liosam map absolute error area region 1 308.81 489.24 180.43 322.00 13.19 area region 2 3021.28 3144.47 123.19 3116.16 94.88 area region 3 4561.49 4742.12 180.63 4591.95 30.46 area region 4 6293.18 6216.12 77.06 6268.21 24.97 area region 5 1156.96 1161.97 5.01 1201.53 44.57 length segment 1 78.09 91.22 13.13 77.29 0.8 lenght segment 2 31.36 37.78 6.42 32.59 1.23 length segment 3 78.83 92.07 13.24 79.03 0.2 lenght segment 4 154.97 182.03 27.06 154.96 0.01 length segment 5 86.49 99.66 13.17 88.84 2.35 4.2.
12,"fuel mapping in this section, we detail how we evaluate the critical individual modules necessary for the final map, specifically semantic segmentation and fuel mapping."
12,"we address the current drawbacks of each technique, our setting limitations, and our solutions to overcome them."
12,"in our evaluation of the semantic segmentation model, we utilize a small annotated test set derived from the semantic mapping mission in the rural test site, which was not used for training."
12,"for this purpose, we annotated 17 images using the same strategy employed during training, but these images were not included in the training dataset."
12,"to ensure flora safety, we have used a conservative approach when labeling fuel where we would underestimate fuel to avoid future issues where the ground vehicle would mulch canopies."
12,"similarly, for the training case, it is worth noting that despite having 17 images, the actual instances used for testing are higher."
12,this is because some classes can appear more than once in a single image.
12,"we conducted an analysis of the semantic segmentation using precision, recall, and intersection over union (iou) metrics to assess the fuel classification in our system."
12,these metrics were chosen because of their importance for addressing false positive/negative results while iou estimates the general quality of the segmentation.
12,"we decided to mainly focus on precision for our results because it avoids false positives, ideal for fuel classification to avoid mulching green vegetation and other important dynamic classes such as humans and animals."
12,"it is worth noting that certain classes which were included in the original 15 classes, are absent from the evaluation table 5."
12,"this is because these classes were not present in the test set, as seen in figure 7."
12,"consequently, these classes were excluded from the results."
12,we also took into account the lack of training instances by adding class weights to rarely occurred classes in our training model to lower dataset shift issues.
12,"even with the aforementioned techniques used, there is a noticeable shift in performance between the common classes and the rare classes, which could stem from our lack of expert annotators to ensure consistency for each subclass, the need for more class imbalances techniques, or the addition of more training instances."
12,"however, considering a ground vehicle can do further exploring and the high precision in the known fuel classes, we can conclude that the current results are above our needed threshold to find fuel regions for further inspection."
12,"to provide further insight into the model performance, we show qualitative predic- tions on the test set, as seen in figure 8."
12,"finally, we present the results of the semantic mapping experiment conducted at the most representative test site (the rural location in pittsburgh, united states)."
12,"due to the lack of ground truth information for the geometric and semantic information in the test sites, quantitative metrics for semantic mapping in large-scale forestry environments were not available."
12,"for quantitative results, a high-precision laser scanner such as the leica nova ms50 or blk360 [73] or adding ground control points for photogrammetry is necessary to quantify the results."
12,"therefore, we devised a qualitative test to evaluate our full framework"
13,"forests 2023, 14, 1601 13 of 20 by comparing the generated ufomap with a manually labeled semantic mesh from an orthomosaic to evaluate the accuracy of our global map. (a) (b) figure 7."
13,this shows the fraction of pixels per class for (a) the train set and (b) the test set.
13,"note that the three dominant classes canopy, bare earth, and dry grass are common across both collections but the comparative frequencies are somewhat different."
13,"these correspond to our aggregate vegetation, background, and fuel classes, respectively."
13,"the fractions of other classes are fairly small, and some from the training set are entirely absent in the test set."
13,figure 8.
13,qualitative semantic mapping results from the test set.
13,"the results are shown both for the predicted classes and the aggregated ones, with colors visualized in the top rows."
13,white regions in the ground truth (gt) represent areas that were ambiguous to the human annotator.
13,overall the predictions match the ground truth well and boundaries are well-defined.
13,"note that many regions of confusion, such as canopy-to-trunk and green shrub-to-canopy, fall within the same coarse classes for our mapping purposes."
14,"forests 2023, 14, 1601 14 of 20 table 5."
14,evaluation results of the segnext network with the anderson fuel model as a base for semantic segmentation in a forestry environment.
14,"class iou precision recall canopy 70.05 84.77 80.13 dry grass 79.7 93.75 84.17 bare earth 78.53 88.12 87.83 green shrubs 3.27 21.72 3.71 green grass 0.0 0.0 0.0 dry shrubs 0.0 0.0 0.0 live trunks 0.05 0.05 84.09 figure 9 showcases the semantic ufomap results, including the orthomosaic ground truth labels for the compressed classes (fuel in red, canopy in green, and background in black), along with the rgb ufomap representing the terrain baseline."
14,"additionally, figure 10 shows a close-up for both image and segmentation for a clearer comparison between semantic classes and the original rgb image. (a) (b) (c) figure 9."
14,"ufomaps of the (a) colored image baseline, (b) ufomap semantic outcome using red as the fuel classes, green as the canopy classes, and black as the background classes (c) the hand-labeled orthomosaic ground truth for the semantic classes."
15,"forests 2023, 14, 1601 15 of 20 (a) (b) figure 10."
15,"ufomaps from a closer view of the (a) colored image baseline, (b) ufomap semantic outcome using red as the fuel classes, green as the canopy classes, and black as the background classes."
15,"discussion in the two test sites surveyed in this work, liosam demonstrates superior perfor- mance in terms of rmse compared to fastlio-scon the study sites reported in this work."
15,"specifically, we noticed that liosam might outperform fastlio-sc in two key aspects: imu heading initialization and efficient odometry updates facilitate the integration of gnss measurements within the optimization loop."
15,the positive impact of heading initialization and odometry updates can be observed in the quantitative and qualitative results depicted in table 3 and figure 4.
15,"although the experiments addressed in the current work show that liosam achieves better odometry and mapping outcomes, it should be noted that for the pittsburgh study site, the average rmse is higher than the coimbra study site."
15,"although the flights in the two testing sites were different (autonomous in pittsburgh, manual pilot in coimbra), the main factor that advocates the higher errors in the pittsburgh surveys might be related to the need for more reliable features for determining a closer lidar odometry to the actual trajectory."
15,"specifically, liosam extracts corner and surface features from lidar scans to perform scan matching between point clouds and retrieve lidar odometry."
15,"thus, such features might not be reliable enough to yield accurate lidar odometry."
15,"note that in the semi-urban environment, the coimbra study site, where corner features are more abundant than in a rural area, the average rmse is below 1 m, which is acceptable considering the size of the surveyed area and the distance flown."
15,"while the two flights regarding fastlio-sc, it performs direct registration of lidar scans; thus, it does not need computing corner of surface features."
15,"however, the experi- ments performed in both study sites show that its main drawback might be related to the initial yaw orientation."
15,"in particular, the fastlio-sc yaw angle does not align with the actual imu heading angle."
15,this mistrust alignment severely affects the estimated odometry because it starts deviating from the current location of the platform; see figure 4.
15,"for instance, one of the worst deviations occurs on the coimbra study site, where the rmse on the x axis rises to 42.51 m."
15,"based on the aforementioned, liosam might be more suitable than fastlio-sc for performing localization and mapping tasks in semi-urban and rural areas."
15,"nevertheless, it is suggested to continue evaluating the limitations and advantages of both slam approaches on rural and forest environments in future works."
15,further assessment of these algorithms might yield insights about a new robust slam strategy for these environments.
15,our semantic segmentation experiments show that a small number of labeled images from a similar region can result in relatively accurate predictions for that region.
15,"overall, the predictions in figure 8 show fairly good agreement with the ground truth."
15,"the errors often occurred when the textures were indicative of the predicted class, suggesting that the model struggles with more global reasoning."
15,"this could be further improved with a comparison study between rgb and multispectral cameras to see which factors more in the quality of the segmentation, the channel choices or the higher resolution."
15,this was not possible for this paper as we did not have enough annotators for both sensors.
15,"by observing both the raw classes and the classes aggregated by the rules defined in table 2, we see that many of the prediction errors fall within the same aggregate class."
15,"given the variability of vegetation by geographic area and different objectives of mapping, it seems"
16,"forests 2023, 14, 1601 16 of 20 that training many site-specific models may be easier than expecting one fixed model to generalize worldwide."
16,"this observation agrees with the result of our previous work [14], where it was shown that increasing the number of training samples, marginally increased the segmentation accuracy."
16,"in the fuel mapping results, we observed that capturing the map from a higher altitude, specifically between 30 m and 40 m above the ground, with resolutions below 0.1 m did not yield a cohesive and dense map due to limitations in the lidar density."
16,"furthermore, the mapping process faced challenges related to odometry dropouts as the map expanded and the computational load required for neural network operations."
16,"however, despite these challenges, a high map density was achieved by collecting data points at a frequency of approximately 4 hz, ensuring a sufficient representation of the environment as seen in figure 9."
16,"visual comparison from figure 9b,c (between the semantic ufomap and the ground truth map) revealed a general alignment."
16,"nonetheless, specific issues were identified, particularly in localized areas such as thin layers of background misidentified as canopies."
16,"these issues could be attributed to factors such as pose drift, abrupt jumps resulting from the lack of loop closure updates in the odometry messages employed, and semantic mapping."
16,"additionally, utilizing detection without tracking had a negative impact on the segmentation quality of the map."
16,"incorporating tracking mechanisms would enhance the robustness and accuracy of the mapping process, thereby contributing to a more reliable global representation system."
16,"importantly, despite room for improvement, the generated global map demonstrated a conservative approach to fuel classification, prioritizing the preservation of tree cover and minimizing the risk of erroneously identifying and removing trees."
16,this approach aligns with the objective of accurately identifying fuel regions for wildfire prevention.
16,these observations provide valuable insights into the challenges associated with semantic mapping.
