page,p
8,so a procedure is implemented in the satellite display system at 3.2 quantitative data the central office at offenbach to determine explicitly the 3.2.1 quantification of qualitative data speed of cloud or frontal systems.
8,this is a tool for very short time forecasting.
8,"as ir images are calibrated, it is an important usage of satellite data is the monitoring possible to determine the exact cloud top temperature and the correctness of numerical weather analyses and from that the cloud top height."
8,this is mainly needed for forecasts by means of satellite images.
8,"as it is well known, aviation purposes."
9,"geojournal 24.1/1991 61 fig 4 meteosat-2, 28.10.1985, 12 utc, vis, superimposed with timely corresponding isolines of relative humidity (%), 700 hpa. 12 hourly forecast from bkf modell 3.2.2 satellite data for numerical weather prediction the forecast model which will be operational from the beginning of 1991 onwards will be a mesoscale model with an example for the usage of satellite data in numerical a 50 km gridpoint distance and 20 layers."
9,this model weather forecast models has been given already in the cannot be used for weather simulation over the whole section above (bogus data).
9,quantitative satellite data globe.
9,it is a nested model whose parameters at the borders being derived at international centers of satellite operators have to be provided from a global model.
9,"for numerical are more important, however."
9,those data are vertical weather forecasting over germany and europe by means of temperature and humidity profiles which are retrieved the mesoscale model the dwd consequently has to from the tovs data at a center at washington (see section operate in parallel a global model.
9,2.1.3).
9,these data are distributed worldwide to all this is necessary as meteorological events in one part of interested meteorological services via the international the earth propagate quickly around the world and meteorological telecommunication system.
9,thus the data influence the weather even at distant places within a few are available at dwd and are used operationally day by day days.
9,"for example, tropical disturbances can give rise to in the numerical analysis scheme. weather systems at much higher latitudes."
10,62 geojournal 24.1 / 1991 -....
10,"+-,..+~ ~, o -- +.,~ + + , + o o • ;o'~ ~ , + '~+l . . . ."
10,"32 2. , , ~ ........"
10,"+~-,+,, . . . . . . o , , ~ +°,+ o o,~,-~."
10,"%,..x o ,3 +, ,i, 33 :+ ~ + ~;-o ,o 2 0~ ,'~, , f~'2, o , o o * o ol . . . ."
10,"+ +l.at+,,~ o +~222 ,~ 3 + ?"
10,"ii""+++ ,, . . . . + ,3 u , ~ '~'/"" ~+ o i o c o +t o ~,,o+ 2 ,2 , ~ o+. o */ + i o o ."
10,"~ 2 i 2 a o i |.,~ ~ m o -,+ a ,."
10,i i o i/ . . . .
10,"5+ "" + ."
10,"~ p ' 6 "" ~ ~ /--3i"" .223 , i, o ;70""1v q[."
10,"ow~ 15g'w 14g'~ 12so+vl ~id'w 1 l i l y igot~ u(y~ ~ 7g'w 60'w 54~v ~ 3g'~ ~ io'w p idi~ 2031[ ~ 40t[ 5(}'1[ 60'[ 70'1~ bo*( 9~( iqo'[ t l o ~ 1zd~[ 13g'~ 1413~ 1~o'i[ t£oq£ itg'~ ~;1~ l l m ' w ~f,o'w ~,1o~ 13o'# 1 2 0 ~ 11o,w i o o ~ sow ~ 7o*w ~ sew ~ 3o'# 20~ 1o'~ o* lot 2o't 3o,[. ~ ~0'[ lot 7o'[ no'[ tm.[ lcm*t 110'[ lap[ 130'[ i,io2 l~l~t 111t~ i;'o2 o o~o o o o o o o o o e e o o a • ole oo o o o • o e o o o • o o o | iil i 1 i i i i i i i 1111 i t i +,.."
10,"~.-'-+l, - r.d..,r..."
10,"&~ ~ '~*--+f, , ~ j . - . ~ , ~, l ., . , : ., . ."
10,i . t .
10,2. . i .
10,~ . . i.
10,$ i i i .1 . i . .t .
10,i . .1 .
10,i . t i i .i .
10,i . i. .
10,"i i t , 22 ~1121 ~ 1 2 2 2 +,+ ~ ........"
10,"~ = ,~+: +3l+c+,r + ,~ ...."
10,"++,l+3:+,~+2,13++++2,+~e3~.., ~ :~ 2 i 3 ~. + 3 3 : s, + 1~ s s + 3 + + + s s, • s ' 4 3 s 1 z ~ 2 a a -~ 43 s s s ~ s 3 d 3 ."
10,"~ ~s .s ~£""~ ~ ~s ++?"
10,"+, ++ . . . . ++,+++ ~ ~ 3 z 2 2 ~j. 2 3 $ s12 2 2 2 + 2 2 3 2 2;3 z 2 ~} ~ n +`,,:,-,` +~: z i 3 4 3 2 i 2 z ,i 4 3 3 2 2 1 . . ...... . . . ."
10,"+ . . . . i. . . . . . . ..... . . . .,.. . . . . ."
10,+ . ...... . .
10,"+. +,')i:'+, , ~ 3 3 3 +--+~ s s ~ 2 s i 4 33:22 ~ 2 = 22 ~'~ ~ 4;44 s s 3 s = ~ l 2 ~ ~ ~ s 3 s ' 4 s ~ 2 2 2 2 ~ 2 ~ ~ ], . . . . . .22 ~c 2 2 2 3 3 3 3 3 s 2 ~ 221 i 1 2 ~ 3 ~ 3 3 33 33 3 3 ~%2 ~ 22 3 s~$ 2 a ~ 2 3 3 3 1 3 1 3 4 3 = = 2 2 ~ ; ; 2 3 3 3 + ,i + 4 + 3 + + 3 + ."
10,"+ 233 s 4 , 3 1 1 1 2 2 2 2 ~ s s s s ~ l 2 4 4 ' ~ ' i - 4 4 4 4 3 3 2 1 2 1 ~ i 2 3 0 3 2 ~ 233 s 4 4 4 4 4 , s 4321223 s 3 = 3i . . . ."
10,' ............
10,"~nn1, ...... ~ ~+a z ~ s 4 + 4 + 44 4 4 s =i:t i + s s~s~+ s l 44 ¢ 4 4 3 3 2 2 2 z ."
10,~ 1 ~ 4 4 5 3 1 2 3 3 4 444 1 3 3 ~ 1 1 1 2 2 2 3 3 3 3 3 3 4 5 + 4 + 3 3 3 3 + 3 33 +43 4 4 4 4 3 222 123 i 22 ~ s ~ ~ s 44 & 444 s s ~ ~ 44 s s ~ 44 4 4 4 4 4 2 ;2 ~ 2 ~ l i ~ ~ ~ 4 ~ l s 3 3 ~ 3 3 3 4 4 3 3 3 ~ 2 1 2 : .......
10,i. . . . . . . . . . . . .
10,"i 4 l ~ 3 3 3 3 3 2 ;~ 2 2 1 33,44 • s4 42 s s + s 4 444 ~ . ~3 3 3 3 3 3 3 3 1 * 4 4 4 3 3 3 3 3 3 344 43 3 3 3 3 3 4 4 4 , 4 4 4 4 ~ $ 3 3 3 ~ 2 a i • 4 4' 4 ] ~ ~ ~ ] i ~ i 4 l • + 4 ~!"
10,"+ s ,s 5 3 s ~ 3 * s14 41441~ 413 s ~ • s ~2 = ~ s ~ 33 sis 3 s 2 s 3 = s 3 ~ * , , , ,i, s': s s 3 3 ,is , , s , 4 , ,~s s s s , 2~2 2 t; 2. . .2. .2. .3 2 2 2 t; .3. .a. . ."
10,+ + 2 2 : .
10,"2 3. 2 s 3 ~ ~ 3 3 2 2 2 ~ : s ~ 3 ~ ~ 3 +is ~13 + : 3 a = 2 ~ 12 :t 2 ~ = s 3312 2 ~ 22 ~ 3 3 1 2 2 2 2 3 3 ~1,.33322 ~ 2 2 2 2 2 2 2 2 3 2 3 2 3 3 3 3 3 3 ~ 3 3 2 2 ~ = 2 3 3 3 3 3 3 3 , 3 3 ~ 2 2 2 1 3 2 i ................."
10,"i ....... ¢'d 34 3 ;~ 2 2 2 1 2 3 2 2 2 2 23 ~+~..33 '-~+t: 3 ~l ~ - , t 2 : : +i3 + a .2 .2. .2 2 t: .2 ."
10,2. .2. .2 2 2 + .2 .
10,3. .2. .3 2 2 + .2 . .2.
10,"1 2 2 ~ ++ 2 2 + + i + +i± + +o , o-""~ o , ~ ' , , , o,, . . . . . . + o o , 2 2 + , + + o ,, o +l+ o o o o o o a,o i o ~ o o , o o o © o o o o o o o o oo o o o o o j o o ~td'w +tlr~ 150""# i+o'w 15e'+ t ~ / ' w l l t ~ |00~ sow ~ 70,+ to~ sow ,m~ ~ ~ lot+ ~* i0'[ ~ so'[ ,lot ~ ~ 7c~ ~ ~ w,o~ 1lift t~o't i~'t 1102 i~ i~ i?"
10,"0'[ fig 5 ecmwf availability monitoring statistics a) average number of radiosonde measurements and pilot reports at 30 o hpa, august 1990 b) average number of noaa-11 sounding measurements, august 1990 observational data are n e e d e d from the w h o l e globe even m e a s u r e m e n t s and pilot reports at the level of about 9 kin, w h e n forecasting the weather for m o r e than a few days for in fig 5 b the distribution of data from the satellites is a particular region as germany. depicted."
10,the maps are provided by the european center the great advantage of satellites is that they are the for m e d i u m range weather forecasts ( e c m w f ) and only s y s t e m capable to provide data with the required contain the number of m e a s u r e m e n t s in each five degree global coverage!
10,f r o m that point o f view the satellites are square during august 1990 for the t i m e around noon.
10,the undispensable for numerical weather forecasting.
10,"in fig 5 a map o f conventional data (radiosonde, pilot reports) s h o w w e can see the global distribution of radiosonde e n o r m o u s gaps especially over the southern hemisphere,"
11,geojournal 24.1/1991 63 the polar and subpolar regions and the oceans.
11,contrary to programme.
11,within this project the dwd operates the this the satellite data provide the needed global coverage.
11,global precipitation climatology center (gpcc).
11,"all it has to be conceded, however, that at present the available precipitation data from the whole world are sounding data from the polar orbiting satellites are not gathered, quality controlled, statistically evaluated and always as accurate as desired. archived by the dwd."
11,"data originate from measurements vertical wind profiles are nearly more important than of rain gauges, radars and satellites (geostationary as well temperature and humidity profiles."
11,"however, there will be as polar orbiting)."
11,the precipitation values are derived no system available within the next 10 to 15 years providing from satellite data at international centers. wind profiles from a satellite.
11,"what is done, however, is to satellite derived precipitation data are essential in. this derive cloud motion vectors from the displacement of project as only satellites can provide estimates on the clouds in satellite images."
11,this provides wind information precipitation over the oceans which cover three quarters of in the level of the clouds.
11,wind data are derived 4 times a the globe.
11,fig 7 gives an example with a map of the day at the european space operations center (esoc) precipitation totals for august 1987.
11,"global precipipation from meteosat data, in the us from goes data and in data are very important in studies of climate trends (as japan from goms."
11,"these wind data being distributed on precipitation is a sensible indicator in this area), questions the international meteorological telecommunication of water and human nourishment resources, to validate network are available at the dwd and are used regularly in climate models and identify processes relevant for numerical analyses. studying the climate system of the earth."
11,"more details on another parameter being derived at esoc and utilized the role & t h e dwd as g p c c and first results are given by at the dwd in the numerical analysis scheme is the so- rudolf et al., 1991. called upper tropospheric humidity (utc)."
11,these are data other applications are in an early state and are far more of humidity in heights between 5 and 10 kilometers experimental than operational.
11,for example studies have calculated from the meteosat water vapor channel. been initiated to calculate evaporation by means of land these data are important because radiosonde humidity surface temperatures which are derived from a v h r r data. measurements are rather inaccurate at those cold levels ( - 20 t o - 8 0 degrees centigrade).
11,future applications another parameter quantitatively derived from satellte data is the sea surface temperature.
11,"the data are available examples for the future utilization of satellite data at from the geostationary satellites and, with some higher the dwd will follow roughly."
11,"some applications are in a accuracy, from the noaa satellites."
11,as sea surface state of advanced preparation others in an early state of temperatures are changing only slowly they are used in the planning. numerical analysis scheme in combination with in section 3.1.1 a description is given on information conventional measurements from ships and with older being derived from satellite data at the dwd for very short data. time forecasting (often named nowcasting).
11,evaluation of those information is often performed by subjective 3.2.3 satellite data for climatological and environmental interpretation of satellite images.
11,thus efforts are made to studies objectify nowcasting methods.
11,a first step in this direction the dwd operates on a routine basis a method for will be an automatic classification of cloud and surface determining from satellite data the solar irradiance parameters in satellite images.
11,results will be objective available at ground level.
11,"this method was published by data on type and amount of clouds, sea and land surface m6ser etal., 1984."
11,"the dwd applies this method on parameters as discrimination between snow and ice, meteosat data for the area of germany and boundary vegetation and precipitation index."
11,this will not only regions.
11,"results provide data and statistics on available improve short range weather forecasting but will even solar energy needed for climatological purposes (expertises provide the data basis for a quality control of incoming on utilization of solar energy, planning of power plants) conventional observation data and of numerical forecasts. and agricultural studies (evapo-transpiration)."
11,"more another step in implementing improved nowcasting detailed information on this application is found in methods will be the intensified utilization of all available diekmann et al., 1988."
11,in fig 8 we can see as an example a data in advanced workstations.
11,"this includes a combined map of the monthly mean of the global radiation derived evaluation of conventional data, radar and satellite data from meteosat data for june 1988."
11,note the great and numerical analyses and forecast fields even at regional differences over the north sea and the continent: a lot of forecast offices.
11,"the final target will be an expert system sunshine over the ocean, reduced sunshine over land eventually including the utilization of artificial intelligence. because of high cloudiness caused by convection during this month."
11,such gradients can only be studied in detail by in the near future the dwd will not only make use of means of satellite data as there are only a few stations in a tovs data being available from usa with reduced ground-based radiation network. horizontal resolution in numerical analyses but even of another example for the utilization of satellite data in tovs data in full resolution being received and processed climatological studies is the global precipitation at the dwd.
11,for this purpose the dwd has available the
12,"64 geojournal 24.1 /1991 fig 6 monthly mean of global radiation at ground level determined from meteosat data for june 1986, german area (global radiation in j/cm 2 = count * 4.8 + 1105; count to be derived from the colour scale) necessary software (international tovs processing export package itpp-3 from the university of wisconsin) and has performed a lot of tests with very encouraging results, and preparations of routine operations are close to be finalized."
12,efforts are ongoing to improve the accuracy of the temperature profiles by including avhrr data in the retrieval process.
12,the utilization of full resolution tovs data is necessary for mesoscale numerical weather forecasting as the mesoscale structure of the atmosphere can be derived only from satellite data because the horizontal distance of radiosonde measurements is too large.
12,other quantitative parameters for numerical weather forecasting and for climatological studies will be derived from avhrr data at the dwd.
12,for this purpose we have available the so-called apollo software which has been developed at the university of oxford.
12,"besides digital mapping of snow and ice, cloud classification, sea and land surface temperatures, data of the liquid water content of the atmosphere will be derived."
12,other activities concern the preparation on the availability of advanced microwave sounding instruments (amsus) which will provide vertical atmosperic temperature and humidity profiles even from areas with clouds.
12,"fig 7 global monthly aereal mean precipitation totals for august 1987 based on geostationary satellites ir images completed by noaa satellites data by cac, noaa (prepared by global precipitation climatology center, g p c c at dwd) leu~ 1sou 14du 120~ lnnu ouu 5""ow , , s o u 201,1 u 20e 40e 60e ooe !"
12,"00 160e lnol[ - - - .- 8101 it' "" 60 d 2d r q i - .~1o l o o - ,t1540 4 0 q - ¢leijo ~. 10 - <25 1 5 t 0 - ¢~gio 1600- cmo | 25 - <so iuao- ,,t~loo - ooo- <loon teal cos = ...,. ..,,,...,0 . w.."
12,1611 u 160 u 14g h 120 m l o g m miu 61dm 40u 2051 ~q]e 40e 60 e 80 e 100 e 12d e 140 e lib e 180 e
13,geojournal 24.1/1991 65 the dwd welcomes the development of new forecasts.
13,"quanitative satellite data are input data for instruments which might have a positive impact on numerical weather forecasting and are used in numerical weather forecasting and which will perhaps climatological, environmental and agricultural studies. become operational on future satellite systems."
13,in this usage is made of satellite data which are extracted at context the dwd supports studies to be performed at the specialized international centers as well as of data european center for medium range weather forecasts processed by ourselves.
13,preparatory activities have been (ecmwf) of scatterometer and radar altimeter data from initiated for an advanced utilization of qualitative and the first european remote sensing satellite ers-1.
13,"other quantitative satellite data and to derive benefit from future instruments of high interest to operational meteorology instruments and satellite systeme. and for climatological/environmental studies are meteorological services cannot renounce on satellite backscatter lidar (determination of inversions, exact data."
13,"only a system of geostationary and polar orbiting tropopause height, aerosol content, turbidity), doppler satellites can provide observational data without any gaps wind lidar (vertical wind profiles) and a medium resolution in space and time."
13,"over the oceans the necessary density of microwave imaging radiometer (atmospheric water measurement networks could never be achieved by content (liquid, gaseous, solid), soil moisture, snow and ice conventional systems."
13,"satellite data contribute to characteristics, precipitation rate, state of the sea)."
13,"the improvements in weather forecasting and the timeliness of greatest requirement, however, is an interferometer or warnings of severe weather."
13,thus satellites contribute to spectrometer for improved atmosperic sounding in order economic savings and safeguarding of human life.
13,studies to increase the vertical and radiometric accuracy of vertical in preparation of the present meteosat operational atmospheric temperature and humidity profiles.
13,"programme, in which germany is participating with 26% of the costs, have indicated a cost to benefit ratio of about 1 : 3 for germany, and about 1:16 when including the 5."
13,conclusions developing countries in the tropics and subtropics.
13,in addition it should be kept in mind that data of the dwd is one of a few authorities utilizing satellite meteorological satellites have an enormous benefit for earth observation data on a routine basis.
13,this has been other scientific disciplines than meteorology.
13,"in this done nearly since operational weather satellites are context we have to mention oceanography, hydrology, available."
13,"very modern satellite data receiving and climatology, environmental sciences, glaceology, forestry, processing facilities have been recently installed at the agriculture and geography."
13,"synergism of meteorological dwd, all regional and aerodrome meteorological offices satellites is very high."
13,"in the future the greatest additional have independent satellite receiving systems. benefit of data from meteorological satellites will become satellite images are used for weather monitoring and effective in studies on climate trends, as long time for very short range forecasting."
13,they are used for continuity of instruments is assured and as different parts monitoring the quality of numerical weather analyses and of the earth are monitored with the same sensors.
13,references eumetsat: the european organization for meteorological satellites.
13,"published by eumetsat,darmstadt, germany, 1988."
13,"fett, r. et al.: techniques and applications of image analysis."
13,"navy benesch, w."
13,"; kaestner, a.: improvement of the numerical humidity tactical applications guide."
13,naval environmental prediction analysis by subjective interpretation of meteosat images.
13,"research facility, monterey, california."
13,the walter a.
13,"bohan report of the proceedings 6th meteosat scientific users' company, 1977."
13,"meeting, amsterdam, the netherlands, 25-27 november 1986, m6ser, w."
13,"; raschke, e.: incident solar radiation over europe eumetsat eum p 01, 1986. estimated from meteosat data."
13,"journal on climate and benesch, w."
13,"; knottenberg, h.: new satellite receiving and applied meteorology 23, 188-170 (1984) processing system at deutscher wetterdienst, offenbach/m."
13,in: noaa: polar orbiter satellite imagery interpretation.
13,"script-slide eumetsat (ed.), proceedings 8th meteosat scientific program."
13,"department of commerce, national oceanic and users' meeting, 28.-31."
13,"august 1990, norrk6ping, sweden; to be atmospheric administration, usa, noaa/nesdis, 1."
13,1. published june 1988.
13,"diekmann, f.-j., happ."
13,; rieland.
13,; benesch.
13,"; czeplak, g."
13,"; planet, w.: data extraction and calibration of tiros-n/noaa kasten, f.: an operational estimate of global solar irradiance at radiometers."
13,"noaatechnical memorandum ness 107-rev. 1, ground level from meteosatdata: results from 1985 to 1987."
13,"washington dc, november 1979, revised october 1988."
13,"meteorologische rundschau 41, 65-79 (1988) rudolf, b."
13,; hauschild.
13,"; reib, m."
13,"; schneider, u.: operational esa-esoc: introduction to the meteosat operational system."
13,global analyses of monthly precipitation totals planned by esa br-32.
13,esa publications division.
13,"estec, n1-2200 ag gpcc."
13,in: dynamics of atmospheres and oceans.
13,"to be noordwijk, 1987. published in 1991 (delivered and accepted)"
