page,p
1,"catena 201 (2021) 105190 contents lists available at sciencedirect catena journal homepage: www.elsevier.com/locate/catena characterization of field-scale soil variation using a stepwise multi-sensor fusion approach and a cost-benefit analysis sumanta chatterjee a, b, alfred e."
1,"hartemink a, john triantafilis c, ankur r."
1,"desai d, doug soldat a, jun zhu e, philip a."
1,"townsend f, yakun zhang a, jingyi huang a, * a department of soil science, university of wisconsin-madison, madison, wi 53706, usa b icar-national rice research institute, cuttack 753006, india c school of biological, earth and environmental sciences, unsw sydney, kensington, nsw 2033, australia d department of atmospheric and oceanic sciences, university of wisconsin-madison, madison, wi 53706, usa e departments of statistics and entomology, university of wisconsin-madison, madison, wi 53706, usa f department of forest and wildlife ecology, university of wisconsin-madison, madison, wi 53706, usa a r t i c l e i n f o a b s t r a c t keywords: the potential of a stepwise fusion of proximally sensed portable x-ray fluorescence (pxrf) spectra and elec­ digital soil mapping tromagnetic induction (emi) with remote sentinel-2 bands and a digital elevation model (dem) was investigated pxrf spectroscopy for predicting soil physicochemical properties in pedons and across a heterogeneous 80-ha crop field in wis­ electromagnetic induction consin, usa."
1,"we found that pxrf spectra with partial least squares regression (plsr) models can predict sand, sentinel-2 management zones total nitrogen (tn), organic carbon (oc), silt contents, and clay with validation r2 of 0.81, 0.74, 0.73, 0.68, and plsr 0.64 at the pedon scale but performed less well for soil ph (r2 = 0.51)."
1,"a combination of emi, sentinel-2, and dem data showed promise in mapping sand, silt contents, and tn at two depths and ap horizon thickness and soil depth across the field."
1,a clustering analysis using combinations of mapped soil properties or proximal and remote sensing data suggested that data fusion improved the characterization of field-scale variability of soil properties.
1,the cost-benefit analysis showed that the most accurate management zones (mzs) for topsoil can be generated only using estimated soil property maps while it was the most costly as compared to other data sources.
1,"for an intermediate-high (for topsoil) and high (subsoil) accuracy and a moderate economic budget, the combination of sensors (proximal + remote sensing + dem) might be a better approach for effective mzs generation than collecting soil samples for laboratory analysis while the latter produced the most accurate maps for topsoil."
1,"it can be concluded that pxrf spectra can be useful for predicting key soil properties (e.g., sand, tn, oc, silt, clay) at different soil depths, and a combination of proximal and remote sensing provides an effective way to delineate soil mzs that are useful for decision-making."
1,"introduction bhaduri et al., 2018; zhang and hartemink, 2019)."
1,"traditionally, soil mapping relies on labor-intensive field surveys understanding the spatial variability of soil is a prerequisite for and, time-consuming, costly laboratory analyses (minasny and effective management of agricultural resources and environmental mcbratney, 2016)."
1,"the polygon-based soil maps can provide qualitative monitoring (minasny and mcbratney, 2016)."
1,"among all the physi­ information at a coarse-scale but are not suitable for location-specific ochemical properties, soil organic carbon (soc), salinity, clay, sand, nutrients and water management (castaldi et al., 2016)."
1,"in addition, bulk density, cation exchange capacity (cec), ph, nitrogen (n), phos­ regional and national legacy soil survey maps such as soil survey phorus (p), potassium (k), soil moisture (sm), depths of soil and ap geographic database (ssurgo) often consist of artificial boundaries horizon are essential, as they control plant growth and water and that do not account for continuous variation of soil properties nutrient movement (chatterjee et al., 2017, 2018; chen et al., 2018; (mcbratney et al., 2003)."
1,"gholizadeh et al., 2018; mohanty et al., 2011; pradhan et al., 2017; recent progress in proximal soil sensing and remote sensing * corresponding author at: university of wisconsin-madison, department of soil science, 1525 observatory drive, madison, wi 53706, usa."
1,e-mail address: jhuang426@wisc.edu (j.
1,huang). https://doi.org/10.1016/j.catena.2021.105190 received 20 july 2020; received in revised form 15 january 2021; accepted 18 january 2021 available online 7 february 2021 0341-8162/© 2021 elsevier b.v.
1,all rights reserved.
2,chatterjee et al.
2,"catena 201 (2021) 105190 technologies has proven to be an effective way for predictive mapping of et al., 2018; loiseau et al., 2019; paul et al., 2020)."
2,"hyperspectral different soil physicochemical properties with high accuracies at a finer remote sensing data (e.g., hyperion sensor onboard the eo-1 satellite) resolution (mcbratney et al., 2003; hartemink and minasny, 2014; was used to estimate soil moisture, lulc, soc, clay, and soil texture heung et al., 2016; liang et al., 2019)."
2,"the development of soil and plant (folkman et al., 2001; gomez et al., 2008; gholizadeh et al., 2018; sensors and machine learning tools along with increased availability of castaldi et al., 2016)."
2,"microwave backscatter data from sentinel-1 and spatial geo-referenced data and computing power had steered the suc­ smap mission have been used for estimating soil moisture dynamics cess of digital soil mapping in recent decades (minasny and mcbratney, (das et al., 2019; chatterjee et al., 2019, 2020)."
2,"besides, high-resolution 2016; ma et al., 2019). digital elevation models (dems) have been created recently using light a brief description of different proximal and remote sensing sensors detection and ranging (lidar) sensor data (fink and drohan, 2016) are described in table 1."
2,"different proximal soil sensing techniques, such that provide useful topographic information about soil variations. as visible near-infrared (vis-nir, 350–2500 nm), portable x-ray fluo­ advances in machine learning and sensor data fusion in recent de­ rescence (pxrf) spectroscopy, and electromagnetic induction imaging cades have facilitated a better understanding of the dynamics and pre­ (emi) are increasingly being used to predict soil properties and to build diction of different soil properties in space by merging information from digital soil maps at the field scale (viscarra rossel et al., 2016). vis–nir environmental covariates and predictions from different predictive soil reflectance spectra can be useful for characterizing many soil models (errico et al., 2015; chatterjee et al., 2020)."
2,"sensor fusion theory physicochemical and mineralogical properties such as soc, clay, sand, makes use of complementary information from different sensors which bulk density, total nitrogen (tn), cec, ph, carbonate content, and soil can improve the prediction accuracy of the predictive models and esti­ horizon delineation (stenberg et al., 2010; viscarra rosel et al., 2016; mate soil properties at depths (mouazen et al., 2014; xu et al., 2019)."
2,"minasny and mcbratney, 2016; padarian et al., 2019; zhang and har­ except for a few studies that combine proximal and remote sensing to temink, 2019; xu et al., 2020)."
2,"the pxrf spectroscopy is related to the map soil salinity (huang et al., 2017) and moisture (babaeian et al., energy status of the elements and has been used to detect soil heavy 2019) at multiple depths, few studies have shown the potential to metals (mclaren et al., 2012; minasny and mcbratney, 2016; stockman combine proximal and remote sensing to map key soil physiochemical et al., 2016) and to predict several soil physicochemical properties (e.g., properties at a high spatial resolution (e.g. < 30 m). sand, silt, and clay content, ph, cec and base saturation percentage, soil physicochemical properties vary at the field scale, creating dif­ soc) due to the correlation of pxrf spectra or elemental data with these ficulty in allocating crucial inputs for precision agriculture management soil properties (zhu et al., 2011; sharma et al., 2015; wang et al., 2015; (goovaerts, 1998; brejda et al., 2000; ferguson et al., 2002)."
2,"delineation weindorf et al., 2016; chakraborty et al., 2015; rawal et al., 2019; of soil management zones (mzs) proved as one of the most promising zhang and hartemink, 2019)."
2,"the non-invasive emi instruments, approaches to address the spatial heterogeneity within a field by designed to measure soil apparent electrical conductivity (eca), are dividing the field into different zones having homogeneous physico­ increasingly being used to map soil moisture, exchangeable sodium chemical and terrain features (moral et al., 2010)."
2,"previously, re­ percentage (esp), clay content, and salinity (corwin et al., 2003; tri­ searchers used crop yield (vrindts et al., 2005), soil survey and antafilis and monteiro santos, 2010; doolittle and brevik, 2014)."
2,"to topographic maps (fraisse et al., 2001; franzen et al., 2002), and soil summarize, vis-nir and pxrf technologies are often used to estimate properties (oldoni et al., 2019) with clustering methods (cambouris soil properties from individual soil samples collected at the profile scale et al., 2006) and fuzzy logic techniques (molin and castro, 2008) for at different depths while emi can delineate depth-specific variations in creating mzs."
2,"however, only a few studies have used a combination of soil properties and map soil properties across the field (huang et al., proximally and remotely sensed data in delimiting mzs at the field scale 2014; zare et al., 2015). (e.g."
2,"zare et al., 2018)."
2,"furthermore, little research has evaluated the compared to proximal soil sensing that can be used to map soil cost-benefit of combining multiple sensor datasets for creating the mzs. properties at the profile to field scale, remote sensing data from different in this study, laboratory-measured soil properties, proximally sensed satellites have been mainly utilized for characterizing surface soil pxrf soil spectra and emi data from a dualem-1hs sensor, remotely physicochemical properties across large spatial extents (field to global sensed dem and sentinel-2 bands were combined to map several key soil scales)."
2,optical band sensors such as landsat 8 and sentinel-2 have been physicochemical properties across an 80-ha crop field at different depths widely used for land use and land cover (lulc) mapping and recently be using a stepwise multi-sensor fusion technique.
2,"the objectives of the applied for estimating soil mineralogy (forkuor et al., 2018; van der study are two-fold."
2,"werff and van der meer, 2016), soc, and clay contents (gholizadeh table 1 proximal and remote sensing sensors for soil properties measurements."
2,"sensor types of sensors measuring properties spatial depth of references categories resolutions measurements proximal visible-near infrared soil organic carbon (soc), clay, sand, bulk density, – depending on stenberg et al."
2,"(2010), viscarra rossel soil (vis-nir) spectrometer total carbon (tc), total nitrogen (tn), cation soil samples et al."
2,"(2016), minasny and mcbratney sensors exchange capacity (cec), ph, phosphorus (p), (2016), padarian et al."
2,"(2019), zhang potassium (k), soil moisture (sm) and hartemink (2019)) portable x-ray cec, base saturation percentage (bsp), tc, tn, soil – depending on sharma et al."
2,"(2015), wang et al. (2015), fluorescence (pxrf) texture soil samples weindorf et al."
2,"(2016), rawal et al. spectrometer (2019) electromagnetic sm, apparent electrical conductivity (eca), soil ~5 m, 0–6 m huang et al."
2,"(2017), hu et al."
2,"(2019) induction (emi) salinity depending on surveys remote optical (landsat 8, land-use and land-cover (lulc), soil mineralogy, 10–60 m surface forkuor et al."
2,"(2018), van der werff and sensing sentinel-2) soc, clay van der meer (2016), paul et al."
2,"(2020) sensors hyperspectral (eo-1/ sm, lulc mapping, soc, clay, soil texture 10–60 m surface folkman et al."
2,"(2001), gholizadeh et al."
2,"hyperion) (2018), castaldi et al."
2,"(2016) microwave (sentinel-1, backscatter, roughness, sm 10–20 m; 36 surface das et al."
2,"(2019), chatterjee et al."
2,"(2019, smap) km 2020) light detection and digital elevation model 1–30 m surface fink and drohan (2016) ranging (lidar) 2"
3,chatterjee et al.
3,catena 201 (2021) 105190 (1).
3,"to explore the potential to map key soil properties at different from all the six depths (total 288 sub-samples) were then air-dried, depths at the profile and field scales using a stepwise sensor- ground, and sieved through a 2-mm sieve for further analysis."
3,"soil fusion model with laboratory-measured soil properties and texture analysis (sand, silt, and clay fractions) were performed by the proximal and remotely sensed data. hydrometer method (gee and bauder, 1979)."
3,organic carbon (oc) (2).
3,"to evaluate different methods of generating management zones (nelson and sommers, 1996) and total nitrogen (tn) (bremner, 1996) and assessing accuracy and cost for mapping soil properties at were measured using a flash ea 1112 nc soil analyser by the dry two depths using a clustering analysis with a) maps of soil combustion method (soil survey staff, 2014)."
3,"soil ph was measured properties produced with all proximal and remote sensing data, using an oakton ph/con 510 series meter in a 1:1 soil water suspension b) proximal, remote sensing data, and dem data without soil (soil survey staff, 2014)."
3,"the soil spectra were derived by scanning the laboratory data, c) remote sensing and dem data without prox­ air-dried and ground samples using a pxrf spectrometer (olympus imal soil sensors, d) only remote sensing data, e) only dem data, scientific solutions americas inc., waltham, ma, usa). f) only proximal soil sensor data, and g) a legacy soil map."
3,the diagnosis of soil genetic horizons was done based on the 50 soil cores that were collected from the study area.
3,soil profiles were manu­ two hypotheses will be tested in the study: 1) can proximal and ally wetted in the lab to delineate diagnostic horizons.
3,the depth to the remote sensing data be fused to map key soil properties at different bedrock was considered as soil depth.
3,we used official soil series de­ depths from the profile to field scales?
3,2) does a combination of multiple scriptions (osds) as guidance to classify the soil horizons based on the sensors always outperform the use of a single sensor in terms of accu­ sampled 90-cm deep soil cores. racies and cost of delineating soil properties at depths?
3,"for understanding the distribution of soil properties of the 50 sam­ ples, the boxplots and the usda soil textural triangle were plotted using 2."
3,"materials and methods “ggplot2” and “soiltexture” packages in r version 3.6.1 (r core team, 2019)."
3,"study area, sample collection, and analysis 2.2."
3,"ancillary datasets the hughes farm is located in rock county, wisconsin, usa (42.6828◦ n, 89.0187◦ w)."
3,"the soils in this region are formed due to in this study, soil properties were mapped using empirical models glacial outwash plain and sediments of the johnson end moraine and established between the laboratory-measured soil properties (used as have been cultivated since about the 1850 s and are presently under a the model response) and various ancillary data (e.g., pxrf soil spectra, corn-soybean rotation."
3,"our study area is approximately 80-ha in which emi, dem, and sentinel-2) used as covariates."
3,a detailed description of corn and soybean are mainly produced in rotation.
3,the most common all the proximal and remote sensing data set used in this study has been soil orders observed are mollisols and alfisols and the main textural depicted in table 3.
3,we describe these in the order of their measuring classes are silty loam and sandy loam.
3,the annual average precipitation support/spatial resolution and from the pedon scale to field scale is 226.7 mm with a monthly average maximum and minimum temper­ (fig.
3,"1). atures of 22 ◦ c (july) and − 6 ◦ c (january), respectively."
3,"soil samples were collected from different locations across the study 2.2.1. pxrf spectra collection and preprocessing field representing five soil series (ssurgo database, a delta premium pxrf spectrometer (olympus scientific solutions https://websoilsurvey.nrcs.usda.gov/) (table 2)."
3,"in total, fifty points americas inc., waltham, ma, usa) was used to scan all the soil samples that represent the within-field variability of different soil series were in geochem mode."
3,the pxrf spectrometer was calibrated before scan­ chosen for sampling.
3,a conditioned latin hypercube sampling (clhs) ning using a 316 stainless steel calibration reference check.
3,"the geo­ design was used to determine the sampling points based on ancillary chem mode operates in a two-beam configuration (40 and 10 kev) for a data from dualem-1hs, dem data, and normalized difference vege­ duration of 60 s."
3,"beam-1 operates at the energy range of 0–40 kev and, tation index (ndvi) data from sentinel-2 across the field (see following can detect various heavy elements, such as v, cr, fe, co, as, se, pb, ni, sections for details)."
3,"the “clhs” function from the “clhs” package cu, zn, ta, w, hg, bi, rb, u, sr, y, zr, th, ag, cd, nb, mo, le, sn, and sb."
3,"(roudier, 2011) in r version 3.6.1 (r core team, 2019) was used to beam-2 operates at the energy range of 0–10 kev and, can detect lighter carry out the clhs sampling design. elements, including mg, ca, al, mn, si, p, s, cl, and ti."
3,"the elemental soil cores were collected from the selected 50 points (3-cm in concentrations were calculated from the spectra based on an internal diameter, 90-cm depth) using an environmentalist’s sub-soil probe soil calibration procedure (compton normalization method)."
3,"the concen­ sampler (jmc soil samplers, clements associates inc., newton, ia, trations of ca, mg, al, si, fe, zn, ti, mn, rb, sr, and zr and soil spectra usa)."
3,the 50 soil cores (pedons) were brought to the soil laboratory and were detected from all the samples collected from the hughes field.
3,"the sub-sampled successively at a 10-cm depth interval to six depths (e.g., pxrf spectra along with the measured soil properties data were used for 0–10, 10–20, 20–30, 30–40, 40–50, and 50–60 cm)."
3,"all the soil samples predicting soil physicochemical properties (sand, silt, clay, oc, tn) at table 2 summary of 50 pedons sampled for this study followed by usda soil taxonomy."
3,"soil soil series map unit taxonomic class horizons descriptions number of order symbol pedons mollisol rockton loam rpb fine-loamy, mixed, superactive, mesic typic ap (0–25 cm) ab (25–38 cm) bt1 (38–53 cm) bt2 (53–66 cm) 2bt3 12 argiudolls (66–79 cm) 2r (79 cm) winnebago silt wnb2 fine-loamy, mixed, superactive, mesic typic ap (0–25 cm) a (25–38 cm) 2ba(38–53 cm) 2bt1 (53–86 cm) 2bt2 26 loam argiudolls (86–127 cm) 2bc1 (127–168 cm) 2bc2 (168–188 cm) whalan silt wlc2 fine-loamy, mixed, superactive, mesic typic a1 (0–10.16 cm) a2 (10.16–22.86 cm) b1(22.86–30.48 cm) b21t 4 loam argiudolls (30.48–43.18 cm) b22t (43.18–55.88 cm) iib23t (55.88–60.96 cm) ii kane silt loam kaa fine-loamy over sandy or sandy-skeletal, ap (0–13 cm) a(13–30 cm) bt1 (30–41 cm) bt2 (41–56 cm) 2bt3 1 mixed, superactive, mesic aquic argiudolls (56–74 cm) 3c (74–152 cm) alfisol locke fine sandy lka fine-loamy, mixed, superactive, mesic ap (0–23 cm) bt1 (23–36 cm) bt2 (36–61 cm) btk (61–94 cm) c 7 loam aquollic hapludalfs (94–152 cm) abbreviation: usda-nrcs, united states department of agriculture–natural resources conservation service 3"
4,chatterjee et al.
4,catena 201 (2021) 105190 table 3 proximal and remote sensing data used to predict soil properties.
4,"sensor bands/arrays description spatial wavelength resolution pxrf beam-1 (0–40 kev), beam-2 (0–10 kev) soil spectra – – dualem- prp_half, hcp_half, prp_1m, hcp_1m apparent electrical conductivity (eca, ms m− 1) – – 1hs sentinel-2 b2, b3, b4, b5, b6, b7, b8, b8a, b11, b12 blue, green, red, red edge 1, red edge 2, red edge 3, 10 m–20 m 490 near infrared, red edge 4, short wave infrared-1, nm–2,200 nm short wave infrared-2 lidar elevation, analytical hill shading, slope, aspect, planiform curvature, digital elevation models (dems) ~2 m – profile curvature, convergent index, topographic wetness index, ls- factor, channel network base level, channel network distance, valley depth, relative slope position half of the sample locations using a partial least squares regression analysis."
4,"two types of pc combinations were compared for the plsr (plsr) model. model built for sand, silt, clay, oc, and tn: (a) 40 pcs from the spectra of the pxrf spectra were preprocessed as follows: (a) smoothing and pxrf beam 1 (xrf40), (b) 13 pcs from the spectra of pxrf beam 2 (b) background removal and peak search."
4,for smoothing savitzky and (xrf10).
4,"a separate plsr model was built for ph which used 54 pcs golay (sg) polynomial filter was used (savitzky and golay, 1964)."
4,"the from the spectra of pxrf beam 1 (xrf40), and 13 pcs from the spectra sg filter fits a local polynomial regression curve on the pxrf signal with of pxrf beam 2 (xrf10)."
4,the use of pcs is very common in building soil specified window size and order of polynomial regression.
4,"the pxrf spectroscopic models and selecting the most useful information from spectra of beam 1 (xrf40) were smoothed with a polynomial order of 2 sensor data (zhang and hartemink, 2019; ji et al., 2019). and a window size of 11 nm."
4,the pxrf spectra of beam 2 (xrf10) were smoothed with a polynomial order of 2 and a window size of 7 nm.
4,the 2.2.2.
4,"electromagnetic induction (emi) savitzky golay function in the “prospectr” package (stevens et al., 2013) the apparent electrical conductivity (eca, ms m− 1) was obtained at was used in r version 3.6.1 (r core team, 2019). four different depths along the transect (fig. 4g, h) with a dualem-1hs the processed pxrf spectra (xrf40 and xrf10) were scaled to zero instrument (dualem inc., milton, on, canada)."
4,it has four coil arrays sample mean and one sample standard deviation individually.
4,"then a (0.5 m hcp, 1.0 m hcp, 0.5 m prp, and 1.0 m prp) provided by two coil principal component analysis (pca) was applied to extract the most spacing – approximately 0.5 and 1.0 m, along with two coil geometrics – important principal components (pcs) of each type of spectra which horizontal coplanar (hcp) and perpendicular (prp) at each spacing."
4,the explained most of the variation (~90%) in the data.
4,"the “prcomp” notations of hcp_half, hcp_1m, prp_half, and prp_1m represent eca function in r version 3.6.1 (r core team, 2019) was used for the pca measurements by different arrays and correspond to depths of fig."
4,flowchart of the method used in this study.
5,chatterjee et al.
5,"catena 201 (2021) 105190 exploration (doe) of 0.8, 1.6, 0.3, and 0.5 m, respectively. 1∑n mae = |pi − oi | (2) n i=1 2.2.3."
5,"sentinel-2 bands sentinel-2 is a wide-swath, high-resolution, multi-spectral imaging √̅̅̅̅̅̅̅̅̅̅̅̅̅̅̅̅̅̅̅̅̅̅̅̅̅̅̅̅̅̅̅̅ ∑n (pi − oi )2 mission of the european union supporting the copernicus program for rmse = (3) monitoring land surfaces, including vegetation, soil, and water cover, i=1 n inland waterways, and coastal areas."
5,it comprises two satel­ ⎡ ⎤2 lites–sentinel-2a (s2a) and sentinel-2b (s2b).
5,"the level-1c products ∑n ( )( ) ⎢ o − o p − p ⎥ from sentinel-2 multi-spectral imager (msi) including several bands i=1 i i r2 = ⎢ )2 √̅̅̅̅̅̅̅̅̅̅̅̅̅̅̅̅̅̅̅̅̅̅̅̅̅̅̅̅̅̅ ⎣√̅̅̅̅̅̅̅̅̅̅̅̅̅̅̅̅̅̅̅̅̅̅̅̅̅̅̅̅̅̅̅̅ )2̅ ⎦ ⎥ (4) and ndvi for two years (2018–19) were computed at 10-m resolution ∑n ( ∑n ( o − o p − p from google earth engine (gee, gorelick et al., 2017) using the i=1 i i=1 i “copernicus/s2” image collection."
5,the level-1c products included ⎡ ⎤ cloud masks to acquire cloud-free images.
5,"the images were collected ∑n 2 ⎢ i=1 (pi − oi ) ⎥ during september in both the years of observations coinciding with the nse = 1 − ⎣∑ ( )2 ⎦, − ∞ ≤ nse ≤ 1 (5) n end of the growing season of maize in the study area."
5,"remote sensing i=1 oi − o data were used previously for retrieving soil properties and mapping at different scales across the globe (gholizadeh et al., 2018; castaldi et al., where, pi and oi are model predicted values and observed values, 2016; paul et al., 2020). respectively, and ō and p‾ are the mean of the observed values and mean of n predicted values, respectively."
5,2.2.4.
5,"digital elevation models and terrain parameters in this study, we did not select the calibration and validation samples the dem of the study area was collected from the wisconsin based on the entire soil cores suggested by others (e.g."
5,"chen et al., 2020)."
5,department of natural resources with an approximately 2-m spatial this was mainly due to two reasons.
5,"first, the soil of the study area was resolution (http://relief.ersc.wisc.edu/wisconsinview/form.php). heterogeneous in horizontal as well as in vertical directions (e.g. varying terrain parameters were calculated from the dem using saga gis, clay content between a and bt horizons)."
