page,p
5,"as such, selection of calibra­ including analytical hill shading, slope, aspect, planiform curvature, tion and validation datasets randomly would not necessarily lead to an profile curvature, convergent index, topographic wetness index, ls- over-estimation of model performance compared to that generated using factor, channel network base level, channel network distance, valley the entire profiles as calibration and validation datasets."
5,"secondly, it depth, relative slope position."
5,these terrain parameters were utilized was not the aim of this study to evaluate the spectral model uncertainty previously for producing digital soil maps at different scales across the across the field and with depth.
5,"in this study, we would like to explore globe (behrens et al., 2014; schillaci et al., 2017; lacoste et al., 2014). how to combine remote sensing and proximal sensing data to map soil all the ancillary data (e.g."
5,"dualem-1hs eca, terrain parameters, properties across the field."
5,"as such, we would like to make sure the and sentinel-2) were interpolated to a 5 × 5 m grid using ordinary predicted soil properties at 50 sample locations from the pxrf were as kriging with local exponential variograms with a neighbor of 20–30 accurate as possible to be used for the following mapping process. points."
5,"the kriging was done using vesper software (minasny et al., 2006)."
5,we used the local ordinary kriging method to interpolate all the 2.4.
5,predictions of soil properties at the field scale using proximal and ancillary covariates onto the same grid to make it more consistent and remote sensing data easy to interpret.
5,"once the plsr models were established for 25 cores, soil properties 2.3."
5,estimation of soil properties at the profile scale using pxrf spectra were predicted onto all the 50 sampling locations at different depths using multiple linear regression (mlr).
5,"the established soil properties half of the samples (144 samples at 25 profiles) were analyzed for (except ph) were used to establish mlr models to predict soil properties sand, silt, clay, oc, and tn."
5,all the samples were analyzed for ph.
5,"a from the 50 locations across the whole field for decision-making. partial least squares regression (plsr) model was used to predict all the backward elimination was used to select the covariates from emi, soil properties from different combinations of principal components sentinel-2, terrain parameters, and soil depth until all the remaining (pcs) of pxrf spectra (40 kev + 10 kev)."
5,all the samples were randomly covariates had a probability < 0.05.
5,"the performance of the selected divided into training (75%) and validation (25%) datasets. 108 and 36 mlr model was then evaluated using leave-one-out cross-validation samples were used as training and validation datasets for modeling sand, using the “lm” function in r version 3.6.1 (r core team, 2019)."
5,"the r2, silt, clay, oc, and tn, while 216 and 72 samples were used as training rmse, and me including mae, and nse were calculated for both the and validation datasets for estimating soil ph."
5,the plsr models were calibration and validation processes.
5,"once the mlr models were built using “pls” package in r version 3.6.1 (r core team, 2019)."
5,"the established for all the six depths, soil properties (ph, sand, silt, tn, soil model was fitted with the “train” function and “pls” method in the caret depth, ap depth) were mapped across the whole field at two depths package (kuhn, 2008)."
5,the training procedure was conducted on the (0–10 cm and 50–60 cm) with their standard errors (se) to emphasize calibration dataset and the performance was controlled by 10-fold cross- the top and sub-soil depths. validation and was repeated 10 times.
5,the maximum number of pls latent vectors was set to be 30 and the best number of components was 2.5.
5,delineation of management zones (mzs) selected by the smallest root mean squared error (rmse).
5,"the coefficient of determination (r2), rmse, mean error (me), mean absolute error the maps of soil properties established from mlr models, remote (mae), and nash-sutcliffe efficiency (nse) were calculated for both the sensing products, terrain properties, and proximal sensed data were training and validation datasets to assess the performance of the plsr used for cluster analysis using jmp software (sas, 2020)."
5,"k-means (km) models. clustering is a nonparametric and unsupervised classification technique, the equations of all the model performance indicators are given which is widely used for creating soil management zones (mzs) (tou and below: gonzalez, 1974; cambouris et al., 2006)."
5,"to perform km clustering, euclidean distance was used as a distance matrix (bezdek, 1981)."
5,"the 1∑n traditional ssurgo soil series map (fig. 4b) with 4 (k = 4) distinct soil me = (pi − oi ) (1) n i=1 series classes were compared with maps of mzs created using different combinations of proximal, remote sensing, and dem data."
5,we tested 5
6,chatterjee et al.
6,"catena 201 (2021) 105190 seven approaches of cluster formation a) clustering using maps of soil divided into three categories: hardware/rental cost, preprocessing/ properties produced with all ancillary data (e.g., pfrf predicted data, analysis cost, and modeling/mapping cost."
6,"the cost of laboratory anal­ sentinel-2 bands, emi, lidar-dem), b) clustering using proximal, ysis for each sample and labor charges was around 40 and 500 us dollars remote sensing data, and dem data (pss + rs + dem) without soil ($), respectively."
6,"hence, for six depths and different soil properties (e.g., laboratory and pxrf data, c) clustering using remote sensing and dem ph, texture, oc, tn) it cost around $6,500 (25 locations × 6 depths × $ data (rs + dem) without proximal soil sensors, d) clustering using only 40 per sample + $500 = $6,500)."
6,"the cost of the jmc soil sampling remote sensing (rs) data, e) clustering using only dem data, f) clus­ tubes with caps was $296."
6,"the modeling cost was estimated to be $480. tering using only proximal soil sensors data (pss) came from emi sensor, therefore, the total cost incurred for this scenario was around $7,276. and g) clustering using a legacy soil map (ssurgo)."
6,"the cost for proximal sensors (e.g., dualem-1hs, pxrf) hire, surveys, we compared dem from lidar and rs data from sentinel-2 sepa­ and analysis cost was around $1,400, whereas, ssurgo maps and rately and combined it with the pss because the lidar dem data are not remote sensing analyses costs were $214 and $200, respectively."
6,the easily available.
6,"multispectral remote sensing data such as sentinel-2 lidar-dem survey was done by the department of natural resources, are easily available and are related to many soil properties such as soil wisconsin, usa with the help of a manned aircraft, and the approximate organic carbon, soil mineralogy, and clay content (forkuor et al., 2018; cost to survey the 80-ha field was $1,400."
6,"the hourly charges for un­ van der werff and van der meer, 2016; paul et al., 2020)."
6,that is why we dergraduate and skilled graduate student hire were approximately $16 incorporated rs data with the pss and dem data (scenario b).
6,"adding and $40, respectively."
6,the detail of cost partitioning including the time the extra dataset (e.g.
6,"rs from sentinel-2) would not involve significant taken (in man-hours) to complete each scenario has been presented in processing effort and cost, which will be compared with other scenarios table 8. for the cost-benefit analysis."
6,we then compared all the approaches of clustering to evaluate the 3.
6,results best approach of clustering in this site based on the sum of the within- class variance of different topsoil and subsoil properties of the avail­ 3.1.
6,exploratory analysis of soil properties able soil samples in each mz and the costs of generating the mzs (see below).
6,"in this study, the optimal number of mzs was set to 4 to be the dominant soil order of the experimental farm was mollisol and consistent with the major soil series from the legacy soil map."
6,it should 43 pedons fell under this order and the main textural classes were silt be noted that methods exist to determine the optimal numbers of mzs loam and sandy loam (table 2).
6,the major soil series was winnebago silt based on feature space (e.g.
6,"hartigan and wong, 1979; mcbratney and loam (wnb2) (fig. 4b)."
6,"the summary statistics of various soil properties moore, 1985) or soil properties from collected samples (e.g."
6,huang measured at the sampling locations are shown in table 4.
6,"the percent et al., 2014)."
6,"as this was beyond the scope of this study, we would not sand, silt, and clay varied from 24.2 to 82.7, 4.7–49.2, and 0.8–39.7, evaluate the effect of cluster numbers on the results. with a mean value of 56.9, 25.8, and 18.1%, and a standard deviation (sd) of 12.6, 9.1, and 6.3, and coefficient of variation (cv) of 0.22, 0.35, and 0.36%, respectively."
6,"soil ph across the farm ranged from 4.7 to 8.4, 2.6."
6,"costs of surveys/sensors/measurements with a mean, sd, and cv (%) of 6.6, 0.8, and 12, respectively."
6,"the organic carbon (oc) and total nitrogen (tn) varied between 0.1 and 8.7 the cost of analyses was estimated empirically: field soil sampling and 0.03–0.26%, with a mean value of 1.12 and 0.11%, sd of 1.11 and and laboratory measurements > proximal and remote sensing surveys > 0.06, and cv (%) value of 1 and 0.5, respectively."
6,the a horizon (ap) remote sensing measurement > ssurgo maps.
6,"out of the total profile depth, which is the most important soil horizon for crop growth and samples (~50 pedons), half of the profiles (~25 pedons) samples were influence soil physicochemical properties substantially, varied from 10 analyzed in the laboratory for six depths (e.g., 0–10, 10–20, 20–30, to 55 cm, with a mean, sd, and cv(%) value of 26.6, 9.3, and 34.9, 30–40, 40–50, and 50–60 cm)."
6,the cost for different scenarios was fig.
6,"soil properties measured at 25 locations and pxrf predicted soil properties at another 25 locations (a), and the particle size classes (usda) of the measured 144 samples (at 25 locations) used in this study (b)."
6,"oc, organic carbon; tn, total nitrogen."
7,chatterjee et al.
7,catena 201 (2021) 105190 respectively.
7,"total soil depth till bedrock was also measured which performance of the mlr model is presented in table 6 based on the ranged from 22 to 87 cm, with a mean, sd, and cv (%) value of 69.2, leave-one-out cross-validation approach."
7,"as shown in table 6, the 15.9, and 23, respectively. covariates selected in the mlr model can be divided into three cate­ the details of pearson correlation coefficients of measured soil gories, including apparent eca data from the emi sensor (dualem 1- properties and ancillary covariates for topsoil and subsoil are presented hs) at four different channels (prp_half, hcp_half, prp_1m, in appendix tables a and b, and the heat maps of pearson correlation hcp_1m), terrain parameters from digital elevation models (slope, coefficients are illustrated in fig."
7,"from appendix table a it can be elevation, aspect, hillshade, planc, profc, twi, lsf, cnbl, cnd, rsp, shown that there were significant (p < 0.001) correlations between sand ci, vd), sentinel-2 bands (b2, b3, b4, b5, b6, b7, b8, b8a, b11, b12, and and silt (r = − 0.92), sand and clay (r = − 0.91), sand and oc (r = − 0.75), ndvi)."
7,a detailed description of the covariates is depicted in table 3. and sand and tn (r = − 0.80) for the topsoil (~0–10 cm).
7,"for subsoil table 6 shows that the mlr model was able to map six soil properties (~50–60 cm) significant correlation (p < 0.001) were found between at different depths, however performed the best for topsoil depth (0–10 sand and silt (r = − 0.53), sand and clay (r = − 0.67), sand and tn (r = cm)."
7,"for topsoil depth (0–10 cm) the r2 and rmse values for mlr − 0.74), sand and ap depth (r = − 0.51), silt and oc (r = 0.75), silt and predicted soil properties were ph (r2 = 0.47, rmse = 0.60), sand (r2 = tn (r = 0.84), clay and oc (r = − 0.55), and oc and tn (r = 0.58)."
7,"0.67, rmse = 6.10%), silt (r2 = 0.56, rmse = 4.10%), tn (r2 = 0.66, rmse = 0.02%), soil depth (r2 = 0.55, rmse = 28.95 cm) and ap depth 3.2."
7,"prediction of soil properties at the profile scale using pxrf spectra (r2 = 0.73, rmse = 5.81 cm)."
7,"for subsoil depth (50–60 cm) the r2 and rmse values for mlr predicted soil properties were – ph (r2 = 0.52, out of 50 pedon samples that were collected from different locations rmse = 0.59), sand (r2 = 0.35, rmse = 9.05%), silt (r2 = 0.35, rmse across the field by using clhs scheme, about half of the samples were = 7.26%), tn (r2 = 0.22, rmse = 0.03%), soil depth (r2 = 0.55, rmse analyzed in the lab and the rest were predicted at the profile scale using = 28.88 cm) and ap depth (r2 = 0.73, rmse = 5.67 cm)."
7,the overall preprocessed pxrf soil spectra with plsr technique.
7,"the soil properties mlr performance for all the six depth– ph (r2 = 0.52, rmse = 0.54), that were predicted using a plsr model, are sand, silt, clay, oc, and tn, sand (r2 = 0.60, rmse = 6.77%), silt (r2 = 0.48, rmse = 5.29%), tn and the pxrf spectra were used as covariates."
7,"the performance of the (r2 = 0.56, rmse = 0.03%), soil depth (r2 = 0.55, rmse = 28.79 cm) plsr models established to predict soil properties using the pxrf and ap depth (r2 = 0.72, rmse = 5.81 cm)."
7,the respective maps of spectra is presented in table 5.
7,"the plsr model performed with higher different covariates (e.g., ndvi, slope, elevation, profile curvature, accuracy for all the soil properties, e.g., sand (r2 = 0.85, rmse = planform curvature, apparent eca, and twi), the predicted soil prop­ 4.80%), tn (r2 = 0.82, rmse = 0.02%), oc (r2 = 0.82, rmse = erties at two different depths including their standard error maps are 0.43%), clay (r2 = 0.79, rmse = 2.89%), ph (r2 = 0.69, rmse = 0.45), illustrated in figs."
7,"4–7. and silt (r2 = 0.67, rmse = 5.05%) for calibration dataset."
7,"in terms of validation datasets, the plsr model showed a good performance, e.g., 3.4."
7,"delineation of zones and cost-benefit analysis sand (r2 = 0.81, rmse = 5.83%), clay (r2 = 0.64, rmse = 3.74%), tn (r2 = 0.74, rmse = 0.03%), oc (r2 = 0.73, rmse = 0.71%), silt (r2 = fig. 8 shows the seven cluster maps (k = 4) that were identified in the 0.68, rmse = 5.57%), clay (r2 = 0.64, rmse = 3.74%), and ph (r2 = experimental field for the delineation of management zones (mzs)."
7,"0.51, rmse = 5)."
7,"for both the calibration and validation datasets, the different suites of sensor data were used to assess the efficacy of creating nse values for all the soil properties were > 0.60 except for soil ph (nse mzs."
7,the sum of within-class variance (σ2w) for predicting various soil < 0.60) for the validation dataset. properties using cluster maps is presented in table 7.
7,"a small σ2w in­ hence, it can be interpreted that pxrf spectra can be used for dicates the presence of overall more homogenous soil properties within building predictive models (e.g., plsr) for predicting some key soil each mz for the cluster map."
7,it can be interpreted from table 7 that σ2w properties.
7,we used this approach to gap-fill our unmeasured dataset differed significantly given the choice of sensor combination.
7,it was and applied them to the measured datasets for consistency in the observed that only measured soil properties alone could be used effec­ following analysis.
7,"the distribution of different soil properties measured tively for delineating the mzs for topsoil (~0–10 cm) as the σ2w for and predicted by plsr is illustrated in fig. 2 including the usda soil different soil properties (e.g. sand, silt, tn) is the smallest (σ2w sand = textural triangle for the measured soil samples."
7,255.9 %2; σ2w silt = 99.4 %2; σ2w tn = 3.6 × 10− 3 %2) compared to other combinations of sensors.
7,"whereas, the combination of proximal 3.3."
7,"prediction of soil properties across the field using proximal and sensor, remote sensing, and dem data (pss + rs + dem) could be remote sensing data effective for subsoil (~50–60 cm) as the σ2w values were the smallest as compared to other combinations of sensors at the same depth, suggest­ once soil properties were predicted onto all the 50 profiles, we used ing that this combination is effective for creating mzs for some subsoil other covariates from proximal (emi) and remote sensing (sentinel-2 properties (e.g., ph, silt, and tn). bands and dem) to build multiple linear regression (mlr) models to table 7 shows that the ssurgo map is not enough to effectively predict all the soil properties (e.g. ph, sand, silt, tn at different profile delineate the mzs in the study area, suggesting the importance of using depths and soil depth, ap depth) across the entire 80-ha field."
7,"the other data sources that are easy to collect (e.g., remote sensing and dem table 4 summary statistics of soil properties measured at different depths across the field."
7,soil properties n min.
7,mean median max.
7,"sem cv (%) skewness kurtosis ph 288 4.7 6.6 6.4 8.4 0.8 0.1 12 0.36 − 0.41 sand (%) 135 24.2 56.9 57.9 82.7 12.6 1.1 0.2 − 0.42 − 0.17 silt (%) 135 4.7 25.8 25.8 49.2 9.1 0.8 0.4 0.13 − 0.04 clay (%) 135 0.8 17.3 18.1 39.7 6.3 0.5 0.4 0.13 1.09 oc (%) 144 0.1 1.1 0.8 8.7 1.1 0.1 1 3.90 21.38 tn (%) 72 0.03 0.1 0.1 0.3 0.1 0 0.5 0.51 − 0.32 soil depth (cm) 50 22 69.2 74 87 15.9 2.3 23 − 0.91 0.34 ap depth (cm) 50 10 26.6 25.5 55 9.3 1.3 35 0.58 0.58 abbreviations: n, number of soil samples measured; oc, organic carbon; tn, total nitrogen; min., minimum; max., maximum; std."
7,"dev., standard deviation; sem, standard error of mean; cv, coefficient of variation."
8,chatterjee et al.
8,catena 201 (2021) 105190 fig.
8,"heat maps showing pearson correlation coefficients among measured soil properties and ancillary covariates for 0–10 cm soil depth (a), and 50–60 cm soil depth (b)."
8,"for abbreviations of the covariates, refer to tables 3 and 4."
8,"maps of different land surface features including dualem transect and field boundary (a), soil series with sampling location (b), mean normalized difference vegetation index (ndvi) of 2018 and 2019 (c), slope (d), profile curvature (e), elevation of the field (f), dualem 1.0 prp (g), and dualem 1.0 hcp (h), topographic wetness index (twi) (i), and planform curvature (j). data)."
8,"however, collecting soil samples and using proximal sensors can soil maps at two different soil depths."
8,"for topsoil, the highest accuracy of incur an additional cost that could be weighed when comparing the cost- cluster maps is associated with measured soil properties from a labo­ benefit analysis."
8,table 8 shows the cost of the sensors and surveys for ratory and the ssurgo maps produced the least accurate cluster maps measurements of soil properties at laboratory and field surveys.
8,the (fig.
8,"when lab-based soil data were not available, the combination of highest cost of analysis was for field soil sampling and laboratory pss, rs, and dem still performed better than the use of rs + dem and analysis (~$7,276), followed by pss + rs + dem data (~$3,000), rs + legacy soil maps (ssurgo)."
8,"when single sensor data were considered, dem ($1,600), dem ($1,400), pss ($1,400), ssurgo maps (~$214), rs and dem performed better than pss and ssurgo data."
8,"this high­ and rs data ($200). lights the importance of performing ground-based pss surveys, partic­ fig. 9 illustrates the costs of different surveys and accuracies of ularly when soil sampling is not affordable. cluster maps for different combinations of sensors including ssurgo however, for subsoil, the highest accuracy in cluster maps was 8"
9,chatterjee et al.
9,catena 201 (2021) 105190 table 5 performance of the partial least squares regression (plsr) models established to predict soil properties using the pxrf spectra.
9,"validation soil properties no. elem. n r2 me mae rmse nse n r2 me mae rmse nse ph 4 202 0.69 0.00 0.36 0.45 0.69 86 0.51 0.08 0.43 0.54 0.48 sand 4 96 0.85 0.00 3.43 4.80 0.85 39 0.81 − 0.56 4.37 5.83 0.80 silt 3 96 0.67 0.00 3.75 5.05 0.67 39 0.68 0.49 4.26 5.57 0.67 clay 4 96 0.79 0.00 2.16 2.89 0.79 39 0.64 0.28 3.16 3.74 0.61 oc 5 102 0.82 0.00 0.32 0.43 0.82 42 0.73 0.03 0.44 0.71 0.70 tn 4 51 0.82 0.00 0.02 0.02 0.82 21 0.74 − 0.00 0.02 0.03 0.73 abbreviations: no. elem., number of elements used in the optimal partial least squared regression; n, number of samples; r2, coefficient of determination; rmse, root mean square error; me, mean error; mae, mean absolute error; nse, nash-sutcliffe efficiency (-inf <= nse <= 1)."
9,"table 6 leave-one-out cross-validation results for the multiple linear regression (mlr) models built to predict various soil properties at all six depths (0–60 cm), topsoil (0–10 cm) and subsoil (50–60 cm)."
9,for abbreviations of the covariates used in mlr models refer to table 3.
9,"soil equation all six depths 0–10 cm 50–60 cm properties all six depths r2 me rmse r2 me rmse r2 me rmse ph ph = 1557.35–0.89 × depth + 0.07 × h_half − 0.63 × p_half − 0.15 × h_1 + 0.52 0.02 0.54 0.47 0.13 0.60 0.52 0.12 0.59 0.22 × p_1 − 214.97 × elev − 999.46 × slope − 0.52 × twi + 0.74 × lsf + 214.98 × cnbl + 214.93 × cnd + 0.007 × s2_b1 sand sand = 131.28–11.14 × depth + 1.18 × h_half − 10.08 × p_half − 1.19 × h_1 0.60 − 0.05 6.77 0.67 − 1.90 6.10 0.35 − 1.67 9.05 − 3209.47 × elev + 0.55 × aspect − 0.28 × ci − 1.25 × twi + 3208.97 × cnbl + 3208.34 × cnd + 3.43 × vd + 65.90 × rsp − 0.04 × s2_b3 + 0.013 × s2_b4 + 0.02 × s2_b5 − 0.019 × s2_b7 + 0.02 × s2_b9 silt silt = -132.83 + 2.51 × depth − 0.89 × h_half + 15.96 × p_half + 1.66 × h_1 − 0.48 0.00 5.29 0.56 0.30 4.10 0.35 0.21 7.26 2.40 × p_1 + 0.50 × elev − 0.32 × aspect + 1.4 × 10− 7 × planc − 1.93 × twi + 6.17 × lsf − 4.52 × vd − 66.66 × rsp + 0.03 × s2_b1 + 0.004 × s2_b7 total n tn = -0.16 + 0.10 × depth − 0.006 × h_half + 0.04 × p_half + 0.004 × h_1 + 0.56 0.00 0.03 0.66 0.00 0.02 0.22 − 0.00 0.03 3.4 × 10− 10 × profc + 0.006 × lsf + 8 × 10− 4 × cnbl − 6 × 10− 5 × s2_b5 − 3 × 10− 5 × s2_b6 + 8.09 × 10− 5 × s2_b7 soil depth soil depth = -792.51 + 3.36 × h_half − 125.90 × p_half − 6.54 × h_1 + 28.43 0.55 − 0.12 28.79 0.55 0.71 28.95 0.55 − 2.35 28.88 × p_1 + 30.21 × hillshade + 23 × 10− 6 × planc − 4.95 × ci − 24.30 × vd − 397.45 × rsp + 2301.64 × ndvi − 1.25 × s2_b2 + 2.89 × s2_b3 − 0.92 × s2_b4 + 0.66 × s2_b5 − 0.12 × s2_b7 − 0.37 × s2_b8 ap depth ap depth = -9356.31–0.50 × p_1- 0.89 × elev − 2.52 × hillshade + 6138.69 × 0.72 0.01 5.81 0.73 0.12 5.81 0.73 − 0.34 5.67 slope + 8 × 10− 7 × planc − 2 × 10− 7 × profc − 3.69 × ci − 5.02 × lsf − 0.04 × s2_b1 − 0.28 × s2_b2 + 0.10 × s2_b3 + 0.11 × s2_b4 + 0.04 × s2_b5 + 0.003 × s2_b6 + 0.084 × s2_b7 − 0.08 × s2_b8 − 0.10 × s2_b9 + 0.20 × s2_b10 observed when a combination of proximal and remote sensing data and 0.85 and rmse of 0.22 and 0.02% for total c and tn, respectively, using dem (~pss + rs + dem) data were considered and the least accurate pxrf spectra with a random forest model, whereas, o’rourke et al. cluster maps were produced when only dem data was used."
9,"this sug­ (2016) found pxrf spectra effective for prediction of tc (r2 = 0.76, gests that for delineation of subsoil properties a combination of proximal rmse = 0.52 g/kg), clay (r2 = 0.77, rmse = 7.71 g/kg), sand (r2 = and remote sensing and terrain (dem) data could be useful in places 0.79, rmse = 7.96 g/kg), and ph (r2 = 0.43, rmse = 0.65) with a compared to legacy soil maps (ssurgo) and the use of rs and dem data cubist model for validation dataset. only."
9,"when single sensor data were considered, pss performed better plsr is one of the most popular methods that is widely used for than rs, dem, rs + dem, and ssurgo data for subsoil."
9,"hence, pss data spectral calibration and prediction of soil physicochemical properties (from the emi survey) could be useful for delineation of subsoil prop­ with a high degree of accuracy and precision (wold et al., 1983; soriano- erties as it had a larger depth of exploration."
9,"however, the combination disla et al., 2014) and was used in this study."
9,"in our study, the pxrf of pss and rs + dem outperformed the mzs generated with lab-based performed well in predicting sand (r2 = 0.81), silt (r2 = 0.68), and clay soil data."
9,this indicates that mlr models of subsoil may not be content (r2 = 0.64) in the validation dataset (table 5).
9,"soil texture or required when their errors were large and that the unsupervised clus­ particle size distribution characterizes a unique combination of primary tering of pss + rs + dem may be adequate to delineate subsoil and secondary minerals, reflecting the elemental composition of the soil variations. which in turn influences the pxrf spectral composition (zhu et al., 2011; o’rourke et al., 2016)."
9,"in a similar study, stockmann et al."
9,(2016) 4.
9,discussion showed that pxrf spectra can be used for predicting sand (r2 = 0.79) and clay content (r2 = 0.77).
9,the moderate performance for clay and silt 4.1.
9,use of pxrf for predicting soil properties may be attributed to the masking effect due to the large particle size distribution for sand content in this particular study.
9,"however, the pxrf the pxrf showed potential in rapid prediction of sand, tn, oc, silt, sensor may not accurately detect smaller variations within each specific clay, and soil ph with moderate accuracies."
9,previous studies have textural class.
