page,p
9,"for more accuracy in soil texture prediction, other labo­ employed pxrf spectra for predicting soil physical (clay, sand, and silt) ratory methods (e.g., pipette or hydrometer methods) or laser scanning and chemical properties (ph, total c, and tn, cec, and gypsum content) can be employed."
9,"(sharma et al., 2015; wang et al., 2015; weindorf et al., 2016; zhang similarly, organic carbon (oc) and total nitrogen (tn) also have and hartemink, 2019)."
9,"for example, wang et al. (2015) reported r2 of been well predicted from pxrf spectra."
9,this might be due to spectral 9
10,chatterjee et al.
10,catena 201 (2021) 105190 fig.
10,"maps of different soil properties and their standard error at two depths including sand content at 0–10 and 50–60 cm (a, b), standard error of sand content at 0–10 and 50–60 cm (c, d), silt content at 0–10 and 50–60 cm (d, e), standard error of silt content at 0–10 and 50–60 cm (g, h). sensitivity due to carbon and nitrogen content in the soil."
10,"the prediction approach, which could also improve the overall model performance accuracy for carbon and nitrogen can be improved by combining pxrf (o’rourke et al., 2016)."
10,"it is also imperative to include different other with other sensors such as mid-infrared (mir) which has more absorp­ soil-forming factors (e.g. terrain parameters, parent materials, and soil tion features due to fundamental vibrations of molecules (viscarra depth) into the predictive model as these factors influence soil ph rossel et al., 2006)."
10,"similar observations were also reported by wang significantly (teixeira et al., 2020)."
10,in this study the pattern of ph at et al.
10,"(2015), o’rourke et al. (2016), and zhang and hartemink (2019). topsoil and subsoil mostly attributed to patterns of terrain parameters (e."
10,"only a few promising results were reported for the prediction of soil g. slope, twi, and elevation) and soil pedological properties (e.g. soil ph due to its indirect relationship with the pxrf spectra but the cor­ depth, ap thickness) which we discussed in section 4.2 in detail and can relation with other properties (stenberg et al., 2010)."
10,"in our study, the be found in appendix table a and b."
10,we also observed a narrow range of soil ph was poorly predicted with pxrf spectra (validation r2 = 0.51). soil ph in the study area which may be attributed to the poor perfor­ the weaker prediction accuracy with soil ph may be attributed to the mance of the spectrum model.
10,"for better accuracy in soil ph estimation complex nature of the dissociated h+ ion concentration/activity traditional laboratory methods (e.g., ion-selective electrodes, ion- attributed to the expression of ph."
10,the poor performance of the pxrf sensitive field-effect transistors) can be used. spectra for the prediction of soil ph has been reported by some re­ one significance of this study is the ability to predict depths of ap searchers (e.g.
10,"o’rourke et al., 2016; teixeira et al., 2018; teixeira horizons and soil using a combination of proximal and remote sensing et al., 2020)."
10,"however, many researchers used pxrf elemental data to data."
10,similar studies were identified with the use of emi data along a predict soil ph.
10,"for example, sharma et al. (2014) used pxrf elemental hillslope for estimating soil erosion (e.g."
10,"brus et al., 1992; doolittle data in geochem mode to predict ph with reasonable accuracy (r2 = et al., 1994; sudduth et al., 1995)."
10,"however, it is still worth further 0.77, rmse = 0.68), however in our case the elemental data performed investigating the potential of using emi, remote sensing, and/or dem for poorly than the spectra data."
10,similar observations were reported by ap horizon and soil depth delineation given the importance of these zhang and hartemink (2019) who found the poor performance of pxrf variables in soil fertility and hydrological modeling. elemental data for ph prediction (r2 = 0.12 and rmse = 0.62 for validation dataset).
10,"in another study, teixeira et al. (2018) used pxrf spectra to predict soil ph with an r2 of 0.85."
10,"similarly, o’rourke et al."
10,mapping depth-specific soil physiochemical properties at the field (2016) predicted soil ph (r2 = 0.60 and 0.43 for two datasets) with scale using proximal and remote sensing data pxrf spectra.
10,"this performance of the prediction accuracy for soil ph can be improved if other auxiliary predictor variables are included in the the maps of soil physical properties (e.g., sand and silt content) at predictive model."
10,"for example, sharma et al. (2015) included soil two different depths (e.g., 0–10, and 50–60 cm) and the standard error organic matter as a predictor for soil ph."
10,sensor data fusion is another (se) are depicted in fig.
10,"sand content varied significantly throughout the field; however, the northeast and south portion of the field 10"
11,chatterjee et al.
11,catena 201 (2021) 105190 fig.
11,"maps of different soil properties and their standard error at two depths including total ph at 0–10 and 50–60 cm (a, b), standard error of ph at 0–10 and 50–60 cm (c, d), percent total nitrogen at 0–10 and 50–60 cm (d, e), standard error of percent total nitrogen at 0–10 and 50–60 cm (g, h). contained < 45% sand at both depths of interest."
11,"the se maps of sand ap horizon depth, and ndvi (appendix table a)."
11,"at the subsoil depth, content at both depths showed a different trend where maximum se soil ph was negatively correlated with clay content, soil depth, ndvi, (>2.4%) was observed in the grass waterways or less elevated areas used terrain parameters (e.g., twi, vd), and positively correlated with oc, as drainage passage."
11,"the distribution of sand across the field depends on and some terrain parameters (e.g., slope, elevation, cnd, and rsp) many factors such as silt and clay content, elevation, slope, soil depth (appendix table b)."
11,"the pattern of ph and se of ph at both the soil and ap horizon depth, vegetation, the curvature of land (planiform and depths are mostly attributed to patterns of terrain parameters (e.g., profile curvature) which can be visualized from fig."
11,"from appendix slope, twi, and elevation) and soil pedological properties (e.g., soil table a and fig. 3, it can be seen that sand content of topsoil was depth, ap thickness)."
11,"the se of soil ph was larger in grass ways strips significantly negatively correlated with silt, clay, oc, tn, and apparent and low elevated areas which follows the same pattern of some terrain eca data, and positively correlated with slope, cnd, vd, and rsp."
11,"at the parameters (e.g., elevation, slope, twi)."
11,"similar observations were subsoil depth, the percent sand content was significantly negatively recorded with the maps of tn and se of tn at both the soil depths."
11,"the correlated with silt, clay, oc, tn, ap horizon depth, apparent eca data, higher ph at the elevated locations might be attributed to the effects of twi, and lsf (appendix table b)."
11,"the larger se values of sand in the irrigation and rainfall washing away the acid cations from upslope to the grass ways (fig. 5) for both the depths may be attributed to the similar downslope region which is supported by larger twi, soil depth, and ap patterns of terrain parameters (e.g., twi, slope) which played a major thickness at the strips of grass ways."
11,"previous studies have shown that in role in the distribution of sand content across uneven terrain (krav­ depressed terrain features (e.g., valley bottom and grass ways) soils are chenko and bullock, 2000)."
11,similar patterns were observed with the silt richer with nutrients and water than on slopes and upland features content and se maps of silt at both depths (fig.
11,"multiple studies have (hook and burke, 2000). demonstrated that the soil particle size fractions (e.g., sand and silt pedological properties (e.g., soil depth, ap horizon thickness) also content) have a strong relationship with the topographic features such as showed a distinct pattern at the study area which can be visualized from slope, elevation, and surface curvature (kreznor et al., 1989; seibert the maps of soil depth and ap depth including their se maps in fig."
11,"it et al., 2007; laganiere et al., 2010; nie et al., 2019)."
11,"correlations be­ can be shown that the ap depth was higher in the grass ways and strips tween soil particle size fractions and topography can also be caused by and areas with lower elevation (e.g., northeast side of the field)."
11,"from the management practices (e.g., mulching, irrigation, and fertilizer appendix table a, it can be shown that the ap horizon depth was application) that have important roles in the distribution of soil water, positively correlated with twi, lsf, and vd and negatively correlated oc, and tn in crop fields (chatterjee, 2014; chatterjee et al., 2016). with slope, elevation, cnd, and rsp."
11,"the thickness of the ap horizon maps of soil chemical properties (e.g., ph and tn) including their se corresponds to the history of soil formation and management in this maps are illustrated in fig."
11,"the pattern of soil ph at topsoil showed a study area, in which many pedologic and tillage processes (e.g., illuvi­ significant positive correlation with some terrain parameters (e.g., ation, eluviation, erosion, tillage, vegetation) might be attributed to elevation, slope, and cnbl) and a negative correlation with soil depth, such patterns."
11,"in general, the terrain properties (e.g., slope, elevation, 11"
12,chatterjee et al.
12,catena 201 (2021) 105190 fig.
12,"maps of ap horizon depth (a) and standard error of ap horizon depth (b), soil depth (c), and standard error of soil depth (d)."
12,"twi, vd) played a major role in determining the thickness of the ap calculated the sum of within-class variance (σ2w) for different sources of horizon."
12,similar observations were made in the case of total soil depth covariates (table 7).
12,we found that the σ2w for predicting various soil (till bedrock) which has a significant positive correlation with ap ho­ properties using clustering maps generated with a different combination rizon depth.
12,the larger se of ap and soil depth maps in the strips and of input data varied for different soil properties and on the choice of grass ways may be attributed to higher values of those covariates and sensor.
12,"this could be attributed to errors that might be introduced and terrain parameters (e.g., slope and twi) in those regions."
12,previous propagated with covariates usage during the clustering process which studies have shown that soil depth is mostly conditioned by geomor­ resulted in some uncertainty in the cluster maps.
12,"each time a new source phological and topographical features such as slope (delmonaco et al., of secondary data are used for clustering there is a chance of some errors 2003; chan et al., 2019), hillshade (marques and mora, 1992), twi (lee introduced along the clustering process. and ho, 2009), elevation (saulnier et al., 1997), and curvature (heim­ errors in digital maps are mostly originated from the choice of sath et al., 1997). models, covariates, laboratory analysis, and position errors due to gps (heuvelink et al., 2007; nelson et al., 2011)."
12,in similar studies with error analysis various sources of errors were reported for using emi survey 4.3.
12,"cost-benefit analysis (wilson et al., 2005; sudduth et al., 2001; huang et al., 2015), dem and terrain characteristics (skidmore, 1989; chaplot et al., 2006; bishop to understand the accuracy of soil management zones (mzs), we 12"
13,chatterjee et al.
13,catena 201 (2021) 105190 fig.
13,"cluster maps using soil properties maps (a), pss + rs + dem (b), rs + dem (c), only rs (d), only pss (e), only dem (f), and ssurgo database (g)."
13,"table 7 sum of within-class variance for predicting various soil properties using clustering maps generated with different combination of input data, including topsoil and subsoil property maps, proximal soil sensing (pss), remote sensing (rs), and digital elevation model (dem), as well as the ssurgo soil map."
13,soil 0–10 cm 50–60 cm properties soil pss + rs + rs dem pss ssurgo soil pss + rs + rs dem pss ssurgo \input data properties rs + dem properties rs + dem dem dem ph 1.64 1.59 2.09 2.16 2.76 2.81 2.54 2.14 1.79 2.16 2.33 3.00 3.21 2.91 sand (%2) 255.9 456.7 434.4 347.4 523.7 314.3 475.2 290.6 378.8 453.2 368.8 586.6 367.9 452.7 silt (%2) 99.4 156.3 178.0 131.7 168.9 138.8 170.3 350.9 279.4 364.6 413.7 226.8 245.5 283.2 tn (%2) 3.6 £ 5.5 × 4.9 × 5.0 £ 6.2 £ 4.7 £ 5.5 × 5.0 × 4.2 × 5.3 × 6.5 £ 4.0 × 4.0 £ 4.3 × 10¡3 10− 3 10− 3 10− 3 10− 3 10− 3 10− 3 10− 3 10− 3 10− 3 10− 3 10− 3 10¡3 10− 3 soil depth 7411.6 11117.9 6878.7 7008.5 5922.9 9670.1 6692.2 – – – – – – – (cm2) ap depth 421.7 433.9 481.3 418.7 1045.5 573.2 446.5 – – – – – – – (cm2) count (n) 3 1 0 1 1 0 0 1 2 0 0 0 1 0 note: the bold numbers indicate the minimum sum of within-class variance across different combinations of sensor data.
13,"count (n) = number of times the sum of within-class variance recorded minimum for different soil properties and combination of sensor and surveys. et al., 2006), interpolation methods (carrara et al., 1997; xie et al., γ-ray spectrometry data) followed by modeling error."
13,"each sensor has its 2011), and remote sensing data (bishop and mcbratney, 2001; latifovic sensitivity and calibration errors."
13,"remotely sensed data are more error- and olthof, 2004). prone than proximally sensed data."
13,"nevertheless, empirical methods a trade-off exists between the accuracy of maps and the cost of (spectral models) used in digital soil mapping purposes also have errors, collecting data."
13,"there is uncertainty associated with every approach to which can be quantified by using different matrices (e.g., rmse, mae, building models that propagate through the maps of soil properties."
13,the and me).
13,"the larger errors in spectral models may be attributed to the laboratory measured soil properties maps are more accurate as lack of data; therefore, collecting more pxrf spectra data from a diverse compared to sensor derived (e.g., emi, rs, dem) maps as they are less set of soil samples will improve the model performance."
13,"therefore, prone to errors."
13,"for example, huang et al. (2015) analyzed the error future work is required to further address the uncertainty and errors budget for soil salinity mapping using various ancillary covariates and associated with each sensor data, sampling schemes, and modeling found that larger errors were attributed to the input errors (e.g., dem, methods for building predictive models and subsequent map-making 13"
14,chatterjee et al.
14,table 8 cost of the sensor and surveys for measurements of soil properties at laboratory and field surveys.
14,"scenarios hardware /rental preprocessing modeling total time accuracy of cluster maps advantages disadvantages cost /analysis cost cost cost us dollars ($) man 0–10 cm 50–60 cm hrs soil properties 296 6,500 480 7,276 66 high intermediate i) very accurate, detail, and have high i) too costly, labor-intensive, time- high resolution consuming ii) can delineate subsoil properties ii) need site-specific calibration effectively pss + rs + 1,500 1000 500 3,000 60 intermediate high i) no need for local calibration i) relatively costly to implement dem high ii) can delineate subsoil properties ii) associated with higher error rs + dem 500 500 600 1,600 44 low low i) cost effective i) cannot delineate subsoil properties, ii) ii) no need of local calibration larger error rs 100 100 200 4 intermediate low i) no need for local calibration i) coarse resolution 14 – high ii) allows repetitive coverage for a large ii) associated with higher error area ii) cannot delineate subsoil properties iii) relatively cheap dem 500 400 500 1,400 40 intermediate low i) high-resolution data i) relatively expensive high ii) can delineate terrain features of the ii) associated with larger error landscape pss 500 600 300 1,400 16 low intermediate i) allows a larger number of measurements i) relatively costly to implement, high ii) can delineate subsoil properties ii) sensor calibration issue iii) data collection is relatively easy, rapid iii) results are indirect, semi-quantitative, and noninvasive and site-specific ssurgo – 64 150 214 4 low low i) cost effective i) higher uncertainty, can lead to large ii) fast and easy to implement errors ii) include subjective boundaries, iii) low accuracy note: the dualem and pxrf sensor rental costs ($) was considered in the cost of the survey, not the actual costs of the sensors."
14,catena 201 (2021) 105190
15,chatterjee et al.
15,catena 201 (2021) 105190 fig.
15,"schematic diagram of costs of different surveys and respective accuracies of cluster maps generated using a different combination of proximal and remote sensors or legacy soil maps (ssurgo) for soil mapping at 0–10 cm (a), and 50–60 cm (b) depths."
15,"for the magnitude of cost and accuracy, refer to table 8."
15,"(heuvelink et al., 2007; malone et al., 2011; huang et al., 2015). laboratory measurements of soil properties provided the highest accu­ from table 8 and fig. 9 it can be observed that the most accurate racy of the mzs maps, however, the cost of measurements was also the cluster maps (mzs) for topsoil can be generated only using measured soil highest."
15,"contrastingly, for the lower depth, the combination of proximal property maps, however, it is the most costly way as compared to other sensors, dems, and remote sensing data provided the highest accuracy data sources."
15,"in areas where the laboratory measurements are not viable of the mzs cluster maps with a moderate cost of surveys. economically, the other cheap ancillary data can also be used for similar it can be concluded that pxrf spectra can be useful for effective exercises, however, it has a trade-off in accuracy level and errors of prediction of key soil properties (e.g., sand, tn, oc, silt, clay) at maps."
15,"in this study, it is observed that for subsoil depth the combination different soil depths, and a combination of the different sensors provides of proximal and remote sensing data including dem data produced an effective way to delineate soil management zones that are useful for minimum σ2w and maximum accuracy as compared to other ways of decision-making, resource management, and ecological monitoring and cluster analysis."
15,"hence, if end-users want affordable soil surveys then modeling."
15,"further research work is needed for understanding error they may use these maps with some cautions. propagation in multi-sensor data fusion to improve the prediction ac­ error quantification and uncertainty analysis are important for all curacy for important soil properties at the field scale. possible ways of generating cluster maps, nevertheless, the decision depending on the purpose of such maps and perspectives of mapmakers and end-users (malone et al., 2011)."
15,"in this study, we found that the declaration of competing interest ssurgo maps are cheaper but their accuracy is inferior among all the other approaches (table 7)."
15,"from table 8 it can be claimed that for an the authors declare that they have no known competing financial intermediate-high (for topsoil) and high accuracy (subsoil) and a mod­ interests or personal relationships that could have appeared to influence erate economic budget, the combination of sensors (pss + rs + dem) the work reported in this paper. might be a better approach for effective mzs generation, however, laboratory-measured soil properties produced the most accurate maps for topsoil."
15,acknowledgements 5.
15,"conclusions we acknowledge the united states department of agriculture hatch w4188 multi-state research formula fund for providing support for the in this study, pxrf spectra measured in lab conditions were project."
15,"we would like to thank sean sunduk yun, sam steen, maggie employed to predict different soil properties (i.e., ph, clay, sand, silt philips, and jenifer yost from the university of wisconsin-madison and contents, organic carbon, and total nitrogen) with a partial least squares ehsan zare from the university of new south wales for their assistance regression (plsr) method."
15,"other ancillary datasets (e.g., emi, dems, in the field surveys and laboratory analysis of soil samples."
15,"the first and sentinel-2 data) were explored for generating high resolution (~5 author acknowledges the indian council of agricultural research for m × 5 m) soil property maps for different soil depths at field-scale and providing study leave and financial support for his ph.d. studies at the creating effective soil management zones (mzs) and a cost-benefit university of wisconsin-madison, usa. analysis. pxrf spectroscopy with an appropriate modeling method proves to be a good technique for a quick and non-destructive inex­ pensive way to delineate soil properties at the profile scale."
15,"we found data availability statement that pxrf spectra can be effectively used for the prediction of soil texture, organic carbon, and total nitrogen."
15,soil ph was poorly predicted the data for this research work are available from the corresponding from pxrf spectra due to its complex relationship with pxrf spectra. author upon reasonable request.
15,our results show that effective mzs can be delineated using a combi­ nation of proximal and remote sensing datasets coupled with laboratory measurements of important soil properties.
15,appendix a.
15,supplementary material depending upon the choice of sensor or surveys there is a trade-off between cost and accuracy of mzs cluster maps.
15,"for surface soil, supplementary data to this article can be found online at https://doi. org/10.1016/j.catena.2021.105190."
16,chatterjee et al.
16,"catena 201 (2021) 105190 references doolittle, j.a., sudduth, k.a., kitchen, n.r., indorante, s.j., 1994."
16,estimating depths to claypans using electromagnetic induction methods.
16,soil and water conserv.
16,"49 (6), 572–575."
16,"behrens, t., schmidt, k., ramirez-lopez, l., gallant, j., zhu, a.x., scholten, t., 2014."
16,"doolittle, j.a., brevik, e.c., 2014."
16,the use of electromagnetic induction techniques in hyper-scale digital soil mapping and soil formation analysis.
16,"geoderma 213, soils studies."
16,"geoderma 223, 33–45."
16,578–588.
16,"errico, a., angelino, c.v., cicala, l., persechino, g., ferrara, c., lega, m., vallario, a., babaeian, e., sadeghi, m., jones, s.b., montzka, c., vereecken, h., tuller, m., 2019."
16,"parente, c., masi, g., gaetano, r., scarpa, g., amitrano, d., ruello, g., verdoliva, l., ground, proximal, and satellite remote sensing of soil moisture."
16,geophys.
16,"57 poggi, g., 2015."
16,"detection of environmental hazards through the feature-based (2), 530–616. fusion of optical and sar data: a case study in southern italy."
16,remote sens.
16,"36 bezdek, j.c., 1981."
16,pattern recognition with fuzzy objective function algorithms.
16,"plenum (13), 3345–3367."
16,"press, new york."
16,"ferguson, r.b., hergert, g.w., schepers, j.s., gotway, c.a., cahoon, j.e., peterson, t.a., bhaduri, d., chatterjee, d., chakraborty, k., chatterjee, s., saha, a., 2018."
16,bioindicators 2002.
16,site specific nitrogen management of irrigated maize: yield and soil residual of degraded soils.
16,in sustainable agriculture reviews 33 (pp.
16,231-257).
16,"springer, nitrate effects."
16,soil sci.
16,"66, 544–553."
16,"fink, c.m., drohan, p.j., 2016."
16,"high resolution hydric soil mapping using lidar digital bishop, t.f.a., mcbratney, a.b., 2001."
16,a comparison of prediction methods for the terrain modeling.
16,soil sci.
16,"80 (2), 355–363. creation of field-extent soil property maps."
16,"geoderma 103 (1–2), 149–160."
16,"folkman, m.a., pearlman, j., liao, l.b., jarecke, p.j., 2001."
16,february.
16,"eo-1/hyperion bishop, t.f., minasny, b., mcbratney, a.b., 2006."
16,"uncertainty analysis for soil-terrain hyperspectral imager design, development, characterization, and calibration."
16,in: models.
16,information sci.
16,"20 (2), 117–134. https://doi.org/10.1080/ hyperspectral remote sensing of the land and atmosphere, vol."
16,13658810500287073.
16,"optics and photonics, pp."
16,40–51.
16,"brejda, j., moorman, j., smith, t.b., karlen, j.l., allan, d.l., dao, t.h., 2000."
16,"forkuor, g., dimobe, k., serme, i., tondoh, j.e., 2018."
16,landsat-8 vs.
16,sentinel-2: distribution and variability of surface soil properties at a regional scale.
16,soil sci.
16,soc. examining the added value of sentinel-2’s red-edge bands to land-use and land-cover am.
16,"64, 974–982. mapping in burkina faso."
16,giscience & remote sens.
16,"55 (3), 331–354."
16,"bremner, j.m., 1996."
16,nitrogen-total.
16,"methods of soil analysis: part 3 chemical methods, fraisse, c.w., sudduth, k.a., kitchen, n.r., 2001."
16,"delineation of site-specific 5, 1085-1121. management zones by unsupervised classification of topographic attributes and soil brus, d.j., knotters, m., van dooremolen, w.a., van kernebeek, p., van seeters, r.j.m., electrical conductivity."
16,trans.
16,"asae 44 (1), 155."
16,"the use of electromagnetic measurements of apparent soil electrical franzen, d.w., hopkins, d.h., sweeney, m.d., ulmer, m.k., halvorson, a.d., 2002. conductivity to predict the boulder clay depth."
16,"geoderma 55 (1–2), 79–93."
16,"evaluation of soil survey scale for zone development of site-specific nitrogen cambouris, a.n., nolin, m.c., zebarth, b.j., laverdière, m.r., 2006."
16,soil management management.
16,agron.
