page,p
5,"a basic concept spacecraft called na- sectional area of 1.5 m2 and characteristically high drag noeye was proposed with a wedge-shaped front geometry coefficient of 2.7 are selected, but only solar minimum to reduce drag and a propulsion system to provide orbit conditions are assumed for the estimation of atmospheric maintenance and tasking capabilities. density."
5,the solar arrays also do not appear to be in- a later study by shao et al. [62] focused on more clas- cluded in the calculation of the aerodynamic drag.
5,"a fixed sical circular orbits and applied a performance-based cost power efficiency of 40 mn kw−1 is assumed for both the modelling approach to investigate the trade-off between to- ep and abep systems and is not connected to the op- tal system cost for an eo constellation and the operational erational altitude, atmospheric intake characteristics, or orbit altitude."
5,this study indicated that significant cost thruster performance.
5,system models from space mission savings could be made for equivalent system performance analysis and design [44] are used to perform the initial (resolution and coverage) by reducing the orbital altitude spacecraft sizing (wet mass of 1138 kg and solar array area below 500 km.
5,"however, the modelling approach consid- of 41.1 m2 ) and to generate an initial 3d model for the ered only conventional spacecraft designs and did not ex- proposed spacecraft. plore the impact of novel technologies that are currently the use of ep to enable new eo systems in at lower being developed and are applicable to satellites operating altitude has also recently been considered by bertolucci 5"
6,©2020.
6,this manuscript version is made available under the cc-by-nc-nd 4.0 license http://creativecommons.org/licenses/by-nc-nd/4.0/ et al.
6,"in this work, the performance parameters and this study that for the atmospheric intakes considered, a operational considerations for different conventional ep design loop is present between the intake area, thruster systems are analysed for reducing orbital altitude."
6,"ba- inlet area, mass-flow rate, and intake efficiency, such that sic system models are also used estimate the remaining the mass-flow rate and intake efficiency cannot be simul- spacecraft size and mass at different altitude."
6,"a nominal taneously maximised [71–73]. drag coefficient of 2.2 is adopted and the associated cross- in these previous studies, the simplification of the aero- sectional area is determined only from the total mass and dynamic modelling provides an optimistic representation an assumed spacecraft density."
6,the authors conclude that of the satellite drag.
6,"surface area parallel to the nomi- present ep systems could be used to perform drag com- nal oncoming flow has generally been neglected, despite pensation in the upper range of vleo, resulting in satel- being known to contribute to the aerodynamic drag."
6,"if so- lite masses of between two and six times less for the same lar arrays are required to generate the required power for resolution as equivalent systems operating at a higher al- the spacecraft, this can result in a design loop where the titude."
6,"at lower altitude, it is noted that the propulsion area for generating the required power also influences the system performance (i.e. specific impulse) becomes much propulsion system requirements (thrust, efficiency, mass- more critical to successful operations. flow rate, and associated power)."
6,"furthermore, the vari- ation of the oncoming flow direction and satellite atti- 2.1."
6,atmosphere-breathing electric propulsion concepts tude has generally not been considered in these studies.
6,work towards the development of abep systems has in inclined orbits the direction of the oncoming flow vec- also often been accompanied by analysis of the perfor- tor varies periodically during the orbit period due to the mance of a combined intake and thruster with altitude. direction of the atmospheric co-rotation with the earth.
6,concepts for the spacecraft that they may be initially the contribution of thermospheric winds also provides fur- demonstrated on are sometimes also presented.
6,"however, ther and less predictable variations in the true flow vector. in most cases these designs are aimed only at technology thus, unless the spacecraft can always align itself precisely demonstration and therefore do not feature payloads that with the true oncoming flow vector, the drag generated will would be required by commercially-focused satellites. generally be greater than in an idealised attitude."
6,"this is the air breathing ion engine (abie) concept [67, 68] further complicated if off-axis pointing is required to per- is presented as an additional propulsion module that can form mission operations, tracking of the sun vector is re- be attached to the tail end of a long slender spacecraft quired by external solar arrays, or if moving aerodynamic where the atmospheric intake is mounted in an external control surfaces are considered. concentric ring."
6,the system design considers the variation of inlet-to-thruster area ratio and power that is needed 3.
6,system modelling formulation to provide drag-compensation at different altitude.
6,"how- ever, whilst solar electric power is assumed, the studies this work builds on the foundations of system mod- do not address the generation of this power (e.g. body- elling for conventional satellites by incorporating the emerg- mounted or external arrays)."
6,a static drag coefficient of ing technologies that are being developed to enable sus- 2.0 is assumed and the cross-sectional area of the intake is tained operations vleo.
6,"through design- and trade-space neglected in the calculation of aerodynamic drag. exploration, the benefits provided by the emerging tech- the esa ram-ep study [69] provides the first investi- nologies can also be analysed, minimum requirements iden- gation of different thrusting strategies for drag-compensation tified, and their effect on the system-level spacecraft de- (continuous or periodic) and analyses the system perfor- sign observed."
6,"in comparison to previous studies for satel- mance at varying altitude and under different solar activity lites operating in reduced altitude, this work also seeks to conditions."
6,the study also proposes a mission to demon- provide a generalised and flexible approach to the system strate the performance of the propulsion system and to modelling for these technologies that can be applied to the perform eo using a lidar payload.
6,a mass of 1000 kg is development and study of a wide range of system concepts. targeted and a total cross-sectional area of 1 m2 is assumed a system modelling framework for vleo satellite de- with an intake-area of 0.6 m2 .
6,a fixed drag coefficient of sign is first needed that can be integrated with new models 2.0 is stated and the total required area of solar arrays that represent the critical design parameters of the novel calculated as 19.7 m2 .
6,"however, it is not established if the technologies."
6,"the conceptual design of vleo satellites deployed solar arrays are considered in the calculation of can then be explored for different mission profiles, ap- the aerodynamic drag and therefore the required power. plications, and assumptions of technology development."
6,"system analysis for abep concepts is also presented these concepts can subsequently be investigated in co- by schönherr et al. [20] and romano et al. [70] in order to operation with market analysis, stakeholder identification, inform the development of the rf helicon-based ipt [21]. and business modelling work to establish those that pro- a cross-sectional area of 1 m2 and a fixed drag coefficient vide promising economic viability."
6,these results can also of 2.2 were selected and it was assumed that the drag con- be used to influence the development of the novel tech- tribution of solar arrays could be neglected as they would nologies for use in future vleo platforms. be fixed parallel to the oncoming flow.
6,it is also noted in 6
7,©2020.
7,this manuscript version is made available under the cc-by-nc-nd 4.0 license http://creativecommons.org/licenses/by-nc-nd/4.0/ 3.1.
7,multidisciplinary analysis framework also specifically considered as it provides critical infras- the developed framework is shown in figure 2 in the tructure for the spacecraft and is affected considerably form of an extended design structure matrix (xdsm) lambe by the propulsion specification and aerodynamic design. and martins [47].
7,a sequential gauss-seidel multidisci- these fundamental relationships and system models are plinary analysis (mda) process is implemented to resolve detailed in section 3.4.
7,"however, for much of the remain- co-dependencies that exist between some of the individ- ing systems design, relationships and methods for the con- ual analysis functions."
7,in this process each disciplinary ceptual and preliminary design of conventional satellites analysis block is executed in sequence using the external can be adopted from existing literature.
7,a summary of design variables (inputs) and the most recent information the resources used in this work is provided in table 1. from the preceding modules.
7,this process is iterated until the state variables have converged.
7,in the xdsm diagram 3.2.
7,"vleo spacecraft concepts and configurations (figure 2), the thick grey lines represent possible data con- the basic configuration and geometric design of a space- nections whilst the thinner black lines represent the pro- craft is principally driven by the requirements of the pay- cess connections."
7,the mda block (i = 0) distributes the load and the mission it is designed to perform.
7,for eo information to the different subsystem analysis functions spacecraft this typically involves specific pointing require- (i = 1 − 7) and the system-level analysis (i = 8) in the it- ments and may include stability or agility requirements. erative scheme and checks for convergence of the process.
7,"for vleo spacecraft the stability in the presence of aero- the set of input design variables for each analysis is given dynamic forces and torques and the option of performing by xi and output parameters from each analysis function drag compensation are also critical considerations at the given by yi , both reported in figure 2."
7,parameters iden- conceptual design level. tified by yit are target coupling variables (i.e. analysis in- the concept matrix given in table 2 can be used to puts that are derived from prior outputs of the iterative generate different concepts for vleo platforms.
7,"combi- scheme). nations of the different options in each row will produce by varying the input parameters to this mda process conceptual spacecraft designs, some of which will be con- and the internal analyses, parametric design space explo- siderably different to each other."
7,"other combinations may ration can be performed, allowing investigation and iden- be infeasible or irrational due to incompatibilities between tification of the trade-offs associated with different system the selected options, for example a tumbling spacecraft requirements, environmental conditions, design decisions, with a continuously-thrusting propulsion system for drag or technological capabilities and performance."
7,"whilst not compensation. implemented in the current study, this approach has also in vleo a propulsion system may be required to pro- been developed to be compatible with multi-disciplinary vide a useful lifetime."
7,"if the aerodynamic drag is to be optimisation processes, including both single- and multi- compensated for, thrust should be provided opposite to objective methods, enabling directed or “intelligent” search the velocity vector with associated constraints on the plat- for an optimal design or sets of optimal designs based on form configuration."
7,"furthermore, if an abep system is to defined ranges and/or constraints for different input vari- be used to enable sustained operations, the intake should ables. face the oncoming flow direction to provide maximum ef- for vleo platforms, new analysis components are prin- ficiency. cipally required within i) the propulsion module to incor- a surface area for power raising using solar cells is porate the novel abep concepts, ii) the geometry, struc- necessary to provide sustained operational performance. ture, and mechanisms module to account for the aerody- body-mounted solar cells are preferred to avoid increment namic performance of the external spacecraft configura- in the experienced drag but deployed solar arrays may be tion, and iii) the guidance, navigation, and control module required to meet increased power demands, particularly if aerodynamic control manoeuvres are to be considered. if ep or abep systems are to be used."
7,"furthermore, this paper aims to exploring the platform trade-offs the orientation of the sun with respect to the orbit and associated with the development and integration of new satellite may mean that body mounted solar cells may technologies that can enable sustained operations at lower not all be simultaneously illuminated or operating at their altitude."
7,"as such, the developed analyses are focused on full efficiency."
7,the orientation of non-body-mounted solar the use of circular or near-circular orbits in vleo.
7,"the arrays therefore requires careful consideration to balance design of multi-satellite systems or constellation configu- their power generation capability with their contribution rations to achieve a given performance with respect to re- to aerodynamic drag. visit time or coverage is also not be treated in the present the centre of mass of the spacecraft and relative loca- work. tion of any deployable or extended surfaces also requires given the benefits of operating in vleo for eo mis- careful consideration to ensure stability and control of the sions, the design of the payload, attitude determination platform, particularly in the presence of potentially dis- and control system (adcs), and communications subsys- turbing aerodynamic and solar radiation perturbations."
7,"in tem are of interest and require some adaptation for plat- vleo, the geometric design of the satellite can be used to form design in lower altitude orbits."
7,the power system is provide aerostability.
7,"however, this may simultaneously 7"
8,©2020.
8,"this manuscript version is made available under the cc-by-nc-nd 4.0 license http://creativecommons.org/licenses/by-nc-nd/4.0/ figure 2: xdsm representation of the multidisciplinary analysis (mda) framework for vleo satellite design. yt x1 x2 x3 x4 x5 x6 x7 0, 9 → 1: 1 : yt2 3 : yt4-8 mda 1: y1 9 : y1 mission 4 : y1 5 : y1 6 : y1 7 : y1 8 : y1 & constellation y2 9 : y2 2: 3 : y2 4 : y2 7 : y2 8 : y2 payload 3: y3 9 : y3 geometry, 5 : y3 6 : y3 8 : y3 structure, and mechanisms y4 9 : y4 4: 7 : y4 8 : y4 communications 5: y5 9 : y5 guidence, 7: y5 8 : y5 navigation, and control y6 9 : y6 6: 7: y6 8 : y6 propulsion 7: y7 9 : y7 electrical power 8 : y7 system y8 9 : y8 8: system-level input variables output parameters x1 orbit type, lifetime y1 altitude, revisit, eclipse period resolution(s), wavelength, pixel size, quality payload dimensions, payload power, payload y2 factor, quantization, payload duty cycle, mass, downlink rate x2 compression ratio, off-nadir pointing, boresight moments of inertia, centre of mass, angle y3 aerodynamic reference area, srp reference material properties, safety factors, vibration area, drag coefficient, structure mass x3 profile, load factors communications mass, communications y4 architecture, minimum elevation, latitude, power, antenna size x4 frequency, snr, downlink rate, bandwidth y5 gnc power, gnc mass pointing accuracy, pointing knowledge, slew thruster power, thruster mass, intake x5 y6 rate, slew time size/mass2 propulsion system type, thruster mode, y7 solar array area/mass, battery mass x6 thruster efficiency, specific impulse, intake area ratio1 , intake duct ratio1 , intake back ratio1 total system mass, total system power, y8 total system cost array efficiency, array specific performance, x7 eclipse efficiency, sunlit efficiency, depth of discharge, specific energy density 1 defined if abep is specified for design."
9,©2020.
9,this manuscript version is made available under the cc-by-nc-nd 4.0 license http://creativecommons.org/licenses/by-nc-nd/4.0/ table 1: summary of conventional system modelling resources.
9,"module calculation references coverage [45] 1: mission and constellation revisit [74] eclipse [75] 2: payload field of view [45, 75] 3: geometry, structure and mechanisms structural mass [45] 4: communications link budget [45] disturbance torques [45] 5: guidance, navigation and control actuator sizing [45, 76] 6: propulsion propellant tank sizing [77, 78] 7: power battery and array sizing [45] 8: system cost-estimating relationships [45, 79] table 2: vleo satellite concept development matrix."
9,options propulsion chemical electric abep none drag compensation continuous periodic none material gsi current (diffuse) novel (quasi-specular) stability three-axis aerostable spinning tumbling control internal actuators control surfaces mixed payload static steerable hybrid end of life none additional/existing device reduce the agility of the satellite and the ability to point drag [80].
9,"the magnitude of this potential reduction is away from the oncoming flow direction, for example if pay- dependent on the angle with respect to the flow and the load pointing is required away from the nominal aerostable gsi properties of the materials on the external spacecraft attitude."
9,alternative approaches to payload design may surfaces.
9,"the useful internal volume of such geometric be able to compensate for such designs, for example us- configurations, the corresponding effect on stability, also ing steerable optical assemblies that reduce the need for and whether the forward and aft facing surfaces are re- attitude control manoeuvres to perform off-axis target ac- quired for other purposes (e.g. thrusters and atmospheric quisition. intakes) also requires consideration."
9,"a key aim of most geometric designs for vleo is to in vleo, end of life deorbit is naturally enabled and reduce the aerodynamic drag experienced by the satel- quickly realised as a result of the increased aerodynamic lite."
9,slender spacecraft configurations are therefore recom- drag.
9,"however, if very low-drag platforms are realised us- mended as the projected area (i.e. cross-sectional to the ing novel aerodynamic materials, active methods of deor- flow) is minimised and the remaining area is parallel to or bit may still be needed to avoid unnecessary occupation shielded from the flow, reducing drag."
9,such configurations of orbits by non-operational spacecraft that could con- are also suited to providing natural aerostability.
9,"however, tribute to an increased risk of collision."
9,"targeted re-entry alternative configurations can also be considered, including may also be necessary for very large vleo spacecraft that those that use attitude actuators to provide conventional are challenging to “design-for-demise” and may not com- three-axis control, make use of neutral stability providing pletely disintegrate during re-entry, presenting a risk of high agility, or are equipped with external control surfaces casualty or damage at ground level. that can enable aerodynamic orbit and attitude control."
9,the use of surfaces that are angled with respect to 3.3.
9,conceptual vleo satellite configuration the nominal oncoming flow may be used to mitigate the conceptual configurations of satellite platforms can be effects of aerodynamic forces and reduce the experienced useful in informing the development and implementation 9
10,©2020.
10,this manuscript version is made available under the cc-by-nc-nd 4.0 license http://creativecommons.org/licenses/by-nc-nd/4.0/ angle of the sun with respect to the spacecraft.
10,system models for vleo spacecraft system models with a significant dependence on orbital altitude or that are of particular interest in the vleo altitude range are outlined in the following subsections.
10,models for the state-of-the-art and emerging technologies that may contribute to the development of novel vleo platforms are also described.
10,3.4.1.
10,eo payload sizing the basic payload design relationships for eo plat- forms operating in vleo do not differ substantially to those of conventional eo satellites in principle.
10,"however, figure 3: representative concept geometry for a slender “arrow-like” spacecraft. the configuration, orientation, and compactness of the pay- load with respect to the spacecraft geometry may be a lim- iting factor on the aerodynamic performance."
10,"for a typical of the new system models and analyses for vleo tech- optical payload, the minimum aperture diameter d to pro- nologies."
10,"a slender “arrow-like” configuration, shown in vide a given diffraction limited ground resolution distance figure 3, has been adopted in this work."
10,"an analogous grd can be approximated by considering the range r to configuration was used operationally in vleo previously the target and the wavelength λ of interest. by the goce spacecraft, albeit without the abep intake."
10,the proposed “skimsat” platform also exhibits features of λr d ≈ 1.22 (1) this basic configuration [64].
10,grd this geometry is designed to be nominally aligned length- the required focal length f can similarly be calculated wise with the velocity vector and therefore close to the from the altitude hφ and the physical size of the detector direction of the oncoming flow.
10,"as a result, this configu- elements x. ration has a relatively low cross-sectional area with the aim r2 x f= (2) of reducing the experienced drag."
10,"given this nominal at- grd hφ titude, this configuration is also generally compatible with a range of different configurations for optical assem- both ep and abep systems as the thruster can be ap- blies can be considered that have various advantages and propriately aligned with the oncoming flow direction."
10,"the characteristics for high resolution imaging, e.g. number of front (ram) facing surfaces of the spacecraft can also be mirrors, mechanical tolerances, compactness, and stabil- used to accommodate an atmospheric intake, if required, ity."
10,"examples include korsch, three mirror anastigmatic or tapered to further reduce the aerodynamic drag if per- (tma), and catadioptric designs [81, 82]."
10,"to capture the mitted by the material gsis. compactness of these different assembly types, a geomet- extended surfaces, oriented parallel to the length of ric reduction factor can be used, avoiding the need to de- the satellite body, can be utilised for power raising pur- velop a complete telescope design to estimate the axial di- poses whilst minimising the increment in drag force."
10,"when mension and volume of the payload from the focal length located behind the centre of gravity, these surfaces can and diameter."
10,the mass of an optical payload can sub- also contribute to natural aerodynamic stabilisation of the sequently be estimated heuristically by using sizing rela- spacecraft.
10,active control surfaces may also be considered tionships (i.e. mass density) informed by existing satellite for the purpose of aerodynamics-based attitude and orbit imaging systems.
10,"the corresponding power required by control manoeuvres. such a payload can either be estimated similarly from ex- to achieve the best propulsive efficiency, pointing of isting systems using a power density relationship or can the spacecraft away from the velocity vector in pitch and be set a priori based on knowledge of the required perfor- yaw should be avoided."
10,"payloads that can be operated in a mance of the payload (e.g. spectral capability or on-board fixed orientation are therefore most suitable, though point- data processing and storage). ing in roll can be permitted without increasing drag or for a sar instrument the minimum required antenna compromising the propulsive performance."
10,"alternatively, area and maximum antenna length can be calculated prin- the use of steerable optical or radar payloads can be con- cipally from resolution requirements and ambiguity con- sidered to provide more flexible observational performance. straints [83, 84]."
10,"the minimum width of the antenna a similar compromise for any extended solar arrays exists can subsequently be determined, though a larger area and between the increase in drag and alignment with the solar width may be desired to provide a design margin."
10,the vector for maximum power-raising performance.
10,this is average power required by the sar antenna psar can be principally dependent on the orbit geometry and relative calculated using equation (3) from the range resolution 10
11,©2020.
11,"this manuscript version is made available under the cc-by-nc-nd 4.0 license http://creativecommons.org/licenses/by-nc-nd/4.0/ 0 δr , range r, antenna area aant , and sensitivity σne given efficiency solar cells help to reduce the solar array area as the noise-equivalent sigma-zero (nesz): and therefore reduce contributions to aerodynamic drag and the thrust requirement."
11,high specific power of solar 8πkb tr nf r3 v λls psar = (3) arrays and increased energy density of batteries will also 2 δ σ0 a2ant ηant r ne contribute to a reduction in system mass. where kb is boltzmann’s constant and v is the satellite orbital velocity.
11,in the early design phase assumption of 3.4.3.
