page,p
1,system modelling of very low earth orbit satellites for earth observation n.h.
1,"crispa,∗, p.c.e."
1,"robertsa , f."
1,"romanod , k.l."
1,"smitha , v.t.a."
1,"oikoa , v."
1,"sulliotti-linnerb , v."
1,"hanessianc , g.h."
1,"herdrichd , d."
1,"garcı́a-almiñanae , d."
1,"katariaf , s."
1,"seminarig a the university of manchester, oxford road, manchester, m13 9pl, united kingdom b elecnor deimos satellite systems, calle francia 9, 13500 puertollano, spain c gomspace a/s, langagervej 6, 9220 aalborg east, denmark d institute of space systems (irs), university of stuttgart, pfaffenwaldring 29, 70569 stuttgart, germany e upc-barcelonatech, carrer de colom 11, 08222 terrassa, barcelona, spain f mullard space science laboratory, university college london, holmbury st."
1,"mary, dorking, rh5 6nt, united kingdom g euroconsult, 86 boulevard de sébastopol, 75003 paris, france arxiv:2108.01945v2 [physics.space-ph] 5 aug 2021 abstract the operation of satellites in very low earth orbit (vleo) has been linked to a variety of benefits to both the spacecraft platform and mission design."
1,"critically, for earth observation (eo) missions a reduction in altitude can enable smaller and less powerful payloads to achieve the same performance as larger instruments or sensors at higher altitude, with significant benefits to the spacecraft design."
1,"as a result, renewed interest in the exploitation of these orbits has spurred the development of new technologies that have the potential to enable sustainable operations in this lower altitude range."
1,"in this paper, system models are developed for (i) novel materials that improve aerodynamic performance enabling reduced drag or increased lift production and resistance to atomic oxygen erosion and (ii) atmosphere-breathing electric propulsion (abep) for sustained drag compensation or mitigation in vleo."
1,attitude and orbit control methods that can take advantage of the aerodynamic forces and torques in vleo are also discussed.
1,these system models are integrated into a framework for concept-level satellite design and this approach is used to explore the system-level trade-offs for future eo spacecraft enabled by these new technologies.
1,a case-study presented for an optical very-high resolution spacecraft demonstrates the significant potential of reducing orbital altitude using these technologies and indicates possible savings of up to 75 % in system mass and over 50 % in development and manufacturing costs in comparison to current state-of-the-art missions.
1,"for a synthetic aperture radar (sar) satellite, the reduction in mass and cost with altitude were shown to be smaller, though it was noted that currently available cost models do not capture recent commercial advancements in this segment."
1,these results account for the additional propulsive and power requirements needed to sustain operations in vleo and indicate that future eo missions could benefit significantly by operating in this altitude range.
1,"furthermore, it is shown that only modest advancements in technologies already under development may begin to enable exploitation of this lower altitude range."
1,"in addition to the upstream benefits of reduced capital expense and a faster return on investment, lower costs and increased access to high quality observational data may also be passed to the downstream eo industry, with impact across a wide range of commercial, societal, and environmental application areas."
1,keywords: very low earth orbit (vleo); atmosphere-breathing electric propulsion (abep); aerodynamic control; very-high resolution; synthetic aperture radar (sar); earth observation (eo).
1,"introduction food security, and disaster management and response [1]."
1,"the commercial market for satellite-based eo data prod- satellite-based earth observation (eo) and remote sens- ucts has also grown considerably, principally serving sec- ing has evolved considerably in the six decades since its tors such as defence and security, infrastructure monitor- introduction and has become increasingly important as a ing, land management and precision agriculture, and man- field with global scientific significance, economic impact, agement of energy and mining activities."
1,revenue from and commercial value.
1,"in addition to improving our un- these products is projected to increase from $1.5 billion to derstanding of the earth and its natural systems, key ap- $2.4 billion in the decade to 2028 with increasing demand plications with societal and environmental impact include for higher resolution imagery [2]."
1,"constellations of smaller climate change and ecological monitoring, agriculture and satellites for eo have recently enabled and global coverage and more frequent revisit, contributing to increased avail- ∗ corresponding author. ability and a reduction in price of medium and high reso- email address: nicholas.crisp@manchester.ac.uk lution satellite imagery and resulting in significant growth (n.h."
1,crisp) preprint submitted to acta astronautica
2,©2020.
2,"this manuscript version is made available under the cc-by-nc-nd 4.0 license http://creativecommons.org/licenses/by-nc-nd/4.0/ in downstream value-added services and analytics market international space station (iss), scientific satellites (e.g. segments."
2,"further economic upside has been projected goce and grace), and small educational and technology based on the development and growth of new application development satellites (e.g."
2,cubesats).
2,"early satellites areas, for example in change-detection analytics serving of the planet labs flock and spire lemur constellations the financial sector and the development of new location- were also deployed into the vleo altitude range from the based services [2]."
2,"however, more recent operations have generally seen operating satellites at lower orbital altitude has been replacements launched into higher altitude orbits."
2,"the proposed as a means to support the growth in this mar- reason for this sparse usage of vleo, particularly for com- ket by reducing both the cost of satellite development and mercial operations, is largely due to the challenges of the launch and through the generation of higher resolution im- environment that can significantly reduce the mission per- agery [3–6]."
2,reducing orbital altitude below those conven- formance.
2,"principally, the increased atmospheric density tionally used offers a number of individual benefits that increases aerodynamic drag and causes a significant reduc- together can significantly improve the design and perfor- tion in orbital lifetime without the use of propulsion."
2,"the mance of satellites, particularly for remote sensing and eo presence of atomic oxygen further reduces aerodynamic applications."
2,these benefits can be summarised as follows performance and can erode and damage the external sur- [7]: faces of spacecraft.
2,the recent development of a number of new technolo- • optical payloads increase in resolution or can reduce gies aims to address these challenges to enable the sustain- in aperture size resulting in either improved perfor- able operation of spacecraft in vleo.
2,"these technologies mance or smaller size and mass. principally include: i) novel materials that reduce aero- • radiometric performance also improves with reduc- dynamic drag and are resistant to atomic oxygen erosion, ing distance to the target or ground, allowing im- ii) atmosphere-breathing electric propulsion (abep) for provement of signal-to-noise ratio or reduced instru- drag compensation or mitigation in vleo, and iii) aero- ment sensitivity."
2,"this also applies to radar and com- dynamic attitude and orbit control methods. munications payloads leading to improved link bud- this paper aims to explore the use of these novel tech- gets, reduction in power, and smaller antenna areas. nologies being developed to enable operations at reduced orbital altitude and their impact on the design of future • lower altitude orbits are naturally resilient to a build- vleo spacecraft for eo missions."
2,"to perform this inves- up in debris due to the effects of drag and therefore tigation, system models incorporating vleo technologies have a lower risk of on-orbit collision. have been developed and integrated into a design frame- work for concept-level spacecraft design."
2,"using the devel- • the same effect of drag ensures that spacecraft are oped scheme, the system-level trade-offs associated with naturally disposed of quickly after their mission is these technologies can be illustrated and their variation complete or if they suffer a catastrophic failure."
2,ad- with orbital altitude understood.
2,"the effect of assumed ditional deorbit devices are therefore not required, performance on the system-level design can also be demon- reducing system mass and complexity. strated, leading to insight into the requirements of these • launch vehicles can deliver a larger mass into lower technologies for improving spacecraft design for vleo. altitude orbits, reducing the specific (per unit mass) the results of these investigations will be used to inform launch cost and possibly providing greater versatility the ongoing research in this area and the development in launch options. of these technologies and future spacecraft operating in vleo."
2,"• mapping errors as a result of attitude determination and pointing accuracy are reduced at lower altitude, 1.1."
2,the very low earth orbit (vleo) environment improving the geospatial accuracy of ground imagery as altitude in low earth orbit (leo) is reduced the and location-based services. density of the residual atmosphere increases due to the • use of commercial off-the-shelf (cots) electronics effect of gravity and hydrostatic pressure as shown in fig- components may be enabled as a result of reduced ure 1.
2,"the aerodynamic drag force experienced by ob- radiation exposure and dosing in the denser atmo- jects in lower altitude orbits therefore increases, causing sphere, reducing cost and the need for redundancy. faster orbital decay and eventually atmospheric re-entry and demise."
2,"without the use of a propulsion system that however, despite these benefits, altitudes below 450 km, can compensate for or mitigate the experienced drag, this known as very low earth orbit (vleo), have not been causes spacecraft at very low altitude to have significantly frequently utilised for commercial eo operations."
2,"some shorter orbital lifetimes compared to higher altitude or- military satellites, for example in the keyhole program, bits."
2,"however, in order to perform drag compensation or have been reported to use eccentric orbits with very-low mitigation the spacecraft must be launched with or re- perigees to obtain high resolution surveillance imagery [8]. supplied with sufficient propellant."
2,"notable examples in- in recent times, vleo has also been populated by the clude the iss, which maintains an approximately 400 km 2"
3,©2020.
3,"this manuscript version is made available under the cc-by-nc-nd 4.0 license http://creativecommons.org/licenses/by-nc-nd/4.0/ orbit through propellant provided by frequent resupply pointing and stability requirements, highly capable atti- missions, and goce that was able to sustain its orbit tude actuators may be needed to compensate for these for over 4 years at altitudes below 280 km and as low as effects and ensure the ability to accurately point towards, 229 km using an highly capable ion propulsion system [9]. track, and capture a given target."
3,"despite this increase in atmospheric density, the resid- ual atmosphere in vleo is still highly rarefied."
3,above 1.2.
3,emerging technologies for vleo altitudes of approximately 150 km the flow condition for a range of fundamental research and technology de- orbiting spacecraft of typical length scale (∼1 m) is con- velopment is underway to address these critical challenges sidered to be free molecular (kn  10) [11].
3,in the free associated with the environment and enable sustained op- molecular flow (fmf) regime aerodynamic forces are prin- erations in vleo. cipally generated by the direct interaction between the research into novel materials for orbital aerodynamics particles in the flow and the external spacecraft surfaces is aiming to identify those that are resistant to the detri- as interactions between the constituent particles are in- mental effects of atomic oxygen and demonstrate spec- frequent by comparison and can therefore be neglected. ular or quasi-specular gsi properties.
3,"when combined these gas-surface interactions (gsis) are dependent on with the design of the spacecraft external geometry (i.e. the energy and momentum exchange that occurs between forward-facing surfaces oriented at shallow angles to the the incoming particle and the surface, and are known to oncoming flow), materials with these properties would ex- vary depending on the properties of the incoming particles perience lower drag in orbit and would therefore increase (mass, velocity, angle, temperature) surface characteristics the orbit lifetime."
3,"alternatively, if oriented towards the (roughness, contamination, composition, and morphology) normal to the oncoming flow, these materials increase the [12]."
3,the estimation of aerodynamic forces under these experienced drag and can be applied to the design of im- conditions can be calculated using a range of different gsi proved deorbit devices.
3,"these materials would also be models, reviews of which are provided by mostaza-prieto able to generate lift forces of increased magnitude enabling et al. [13] and livadiotti et al."
3,[14]. novel methods of aerodynamic attitude and orbit control.
3,"in combination with the increasing density and orbital the ongoing development of space propulsion systems velocity, the prevalence of highly-reactive atomic oxygen at is highly relevant to vleo spacecraft."
3,"efficiency increases these altitudes, shown in figure 1, can also damage and of electric propulsion (ep) systems will reduce the power erode materials on the external surfaces of spacecraft, de- and propellant requirements for drag compensation or mit- grading both the aerodynamic performance and affecting igation."
3,"beyond this, the development of novel atmosphere- optical sensors, thermal coatings, and solar-cell cover-glass breathing electric propulsion (abep) systems would en- [15]."
3,"in addition to this erosive damage, atomic oxygen able theoretically sustainable operation in vleo, limited also adsorbs to the external spacecraft surfaces causing only by component lifetime."
3,such concepts propose the use surface contamination and further affecting the gsi pa- of a forward-facing intake that collects propellant from the rameters.
3,"for typical materials in the vleo environment, residual atmosphere and can subsequently be used by an diffuse reflection with complete thermal accommodation is electric thruster, eliminating the need for the spacecraft generally assumed, primarily as a result of atomic oxygen to carry or be launched with any propellant."
3,the devel- erosion and surface adsorption [16].
3,"as a result of this opment of abep systems is currently focused on the de- energy and momentum exchange, the main aerodynamic sign of intakes that can efficiently collect the required pro- force generated is drag and is principally dependent the pellant from the atmosphere under the fmf conditions projected cross-sectional area rather than the more de- in vleo [19] and the development of electric thrusters tailed spacecraft geometry."
3,"however, at higher altitude that can flexibly utilise the range of different atmospheric reduced atomic oxygen adsorption has been observed and gas constituents at varying density that will be collected, incomplete energy accommodation and quasi-specular par- whilst remaining resilient to erosion or degradation by ag- ticle re-emission can be considered [12, 17]. gressive atmospheric species [20]."
3,"electrodeless and grid- the atmospheric density experienced at a given al- less thruster concepts that do not require direct contact titude can also vary considerably, principally with geo- with the atmospheric gas therefore demonstrate good po- graphic position (e.g. latitude and longitude), the day- tential for use in vleo, for example the rf helicon-based night cycle, and the approximately 11-year cycle of solar inductive plasma thruster [21]."
3,such a design benefits from intensity [18].
3,this variation from high to low solar ac- the quasi-neutral plasma flow that eliminates the need for tivity level is shown in figure 1 and can be seen to span a neutralizer.
3,"for non-quasi-neutral thrusters, operation several orders of magnitude above approximately 100 km. with the residual constituents of the atmosphere has not similarly, the direction of the oncoming flow can vary yet been solved. as a result of atmospheric co-rotation and thermospheric the development of abep may also facilitate the use winds."
3,"when combined with the external spacecraft geom- of novel orbit control methods that may help to overcome etry and configuration, these effects can generate disturb- the drawbacks of vleo with regards to increased revisit ing forces and torques that can effect the satellite stabil- time and generally poor coverage properties."
3,methods for ity and pointing capability.
3,for eo satellites with strict low-thrust trajectory design have been developed to reduce 3
4,©2020.
4,"this manuscript version is made available under the cc-by-nc-nd 4.0 license http://creativecommons.org/licenses/by-nc-nd/4.0/ n ar figure 1: representative variation of atmospheric density and composition with solar activity level and altitude in leo, calculated using the nrlmsise-00 model [10]. the overflight or revisit time of a set of given ground targets in the form of trim and momentum management has only from low altitude orbits guelman and kogan [22], co and been demonstrated on magsat [42, 43])."
4,"this is princi- black [23], guelman and shiryaev [24]."
4,"with abep, the pally due to the low lift-to-drag ratio that is achievable constraint of limited propellant can be removed, and such with current materials and the high uncertainties associ- control may be extended to include small out-of-plane ma- ated with knowledge of the oncoming flow density and ve- noeuvres and applied throughout the entirety of a mission. locity, leading to low expectations on control performance."
4,"progress towards methods for autonomous and real-time without further generalised study, implementation, and control may further facilitate their use in the operation of demonstration of such control methods, modelling of their future vleo constellations. system-level requirements, trade-offs, and effects with re- new methods of attitude and orbit control that utilise spect to conceptual designs is difficult and is beyond the aerodynamic forces and torques are also being developed. scope of this current study."
4,"as development continues proposals for orbit control include constellation deploy- and initial on-orbit demonstrations are performed, con- ment [25], formation keeping [26, 27], rendezvous [28, 29], cepts and methods of aerodynamic control can be inte- inclination correction for sun-synchronous orbits [30], and grated into future studies of vleo platform design."
4,"key atmospheric re-entry interface targeting [31, 32]."
4,"aerody- trade-offs associated with the implementation of aerody- namics attitude control has also been proposed for point- namic control are expected to include actuator size, mass, ing and momentum management manoeuvres that assist and configuration, pointing performance and momentum and reduce the requirements on traditional attitude ac- control/dumping capability, and power requirements."
4,"in tuators [33–36], with the potential for reducing system the wider system design, the corresponding reduction in mass."
4,"aerodynamic trim manoeuvres can also be consid- traditional attitude or orbit control actuator requirements ered to directly reject external disturbances, for example and the drag increment associated with the aerodynamic as a result of variations in the oncoming flow direction, control implementation should also be considered. solar radiation pressure, and residual magnetic dipole in- teractions."
4,such control may be particularly relevant at 2.
4,system modelling for reducing altitude in leo very low altitude where aerodynamic torques may cause the rapid saturation of momentum-based actuators.
4,"how- system modelling for satellites and orbital space sys- ever, at present only orbit control methods utilising dif- tems has been developed over a number of years, the ba- ferential drag for collision avoidance [37, 38] and constel- sics of which are well established in texts such as wertz lation deployment/maintenance [39–41] have been demon- and larson [44], wertz et al. [45], and fortescue et al. strated in-orbit."
4,"similarly, aerodynamic attitude control [46]."
4,these system models allow engineers to investigate 4
5,©2020.
5,this manuscript version is made available under the cc-by-nc-nd 4.0 license http://creativecommons.org/licenses/by-nc-nd/4.0/ different designs and synthesise solutions in the early de- in vleo. sign process.
5,"exploration of the design- and trade-spaces, concept missions for vleo have also developed by de- often by parametric or optimisation processes, can also sign teams at cranfield university [63]."
5,"a satellite based be performed to improve knowledge of the trade-offs be- on the sstl-300 platform operating between 300 km to tween different input variables, subsystem specifications, 500 km was designed to be implemented in the near-term, and output parameters."
5,this exploration can also facili- providing enhanced resolution predominantly by reducing tate the identification and selection of promising or opti- the orbital altitude of operation.
5,different propulsion sys- mal solutions that can subsequently be taken forward for tems were chosen depending on the selected altitude to further investigation and into more detailed design phases. provide a mission lifetime of 5 years.
5,"a more ambitious the selection, integration, and configuration of the sys- spacecraft called thor (thermospheric orbital recon- tem/subsystem models is specific to the mission, concept naissance) was also developed to operate in a 227 km sun- of operations, and application area of the system of inter- synchronous orbit (sso) and provide 0.15 m resolution est."
5,"however, general approaches to complex and multi- optical imagery."
5,drag-compensation was provided by an disciplinary systems engineering can be used to inform the ep system and the geometry was designed to reduce drag development of an appropriate framework and the organ- and provide natural aerostability.
5,internal steerable optics isation of the contributing models [47].
5,"within the disci- were considered to provide some off-nadir pointing perfor- pline of space systems, application of such system mod- mance. elling is widespread with differing levels of integration and the “skimsat” has been proposed by thales alenia scope, e.g. at system level [48–52], constellation design space [64]."
5,"this concept is designed to be deployed into [53, 54] and deployment [55, 56], propulsion systems [57– eo constellations in vleo as low as 160 km in altitude, 59], and communications architecture [60]."
5,"however, given benefiting from the reduction in payload size and mass the challenges of operating spacecraft in low altitude or- with altitude."
5,"the spacecraft geometry suggests that it bits, to date only a limited number of studies have ap- has been designed for operation in the aerodynamic en- proached the system modelling of spacecraft intended for vironment of vleo and remarks are made regarding use operation in vleo. of abep for drag compensation."
5,"however, whilst some the design of remote-sensing satellites operating in discussion of the key system trade-offs is provided, de- lower altitude orbits was studied by fearn [61] with a par- tails of the underlying system design has not yet been ticular focus on drag compensation using ep."
5,the system- presented.
5,"similar concepts are also being developed by level trades in propulsive, power system, and payload de- emerging companies such as earthobservant and skeyeon sign with altitude were principally considered for a mission demonstrating a growing interest from industry in vleo with a 5 year lifetime."
5,the design of a concept spacecraft operations. providing 1 m resolution imaging was presented with an mccreary [65] presents a traditional systems engineer- operational altitude between 250 km to 280 km and wet ing approach to the development of a satellite mission con- mass of less than 300 kg.
5,"whilst the presented design sug- cept for operation in the high drag environment of vleo. gested the near-term feasibility of such a concept, chal- the initial needs analysis is performed principally for us lenges such as the required solar array performance and scientific, military, and academic stakeholders and used to sensitivity to on-orbit solar illumination were noted. develop a sample set of system requirements."
5,the use of a review of the benefits of moderately-elliptical very- both a fight-proven ep system with stored propellant and low orbits (mevlos) was provided by wertz et al.
5,[3]. an abep system are considered to provide redundancy in this work the propellant required to maintain differ- and allow for initial operational learning at the beginning ent low-perigee orbits was explored for the purpose of en- of the mission before the abep system is given full re- abling high-resolution imaging from a smaller and cheaper sponsibility for drag-compensation.
5,a maximum cross- satellite platform.
