page,p
11,"aerodynamic performance the antenna efficiency ηant , noise factor nf , receiver noise estimation of the satellite aerodynamic performance is temperature tr , and system losses ls are also generally critical in vleo as it is required to either determine the necessary. lifetime of the spacecraft before deorbit, the propulsive and the mass of the sar instrument can be approximated power requirements to mitigate or compensate the drag using a value of area density determined from similar in- and extend or sustain the mission, or to determine the struments."
11,"however, the instrument design and mass are capability of the satellite to perform aerodynamic attitude related to a number of other performance factors, for ex- and orbit control manoeuvres. ample number of image acquisition modes and need for aerodynamic forces fa in three dimensions can be cal- polarisation diversity [85]."
11,"the use of a given antenna culated using equation (5) from the atmospheric density ρ, area density will therefore only reflect a small range of the relative velocity vrel (with respect to the oncoming flow), sar instrument configurations or antenna types and will reference area aref , and set of aerodynamic force coeffi- be specific to a given set of mission requirements. cients cf that are defined in axes that correspond to the output force."
11,3.4.2.
11,"electrical power system electrical power system (eps) architecture for vleo 1 2 fa = ρkvrel k aref cf (5) satellites is likely to be similar to that of conventional or- 2 biting platforms, using solar arrays as the primary power the drag force fd is considered as the component that source with supporting batteries to enable operations dur- is aligned with the orbital velocity vector of the satellite ing eclipse periods."
11,"however, for vleo satellites with and is therefore usually closely aligned with the direction of abep or ep for drag compensation or mitigation, power the oncoming flow."
11,mutually perpendicular forces (herein requirements are likely to be significantly increased.
11,fur- termed lift) can also be considered.
11,"however, the predom- thermore, eclipse conditions in vleo also increase slightly inant gsi characteristics of typical spacecraft materials in in duration with reducing altitude."
11,"even in dawn-dusk vleo are diffuse and the lift forces generated are typically or similar ssos, often considered due to their favourable an order of magnitude smaller than the drag force."
11,"if spec- on-orbit illumination conditions, the length of the eclipse ularly reflecting gsi performance is considered the mag- seasons also increases with reducing altitude [61]. nitude of these forces can increase significantly depending for solar-based power the implication on spacecraft on the angle of the surfaces with respect to the flow. aerodynamics (principally drag) and stability due to the aerodynamic torques ta can also be produced by in- presence of extensive solar arrays must be carefully consid- teraction of the satellite body with the atmospheric flow. ered and captured in the aerodynamic models."
11,"if the solar these aerodynamic torques can be calculated from the arrays are expected to remain aligned parallel with the aerodynamic force and associated moment arms ` or in direction of the flow to minimise drag, the loss in power- a similar manner to equation (5) by considering the set raising performance associated non-alignment of the arrays of aerodynamic moment coefficients cm of the satellite with the sun vector must also be incorporated into the geometry and a reference length lref . power system and sizing calculations to ensure that suffi- cient power is available throughout the orbit."
11,"dawn-dusk 1 2 ta = ` × fa = kvrel k aref lref cm (6) ssos allow flow-aligned solar arrays to remain approxi- 2 mately normal to the solar vector, minimising the cosine the sets of aerodynamic force and moment coefficients loss and maximising power-raising performance."
11,"for gen- of a body in vleo are dependent on the external ge- eralised inclined orbits, the worst-case condition will exist ometry of the spacecraft, the orientation of the spacecraft when the beta angle is 0°."
11,"for fixed solar arrays oriented with respect to the flow, the oncoming flow conditions, and in the local horizontal plane under this condition, where the gsi characteristics between the surface materials and θ is the angle between the solar array normal and the so- the atmospheric flow."
11,"in this study maxwell’s model [86] lar vector, the cosine loss can be approximated over the has been selected to explore the effect of different materi- period of an orbit. als on the aerodynamic performance in vleo."
11,"this gsi z π model combines diffuse and specular particle interactions 1 2 | cos θ| dθ = ≈ 0.637 (4) using an accommodation coefficient (α) that defines the 2π −π π proportion of particles that are fully accommodated and given the challenges and high requirements for eps re-emitted thermally and diffusely whilst the remaining design in vleo, the system performance is critical."
11,high 11
12,©2020.
12,this manuscript version is made available under the cc-by-nc-nd 4.0 license http://creativecommons.org/licenses/by-nc-nd/4.0/ proportion are reflected elastically and specularly.
12,"how- compensation of the aerodynamic drag to extend or sus- ever, whilst capable of describing the effect of some spec- tain operations."
12,"however, if appropriately specified and ular reflection qualities, maxwell’s model is not able to designed a propulsion system may also be used to perform adequately describe the more complex petal-like shaped orbit-raising or lowering procedures, constellation main- distribution of materials with a predominant specular or tenance, out-of-plane manoeuvres, contribute to attitude quasi-specular component that has been observed experi- control, or support a controlled/targeted re-entry as re- mentally [14]. quired by different mission concepts."
12,"a range of alternative gsi models have been developed for both conventional ep systems (for example demon- with different assumptions, limitations, and level of com- strated by goce) and novel abep systems in vleo, the plexity."
12,"however, significant uncertainty remains associ- thrust required for continuous drag compensation must be ated with the aerodynamic performance of even commonly equal the drag force that will be experienced over the ex- used materials in the vleo environment, not to mention pected lifetime in orbit."
12,"however, alternative thrusting the possible characteristics of novel atomic oxygen resis- strategies can be considered that may reduce the power tant materials that are currently being sought to reduce required during eclipse, for example periodic thruster op- drag in vleo."
12,"as knowledge of these materials improves eration either only during sunlit conditions or at another and their gsi properties become more fully characterised, chosen ratio [69]."
12,"under such strategies, the thruster must models that more appropriately reflect these behaviours provide sufficient thrust to ensure that the effect of the can be incorporated into future studies. drag over an orbit period (or similar time scale) is compen- the density at a given orbit altitude can be estimated sated for and a mean altitude is maintained."
12,the required using an atmosphere model.
12,"different atmosphere mod- thrust force ft can be approximated by considering the els of varying complexity and fidelity can be used with accumulated drag force over a given orbit divided by the possible inputs dependent on geographic position, time, period of the orbit that the thruster will be operated for. and space weather [87]."
12,"however, for conceptual design purposes the fine detail of the atmospheric density is not fd tperiod ft ≈ (8) necessary and uncertainties in estimating the future space tthrust weather indices are considerable."
12,a characteristically high periodic thrusting strategies may also be considered if or averaged value of the density at a given altitude can off-axis pointing performance is required in either the pitch therefore be used as a conservative estimate.
12,"the nrlmsise- (or less commonly yaw) axis, causing a significant mis- 00 [10] model is commonly used and openly available and alignment of the spacecraft from the desired thrust vector. has therefore been used in this study in conjunction with such strategies would allow periods of agile eo operation input parameters as recommended in iso 14222:2013 [88]. whilst compatibility with a drag-compensating propulsion for simple spacecraft configurations, the overall aero- system is maintained."
12,"however, it is likely that this imag- dynamic drag coefficient and associated reference area can ing would take place during sunlit conditions and there- be calculated by the panel method, i.e. by summing the fore conflicts with the optimal drag-compensation phase contribution of a set of simple flat panels that provide a and power availability."
12,"the impact on the overall system basic representation of the spacecraft geometry. performance will therefore be of greater consequence. n x {cd aref }t = cd,i ai (7) conventional electric propulsion. i=1 a conventional ep system comprises primarily of a thruster, power supply hardware, a propellant feeding system, and this basic method can be extended and applied to the required propellant that is typically stored within a cad or mesh-based geometries for more complex satellite pressurised tank."
12,"for spacecraft operating in vleo, a representations."
12,"the panel method tool adbsat [89, 90] high specific impulse is typically desired to minimise the has been used in this study and has been shown to demon- mass of propellant required. strate good agreement with more complex simulations (e.g."
12,under the assumption that the propulsion system op- direct simulation monte carlo) whilst remaining easy to erates continuously to compensate the aerodynamic drag implement for use in preliminary design studies.
12,"further- force most efficiently for the total length of the mission tl , more, this tool can be adapted for use with different gsi the mass of propellant can be estimated from the specific models under the general assumptions that the geome- impulse isp ."
12,a mass usage efficiency of the thruster ηm try used is generally convex (i.e. does not have surfaces can also be introduced. that can experience secondary reflections) and the flow is strictly free-molecular.
12,fd mp = tl (9) isp g0 ηm 3.4.4.
12,"propulsion the power required by the thruster can be calculated for vleo spacecraft, the principal function of a propul- from the required thrust ft , propellant mass flow rate sion system is to perform either mitigation or complete ṁp , and total thruster efficiency (ηt = γ 2 ηm ηe ), where ηe 12"
13,©2020.
13,this manuscript version is made available under the cc-by-nc-nd 4.0 license http://creativecommons.org/licenses/by-nc-nd/4.0/ is the electrical efficiency of the thruster and γ is a thrust ion thrusters can be considered to provide an estimate of correction factor (accounting for multiply charged ions and the mass of a notional abep thruster. beam divergence) [91].
13,a number of designs for rarefied intakes have been pre- sented in the literature [19].
13,"however, many of these de- ft2 signs are given for a specific set of mission or platform pt = (10) 2ṁp ηt design parameters and cannot be simply scaled for alter- native scenarios."
13,"studies of parametrised abep intakes for ep, a trade-off between thrust, input power, and allow scaling based on frontal area and thruster specifi- specific impulse results."
13,"for a given thrust requirement, cation using a set of geometric design factors (e.g. inlet- increasing isp can reduce the necessary propellant mass outlet area ratio and length-radius ratios for internal fea- (see equation (9)), but requires a corresponding increase tures)."
13,"the collection efficiency ηc can be calculated using in input power. a balance model and transmittance probabilities for rar- 2ηt pt ft = (11) efied flows, but such methods can only be applied to dif- g0 isp fusely re-emitting surfaces [71–73]."
13,"these analytical mod- given the required thrust magnitude, mass of propel- els have been compared to simulations using direct simula- lant, and power consumption, the basic propulsion system tion monte carlo and particle-in-cell methods."
13,"deviations mass can be estimated using simple sizing relationships were found the range of 5 % to 8 %, demonstrating good and historical database of actual system parameters and agreement and their suitability particularly for prelimi- simple regression methods [77, 78]."
13,typical efficiencies for nary design studies.
13,"the maximum efficiency of these dif- hall electric thrusters (hets) and gridded ion engines fuse intakes has been shown to range up to approximately (gies) range from 0.20 to 0.90, whilst specific impulses 0.60 [73]."
13,"if specular reflecting materials can be identi- can range from 600 s to 10 000 s [92]. fied and integrated for use in the orbital environment then alternative intake designs can be developed, and higher atmosphere-breathing electric propulsion (abep). intake efficiencies (up to 0.70 for hybrid designs and 0.94 in contrast to conventional ep, on-board propellant is not for pure-specular reflections) can be theoretically achieved required for an abep system as the reaction mass is col- [95]."
13,"however, flexible design and optimisation methods lected by the spacecraft from the surrounding atmosphere for such intakes are currently lacking and computation- using an intake."
13,"for conceptual and preliminary design ally expensive monte carlo simulations are required to es- purposes, the abep system can be considered simply as tablish their performance."
13,"for such intakes, the mass of two discrete components, the intake and the thruster. the assembly can be estimated from the geometric prop- given the magnitude of the required thrust ft , the erties, a structural wall thickness, and selected material power required by the abep thruster pt can be calculated properties."
13,"in the presence of significant uncertainty as- from the external mass flow rate into the intake (ṁc = sociated with the knowledge of material gsi performance ρac v), the intake collection efficiency ηc , and the thruster and abep intake performance a priori values of intake effi- efficiency ηt . ciency can be used for simplicity and to explore the design ft2 space as this area of system design and modelling matures."
13,pt = (12) 2ṁc ηc ηt the use of abep can present a significant challenge in critical considerations for abep thruster development system design convergence and optimisation.
13,"the thruster include compatibility and performance under the condi- power requirement is simultaneously dependent on the in- tions of changing atmospheric density and composition, take efficiency, thrust requirement, and available mass flow for example with the solar cycle or smaller short-term rate."
13,"meanwhile, the intake efficiency is principally depen- variations."
13,the technical challenges of thruster design dent on the inlet-outlet ratio that also affects the mass flow for operation with variable and mixed atmospheric pro- rate to the thruster.
13,"at low altitude, the power require- pellant must also be considered."
13,component degradation ment needed for drag compensation increases due to the (e.g. electrode erosion principally by atomic oxygen) must increased atmospheric density and therefore experienced also be avoided to ensure long-term operation and has re- drag.
13,"this increases the area required for power raising sulted in increasing interest in electrodeless and contactless (assuming the use of solar arrays), which in turn simul- thruster designs that utilise radio-frequency (rf) plasma taneously increases the drag and the power requirement. discharges."
13,"owing to the relative immaturity of these tech- to reduce the power requirement, a larger mass flow to nologies, the efficiency of rf helicon thrusters is currently the thruster is desired, requiring either a more efficient lower than that of established ep types, and has currently intake or a larger intake area that would once again in- demonstrated maximum thruster efficiencies of 0.2 to 0.25 crease the drag and the power."
13,"a circular dependency [93, 94]."
13,"given the novelty of abep thrusters, relation- that can cause non-convergence is therefore present in the ships between their mass for different power or thrust re- design and a trade-off between these characteristics has to quirements cannot yet be developed."
13,"however, given the be matched to ensure sustained operation at lower alti- similarity in technology, an analogous relationship to rf tude [72]."
13,"at higher altitude where the thrust and mass flow rate requirements are lower, it may be advantageous 13"
14,©2020.
14,"this manuscript version is made available under the cc-by-nc-nd 4.0 license http://creativecommons.org/licenses/by-nc-nd/4.0/ to consider intake designs that only cover a fraction of table 3: optical vhr mission and system input parameters. the cross-sectional area, reducing the mass of the intake."
14,"furthermore, if specular reflecting materials are identified, parameter value the remaining forward-facing surfaces can be angled with design lifetime [years] 5 respect to the flow, reducing the overall drag of the satel- grd (nadir) [m] 0.3 lite, and therefore reducing the power requirement of the vhr eo payload density [kg m−3 ] 61.5 propulsion system."
14,payload power [w] 400 orbit sso 3.4.5.
14,system cost ltan 10:00h parametric cost models can be used to estimate the de- maximum off-nadir pointing angle [°] 30 velopment and manufacturing costs for future space sys- maximum slew rate [° s−1 ] 4.5 tems during the early design phases.
14,these models typi- cally utilise a set of cost-estimating relationships (cers) that express system or subsystem costs as a function of given the inherent cost model uncertainties and addi- different performance parameters.
14,"these cers are gen- tional issues with cost modelling for vleo systems de- erally developed from databases of historic satellites us- scribed above, it is recommended that the output system ing regression-based analysis [45]."
14,the unmanned sys- costs presented in the following section are used only to tem cost model (uscm) and the small satellite cost identify rough system-level trends and to compare differ- model (sscm) are publicly available and widely used.
14,the ent designs in a relative and not absolute sense.
14,nasa instrument cost model (nicm) can also be used to provide estimations for specific payload costs [96].
14,"the uscm and sscm also provide estimation of model errors, 4."
14,system case studies allowing for some measure of the uncertainty in the cost using the described system design framework and de- estimation process.
14,"the cers contained in the uscm8 veloped system models, it is possible to investigate the [45], sscm19 [79], and nicm version iiic [45] have been system-level design of vleo spacecraft and the trade-offs used in this work. associated with the emerging technologies of interest."
14,"two whilst these models can provide some representation case-studies will be considered; the first a very-high reso- of cost for the system development and production, they lution (vhr) optical imaging satellite, and the second a currently lack proper compatibility with vleo platform synthetic aperture radar (sar) satellite."
14,"sets of input designs that may incorporate novel technologies, for ex- parameters are presented for each case to explore the dif- ample abep and aerodynamic surface coatings."
14,"further- ferent vleo-specific technologies and to represent their more, given the low technology readiness level (trl) of near-term expected performance and longer-term specula- these technologies, there is currently insufficient data to tive properties."
14,"in both case studies, the current state-of- produce new regressions that can provide reliable cost es- practice and improvements to the supporting technologies timates."
14,"in the absence of suitable cers, the cost of the will also be considered, notably solar array efficiency and abep system will be estimated analogously; the intake specific power, and battery specific energy density. will be associated with the structural subsystem whilst the thruster and supporting systems are considered as compo- 4.1."
14,optical very high resolution (vhr) nents of a conventional propulsion system.
14,"at present, the cost-implications of aerodynamic surface coatings are the reduced altitude of vleo lends itself to vhr im- largely unknown and will not be considered. agery as the distance to the target is reduced and thus it should also be noted that each cost model and the the payload requirements for a given resolution reduce."
14,"in associated cers are limited in their range of application combination with vhr, a high-performance eo satellite and inputs (e.g. total system and individual subsystem would require the high image stability and quality, pre- masses) as a result of the underlying data used in their cise geolocation, and flexible tasking and pointing perfor- development."
14,"for example, the sscm does not provide a mance."
14,"if deployed in a distributed system or constella- cer for propulsion systems for spacecraft with a wet mass tion, daily or sub-daily revisit would likely be desired. below 100 kg."
14,discontinuities will therefore be present existing systems in this segment include worldview- across the transitions between the different models.
14,"1/2/3/4, pleiades-1a/1b, and kompsat-3/3a that serve when the development of multiple spacecraft is con- principal application areas of defence monitoring and mis- sidered, for example in constellations, learning curves can sion planning, construction and infrastructure monitoring, be incorporated to account for the reduction in recurring and urban development."
14,a satellite with the aim of re- production costs that can be achieved.
14,further economic placing such systems would require a gsd of 0.3 m and considerations such as adjustments for inflation and amor- operate for at least 5 years.
14,the principal mission design tisation for projects lasting multiple years can also be in- parameters for a notional satellite of this class are given cluded but have been neglected at present. in table 3.
15,©2020.
15,this manuscript version is made available under the cc-by-nc-nd 4.0 license http://creativecommons.org/licenses/by-nc-nd/4.0/ worldview-3 (0.31m) worldview-2 (0.46m) worldview-1 ( 0.5m) worldview-4 (0.31m) geoeye-1 (0.41m) kompsat-3a (0.55m) pleiades-1a/b (0.69m) kompsat-3 (0.69m) figure 4: variation of system mass with altitude for different optical vhr satellite designs (0.3 m gsd).
15,the point of minimum mass for each case is marked with by an ’x’.
15,previous optical vhr satellite designs (with varying gsd noted) are shown for comparison.
15,table 4: optical vhr satellite design input and output parameters.
15,"case parameter vhr-1 vhr-2 vhr-3 vhr-4 inputs propulsion type ep ep abep abep thruster efficiency, ηt [-] 0.60 0.80 0.30 0.60 specific impulse, isp [s] 2500 4000 - - intake efficiency, ηc [-] - - 0.40 0.94 acc."
15,"coefficient, α [-] 1.00 0.50 1.00 0.50 solar array efficiency [-] 0.30 0.40 0.30 0.40 solar array specific power [w kg−1 ] 60 100 60 100 battery energy density [w h kg−1 ] 125 200 125 200 outputs altitude [km] 420 330 330 220 mass [kg] 561 296 618 225 solar array area [m2 ] 14.3 7.1 25.2 11.1 aperture diameter [m] 0.85 0.67 0.67 0.45 body diameter [m] 2.7 2.1 2.1 1.4 unit cost [$m] 347 274 292 201 15"
16,©2020.
16,this manuscript version is made available under the cc-by-nc-nd 4.0 license http://creativecommons.org/licenses/by-nc-nd/4.0/ figure 5: variation of subsystem mass and power with altitude for different optical vhr satellite designs (vhr-2 and vhr-4).
16,"using the previously described system modelling frame- when operating in vleo, a satellite with a conven- work, system designs can be generated for sets of differ- tional ep system and assuming traditional materials (case ent input options and parameters."
16,"four different cases vhr-1) is shown to achieve the desired imaging perfor- are defined (see table 4), illustrating the current and fu- mance at a lower total (wet) mass than existing systems, ture expected performance of ep and abep enabled sys- particularly those matching the high-resolution require- tems."
16,"for each case, the variation of modelled spacecraft ment."
16,"this result is consistent with the success of the mass with reducing altitude is shown in figure 4 along- goce spacecraft that had a payload mass of approxi- side some recent examples of commercial vhr satellites. mately 200 kg and was able to operate for a period of over whilst these existing systems are provided for high-level 4 years at altitudes below 280 km using a drag-compensating comparison, it should be noted that the systems mod- propulsion system."
16,"as the altitude is reduced below 400 km elling approach and inputs will not directly correspond to the propulsive and power requirements begin to increase the specification, configuration, and performance of any of and the mass correspondingly grows rapidly."
16,when the po- these spacecraft individually.
16,"output design parameters of tential of drag-reducing materials is incorporated into the interest are reported in table 4, corresponding to the low- design and propulsive and eps performance is increased est mass system reported for each set of input parameters."
