page,p
6,remote sensing of seagrasses in a patchy management advantages include 1) the provision of information on multi-species environment.
6,"international journal of remote sensing 32, 2227e2244. habitat characteristics where none may previously have existed; 2) lourie, s.a., vincent, a., 2004."
6,"using biogeography to help set priorities in marine the identiﬁcation of areas of high geomorphic diversity, which are conservation."
6,"conservation biology 1, 1004e1020. also likely to harbour high biological habitat and species diversity; lyzenga, d., 1981."
6,remote sensing of bottom reﬂectance and water attenuation parameters in shallow water using aircraft and landsat data.
6,"international and 3) the maximization of returns on investment in regional-scale journal of remote sensing 2, 71e82. biodiversity marine conservation planning."
6,"mumby, p.j., edwards, a.j., 2002."
6,mapping marine environments with ikonos imagery: enhanced spatial resolution can deliver greater thematic accuracy.
6,"acknowledgements remote sensing of environonment 82, 248e257."
6,"rees, g., 2008."
6,comparing the spatial content of thematic maps.
6,"international journal of remote sensing 29, 3833e3844."
6,"this research would not have been possible without the roberts, c.m., mcclean, c.j., veron, j.e.n., hawkins, j.p., allen, g.r., mcallister, d.e., generous support of the khaled bin sultan living oceans founda- mittermeier, c.g., schueler, f.w., spalding, m., wells, m., vynne, c., werner, t.b., 2002."
6,marine biodiversity hotspots and conservation priorities for tropical tion.
6,the millennium coral mapping funding project was funded by reefs.
6,"science 296, 1026e1028."
6,"nasa through a grant to university of south florida/institute for roberts, c.m., andelman, s., branch, g., bustamante, r., castilla, j.c., 2003."
6,"ecological marine remote sensing (frank muller-karger and sa), and by ird. criteria for evaluating candidate sites for marine reserves."
6,"ecological applica- tions 13, 199e214."
6,"dr annelise hagan and christine kranenburg are warmly thanked rowlands, g.p., purkis, s., riegl, b., metsamaa, l., bruckner, a., renaud, p., 2012. for assistance with production of the habitat and geomorphological satellite imaging coral reef resilience at regional scale."
6,a case-study from saudi maps respectively.
6,arabia.
6,marine pollution bulletin. http://dx.doi.org/10.1016/j.marpolbul.2012.
6,03.003.
6,"spencer, t., hagan, a.b., hamylton, s.m., renaud, p., 2009."
6,the atlas of the amir- references antes.
6,"cambridge coastal research unit, university of cambridge, p."
6,"steele, b.m., winne, j.c., redmond, r.l., 1998."
6,"estimation and mapping of misclas- allnutt, t.f., mcclanahan, t.r., andréfouët, s., baker, m., lagabrielle, e., siﬁcation probabilities for thematic land cover maps."
6,"remote sensing of envi- mcclennen, c., rakotomanjaka, a.j.m., tianarisoa, t.f., watson, r., kremen, c., ronment 66, 192e202."
6,"comparison of marine spatial planning methods in madagascar demon- stoddart, d.r., steers, j.a., 1977."
6,the nature and origin of coral reef islands.
6,in: strates value of alternative approaches.
6,"plos one 7, e28969."
6,"jones, o.a., endean, r.e."
6,"(eds.), 1977."
6,"biology and geology of coral reefs, vol."
6,"andréfouët, s., guzman, h.m., 2005."
6,"coral reef distribution, status and geomor- academic press, new york, pp. 59e105 (geology 2). phology: biodiversity relationship in kuna yala (san blas) archipelago, carib- stoddart, d.r., 1984."
6,coral reefs of the seychelles and adjacent regions.
6,in: bean panama.
6,"coral reefs 24, 31e42."
6,"stoddart, d.r."
6,"(ed.), biogeography and ecology of the seychelles islands."
6,"andréfouët, s., muller-karger, f.e., robinson, j.a., kranenburg, c.j., torres-pulliza, d., junk, the hague, pp. 63e81."
6,"spraggins, s.a., murch, b., 2006."
6,"global assessment of modern coral reef extent wabnitz, c.c., andréfouët, s., müller-karger, f.e., 2010."
6,measuring progress toward and diversity for regional science and management applications: a view from global marine conservation targets.
6,"frontiers in ecology and the environment 8, space."
6,"proceedings of the 10th international coral reef symposium 1, 1732e1745. 124e129."
6,"andréfouët, s., 2008."
6,"coral reef habitat mapping using remote sensing: a user vs wilson, k.a., moilanen, a., possingham, h., 2011."
6,spatial conservation prioritisation: producer perspective.
6,"implications for research, management and capacity quantitative methods and computational tools."
6,"oxford university press, building."
6,"journal of spatial science 53, 113e129."
6,"oxford, p."
