page,p
9,"economic and environmental damage is august 21, 2000 showed the strip clearly as being nitro- minimized by early detection and treatment of pest infesta- gen-deficient. tions."
9,"in an interesting use of satellite imagery, a farmer in the red river valley of minnesota used landsat imagery to 4.4.5."
9,"selecting sugarbeet areas for payment in kind (pik) confirm damage caused by armyworms in two varieties of program wheat, oxen and lars."
9,the farmer noticed the armyworm the above illustrations pertained to maximizing produc- infestation in parts of his field during a routine investigation. tion.
9,"in a contrasting scenario, imagery was used to identify since it was difficult to pinpoint the areas of attack, he then hectares to be destroyed under the pik program. sprayed pesticide over the whole field."
9,"after harvest, the because of overproduction of sugar and high inventories, final yield map was compared with two landsat scenes, one the department of agriculture implemented the pik program taken in june before the insect attack was noticed, and the in 2000 to reduce excess sugar inventories and thereby support prices."
9,the mechanics of the program are that the farmer would destroy a small but specified number of sugar- beet hectares in return for the past 3 years’ average price.
9,growers were given the opportunity to participate in the program based on a limited hectares per grower.
9,"selecting the program hectares for an average farm (200 ha of beets) would have necessitated large amount of groundtruth, making a timely and cost effective decision impossible."
9,"again, the growers resorted to the high resolution satellite imagery to help identify the least productive acreage for destruction."
9,"in the example shown in fig. 6, the imagery was first applied to narrow down the number of areas for closer consideration from seven to three."
9,the areas within these three fields where the crop seemed stressed were selected for groundtruthing.
9,"two of the three turned out to be affected by rhizoctonia, a type of fungus that reduces yields, while the third was merely a mature crop with yellowing canopy but good yields."
9,the decision as to which areas within the field to be destroyed were much easier based on these results.
9,"timely decision making was of utmost im- portance for the pik program, and this was achieved with the help of high resolution imagery."
9,4.4.6.
9,"verifying effectiveness of fungicide application precision farmers are always confronted with the ques- tion of whether to apply fungicide, how much to apply, and when to apply."
9,"carson farms, north dakota, applied fungi- cide on its wheat crops except along two test strips, 55 and 37 m wide."
9,"the test strips stood out prominently on ikonos imagery taken august 21, 2000."
9,the imagery also showed that the crop was healthier where the fungicide was applied.
9,fig. 7 shows the multispectral 4-m resolution ikonos image of the fields.
9,yield data were related to the fungicide applications.
9,fig. 8 shows the yield variations within and outside the test strips.
9,"the fine resolution of the imagery allowed easy identifica- tion of the 37 m wide test strip, but the yield variations were more noticeable in the 55 m wide strip."
9,the overlay of yield over the wheat field showed that the average yield within the test strip was only 4.1 t/ha as compared to 4.8 t/ha outside the fig.
9,"airborne multispectral data at 2-m resolution collected over a sugar test strip, thereby demonstrating the value of fungicide beet field after damage due to herbicide drift."
9,damaged areas are outlined in applications. white.
10,166 s.k.
10,seelan et al.
10,"/ remote sensing of environment 88 (2003) 157–169 other taken in late july, a few weeks after the spray was 4.4.8."
10,spray drift damage assessment done.
10,accidental damage occurred in a sugar beet field in st.
10,"the abnormally low reflectance areas on the july image thomas township, nd, during an aerial application of vine indicated areas of armyworm attack (fig."
10,this was desiccant to an adjoining potato field.
10,"a 30-ha sugar beet compared with the yield map, and it was noted that the field was accidentally hit by the desiccant on the 25th areas observed in the field and seen on the images seemed august, 2000."
10,the situation was noticed on the 29th august to indicate a correspondence between areas of high army- during a routine inspection of the field. worm attack and low yield.
10,the june imagery did not a quick survey revealed that while there could be no reveal the armyworm infestations.
10,"this clearly indicated to disputing the damage (fig. 10), the challenge would be to the farmer that with imagery taken at an appropriate time, estimate the area and severity of the damage."
10,"a certified crop it is possible to spot infestations and attack the pest consultant was contacted who, after a preliminary review of without waiting until harvest to discover low yielding the affected field, concluded that it would not be possible to areas."
10,the july imagery also clearly showed the two accurately estimate the damaged area from ground-based different wheat varieties.
10,the lars variety seemed to be surveys.
10,sugar beets are extremely sensitive to defoliants more resistant to the pest.
10,this prompted further investi- and the accident occurred at a critical growth stage of the gation of lars wheat properties by the farmer and he plants.
10,"in order to resolve the issue amicably, a quick and reasoned that lars did not attract armyworm because of reliable estimate of the damage and loss of sugar content had its higher lignin content. to be made."
10,"the july imagery helped in understanding the impact of soon after the damage was noticed, multispectral data at armyworm attack on wheat."
10,"if the farmer had had immediate 2-m resolution was collected over the field using an air- access to earlier imagery that showed the two spots of insect borne, digital camera (fig."
10,"multispectral ikonos attack, the insecticide application could have been targeted satellite images at 4-m-resolution, taken a few days before precisely to where the problem existed, yielding both the accident, were used to assess the variations within the economic and environmental benefits. field before the damage occurred."
10,both aerial and ikonos fig.
10,drainage problems detected on a landsat 7 false color image.
11,seelan et al.
11,/ remote sensing of environment 88 (2003) 157–169 167 images were geo-corrected before demarcating the damaged conditions.
11,drainage ditches are used to remove the excess areas. water from the root zone of the crop and prevent flooding of the damaged area was classified using erdas imagine farmland.
11,these ditches increase crop yield by enhancing software and estimated at 7.4 ha.
11,"ground samples taken at soil oxygen, necessary for healthy roots."
11,they also lower different time periods revealed that the average loss of losses of gaseous nitrogen and increase microbial activity. sugar in the damaged areas was 502 kg/ha.
11,"at the prevail- remote sensing, combined with yield information and ing price of us$0.44 per kg, the total loss was estimated at existing drainage maps, can help the farmer identify areas us$1600."
11,this study showed the usefulness of high-reso- needing drainage improvements. lution imagery in accurate and timely assessment of loss a farmer noticed patches of low reflectance in his due to inadvertent chemical damage.
11,"the estimate based on wheat field using landsat imagery taken on july 23, remotely sensed data was a guiding factor in amicably 2000."
11,"the patches were interpreted as poor growth areas. settling the dispute between the farmer and the aerial yield data obtained at harvest was then overlaid, confirm- sprayer, out of court (seelan, green, laguette, & wivell, ing poor yield along these patches."
11,the farmer then 2001). overlaid the drainage map of the field over the imagery.
11,"as shown in fig. 12, a clear correlation was noticed 4.4.9."
11,"drainage deficiency detection between some of the drainage ditches and the lower much of the red river valley in minnesota and north reflectance pixels, highlighting a deficiency in the drainage dakota is low-lying and flat, resulting in poor drainage system."
11,"ikonos image of part of red river valley, taken on the 5th august, 2001, showing inundated areas."
11,includes material from space imagingn l.p.
12,168 s.k.
12,seelan et al.
12,/ remote sensing of environment 88 (2003) 157–169 fig.
12,typical wet spot or ‘‘drown out’’ in a potato field.
12,"the white, circular spot represents increased salinity due to water logging."
12,4.4.10.
12,assessment of damage due to inundation factor will be how rapidly cadres of producers acquire and thousands of hectares of arable land are often flooded use the knowledge of geospatial techniques.
12,"recognizing the and inundated in the red river valley in north dakota and reasons why the technology has not ‘‘caught on’’ with the minnesota, resulting in loss of productivity and income. agricultural producers despite its promise, the upper mid- much of the valley has shallow gradients with slow drainage, west aerospace consortium evolved a unique learning so even a small amount of above normal or intense precip- community approach."
12,the producers and scientists work itation leads to inundation.
12,"farmers who were faced with the together to create the right geospatial products and provide problem of flooding and inundation were able to derive them in near real time, transfer knowledge through organized information from ikonos imagery to support their insur- training programs, and assist each other in discovering new ance claims and to convince the local water board to improve applications, thus creating a strong foundation for a sustained drainage. use and adoption of the technology."
12,"the numbers of pro- ikonos images were acquired for july 09, 2001, august ducers who use this technology have grown steadily over the 05, 2001 (fig. 13) and august 27, 2001."
12,the first image years.
12,"the early adopters and innovators are now leading and showed no inundation, while the second, subsequent to motivating the others through their successes. heavy rainfall, showed several wet spots or ‘‘drown out’’ our experience so far has shown that (a) examples of areas, affecting the crops (fig."
12,"the third image showed economic and environmental benefits are critical in adoption continued inundation, though some fields started drying up by a larger number of end users."
12,value is derived only if the by then.
12,section 24 of north st.
12,thomas was particularly information enables a decision that results in higher profit- devastated by the water damage.
12,the imagery showed that a ability and more responsible stewardship; (b) remote sensing 31-ha field with red potatoes was severely affected.
12,"while supplements, but does not replace all other sources of the average yield in the rest of the potato fields was 169 kg information; (c) a commitment over several growing seasons per ha, this field produced only 100 kg per ha."
12,after an is required.
12,"time series data are important for detecting adjustment for crop insurance, this yield reduction is esti- changes that impact production; (d) engaging producers mated to have resulted in an income loss of over us$875.00 means supplying images of their fields."
12,"presentations of per ha or over us$27,000.00 for the field. examples from others’ farms or ranches do not necessarily trigger commitments; (e) most applications of the informa- tion have to be customized; (f) information must be provided 5."
12,"conclusions in near real-time; and (g) the proper resolutions—spatial, temporal, and spectral—depend on the problem."
12,cost – precision agriculture is economically and ecologically benefit analyses must constantly recalculate the length of promising.
12,it will one day be standard practice.
12,"predicting time information has value, as well as whether field practices exactly when that day arrives is difficult."
12,a determining can be implemented at a scale matching the spatial detail.
13,seelan et al.
13,"/ remote sensing of environment 88 (2003) 157–169 169 acknowledgements jackson, r."
13,(1984).
13,remote sensing of vegetation characteristics for farm management.
13,"proceedings of the society of photo-optical instru- mentation engineers, 475, 81 – 96."
13,"the authors wish to acknowledge the various funding laguette, s., seelan, s., casady, g., wyatt, e., & wivell, c."
13,"(2001). sources for this work, viz., nasa/raytheon synergy info- helping farmers and ranchers to use remote sensing as a basic man- mart project, nasa grants nag-3616 and ncc-310 and agement tool: a development of an interactive remote sensing and nasa’s scientific data purchase program."
13,the authors also image processing teaching process.
13,"igarrs ’2001, vol."
13,"vi wish to acknowledge pete carson, robert green, carl and (pp."
13,2881 – 2883).
13,"laguette, s., seielstad, g., seelan, s., wivell, c., olsen, d., lawrence, r., janice mattson, alan tucker, gary wagner, farmers whose nielsen, g., rattling leaf, j., clay, d., & dalsted, k."
13,(2001).
13,precision examples are used in this paper.
13,the valuable comments by farming management via information dissemination.
13,"igarrs’ the reviewers are also acknowledged. 2001, vol."
13,ii (pp.
13,837 – 839).
13,"lal, r."
13,(1991).
13,soil structure and sustainabilty.
13,"journal of sustainable agriculture, 4, 67 – 92."
13,"references mansfield, e."
13,(1963).
13,technical change and the rate of imitation.
13,"econo- metrica, 29, 741 – 763."
13,"bauer, m."
13,(1985).
13,"spectral inputs to crop identification and condition mcdonald, r."
13,"b., & hall, f."
13,(1980).
13,global crop forecasting.
13,"science, assessment."
13,"proceedings of the ieee, 73, 1071 – 1085."
13,"280, 670 – 679."
13,"daberkow, s."
13,"g., & mcbride, w."
13,(2000).
13,"adoption of precision moran, m."
13,"s., inoue, y., & barnes, e."
13,(1997).
13,opportunities and lim- agriculture technologies by u.s. farmers.
13,proceedings of the fifth itations for image-based remote sensing in precision crop management.
13,international conference on precision agriculture.
13,"madison, wi, remote sensing of environment, 61, 319 – 346."
13,usa: asa-cssa-sssa.
13,national research council.
13,"precision agriculture in the 21st century: daily, g."
13,"c., dasgupta, p., bolin, b., crosson, p., guerny du, j., ehrlich, geospatial technologies in crop management."
13,"washington, dc: p."
13,"r., folke, c., jansson, a."
13,"m., jansson, b. -o., kautsky, n., kinzig, nrc national academy of sciences."
13,"a., levin, s., mäler, k. -g., pinstrup-andersen, p., siniscalco, d., & reitmeier, l.j., franzen, d.w., giles, j.f., cattanach, a.w., cattanach, walker, b."
13,(1998).
13,"food production, population growth, and the en- n.r."
13,(1998).
13,nitrogen management in a wheat/potatoes/sugabeet crop vironment.
13,"science, 281, 1291 – 1292. rotation."
13,"sugarbeet research and extension reports, minnesota and fountas, s."
13,(2001).
13,farmers’ attitude to precision farming.
13,proceedings of north dakota sugarbeet research and education board.
13,"29,125. the third european conference on precision agriculture ( pp."
13,515 – 519).
13,"seelan, s."
13,"r., green, r., laguette, s., & wivell, c."
13,(2001).
13,"assessment of montpellier, france: ensa-montpellier. damage to sugarbeet crop due to errant defoliant chemical drift."
13,"pro- hapka, a."
13,"j., franzen, d."
13,"w., giles, j."
13,"f., & cattanach, n."
13,(2000). ceedings of the third international conference on geospatial informa- timing and release of nitrogen from residues.
13,sugarbeet research tion in agriculture and forestry.
13,"ann arbor, mi: veridian. and extension reports, minnesota and north dakota sugarbeet re- swinton, s."
13,"m., & lowenberg-deboer, j."
13,(2001).
13,"global adoption of pre- search and education board, vol. 31 ( pp."
13,114 – 121).
13,"fargo: ndsu cision agriculture technologies: who, when, why?"
13,proceedings of the extension service.
13,third european conference on precision agriculture ( pp.
13,557 – 562).
13,"hatfield, j."
13,"l., & pinter jr., p."
13,(1993).
13,remote sensing for crop protec- ensa-montpellier. tion.
13,"crop protection, 12, 403 – 414."
13,"vossen, p., & meyer-roux, j."
13,(1995).
13,"crop monitoring and yield forecast- idso, s."
13,"b., jackson, r."
13,"d., & reginato, r."
13,(1977).
13,remote sensing of ing activities of the mars project.
13,"king, r."
13,"jones, & a.j crop yields."
13,"science, 196, 19 – 25."
13,"thomasson (eds.), european land information systems for agro-en- idso, s."
13,"b., pinter jr., p."
13,"j., jackson, r."
13,"d., & reginato, r."
13,(1980). vironmental monitoring ( pp.
13,11 – 29).
13,luxembourg: official publica- estimation of grain yields by remote sensing of crop senescence rates. tions of the eu.
13,"remote sensing of environment, 9, 87 – 91."
