page,p
5,"using simulations to do earthquake forecasts is a motions at a given distance and for an assumed magnitude, in new approach being contemplated, instead of using statistical a manner consistent with recordings of past earthquakes under renewal models."
5,although there are pros and cons to using similar conditions.
5,"moreover, attenuation relationships include simulations over statistical methods, there is an increasing an aleatory variability term and, therefore, can be used to interest to assess the potential benefits of a simulation-based estimate variability in ground motion."
5,shakemap sites provide approach (see also [17]). near-real-time maps of ground motion and shaking intensity following significant earthquakes.
5,these maps are used by iv.
5,"m odel -b ased e arthquake s imulations federal, state, and local organizations, both public and private, for l oss e stimation for postearthquake response and recovery, public and scientific information, as well as for preparedness exercises and disaster synoptic observations of the entire earthquake cycle, includ- planning."
5,"the shakemap file is input to hazus-mh. ing accumulation and release of strain between events, are authorized licensed use limited to: univ of calif santa barbara."
5,"downloaded on november 23,2024 at 18:48:44 utc from ieee xplore."
5,restrictions apply.
6,"1600 ieee transactions on geoscience and remote sensing, vol."
6,"45, no."
6,"6, june 2007 critical for learning about the phenomenology and forecasting analysis and prediction."
6,"here, the osses would be designed potentially hazardous earthquakes."
6,"delineation of seismic using computer-based simulations to evaluate the impact source zones requires understanding the geology, tectonics, of insar observing system data on loss estimation with and paleoseismic and neotectonic features of the fault system. the hazus-mh earthquake module for both preevent surface deformation, plate-boundary interactions, frictional mitigation planning and postevent rapid damage assessment properties of faults, and mechanical properties of the earth’s and emergency response."
6,osses provide a means to evaluate crust and lithosphere determine what controls the spatial and the potential contributions of a system while the system is temporal characteristics of earthquakes.
6,it is essential for effec- still in the early design stage.
6,"requirements of the policy- tive seismic risk management that observational data support and decision-making communities would be identified and/or scientific and engineering models in order to understand the developed and defined, the risks to implementing an enhanced source-rupture process and fault plane geometry thus to infer hazus-mh would be elicited, with an approach formulated resultant damage patterns (see [18]). that would structure how data and imagery assimilation would demonstrating the benefits of insar in the context of better meet these user requirements. decision-making for loss estimation must be addressed early to enable the successful transition of research to applications b."
6,event forecasting for sha from a future dedicated observational system.
6,"insar data and products could be integrated with existing ground-based opensha is an effort led by the scec and usgs to measurements, such as seismometry and gps geodesy in order develop object-oriented, web- and graphical user interface to understand better the behavior of fault systems and resultant (gui)-enabled, open-source, and freely available code ground motion (see [4] and references cited therein; see also for conducting seismic hazard analyses (sha) (see fig."
6,"however, loss estimates rely on engineering damage www.opensha.org)."
6,"development of opensha recognizes: functions that are driven by peak ground motion (i.e., ground 1) the need for a more physics-based approach to modeling; shaking intensity)."
6,"since insar interferograms represent snap- 2) that all viable models must be considered; and 3) that a shots of accumulated ground deformation over a time window computational infrastructure is needed which is capable of of observation, rather than instantaneous accelerations, such handling a potentially great number of arbitrarily complex a time window clearly does not resolve accelerations on the models."
6,opensha is envisioned herein as a principal enabler timescales of fault rupture.
6,"however, insar measurements of for undertaking insar-based osses for sha (see fig."
6,"5). interseismic deformation would be very useful for erf models the goal of opensha is to provide a framework wherein any that are constrained by crustal strain measurements and are em- arbitrarily complex (e.g., physics-based) erf, ground-motion, ployed either in 1) estimating the probabilities of deterministic or engineering-response model can be “plugged in” for analysis events or 2) developing a constrained magnitude recurrence without changing the basic code."
6,"field et al. [19] for example, model for probabilistic sha."
6,"assessing the spatial correla- present loss estimates for an earthquake rupture on the recently tion of insar-based ground deformations to actual shaking identified puente hills blind-thrust fault beneath los angeles, intensity would be of interest, and might elucidate variability ca, based on opensha and hazus-mh."
6,rupture on this in site amplification and attenuation conditions.
6,"however, any fault is a rare event, once every 3000 years."
6,"given a range improvements to erf models constrained by insar measure- of possible magnitudes and ground motion models, and ments would not reconcile issues related to estimating ground presuming a full fault rupture, they estimate the total economic shaking using empirical attenuation relationships as opposed loss to be between $82 and $252 billion."
6,this range is not only to time-domain rupture simulations.
6,"rather, the assimilation of considerably higher than a previous estimate of $69 billion, but simulated interferometric data into sha and hazus-mh is a also implies the event would be the costliest disaster in u.s. step in the transitional direction of bringing the requirements of history."
6,"field et al. [19] show that the choice of ground motion the loss estimation community to bear on how insar could model can have greater effect than earthquake magnitude, best contribute to operational sha."
6,"admittedly, the contri- and that reducing this epistemic uncertainty (e.g., via model butions of insar lie more so in event forecasting and fault improvement and/or rejection) could reduce the uncertainty of rupture modeling than the direct estimation of losses, other the loss estimates by up to a factor of two. than a designed emergency response capability with near-real- an ideal forecast model for osses in light of opensha is time damage assessment (i.e., within a 24- to 48-h period after quakesim [http://quakesim.jpl. nasa.gov] and its grid exten- an event) that would likely require a satellite constellation to sion, the solid earth research virtual observatory (servo) ensure prompt coverage."
6,quakesim is an interoperable web portal modeling environ- ment that enables multiscale earthquake modeling.
6,quakesim and servo address forecasting methodologies to study the a.
6,"observing system simulation experiments (osses) physics of earthquakes using state-of-the-art modeling, data osses are recommended in order to assess the value of manipulation, and pattern recognition technologies."
6,these ef- insar-derived products for generating earthquake scenarios forts involve simulation and analysis tools in order to build a used in seismic hazard analyses.
6,"the notion of an osse framework for understanding and studying complex, nonlinear is borrowed from the national oceanic and atmospheric active tectonic, and earthquake processes [20]."
6,administration.
6,"for example, osses are designed to evaluate the simulation tools that support quakesim include geo- the impact of observing system data in numerical weather fest and the virtual california erf."
6,geofest simulates authorized licensed use limited to: univ of calif santa barbara.
6,"downloaded on november 23,2024 at 18:48:44 utc from ieee xplore."
6,restrictions apply.
7,tralli et al.: conceptual case for assimilating insar data into hazus-mh earthquake module 1601 fig.
7,"schematic of conceptual approach to osses with simulated interferograms for supporting erfs and loss estimation, indicating opensha components (green box) compared to an empirical and statistical approach alone (red box)."
7,the contributions of a future insar system to sha and hazus-mh are shown in shaded characters.
7,"the osse construct offers a means to evaluate and prepare for a future capability, helping to accelerate the transition to earthquake disaster management. stress evolution, fault slip, and plastic/elastic processes in model, through virtual california and quakesim analyses, is realistic materials."
7,"the products of such simulations are syn- used to constrain event magnitudes and recurrence, and com- thetic observable time-dependent surface deformation on scales plex fault behavior in the sha."
7,all of these elements would from days to decades.
7,"scientific applications of the code include be implemented with the opensha framework (green box). the modeling of static and transient co- and postseismic earth sha outputs, using ground motion and engineering-response deformation."
7,"it is well suited for osses and actually was models, are employed by hazus-mh for loss estimation. developed for such purposes."
7,simulations can be run to model the incorporation of quakesim and interferogram simulations deformation that would be observed from insar satellites and comprises the principal osse components for helping to pre- gps stations.
7,"data from such systems then can be used to scribe system requirements and to assess the benefits to an estimate potential earthquake sources, for use as input into enhanced loss estimation methodology."
7,hazus-mh and opensha.
7,"virtual california is software a capability for generating interferogram simulations and that utilizes the monte carlo method in order to generate providing a proxy seismic risk map gis layer to hazus-mh simulated, realistic earthquakes on an arbitrary fault surface also is indicated in fig."
7,"additionally, a rapid postevent and mesh."
7,it uses topologically realistic networks of independent interseismic insar data acquisition and analysis capability is fault segments that are mediated by elastic interactions.
7,vir- shown to represent an ideal future system state.
7,"such capability tual california can be used to study how earthquake faults would contribute to sha in both pre- and immediate postevent interact, allowing calculations that define how future earth- (i.e., near real-time) domains, by providing event magnitude quakes arise from correlations with previous earthquakes in constraints from time series data of strain accumulation and a region. from actual damage estimates."
7,"moreover, the osses could be fig. 5 is a schematic of the principal components of an performed in such a manner as to also assess the potential of enhanced loss estimation capability as conceptualized herein. real-time damage assessment to sha with insar, however, currently, shakemap scenarios come directly out of fault this is not shown in fig."
7,"insar imagery would be provided source parameters that make up the probabilistic sha (red into hazus-mh to support emergency response, integrat- box) and are input directly to hazus-mh."
7,a physics model- ing with other higher resolution reconnaissance imagery and based approach using the erf construct also is represented.
7,hazus-mh screen displays.
7,insar thereby would provide quakesim and its simulation tool components are shown to an end-to-end capability ranging from disaster mitigation and provide inputs to erf and interferogram simulation.
7,the erf planning to response.
7,authorized licensed use limited to: univ of calif santa barbara.
7,"downloaded on november 23,2024 at 18:48:44 utc from ieee xplore."
7,restrictions apply.
8,"1602 ieee transactions on geoscience and remote sensing, vol."
8,"45, no."
8,"6, june 2007 quakesim is offered as a principal component of the osse assessment, verification, and validation are needed between in an open sha architecture."
8,"quakesim is a distributed system, simulations, and seismic and geodetic data to assess their making it ideally suited for interfacing with networks of users. performance and cost benefit in loss estimation, given the it was developed to study the physics of earthquakes using complexity of physics-based approaches. state-of-the-art modeling, data manipulation, and pattern recog- the demonstrated success of insar in natural hazards re- nition technologies."
8,quakesim has clearly defined accessible search and applications is witnessed in the literature.
8,"a deliber- data formats and code protocols as inputs to the simulations. ate process is needed to ensure that these advances transition these tools have now made it possible to construct more into operational capacity, from observational data streams to complex models and simulations."
8,the development and inte- decision-support tools.
8,"however, the global coverage of obser- gration of grid services uses industry standard specifications. vations and specialized loss estimation tools is disparate."
8,"fur- similarly, opensha is open source, object-oriented, platform thermore, present insar-capable satellites were not designed independent, web/gui enabled, potentially distributed using specifically for such observations and have limitations in data web-services and distributed object technologies, and java- availability, frequency of observations, and less than optimum based, and is made possible using grid computing for full observational wavelengths."
8,nonetheless they provide initial hazard maps with digital libraries used to store large datasets data to help derive requirements for a dedicated insar mission.
8,"moreover, using the grid infrastructure, real-time collabo- these insar-capable data sources include the asar oper- ration tools could be integrated to merge decision support with ating at c-band, onboard envisat, launched by the european emergency response."
8,space agency in march 2002; it is an enhanced-capabilities incorporating quakesim into opensha and hazus-mh continuation of the ers-1/2 that has as one of its mission has a potential impact on enhancing decision-making in earth- objectives the monitoring of earthquake and volcanic hazards. quake disaster management.
8,"this incorporation would address radarsat-2 is canada’s next-generation commercial sar the need for more physics-based modeling and distributed satellite, to be launched later in 2007; operating at c-band, and computational infrastructure."
8,"moreover, given the increasing will be the first such system to offer quadrature polarization for realization of the potential of sar interferometry from space, better characterization of geophysical properties of the earth’s witnessed by analyses ranging from regional tectonic strain surface, while the radarsat-1 satellite is continuing to acquire mapping to fault structure and even urban density changes in c-band sar imagery since 1996."
8,"the japanese advanced land select cases, a deliberate approach to bringing these research observing satellite launched january 2006 includes a phased products to bear in loss estimation methodology would help to array l-band sar (palsar) designed to provide radar images assess performance benefits."
8,advanced simulations and their of land surface materials.
8,"the l-band wavelength (23 cm) is assimilation into hazus-mh using opensha architecture superior for insar measurements as it suffers less temporal would guide the end-to-end design of an insar system that decorrelation due to vegetation and scene changes, and early 1) would be integrated with existing airborne and ground-based palsar insar results are promising."
8,"the german aerospace assets; 2) provide opportunities for better understanding the center (dlr) should launch terrasar-x in 2007, with an linkages between phenomenology and damage; and 3) offer add-on satellite tandem-x planned for 2008 launch."
8,these a framework for enhanced decision- and policy-making.
8,an spacecraft will be flying in formation to provide single-pass underlying assumption is that the spatial and temporal require- sar interferometry with 2-m accuracy.
8,"the short, x-band ments for such a system could be met cost-effectively for oper- wavelength (3 cm) may limit repeat pass insar to short time ational capacity ranging from mitigation planning to disaster spans and less vegetated areas. response, anticipating continued advances in technology and insar tools to produce information products through in- integrated earth observation strategies. tegration, assimilation, modeling, and realistic computational simulations must continue to be developed, addressing issues of data access continuity, completeness, interoperability, and v."
8,c onclusion verification and validation.
8,"the value will be to both scientific the last few years have shown unprecedented growth in the research and operational scenario analyses, through the use of amount and quality of data collected to characterize ground integrated data sets, models, and simulations that offer comple- deformation in earthquake-prone areas."
8,"modeling and simula- mentary and overlapping measurements across requisite spatial, tion tools use these data to produce dynamic strain maps and temporal, and spectral scales."
8,the recently published study by estimate stress field changes that are indicative of earthquake the space studies board of the u.s.
8,national research council risk.
8,earth observing systems are enabling new kinds of fore- recommends that the national aeronautics and space admin- casts and hazard assessments for earthquakes.
8,"satellite remote istration (nasa) begin an insar mission as soon as possible sensing, along with computer-based modeling technologies are [21]."
8,this is a manifestation that the committee on earth enhancing the understanding of underlying physics and repre- science and applications from space recognizes the potential sentation of ground motions through simulations and pattern of a dedicated insar mission for addressing earthquakes and recognition in a manner that is not possible with statistical and other hazards. empirical methods alone.
8,"these data and advanced methods the desire to transition the outcomes of scientific re- greatly will improve estimates of potential earthquake risk, search into socioeconomic benefits is driven by several fac- including better understanding of earthquake source character- tors."
8,"decision- and policy-making increasingly look to science, istics and rupture processes."
8,"additional research, evaluation, technology, and derived information products as the rationale authorized licensed use limited to: univ of calif santa barbara."
8,"downloaded on november 23,2024 at 18:48:44 utc from ieee xplore."
8,restrictions apply.
9,"tralli et al.: conceptual case for assimilating insar data into hazus-mh earthquake module 1603 for ensuring reliability and sustainability, recognizing the com- [7] m."
9,"talebian, e."
9,"fielding, g."
9,"funning, m."
9,"ghorashi, j."
9,"jackson, plexity of the earth system."
9,addressing some of the problems h.
9,"nazari, b."
9,"parsons, k."
9,"priestley, p."
9,"rosen, r."
9,"walker, and t."
9,"wright, “the 2003 bam (iran) earthquake: rupture of a blind strike- with the greatest impact on economic vitality and environmen- slip fault,” geophys."
9,"lett., vol. 31, no. 11, pp."
9,"1–4, 2004. tal health—such as the management of natural disasters—in [8] e."
9,"fielding, m."
9,"talebian, p."
9,"rosen, h."
9,"nazari, j."
9,"jackson, turn requires new and integrated measurement schemes."
9,the m.
9,"ghorashi, and r."
9,"walker, “surface ruptures and building damage of the 2003 bam, iran, earthquake mapped by satellite synthetic aperture radar critical missing element is resources, which must be dedicated interferometric correlation,” j."
9,geophys.
9,"res., vol. 110, no."
9,"b3, pp. 1–15, to making these transitions to applications."
9,"recent disasters 2005. have highlighted the critical need for better information, par- [9] d."
9,"massonnet, m."
9,"rossi, c."
9,"carmona, f."
9,"adragna, g."
9,"peltzer, k."
9,"feigl, and t."
9,"rabaute, “the displacement field of the landers earthquake ticularly before and during the events."
9,"the key issue is forging mapped by radar interferometry,” nature, vol. 364, no. 6433, pp. 138– the connection between the science and the applications."
9,"142, jul."
9,an osse construct is suggested that would enable the [10] h.
9,"zebker, p."
9,"rosen, r."
9,"goldstein, a."
9,"gabriel, and c."
9,"werner, “on the derivation of coseismic displacement fields using differential demonstration to policy- and decision-makers of the potential radar interferometry—the landers earthquake,” j."
9,geophys.
9,"res., vol. 99, benefits of integrating insar with current ground-based sensor no."
9,"b10, pp."
9,"19617–19634, oct."
9,"1994. networks and with hazus-mh for earthquake disaster man- [11] ncc, preliminary damage map for bam, iran earthquake of 26 december 2003, 2004, tehran, iran: nat."
9,cartographic center iran. agement.
9,the global earth observation system of systems [12] b.
9,"schauer, e."
9,"laatsch, j."
9,"minor, p."
9,"vickery, and f."
9,"lavelle, “the hazus (geoss), for instance, is a large international cooperative hurricane model and its use in mitigation,” in proc."
9,"hurricane conf., effort to bring together existing and emerging hardware and orlando, fl, apr."
9,2002. 34 pp.
9,[13] d.
9,"bausch, “hazus: fema’s gis-based risk assessment tool,” in proc. software capabilities into an integrated global network of mea- geospatial inf."
9,& technol.
9,assoc. 7th annu.
9,"conf. and exhib.: a geospa- surements, enhanced data distribution, improved modeling, and tial odyssey, 2003."
9,[14] f.
9,"lavelle, p."
9,"vickery, b."
9,"shauer, l."
9,"twisdale, and e."
9,"laatsch, “the decision support."
9,"the conceptual case herein is envisioned as an hazus-mh hurricane model,” in proc. 11th int."
9,"wind eng., element toward implementing the geoss strategy in seismic lubbock, tx, jun."
9,"2–5, 2003. hazards."
9,spaceborne measurements and computer-based mod- [15] d.
9,"srinivasan, “battling hazards with a brand new tool,” plan."
9,"mag., pp."
9,"10–13, feb."
9,2003. eling and simulation are key contributors to an integrated earth [16] j.
9,"rundle, p."
9,"rundle, a."
9,"donnellan, p."
9,"li, w."
9,"klein, d."
9,l. observation strategy.
9,"the continued developments of opensha turcotte, and l."
9,"grant, “stress transfer in earthquakes, hazard estima- and quakesim are potential enablers of a future, enhanced tion and ensemble forecasting: inferences from numerical simulation,” tectonophysics, vol. 413, no. 1/2, pp."
9,"109–125, 2006."
9,hazus-mh earthquake module that incorporates spaceborne [17] e.
9,"field, v."
9,"gupta, n."
9,"gupta, p."
9,"maechling, and t."
9,"jordan, “hazard insar observations."
9,"with an improved earthquake forecasting map calculations using grid computing,” seismol."
9,"lett., vol. 76, no. 5, capability, decision-makers will have a better understanding of pp."
9,"565–575, 2005."
9,[18] r.
9,"lohman, m."
9,"simons, and b."
9,"savage, “location and mechanism of where earthquake risks are the highest and can work to develop the little skull mountain earthquake as constrained by satellite radar in- more effective disaster management programs to reduce losses terferometry and seismic waveform modeling,” j."
9,geophys.
9,"res., vol. 107, to life and property. no."
9,"b6, 2118, 2003."
9,doi:10.1029/2001jb000627.
9,[19] e.
9,"field, h."
9,"seligson, n."
9,"gupta, v."
9,"gupta, t."
9,"jordan, and k."
9,"campbell, “loss estimates for a puente hills blind-thrust earthquake in los angeles, california,” earthq."
9,"spectra, vol. 21, no. 2, pp."
9,"329–338, acknowledgment may 2005."
9,[20] j.
9,"rundle, k."
9,"tiampo, w."
9,"klein, and j."
9,"samartins, “self- this review paper was written at the jet propulsion organization in leaky threshold systems: the influence of near-mean field dynamics and its implications for earthquakes, neurobiology, and fore- laboratory, california institute of technology, under contract casting,” proc."
9,"sci., vol. 99, pp."
9,"2514–2521, 2002. to nasa."
9,"the authors would like to thank the two anonymous [21] committee on earth science and applications from space: a community reviewers for comments that contributed significantly to the assessment and strategy for the future, earth science and applications from space: urgent needs and opportunities to serve the nation, 2005, manuscript and helped clarify some of the principal points."
9,"washington, dc: national academy press."
9,"space studies board, division on engineering and physical sciences, national research council of the national academies."
9,r eferences [1] a.
9,"donnellan, j."
9,"rundle, j."
9,"ries, g."
9,"fox, m."
9,"pierce, j."
9,"parker, r."
9,"crippen, e."
9,"dejong, b."
9,"chao, w."
9,"kuang, d."
9,"mcleod, m."
9,"matu’ura, and j."
9,"bloxham, “illuminating earth’s interior through advanced computing,” ieee comput."
9,"eng., vol. 6, no. 1, pp."
9,"36–44, jan."
9,[2] a.
9,"gerber, r."
9,"baron, d."
9,"tralli, m."
9,"crison, s."
9,"bajpai, and g."
9,"dittberner, “medium earth orbit architecture for an integrated envi- ronmental satellite system,” earth obs."
9,"mag., vol. 13, no. 6, pp."
9,"10–15, sep."
9,"[3] national research council (nrc), living on an active earth, 2003, washington, dc: nat."
