page,p
1,"ieee transactions on geoscience and remote sensing, vol."
1,"45, no."
1,"6, june 2007 1595 conceptual case for assimilating interferometric synthetic aperture radar data into the hazus-mh earthquake module david m."
1,"tralli, ronald g."
1,"blom, member, ieee, eric j."
1,"fielding, andrea donnellan, and diane l."
1,evans abstract—the study of the earth as a system is being adopted volumes.
1,these advances are reducing the time necessary to widely by geoscientists.
1,numerical models and simulations are study long-term processes while constraining the models with providing the capability to rapidly test hypotheses and make observational data [1].
1,such capabilities provide a greater un- forecasts of complex geophysical behavior.
1,"international efforts are seeking to integrate existing and emerging earth observation derstanding of events occurring today from the perspective of systems into a global network, with enhanced data distribution, phenomenology (i.e., science) and for assessing impact on life models, and decision support tools."
1,"remote sensing is poised to and property (i.e., loss estimation). fulfill the increasing need for a synoptic framework."
1,"however, the with the increasing attention placed on transitioning re- desire to improve the connection between scientific research and sults of research into practical socioeconomic benefits, the societal benefits has not been matched with resources and tools geosciences—fundamentally comprised of atmospheric, solid required to bridge the gap between research and applications."
1,"natural hazards research and disaster management are a prime earth, and ocean sciences—have broadened their scope to example."
1,"here, we present a conceptual case for how interfero- include such topics as natural disasters, natural resources, metric synthetic aperture radar (insar) data could make a de- biological diversity, climate change, and the solar-terrestrial en- finitive contribution to understanding earthquake processes while vironment."
1,"viewed as a complex interacting system of physical, simultaneously supporting policy- and decision-making."
1,"insar chemical, and biological processes, the geosciences recognize measurements derived from time series of radar observations from the need for earth observations that range from particulate to earth orbit uniquely can provide geographically comprehensive maps of surface deformation."
1,"observing system simulations are global scales, from subdaily to decadal sampling and temporal suggested to evaluate the potential contributions of a future sys- spans, across the electromagnetic spectrum from gamma rays tem."
1,simulations would adopt an open seismic hazard analysis to microwaves.
1,"fig. 1 shows the breadth of measurements, (sha) framework, opensha, recognizing the need for more observations and experiments for tectonic, earthquake and ma- physics-based modeling and computational infrastructure."
1,sha terial processes.
1,"sensors and instruments are being placed on is employed by the hazus-mh earthquake module to estimate the seafloor, on autonomous underwater vehicles, on the ocean losses."
1,"insar measurements of strain accumulation would pro- vide event magnitude recurrence bounds for probabilistic sha, surface, on land and in boreholes, on balloons, unmanned aer- while coseismic insar measurements would add constraints on ial vehicles, and airborne and satellite platforms."
1,observation fault rupture models for deterministic approaches.
1,"moreover, in- venues in addition to traditional low-earth orbits are receiving terferograms would be incorporated graphically as proxy seismic increased consideration in architecture studies for environmen- risk maps for planning and mitigation. tal systems [2] because of the synoptic advantages afforded by index terms—hazus, interferometric synthetic aperture continuous imaging of the total full-disk earth system. radar (insar), observing system simulation experiment however, the desire to improve the connection between (osse), remote sensing, seismic hazard analysis. scientific research and societal benefits has not been matched with resources and tools to bridge the gap between research and i."
1,i ntroduction applications [3].
1,"the process of transitioning research products and knowledge into more effective risk reduction strategies t he study of the earth as a system is being adopted widely by geoscientists, treating the entire earth as a system that evolves from the interactions of its constituents. requires placing scientific queries and outcomes into an engi- neering, socioeconomic, and political context."
1,the u.s.
1,na- tional research council cites that scientists and engineers have this earth system science approach is enabled by the integra- lacked effective organizational and programmatic mechanisms tion of diverse technologies and data types from a multitude to exploit areas of synergy and better understand implementa- of observation venues.
1,earth system computer models rapidly tion issues [3].
1,"relying on advances in earth system computer test hypotheses and provide forecasts of future earth system models, observing system simulations are an effective means behavior over decades."
1,"moreover, advances in computational of assessing the impact and benefit of future data streams on science and numerical simulations allow the study of correlated numerical models and decision support tools."
1,"here, we suggest phenomena and recognition of subtle patterns in large data such simulation experiments for seismic hazard analysis (sha) and loss estimation."
1,"the effort would involve the participation manuscript received may 12, 2006; revised february 26, 2007. of observational system developers, data providers, and disaster the authors are with the earth science and technology directorate, management practitioners toward guiding the end-to-end archi- nasa jet propulsion laboratory, california institute of technology, pasadena, ca 91109 usa. tecture of an enhanced earthquake hazard monitoring and risk digital object identifier 10.1109/tgrs.2007.895848 assessment capability."
1,government work not protected by u.s copyright.
1,authorized licensed use limited to: univ of calif santa barbara.
1,"downloaded on november 23,2024 at 18:48:44 utc from ieee xplore."
1,restrictions apply.
2,"1596 ieee transactions on geoscience and remote sensing, vol."
2,"45, no."
2,"6, june 2007 fig."
2,"representation of the range of spatial and temporal scales of geophysical phenomenology related to tectonic, earthquake, and material processes, with observation domains for laboratory, field, and spaceborne measurements."
2,insar provides needed capabilities over local to regional scales and at time scales that complement seismology and geodesy.
2,(diagram adopted and used with permission from b.
2,minster).
2,"international efforts seek to integrate existing and emerg- motions, groundwater withdrawal, and many other phenomena. ing earth observation capabilities into a global network of a repeat-pass spaceborne insar system measures ground de- measurements, with enhanced data distribution, modeling, and formation by comparing reflected radar signals recorded on decision and policy support."
2,"resources and infrastructure that successive passes of an earth-orbiting satellite from nearly would be coordinated, and augmented and developed to deliver identical positions, enabling measurement of vector displace- improved data, information and model outputs to a broadening ments using pairs of images from multiple locations."
2,"con- community of users, decision- and policy-makers would in turn versely, a single-pass system measures topography, and is support a comprehensive and sustained global capability for comprised of two antennas on a common satellite or platform, integrated scientific measurements at the earth system level. as with the shuttle radar topography mission, or two satel- remote sensing data and derived geospatial information prod- lites flying in formation, as the planned tandem-x mission ucts are recognized to fulfill the increasing requirement for a of the german aerospace center."
2,"current and planned sys- synoptic framework (e.g., [4] and [5])."
2,"fig. 2 is a schematic tems, however, are limited due to inadequate data availability, of diverse measurements, complemented by modeling and sim- the frequency of observations and suboptimal observational ulation, for understanding earthquake risk potential."
2,"in order wavelengths that preclude their routine use for postearthquake to demonstrate an accelerated approach for transitioning these emergency response and systematic long-term measurements of capabilities to disaster management, here a case is offered interseismic strain and strain transients. suggesting conceptually how spaceborne interferometric syn- surface deformation is measured as follows."
2,interferometry thetic aperture radar (insar) measurements of seismically subtracts the phase of the radar waves that return to the anten- prone regions—at localized scales within a regional tectonic nas.
2,"the radar system is coherent, with wavelengths typically framework and at coseismic, postseismic, and interseismic 3–25 cm, so the phase difference of the waves transmitted intervals—could make contributions to phenomenological un- and received can be determined (having accounted for an derstanding while supporting policy and economic decision- unknown number of integer wavelengths) for each synthetic making for risk mitigation strategies, vulnerability reduction, aperture resolution element."
2,"although there are error factors, and emergency response. such as random phase shifts at the point of reflection (i.e., incoherence), topographic effects, satellite orbital errors, and atmospheric variability effects, it is possible to generate phase ii."
2,"i nterferometric s ynthetic change images that map the surface deformation (through a perture r adar the change in distance) along the radar line-of-sight between insar measurements derived from long time series of obser- different times at the same position in space to centimeter- vations uniquely can provide a geographically comprehensive level or better accuracy with a spatial resolution of the order map of surface deformation due to earthquakes, slow tectonic of 10–100 m."
2,authorized licensed use limited to: univ of calif santa barbara.
2,"downloaded on november 23,2024 at 18:48:44 utc from ieee xplore."
2,restrictions apply.
3,tralli et al.: conceptual case for assimilating insar data into hazus-mh earthquake module 1597 fig.
3,"schematic of how seismic, geodetic, and insar measurements of ground deformation, combined with computer-based simulations and data mining, advance understanding of earthquake hazards potential, contributing also to better representation of critical site-dependent effects."
3,"this complements empirical and statistical approaches to assessing the potential for ground motion, the impact on the built environment, and estimation of losses to life and property."
3,"in earthquake studies, insar has been used to map deformation at various stages of the earthquake cycle."
3,the coseismic deformation that occurs during an earthquake is obviously the most important cause of losses.
3,"insar has been used to map coseismic deformation for many large earthquakes, starting with the 1992 landers, california earthquake (e.g., [9] and [10])."
3,an urgent way to mitigate earthquake casualties is to rescue survivors.
3,"to aid rescue efforts, first-responder teams require damage assessments in the first 24–48 h."
3,international disaster response teams need a preliminary estimate of possible casualty levels even in the first 12 h after an earthquake in a remote location where deploying rescue teams takes a long time.
3,"while the ground resolution of current spaceborne systems is of order 10 m, thus an order of magnitude coarser than that of very high resolution meter-level optical imagery, radar provides an all-weather, and day–night capability that could complement airborne reconnaissance for damage assessment."
3,"for example, wyss et al. [6] show how the exact location of an earthquake rupture can make a huge difference in the estimate of casualties."
3,"they explain how the initial estimates from the global seismic networks for the location of the december 26, 2003 mw , 6.6 earthquake that devastated bam, iran (see fig. 3), generated a first preliminary loss estimate of less than 100 fatalities, far less than the official final toll of fig."
3,"general earthquake rupture area and final epicenter solution for the bam, iran, earthquake."
3,the area is sparsely populated except for the city 26 000 fatalities.
3,"this is because the city of bam, with about of bam."
3,"immediately after the earthquake, model-based casualty estimates 100 000 residents, is surrounded by very sparsely populated were very low due to initial seismological solutions indicating an epicenter at desert areas."
3,"the actual hypocenter of the 2003 earthquake some distance from bam, but later insar estimates of the location produced estimates much closer to the official death toll of more than 26 000 [6]."
3,early proved to be in the worst possible location—directly beneath estimates are used by relief agencies for response planning.
3,the insar images the city.
3,"wyss et al. [6] explain that insar analysis of envisat (see fig. 4), later, led field geologists to the surface ruptures [7], [8]."
3,authorized licensed use limited to: univ of calif santa barbara.
3,"downloaded on november 23,2024 at 18:48:44 utc from ieee xplore."
3,restrictions apply.
4,"1598 ieee transactions on geoscience and remote sensing, vol."
4,"45, no."
4,"6, june 2007 insar measurements would be of principal value, integrated with seismic and other monitoring measurements such as with the global positioning system (gps), providing observational constraints on computer-based modeling of the earthquake source."
4,better understanding of major earthquake sources and comparison to strong ground motion measurements and dam- age distribution aids prediction of damage and loss from future events.
4,long-term strain accumulation (interseismic) is nearly a linear function of time and is indicative of which fault zones are accumulating elastic strain and at what rate.
4,these long-term measurements provide constraints on magnitude recurrence for probabilistic sha.
4,"moreover, insar measurements can be used to estimate the depth and length extent of the locked zone in a major fault that can be expected to rupture in a future earth- quake, useful in deterministic analyses."
4,"time series maps of interseismic deformation also could be depicted as geographic information system (gis) layers to indicate areas of higher risk, as proxy seismic risk maps based on strain accumulation, fig."
4,"subscene of a complete insar image showing the correlation dif- relative to the building stock, critical infrastructure, and census ference for the city of bam, between preearthquake and coseismic insar data."
4,"on the other hand, transient strain (typically aseismic or pairs."
4,red areas show decreasing correlation due to increasing destruction.
4,"the thick black line is the up-dip projection of the main fault rupture deter- accompanied by very small earthquakes) is usually short-term mined by analysis of insar data, passing directly into the city."
4,the solid black deformation that releases accumulated elastic stress and circle shows the location of a single strong motion station.
4,"black hatching reduces the likelihood of a future earthquake, or transfers stress areas were mapped as “total damage,” green areas as “high damage” in the preliminary assessment made by the iran national cartographic center from one area to another."
4,"(there are also some fault segments, from aerial photographs [11]."
4,"the very high damage area marked “a” is the such as the central san andreas fault, that are continuously arg-e-bam castle that was severely damaged."
4,the “t” in the very low correla- deforming aseismically and are not expected to have major tion area is a tent city established after the event to house refugees.
4,blue areas are where the correlation is actually higher in the coseismic pair than preseismic earthquakes because there is no elastic strain accumulating.) (see [8] for discussion).
4,"detecting strain transients requires more dense temporal coverage that is difficult with existing insar satellite systems, advanced synthetic aperture radar (asar) could have been but also requires dense spatial coverage that is not always used to determine the location of the fault rupture much more available from ground-based gps networks and strain meters. accurately with a resulting loss estimate of 6600 to 12 700 with attendant advances in data management and distributed fatalities, which is within a factor of two of the official losses. modeling, the application of high-resolution spaceborne other studies of the 2003 bam, iran, earthquake [7], [8] radar remote sensing could guide the evolution of enhanced used interferometric correlation from envisat sar images to probabilistic and deterministic sha and loss estimation map details of surface ruptures of the earthquake and enabled methodologies."
4,"using simulations, a capability to assimilate location of the ruptures in the field."
4,"fielding et al. [8] showed coseismic interferograms and measurements, and magnitude that it was even possible to map the loss of buildings in the city recurrence from long-term strain accumulation data into of bam due to the 2003 earthquake (figs. 3 and 4)."
4,"using two hazus-mh and physics model-based sha schemes such as preevent and postevent envisat sar images, they calculate opensha can be prototyped to provide early assessments of the difference between the interferometric correlation for potential improvements from a future dedicated insar system. an interval, including the earthquake and an interval before this would accelerate the transition of insar data products (fig. 4), thus separating earthquake-related changes from other into disaster management applications. decorrelation effects."
4,damage to buildings was estimated by measuring the change from high correlation to low correlation iii.
4,hazus-mh e arthquake m odule — where buildings were destroyed.
4,"by measuring this correlation a d ecision -s upport t ool decrease within bam, a proxy damage assessment metric is obtained."
4,since the first postevent insar data were not the u.s.
4,"federal government has developed hazus-mh1 acquired until 2 weeks after the event, some of the decorrelation as a gis-based planning tool for emergency managers to is related to rescue and clean up efforts."
4,"admittedly, in more address the fundamental question of how to minimize dam- densely vegetated areas, this correlation methodology would age and loss of life from earthquake, flood, and severe wind have been significantly limited."
4,"an operational radar system events in order to ensure that such natural hazards do not would require a much shorter response time to effectively com- become large-scale, catastrophic natural disasters."
4,"several pub- plement other systems that might be deployed after a disaster. lications give general descriptions of the hazus-mh software, insar systems also can provide series of observations (e.g., [12]–[15])."
4,"the earthquake module is comprised of em- spanning the earthquake cycle to help elucidate aseismic slip pirical and statistical analysis inputs, geophysical relationships distribution, interseismic strain accumulation, and the mechan- ical properties of the crust and lithosphere."
4,"for sha, coseismic 1 multihazard (mh)."
4,authorized licensed use limited to: univ of calif santa barbara.
4,"downloaded on november 23,2024 at 18:48:44 utc from ieee xplore."
4,restrictions apply.
5,"tralli et al.: conceptual case for assimilating insar data into hazus-mh earthquake module 1599 for fault physics and ground motion, fault source parameters, there are some recognized limitations in this approach."
5,"for census tract data, building stock, and common environmen- example, fault finiteness is accounted for by measuring the tal systems research institute (esri) arcgis 9.0 gis."
5,"the distance to the surface projection of the fault location; the federal emergency management agency (fema) in fact ini- direction of rupture is not accounted for, nor the peak motions tially released hazus in 1999 primarily as a tool for earth- adjusted by a directivity term."
5,"with this approach, the location quake disaster risk assessment. of the earthquake epicenter does not have any effect on the each hazard-specific module—earthquake, flood, and resulting ground motions; only the location and dimensions of wind—includes a basic functionality common to all hazus the fault matter."
5,"therefore, only the average effect for a given natural hazards loss estimation modules, plus additional fault is shown."
5,the empirical predictive approach also only functionality unique to the particular hazard.
5,"each module gives average peak ground motion values so it does not account allows the user to map, assess, and display geospatial data for all the expected variability in motions, other than the afore- pertaining to the specific natural hazard to assess and mitigate mentioned site amplification (or attenuation) variations. hazard risk."
5,"hazus-mh also enables estimation of physical these shortcomings are being addressed in such efforts as damage to buildings, critical facilities, other infrastructure, the regional earthquake likelihood models (relm) project, and attendant economic losses."
5,hazus-mh makes use of which is a joint effort between the southern california earth- nationwide geospatial databases and employs standardized quake center (scec) and usgs.
5,"the relm project is loss estimation and risk assessment methodology that has developing a system-level time-dependent earthquake-rupture- been well documented by fema, and others cited above."
5,it is forecast (erf) model for southern california.
5,the intent of comprised of three levels of analysis.
5,"levels 1 and 2 rely on relm is to help understand uncertainties in sha and identify standard databases, including general building stock, essential areas where additional research and model development are facilities, high potential loss facilities, and lifelines such as needed."
5,"the goal is to create a more physics-based time- transportation and utility systems, and additional input data as dependent stress-interaction alternative to the time-independent deemed necessary."
5,level 3 involves expert input and parameter model currently applied in the national hazard maps.
5,"from modification. a scientific perspective, this provides a more realistic likeli- hood of future event occurrence."
5,"however, from a structural a."
5,"scenario earthquakes engineering design perspective, such short-term forecasts are inadequate, as all possible sequences of events over the lifetime the generation of scenario earthquakes is central to sha. of a structure must be taken into consideration."
5,"thus, simulated scenario earthquakes describe expected ground motions and earthquakes are catalogued over a time span of interest, incor- the effects of specific hypothetical large earthquakes."
5,an porating the effects of stress correlations.
5,"opensha is designed earthquake hazard scenario is based on simulating user-defined to accommodate such models, like the virtual california erf events, historic events, or probabilistic events."
5,"for instance, [16]."
5,"time domain simulations have their own uncertainties that a particular fault or fault segment is assumed to rupture over must be addressed, such as the initiation of the rupture, rupture a certain length, relying on consensus-based information about propagation, and slip distribution in space and time."
5,"thus, it is the potential behavior of the fault for historic events; the actual not meant to be implied that time domain simulations neces- rupture dimensions may be constrained based on existing ob- sarily are better than empirical/statistical models."
5,"however, the servations or models."
5,"then, ground motions at all locations in capabilities of insar are amenable to improving physics-based a chosen region surrounding the causative fault are estimated to simulation models of complex fault behavior, and for erf assess potential shaking. models that are constrained by measurements of crustal strain."
5,the california geological survey (cgs) and the u.s.
5,geo- the usgs earthquake hazards program recognizes that logical survey (usgs) have evaluated the probabilistic hazard while current earthquake modeling techniques are sufficient for from active faults in the state as part of the probabilistic providing useful motion time histories and scenario shakemaps seismic hazard assessment for the state of california.
5,"cur- based on empirical means (e.g., ground motion attenuation re- rently, the shakemap scenario events come directly out of lations), substantial improvement will require developing cost- the cgs catalog of fault source parameters that make up the effective numerical tools for proper theoretical inclusion of statewide probabilistic sha."
5,ground motions are estimated known complex ground motion effects.
5,"the state of california using an empirical attenuation relationship, which is a predic- has established a working group on california earthquake tive relationship that allows the estimation of the peak ground probabilities."
