page,p
5,"remote sensing 34, 1353–1368, 1996."
6,922 y.
6,qiao et al.
6,"/ advances in space research 43 (2009) 917–922 friedl, m.a., brodley, c.e."
6,"decision tree classiﬁcation of land cover from saraf, a.k., choudnury, p.r."
6,integrated remote sensing and gis for remotely sensed data [j].
6,"remote sensing of environment 61, 399–409, groundwater exploration and identiﬁcation of artiﬁcial recharge 1997. sites [j]."
6,"international journal of remote sensing 19 (10), 1825– gong, p., pu, r., miller, j.r."
6,"coniferous forest leaf area index estimation 1841, 1998. along the oregon transect using compact airborne spectrographic shi, yiqiang the application of remote sensing technology to environ- imager data [j]."
6,photogrammetric engineering and remote sensing 61 ment: its progress and prospects [j].
6,"remote sensing for land and (9), 1107–1117, 1995."
6,"resources 54 (4), 7–13, 2002."
6,"lo, c.p., quantrochi, d.a., luvall, j.c."
6,"application of high-resolution tassan, s."
6,a procedure to determine the particulate content of shallow thermal remote sensing and gis to assess the urban heat island eﬀect water from thematic mapper data [j].
6,international journal of remote [j].
6,"remote sensing 18 (2), 287–304, 1997."
6,"sensing 18 (10), 557–562, 1997."
6,"phinn, s.k."
6,"a framework for selecting appropriate remotely sensed data wang, zhihua an airborne remote sensing survey of qian-jiang-ping dimensions for environmental monitoring and management [j]."
6,inter- landslide in zi-gui shaxisha town [j].
6,"remote sensing for land and national journal of remote sensing 19 (17), 3457–3463, 1998."
6,"resources 57 (3), 5–9, 2003."
