title,author,year,screening_decision,reason_for_exclusion,quick_notes,soc_method,societal_benefit,value_units,eo_data,applied_science_theme,revisited
Assimilation of GRACE Terrestrial Water Storage Data into a Land Surface Model: Results for the Mississippi River Basin,"Zaitchik, Benjamin F. and Rodell, Matthew and Reichle, Rolf H.",2008,exclude,data not valued,NA,NA,NA,NA,NA,NA,NA
A User-Driven Approach to Determining Critical Earth Observation Priorities for Societal Benefit,"Zell, Erica and Huff, Amy K. and Carpenter, Adam T. and Friedl, Lawrence A.",2012,exclude,data not valued,keep in mind for identifying gaps later on - papers that present priorities compared to implementations,NA,NA,NA,NA,NA,NA
Future Earth Observation Strategy for Societal Benefits,"Zhou, Guoqing and Baysal, O.",2005,exclude,data not valued,describing value of future satellite observation system for various use cases.  does not actually calculate value - mentions how data could drive benefits but no actual value calculation,NA,NA,NA,NA,NA,NA
Benefits of the Free and Open Landsat Data Policy,"Zhu, Zhe and Wulder, Michael A. and Roy, David P. and Woodcock, Curtis E. and Hansen, Matthew C. and Radeloff, Volker C. and Healey, Sean P. and Schaaf, Crystal and Hostert, Patrick and Strobl, Peter and Pekel, Jean-Francois and Lymburner, Leo and Pahlevan, Nima and Scambos, Ted A.",2019,exclude,review; data not valued,"describes benefits of free and open access to landsat imagery - more downloads, more publications, more uptake for research; also describes economic benefits, but referring to papers elsewhere that did those analyses",NA,greater uptake of landsat for academic studies,publications,landsat,various,NA
Economic Value of Environmental and Weather Information for Agricultural Decisions - A Case Study for Oklahoma Mesonet,"Ziolkowska, Jadwiga R.",2018,include,NA,NA,utility value;voi,ag production,dollars,mesonet,agriculture,x
Benefits and Beneficiaries of the Oklahoma Mesonet: A Multisectoral Ripple Effect Analysis,"Ziolkowska, Jadwiga R. and Fiebrich, Christopher A. and Carlson, J. D. and Melvin, Andrea D. and Sutherland, Albert J. and Kloesel, Kevin A. and McManus, Gary D. and Illston, Bradley G. and Hocker, James E. and Reyes, Reuben",2017,exclude,data not valued,"oklahoma mesonet network of weather stations - not satellite, but still eo?  benefits for improving predictions of extreme weather events - but these are not measured in this paper, but documented elsewhere and mentioned here?",NA,NA,NA,NA,NA,NA
