page,p
9,"the ndmc maintains weekly usdm drought designation data, which is archived online back to the year 2000 in the form of county-level statistics.3 the university of nebraska-lincoln maintains weekly grace-da spatial data online; tagged image file format (tiff) images of these spatial data are available for every week between august 2002 and september 2014.4 nasa author manuscript the usdm and grace-da county data were merged, resulting in a dataset with drought designations by the usdm and the three grace-da indicators for every county in the continental united states, for every week between 2002 and 2014."
9,we then assigned a single drought category to each county-week observation by taking the highest drought category.
9,"for example, if 10 percent of a county is classified as d4 and the remainder is classified in a lower category in a given week, category d4 is assigned to that county-week observation."
9,"then, for each county, the total number of weeks in each year that the county was assigned to each drought category under the usdm and the three grace-da indicators is calculated."
9,farm income data were obtained from the bureau of us economic analysis (bea) for each county and year covered by the drought indicator data.
9,the economic indicator of interest in the analysis is the sum of realized net income and the value of inventory change.
9,"realized net income consists of total cash receipts and other income for farms, minus total production nasa author manuscript expenses."
9,the value of inventory change is the value of the net change in farm inventories of livestock and crops that are held for sale during a calendar year.
9,"as a result, we obtain an estimate of farm proprietors’ income for a given year that includes farm income from production during that year only, and not that of previous years."
9,inventories are an important factor to control for in an analysis of the impacts of drought on farm income since inventories contain value of production generated in previous years for which current drought status does not apply.
9,"bea data on farm income are annual and were available until 2013; thus, the final panel data set covers the 2002 to 2013 period."
9,3this archive can be accessed at http://droughtmonitor.unl.edu/mapsanddata/gisdata.aspx.
9,4the grace-da drought indicator data are described in section 2.2.
9,the spatial data can be accessed at http://seca.unl.edu/ web_archive/nasa/grace.
9,weather clim soc.
9,author manuscript; available in pmc 2019 january 01.
10,bernknopf et al.
10,page 10 corn yield data were obtained from the usda’s national agricultural statistics service.
10,"while farm income data are available for every county in every year during the 2002 to 2013 period, yield data are not available for every county-year."
10,"yield observations are missing when counties do not experience corn production, have a sufficiently small number of nasa author manuscript producers such that information is not disclosed for privacy reasons, or are simply not surveyed."
10,one important implication of the choice for an agricultural indicator is the relationship between a drought severity signal and agriculture production is subject to many biophysical and behavioral processes in addition to impacts on crop and livestock conditions.
10,"as a result, the correlations capture the potentially countervailing effects of on-farm drought management and adaptation, including changes in irrigation practices, crop choice, and seed type choice, as well as policy-driven effects on farm income such as payments from drought relief programs and crop insurance."
10,"therefore, the correlations identified below should not be interpreted as only representing the direct impact of drought on crop and livestock conditions, rather it is the impact of drought on farm income given all the adjustments that are available to farmers and ranchers."
10,model estimation nasa author manuscript our econometric approach enables the comparison of the degree of correlation between different sets of drought indicators and realized net farm income.
10,"estimation of realized net farm income in a county in a specific year involves usdm indicators only as explanatory variables: farmy it = α + β0usdm d0wks + ⋯ + β4usdm d4wks + λt + φi + εit . (9) it it in equation 9, farmyit represents realized net farm income plus the value of inventory change or corn yield in county i in year t, depending on the specification."
10,"usdm_d0wksit represents the number of weeks in year t that county i was designated as being in drought category d0, usdm_d1wksit represents the number of weeks in year t that county i was designated as being in drought category d1, etc."
10,"equation 9 includes a set of year dummies, λt, which controls for unobserved, time-varying determinants of farm income that are nasa author manuscript equivalent for all counties."
10,"these effects can include changes in crop or livestock prices at the national level, or changes in the availability of modern seed varieties and other improved agricultural production technologies."
10,"finally, county fixed effects are included, represented by φi, which allows us to obtain unbiased parameter estimates in the presence of unobserved, county-specific characteristics that do not vary over time."
10,"in a similar equation, usdm and grace-da indicators are combined to estimate the effect of additional parameters."
10,"first, groundwater storage indicators are added as explanatory variables: weather clim soc."
10,author manuscript; available in pmc 2019 january 01.
11,bernknopf et al.
11,"page 11 farmy it = α + β0usdm d0wks + ⋯ + β4usdm d4wks + β5grace gw +⋯ (10) it it d0wksit + β9grace gw + λt + φi + εit, d4wksit nasa author manuscript where grace_gw_d0wksit represents the number of weeks in year t that county i was designated as being in drought category d0 by the grace groundwater indicator, grace_gw_d1wksit represents the number of weeks in year t that county i was designated as being in drought category d1 by the grace groundwater indicator, etc."
11,we then repeat the estimation of equation 10 by replacing the grace-da groundwater storage indicators with the grace-da surface and root zone soil moisture indicators to quantify the correlation of these indicators with net farm income independently.
11,"next, versions of equation 10 were estimated with two of the three grace-da indicators as explanatory variables."
11,"this involves three additional regressions (i.e. one including grace-da groundwater storage and surface soil moisture, one including grace-da groundwater storage and root zone soil moisture, and one including grace-da surface soil moisture and root zone soil moisture)."
11,"finally, a version of equation 10 includes all three grace- nasa author manuscript da indicators."
11,"in total, this procedure involves seven regressions."
11,use of linear specifications for statistical analysis of panel data is standard practice in the economics literature (greene 2011).
11,equation 9 and all versions of equation 10 are estimated using robust standard errors clustered at the county level to account for any heteroskedasticity in the data.
11,"when farm income is the dependent variable, each model is estimated for all counties in the lower 48 states to obtain goodness-of-fit measures that apply to the nation as a whole."
11,"for corn yield, each model is estimated for the subset of counties for which yield data are available."
11,"in addition, we explore whether grace-da affects the goodness of fit differentially across six regions, the northeast, southeast, midwest, south, high plains, and west.5 4.3."
11,"goodness-of-fit for comparing information structures table 1 presents results from estimation of equations 9 and 10, where we only present coefficient estimates for a specification of equation 10 that includes all three grace nasa author manuscript indicators."
11,the results illustrate how the magnitude of the coefficient estimates associated with the usdm variables change substantially when grace indicators are also included as variables in the regression.
11,"in addition to identifying differences in the coefficient estimates arising from estimation of equations 9 and 10, we compare the goodness of fit of the two models by calculating three statistics and performing one statistical test."
11,the three statistics are: 1.
11,adjusted r-squared; 2.
11,akaike information criterion (aic); and 5states were aggregated into these regions based on the convention used by the usdm.
11,"colorado and wyoming, which are double- counted in usdm maps as being in both the west and high plains regions, were both placed in the high plains region for this study."
11,weather clim soc.
11,author manuscript; available in pmc 2019 january 01.
12,bernknopf et al.
12,page 12 3.
12,bayesian information criterion (bic).
12,adjusted r-squared is a variant of the commonly used r-squared statistic.
12,"for a particular regression, the adjusted r-squared is equal to the percentage of the variation in net farm nasa author manuscript income or corn yield explained by the drought indicators included as explanatory variables."
12,"the adjusted r-squared accounts for the fact that r-squared automatically increases when extra explanatory variables are added to a model, and is thus more suitable when comparing the explanatory power of regression models that contain different numbers of predictors."
12,an adjusted r-squared is necessary since the regressions that include grace-da indicators have a larger number of predictors than the one that only includes usdm indicators.
12,"the aic and bic are alternative measures to aid model selection, with the bic imposing a heavier penalty on model complexity."
12,"taken together, improvements in these three statistics for models that include grace-da variables suggest that their inclusion in a model improves the goodness of fit between drought, net farm income, and crop yields."
12,f tests were conducted to estimate the joint significance of the grace-da variables in those regressions that included them as predictors.
12,"joint significance of the grace-da variables suggests that their inclusion in models of drought, farm income, and crop yields is statistically appropriate."
12,nasa author manuscript tables 2 and 3 list the outcomes for the three goodness-of-fit tests and the p-values associated with the f test for joint significance of the grace-da indicators.
12,the statistic is highlighted in bold font for the combination of umdm and grace-da variables that yields a better goodness of fit than all other combinations.
12,"with only a few exceptions, the econometric models indicate an improvement in the prediction of the impact of drought on farm income and corn yield by adding grace-da drought indicators as supplemental information to the usdm drought severity categories."
12,"when considering all counties in the lower 48 states, the adjusted r-squared statistic improves by 13.1 percent for farm income and 2.5 percent for corn yield when going from a model with usdm indicators only to one in which all three grace-da indicators are added."
12,"this improvement varies by region, from 3.3 percent in the midwest to 38.9 percent in the south for farm income, and from 1.0 percent in the northeast to 30.0 percent in the west for corn yield."
12,"generally, the best goodness of fit is achieved in models in which one or more grace-da indicators are present in addition to the usdm indicators."
12,"this is particularly true for the high plains, midwest, and south."
12,"results for the northeast, southeast, and west are more mixed."
12,the nasa author manuscript results of the f tests lead to a similar conclusion.
12,expressing improvements in goodness of fit in terms of statistics and information criteria can make it difficult to assess whether the improvements are economically significant.
12,"in order to address this issue, we calculated the prediction of the error component from the estimation of equations 9 and 10."
12,these prediction errors (residuals) represent the difference between the actual farm income and crop yield values that occurred during the sample period and the farm income and crop yield values that are predicted by the two models.
12,"for farm income, the prediction errors are already expressed in terms of dollars, so they provide a more intuitive sense of the difference in the accuracy of the models."
12,"for corn yields, we calculate a dollar representation of the residuals by multiplying predicted corn yields with observed corn acreage and prices, thus obtaining values for revenue from corn production."
12,weather clim soc.
12,author manuscript; available in pmc 2019 january 01.
13,bernknopf et al.
13,page 13 table 4 provides the number of county-year observations for all lower 48 states that are associated with different prediction error sizes for the model with usdm indicators only and the model with all three grace-da indicators added.
13,"for farm income, there are 36,624 county observations during the period of the analysis with prediction errors that nasa author manuscript ranged from $4 to as much as $121m."
13,"for corn yields, there are 21,079 county observations with prediction errors that ranged from $0 to $133m."
13,the counts comparison shows that adding grace-da variables to the model alters the distribution of prediction errors.
13,"for both farm income and corn yields, the impact of this change in the distribution with grace-da was to reduce the number of prediction errors in the larger ranges of, which are replaced by errors in the smaller ranges."
13,the magnitude of the errors that are avoided by the addition of grace-da indicators is economically significant given the fact that mean net farm income in our dataset is only $21.3m.
13,"furthermore, reducing the frequency of large errors is important for decision makers because larger errors are likely to be associated with societal costs that are proportionately larger than those associated with small errors."
13,"there is a social loss from wrongly categorizing county drought severity, which to the decision maker is measured as the uncertainty (variance) of the probability function and increases with the magnitude of the misclassification."
13,the social loss is due to the limitation nasa author manuscript in accuracy of drought severity with the data inputs that make up the usdm.
13,"in the next section, we illustrate how this reduction in the magnitude of errors can translate to meaningful changes in a policymaking setting."
13,"policy implications and discussion because many drought assistance programs seek to direct a finite amount of disaster funds to the regions that are most affected by drought during the most susceptible periods, having access to a drought indicator (or set of drought indicators) that correlates well with agricultural outcomes would generate significant societal value."
13,the lagp made $50 million available to states with eligible counties.
13,"to be eligible, a county must have experienced exceptional (usdm category d4) or extreme (usdm category d3) drought during march 7, 2006 to august 31, 2006."
13,"to evaluate how decision-making might be affected by incorporating grace-da into the usdm, we developed county eligibility schedules under both datasets."
13,nasa author manuscript results of this evaluation are presented in figure 3.
13,"the three maps on the top row show counties that were deemed eligible for assistance based on usdm status but for which grace-da indicators for groundwater storage, surface soil moisture, and root zone soil moisture (respectively) did not indicate any drought status."
13,maps in the lower row show counties that were deemed ineligible for assistance based on usdm status but for which grace-da indicated either extreme drought (d3) or exceptional drought (d4).
13,counties that were deemed eligible for assistance under the usdm but had no indications of drought according to the grace-da groundwater indicator were clustered near the ogallala aquifer.
13,"counties that were not in drought according to the usdm but were in d3 or d4 status under the three grace-da indicators were clustered in the pacific northwest, nevada, utah, michigan, and new england."
13,these counties would have been the most likely to switch eligibility status had grace-da information influenced the production of the weather clim soc.
13,author manuscript; available in pmc 2019 january 01.
14,bernknopf et al.
14,"page 14 usdm in 2006, highlighting the practical implications of harnessing the remotely sensed data."
14,"in order to get a sense of the magnitude of the potential changes in assistance allocation, we nasa author manuscript replicated the allocation approach that usda outlines in their lagp program fact sheet,6 using grace and usdm drought indicators to determine eligibility, using the same time period (7 march 2006 – 31 august 2006) and severity levels (d3 or d4)."
14,"once eligibility is determined using all relevant indicators, the funding allocation was estimated based on the number of adult beef cattle and sheep in eligible counties in each state, using usda data."
14,"keeping total funding constant at $50 million, the allocation that would have occurred had eligibility been determined using the grace-da indicators is calculated."
14,"basing the allocation decision entirely on grace-da indicators would have increased program allocation to a large number of states and reduced allocations to a small number of states, most notably oklahoma, south dakota, and texas."
14,"if grace-da had a greater influence on the program’s eligibility decision, up to $16 million of the $50 million distributed by the lagp would have been allocated to different states than what they actually were."
14,"one obvious caveat regarding these hypothetical changes in eligibility is that they assume that the eligibility decisions would be made entirely based on a grace-da nasa author manuscript indicator, which is unlikely to occur in practice."
14,it is also possible that policymakers may wish to make allocations based on vulnerability considerations that the usdm is able to capture but that are not captured by grace-da or by farm income or crop yield data.
14,"however, the simulations are illustrative in that they show the counties that would most likely have switched eligibility status had grace-da been further incorporated into eligibility decisions, as well as provide an upper bound on the financial implications of alternative allocations under the lagp."
14,the usdm is an important tool that is used by private and public sectors decision makers for drought management.
14,"because, in some cases, it is the sole criterion for a community’s eligibility for disaster assistance, it is imperative that the usdm be as accurate as possible for cost effective drought policy."
14,"in this paper, a bayesian framework is developed for quantifying the voi of grace-da soil moisture and groundwater indicators for drought monitoring, including the development of a conceptual decision model, an econometric analysis to characterize the contribution of grace-da to the usdm in capturing the nasa author manuscript effects of drought on the agricultural sector, and hypothetical simulations of a real-world drought assistance policy."
14,"grace-da has the potential to lower the uncertainty associated with our understanding of drought, and that this improved understanding has the potential to change policy decisions that lead to tangible societal benefits."
14,"although we explored the policy relevance of our findings by examining how grace-da data may have changed county eligibility for drought assistance under the lagp program, we are unable to quantify the actual voi in this application because we do not have access to data on county-level allocations of aid funds."
14,such data would have allowed the estimation of the effect of drought assistance on local agricultural outcomes.
14,future research 6the lagp fact sheet is available at https://www.fsa.usda.gov/internet/fsa_file/live_a_grant_prog06.pdf.
14,weather clim soc.
14,author manuscript; available in pmc 2019 january 01.
15,bernknopf et al.
15,page 15 may be able to directly estimate the voi of grace-da for drought monitoring by explicitly modeling the socioeconomic outcomes associated with different drought management actions.
15,"nasa author manuscript acknowledgments the authors wish to thank sara pesko for excellent research assistance, and bradley doorn and mark svoboda for valuable comments and suggestions."
15,"this project was completed with financial support from the national aeronautics and space administration, nnx09a01g."
15,we dedicate this paper to dr.
15,molly macauley for her leadership in space economics who died unexpectedly in 2016.
15,"references berger, j."
15,statistical decision theory and decision analysis.
15,springer-verlag; 1985. p.
15,"617 bernknopf, r., dinitz, l., loague, k."
15,an interdisciplinary assessment of regional-scale nonpoint source groundwater vulnerability: theory and application; usgs professional paper 1645. -2001.p.
15,27[available online at http://pubs.usgs.gov/pp/pp1645/pp1645.pdf.]
15,"bradford df, kelejian hh."
15,the value of information for crop forecasting in a market system: some theoretical issues.
15,rev econ stud.
15,1977; 44(3):519–531.
15,"crean j, parton k, mullen j, hayman p."
15,valuing seasonal climate forecasts in a state-contingent manner.
15,aust j agrr resour ec.
15,2014; 59(1):61–77.
15,"doi: 10.1111/1467-8489.12041 nasa author manuscript economou t, stephenson db, rougier jc, neal ra, mylne kr."
15,on the use of bayesian decision theory for issuing natural hazard warnings.
15,proc r soc a.
15,2016; 472:20160295. http://dx.doi.org/ 10.1098/rspa.2016.0295.
15,"[pubmed: 27843399] freixas, x., kihlstrom, r."
15,"risk aversion and information demand, chapter 5."
15,"in: boyer, m., kihlstrom, re., editors."
15,bayesian models in economic theory.
15,north-holland: 1984. p. 317p fema (federal emergency management agency).
15,national mitigation strategy: partnerships for building safer communities. -1995.p.
15,44[available online at http://fas.org/irp/agency/dhs/fema/ mitigation.pdf] gossner o.
15,comparison of information structures.
15,games and economic behavior.
15,2000; 30:44–63.
15,"doi: 10.1006/game.1998.0706 greene, w."
15,econometric analysis.
15,pearson; 2011. p.
15,"1232 houborg r, rodell m, li b, reichle r, zaitchik b."
15,drought indicators based on model-assimilated gravity recovery and climate experiment (grace) terrestrial water storage observations.
15,water resources res.
15,2012; 48(7):1–17.
15,"doi: 10.1029/2011wr011291 howitt, r., macewan, d., medellín-azuara, j., lund, j., sumner, d."
15,economic analysis of the 2015 drought for california agriculture.
15,2015. p.
15,"16[available online at https://watershed.ucdavis.edu/ files/biblio/final_drought%20report_08182015_full_report_withappendices.pdf] koster rd, suarez mj, ducharne a, stieglitz m, kumar p."
15,a catchment-based approach to modeling nasa author manuscript land surface processes in a general circulation model.
15,model structure.
15,j geophys res.
15,2000; 105(d20):24809–24822. doi:0.1029/2000jd900327.
15,"laffont, j-j."
15,the economics of uncertainty and information.
15,mit press; 1989. p.
15,"289 landerer f, swenson s."
15,accuracy of scaled grace terrestrial water storage estimates.
15,water resour res.
15,"2012; 48:4.doi: 10.1029/2011wr011453 lawrence, d."
15,the economic value of information.
15,springer-verlag; 1999. p.
15,"393 lence sh, hayes dj."
15,parameter-based decision making under estimation risk: an application to futures trading.
15,j financ.
15,1994; 49(1):345–357.
15,"doi: 10.2307/2329149 li b, rodell m, zaitchik bf, reichle rh, koster rd, van dam tm."
15,assimilation of grace terrestrial water storage into a land surface model: evaluation and potential value for drought monitoring in western and central europe.
15,j hydrol.
15,2012; 446:103–115.
15,doi: 10.1016/j.jhydrol.
15,2012.04.035 weather clim soc.
15,author manuscript; available in pmc 2019 january 01.
16,bernknopf et al.
16,"page 16 qian c, chen j, nakagawa t."
16,comparison of two information structures with noise and its application to bayes decision analysis.
16,quality technology &quantitative management.
16,2009; 6(1):1–10. http://dx.doi.org/10.1080/16843703.2009.11673180.
16,"rodell m, famiglietti js."
16,an analysis of terrestrial water storage variations in illinois with nasa author manuscript implications for the gravity recovery and climate experiment (grace).
16,wat resour res.
16,2001; 37:1327–1340.
16,"doi: 10.1029/2000wr900306 svoboda m, lecomte d, hayes m, heim r, gleason k, angel j, rippey b, tinker r, palecki m, stooksbury d, miskus d, stephens s."
16,the drought monitor.
16,b amer meteor soc.
16,2002; 83(8): 1181–1190.
16,doi: 10.1175/1520-0477(2002)083<1181:tdm>2.3.
16,"co;2 swenson s, wahr j."
16,post processing removal of correlated errors in grace data.
16,geophys res lett.
16,"2006; 33:8.doi: 10.1029/2005gl025285 zaitchik b, rodell m, reichle r."
16,assimilation of grace terrestrial water storage into a land surface model: results for the mississippi river basin.
16,j hydrometeor.
16,2008; 9(3):535–548.
16,doi: 10.1175/2007jhm951.1 nasa author manuscript nasa author manuscript weather clim soc.
16,author manuscript; available in pmc 2019 january 01.
17,bernknopf et al.
17,page 17 nasa author manuscript figure 1.
17,influence diagram describing the decision problem of issuing financial assistance.
17,"oval nodes indicate uncertain quantities, rectangular node relates to decisions and hexagonal nodes relate to outcomes (adapted from economou et al 2016)."
17,nasa author manuscript nasa author manuscript weather clim soc.
