page,p
1,"338 ieee systems journal, vol."
1,"2, no."
1,"3, september 2008 a conceptual framework for assessing the benefits of a global earth observation system of systems steffen fritz, robert j."
1,"scholes, michael obersteiner, jetske bouma, and belinda reyers abstract—the aim of the global earth observation system-of- the farming family that anxiously scans the sky for rain to systems (geoss) is to improve the information available to de- multinational high-cost efforts, such as programs that observe cision makers, at all levels, relating to human health and safety, the earth from space."
1,"therefore, earth observation systems, protection of the global environment, the reduction of losses from natural disasters, and achieving sustainable development."
1,"specifi- broadly defined, are nothing new and societies have implicitly cally, geoss proposes that better international cooperation in the adjusted the amount of effort that they put into such activities collection, interpretation, and sharing of earth observation infor- such that it satisfies some intuitive balance with the benefits mation is an important and cost-effective mechanism for achieving that are expected from the activity."
1,with the emergence in this aim.
1,"while there is a widespread intuition that this proposi- tion is correct, at some point the following question needs to be modern times of nation-states, and the rise of science as the answered: how much additional investment in earth observation dominant mode of making and interpreting such observations, (and specifically, in its international integration) is enough?"
1,"this much of the formal activity in earth observation has been leads directly to some challenging subsidiary questions, such as institutionally concentrated at the level of national technical how can the benefits of earth observation be assessed?"
1,what are the incremental costs of geoss?
1,are there societal benefit areas agencies.
1,"for example, virtually every country in the world has where the return on investment is higher than in others?"
1,"the geo- some form of weather service that collects climate data, and a bene project has developed a “benefit chain” concept as a frame- statistical office that collates agriculture and natural resource work for addressing these questions."
1,the basic idea is that an in- information.
1,"clearly, people see benefit in collecting and sharing cremental improvement in the observing system (including its data information and that there are economies of scale to doing so collection, interpretation and information-sharing aspects) will re- sult in an improvement in the quality of decisions based on that in- at a national level."
1,the central premise of the global earth formation.
1,"in turn, this will lead to better societal outcomes, which observation system-of-systems (geoss), implemented by the have a value."
1,this incremental value must be judged against the in- intergovernmental group on earth observations (geo) at its cremental cost of the improved observation system.
1,"since in many third summit in brussels in february, 2004 (iptt 2004), is that cases there will be large uncertainties in the estimation of both the costs and the benefits, and it may not be possible to express them these benefits and economies extend to a supra-national scale in comparable monetary terms, we show how order-of-magnitude as well."
1,"but whereas political and technical mechanisms exist approaches and a qualitative understanding of the shape of the cost at the national level to “right-size” earth observation activities and benefit curves can help guide rational investment decisions in (at least in principle, although there is little evidence that they earth observation systems. have in fact been optimized), no such mechanisms exist at index terms—benefit assessment, conceptual framework, the international level."
1,"if the geoss concept is to become a cost-benefit analysis, global earth observation system-of-sys- sustained and operational reality it is necessary to move beyond tems (geoss). the gut-feeling that the benefits of international collaboration in this field far outweigh the incremental costs, to actually i."
1,"introduction providing a rational, quantified, and persuasive argument for a particular magnitude of investment."
1,"nine benefit areas to society a ll societies make observations about the environment that surrounds them, and make decisions based to some extent on this information."
1,"this is true for all cultures, in have been defined, which would profit from such an investment."
1,"these are health, biodiversity, ecosystems, weather, climate, all parts of the world, and at all levels of organization: from agriculture, disaster, energy, and water."
1,"the geo-bene research project, an european union (eu) funded project within the manuscript received september 18, 2007; revised may 8, 2008."
1,"first pub- sixth framework program, aims to provide the basis for making a lished august 12, 2008; current version published september 17, 2008."
1,"this re- systematic and transparent comparison of informational benefits search was performed in the framework of the ec project geo-bene (www. and costs for the different societal benefit areas as well as geo-bene.eu), led by the international institute for applied systems analysis (iiasa). for geoss as a whole."
1,this paper elaborates the conceptual s.
1,fritz and m.
1,obersteiner are with the international institute for applied framework of the geo-bene project.
1,"systems analysis, a-2361 laxenburg, austria (e-mail: fritz@iiasa.ac.at; ober- stei@iiasa.ac.at)."
1,geoss and an assessment of it seem to be more important r.
1,"scholes is with the council for scientific and industrial research, pre- than ever since two major drivers of earth observation sys- toria 0001, south africa (e-mail: bscholes@csir.co.za). tems have dramatically changed over the past few decades."
1,the j.
1,"bouma is with the institute for environmental studies, vrije universiteit, 1081 hv amsterdam, netherlands (e-mail: jetske.bouma@ivm.vu.nl). first is the understanding that there are powerful biospheric and b."
1,"reyers is with the council for scientific and industrial research, stellen- socio-economic processes that operate at scales greater than bosch 7599, south africa (e-mail: breyers@csir.co.za). the nation."
1,an example of the former is the phenomenon of color versions of one or more of the figures in this paper are available online at http://ieeexplore.ieee.org. global climate change and of the latter is the globalization of digital object identifier 10.1109/jsyst.2008.926688 trade.
1,these can have important (even dominant) consequences 1932-8184/$25.00 © 2008 ieee authorized licensed use limited to: univ of calif santa barbara.
1,"downloaded on september 29,2023 at 20:16:04 utc from ieee xplore."
1,restrictions apply.
2,"fritz et al.: a conceptual framework for assessing the benefits of a geoss 339 for the wellbeing of the inhabitants of a particular country, but affairs and forestry, not to mention hundreds of private individ- cannot be observed, understood or predicted by systems that uals, corporations, and nongovernmental organizations. confine themselves to national boundaries."
2,"as a result, the major as previously indicated, many studies illustrate the potential powers have developed regional or global observation sys- benefit which could be gained from an improved weather fore- tems, largely for their own purposes."
2,"smaller, poorer, and less cast system: with respect to mitigating natural hazards [49], in- technologically-advanced societies have been unable to do so, creasing crop yield [1], food trade [9], or road safety [2]."
2,these and depend on what they can glean from local observations and studies attempt to measure the value of improved weather infor- what is made available from global systems.
2,"clearly, there are mationinabsoluteterms.theyshowthatsimulationmodelingcan cost efficiencies to be gained by integrating the efforts of all na- provide insight into the relationship between improved weather tions at this scale, and benefits to be had from distributing the information and the resultant economic gain."
2,other research has information more broadly.
2,"the strong development of interna- attempted to use contingent valuation (willingness-to-pay) as an tional collaboration in weather observations, through the world alternative to the usual cost avoidance approach, incorporating meteorological organization, is a case in point. the commercial sector (for example, television and film compa- the second driver of change in earth observation (eo) nies, recreation and sports, agriculture, hotel and catering, and systems is technology."
2,there are now ways of observing the institutions such as sports and hospitals).
2,"earth that were previously impractical (such as measurement more recent studies have started to look at other aspects of of the sea-surface temperature in remote parts of the ocean), eo."
2,"for example, two studies have been conducted by pricewa- terhouse coopers on contract to the european space agency. and for sharing, through information and communications tech- the first was to support the development of a business plan for nology, unprecedented volumes of information, very rapidly the galileo programme [43]."
2,the second was a benefit as- and broadly.
2,"these two drivers have created the conditions for sessment of the global monitoring for environment and secu- the emergence of geoss, based (both out of necessity and rity (gmes) programme [44]."
2,"whereas the study on galileo good sense) on the preexistence of an elaborate set of partial or did not consider it in the context of geoss, the gmes study smaller scale subsystems. explicitly investigates the impact of an existing and functional gmes system versus the nonexistence of such a system (termed ii."
2,"review of benefit assessments the “without gmes scenario”), and notes that gmes is the eu- which relate to geoss ropean contribution to geoss."
2,the gmes study is the only current extensive study which tries to assess the benefit of the apart from a quite extensive literature on the costs and benefits european part of geoss.
2,"the pricewaterhouse coopers study of weather forecasts [10], [30] there is relatively little available undertook a strategic as well as a quantitative analysis."
2,"the literature on these values in other fields of eo (e.g., biodiversity, strategic analysis looked at strategic benefits in order to deter- water)."
2,"the cost side, in particular, shows a current lack of com- mine what gmes as a strategic and political investment is trying piled information."
2,"this is true both for big, concerted efforts such to achieve."
2,"in a second, so-called “bottom up” study, which en- as satellite missions, but also forin-situ networks, such as weather compassed a quantitative as well as a qualitative assessment, the stations or river hydrographs."
2,"it is especially true for determining macro-economic benefits and economic efficiency savings were the incremental costs of the information dissemination systems assessed, largely through consultation of key stakeholders. that follow downstream of a data acquisition platform."
2,"the costs the pricewaterhouse coopers study pointed out that placing of satellite missions are usually insufficiently itemized (for en- a monetary value on all the potential impacts of gmes was not visat only the full program costs are given, 2.3 billion euros) or practical, since the wider societal impacts were not amenable to entirely missing (e.g., the entry on landsat 5 in the satellite ency- monetary quantification."
2,"in addition, the relationship between clopedia) to be able to understand their incremental components. the improved eo information and the potential welfare impacts also, the organization for economic cooperation and develop- was not always clear."
2,"the gmes study, therefore, adopted an ment oecd has identified this gap and will soon publish a study approach of consultation with key stakeholders."
2,a large group of entitled “the space economy at a glance” [38].
2,"nevertheless, experts were asked to prioritize benefit areas and to assess what program cost summaries exist for some satellite missions, such the most important benefits of gmes were expected to be."
2,the as those described by [46].
2,"this study points out that costs can be advantage of using expert consultation is that it is a relatively reduced by a factor of 2–10, if “virtual constellations” of collab- quick way to get an indication of the range of expected bene- orating satellite platforms are put in place [45]. fits."
2,the disadvantage is that outcomes strongly depend on the the extremely distributed nature of in situ observation sys- experts consulted.
2,the attribution of benefits usually remains tems makes estimation of the total or incremental costs diffi- anonymous.
2,the risk is that only those stakeholders who are re- cult.
2,"for example, in europe, investment costs are largely un- ally interested in the project will provide information."
2,"as a re- known due to the fragmented ownership and funding structure sult, some benefit areas will be described in more detail and the of the eu, each sponsoring organization only reporting their study will be biased, typically with an optimistic view of bene- own contribution to the common budget [15]."
2,even within a fits.
2,"it is crucial that expert consultation studies are transparent single country, there are often several agencies collecting es- about who was consulted and the range of answers provided sentially the same data—for example, in south africa, rainfall [44]."
2,"the gmes study was criticized for not taking all ben- data are collected by the south african weather service, the na- efit areas equally into account (gmes bureau, personal com- tional department of agriculture, and the department of water munication)."
2,"furthermore, it used a statistical value of life de- authorized licensed use limited to: univ of calif santa barbara."
2,"downloaded on september 29,2023 at 20:16:04 utc from ieee xplore."
2,restrictions apply.
3,"340 ieee systems journal, vol."
3,"2, no."
3,"3, september 2008 fig."
3,benefit chain concept.
3,in the benefit chain concept benefits as well as costs must be considered.
3,"the concept looks at incremental changes of costs and benefits with respect to the already existing observing system (e.g., national)."
3,a logical causal benefit pathway (in steps if necessary) is established and much of the analysis is semi-quantitative (’is the benefit an order of magnitude greater than the cost’) or qualitative (what is the shape of the cost-benefit curve). fined by [19] which differs between developing and developed does it demonstrate how the incremental costs and benefits of countries: an approach that has been criticized as being morally information might be assessed.
3,"finally, all of these studies de- indefensible [19]."
3,"moreover, the study only presented the av- scribed, which evaluate the impact of improved information de- erage of the estimates, largely ignoring the range of responses rived from eo, assess only benefits whereas the costs of pro- and the uncertainties involved."
3,"it did not provide insight into the viding better eo information and in particularly the costs of incremental benefits that various alternate eo investments could sharing data and building the necessary spatial data infrastruc- have, nor the relative importance of improved eo information ture [15] are seldom assessed."
3,"in response to these shortcom- for the wider value chain. ings, we developed a benefit chain concept within our geo-bene another expert opinion-based study of the benefits of geoss project, which will be elaborated in section iii. was carried out by the environmental protection agency (epa) of the united states of america."
3,the epa created an interactive iii.
3,"benefit chain concept us map, allowing the user to view a fact sheet on the benefits of the logic behind the benefit chain concept is that through geoss for each state."
3,"the fact sheet for each state contained in- global cooperation in eo systems, improved information (in formation from expert consultation mainly covering the natural terms of quality, quantity or topical coverage) will become avail- disaster benefit area: looking at tornadoes, hurricanes, floods, able to the decision maker."
3,"better-informed decisions will lead earthquakes, and droughts."
3,"in some states, benefit areas such as to a societal benefit relative to the probable outcome without im- health (e.g., air quality, harmful aquatic blooms) and ecosystems proved information."
3,"this benefit can be in some circumstances (e.g., reduction of erosion, pollution in watersheds, fish stocks) be measured and directly compared to the incremental costs of were also covered."
3,due to the nature of the study consulting ex- global collaboration.
3,"in other circumstances it will be more dif- perts in each state separately, some of the global issues such as ficult to directly estimate the benefits—for instance, in the case tracking global change are mentioned in some states, but not of not directly marketable benefits such as biodiversity, or for consistently in all states. certain downstream or indirect benefits."
3,value of information (voi) theory has been developed by we postulate that it is not possible to go from an incremental economists working in fields as diverse as stock market trading increase in effort in the observation system to an incremental and manufacturing.
3,"a working paper by macauley [35] attempts gain in human wellbeing in a single step, given the multiple fac- to apply the voi theory and methods to show how space-based tors that influence human wellbeing."
3,it is necessary to build a eo can improve natural resource management.
3,this study found plausible causal chain that establishes a prima facie case that that the value of space-derived data depends largely on four fac- all or part of the benefit is traceable to the eo system change. tors: 1) how uncertain decision makers are; 2) what is at stake at a minimum this logical chain has two steps: demonstrating as an outcome of their decisions; 3) how much will it cost to use that the improved observations have some impact on decision- the information to make decisions; and 4) what is the price of making; and then that the resultant decisions led to an improve- the next best substitute for the information.
3,reference [35] de- ment in wellbeing (see fig.
3,1). scribes three groups of methods in which voi can be measured.
3,"we suggest that the costs can be adequately assessed in a in the first group, the value of information is measured by gains single-step process."
3,the difficulties lie mostly in accessing the in output or productivity.
3,in the second group the value of in- information in a way that allows the incremental component to formation is inferred under the hypothesis that it is capitalized be quantified.
3,most such investments are made by public agen- into the prices of goods and services (hedonic pricing).
3,"the third cies, so in principle the costs should be documented, available group tries to estimate the value of improved information based in the public domain and already in monetary terms."
3,"however, on the contingent valuation."
3,"in contingent valuation approaches, in practice costs are often reported in a nontransparent and ag- stakeholders are asked how much they would be willing to pay gregated way, or are distributed across so many cost centers that for certain categories of information. it is hard to assemble them in a coherent fashion."
3,"with respect reference [35] does not clarify how welfare impacts can be to the cost benefit ratio, it is probably too much to ask that this attributed to the availability of improved eo information nor ratio be lower for the choice of action under consideration than authorized licensed use limited to: univ of calif santa barbara."
3,"downloaded on september 29,2023 at 20:16:04 utc from ieee xplore."
3,restrictions apply.
4,"fritz et al.: a conceptual framework for assessing the benefits of a geoss 341 for any other possible action that could have been taken, since that would lead to “analysis paralysis”—the alternatives are ef- fectively infinite, and the uncertainties are high."
4,"but accounting for both the costs and benefits of additional geo investments does provide a rational way of prioritizing between a small set of alternatives within the eo domain, and provides a filter to avoid high-cost, low-benefit actions."
4,the benefit value we refer to is the economic value rather than the financial value.
4,"in other words, it is the value of the benefit to the society as a whole, not just to the entities providing the infor- mation."
4,eo agencies have discovered that societal value in the environmental field is not synonymous with the price the market is willing and able to pay for the information.
4,"eo are generally “public goods,” not traded in a marketplace."
4,the beneficiaries fig.
4,hypothetical curve of a cost benefit relationship.
4,"it is constructed by may, for instance, be the poor, who have no way of paying the sketching a benefit-to-effort and a cost-to-effort relation, and then extracting the true value of the information. costs and benefits for a given level of effort, and building a cost-benefit curve."
4,"“value” does not necessarily have to be expressed in mon- etary terms, though it is often convenient to do so."
4,"it can, for efits are judged to exceed the incremental costs, then the effort instance, be expressed as the number of human lives saved, or involved in establishing collaboration in global eo systems can as a ranked set of preferences."
4,"assigning a monetary value to be justified, even if the total eo system costs exceed the total the benefit should not become an obsession."
4,"rather, it is the benefits, or if the total costs and benefits are unknown."
4,"basically, final step in a logical chain that links the action to the ben- all that needs to be known is whether the incremental effort is efit."
4,"the real intellectual effort should go into establishing the moving things in the right direction, or not. causal chain by which that value is realized, and understanding there has been extensive debate about whether or not it is whether the value will increase proportionally with increased appropriate to calculate a “total benefit” for goods or services observational effort, less than proportionally or more than pro- which are essential to life, and non-substitutable [11], [24]. portionally."
4,"even if quantifying the monetary value is not pos- for example, if all human life depends on the presence of sible—the qualitative shape of the cost:benefit relation, and a water—and nothing else can take its place—then the value of rough ranking of the cost:benefit ratios provides enough infor- water presumably approaches infinity, as the supply declines mation for rational guidance of the geoss. towards the minimum."
4,this is just one of many examples.
4,"hence, even though it will not always be possible to attribute we, therefore, find it more appropriate to think in terms of a reliable monetary value to the economic benefit, which results the marginal benefit—in other words, the increased benefit from a better decision, it is usually possible to know the shape of that results ultimately from a small increase in the eo effort. therelation betweenbenefitandincreasingobservationeffort, and given that the world already has a large investment in eo, and thecorrespondingrelationbetweencostandeffort.dothebenefits that geoss is explicitly built upon this framework, it is also increase disproportionately to the increased observational effort, inescapable that we should be looking at the incremental cost due to synergies or efficiencies achieved, or do they tend to sat- of enhancing the system, rather than the total cost."
4,the curve urate as the problem becomes less and less information-limited?
4,"itself (see fig. 2) can vary across societal benefit areas and do the costs rise steeply because new technology needs to be de- depends on the type of activity (see table i, section iii-b) that ployed or very little because the fixed-cost part of the investment is undertaken."
4,if we can illustrate that the marginally-increased is already made?
4,"can we say, on the basis of order-of-magnitude investment into geoss results in a much higher marginal calculations, that the benefit will be much higher than the incre- benefit, then the investment is well spent."
4,"on the other hand, if mental cost?"
4,"if so, we are probably far below the hypothetical we clearly see that the marginal benefit we gain is much lower optimum point where the cost and benefit curves intersect, and than the incremental investment cost, then justification for such further investment is called for."
4,another question to ask is: what an activity is difficult.
4,"in order to identify at which point we variables are most sensitive to improvements in accuracy?, i.e., are on this cost-benefit curve it is necessary to get a rough where will the largest increase in the benefit to society be seen?"
4,estimate of additional investment required to result in some at is the incremental cost proportionately sensitive?
4,least qualitatively measurable benefit.
4,"moreover, it might be the benefit chain concept can be examined per societal ben- possible to understand at which point further investment will efit area or sub-benefit area."
4,it can be also applied to particular not lead to a substantial increase in the benefit.
