page,p
4,"for example, geoss activities, such as the coordination of space observa- at a certain point the resolution of a sensor will be sufficient tions, or standardization of communication protocols."
4,"however, to gain most of the benefit, further investment in an increased the more indirect the benefits, the more difficult the value of in- resolution will only lead to a negligible extra benefit. formation will be to assess."
4,the particular role of geoss is the we feel that the benefit chain concept is a broad and robust “globalization” of the observing system.
4,the particular question way of looking at the cost-benefit ratio.
4,"it can be used in con- which must be asked in this context is whether global collabo- junction with a variety of specific methods to quantify particular ration can either reduce the costs, or increase the benefit, of eo steps in the chain: for instance, stakeholder surveys, modeling systems."
4,"if this can be demonstrated, and the incremental ben- tools, decision theory, and meta-analysis."
4,"however, there are a authorized licensed use limited to: univ of calif santa barbara."
4,"downloaded on september 29,2023 at 20:16:04 utc from ieee xplore."
4,restrictions apply.
5,"342 ieee systems journal, vol."
5,"2, no."
5,"3, september 2008 table i a."
5,"limitations to the approach improvement to be realized through geoss, effects, and importance we currently do not know the incremental costs of certain components of geoss."
5,"in particular, we know too little about the costs of a global spatial data infrastructure."
5,"since we cannot assess the costs of national systems, we will have problems in estimating the costs for a global system."
5,"the statement made by david rhind (2000), former chief executive of the ordnance survey of great britain is partially still valid today and shows the problem we face: “we know very little about how much money and other resources are actually being expended on maintenance of the existing national spatial data infrastructures, let alone on creation of enhanced versions of them, or who is pro- viding these resources."
5,"in broad terms, we do not know whether these resources are being applied wisely.”"
5,"it would seem helpful, therefore, to carry out some sound accounting of this expenditure: arguments for adding to it or for using it more effectively or efficiently are unconvincing if we do not know the present practice."
5,"even though we do not know the costs associated with globalization of the system, we should still try though various methods (e.g., expert opinion surveys) to get first estimates of the incremental costs."
5,"we are not necessarily looking at absolute figures, but trying to get an understanding of where we are on the cost-benefit curve."
5,minimum requirements to assess the benefit chain we acknowledge that a complete assessment of the full benefit chain for all observations and impacts is not practically achievable.
5,we therefore propose a minimum information guideline.
5,"if geoss is justified using this conservative ap- proach, more elaborate assessments should only increase the confidence in the finding."
5,1) identify the actions that are proposed to improve the quan- tity or quality of information.
5,these constitute “increments of observational effort.”
5,2) describe the pathway by which the increase in informa- tion leads to a welfare benefit.
5,how will the information be used by the policy makers and what are the options avail- able to them?
5,do these options change if more information becomes available?
5,is the probability of their success im- proved with more or better information?
5,"3) describe, and if possible, quantify the incremental cost components that would be associated with the actions."
5,4) describe the shape of benefit-effort and cost-effort curves in the vicinity of the current state.
5,such information can be gained by expert consultation.
5,5) attempt to make order-of magnitude estimates of potential incremental costs and benefits.
5,"if it is possible to upscale the information from local or re- gional case studies to a global level, what global conclusions can be drawn from this exercise?"
5,to what extent do these sub-global studies depend on global information?
5,"can globalization of the currently a number of limitations to this approach, which need information that is used in them, or produced by them, lead to a to be considered."
5,these are outlined in section iii-a. greater net benefit?
5,authorized licensed use limited to: univ of calif santa barbara.
5,"downloaded on september 29,2023 at 20:16:04 utc from ieee xplore."
5,restrictions apply.
6,"fritz et al.: a conceptual framework for assessing the benefits of a geoss 343 if possible, assessments should attempt to go beyond this of sustaining the geo secretariat and its work program."
6,"most minimum by for instance, the following: of the real incremental costs will be borne by national programs. • assessment of the entire value chain, including incremental the incremental benefit is that fraction of the total benefit costs; attributed to eo information that can reasonably be attributed • examination of the geographical distribution of costs and to activities catalyzed by the geoss process."
6,"the “without benefits, qualitatively or quantitatively; geoss” scenario does not assume a complete absence of eo. • determination of the degree to which the societal issue is it allows for what existed and was globally accessible prior to information limited."
6,"for instance, will decision makers ac- 2004 and its likely subsequent growth as independent systems. tually have the resources to take action based on the im- the evaluation of the “without geoss” baseline means hypoth- proved information?"
6,esizing about what would have happened if geoss had not • undertaking sensitivity studies in order to understand been implemented and determining the degree to which the re- which variables (or in which part of the world) better ob- sultant information gaps could have been substituted from other servation will lead to the greatest improvement of welfare; sources.
6,"due to the fact that a number of eo activities exist • using a technology-maturity approach [32] in order to have on a national level independently of geoss it is difficult to an insight into the comparative investment strategy between distinguish which activities can be attributed to geoss, and societal benefit areas; this would help to identify where the which would have happened anyway."
6,"this difficulty was noted steepest part of the cost and benefit curve is likely to lie; in the [44], but is not unique to eo assessment studies."
6,base- • examination of the cross benefit effects since benefits in lines are always counterfactual.
6,there is no fully objective way one area can have multiple benefits in other societal benefit of measuring what would have happened if the current path had areas; linkages between benefit areas are outlined in the not been chosen.
6,"for example, one of the key baselines in the geoss implementation plan [25]. widely-used intergovernmental panel on climate change sce- the adoption of an “incremental effort, incremental benefit and narios is conceptually “business-as-usual” case (although it is incremental cost” basis for investment decision-making in re- not called that, but given the bland title “a1”)."
6,"it is not a simple lation to eo systems makes it necessary to define a baseline. forward projection of current trends, but assumes that certain en- sections iii-c–iii-e describe how the geoss baseline could ergy efficiency actions would take place anyway without regula- be defined, what potential is to be realized through geoss and tory intervention."
6,"the decision of what to include and exclude in what the current limitations are to apply the entire benefit chain the baseline is subjective, but needs to be explained and justified concept."
6,section iii provides examples of applying the benefit in narrative text.
6,"the test is the reasonableness of the scenario, chain concept in three societal benefit areas. not absolute proof that it would have happened that way."
6,defining the baseline of geoss d.
6,"potential to be realized through geoss in order to be able to assess, quantitatively or qualitatively, the these improvements brought about by geoss can occur in value of improved information brought by geoss, it is neces- a number of different ways: though technical improvements in sary to define what geoss actually is."
6,"a working definition can the field of observations, both in-situ and satellite-based; through be found in the geoss implementation plan: “the geoss is to greater reliability and information content gained in the synthesis, be a “distributed system of systems,” building upon current co- modeling, and interpretation of data; and through facilitating the operative efforts among existing observing and processing sys- delivery of information to the end user, in a form that suits their tems, working withintheir ownmandates, and delivering a system needs."
6,"in the field of satellite observations, international coordi- that provides timely, useful and accurate data, information, prod- nation of space platforms and the instruments they carry, along ucts and services to any and all legitimate users around the world. with the data systems that distribute the information, would im- geoss will also encourage and accommodate the addition of prove the reliability and frequency of observations, the number of newcomponentstofillexistingknowledgeandservice gaps”[14]. spectral bands that can be realized, and the spatial resolution that therefore, geoss is not an entirely new system."
6,its aim is can be achieved.
6,"a denser and better-located network of inter- to link existing and independent systems into an integrated net- connected and intercalibrated in-situ sensors would increase the work that will appear, from the user’s perspective, as if it were timeliness, coverage and reliability of information on the many a single system."
6,it is a natural extension to what has already topics that cannot adequately be observed from space alone.
6,"more been achieved between international organizations in terms of sophisticated, higher-resolution models (e.g., global circulation data sharing cooperation [34]."
6,"geoss is about connecting the models) are being continuously developed and improved, and in- dots—linking current existing national programs into a global teract synergistically with better input data from space and the system of systems, and then filling the gaps that become ap- earth’s surface to convert raw observational data into information parent from the unified view of the system. that helps the user to make better decisions."
6,"it is not beneficial therefore, the incremental cost of geoss includes only: 1) for geoss to completely eliminate “duplication of effort” in the the costs of interaction between existing systems, such as in- modeling domain, because having several independent models creased bandwidth that may be necessary and the reprogram- serves to foster innovation and increase the confidence in the pre- ming needed to make data accessible to an integrated system dictions."
6,"but there is benefit to be had from some rationalization, and 2) the cost of filling any gaps identified by the geoss and as well as from model inter-comparison exercises, standardiza- deemed to be necessary to fill in order to achieve its objectives. tion of inputs and outputs, collaboration in capacity building, and note that the costs are substantially more than simply the costs sharing of modular code where it clearly represents best practice."
6,authorized licensed use limited to: univ of calif santa barbara.
6,"downloaded on september 29,2023 at 20:16:04 utc from ieee xplore."
6,restrictions apply.
7,"344 ieee systems journal, vol."
7,"2, no."
7,"3, september 2008 the particular emphasis of geoss is to foster international patrolling."
7,the decision that is based on eo data is the optimal collaboration and international standards defined by the open path and effort that is spent in patrolling for fires.
7,geospatial consortium (ogc).
7,"as outlined in the 10-year im- the baseline in the data-poor (or non-geoss) scenario is plementation plan, the success of geoss will depend on data simulated by using coarse-resolution weather forecast data."
7,this and information providers accepting and implementing a set is comparable with the currently available global datasets such of interoperability arrangements.
7,"these standards allow the in- as degree resolution data from the european center for medium formation flow of geographic feature (e.g., web feature ser- range weather forecasting (ecmwf)."
7,"in europe, as a result of vice) or raster data (e.g., web map service) over the internet. international collaboration, there are better and higher-resolu- on the one hand these standards allows simple searching facil- tion forecasts available, informed by in situ meteorological ob- ities of the standardized metadata catalogues, making data flow servations."
7,this is the “geoss scenario.”
7,it is possible to model more efficient and therefore reducing costs.
7,"on the other hand, a the stochastic process of fire spread and thus to estimate how chain of ogc web services can be invoiced using standard web much area could be saved if the fire is detected quickly as a result chaining mechanisms to produce value-added products."
7,these of an appropriately-designed patrolling pattern.
7,"in addition, we value added information products are produced by automated are able to simulate how in-situ data used in combination with procedures involving different data and process servers on the remote sensing data contributes to the benefit achieved."
7,"simu- internet [41]. lation results reveal that by using the higher resolution geoss one of the tasks of geoss is to identify current data and in- scenario (corresponding to the european 50–km grid) results formation gaps (spatially, temporally, or with respect to topical in a reduction of area burnt of around 21% as well as an overall coverage), and to contribute to the long term continuity of geo. reduction of patrols of 4%."
7,given the increase of forest fires over table i identifies the improvements where geoss could play a the last decades and the high damage caused by these fires in role in an illustrative and non-comprehensive manner.
7,"the ben- portugal and spain a reduction of 21% of the area burnt would efit chain concept can be applied to any improvements, which lead to an enormous societal benefit."
7,in order to get an esti- will be realized in the future.
7,"however, some of the improve- mate of the costs saved we calculated the saved timber and its ments cannot be exclusively realized though geoss, but need economic value by using fao statistics of the year 2000."
7,the to be supported by other national and sub-national activities and timber saved is estimated to be approximately 4 million euro. other institutional mechanisms.
7,"however, in particular for the this number is derived from the following: 22 169 ha burned high priority areas (importance high, see table i) of geoss, area saved, 44 m /ha, 20% economic accessibility, 40% stem we can apply the benefit chain concept and attribute the benefits volume, 50 eur/m - . exclusively to geoss."
7,"our knowledge of the incremental costs of these data is un- certain, but we estimate that they approximate making the data e."
7,examples of application of the benefit chain concept available real time for forest fighting (which is the incremental necessity for this application).
7,"this cost will be in the order three examples, derived from early stages of the geo-bene of 130 000 euros annually, plus 2 million euro for a once off project, are used to illustrate how the benefit chain concept filtering algorithm, which removes errors in the dataset."
7,the works.
7,"the first example, from the natural disaster societal cost/benefit ratio points towards a higher incremental benefit benefit area, uses a model to examine the dependence of than the incremental costs. fire fighting success on higher resolution weather forecast 2) example two—improved data for conservation plan- information."
7,"the second example illustrates how the benefit ning: this case study demonstrates the benefits of replacing chain concept can be applied in a case where the benefits are commonly available coarse scale global data (the non geoss non-marketable, in this case through biodiversity conservation. scenario) with finer scale data in conservation decision making."
7,the third example shows that a stakeholder survey can be these finer scale data are comparable with those expected from designed in a way that information on the incremental benefit geoss and can thus be used to estimate the potential benefits in relation to incremental costs can be acquired. of geoss data.
7,we then contrast the benefits of these data im- 1) example one—better fire control thanks to improved provements with the costs of the improvements.
7,"weather forecasts: this case study (elaborated by [31]) con- south africa, like most countries, is attempting to increase siders a simple model of success in fighting forest fires in spain the amount of land and water area under some form of con- and portugal."
7,"the nesterov fire index is used to assess fire servation (e.g., national parks, conservancies, easements)."
7,the danger on a daily basis.
7,it is assumed that the index is used as current extent of the formal protected areas network is approx- the basic indicator for decision making.
7,official aircraft-based imately 6% and biased towards mountainous or tourist areas forest patrolling rules are applied (based on those in force in often with low agricultural potential resulting in large gaps in the russian federation).
7,"in the model, total area burned and the national conservation area network [21]."
7,efforts to reduce the total observed area are considered in terms of the benefit of these gaps must ensure that new protected areas are optimally having either coarse- or fine-resolution data available. located so as to represent a full sample of the country’s biodiver- the benefit pathway is that through better-calibrated and sity in the most cost efficient manner.
7,"a sophisticated set of sys- higher-resolution satellite data supported by in-situ mea- tematic conservation planning tools is available for this purpose surements, a more targeted and efficient patrolling system is [36], [42]."
7,these tools identify spatially explicit priority areas possible.
7,"the benefit can be expressed both through reductions for conservation action (e.g., land acquisition, land stewardship in the area burned and through having to spend less money on and management, easements, finer scale planning) and feed into authorized licensed use limited to: univ of calif santa barbara."
7,"downloaded on september 29,2023 at 20:16:04 utc from ieee xplore."
7,restrictions apply.
8,fritz et al.: a conceptual framework for assessing the benefits of a geoss 345 land use decision making processes across the country from table ii local to national scales supported by legislation.
8,"these tools re- cost of obtaining biodiversity observations quire spatially explicit data on the distribution of biodiversity (species, ecosystems), threats facing biodiversity (e.g., land con- version, alien invasive plants) and current conservation efforts."
8,"these data are often available at coarse (1:1 000 000) global or continental scales (e.g., wwf ecoregions [40],[22], african mammal databank (http://www.gisbau.uniroma1.it/amd/index. htm)."
8,"several authors have highlighted that comprehensive data sets such as point locality data for specific tax and fine-scale land class and habitat transformation maps are invariably lacking [12], especially in developing countries which harbor most of the world’s unprotected and vulnerable biodiversity [5]."
8,south africa is fortunate as an exception to this rule in that it is both a “biodiversity-rich” country and has relatively good biodiver- sity data [6].
8,"these national scale data (1:250 000) were used to conduct a national spatial biodiversity assessment [37], [44], which identified broad scale priority areas for national conserva- tion action."
8,"as part of this assessment, a comparison was made would be 100 times more than the glc (approximately 200 mil- of the outputs of the nsba (the geoss scenario) and the out- lion euros)."
8,"when one compares this cost estimate (200 million puts of the same assessment based on the coarse global scale euros) with the costs of not having finer scale data (1.2 billion data (the non geoss scenario), in an effort to assess the bene- euros) it appears that the benefits of improved data outweigh fits of improved national scale data. the costs by almost an order of magnitude."
8,"the coarse scale data led to a 9% overestimate of priority land cover data are only one input data layer in conserva- areas identified by the national scale data and a 10% underes- tion decision making processes, and arguably even finer scale timate in other areas (jonas pers comm.)."
8,turning these differ- data than sanlc would be required for conservation decisions. ences into benefit estimates is complex.
8,a simple proxy would table ii provides estimates of the costs of other finer scale bio- be the cost consequences of these over or underestimates.
8,es- diversity datasets.
8,these local scale costs allow us to begin to timates of conservation costs developed in the cape floristic understand the relationship between costs of data development region of south africa [20] found that implementing a con- and the benefits of improved data.
8,it would appear that the ben- servation area network (of protected areas and other off reserve efits of moving from global to national data are large and pro- mechanisms) of 2.8 million hectares would result in a once off vide significant savings in land acquisition and management cost of 627 million euros with annual costs totaling 29 million costs of conservation.
8,work is currently in progress to see if euros (all costs are calculated in euros for the year 2000 using these benefits begin to saturate with increased observational ef- annual national inflation rates and 2000 exchange rates).
8,by just fort in collecting local scale data.
8,the costs of these data im- applying these costs to the priority areas identified in the nsba provements are variable and seem to depend on the scale and a 9% (or 5 million ha) overestimate would cost over 1.2 billion the type of biodiversity data collected.
8,simple maps of land euros in once off costs with annual management costs of the cover and vegetation types appear to represent a good invest- overestimated area equivalent to 57 million euros.
8,"it is impor- ment at all scales, while costs of data on detailed species sur- tant to note that the priority areas identified in the nsba were veys increase significantly at local scales."
8,"despite these costs, not intended to become a conservation area network necessarily, [4] demonstrates that investment in high quality biodiversity in- but rather to direct future sub-national conservation efforts and ventories at a local scale are a very good conservation invest- finer scale conservation plans."
8,the cost differences are however ment and help ensure cost efficiency in the implementation of a useful indication of the potential benefits of improved data. expanded protected areas and their management.
8,"given these the costs or loss of benefits associated with the underestimates findings, there is probably still scope for higher-resolution ob- are more complex to assess and are still in progress. servational effort to yield net benefits to conservation planning calculating the costs associated with improved datasets in south africa. presents a challenge as these data have been built up over a 3) example 3—north sea water quality: an example of number of years by a number of institutions."
8,the datasets are using expert and stakeholder consultation for assessing the value also highly variable in the time and effort taken to collate them. of information is provided by the north sea water quality case costs of biodiversity data that are available are provided in [8].
8,"at present, water quality monitoring in the north sea is table ii. mostly based on in situ measurement."
8,"with geoss-type inte- the coarse and fine scale analyses described previously used grated remote sensing information, the temporal and geograph- the glc and sanlc datasets described in table ii, respec- ical availability of water quality information increases and early tively."
8,sanlc covers an area of less than 1% of the earth’s land warning information becomes available with regard to the pre- surface covered by the glc.
8,assuming a linear relationship be- diction of excessive algal bloom.
8,to estimate how such infor- tween area covered and cost we extrapolated that the costs of mation is required to improve the effectiveness of water quality developing a similar data layer to the sanlc at a global scale management in the north sea we developed a questionnaire that authorized licensed use limited to: univ of calif santa barbara.
8,"downloaded on september 29,2023 at 20:16:04 utc from ieee xplore."
8,restrictions apply.
9,"346 ieee systems journal, vol."
9,"2, no."
9,"3, september 2008 table iii the accuracy of the information system, and the range in expert added value of remote sensing information for water quality in perceptions as well."
9,the north sea iv.
