page,p
8,"ndwi has demonstrated its usefulness in different circumstances such as drought monitoring, early warning, crop monitoring and soil moisture in grasslands and shrublands [126–128]."
8,"in the swiss data cube, a python script has been implemented to produce different satellite-derived indices allowing users to easily perform time-series analysis of annual, seasonal or monthly mean."
8,annual and seasonal ndwi means (with their respective standard deviations) have been computed for the entire country from 1984 to 2019 using landsat data.
8,preliminary results allow researchers to explore both spatial and temporal variation of ndwi across switzerland (figure 2).
8,figure 2.
8,"normalized difference water index (ndwi) seasonal mean (year 2019) from winter (upper-left), spring (upper-right), summer (lower-left) and autumn (lower-right)."
8,these maps show the evolution over a year of the water content in vegetation and soils.
8,such datasets allow soil moisture over a dedicated area to be explored.
8,"for example, users can select a protected area in the valais canton named “bois de finges” and compute a zonal statistic over the annual mean time-series (figure 3)."
8,"this gives a curve that indicates that soil moisture is relatively stable over time, even if a small decrease can be observed, but more interestingly shows various important declines corresponding to major drought events that occurred in 1986, 2003 and 2018."
8,this demonstrates the potential of ndwi to monitor soil moisture and drought conditions.
8,"still concerning water, lakes are also a major feature of the swiss landscape having more than 100 lakes of a surface larger than 0.3 square kilometers [115]."
8,"most of these lakes are artificially regulated and, therefore, their levels can be generally considered as stable [129,130]."
8,"however, in the last years, switzerland has suffered regularly from severe drought conditions that have affected small natural and unregulated lakes showing an important decrease in their respective water levels."
8,"water level, being an ewv, can be evaluated using satellite imagery using both optical and/or radar imagery [131]."
8,"in the french-speaking part of switzerland, two lakes are regularly mentioned in the news showing a substantial decrease in their respective water levels during the summer season."
8,"these are the lake des brenets, located in the north-western part at the swiss/french border, and the lake bret, on the eastside of lausanne city."
8,using the water observations from space algorithm (wofs) [132] it is possible to detect surface water and evaluate the frequency of whether water is permanent or temporary for a
9,"data 2020, 5, 100 9 of 23 given pixel through over a dedicated time-frame."
9,water percentages have been computed for the 2017 and 2018 summer months using sentinel-2 data for both lakes (figures 4 and 5).
9,figure 3.
9,ndwi annual mean time-series for the bois de finges protected area showing important decrease in water content corresponding to major drought events.
9,figure 4.
9,water percentages for the lake des brenets in 2017 (above) and 2018 (below).
9,water level severely decreased in 2018 showing that the east side of the lake was covered approximately only 50% of the time (in yellow) compared to permanent water (blue) and no water (red).
9,data source: sentinel-2.
10,"data 2020, 5, 100 10 of 23 figure 5."
10,water percentages for the lake de bret in 2017 (left) and 2018 (right).
10,the water level shows a similar pattern with the north-west side of the lake evidencing a clear decrease in water level.
10,data source: sentinel-2.
10,"this shows that for the same period of the year, the 2018 drought strongly affected the two lakes and a clear decrease in water levels can be observed."
10,"large areas have been completely drained, severely impacting leisure activities such as sailing or fishing."
10,"remote-sensing techniques have been extensively applied for water quality assessments on oceans, seas, and lakes and can help to estimate and monitor mineral water quality indicators such as turbidity, chlorophyll content, surface temperature or water colors [87,102,133]."
10,"total suspended matter (tsm) allows the average amount of suspended matter in a water body to be determined and, therefore, can be considered as a relatively good proxy to estimate water quality."
10,"it can help to evidence areas of high turbidity that can have various causes such as pollution, vegetation or mineral induced turbidity."
10,lakes thun and brienz are located in the central part of switzerland at the foothill of the alps.
10,"these two lakes are feed only by the aar river, a tributary of the rhine, that takes its source in the aare glacier in the bernese alps."
10,"consequently, the aar river is carrying an important sediment load that can somehow affect the water quality of these two lakes [134]."
10,the tsm algorithm implemented by the odc can be used with landsat data from april to august 2016 to compute the average value per pixel of suspended matter (figure 6).
10,results show that most of the sediment load is deposited in the brienz lake whereas the thun lake appears clearer having virtually no sediment deposited in the lake.
10,this result is confirmed also with a visual inspection of a true-color composite (figure 7) for the same period that shows lake brienz having a color that is desaturated and is whiter than the thun lake that has a better water quality.
10,the last example relates to ebv and how ecosystem structure can be evaluated.
10,"by structure, it is implied the set of biophysical properties of ecosystems that create the conditions of the structural components of ecosystems that lead to and maintain biodiversity characteristics [19]."
10,ecosystem extent and fragmentation can be estimated using satellite data.
10,"to quantify the spatial extent of vegetation, one can use the fractional cover (fc) methodology."
10,"the fraction of vegetation cover can be derived using a linear unmixing methodology to evaluate the proportion of photosynthetic vegetation (pv), non-photosynthetic vegetation (npv) and bare soil (bs) within each pixel and codified in red/green/blue colors [135]."
10,"in figure 8, landsat 8 data has been used to compute fc for estimating the spatial extent"
11,"data 2020, 5, 100 11 of 23 of vegetation in a portion of the swiss low-land in the greater geneva area during the summer of 2003."
11,this map shows that most of the area is covered by photosynthetic vegetation and can help to better determine the structure of vegetated areas as well as assessing the impacts of drought that caused the death of vegetation during the heatwave an appearing as npv on the map.
11,figure 6.
11,total suspended matter (tsm) concentration for the lakes thun (left) and brienz (right) showing an important difference in terms of sediment load.
11,data sources: landsat; google.
11,figure 7.
11,true color composite of lakes thun (left) and brienz (right).
11,brienz lake shows desaturated colors indicating that sediment load is more important than in the thun lake.
11,data source: landsat.
11,"finally, to derive some ebv, the normalized difference vegetation index (ndvi) is a well-accepted index for vegetation monitoring."
11,"in particular, it can help to inform the seasonal pattern of vegetation activity (i.e., phenology) and can help to evaluate vegetation dynamics and health at different scales [136]."
11,ndvi is a measure of the state of vegetation health based on how the vegetation reflects light in the
12,"data 2020, 5, 100 12 of 23 red (i.e., strongly absorbed) and near-infrared (nir) (i.e., strongly reflected) bands."
12,"it is calculated as follows [137]: ndvi = (nir - red)/(nir + red), (2) figure 8."
12,fractional cover in the great geneva area using landsat 7 (summer 2003).
12,index values range from −1.0 to 1.0 representing roughly vegetation for positive values; clouds-water-snow for negative values; and bare soils and rocks for values close to zero [138].
12,when vegetation is affected by dehydration or becomes sick usually the colors turn from green to brown.
12,this change is particularly significant in nir light that is increasingly absorbed when vegetation deteriorates.
12,"therefore, ndvi can provide accurate information on the presence of chlorophyll and can be correlated with plant health [139]."
12,"in the sdc, we used the script mentioned previously for generating ndwi annual and seasonal means by adapting formula (1) to compute annual and seasonal ndvi means nation-wide from 1984 to 2019."
12,vegetation seasonal patterns can be observed as exemplified in figure 9.
12,figure 9.
12,"ndwi seasonal mean (year 2019) from winter (upper-left), spring (upper-right), summer (lower-left) and autumn (lower-right)."
12,these maps show the evolution over a year of the water content in vegetation and soils.
13,"data 2020, 5, 100 13 of 23 similar to the ndwi example, zonal statistics can be computed for the same protected area (i.e., bois de finges) annual mean time-series have been computed showing an increase of the ndvi measurements over time (figure 10)."
13,"one significant hypothesis that can be made is that conditions for vegetation growth have improved (i.e., more precipitation and heat) caused by climate change at mid-latitudes and, therefore, vegetation can be observed to be more active."
13,similar patterns have been observed in different parts of the world [140–142] and further studies are needed to confirm and characterize this change across the different biogeographical regions and landscapes of switzerland.
13,figure 10.
13,normalized difference vegetation index (ndvi) annual mean time-series for the bois de finges protected area showing an important increase of the vegetation’s greenness over the period considered.
13,"discussion the presented use-cases are, to our knowledge, among the first attempts to compute various essential variables to support environmental monitoring using an earth observations data cube."
13,the first results indicate that eodc can facilitate the production of evs and can make them accessible to different users.
13,"in particular, this offers a consistent analytical framework for space and time-series analysis using satellite eo data."
13,"initial implementation indicates benefits, limitations and further development to strengthen the efficient and effective generation of evs for environmental monitoring."
13,"in terms of benefits, eodc can help to improve the accessibility, processing and use of evs [18] providing access to analysis-ready data."
13,"it can therefore facilitate the generation of information and knowledge emphasizing the importance of suitable connections between data, applications and users [31,143]."
13,"importantly, such technology can help to move away from traditional data-centric approaches and can enhance more user-/knowledge-centric approaches by lowering the barriers to use of satellite eo data [8] and automating the extraction of actionable information and knowledge at different spatial and temporal scales [144]."
13,this is an essential condition to efficiently support public policy decision-making.
13,"ultimately, it can allow the provision of decision-ready products that can be used for effective decision-making and evidence-based policy-making [14]."
13,"more importantly, it allows quantifying measurements and can provide a unique capability to track environmental changes across a country."
13,"finally, evs can contribute to support the production of high-level environmental indicators defined in different policy frameworks such as the sustainable development goals (sdgs) [4,110], the aichi targets on biodiversity [145], the water-food-energy nexus [146] as well as the driver-pressure-state-impact-response framework [29]."
13,"other identified benefits are: (1) scalability and reproducibility of code/methods at different scales [37,147] that can be applied in more than 100 countries that are using the open data cube software; (2) integration of the information products into national environmental information database; (3) support innovation and growth in the digital economy; (4) improve efficiency and effectiveness of government investments; (5) improve management of natural resources and (6) stimulate research."
14,"data 2020, 5, 100 14 of 23 the major limitation is probably the lack of awareness about the ev concept both in some scientific domains as well as in the policy context [15,24]."
14,"in addition, eodc is a relatively new technology requiring new knowledge and capacities (e.g., big data, artificial intelligence, data science)."
14,"therefore, to reach wide adoption, acceptance and commitment, capacity development efforts are fundamental [148]."
14,"in that sense, geo can play a fundamental role in leveraging the potential of eodc and evs."
14,in its 2020–2022 work programme (http://www.earthobservations.org/geoss_wp.php) there are related activities both on capacity development and evs.
14,"therefore, geo can help advocating and strengthening the role of eo and evs and their associated benefits to society, enabling different stakeholders to become familiar with this technology and raise awareness on the potential of evs for enhanced environmental monitoring."
14,"benefits can be demonstrated through appropriate examples, best practices, and guidelines."
14,"particular attention should be devoted to developing capacities at the following three levels [149]: (1) human (e.g., education and training of individuals); (2) institutional (e.g., enhancing the understanding within organization and governments of the value of eo data to support decision-making); and (3) infrastructure (e.g., installing/configuring/managing the needed technology)."
14,"ultimately, all these efforts should be geared towards a more open and reproducible eo science [37], an approach of research and education that aims to enhance scientific accountability and credibility by making scientific research and knowledge (e.g., data, methods, tools and resources) more collaborative, transparent and accessible through digital technologies."
14,another limitation that needs to be overcome is that most of the reviewed evs are not directly generated from remote sensing measurements.
14,satellite eo data are often a data source that needs to be used in conjunction with either in-situ/crowdsourced measurements or integrated into models to properly generate evs.
14,"consequently, efforts should be made to better understand how to link eodc with other data sources to develop efficient workflows and produce evs in a consistent and coherent manner."
14,"to tackle this issue, the system of systems (sos) approach promoted by geo in developing geoss, a platform interlinking existing and planned observation systems, can be an interesting solution [150,151]."
14,"the geoss platform relies on interoperability arrangements, a set of standardized technical specifications that allows data from different systems to be combined into coherent data sets [152]."
14,recent efforts have been devoted to implement open geospatial consortium (ogc) and international organization for standardization (iso) specifications in eodc.
14,"these standards are widely adopted in the geospatial community to make eo data and algorithms interoperable [153,154]."
14,"with the help of these standards this can prevent eodc from becoming silos of information and facilitate the integration of eo data with different data sources such as in-situ measurements or socio-economic data at different scales (e.g., local, national, international)."
14,this is a fundamental condition to leverage the information potential of eo data.
14,"all these data sources enclose unique insights and spatiotemporal signatures of relevant environmental changes and can provide crucial information to improve understanding, responding and adequately addressing environmental and sustainability challenges from local to global scales [144,155]."
14,these first results are encouraging and prove the feasibility of generating evs using an eodc.
14,"however, further work is needed to routinely produce evs."
14,"first of all, it is necessary to explore how best to use in-situ data and models together with remotely-sensed data provided by eodc to generate other evs (i.e., those identified as partial contributions in section 2)."
14,"second, it is important to make the information products interoperable [44,153] and compatible with find-accessible-interoperable-reproducible (fair) data-sharing principles [156,157] to facilitate their reuse by different users."
14,"third, all these information products can be the basis for developing a national (or other scales) database for environmental monitoring using satellite eo data and add other evs such as land cover [158,159]."
14,"fourth, it would be valuable to test the presented approach in other emerging ev domains to refine the understanding of the potential of eodc to support additional disciplines."
14,the examples shown in this paper demonstrate that eodc and evs have the potential to realize the objective of transforming data into actionable information to support decisions based on evidence and improve the management of natural resources.
14,this can help countries and local decision-makers
15,"data 2020, 5, 100 15 of 23 to establish and operate their own analytical capabilities to underpin regulatory and official reporting mandates supported by replicable, reusable and scientifically accountable decision-ready products [31]."
15,"conclusions nowadays, petabytes of eo data and geospatial information are freely and openly available from different data holdings."
15,"combined with open source analytical tools for efficiently and effectively storing, managing and analyzing these data are leading an increasing number of countries to use eodc and ard to derive useful information and new insights on environmental changes to inform policies and support decision-making."
15,essential variables can play an important role in providing necessary information on key elements to adequately describe different components of the earth system.
15,"moreover, they can also significantly contribute to high-level policy frameworks such as the sdgs."
15,"consequently, it is necessary to understand how to generate evs on a regular basis."
15,"in this paper, we reviewed evs in the climate, biodiversity and water domains and produced a comprehensive list of evs that can take advantage of consistent time-series satellite data."
15,"through various examples, we demonstrated the applicability of eodc to derive evs and how they can be used both at the local and at the national scales for environmental monitoring."
15,"the initial implementation has shown that it is technically feasible, enabling the rapid production of different evs and benefiting from the spatial and temporal dimension of satellite eo data."
15,"however, further work is needed to better understand how to derive evs using in-situ and or modeled data used in combination with satellite data."
15,"we practically demonstrate the objectives of ev to have a high impact, high feasibility and relatively low cost of implementation and such work can be a contribution to the new geo initiative on essential variables (http://earthobservations.org/documents/gwp20_22/geo_essential_variables_ip.pdf)."
15,"to conclude, we think that eodc represents a valuable opportunity to strengthen environmental monitoring systems, facilitating the production of essential information in a consistent and comparable manner to support evidence-based policy-making."
15,"author contributions: conceptualization, g.g., e.e. and b.c.; methodology, g.g., e.e. and b.c.; validation, e.e. and b.c.; formal analysis, e.e., j.i., c.p.; investigation, g.g.; data curation, b.c.; writing—original draft preparation, g.g., e.e., j.i., c.p., j.-p.r. and b.c.; writing—review and editing, g.g., e.e., j.-p.r. and b.c.; supervision, g.g.; project administration, g.g.; funding acquisition, g.g."
15,all authors have read and agreed to the published version of the manuscript.
15,"funding: this research was funded by european commission “horizon 2020 program” era-planet/geoessential project, grant number 689443."
15,"results of this publication are partly or fully relying on the swiss data cube (http://www.swissdatacube.org), operated and maintained by un environment/grid-geneva, the university of geneva, the university of zurich and the swiss federal institute for forest, snow and landscape research wsl."
15,acknowledgments: the authors would like to thank the swiss federal office for the environment (foen) for their financial support to the swiss data cube.
15,the views expressed in the paper are those of the authors and do not necessarily reflect the views of the institutions they belong to.
15,conflicts of interest: the authors declare no conflict of interest.
15,references 1.
15,world economic forum.
15,"the global risks report 2020; wef: geneva, switzerland, 2020; p."
15,"guerry, a.d."
15,"; polasky, s."
15,"; lubchenco, j."
15,"; chaplin-kramer, r."
15,"; daily, g.c."
15,"; griffin, r."
15,"; ruckelshaus, m."
15,"; bateman, i.j."
15,"; duraiappah, a."
15,"; elmqvist, t.; et al."
15,natural capital and ecosystem services informing decisions: from promise to practice.
15,"usa 2015, 112, 7348–7355."
15,[crossref] 3.
15,"rockström, j."
15,"; bai, x.; devries, b."
15,global sustainability: the challenge ahead.
15,"sustain. 2018, 1, e6."
15,[crossref] 4.
15,"giuliani, g."
15,"; mazzetti, p."
15,"; santoro, m."
15,"; nativi, s."
15,"; van bemmelen, j."
15,"; colangeli, g."
15,"; lehmann, a."
15,knowledge generation using satellite earth observations to support sustainable development goals (sdg): a use case on land degradation.
15,earth obs.
15,geoinf.
15,"2020, 88, 102068."
15,[crossref]
16,"data 2020, 5, 100 16 of 23 5."
16,"curry, e."
16,"the big data value chain: definitions, concepts, and theoretical approaches."
16,"in new horizons for a data-driven economy: a roadmap for usage and exploitation of big data in europe; cavanillas, j.m., curry, e., wahlster, w., eds."
16,"; springer: cham, switzerland, 2016; pp."
16,"29–37, isbn 978-3-319-21569-3."
16,"rowley, j."
16,the wisdom hierarchy: representations of the dikw hierarchy.
16,"2007, 33, 163–180."
16,[crossref] 7.
16,"ackoff, r.l."
16,from data to wisdom.
16,"in ackoff’s best; sons, j.w., ed."
16,"; john wiley & sons: new york, ny, usa, 1999; pp."
16,170–172.
16,"nativi, s."
16,"; santoro, m."
16,"; giuliani, g."
16,"; mazzetti, p."
16,towards a knowledge base to support global change policy goals.
16,digit.
16,"earth 2020, 13, 188–216."
16,[crossref] 9.
16,"lehmann, a."
16,"; chaplin-kramer, r."
16,"; lacayo, m."
16,"; giuliani, g."
16,"; thau, d."
16,"; koy, k."
16,"; goldberg, g."
16,lifting the information barriers to address sustainability challenges with data from physical geography and earth observation.
16,"sustainability 2017, 9, 858."
16,[crossref] 10.
16,"costanza, r."
16,"; daly, l."
16,"; fioramonti, l."
16,"; giovannini, e."
16,"; kubiszewski, i."
16,"; mortensen, l.f."
16,"; pickett, k.e."
16,"; ragnarsdottir, k.v."
16,"; de vogli, r."
16,"; wilkinson, r."
16,modelling and measuring sustainable wellbeing in connection with the un sustainable development goals.
16,"2016, 130, 350–355."
16,[crossref] 11.
16,"santoro, m."
16,"; mazzetti, p."
16,"; nativi, s."
16,the vlab framework: an orchestrator component to support data to knowledge transition.
16,remote.
16,"2020, 12, 1795."
16,[crossref] 12.
16,"cornell, s."
16,"; berkhout, f."
16,"; tuinstra, w."
16,"; tabara, j.d."
16,"; jager, j."
16,"; chabay, i."
16,"; de wit, b."
16,"; langlais, r."
16,"; mills, d."
16,"; moll, p.; et al."
16,opening up knowledge systems for better responses to global environmental change.
16,environ.
16,"policy 2013, 28, 60–70."
16,[crossref] 13.
16,"reyers, b."
16,"; stafford-smith, m."
16,"; erb, k.-h."
16,"; scholes, r.j."
16,"; selomane, o."
16,essential variables help to focus sustainable development goals monitoring.
16,environ.
16,sustain.
16,"2017, 26–27, 97–105."
16,[crossref] 14.
16,"lehmann, a."
16,"; nativi, s."
16,"; mazzetti, p."
16,"; maso, j."
16,"; serral, i."
16,"; spengler, d."
16,"; niamir, a."
16,"; mccallum, i."
16,"; lacroix, p."
16,"; patias, p.; et al."
16,geoessential—mainstreaming workflows from data sources to environment policy indicators with essential variables.
16,digit.
16,"earth 2019, 13, 322–338."
16,[crossref] 15.
16,"lehmann, a."
16,"; masò, j."
16,"; nativi, s."
16,"; giuliani, g."
16,towards integrated essential variables for sustainability.
16,digit.
16,"earth 2020, 13, 158–165."
16,[crossref] 16.
16,"bojinski, s."
16,"; verstraete, m."
16,"; peterson, t.c."
16,"; richter, c."
16,"; simmons, a."
16,"; zemp, m."
16,"the concept of essential climate variables in support of climate research, applications, and policy."
16,meteorol.
16,"2014, 95, 1431–1443."
16,[crossref] 17.
16,"giuliani, g."
16,"; nativi, s."
16,"; obregon, a."
16,"; beniston, m."
16,"; lehmann, a."
16,spatially enabling the global framework for climate services: reviewing geospatial solutions to efficiently share and integrate climate data & information.
16,"2017, 8, 44–58."
16,[crossref] 18.
16,"espinosa, m.t.m."
16,"; giuliani, g."
16,"; ray, n."
16,reviewing the discoverability and accessibility to data and information products linked to essential climate variables.
16,digit.
16,"earth 2019, 13, 236–252."
16,[crossref] 19.
16,"pereira, h.m."
16,"; ferrier, s."
16,"; walters, m."
16,"; geller, g.n."
16,"; jongman, r.h.g."
16,"; scholes, r.j."
16,"; bruford, m.w."
16,"; brummitt, n."
16,"; butchart, s.h.m."
16,"; cardoso, a.c.; et al."
16,essential biodiversity variables.
16,"science 2013, 339, 277–278."
16,[crossref] 20.
16,"geijzendorffer, i.r."
