page,p
1,data article essential variables for environmental monitoring: what are the possible contributions of earth observation data cubes?
1,"gregory giuliani 1,2, * , elvire egger 2 , julie italiano 2 , charlotte poussin 2 , jean-philippe richard 2 and bruno chatenoux 2 1 institute for environmental sciences, university of geneva, envirospace, bd carl-vogt 66, ch-1205 geneva, switzerland 2 institute for environmental sciences, university of geneva, grid-geneva, bd carl-vogt 66, ch-1211 geneva, switzerland; elvire.egger@etu.unige.ch (e.e.); julie.italiano@gmail.com (j.i.)"
1,; charlotte.poussin@unige.ch (c.p.); jean-philippe.richard@unepgrid.ch (j.-p.r.); bruno.chatenoux@unepgrid.ch (b.c.)
1,* correspondence: gregory.giuliani@unige.ch; tel.: +41-(0)22-379-07-09  received: 25 september 2020; accepted: 16 october 2020; published: 21 october 2020  abstract: environmental sustainability is nowadays a major global issue that requires efficient and effective responses from governments.
1,essential variables (ev) have emerged in different scientific communities as a means to characterize and follow environmental changes through a set of measurements required to support policy evidence.
1,"to help track these changes, our planet has been under continuous observation from satellites since 1972."
1,"currently, petabytes of satellite earth observation (eo) data are freely available."
1,"however, the full information potential of eo data has not been yet realized because many big data challenges and complexity barriers hinder their effective use."
1,"consequently, facilitating the production of evs using the wealth of satellite eo data can be beneficial for environmental monitoring systems."
1,"in response to this issue, a comprehensive list of evs that can take advantage of consistent time-series satellite data has been derived."
1,"in addition, a set of use-cases, using an earth observation data cube (eodc) to process large volumes of satellite data, have been implemented to demonstrate the practical applicability of eodc to produce evs."
1,the proposed approach has been successfully tested showing that eodc can facilitate the production of evs at different scales and benefiting from the spatial and temporal dimension of satellite eo data for enhanced environmental monitoring.
1,keywords: essential variables; climate; biodiversity; water; earth observations; data cube 1.
1,"introduction the latest global risks report from the world economic forum (wef) identified for the first time in its 10-year outlook survey that the top five global risks in terms of likelihood and impact were all related to the environment, ranking climate change and biodiversity loss as major global threats [1]."
1,"therefore, environmental sustainability is recognized as a critical global issue that demands achieving a good balance between the exploitation of natural resources for socio-economic development, and conserving ecosystem services that are critical to everyone’s wellbeing and livelihoods [2]."
1,"to reach this objective, it is essential to provide accountable scientific knowledge to policy- and decision-makers to enable them to develop effective policies based on evidence [3,4]."
1,"however, this is still a challenging task because this requires organizing actions (i.e., from data acquisition to knowledge generation) in coherent and coordinated workflows."
1,"these data value chains are a series of transformations to produce new insights from data [5] that can follow the data-information-knowledge-wisdom pattern data 2020, 5, 100; doi:10.3390/data5040100 www.mdpi.com/journal/data"
2,"data 2020, 5, 100 2 of 23 to provide evidence about the limits of our planet [6,7]."
2,this requires a paradigm shift from data-centric to more knowledge-centric approaches [8] integrating different datasets from various disciplines both environmental and socio-economic conditions [9].
2,"ultimately, this allows describing and assessing environmental conditions at different scales (e.g., national, regional, global) and understanding the interactions between the different components of the earth system (e.g., atmosphere, hydrosphere, biosphere, geosphere) and possibly predicting future changes [10]."
2,"however, such a knowledge-centric approach has not yet been widely applied for environmental monitoring [11,12]."
2,"the concept of essential variables (ev) has emerged in various scientific communities as a means to adequately describe and monitor the evolution of earth system components (e.g., atmosphere, biosphere, hydrosphere) through a set of observational data."
2,"these data should be (1) relevant (i.e., critical for characterizing a system and its changes); (2) feasible (i.e., methodologies are scientifically sound, technically feasible); (3) cost-effective (i.e., low cost of implementation, maintenance, archiving and (4) support policy frameworks [13,14]."
2,"evs can be understood as “a minimal set of variables that determine the system’s state and developments, are crucial for predicting system developments, and allow us to define metrics that measure the trajectory of the system“ [15]."
2,"currently, evs are already been defined for climate [16–18], biodiversity [19,20], water [21], oceans [22] and other domains have started the process such as agriculture [23], ecosystems [24], mountains, extractives [25], air quality [26] or renewable energies [27] as well as socio-economic [13,28]."
2,timely and reliable access to evs can provide the basis for accountable scientific understanding and knowledge on environmental conditions to enhance informed and evidence-based policy process [29].
2,"to facilitate environmental monitoring, our planet has been under continuous observation from satellites since 1972, providing synoptic, regular, multi-spectral observations of the planet."
2,"these earth observation (eo) data can provide the long baseline required to determine trends, define present conditions, and inform future evolution [30]."
2,"eo data have the potential to drive progress in key national and international development agendas, providing new insights and supporting better policy development across diverse environmental sustainability issues [31,32]."
2,"indeed, governments have national and international commitments and obligations as well as national environmental programs."
2,"they all need information that is synoptic, consistent, spatially explicit and sufficiently detailed to capture anthropogenic impacts."
2,"however, this vision of eo data-driven decision making has not been fully addressed and challenges remain [33]."
2,"the full information potential of eo data has not yet been realized, because many big data challenges (e.g., volume, variety, velocity), related complexity barriers (e.g., data preparation, model integration and prediction) and lack of capacities/skills hinder effective and efficient use of eo data in policy and decision-making processes [34,35]."
2,"traditional approaches to the acquisition, management, distribution, and analysis of satellite eo data have limitations (e.g., data size, heterogeneity, complexity) that impede their massive use and analysis [36]."
2,"to address these issues and leverage the information potential of eo data, eo data cubes (eodc) have been developed to strengthen the connection between data, applications and users [37]."
2,"eodc are tackling big data challenges by providing efficient and effective solutions to store, organize, manage and analyze large volumes of freely available data in analysis ready (ard) format [38,39]."
2,"various implementations exist mostly at the national and regional scales such as in australia [40,41], africa [42], armenia [43], austria [44], brazil [45], colombia [46], mexico [31], switzerland [47] and taiwan [48]."
2,"however, none of these eodc are neither explored the potential nor routinely generating evs."
2,"consequently, the aim of this paper is to (1) explore and define which evs can be generated using eodc in the three most advanced domains: climate, biodiversity and water; and (2) demonstrate the applicability of eodc in generating selected evs at local and national scales."
2,this can help understanding how eodc can contribute and strengthen existing environmental monitoring systems with the regular provision of evs.
3,"data 2020, 5, 100 3 of 23 2."
3,"methodology and implementation the definition and development of evs in various thematic and scientific domains usually follows a community process to reach an agreement on a set of observables/measurements that can be considered as essential and that satisfy the needs of national to global monitoring, reporting, research or forecasting [15]."
3,"among the different scientific communities, climate, biodiversity and water are those that can be considered the most mature domains and where evs definition process is the most advanced [24]."
3,"for each of these three domains, evs are reviewed and evaluated according to their level of measurability using remotely-sensed data time-series."
3,they are then classified following three labels: (y)es-(p)atrial-(n)o.
3,"yes, means that an ev is fully measurable using remote-sensing data time-series; partial relates to evs that need additional information (e.g., in-situ data, models); no, indicates that they are not measurable using remote-sensing."
3,"in addition, main spatial ((l)ocal-(n)ational-(r)egional-(g)lobal) and temporal ((h)our-(d)ay-(w)eek-(m)onth-(s)eason-(a)nnual) scales for monitoring are also considered."
3,"classification choices are made based on literature search in relevant scientific libraries such as science direct, scopus, web of science or google scholar."
3,"essential climate variables originally, the concept of evs has been defined by the climate community through the effort led by the global climate observing system (gcos) which established a set of 52 essential climate variables (ecv)."
3,these ecvs are supposed to support the work of the united nations framework convention on climate change (unfccc) and the intergovernmental panel on climate change (ipcc) [17].
3,"they were selected for their relevance to characterize the climate system as well as their technical and economic feasibility for systematic observations from satellite remote-sensing or in-situ measurements [16,49]."
3,"ecvs are generated by different organizations (e.g., european space agency, national oceanic and atmospheric administration) and can be searched and accessed through the global observing systems information center (gosic) that provides a single entry-point to ensure a harmonized and integrated search across various data holdings [50]."
3,"however, from a user-perspective accessing ecvs is still difficult because of the variety of data formats, access methodologies, spatial coordinates and temporal resolution [18] making them difficult to integrate with other datasets [51,52]."
3,the full list of ecvs (table 1) has been extracted from the gcos website (https://gcos.wmo.int/en/ essential-climate-variables).
3,table 1.
3,essential climate variables (ecv) and possible contributions from remote sensing.
3,"y-yes, p-patrial, n-no; l-n-r-g, ((l)ocal-(n)ational-(r)egional-(g)lobal); h-d-w-m-s-a, ((h)our-(d)ay-(w)eek-(m)onth-(s)eason-(a)nnual)."
3,"class ecv remote sensing spatial scale temporal scale precipitation y [53] l-n-r-g h-d-w-m-s-a pressure (surface) n l-n-r-g h-d-w-m-s-a surface radiation budget y [54] r-g h-d-w-m-s-a surface surface wind speed y [55] l-n-r-g h-d-w-m-s-a and direction temperature (near surface) y [56] l-n-r-g h-d-w-m-s-a water vapor (surface) y [55] r-g h-d-w-m-s-a earth radiation budget y [57] g w-m-s-a lighting y [58] g w-m-s-a atmosphere upper atmosphere temperature (upper air) p [59] r-g h-d-w-m-s-a water vapor (upper air) p [60] r-g h-d-w-m-s-a cloud properties p [61] r-g h-d-w-m-s-a wind speed and direction y [55] l-n-r-g h-d-w-m-s-a (upper air) aerosols properties p [62] l-n-r-g h-d-w-m-s-a atmospheric composition carbon dioxide, methane and p [63] l-n-r-g h-d-w-m-s-a other greenhouse gases ozone y [64] l-n-r-g h-d-w-m-s-a precursors (supporting the p [65] l-n-r-g h-d-w-m-s-a aerosol and ozone ecvs)"
4,"data 2020, 5, 100 4 of 23 table 1."
4,class ecv remote sensing spatial scale temporal scale river discharge n l-n-r-g h-d-w-m-s-a hydrosphere groundwater p [66] r-g h-d-w-m-s-a lakes y [67] l-n-r-g h-d-w-m-s-a soil moisture p [68] l-n-r-g h-d-w-m-s-a snow y [69] l-n-r-g h-d-w-m-s-a cryosphere glaciers y [70] l-n-r-g m-s-a ice sheets and ice shelves p [70] l-n-r-g m-s-a permafrost p [71] l-n-r-g m-s-a albedo y [72] r-g h-d-w-m-s-a land cover y [73] l-n-r-g a land fraction of absorbed photosynthetically active p [74] l-n-r-g w-m-s-a biosphere radiation (fapar) leaf area index (lai) p [74] l-n-r-g w-m-s-a above-ground biomass p [75] l-n-r-g m-s-a soil carbon p [76] l-n-r-g m-s-a land surface temperature y [77] l-n-r-g h-d-w-m-s-a fire y [78] l-n-r-g h-d-w-m-s-a evaporation from land p [79] l-n-r-g h-d-w-m-s-a anthropogenic greenhouse n l-n-r-g h-d-w-m-s-a anthroposphere gas fluxes anthropogenic water use n l-n-r-g h-d-w-m-s-a ocean surface heat flux p [80] r-g h-d-w-m-s-a sea ice y [81] r-g w-m-s-a sea level p [82] r-g h-d-w-m-s-a sea state n r-g h-d-w-m-s-a physical sea surface salinity y [83] r-g h-d-w-m-s-a sea surface temperature y [84] r-g h-d-w-m-s-a subsurface currents n r-g h-d-w-m-s-a surface currents p [85] r-g h-d-w-m-s-a ocean surface stress n r-g h-d-w-m-s-a inorganic carbon n r-g w-m-s-a nitrous oxide n r-g w-m-s-a biogeochemical nutrients p [86] r-g d-w-m-s-a ocean colour y [87] r-g d-w-m-s-a oxygen n l-n-r-g h-d-w-m-s-a transient tracers n l-n-r-g h-d-w-m-s-a marine habitats properties p [88] r-g m-s-a biological/ecosystems plankton p [89] l-n-r-g h-d-w-m-s-a 2.2.
4,"essential biodiversity variables similarly, the biodiversity community has established essential biodiversity variables (ebv) as a set of variables that are between primary observations and indicators [19,20]."
4,"currently, there are 21 ebvs organized in 6 classes (e.g., genetic composition, species population, species traits, community composition, ecosystem function, ecosystem structure) [90]."
4,"these variables are meant to study, report and manage biodiversity change, status and trends [91]."
4,"they designed to support global initiatives such as the united nations convention on biological diversity (cbd) and the intergovernmental panel for biodiversity and ecosystem services (ipbes) [92] as well as national reporting commitments [93,94]."
4,"ideally, these variables should benefit from a synergetic use of remote sensing and in-situ measurements [95,96]."
4,"however, to access ebv, interoperability challenges are similar to those identified for ecvs [92]."
4,the ebv list (table 2) has been extracted from the group on earth observations (geo) biodiversity observation network (bon) website (https://geobon.org/ebvs/what-are-ebvs/) which is providing access to ebvs through its portal (https://portal.geobon.org).
4,the classification is based on the work done by pettorelli et al. (2016) [95] and randin et al. (2020) [97] how carefully reviewed the potential contributions of remote sensing for biodiversity.
5,"data 2020, 5, 100 5 of 23 table 2."
5,essential biodiversity variables (ebv) and possible contributions from remote sensing.
5,class ebv remote sensing spatial scale temporal scale co-ancestry n l m-s-a allelic diversity n l-n-r-g m-s-a genetic composition population genetic differentiation p l-n-r-g m-s-a breed and variety diversity n l-n-r-g m-s-a species distribution p l-n-r-g m-s-a species population population abundance p l-n-r-g m-s-a population structure by age/size class p l-n-r-g m-s-a phenology p l-n-r-g w-m-s-a morphology p l-n-r-g m-s-a species traits reproduction n l-n-r-g w-m-s-a physiology n l-n-r-g w-m-s-a movement n l-n-r-g w-m-s-a taxonomic diversity p l-n-r-g m-s-a community composition species interactions n l-n-r-g m-s-a net primary productivity p l-n-r-g h-d-w-m-s-a secondary productivity n l-n-r-g h-d-w-m-s-a ecosystem functions nutrient retention n l-n-r-g m-s-a disturbance regime y l-n-r-g m-s-a habitat structure p l-n-r-g m-s-a ecosystem structure ecosystem extent and fragmentation p l-n-r-g m-s-a ecosystem composition by functional type p l-n-r-g m-s-a 2.3.
5,essential water variables essential water variables (ewv) have emerged from different activities on water-related to the geo and led by the integrated global water cycle community of practice [98].
5,"through a community reviewing process to ensure wide acceptance by the community, a set of 16 variables that are linked to applications and end-users [21] and are aiming to support international bodies to provide a comprehensive list of parameters targeting monitoring, modeling, and inter-disciplinary decision support systems [99]."
5,"this list has been derived from user-needs/requirements assessment in all geo user sectors (e.g., agriculture, health, ecosystems, biodiversity, climate, energy, weather)."
5,ewv are listed in table 3 and extracted from the global earth observation system of systems (geoss) water strategy report [98].
5,table 3.
5,essential water variables (ewv) and possible contributions from remote sensing.
5,"class ewv remote sensing spatial scale temporal scale precipitation y [53] l-n-r-g h-d-w-m-s-a evaporation and evapotranspiration p [79] l-n-r-g h-d-w-m-s-a snow cover (and depth, freeze thaw margins) p [100] l-n-r-g h-d-w-m-s-a soil moisture/temperature y [56] l-n-r-g h-d-w-m-s-a primary groundwater p [101] r-g h-d-w-m-s-a runoff/streamflow/river discharge n l-n-r-g h-d-w-m-s-a lakes/reservoir levels and aquifer volumetric change p [67] l-n-r-g h-d-w-m-s-a water quality p [102] l-n-r-g h-d-w-m-s-a water use/demand n l-n-r-g d-w-m-s-a glaciers/ice sheets y [70] r-g m-s-a surface meteorology p [55] l-n-r-g h-d-w-m-s-a surface and atmospheric radiation budget p [57] r-g h-d-w-m-s-a cloud and aerosols p [103] l-n-r-g h-d-w-m-s-a supplementary land cover and vegetation/land use y [73] l-n-r-g m-s-a permafrost p [71] l-n-r-g w-m-s-a elevation/topography and geological stratification p [104] l-n-r-g a 2.4."
5,"implementation to demonstrate the practical capability to generate evs, an operational eodc implementation has been used enabling a country to benefit from satellite eo data for environmental monitoring."
6,"data 2020, 5, 100 6 of 23 switzerland is facing important environmental challenges because it is a small country with increasing pressures on land resources [105] and it is among the first countries in the world to have an operational eodc providing access to a unique eo analysis-ready data (ard) archive over the entire national territory [106]."
6,"the swiss data cube (sdc) is a tera-scale analytical cloud-based platform offering access to 36 years (e.g., 1984 to present days) of satellite data from landsat 5-7-8 [47], sentinel-1 [107], and sentinel-2 [108] sensors."
6,the sdc facilitates national-scale analyses of large volume of spatially aligned and consistently calibrated satellite eo data.
6,"it is an initiative implemented and operated by the united nations environment programme (unep)/global resource information database (grid)-geneva in partnership with the university of geneva, the university of zurich, and the swiss federal institute for forest, snow and landscape research (wsl)."
6,the sdc is supported by the federal office for the environment (foen) and is aiming to contribute to its environmental and reporting mandate while at the same time enabling any swiss institutions to benefit from the information power of satellite eo data.
6,"the archive is updated on a daily basis and contains approximately 12,500 scenes corresponding to a total volume of 5 tb and more than 1000 billion observations/pixels."
6,"it is built on the open data cube (odc), an open-source geospatial data management and analysis software project, led by the committee on earth observation satellites (ceos) in partnership with geoscience australia, the commonwealth scientific and industrial research organisation (csiro), the national aeronautics and space administration (nasa), the united states geological survey (usgs), catapult satellite applications, and analytical mechanics associates (ama) [109]."
6,"in the backend, postgresql database is used to index data and their metadata; data can be either stored as network common data format (netcdf) or cloud-optimized geotiff; and data are handled using geospatial data abstraction library (gdal) and specific python libraries (e.g., numpy, proj, matplotlib)."
6,"the sdc has already provided insightful results for forest monitoring [110], land degradation [111] and snow evolution [112]."
6,"to efficiently and effectively process these large volumes of data and developed tailored applications, the sdc provides a python application programming interface (api) that enables users to write their own processing algorithms [113]."
6,"this api is accessible through jupyter notebooks, an interactive web-based programming interface that can be used for combining software code, algorithm output and explanatory text [114]."
6,"consequently, using these capabilities, dedicated analysis workflows have been implemented as python scripts to produce the evs presented in the next section."
6,results are then published into a geoserver instance (https://geoserver.swissdatacube.org/) and properly documented with metadata descriptions and stored in a geonetwork catalog (https://geonetwork.swissdatacube.org/geonetwork/srv/eng/catalog.search#/home).
6,"this allows an interoperable discovery and access to data products using standardized interfaces such as the web map service (wms), web coverage service (wcs) and catalog service for the web (csw)."
6,"ultimately, these data can be examined in a web-based application enabling users to visualize, query, and download time-series products generated with the sdc (http://www.swissdatacube.org/viewer)."
6,"results based on the evaluation of ecv, ebv and ebw, approximately 67 from a total number of 89 variables can be fully or partially measured using remote sensing."
6,this corresponds to a percentage of 75%.
6,"by domain, this corresponds to 79% of ecv (41 of 52), 57% of ebv (12 of 21) and 88% of ewv (14 of 16)."
6,this shows that remote sensing can provide a substantial contribution to measure this evs.
6,"to test and validate the technical feasibility, identify possible limitations and determine the potential of generating evs using an eodc, different use-cases have been selected."
6,"climate change, biodiversity loss and water management are among the most important pressures that switzerland has to overcome in the next future [115]."
6,"based on this consideration and the review done in section 2, the following essential variables have been selected: (1) for ecv: soil moisture and snow cover; (2) for ebv: ecosystem structure; and finally, for ewv: lake level and water quality."
6,switzerland is recognized as the water castle of europe because approximately 6% of europe’s freshwater reserves are stored in the country [116].
6,"therefore, adequate policies and management"
7,"data 2020, 5, 100 7 of 23 practices are required to preserve and protect this resource."
7,one famous feature of the swiss landscape is the mountainous regions covered by snow in the winter season.
7,"besides its touristic aspect [117], snow is an important water resource and component of the water cycle, storing water in winter and releasing it in spring during the melting season."
7,"snow cover is an ecv that is important to monitor as it provided useful indications on climate change as well as for effective natural resource management (e.g., flood risk management, water supply) [118]."
7,"the contribution of snow melt to water bodies will likely decrease by about 25% by the end of the century and consequently greatly affect the water regime of some of the major european rivers (e.g., rhône, rhine and danube) [119,120]."
7,detailed information on snow cover evolution can be produced to map snow cover extension using optical sensors data available in the swiss data cube.
7,"the snow observations from space (sofs) algorithm [121] allows monitoring of snow cover evolution and variability over the entire swiss territory using a time-weighted approach of the normalized difference snow index [100,122] to compute frequencies of observations."
7,"initial results using 20 years of landsat observations have evidenced an apparent decrease of snow cover during the winter season [31,112]."
7,the area where permanent snow coverage is observed during the winter season has decreased by about 4% while during the same period the area with little or no snow has increased by about 8% (figure 1).
7,figure 1.
7,comparison of snow observations frequencies between the periods 1995/2005 (above) and 2005/2017 (below).
7,areas with permanent snow cover over the winter season (dark blue) have significantly decreased whereas at the same time areas with little or no snow (red) have increased.
7,data source: landsat.
7,such results can be an indication of changing climate conditions over the swiss alps and can help follow the evolution trend of snow cover in this alpine region.
7,another ecv that can be useful to provide useful information on water conditions is the soil moisture.
7,it can be measured in various ways but the normalized difference water index (ndwi) is recognized as a good proxy to estimate water content in vegetation and soils [123].
7,the ndwi
8,"data 2020, 5, 100 8 of 23 estimates soil moisture and canopy water content using the reflecting properties in the near-infrared (nir) and short-wave infrared (swir) bands and is calculated as follows [124]: ndwi = (nir - swir)/(nir + swir), (1) usually, ndwi is a function of local climate conditions and soil properties controlling water availability [125]."
