page,p
18,"see the terms and conditions (https://onlinelibrary.wiley.com/terms-and-conditions) on wiley online library for rules of use; oa articles are governed by the applicable creative commons license 488 case study: omo-gibe river basin 489 as described in the previous section, the dss developed in this study contains several components 490 to aid in the generation of reliable reservoir release decisions at different timescales (daily to 491 492 author manuscript seasonal)."
18,"the components include consideration of various eos-based p and et datasets (14 datasets), ensemble climate forecasts, hydrologic models (based on nasa’s lis), uncertainty 493 quantification (incorporation of model parameter uncertainty in addition to climate forecasts 494 uncertainty), different optimization schemes (deterministic or stochastic), and visualization 495 support tool design considerations."
18,"however, for the purpose of the case study, we apply a specific 496 sequence of the dss chain for a large river basin in east africa at seasonal timescales: a) in the 497 eom, we use all the eos-based datasets described in table 1; b) in the cfm, we use the nmme 498 seasonal forecasts to generate all the three different scenarios (det, spwr-d, and spwr-s) to 499 couple to the hfm, and use ncep and tigge forecasts for daily to weekly rainfall guidance; c) 500 in the hfm, we setup the noah-mp hydrologic model (niu et al., 2011) using nasa’s lis and 501 calibrate the model using dream, however, we select only one behavioral parameter set and 502 therefore no model parameter uncertainty is incorporated in the final release decision; d) in the 503 om, we use deterministic and stochastic programming model at monthly timestep to optimize 504 hydropower under det, spwr-d, and spwr-s scenarios."
18,"in the following sections, we present 505 the hydropower scheme selected as a case study, describe implementation of the developed 506 methodology step-by-step, demonstrate the added value of the dss by comparing results against 507 actually generated hydropower values, and present the particular implementation of our 508 visualization and support module for the dss."
18,"509 study area and time period 510 our study region is the omo-gibe river basin, with an area of 79,000 km2, in ethiopia (figure 4)."
18,"511 the elevation ranges from about 700 to 3,100 m.a.s.l."
18,"the average rainfall in the basin is about 512 1,150 mm with a humid north and arid south."
18,the annual temperature varies between 17 oc and 513 29 oc.
18,"the study area consists of three power plants in operation (gilgel gibe i, ii and iii) and one 514 planned hydropower plant (koysha) – see table 2 for characteristics of the hydropower plants."
18,"515 for our study, we considered a cascade of two reservoirs (gibe i and gibe iii)."
18,"we focused on the 516 time period of february 2005 to september 2005, due to availability of actually generated 517 hydropower production data."
18,"assuming a planning horizon of eight months, we forecasted inflows this article is protected by copyright."
18,all rights reserved
19,"17521688, 2021, 5, downloaded from https://onlinelibrary.wiley.com/doi/10.1111/1752-1688.12914 by university of california, wiley online library on [29/04/2024]."
19,see the terms and conditions (https://onlinelibrary.wiley.com/terms-and-conditions) on wiley online library for rules of use; oa articles are governed by the applicable creative commons license 518 to the reservoirs eight months in advance.
19,"therefore, this case study demonstrates the values of 519 our dss when we selected forecasts made eight months in advance."
19,520 insert figure 4 521 author manuscript earth observations datasets (eos) 522 the first step in implementing the dss is the selection of an appropriate eos-based p and et 523 datasets required for the calibration of climate forecasts and the calibration of the hydrologic 524 model.
19,"using the budyko-based framework of the dss (see eom component in fig. 1), we select 525 the most appropriate p and et datasets from a list of fourteen datasets (table 1) in the following 526 steps."
19,we discretize the study domain into regular grids of 0.25o x 0.25o (a total of 592 grids).
19,the 527 14 datasets are then interpolated onto the grids using bi-linear interpolation.
19,"for each of the grid, 528 the budyko parameter is calculated using equation 5."
19,then the combined error (ce) in a 529 combination of p and et dataset (total of 49 combinations) is determined for each grid cell using 530 equation 4.
19,"finally, the root mean square error (rmse) of all the ce values (total of 592 values) 531 is used to summarize the performance of a specific combination of p and et in representing the 532 water and energy balance of the omo-gibe river basin."
19,the combination of p and et dataset with 533 the least rmse is selected as the best combination.
19,"in figure 5, we present a heat map of the 534 rmse of each combination of p and et dataset."
19,it is seen that the best combination of p and et 535 dataset (i.e. with the least rmse) is obtained for the p product “persiann.cdr” and et product 536 “ssebopv4.0”.
19,"537 insert figure 5 538 weather and seasonal precipitation forecast data 539 for climate forecasts, we use the ensemble seasonal precipitation forecasts from the north 540 american multi-model ensemble (nmme) (kirtman et al., 2014)."
19,it consists of nine partner 541 models with the number of ensemble members in each model varying from six to twenty-eight.
19,"542 as the hydrologic model (described below) requires daily forecasts to run, three models which 543 provide the seasonal forecasts at daily time step are chosen : 1) goddard earth observation 544 system version 5 (geos-5) (borovikov et al., 2019), 2) third generation canadian coupled 545 global climate model (cancm3) (merryfield et al., 2013), and 3) fourth generation canadian 546 coupled global climate model (cancm4) (merryfield et al., 2013)."
19,the cancm3 and cancm4 this article is protected by copyright.
19,all rights reserved
20,"17521688, 2021, 5, downloaded from https://onlinelibrary.wiley.com/doi/10.1111/1752-1688.12914 by university of california, wiley online library on [29/04/2024]."
20,see the terms and conditions (https://onlinelibrary.wiley.com/terms-and-conditions) on wiley online library for rules of use; oa articles are governed by the applicable creative commons license 547 models issue forecasts for lead times of up to 12 months.
20,geos-5 forecasts are available for lead 548 times of up to 9 months.
20,"with ten ensemble members for each model, the dss application to the 549 omo-gibe river basin uses a total of thirty ensembles from three models."
20,the hindcasts of 550 nmme are available for the time period 1981-2010.
20,the spatial resolution is 1.0o x 1.0o and the 551 author manuscript temporal resolution is daily.
20,"552 at the daily- to two week-range time-scales, the dynamical forecast products we discussed above 553 are used to provide rainfall guidance to the user, with these forecasts coming from ncep and 554 tigge."
20,"for s2s forecasts, geostatistical information at weekly-evolving time-scales can also be 555 used to enhance nwp rainfall forecasting skill."
20,"in figure 6, we show composite plots of how the 556 madden-julian oscillation (mjo) impacts rainfall anomalies over ethiopia based on the phase of 557 the mjo because of its proximity to the equator (broman, 2019)."
20,"558 insert figure 6 559 similarly, at seasonal timescales, enso can have an impact on the rainfall over the major river 560 basins in ethiopia, but the phase of the impact varies strongly based on the location, as we see in 561 figure 7."
20,"562 insert figure 7 563 hydrologic model setup and calibration 564 to translate the nmme precipitation forecasts into reservoir inflow forecasts, we choose the 565 noah-mp (multi-parameterization) land surface model (lsm) (niu et al., 2011), driven through 566 nasa’s land information system (lis) (kumar et al., 2006)."
20,we source the static input datasets 567 required for running the noah-mp mode from nasa’s lis data portal 568 (https://portal.nccs.nasa.gov/lisdata).
20,"this includes the land cover map, sourced from united 569 states geological survey (usgs); the soil texture map from state soil geographic (statsgo) 570 dataset, sourced from the united states department of agriculture (usda); and the elevation map 571 from gtopo30, sourced from usgs."
20,"albedo, greenness fraction and temperature are sourced 572 from the national centers for environmental prediction (ncep) reanalysis."
20,"the meteorological 573 forcings required by the noah-mp model include precipitation, air temperature, surface pressure, 574 specific humidity, wind speed, and radiation."
20,"barring persiann.cdr precipitation, all 575 meteorological forcings are derived from the global data assimilation system (gdas), sourced this article is protected by copyright."
20,all rights reserved
21,"17521688, 2021, 5, downloaded from https://onlinelibrary.wiley.com/doi/10.1111/1752-1688.12914 by university of california, wiley online library on [29/04/2024]."
21,see the terms and conditions (https://onlinelibrary.wiley.com/terms-and-conditions) on wiley online library for rules of use; oa articles are governed by the applicable creative commons license 576 from the environmental modeling center (emc) of the ncep.
21,the spatial resolution of the dataset 577 is 0.47o x 0.47o.
21,the noah-mp model is set at a spatial resolution of 5km x 5km.
21,"the 578 meteorological inputs, including the forecasts, are interpolated onto the model grid using bilinear 579 interpolation."
21,the model is spun-up for a period of 68 years by looping through the year 2003 until 580 581 author manuscript the groundwater and soil moisture storage reach equilibrium.
21,the model time step is three hours.
21,"the number of soil layers in the model is four with thicknesses 10cm, 30cm, 60cm, and 100cm."
21,582 specific noah-mp model physics options selected for different processes are detailed in table 3.
21,583 the noah-mp model contains 71 standard parameters (present in user-defined tables) and 139 584 hard-coded parameters (present in the model code).
21,"the noah-mp model output has been found 585 to be sensitive to about two-thirds of the 71 standard parameters (cuntz et al., 2016)."
21,we select 586 five of the most sensitive parameters from the cuntz et al. (2016) study.
21,"the selected parameters 587 are two surface runoff-related parameters (refdk and refkdt), the exponent in the brooks- 588 corey equation (bb), soil porosity (maxsmc), and hydraulic conductivity at saturation 589 (satdk)."
21,"of the five parameters, bb, maxsmc, and satdk are related to soil texture."
21,"as 590 there are twelve soil texture classes, the total number of parameters selected for calibration of the 591 noah-mp hydrologic model is 38 (table 4 presents a detailed breakdown of the parameters with 592 maximum and minimum values used for calibration)."
21,"593 to calibrate the hydrologic model and quantify the uncertainty in reservoir inflow forecasts due to 594 uncertainty in model parameters, we use the dream algorithm."
21,specific configuration options 595 and parameters of the dream algorithm used in this study are detailed in table 5.
21,"in the absence 596 of streamflow observations, we use satellite-based estimates of et (ssebopv4.0) to calibrate the 597 hydrologic model for the year 2004."
21,"specifically, error residuals are determined at all the 5km x 598 5km grid cells and time steps (monthly) over the entire omo-gibe river basin."
21,"on a workstation 599 with 24 processors, dream required approximately 11,300 iterations to converge to a solution."
21,"600 for the purpose of this case study, we choose the best performing model parameter."
21,"as described 601 in the methodology section, multiple behavioral solutions from dream can be used to 602 incorporate model parameter uncertainty in hydropower decision making."
21,"a comprehensive 603 quantification of model parameter uncertainty and its impact on hydropower is discussed in koppa, 604 gebremichael, zambon, et al."
21,(2019).
21,605 visualization module this article is protected by copyright.
21,all rights reserved
22,"17521688, 2021, 5, downloaded from https://onlinelibrary.wiley.com/doi/10.1111/1752-1688.12914 by university of california, wiley online library on [29/04/2024]."
22,"see the terms and conditions (https://onlinelibrary.wiley.com/terms-and-conditions) on wiley online library for rules of use; oa articles are governed by the applicable creative commons license 606 our visualization module provides displays and downloadable data of rainfall estimates from 607 forecasts at time-scales of short-, medium-, and seasonal-range over east africa, with focus over 608 ethiopia."
22,"spatially, to provide the viewer with different scales of resolution, two different sizes of 609 basin-averaged rainfall were provided on the displays, which the user could access through zoom- 610 author manuscript in and zoom-out features."
22,the chosen catchment scales are shown in figure 8.
22,"611 insert figure 8 612 results and discussions 613 first, we evaluate the weather and seasonal precipitation hindcasts over our case study region, the 614 omo-gibe river basin, and the major basins of ethiopia."
22,"then, we evaluate the noah-mp 615 hydrologic model using et estimates from ssebopv4.0."
22,"next, we present the reservoir inflow 616 forecasts and resulting three different scenario structures used for optimization."
22,we also present 617 the results from the deterministic and stochastic programming with recourse model including the 618 optimized release decisions and resulting hydropower production.
22,"finally, we show results from 619 our developed visualization module."
22,"620 evaluation of weather and climate forecasts 621 to validate the 30-member seasonal ensemble precipitation forecasts from nmme, we use the 622 persiann-cdr dataset (selected in the eom)."
22,"we present taylor diagrams (taylor, 2001) to 623 represent the root mean square error (rmse), correlation with observations and standard deviation 624 of different forecast models (figure 9)."
22,"a taylor diagram represents the standard deviation of the 625 observed data and modeled results, radially, along the x and y axes (for example the standard 626 deviation of the observed precipitation is approximately 50 mm)."
22,"the correlation of the different 627 models with the observed data is shown along the circumference of the taylor diagram, increasing 628 radially from the y-axis to the x-axis (for example, the observed data is shown on the x axis, 629 representing a correlation of 1.0 and cancm4 has a correlation of 0.92 at lead time of 1-month)."
22,"630 finally, the rmse of models are represented as contours (dashed yellow lines in figure 4), with 631 rmse values increasing from the x-axis to y-axis (for example, the observed data is shown on the 632 x-axis, representing an rmse of 0.0 and cancm4 has an rmse of approximately 20 mm/month 633 at lead time of 1-month)."
22,"the closer the point representing a model (for example, cancm4) is to 634 the observed data (purple point in figure 5), better the performance of the model."
22,this article is protected by copyright.
22,all rights reserved
23,"17521688, 2021, 5, downloaded from https://onlinelibrary.wiley.com/doi/10.1111/1752-1688.12914 by university of california, wiley online library on [29/04/2024]."
23,"see the terms and conditions (https://onlinelibrary.wiley.com/terms-and-conditions) on wiley online library for rules of use; oa articles are governed by the applicable creative commons license 635 the stochastic programming with recourse model implemented in this study uses forecasts that are 636 updated at the start of each month, while the release decisions are implemented only for the 637 immediate stage."
23,"therefore, we focus on the performance of the forecasts at shorter lead times."
23,"at 638 lead times of 2-3 months, we see that the geos-5 model consistently outperforms the other two 639 640 author manuscript models (figure 9)."
23,"at lead time of 1-month, the cancm4 model exhibits lower rmse and higher correlation with the observed data (figure 9)."
23,"however, at longer lead times, cancm4 model 641 performs relatively poorly compared with the other models."
23,"as expected, the forecast accuracy of 642 all the models deteriorates with increasing lead times."
23,"643 finally, we compare the simple mean and bayesian model average of all 30 ensemble members 644 with the individual models."
23,we see that the ensemble bma outperforms all the other models at 645 almost every lead time (figure 9).
23,the low rmse (approximately 18 mm/month) and high 646 correlation coefficient (greater than 0.9) at lead time 1-month supports this conclusion.
23,"at shorter 647 lead times, the cancm4 model outperforms the ensemble mean in terms of both the magnitude of 648 error and correlation with the observed data."
23,"this highlights the advantage of the bma technique, 649 which provides higher weights to better performing models (cancm4 in this case)."
23,"the ensemble 650 mean, which weighs all the ensemble members equally, is biased by the lower performing 651 cancm3 and geos-5 models."
23,"652 insert figure 9 653 the inclusion of large-scale teleconnections as geostatistical predictors along with nwp multi- 654 modeling can greatly enhance the forecasting skill of nwp seasonal and weather forecasts over 655 not only over the omo-gibe river basin (our primary study region), but over all the major river 656 basins of ethiopia."
23,"building on the relationship between enso and rainfall anomalies shown in 657 figure 7 above, in figure 10 we utilize enso as a predictor along with all eight nmme models 658 into an optimized probabilistic forecast for the blue nile river basin, using the centennial trends 659 (centrends) gauge-based precipitation dataset (funk, nicholson, et al., 2015) for observations."
23,"660 the individual forecast models are calibrated using a regression of the model ensemble mean 661 against the observations leaving one year out at a time (unger et al., 2009)."
23,a simple linear 662 regression is also used to create a probabilistic forecast based on the nino3.4 index.
23,a multi- 663 model forecast is then calculated by averaging the individual nmme forecasts together with 664 enso.
23,since the higher confidence forecasts show greater variability from the climatological this article is protected by copyright.
23,all rights reserved
24,"17521688, 2021, 5, downloaded from https://onlinelibrary.wiley.com/doi/10.1111/1752-1688.12914 by university of california, wiley online library on [29/04/2024]."
24,"see the terms and conditions (https://onlinelibrary.wiley.com/terms-and-conditions) on wiley online library for rules of use; oa articles are governed by the applicable creative commons license 665 mean, they will be more highly weighted in the average."
24,"as a last step, the output of the multi- 666 model forecast itself is once again calibrated to ensure accurate forecast probabilities."
24,"the 667 summer season rainfall over the basin can be skillfully forecast using this multi-model approach 668 (r=0.59, p<0.001)."
24,"669 author manuscript insert figure 10 670 similarly, geostatistical information at weekly-evolving time-scales can also be used to enhance 671 nwp rainfall forecasting skill."
24,"utilizing the information shown in figure 6 on how the phasing of 672 the mjo impacts rainfall anomalies over ethiopia, this information, along with nwp rainfall 673 forecasts from ncep’s cfsv2, can be combined through a quantile regression model, to 674 significantly improve weekly time-scale rainfall forecasts for the omo-gibe, as shown in figure 675 11 (broman et al., 2020) ."
24,"676 insert figure 11 677 at daily-to-two-week time-scales, combining nwp ensemble forecasts into a multi-model forecast 678 can provide significant benefits in forecasting skill for extreme events, as we show below in figure 679 12 (here, 90th percentile rainfall), where we compare rainfall forecasting skill of four weather 680 centers (canada – cmc, ecwmf, us – ncep, uk met office) to a combined multi-model over 681 ethiopia (stellingwerf et al., 2020)."
24,"as shown in the figure using the brier skill score, the multi- 682 model forecast is equal to or out-performs any individual model for all of the 12 primary ethiopian 683 river basins shown."
24,684 insert figure 12 685 evaluation of hydrologic model calibration and reservoir inflow forecasts 686 we validate the set of selected behavioral solutions with the ssebopv4.0 et dataset for the year 687 2005 using time series (figure 13a) and relevant error metrics.
24,figure 13a reveals that the 688 ssebopv4.0 et-calibrated noah-mp model performs well in simulating et over the omo-gibe 689 river basin.
24,"in the calibration period (12 months of 2004), we see that the reference et data (black 690 line) is closer to the 5% quantile of the modelled et for the months of april, may, and june."
24,this 691 implies that the behavioral solutions consistently overestimate et for the months with higher 692 observed evapotranspiration.
24,"in the validation period (12 months of 2005), the reference dataset this article is protected by copyright."
24,all rights reserved
25,"17521688, 2021, 5, downloaded from https://onlinelibrary.wiley.com/doi/10.1111/1752-1688.12914 by university of california, wiley online library on [29/04/2024]."
25,see the terms and conditions (https://onlinelibrary.wiley.com/terms-and-conditions) on wiley online library for rules of use; oa articles are governed by the applicable creative commons license 693 corresponds to the median modelled et values for the first six months.
25,"in this last six months of 694 2005, we see that the model consistently underestimates et over the study area."
25,"additionally, the 695 model can capture the quantity and timing of the peaks and troughs seen in the reference et 696 dataset."
25,"a low mean rmse of 2.5 mm/month and a high mean correlation co-efficient of 0.94, 697 698 author manuscript determined for the validation time period, shows that the noah-mp model is capable of simulating et."
25,"as stated in the methodology, we assume that the high fidelity of the noah-mp model in 699 simulating et across the omo-gibe river basin implies accurate simulation of streamflow."
25,"700 for the application of the dss in the omo-gibe river basin, we select the best performing noah- 701 mp model parameter set from the twenty behavioral solutions (used in figure 13a) to generate the 702 reservoir inflow forecasts for two reservoirs (gibe i and gibe iii)."
25,"as described in the 703 methodology, we construct three scenario structures (det, spwr-d, and spwr-s) for the 704 months february 2005 to september 2005 by combining the calibrated and uncalibrated nmme 705 precipitation forecasts and the et-calibrated noah-mp hydrologic model."
25,"here, we compare the 706 differences in reservoir inflows among the three scenarios."
25,figure 13b presents the deterministic 707 (from bma) and stochastic (raw forecast ensembles) inflows used to construct the three scenario 708 trees.
25,"in addition, we also present the inflows generated from a climatological forecast generated 709 by forcing noah-mp with persiann-cdr precipitation for a period of 10 years (2002 – 2015) 710 (seasn) and determining the average streamflow values for each month of the planning horizon."
25,711 we see that the first three months of the study period are relatively dry compared to the rest of the 712 months.
25,"also, the deterministic inflows into both gibe i and gibe iii are near the mean of the 30- 713 member ensemble, with july and september being the exceptions."
25,"additionally, we also see that 714 there is considerable uncertainty in the reservoir inflow arising from uncertainty in the input 715 precipitation ensembles (boxplots in figure 13b)."
25,the climatological forecasts are higher than the 716 mean of the ensemble mean in the low flow months and lower than the ensemble mean in the high 717 flow months.
25,"718 insert figure 13 719 optimized release decision and power produced 720 the three inflow scenarios (det, spwr-d, and spwr-s) along with the climatological forecast 721 generated using 10-year of persiann-cdr data (seasn) are used as inputs to a deterministic this article is protected by copyright."
25,all rights reserved
26,"17521688, 2021, 5, downloaded from https://onlinelibrary.wiley.com/doi/10.1111/1752-1688.12914 by university of california, wiley online library on [29/04/2024]."
26,see the terms and conditions (https://onlinelibrary.wiley.com/terms-and-conditions) on wiley online library for rules of use; oa articles are governed by the applicable creative commons license 722 and stochastic programming with recourse model to generate optimized power releases (figure 723 14a) and the associated hydropower production (figure 14b).
26,"724 for the gibe i reservoirs, we see that the release decisions generated with the det and spwr-d 725 726 author manuscript inflow scenario structures are similar to each other, except for the month of may 2005 (figure 14a)."
26,we note here that the results correspond to the immediate stage of the stochastic 727 programming with recourse model.
26,"therefore, the similarity between the det and spwr-d 728 release decisions may be because the immediate stage of the spwr-d model is deterministic, 729 and the value derived from bma of ensemble members is equal to the det inflow scenario 730 structure."
26,"we see that the optimized release decisions are consistently higher in the spwr-s 731 case compared with either the det or spwr-d scenario structures, in the dry months."
