page,p
1,1 2 dr.
1,akash koppa (orcid id : 0000-0001-5671-0878) 3 dr.
1,"thomas hopson (orcid id : 0000-0002-4595-7274) 4 author manuscript 5 6 article type : technical paper 7 8 9 a scalable earth observations-based decision support system for hydropower planning 10 in africa 11 akash koppa, mekonnen gebremichael, thomas m."
1,"hopson, emily riddle, jennifer boehnert, daniel p."
1,"12 broman 13 department of civil and environmental engineering (koppa, gebremichael), university of california, los 14 angeles, california, usa (correspondence to koppa: akashkoppa@ucla.edu) 15 hydro-climate extremes lab (h-cel) (koppa), faculty of bioscience engineering, ghent university, 16 coupure links 653, 9000 ghent, belgiumresearch applications laboratory (hopson, riddle, boehnert), 17 national center for atmospheric research, boulder, co, usa 18 department of civil, environmental, and architectural engineering (broman), university of colorado 19 boulder, colorado, usa 20 water and environmental resources division (broman), united states bureau of reclamation, colorado, 21 usa 22 research impact statement: a novel decision support system based on earth observation 23 satellites, ensemble climate forecasts and hydrologic models for hydropower planning under deep 24 data uncertainty in africa."
1,"this is the author manuscript accepted for publication and has undergone full peer review but has not been through the copyediting, typesetting, pagination and proofreading process, which may lead to differences between this version and the version of record."
1,please cite this article as doi: 10.xxxx/jawr.12914 this article is protected by copyright.
1,all rights reserved
2,"17521688, 2021, 5, downloaded from https://onlinelibrary.wiley.com/doi/10.1111/1752-1688.12914 by university of california, wiley online library on [29/04/2024]."
2,see the terms and conditions (https://onlinelibrary.wiley.com/terms-and-conditions) on wiley online library for rules of use; oa articles are governed by the applicable creative commons license 25 abstract: hydropower is a key part of the increasing shift in power production from non- 26 renewables to renewable energy.
2,"in regions such as africa, hydropower reservoirs are vital for 27 achieving several sustainable development goals, including clean water, energy, and poverty 28 elimination."
2,"however, the operations of hydropower reservoirs are often sub-optimal due to lack 29 30 author manuscript of hydrologic data for generating reliable inflow forecasts."
2,"here, we present a decision support system (dss) framework for hydropower planning at daily to seasonal timescales by combining 31 data from earth observation satellites (eos) with ensemble climate forecasts from dynamical 32 models and hydrologic modeling."
2,the large uncertainty inherent in satellite-based datasets is 33 overcome by using a data validation framework which does not require ground-based 34 measurements.
2,"in addition, an eos evapotranspiration product is used as a proxy for streamflow 35 in calibrating hydrologic models."
2,"compared to a dss forced with a climatological forecast (zero- 36 skill), the hydropower production with the new dss increased by 20%."
2,"the study highlights the 37 advantage of using data from eos in overcoming the issue of data scarcity in water resources 38 applications, particularly in developing regions of the world such as africa."
2,39 (keywords: hydropower; decision support system; remote sensing; water resources) 40 introduction 41 access to water and energy are essential for the development of the socio-economically vulnerable 42 regions of the world.
2,"in fact, clean water and energy constitute two (sdg6 and sdg7) out of the 43 seventeen sustainable development goals (sdgs) identified by the united nations (griggs et al., 44 2013; sachs, 2012) (https://sustainabledevelopment.un.org/)."
2,"effective water and energy resources 45 planning is necessary for not only achieving sdg6 and sdg7 but also plays an important role in 46 addressing other sdgs such as poverty elimination (sdg1), zero hunger (sdg2), and promotion 47 of sustainable cities and communities (sdg11)."
2,"in this regard, hydropower, which lies at the nexus 48 of water and energy, has an important role to play."
2,"this is especially true in africa, which has 49 witnessed significant growth in the construction of reservoirs, including those specifically 50 targeting hydropower production."
2,"with such an exponential increase in hydropower capacity, it is 51 crucial to operate these reservoirs in such a way that guarantees energy production is maximized, 52 not an easy task given the seasonal and annual variability of water availability under present 53 (broman et al., 2020) and future (fletcher et al., 2019) climatic conditions."
2,"the lack of optimal 54 reservoir operation causes more frequent power outages and associated economic losses, and this article is protected by copyright."
2,all rights reserved
3,"17521688, 2021, 5, downloaded from https://onlinelibrary.wiley.com/doi/10.1111/1752-1688.12914 by university of california, wiley online library on [29/04/2024]."
3,"see the terms and conditions (https://onlinelibrary.wiley.com/terms-and-conditions) on wiley online library for rules of use; oa articles are governed by the applicable creative commons license 55 incurs substantial opportunity cost (conway et al., 2017; sridharan et al., 2019)."
3,"these reasons 56 necessitate the development and implementation of decision support systems (dsss) which can 57 provide reliable and effective information to decision makers, at the relevant time scales."
3,58 59 author manuscript dsss are used for the optimal operations of reservoirs for a variety of purposes.
3,"typically, the near-term (daily), sub-seasonal (weekly), and seasonal (monthly) releases from a reservoir serve 60 multiple purposes, such as domestic, industrial, and agricultural water supply, flood control, 61 hydropower, and the maintenance of environmental flows (alemu et al., 2011; koppa, 62 gebremichael, zambon, et al., 2019; westphal et al., 2003)."
3,"a dss consists of three parts: 1) an 63 inflow forecasting system which uses statistical or dynamical methods to generate possible 64 realizations of future inflow into the reservoir at the required timescales, 2) an optimization system 65 which employs either deterministic or stochastic programming techniques, based on the nature of 66 the inflow forecasts, to optimize reservoir outflows, and 3) a visualization support system interface 67 that communicates this information to the user in an effective way to meet their decision-making 68 process in a timely fashion."
3,"in the rest of the introduction, we provide a brief overview of the three 69 enumerated dss components and summarize the objectives of this study."
3,70 inflow forecasting system 71 the effectiveness of a dss for hydropower planning is significantly influenced by the reliability 72 of the inflow forecasting system.
3,"inflow forecasting systems generally fall into one of the 73 following two categories: (1) statistical modeling based on past streamflow observations, and (2) 74 dynamically driven hydrologic modeling forced by climate forecasts."
3,"75 in the first category, statistical modeling techniques such as autoregressive moving average and 76 neural networks which sample from past observation of inflows, are used to generate the forecasts 77 (cuo et al., 2011; li et al., 2017)."
3,"several factors hinder the application of such an inflow 78 forecasting system in africa, of which in-situ data scarcity and inaccessibility are the most 79 significant, because the lack of reliable long-term inflow information adversely impacts the 80 accuracy of statistical models of forecasting."
3,"81 in the second category, dynamic forecasts of reservoir inflows are generated with computational 82 physics-based climate and hydrologic models."
3,"the emergence of ensemble climate and hydrologic 83 forecasting in the last decade has shown potential for improving the quality of the forecasts, and this article is protected by copyright."
3,all rights reserved
4,"17521688, 2021, 5, downloaded from https://onlinelibrary.wiley.com/doi/10.1111/1752-1688.12914 by university of california, wiley online library on [29/04/2024]."
4,"see the terms and conditions (https://onlinelibrary.wiley.com/terms-and-conditions) on wiley online library for rules of use; oa articles are governed by the applicable creative commons license 84 hence forecast-informed decision making (alfieri et al., 2013; benninga et al., 2017)."
4,"while this 85 category has shown value in generating dynamic forecasts and acknowledging some uncertainties 86 in the forecasts, it is limited by the large range in ensemble members and questions about which 87 ensemble forecast products are reliable."
4,"in addition, reliable calibration of spatially distributed 88 89 author manuscript hydrologic models for forecasting purposes are largely dependent on the availability of streamflow measurements."
4,"90 in our opinion, the next advancement in the inflow forecasting system in regions with reduced in 91 situ monitoring would be to develop a methodology that accurately quantifies the uncertainty in 92 the climate ensemble forecast products and reduces the uncertainty to a level that is useful for 93 decision making."
4,"therefore, in this study, we propose a new approach for inflow forecasting 94 system that is particularly appropriate in data-scarce regions, such as africa."
4,"this approach is to 95 utilize earth observing system (eos) data to both dynamically adjust the climate forecasts 96 provided by climate forecast centers, while also utilizing the eos data with novel techniques to 97 calibrate the hydrologic models of watersheds with limited surface measurements."
4,"98 the value of eos in enabling improved water resources management in data scarce regions is well 99 recognized (sheffield et al., 2018)."
4,"the development of improved eos over the last fifty years has 100 resulted in vast amounts of direct and indirect observations of nearly all the water and energy 101 balance components required for modeling the earth’s terrestrial processes, including its hydrology 102 (lettenmaier et al., 2015)."
4,"although, eos data have been extensively used in climate and 103 hydrological modeling and forecasting through data assimilation (crow and ryu, 2009; mazrooei 104 and sankarasubramanian, 2019) and model calibration (koppa, gebremichael, and yeh, 2019; 105 lópez et al., 2017; rakovec et al., 2016; zink et al., 2018) or directly as forcing inputs, the utility 106 of such data for water and energy resources planning, in general, and hydropower reservoir 107 operation, specifically, has not been sufficiently explored."
4,108 one of the key challenges in utilizing eos data products is to choose which data products to use.
4,"109 there are many eos data products for the same variable (e.g., precipitation) with large differences 110 amongst them owing to differences in satellites, sensors and retrieval algorithms."
4,"in addition, the 111 choice of eos data products may have to take into account their joint performance to ensure some 112 realism, for example, the closure of energy and water balance."
4,"this is corroborated by several 113 findings (bitew et al., 2012; koppa, gebremichael, and yeh, 2019) who showed that the use of this article is protected by copyright."
4,all rights reserved
5,"17521688, 2021, 5, downloaded from https://onlinelibrary.wiley.com/doi/10.1111/1752-1688.12914 by university of california, wiley online library on [29/04/2024]."
5,"see the terms and conditions (https://onlinelibrary.wiley.com/terms-and-conditions) on wiley online library for rules of use; oa articles are governed by the applicable creative commons license 114 eos data products for only one variable may show good performance in simulating the streamflow 115 at the outlet of the catchment, but it may have large errors and unrealistic performance in 116 simulating other water balance components, indicating that such an approach may not work in 117 simulating even streamflow in the case of cascading hydropower reservoirs."
5,"therefore, new 118 119 author manuscript methodologies need to be developed that advance the use of eos data for hydropower reservoir planning, particularly in africa where ground validation data are lacking."
5,"120 optimization system 121 the optimization of a cascade of hydropower dams, using an ensemble of streamflow forecasts, is 122 generally carried out using stochastic programming with recourse models (yeh, 1985)."
5,"in such 123 models, the system of reservoirs is optimized for the entire forecast horizon but the release 124 decisions for only the first-time step (referred to as ‘first stage’) is adopted."
5,"then, the forecast 125 horizon is moved forward by one stage and the optimization procedure is repeated."
5,"although the 126 value of stochastic inflow forecasts in hydropower optimization is well studied (séguin et al., 127 2017), an assumption inherent in such optimization models is that the first stage (day, week, 128 month) forecast is deterministic."
5,"in other words, the forecast for the first stage is assumed to be 129 sufficiently accurate such that a single deterministic forecast for the first stage is deemed enough 130 for the optimization of reservoirs."
5,"when new information regarding the inflow into reservoirs are 131 available, the whole system is validated, and the required adjustments are made to the dss before 132 the start of the next stage."
5,"several studies employ this approach for the operation of reservoir 133 cascades (etkin et al., 2015; wang et al., 2012)."
5,"however, such an approach is dependent on the 134 availability of reservoir inflows at regular intervals for the validation of the entire dss, which may 135 not be possible in data scarce regions such as africa."
5,"here, we implement a new stochastic 136 programming with recourse model which considers the first stage to be also stochastic (koppa, 137 gebremichael, zambon, et al., 2019)."
5,"in addition, we implement the conventional stochastic 138 programming with recourse model and a purely deterministic optimization model to enable 139 decision making under data scarcity and uncertainty."
5,140 visualization support system 141 the effectiveness of a dss for hydropower planning is significantly enhanced by providing a 142 coherent interface between the technical outputs of the inflow forecasting and optimization 143 systems that then communicates this information to the user in an effective way to meet their this article is protected by copyright.
5,all rights reserved
6,"17521688, 2021, 5, downloaded from https://onlinelibrary.wiley.com/doi/10.1111/1752-1688.12914 by university of california, wiley online library on [29/04/2024]."
6,"see the terms and conditions (https://onlinelibrary.wiley.com/terms-and-conditions) on wiley online library for rules of use; oa articles are governed by the applicable creative commons license 144 decision-making process, all in a timely fashion."
6,the scale of the information produced by 145 hydrometeorological services and climatological centers can often be overwhelming to a user.
6,"as 146 an example, ensemble rainfall forecasts at a single location from a single weather center can easily 147 comprise over 3000 data points for a forecast going out to two weeks in advance – a well-designed 148 149 author manuscript visualization and support system then should consolidate and filter such information using expert knowledge of the data’s relevance to the unique decision making process of the user."
6,"a number of 150 systems have been developed that have been shown to be effective in communicating timely, 151 coherent, relevant, and user-friendly information for a number of applications that have relevance 152 to a broad class of user’s decision-making needs, such as in the area of climate change (wilhelmi 153 et al."
6,2016).
6,"decision support visualization tools for hydropower planning comprises a unique 154 challenge, in that design considerations for decision making need consider a broad range of data 155 types (e.g. rainfall, streamflow, and power), temporal immediacy (e.g. historical, current 156 observations, forecasts), data source centers (e.g. space agencies and weather centers), the range 157 of temporal scale (e.g. 24-hour, 5-day, 1-month, and 3-month totals) and spatial scale (grid, small- 158 to large-catchment averaging), data accessing formats (e.g. csv, flat file, time-series, etc.), 159 uncertainty information (ensembles versus cumulative probabilities versus averages), and general 160 aesthetic and design considerations."
6,"161 objectives of the study 162 in this study, the three systems detailed above are combined to create a decision support system 163 (dss) for hydropower planning in africa and other data scarce regions that leverages the potential 164 of eos data, ensemble climate forecasts, hydrological models, and stochastic optimization 165 systems."
6,"this study leverages the findings of our previous research to develop, implement, and 166 test a coherent dss prototype, at daily to seasonal timescales, in a major river basin in ethiopia 167 consisting of a cascade of hydropower reservoirs."
6,"the newly developed dss contains the 168 following innovations, and web-based tools to enable hydropower managers to implement the dss 169 in operational settings: 170  selection of appropriate eos data products – the dss includes a new data validation 171 framework for data-scarce regions that allows users to select the best eos data products, 172 among the wide variety available data products, required for the calibration of climate 173 precipitation forecasts and hydrologic models (koppa and gebremichael, 2017)."
6,the this article is protected by copyright.
6,all rights reserved
7,"17521688, 2021, 5, downloaded from https://onlinelibrary.wiley.com/doi/10.1111/1752-1688.12914 by university of california, wiley online library on [29/04/2024]."
7,see the terms and conditions (https://onlinelibrary.wiley.com/terms-and-conditions) on wiley online library for rules of use; oa articles are governed by the applicable creative commons license 174 framework does not require any ground-based data and uses the concept of budyko 175 hypothesis to select the most appropriate eos data products that represent the climate 176 accurately and close the water and energy balance.
7,177  calibration of weather and climate forecasts – the dss development has led to 178 179 author manuscript innovations in calibrating optimized multi-model/multi-center ensemble weather and climate forecasts at daily (medium-range) and weekly (s2s) time scales using conditioned 180 analogue approaches blended with geostatistical regressors and quantile regression.
7,these 181 post-processsed forecasts then provide skillful and reliable rainfall forecasts tailored for 182 the next stage in hydrometeorological forecast generation.
7,"183  calibration of hydrologic models – the dss will use a recently developed bayesian 184 framework and eos terrestrial evaporation data product to calibrate a hydrologic model 185 (koppa, gebremichael, and yeh, 2019; koppa and gebremichael, 2020)."
7,"this approach 186 conveniently replaces streamflow data, which is the commonly used data for calibrating 187 hydrologic models, with eos terrestrial evaporation data products, because most 188 watersheds in africa are ungauged and even those that are gauged have data quality issues 189 (outdated rating curve, stage measurements observed and recorded manually by non- 190 experts) and availability (substantial time lag until the data are transferred to electronic 191 format and shared by users, and bureaucracy in data sharing)."
7,192  reservoir optimization models – the dss will use a new methodology that incorporates 193 uncertainties in climate forecasts and hydrologic model parameters in the optimization of 194 hydropower (koppa et al.
7,2019).
7,"195  web-based decision support tool – a powerful web- and gis-based visualization tool for 196 analyzing dss outputs to aid decision makers, that presents information in ways relevant 197 to the unique breadth and challenges of hydropower management."
7,198 the study is organized as follows.
7,"in the next section, we provide a detailed overview of the dss 199 framework for data scarce regions."
7,"then, we describe the experimental design of the application 200 of the dss using selected hydropower reservoir systems in ethiopia as a case study."
7,"finally, we 201 present and discuss the implications of using eos-based dss for data scarce regions."
7,202 203 methodology this article is protected by copyright.
7,all rights reserved
8,"17521688, 2021, 5, downloaded from https://onlinelibrary.wiley.com/doi/10.1111/1752-1688.12914 by university of california, wiley online library on [29/04/2024]."
8,"see the terms and conditions (https://onlinelibrary.wiley.com/terms-and-conditions) on wiley online library for rules of use; oa articles are governed by the applicable creative commons license 204 the dss in this study consists of the following components: a) earth observations module (eom), 205 b) climate forecasting module (cfm), c) hydrologic forecasting module (hfm), d) optimization 206 module (om), and e) visualization module (vm)."
8,the dss process (figure 1) starts with the 207 selection of the most appropriate eos data for precipitation (p) and evapotranspiration (et) 208 209 author manuscript variables for the selected domain (eom).
8,"the selected p dataset is then used to calibrate ensemble weather and climate forecasts using combined analogue and quantile regression approaches 210 (hopson, 2014; hopson and webster, 2010; knievel et al., 2017; koenker and bassett, 1978b) at 211 the daily to seasonal timescales in the cfm."
8,"an additional forecast calibration methodology in the 212 form of bayesian model averaging (bma) (hoeting et al., 1999; raftery et al., 2005) is also 213 implemented."
8,"simultaneously, the selected et dataset is used to calibrate the hydrologic model 214 using a bayesian calibration algorithm to derive a set of parameters for streamflow forecasting."
8,"215 next, the calibrated climate forecasts are used as input into the hydrologic model to generate 216 ensemble forecasts of inflows into all the reservoirs in the study domain for the forecast horizon 217 (hfm in figure 1)."
8,"in om, the generated reservoir inflow forecasts are then used as an input into 218 a stochastic programming with recourse model to generate optimized reservoir release decision 219 such that the hydropower production is maximized."
8,"finally, web-based decision support tools 220 visualize the ensemble climate forecasts, the reservoir inflow scenarios, and the optimized release, 221 storage and hydropower decisions (vm in figure 1)."
8,we detail each module of the dss in the 222 following subsections.
8,223 insert figure 1 224 earth observations module (eom) 225 the primary objective of the eom is to select the most appropriate eos-derived p and et datasets 226 for the calibration of ensemble p forecasts and the hydrologic model.
8,"in data scarce regions, such 227 as africa, evaluation of eos data products using in-situ measurements is not possible."
8,"we use a 228 recently developed framework which does not require in-situ measurements for validating eos- 229 based p and et datasets (koppa and gebremichael, 2017)."
8,"the framework compares p and et 230 datasets against the budyko hypothesis, a semi-empirical model that describes the coupled water 231 and energy balance of watersheds at long-term timescales (budyko, 1974), using two indices: (1) 232 evaporative index (et/p, abbreviated as ei) and (2) aridity index (pet/p, abbreviated as ai)."
8,"in 233 the dss, we utilize fuh’s equation (fuh, 1981) (equation 1), a single parameter budyko function: this article is protected by copyright."
8,all rights reserved
9,"17521688, 2021, 5, downloaded from https://onlinelibrary.wiley.com/doi/10.1111/1752-1688.12914 by university of california, wiley online library on [29/04/2024]."
9,"see the terms and conditions (https://onlinelibrary.wiley.com/terms-and-conditions) on wiley online library for rules of use; oa articles are governed by the applicable creative commons license 1 � � �� ��� ��� 234 � =1+ � ― 1+ � ( ( )) (1) 235 where pet is potential et, and � is a parameter which has no analytical solution, but several 236 author manuscript parameterizations have been suggested relating � to watershed characteristics such as topography, 237 soil, vegetation, and geographical location of watersheds among others (li et al., 2013; xu et al., 238 2013)."
9,"239 the budyko curve (equation 1) is constrained by the following water and energy limits: �� ��� 240 = 1, >1 (����� �����) (2) � � �� ��� ��� 241 = , <1 (������ �����) (3) � � � 242 the water limit (equation 2) implies that et cannot exceed p in the long term."
9,implicit in the 243 constraint is the assumption that the contribution of watershed storage to long-term water 244 availability is negligible.
9,"we note that this assumption may be inadequate in watersheds which 245 have experienced severe long-term groundwater loss (condon and maxwell, 2017)."
9,"in watersheds 246 where water availability is not a constraint, et is limited by the available energy in the form of 247 net radiation (rn) or pet (equation 3)."
9,"consequently, in our application of the fuh equation 248 (equation 1), the parameter, �, is stationary."
