page,p
9,"however, several studies have disputed this 249 assumption (mianabadi et al., 2020; ning et al., 2018) at finer timescales (monthly, seasonal, or 250 interannual)."
9,we acknowledge that the lack of consideration of the non-stationarity in � could 251 impact the results of the analysis presented below.
9,"to reduce this impact, we conduct our analysis 252 at long-term time scales."
9,"in addition, we have comprehensively quantified the effect of the 253 variability in � in a previous study in which we have developed the methodology (koppa and 254 gebremichael, 2017)."
9,"we have shown that at long-term time scale, the value of � does not have 255 significant on our results."
9,"moreover, similar analysis has been used in a number of hydrological 256 (greve et al., 2020) and climate change studies (greve et al., 2014; zhou et al., 2015)."
9,"finally, we 257 emphasize here that a different methodology for selection of precipitation datasets is necessitated 258 by the lack of availability of ground-based measurements for validating the datasets."
9,"in regions 259 where such validation datasets are available, the remote sensing datasets should be evaluated using this article is protected by copyright."
9,all rights reserved
10,"17521688, 2021, 5, downloaded from https://onlinelibrary.wiley.com/doi/10.1111/1752-1688.12914 by university of california, wiley online library on [29/04/2024]."
10,see the terms and conditions (https://onlinelibrary.wiley.com/terms-and-conditions) on wiley online library for rules of use; oa articles are governed by the applicable creative commons license 260 ground-based measurements.
10,"as this study focuses on detailing the alternate methodology, we do 261 not present a evaluation with ground-based measurements."
10,"262 in koppa and gebremichael (2017), we show that the validation framework is capable of 263 264 author manuscript mimicking traditional methodologies which use in-situ measurements."
10,"specifically, we show that the combined error (ce) in p and et datasets can be represented by the following euclidean 265 measure (equation 4): 266 �� = (����� ― �����)2 + (����� ― �����)2 (4) 267 where, 268 1) eiest and aiest are the long-term average evaporative and aridity indices estimated from 269 satellite-based estimates of p, et, and rn considered in this study for water and energy 270 balance closure."
10,"271 2) aiact is the actual long-term estimate of ai determined using observed rn from the 272 nasa/gewex surface radiation budget (srb) (cox et al., 2006) v3.0 data and 273 precipitation from worldclim v2.0 dataset (fick and hijmans, 2017)."
10,this is done as the 274 methodology developed in koppa & gebremichael (2017) is based on the assumption 275 that the aridity of the watershed is known and does not change significantly.
10,the srb 276 data spans the years 1983-2007 with a spatial resolution of 1o x 1o.
10,the temporal range of 277 the worldclim dataset is 1970–2000 and the spatial resolution is 1km x 1km.
10,278 3) eimod is determined from fuh’s equation (equation 3) as ����� = 1 + ����� ― 279 (1 + (�����)�)1/� where � is the budyko parameter.
10,"280 as � has no analytical solution, we use the parameterization developed by (xu et al., 2013)."
10,"281 specifically, we make use of the following multiple linear regression (mlr) model � = 5.057 ― 0.093��� + 0.130��� + 1.316���� + 0.000003� 282 ― 0.00018���� (5) 283 where, 284 1) lat is the latitude of the centroid of each watershed."
10,this is derived from the 285 hydrobasins dataset.
10,this article is protected by copyright.
10,all rights reserved
11,"17521688, 2021, 5, downloaded from https://onlinelibrary.wiley.com/doi/10.1111/1752-1688.12914 by university of california, wiley online library on [29/04/2024]."
11,"see the terms and conditions (https://onlinelibrary.wiley.com/terms-and-conditions) on wiley online library for rules of use; oa articles are governed by the applicable creative commons license 286 2) cti is the compound topographic index (beven and kirkby, 1979) defined as 287 ln (�/tan �), where a is the upstream watershed area derived from the hydrobasins 288 dataset, � is the slope in degrees."
11,"we derive the average slope of each watershed from the 289 multi-error-removed improved-terrain (merit) digital elevation model (dem) which 290 291 author manuscript has coverage of the entire earth (yamazaki et al., 2017)."
11,cti is correlated with soil moisture.
11,low cti values implies smaller watersheds and steep slopes.
11,high cti values 292 are associated with large watersheds with gentle slopes and represents more water 293 accumulation.
11,294 3) a is the area of watershed derived from hydrobasins dataset and elev is elevation 295 derived from merit dem.
11,"296 4) ndvi is the normalized difference vegetation index derived from nasa’s moderate 297 resolution imaging spectroradiometer (modis), specifically mod13a2 v6.0 available 298 at 1km spatial resolution (didan, 2015)."
11,we determine one ndvi value per watershed by 299 averaging over the years 2000–2018.
11,"300 in summary, the following steps are followed to select the best performing p and et datasets: 1) 301 for a given watershed or catchment area of hydropower reservoirs, the fuh parameter (�) is 302 determined using equation 5."
11,2) the actual or reference long-term aridity index of the study region 303 is calculated using reliable potential evaporation (pet) or net radiation and precipitation datasets.
11,"304 3) for every combination of p and et dataset to be evaluated, a euclidean distance metric in the 305 budyko space (ce) is calculated using equation 4."
11,"4) finally, the combination of p and et dataset 306 with the least value of ce is selected as the best performing datasets."
11,"307 in the dss, we implement this framework described above to select the most appropriate p and 308 et dataset among 14 widely used eos p and et datasets (figure 1 and table 1), using the 309 euclidean distance metric described in equation (4)."
11,the best p and et dataset selected using the 310 framework for a specific watershed will then be used in cfm to calibrate the forecasts and in the 311 hfm to setup and calibrate the distributed hydrologic model.
11,"312 climate forecasting module (cfm) 313 in the cfm, weather and climate forecasts at three different timescales can be generated as input 314 to the hfm: daily, sub-seasonal-to-seasonal (s2s), and seasonal."
11,based on the optimization this article is protected by copyright.
11,all rights reserved
12,"17521688, 2021, 5, downloaded from https://onlinelibrary.wiley.com/doi/10.1111/1752-1688.12914 by university of california, wiley online library on [29/04/2024]."
12,"see the terms and conditions (https://onlinelibrary.wiley.com/terms-and-conditions) on wiley online library for rules of use; oa articles are governed by the applicable creative commons license 315 system, three different forecast scenario structures are produced: a) a single deterministic forecasts 316 for all stages (det), b) a single deterministic forecast for the first stage and ensemble (stochastic) 317 forecasts for the rest of the forecast horizon (spwr-d), and c) ensemble (stochastic) forecasts for 318 all the stages (spwr-s)."
12,"for generating these scenarios, raw or calibrated multi-model ensemble 319 320 author manuscript weather or climate forecasts are used."
12,"two distinct approaches are available in the cfm for calibration of the forecasts: 1) combination of analogue and quantile regression, 2) bayesian 321 model averaging (bma)."
12,"below, we provide details of both the approaches."
12,"322 the combined analogue and quantile regression algorithm (knievel et al., 2017; koenker and 323 bassett, 1978) can be explained as follows."
12,"let {yi} represent a set of observations of the 324 regressand y of interest, and {xi} be an associated set of predictor values."
12,"analogous to standard 325 linear regression, a linear function of x can be used to estimate to a specific quantile q of y 326 (6) 327 with residuals and  (0,1) ."
12,"however, instead of minimizing the squared 328 residuals as with standard linear regression, in qr a weighted iterative minimization of {ri} is 329 performed over : 330 , (7) 331 with the weighting function used inside the summation defined as (using a generic placeholder 332 “u”):  u u0  (u)    (  1)u u  0 333 , (8) 334 where the value of � then prescribes the quantile function that one is solving for (e.g. say, 0.5 for 335 a fit to the median; or 0.9 for a 90th percentile functional fit)."
12,"the benefits of using qr is that it 336 can be used to estimate the full probability distribution function of the regressand, the optimality 337 of its estimation does not require homoscedastic residuals (unlike standard linear regression), and 338 its functional fit is more immune to unrealistic outliers than standard linear regression (which 339 minimizes the squares of the residuals)."
12,this article is protected by copyright.
12,all rights reserved
13,"17521688, 2021, 5, downloaded from https://onlinelibrary.wiley.com/doi/10.1111/1752-1688.12914 by university of california, wiley online library on [29/04/2024]."
13,"see the terms and conditions (https://onlinelibrary.wiley.com/terms-and-conditions) on wiley online library for rules of use; oa articles are governed by the applicable creative commons license 340 building on this qr backbone, one aspect that makes our postprocessing approach novel is that 341 we “pre-process” the ensemble dispersion ensuring its reliability (hopson, 2014), and then 342 explicitly condition the training of the final postprocessing model on the degree of the (now- 343 calibrated) ensemble dispersion, the primary benefit of which is that when the ensembles of the 344 345 author manuscript forecast are less(more) dispersed, the forecast user can trust that the forecast is more(less) certain."
13,figure 2 provides a schematic of our approach.
13,"additionally, we have investigated the use of 346 hybrid statistical-dynamical prediction methodologies to multi-model ensemble dynamical 347 forecasts and geophysical teleconnections to generate rainfall predictions."
13,"specifically, at the s2s 348 scale we have enhanced forecast skill of the ncep-cfsv2 model through combining with madden 349 julian oscillation (mjo) indicators, which we will discuss further below in our case study and 350 results section."
13,351 insert figure 2 352 the second method implemented for calibration of forecasts is bayesian model averaging 353 (bma).
13,"bma is a well-established methodology for calibrating forecast ensembles generated 354 from multiple statistical (hoeting et al., 1999) or dynamical models (raftery et al., 2005)."
13,"bma 355 of a forecast ensemble results in a calibrated and sharp predictive probability density function 356 (pdfs), represented as a weighted averaged of the pdfs of the ensemble members."
13,"following 357 sloughter et al. (2007), the bma predictive pdf can be mathematically represented as � 358 �(�|�1,�2,…,��) = ∑ ����(�│��), (9) � =0 359 where �� is the posterior probability of ensemble forecast member �� being the best one, 360 determined in the calibration or training period using observed or reference data of the 361 hydrologic variable under consideration � (for example, precipitation or terrestrial evaporation); 362 and ��(�│��) is the conditional pdf associated with the ensemble forecast �� of the hydrologic 363 quantity �."
13,"for variables such as temperature, the conditional pdf ��(�│��) can be assumed to 364 be normally distributed (raftery et al., 2005), but a gamma distribution is more appropriate for 365 precipitation (sloughter et al., 2007)."
13,"in the dss, we use a mixture of point mass at zero and a 366 gamma distribution as the conditional pdf (sloughter et al., 2007)."
13,we determine the bma 367 weights (��) of ensemble precipitation members using the most appropriate p dataset selected in 368 the eom.
13,this article is protected by copyright.
13,all rights reserved
14,"17521688, 2021, 5, downloaded from https://onlinelibrary.wiley.com/doi/10.1111/1752-1688.12914 by university of california, wiley online library on [29/04/2024]."
14,"see the terms and conditions (https://onlinelibrary.wiley.com/terms-and-conditions) on wiley online library for rules of use; oa articles are governed by the applicable creative commons license 369 in the dss, we aim to provide support for the most popular global ensemble weather and climate 370 forecasts at daily to seasonal timescales."
14,"at daily weather scale (1- to 16-day lead-times), real- 371 time ensemble forecasts are available from ncep (21 members) and environment canada (21 372 ensembles)."
14,"to expand the multi-model, ensemble forecasts are utilized from an additional six 373 374 author manuscript climate centers from the (two-day delayed) thorpex interactive grand global ensemble (tigge) archive: cma (15 ensembles), cptec (15 ensembles), ecmwf (51 ensembles), 375 meteofrance (11 ensembles), ukmet (24 ensembles), and jma (51 ensembles)."
14,the spatial 376 resolutions of the forecasts vary in the range from 0.25 to 1.50 degrees (table 1).
14,"the forecasts 377 are available at lead times, ranging from nominally 6-hr to 16-days."
14,"at the subseasonal- to 378 seasonal-range (s2s; 2- to 6-week lead-times), dynamical real-time forecasts are available from 379 the subx project (http://iridl.ldeo.columbia.edu/sources/."
14,models/.
14,"subx/), with the following 380 contributing models and centers: ncep-cfsv2, ncep-gefs, nasa-geos5, eccc-gem, us 381 navy-esm, ncar-ccsm4, esrl-fim."
14,"for seasonal forecasts, we use the north american 382 multi-model ensemble (nmme)."
14,"hydrologic forecasting module (hfm) 383 the main objective of hfm is to generate reliable reservoir inflow forecasts, the primary input to 384 the optimization module."
14,"for this, we use the deterministic and stochastic precipitation forecasts 385 at daily to seasonal timescales, produced in the cfm as input into a calibrated spatially distributed 386 hydrologic model."
14,the novel contribution in this module is in the use of terrestrial evaporation 387 (et) as a proxy for streamflow (sf).
14,"the selection of et as a proxy for sf is motivated by the 388 findings of several previous studies which show that calibrating hydrologic models with et, in the 389 absence of sf observations, improves the accuracy of sf relative to an uncalibrated model 390 (immerzeel and droogers, 2008; lópez et al., 2017; zink et al., 2018)."
14,"hence, we assume that the 391 high fidelity of the hydrologic model in simulating et implies accurate simulation of streamflow."
14,"392 in addition, we also introduce the role of hydrologic model parameter uncertainty in affecting the 393 reservoir inflow forecasts and hence hydropower production."
14,"for this, we adopt a formal bayesian 394 calibration approach to derive the posterior probability distribution of model parameters."
14,"395 specifically, we utilize the differential evolution adaptive metropolis (dream) markov chain 396 monte carlo scheme (mcmc) scheme (vrugt et al., 2008, 2009)."
14,"397 first, we calibrate the hydrologic model using the dream algorithm to derive the posterior 398 distribution of model errors."
14,"next, we define a limit of acceptability or error threshold to this article is protected by copyright."
14,all rights reserved
15,"17521688, 2021, 5, downloaded from https://onlinelibrary.wiley.com/doi/10.1111/1752-1688.12914 by university of california, wiley online library on [29/04/2024]."
15,"see the terms and conditions (https://onlinelibrary.wiley.com/terms-and-conditions) on wiley online library for rules of use; oa articles are governed by the applicable creative commons license 399 distinguish between behavioral and non-behavioral solutions (beven, 2006)."
15,"‘behavioral’ 400 solutions are model parameter sets, derived from calibration, that result in errors that are within an 401 acceptable limit (error threshold) for a specific model output (et in this study)."
15,we use the model 402 parameter set with the least model error for generating deterministic and stochastic inflow 403 404 author manuscript scenarios.
15,the remaining behavioral model parameter sets then are used to quantify the uncertainty in et and sf forecasts due to uncertainty in model parameters.
15,"a detailed description of the 405 calibration methodology is available in (koppa, gebremichael, and yeh, 2019)."
15,"406 in summary, the following steps are followed in generating the hydrologic forecasts in this module: 407 1) once the hydrologic model is selected (noah-mp), the model is calibrated using satellite-based 408 p and et datasets, 2) the best p and et datasets selected in the eom are used in a bayesian 409 calibration framework (dream) to generate a set of behavioral parameters for the hydrologic 410 model (noah-mp) for the calibration time period (2004), 3) each set of parameters will result in 411 one set of hydrologic forecast (one ensemble member), 4) the set of parameters are used to 412 generate different deterministic and stochastic inputs to the optimization model (described below)."
15,"413 optimization module (om) 414 in the om, we implement a multistage deterministic and stochastic programming with recourse 415 model to optimize hydropower production at the required timescales."
15,"first, we provide a generic 416 example of a multistage stochastic programming with recourse model."
15,"then, we describe the 417 specific hydropower optimization scheme implemented in the dss."
15,we note that the description 418 is provided for seasonal timescales (monthly time step).
15,"however, the same optimization scheme 419 is applicable for the daily (hourly time step) to s2s (daily time step) time scales."
15,420 consider a system of � reservoirs.
15,"let the seasonal hydropower planning horizon be � months, 421 which is divided into � stages (each stage is one month)."
15,"let the monthly time period be 422 t , t  1, 2,........"
15,"in a multistage stochastic programming with recourse model, at the beginning 423 of each time period t , a reservoir inflow scenario with � scenarios is constructed to represent 424 possible future inflows into the reservoir."
15,these scenario trees or fans are used as an input to an 425 optimization model that minimizes or maximizes the expected value of a specified objective 426 function.
15,we adopt a ‘rolling horizon control’ scheme in which the optimal release decisions are 427 adopted only for the immediate stage (�).
15,"then, the planning horizon ( t) is ‘rolled’ forward ( this article is protected by copyright."
15,all rights reserved
16,"17521688, 2021, 5, downloaded from https://onlinelibrary.wiley.com/doi/10.1111/1752-1688.12914 by university of california, wiley online library on [29/04/2024]."
16,"see the terms and conditions (https://onlinelibrary.wiley.com/terms-and-conditions) on wiley online library for rules of use; oa articles are governed by the applicable creative commons license 428 � = � + 1), the reservoir inflows are reforecasted, and the model is re-optimized (recourse)."
16,"the 429 rolling horizon control is a general-purpose control scheme that involves repeatedly solving a 430 constrained optimization problem, as well as using predictions of future inflows, and constraints 431 over a moving time horizon to choose the control action."
16,this process is repeated until the end of 432 author manuscript the planning horizon (� = �).
16,"433 first, the deterministic and ensemble reservoir inflow forecasts generated in the hfm are used to 434 construct the three scenario structures implemented in the dss – 1) det, 2) spwr-d, and 3) 435 spwr-s."
16,"for the construction of the completely deterministic or det scenario, only the 436 deterministic forecasts generated from bma of ensemble precipitation forecasts are used at all 437 stages of the planning horizon (�)."
16,"as all stages are deterministic, the det scenario consists of 438 only one inflow scenario."
16,"for the spwr-d scenario, deterministic forecast (from bma) is used 439 for just the first stage of the planning horizon, and � ensemble forecasts (generated from raw 440 ensemble precipitation forecasts) are used for the remaining � ― 1 stages (figure 1)."
16,"therefore, 441 spwr-d scenario consists of � inflow scenarios."
16,"finally, for the spwr-s scenario, only ensemble 442 forecasts are used at all stages resulting in a completely stochastic scenario, consisting of � 443 scenarios."
16,"note that the det, spwr-d, and spwr-s scenarios are constructed at the beginning 444 of each iteration of the multistage stochastic programming with recourse model, i.e., at each stage 445 � of the planning horizon �."
16,"next, the different scenarios are used as an input to a nonlinear 446 programming (nlp) hydropower optimization model to generate optimal release and storage 447 decisions."
16,we choose nlp because it can accommodate the nonlinear power production functions 448 without approximation.
16,"it has been shown that nlp models are most accurate in generating reliable 449 release and storage policy for reservoir management and operation (barros et al., 2003)."
16,"a detailed 450 description of the optimization methodology is available in koppa, gebremichael, zambon, et al."
16,451 (2019).
16,"452 in summary, the following steps constitute the optimization module: 1) rolling horizon scheme is 453 followed in which the system is optimized at the start of every month for a planning horizon of 8 454 months, 2) a the start of every month, three inflow scenarios (det, spwr-d, and spwr-s) are 455 generated 3) det is generated by combining the bma of precipitation forecasts (cfm) with the 456 noah-mp model run with the best parameter set from hfm for all the 8 months, 4) spwr-d is 457 generated by running the bma forecast through the noah-mp model for the first month, and for this article is protected by copyright."
16,all rights reserved
17,"17521688, 2021, 5, downloaded from https://onlinelibrary.wiley.com/doi/10.1111/1752-1688.12914 by university of california, wiley online library on [29/04/2024]."
17,"see the terms and conditions (https://onlinelibrary.wiley.com/terms-and-conditions) on wiley online library for rules of use; oa articles are governed by the applicable creative commons license 458 the remaining months all the ensemble climate forecasts and parameter sets are used to generate 459 an ensemble of forecasts for the remaining 7 months , 5) spwr-s scenario is generated using 460 ensemble forecasts and model parameters for all the, 6) the system is optimized for the entire 8 461 months, but the decisions are implemented only for the first month, 7) at the start of the next 462 author manuscript month, the entire procedure (step 1 -7) is repeated for the next months."
17,"463 visualization module (vm) 464 because each collaboration has its own region with its own unique geography, hydrology, and 465 decision-making needs, each partnership begins by identifying the relevant datasets, and forecast 466 models, as well as determining the most convenient output formats, including spatial requirements 467 (local catchments, grids or sites) and best data formats for interfacing with the agencies’ current 468 prediction systems."
17,"because of this, the vm is primarily oriented around a customizable web- 469 based decision support tool that integrates many of the outputs from the dss into a gis-based 470 visualization framework to aid decision makers in assessing and downloading the dss data outputs 471 into their particular context."
17,the power behind the vm is the ability to visualize and interrogate 472 the output from the dss through space and time.
17,a time series graph of precipitation estimates for 473 each catchment is integrated into the interactive mapping application for each catchment.
17,the 474 democratization of the forecasts lead to enhanced situational awareness of possible future rainfall 475 events for decision makers.
17,"the web application components are built using open source data 476 formats, programming languages, and, mapping and graphing libraries.the spatial forecast data is 477 stored as a javascript object notation (json) file, which is a standard for storing and exchanging 478 data written in javascript notation, while the time series for each catchment is stored as common 479 seperated values (csv) files. the webapplication is developed using javascript code libraries; 480 the mapping component uses a library called leaflet (leaflet, 2016), while the time series are 481 plotted using the jqplot."
17,"leaflet is one of the most popular mapping javascripts libraries today 482 (donohue et al., 2013) and is used as the mapping engine to glue all map and data services together."
17,483 the data services that are displayed in the vm are spatial and temporal aggregations of 484 precipitation estimates from the eoss and cfms.
17,this aggregation is developed using python 485 scripting and the open-source library called gdal/ogr.
17,the processing steps required for our 486 precipitation product displays are provided in figure 3.
17,487 insert figure 3 this article is protected by copyright.
17,all rights reserved
18,"17521688, 2021, 5, downloaded from https://onlinelibrary.wiley.com/doi/10.1111/1752-1688.12914 by university of california, wiley online library on [29/04/2024]."
