page,p
1,space policy 18 (2002) 57–65 the socioeconomic benefits of earth science and applications research: reducing the risks and costs of natural disasters in the usa ray a.
1,"williamson*, henry r."
1,"hertzfeld, joseph cordes1, john m."
1,"logsdon space policy institute, george washington university, washington, dc 20052, usa abstract a wealth of satellite data has provided information on weather and climate phenomena for the past 40 years."
1,"within this period, however, the heavy human and economic costs of natural disasters have increased considerably."
1,"using hurricanes, droughts, floods and earthquakes which occurred in the usa as examples, this article describes how earth science can be applied to such situations to predict or mitigate their effects."
1,"the economic value of providing such information is discussed, as are the issues that can affect how successful its provision will be. r 2002 published by elsevier science ltd."
1,"since the launch of the us tiros satellite, the earthquakes and volcanic activity."
1,"such research will world’s first weather satellite in 1961, the united states also contribute to the development of methods that and other countries have used satellite data to support enable more informed national, local and personal our understanding of weather and climate."
1,"in general, decisions regarding land use and other mitigative or the us federal investment in earth science research from preventative actions. space, funded primarily through the national aero- this article reports on the first phase of a research nautics and space administration (nasa), the na- project that will explore the potential long-term socio- tional oceanic and atmospheric administration economic benefits of investments in earth science (noaa), and the us geological survey (usgs) has research."
1,"this first phase focuses on relatively short- led to an improved understanding of the critical forcing term, well documented domestic catastrophic events in functions behind changes in weather and climate."
1,earth the united states and its territories.
1,"such a focus has science research has also resulted in a deeper under- enabled us to concentrate on cases for which the standing of the basic characteristics and observable economic and human losses have been identified and phenomena of earthquakes and volcanic activity, as well quantified with greater certainty than in many other as provided insights into the long-term effects of parts of the world."
1,"since only one nation is analyzed, we worldwide changes in land cover and land use.2 have available relatively standardized economic mea- this research has provided the critical foundation for sures."
1,"among other things, this analysis examines the a wide variety of applications."
1,"scientists can reasonably economic effects of gaining information that can assist expect that further investment in earth science satellite in reducing risk and avoiding losses from catastrophic data, modeling, and algorithm development will, among natural events."
1,"future analysis will explore the socio- other things, help to improve the ability to predict future economic benefits of better information about climate weather and climate trends, and the onset of destructive variations."
1,"in addition, future analysis will expand the geographical coverage to examine the potential benefits *corresponding author. of such research to the international community, as well e-mail address: rayw@gwu.edu (r.a."
1,williamson). as to the united states.
1,1 ph.d.
1,"program in public policy, george washington university, washington, dc 20052, usa."
1,2 nasa emphasizes research that employs data acquired from space platforms.
1,"noaa’s research is primarily focused on oceans, weather, 1."
1,"the challenge of natural disasters and climate [http://www.noaa.gov], in the expectation of improving the predictive capability of the national weather service."
1,usgs conducts geological and land cover/land change research [http:// changes in our environment can have profound www.usgs.gov]. effects on our lives.
1,severe storms and earthquakes 0265-9646/02/$ - see front matter r 2002 published by elsevier science ltd.
1,pii: s 0 2 6 5 - 9 6 4 6 ( 0 1 ) 0 0 0 5 7 - 1
2,58 r.a.
2,williamson et al.
2,"/ space policy 18 (2002) 57–65 often lead to sudden, extensive losses of property, hurricane mitch totaled between $720 and $820 business disruptions, and even loss of life."
2,"more gradual million.5 beyond the loss of life and livelihood, these changes of weather and climate, such as drought and countries lost thousands of hectares of coffee and desertification, can be just as destructive over longer banana plantations. periods."
2,the interannual cycles of el nino* and la nina* one of the most severe climatic phenomena on record also lead to extremes of drought and precipitation was the el nino/southern * oscillation (enso) event of (flooding) that stress communities and significantly 1997–1998.
2,"in the span of one year, natural disasters affect their economic activities."
2,"earthquakes and volca- attributed to the arrival of el nino * affected more than nic activity also exact major human and economic costs. 129 million people worldwide: an estimated 22,000 changes in the patterns of where we live and the way people lost their lives, approximately 378,216 were we live also have a profound effect on the environment infected with water-and vector-borne diseases, and some and on the magnitude of losses from natural climato- 4.6 million people were displaced from their homes. logical events."
2,"the dramatic increase in population noaa estimates worldwide economic damage at $36.6 density in coastal areas puts more lives and higher value billion.6 in total, more than 22 million acres of forest property in the path of hurricanes and cyclones."
2,"the and agricultural land were lost to fires, floods, and growth of industrial society has increased the introduc- drought (see footnote 5). tion of potentially harmful chemicals into the atmo- a study conducted by munich reinsurance led to the sphere with possible effects on global temperature and startling revelation that the number of great natural storm patterns. catastrophes7 worldwide increased fourfold from the within the united states and its territories alone, 1950s to the 1990s."
2,"it also indicated that disasters between 1980 and 2001, major weather and climate currently carry a higher price tag than in the past, disasters created losses of more than $248 billion (1998 because the economic losses from natural catastrophes, dollars) and led to the loss of some 690 human lives.3 in after adjusting for inflation, increased by an astonishing that same period, earthquakes and volcanoes cost the factor of fourteen within the same timeframe.8 united states an additional $41 billion and 193 lives."
2,much of the risk to life and property derives from some estimations of the costsfeconomic and otherwi- uncertainties regarding the onset and severity of sefof natural disasters are presented in appendix a. impending destructive events.
2,"reducing the uncertain- natural disasters in other parts of the world have ties surrounding the beginning and progress of severe been even more destructive to human life and national weather conditions such as hurricanes, harsh winter economies."
2,"for example, in 1999, hurricane mitch tore storms, and flooding would allow local officials and through central america, leaving an estimated 11,000 individuals to prepare ahead, reducing economic losses people dead and destroying the infrastructure of whole and human suffering."
2,"thus, better information can be villages and towns."
2,economic losses were staggering. translated into direct economic value.
2,"greater accuracy hurricane mitch cost el salvador close to $1 billion and in predicting future climate patterns, coupled with honduras more than $4 billion in direct property effective planning, would enable farmers, developers, damage."
2,agricultural losses resulted in more than $1 and land managers to mitigate some of the harmful billion additional costs for honduras alone.
2,"effects effects of possible changes, reducing future economic from the 1999 earthquake in central turkey killed losses resulting from such changes."
2,"lengthening the 15,466 people and led to losses of over $25 billion.4 in warning time for the onset of major earthquakes could many of these cases, the affected regions, especially in sharply reduce losses of human life."
2,"in short, the developing countries, are ill prepared to cope with the practical applications of improved predictive capabilities scale and severity of such natural calamities."
2,"not only will, if realized, result in considerable benefit to the us do they cause great human suffering and severely stress and global economy and in fewer lives lost during regional economies, they affect the rest of the world as natural disasters."
2,"nasa’s earth science research well, both in the direct costs of human and economic program is focused in large part on extending the assistance and in the interrupted supplies of goods and services in world trade."
2,"for example, the disaster assistance rendered by canada, europe, and the united 5 http://www.hurricane.info.usaid.gov/ states to all central american countries affected by 6 http://www.usaid.gov/hum response/ofda/98annual/inte.html 7 munich reinsurance defines a natural as great ‘‘if the ability of the 3 these data aggregate only weather and climate events that cost region to help itself is distinctly overtaxed, making interregional or over one billion dollars per event."
2,the sum of events that are less costly international assistance necessary.
2,this is usually the case when would add significant additional costs.
2,"estimates of loss of life do thousands of people are killed, hundreds of thousands are made not count a possible significant toll attributable in part to heat stress homeless, or when a country suffers substantial economic losses, and other causes related to prolonged drought see [1]. [http:// depending on the economic circumstances generally prevailing in that www.ncdc.noaa.gov/ol/reports/billionz.html] country’’. 4 8 http://www.usaid.gov/hum response/ofda/99annual/appendix.html http://www/munichre.com/pdf/topics 2000 a5 e.pdf"
3,williamson et al.
3,/ space policy 18 (2002) 57–65 59 nasa’s earth science program focuses on developing advanced predictive capabilities for : • weather - extending the useful range (~ weeks) of short-term predictions • climate - improving accuracy of near-term (~ months) predictions - developing long-term (~ years) predictions • natural hazards - experimental forecasting of hazard warnings. - experimental forecasting of long- and mid-term predictions for certain events source: nasa fig.
3,focus of nasa’s earth science program. nation’s predictive ability far beyond current capabilities many of its climate research programs nonetheless (fig.
3,1). provide the basic research and tools necessary for estimating the scale of possible future social and improving meteorological predictability.
3,"further, economic benefits from earth science research is subject nasa develops many of the instruments eventually to wide uncertainties."
3,"nevertheless, considerable pro- used by noaa for its environmental satellite programs. gress has been made in recent years in making such in the paragraphs that follow, we examine several estimates, giving policy makers a much richer founda- recent natural disasters, suggesting how improved tion upon which to make decisions regarding the prediction can lead to economic savings."
3,"in each of potential payoffs from investments in earth science the following cases, we also suggest how the data, research than they have had in the past."
3,"in particular, information, and analytical tools could benefit planning, because earth science research can lead to more precise response, recovery and mitigation."
3,"although each predictions about future environmental changes, local, natural disaster requires different information and state, and federal agencies as well as private citizens can analytical tools, there is also considerable overlap."
3,"for benefit from more precise planning and from avoiding example, the information required to respond effectively certain costs."
3,"for example, improved information about to flooding would also apply to many hurricanes, as the timing of floods helps emergency planners to prepare flooding is a major result of hurricanes. to meet the challenge these pose to property and human lives."
3,more precise delineation of the extent of possible 2.1.
3,hurricane floyd (september 1999) flood damage can also assist them in deciding who is most at risk and how best to mitigate that risk.
3,"it also this large, category 2 hurricane struck the atlantic helps people who confront only low risk hazards to coast on 16 september 1999 making landfall in eastern avoid costly preparations they might otherwise be north carolina, where it dropped between 10 and 25 prompted to make in the face of greater uncertainty. inches of rain in only two days."
3,the resultant flooding caused far greater damage than wind or coastal storm surge.
3,"in north carolina, 7000 homes were destroyed, 2."
3,"natural disasters and earth science 17,000 rendered uninhabitable, and 56,000 were da- maged."
3,"some 1500 people had to be rescued from flood as noted earlier, the costs of natural disasters can be waters."
3,"pitt county, nc alone experienced damage very high. costing an estimated $1.6 billion."
3,some 51 people died in these investments in earth science research and storm-related deaths in north carolina.
3,"the outer applications have led to markedly improved weather banks, low-lying barrier islands, suffered serious beach forecasts, both in accuracy and in duration."
3,"estimates of erosion, and 500,000 people went without electrical the severity, scope, and path of hurricanes, which cost power for periods lasting from days to weeks. the us economy billions of dollars a year in damages additional, less damaging flooding occurred in south and recovery, have also improved."
3,"these improved carolina, virginia, maryland, pennsylvania, new york, estimates have allowed local, state, and federal officials new jersey, delaware, rhode island, connecticut, to prepare more effectively for their devastating fury."
3,"massachusetts, new hampshire, and vermont."
3,"in all, nasa has a comprehensive research program [http:// hurricane floyd caused an estimated $6.0 billion www.earth.nasa.gov] that includes the collection of data damage and was directly implicated in 77 deaths.9 from a wide variety of research satellites."
3,"although 9 nasa does not directly support much weather research, http://www.ncdc.noaa.gov/ol/reports/billion/billionpaper.pdf"
4,60 r.a.
4,williamson et al.
4,/ space policy 18 (2002) 57–65 2.1.1.
4,"applications of earth science research to effects in the west, the drought, coupled with frequent high of hurricanes winds, led to the worst wildfire season in 50 years."
4,"the data, information, and analytical tools developed among the most destructive fire was the cerro gordo in earth science research are potentially applicable in all fire around los alamos, new mexico fire, which phases of a hurricane, from initial planning to recovery threatened the los alamos national laboratory and and future mitigation."
4,the following offers examples destroyed 235 nearby homes and other structures.11 from among many of the sorts of assistance these fires throughout the west caused an estimated $2 billion outcomes of earth science can provide: in damage and costs related to fighting fires.
4,"fortu- nately, no lives were lost."
4,* planning.
4,"as a result of r&d over the past 30 years, regions that are prone to hurricane impacts now have a variety of satellite and airborne data and geospatial 2.2.1."
4,"applications of earth science to effects of drought tools to map the region and delineate areas particu- and fires larly prone to impacts, including low-lying barrier here again, the products of earth science research can islands and river drainages."
4,"in this effort, airborne help local communities prepare more effectively to cope lidar is particularly valuable for creating a detailed with drought and the conditions that support wildfires. digital terrain map."
4,"models developed using techni- satellite and airborne sensors developed for scientific ques developed by nasa and the federal emergency research gather data on soil moisture, water reserves, management agency (fema) of the potential extent vegetation biomass, and evaporation rates, enabling an of storm surges in fragile coastal areas can be area-wide survey of drought conditions as they develop. especially important for emergency planners."
4,remote predictive models developed using these and other data sensing analysis of the road networks would enhance can be used to create forecasts of future precipitation the ability of emergency vehicles to reach people in rates and magnitudes.
4,extrapolation of these models to the response phase.
4,"such advanced planning may not soil moisture and evaporation rates allows emergency only save lives, but also reduce the costs of emergency response teams to plan for potential future fires. evacuation during the hurricane."
4,* response.
4,satellite and airborne-derived maps are 2.3.
4,"flooding in the northern plains, april, may 1997 especially important for assessing the extent and severity of damage following a hurricane and during april and may of 1997, unusually warm planning the most effective response, including temperatures led to an early heavy snowmelt, creating transportation lifelines. severe flooding along several rivers in north and south * recovery and mitigation."
4,during the recovery period dakota and minnesota.
4,"grand forks, north dakota and later, the experiences with the hurricane will was particularly hard hit by the flood, leading to indicate areas that are especially vulnerable to wind evacuation of much of the downtown, lost crops, and and rain damage."
4,one of the most important efforts damaged or destroyed homes and businesses.
4,"the during this period is to attempt to improve planning overall economic toll in direct damage, lost business to avoid future damage."
4,"modeling using earth income, and cleanup costs reached about $3.7 billion. science data and modeling tools can help local, state, eleven people lost their lives to the flooding.12 and federal policy makers develop more effective building codes or indicate areas where development would create potential high risks of loss."
4,2.3.1.
4,applications of earth science to the effects 2.2.
4,"drought, western us fires: spring and summer 2000 of floods with better information, the rate and extent of the drought of 2000 began in the early spring, when flooding can be predicted with considerable accuracy, the customary spring rains did not materialize in many allowing communities to prepare for the high water."
4,the areas.
4,"by the end of august, after months of dry data products from earth science research allow the weather and unusually hot temperatures, some 35% of creation of detailed topographic maps, land cover the country had experienced severe to extreme drought. characterization, the extent and depth of snow cover, the drought was most severe in the west and snow melt rates, and the amount and rate of precipita- southwest, but it had a major impact on the southeast tion."
4,the analytical tools and modeling capabilities united states as well.
4,"the drought caused about $4 billion in damage and associated costs and contributed 11 although the los alamos wildfire began with an intentional, to an estimated 140 deaths, nationwide.10 scheduled burn that raged out of control, the conditions that led to the extensive destruction are characteristic of natural wildfires. 10 12 http://www.ncdc.noaa.gov/ol/climate/research/2000/sum/ http://www.ncdc.noaa.gov/ol/reports/dakotaflood/dakeota- us drought.html flood.html"
5,williamson et al.
5,"/ space policy 18 (2002) 57–65 61 allow the development of hydrologic models, predicting yields and prices."
5,"in economic terms, this can translate the direction and speed of storms, and the dynamic into more predictable crop prices by reducing fluctua- modeling of floods as they develop. tions in the futures market, and help farmers, food producers, and food processors (among others) plan 2.4."
5,"northridge, ca earthquake: 17 january 1994 their business operations more efficiently."
5,"the carib- bean island of guadeloupe is attempting to supply more the earthquake that struck northridge in 1994 of its power through utilizing its abundant wind, solar measured 6.7 on the richter scale, causing extensive and water resources."
5,"because fluctuating wind and cloud damage over an area of some 2192 square miles in los cover reduces the contribution that wind and solar angeles, ventura, and orange counties."
5,"nearly 12,000 generation can make to the island’s total needs, detailed people required hospital treatment, and 72 lost their local forecasting would assist the island in managing lives."
5,"the damage reached about $25 billion, with those resources more effectively, thus boosting potential additional losses from reduced productivity and lost power generation [3]. business."
5,the federal government alone spent $12.5 billion on response and recovery.13 3.2.
5,information as a commodity information can be a commodity bought and sold on 2.4.1.
5,application of earth science to the effects the market.
5,"although the government produces free of earthquakes weather forecasts as a public good, private companies although the science of earthquake prediction is in its also make a profit developing and selling detailed, infancy compared with the ability to predict the tracks enhanced forecasts to a variety of industries."
5,"for and destructive damage of hurricanes, making prepara- example, to the energy generation industry, improving tion for a specific earthquake impossible at the present the predictive ability of forecasts by an average of only time, there is nevertheless much that can be done to one degree can result in more efficient use of power prepare for a cost-effective response to a possible future generating resources and save hundreds of thousands of destructive earthquake [2]."
5,most regions prone to dollars each year for electric utilities [4].
5,many utilities earthquakes are well known.
5,"preparation derived from employ their own forecasters at a high annual cost earth science research includes the development of because of these potential large savings. accurate topographic maps, including land cover types, urban features, and transportation lifelines."
5,modeling of 3.3.
5,information as knowledge alternate transportation routing assists in the recovery from the damaging effects of earthquakes.
5,"in addition, information also provides the backbone of human techniques developed to further solid earth science can knowledge."
5,"libraries, computer databases, data ar- be used to follow possible local surface deformations chives, textbooks, etc. all are storehouses of information and fault movement, which may indicate areas of and have economic value. particular surface stress."
5,it is possible to develop many specific examples in each of these categories that apply to information derived from the data and analytic tools developed 3.
5,the economic value of better information through earth science research.
5,"however, information has no value unless it is made available to potential users providing better information about the onset and and then put to use, whether for economic gain, consequence of natural disasters can provide tangible education, entertainment, or to further scientific re- economic benefits to governments, individuals, and search."
5,"hence, an important part of the task of businesses."
5,these benefits come about in several making the results of earth science research useful is different ways. to develop and disseminate specific applications in each category.
5,"reducing uncertainty after information is disseminated, it is quite easily transmitted and copied."
5,"for public good applications, more accurate, precise information can be used to such as responding to natural disasters, this capability reduce uncertainty about future events."
5,"for example, is a marked benefit to society."
5,"however, the more accurate predictions about future weather and market value of information is immediately diminished climate enable farmers and agribusinesses to estimate after it is released unless the originator can acquire some future crop yields, leading to reduced uncertainty about method of retaining control, such as copyright or licensing."
5,"in general, therefore, information is not a single 13 http://www/fema/gov/nr/nr 0106.htm commodity whose worth can be easily evaluated."
6,62 r.a.
6,williamson et al.
6,"/ space policy 18 (2002) 57–65 reducing evacuation costs from a hurricane each time a hurricane threatens to strike the east coast of southern florida, emergency management officials in broward county, which lies north of the city of miami, have the difficult task of evacuating residents who may be in the hurricane’s path."
6,"because the highest natural elevation in the county is about 21 feet, the county is highly subject to storm surge, which can flood densely populated low-lying areas along the coast."
6,the reach of storm surge is highly dependent both on distance from the shoreline and on elevation.
