page,p
6,"emergency management officials reasoned that if they could create a more accurate topographic model than they had previously possessed, they might be able to reduce the number of people it was necessary to evacuate prior to a hurricane actually coming ashore in the county from the 425,000 previously estimated."
6,"not only would a reduction in the number of evacuees reduce the stress on the population, it would save the county government and citizens significant costs."
6,certain facilities are particularly expensive to evacuate.
6,"for example, the county is home to a dozen hospitals, each one of which could cost up to $100,000 to evacuate in advance of a storm, not to mention the indefinable costs of mental and physical stress experienced by patients and their families."
6,broward county officials contracted with florida international university to develop a very accurate digital elevation model of the county based on elevation data acquired using an airborne laser sensor.
6,"the laser data were used to create a grid of elevation values every 2 meters, covering the urban area."
6,"the resulting model, when evaluated by a storm surge model for a category 4-5 storm, enabled broward county to reduce the number of potential evacuees from about 450,000 to approximately 250,000."
6,both estimates include residents of mobile homes.
6,this has resulted in a significant reduction of future costs to the county and its citizens.
6,"in the future, broward county will extend and improve the storm surge analysis by incorporating off shore bathymetry data it has recently acquired."
6,"the bathymetry data were also acquired by an airborne laser instrument, which is capable of measuring water depths of up to 50 meters."
6,"on the coast east of broward county, this amounts to a distance from the coast of about 2.7 kilometers, or 9,000 ft."
6,floridan case study of reducing hurricane evacuation costs.
6,source: broward county office of emergency management. type of information is unique and often even the value is the economic benefits of improved forecasts of hurri- dependent on who receives the information and when as canes. well as what actions are taken as a result of having the information on a timely basis.
6,direct damage from hurricanes while current forecasting capabilities have done much 4.
6,"an illustration: benefits of improved weather prediction to provide communities with advance warning of the onset of hurricanes, direct damage from major hurri- some of the ways in which improved information canes continues to be substantial."
6,"although much of this about natural hazards can produce economic savings damage, such as destruction of structures, may not can be illustrated by the case of weather forecasts."
6,"more preventable, even if the landfall of hurricanes could be accurate information about adverse weather provides predicted with greater accuracy earlier in the hurricane’s economic benefits in two ways."
6,"first, better in- advance, it is nevertheless believed that roughly 15–20% formation makes it possible for people and businesses of the damage from hurricanes can be prevented, given to undertake loss-reduction activities that should be sufficient advance warning."
6,"providing the capability to undertaken, but which are not when the available predict the path and intensity of hurricanes earlier in the information is of poor quality."
6,"another, perhaps less course of the storm and with greater precision would well-recognized benefit of better information is that it lower the cost of taking preventive actions, thereby can also reduce economic costs that arise when increasing the range of preventive actions that would uncertainty about adverse weather causes government probably need to be undertaken. authorities, people, and business to ‘‘err on the side of caution’’ and undertake loss-reduction activities when 4.2."
6,loss of life and limb they are not necessary.
6,"for example, the kinds of cost savings that can be hurricanes also exact a toll in lives lost."
6,"it is difficult realized from better predictive ability are illustrated by to know how many additional lives, if any, would be"
7,williamson et al.
7,/ space policy 18 (2002) 57–65 63 saved by the increase in forecast accuracy indicated advance to modify economic activities that might give above.
7,"it is harder still, and somewhat controversial, to rise to such warming. attach an economic value to any lives that could be the possibility of climate change poses a challenge to saved."
7,"nonetheless, the potential for reducing losses of policy makers because there are potential costs to action life and limb should be counted qualitatively, if not as well as inaction."
7,"on the one hand, steps can be quantitatively, as an economic benefit of improvements undertaken to reduce emissions that are the potential in the ability to forecast the severity and direction of cause of climate change."
7,but taking these steps will hurricanes. be costly.
7,"for example, several different analyses imply that the economic costs of simply stabilizing the 4.2.1."
7,"reduced damage prevention costs level of co2 emissions at 1990 levels would be on many of the costs of hurricanes and other natural the order of one-half of one percent of gross domestic disasters derive from the costs of preparation and product, or roughly $3 billion, while the costs of damage prevention."
7,"in many cases, better informa- reducing co2 emissions by 20% from current tion can also reduce these costs."
7,"for example, levels would be roughly twice as large."
7,"for this reason, reducing the number of people that must be evacuated there is understandable caution in embracing such prior to a hurricane landfall would substantially reduce measures [7]. the costs to cities and counties, as well as residents on the other hand, if steps are not undertaken to (fig."
7,"2). reduce worldwide emissions of co2 and other gases, and significant global warming does take place, measures may need to be taken quickly to stabilize and reduce 4.3."
7,reduced overwarning these emissions.
7,"the short-term costs of the behavioral changes that would be required to achieve such based on current forecasting capabilities, the na- adjustments could be much higher than if such changes tional hurricane center issues warnings to areas that had been encouraged sooner and took place over a are likely (though not certain) to be struck by longer period of time. hurricanes."
7,"emergency preparedness officials have in each case, better information about future climate estimated that the costs of evacuating people from the would be of economic value to policy makers because it path of a possible hurricane landfall is roughly $1 would reduce the present range of uncertainty about the million per coastal mile [5]."
7,because of current scope and pace of possible climate change.
7,"lowering the uncertainties about the precise direction and onset of level of uncertainty would reduce the likelihood of hurricanes, a typical landfall warning area is about 400 taking steps to reduce global warming that later miles in length, even though the coastal area that is prove unnecessary because the risk of significant global ultimately affected by an average hurricane once it hits warming fails to materialize."
7,it would also reduce land is only 100 miles.
7,if predictions 24 h in advance of the likelihood of failing to act in the face of a real the storm could be improved to the point that only 300 threat.
7,"in short, information about the process of miles of coastline need to be evacuated, the costs of climate change could help lower the economic costs undertaking preventive actions that ultimately prove to associated with both unwarranted action and inaction in be unnecessary are on the order of $100 million ($1 the face of possible, though uncertain global climate million/mile x 100 miles) for a typical hurricane. change."
7,"alternative transportation routing, derived in part from models using remotely sensed data, could potentially lower evacuation costs still further [6]."
7,issues in realizing the economic benefits of better information 5.
7,"the benefits of improved information although better information about natural hazards on climate change has the potential to yield tangible economic benefits, the gain from better information depends not only on the although its precise order of magnitude cannot be quality of the information, but also on how it is used quantified, reducing uncertainty about the scope and and disseminated."
7,"for example, improved information pace of possible future climate change will provide real about the location of a floodplain, or earthquake fault benefits."
7,several studies have shown that the potential line will have a greater potential to mitigate future losses economic costs caused by significant global warming if the information is made available in a way that plus the costs of adapting existing economic activities to encourages private individuals and businesses to act on mitigate its effects would be substantial.
7,these studies the information.
7,"in some cases, regulatory actions by also show that the costs of future global warming can be federal, state, or local authoritiesffor example in the reduced significantly if steps are taken soon enough in form of building codes, or evacuation planningfmay"
8,64 r.a.
8,williamson et al.
8,"/ space policy 18 (2002) 57–65 be needed to fully capture the cost savings from reduced along vulnerable coastal areas and floodplains, some- uncertainty about natural hazards. times with financial and other incentives from federal, there are also certain limitations to the value state and local governments."
8,"further, communities and of information derived from improved scientific individuals continue to drain wetlands that would information affecting predictions of future catastrophic ameliorate flooding and build river levies that force events.14 water to move downstream, contributing to downstream it is inevitable that natural disasters will occur each flooding."
8,"federal and state policies to suppress small year around the world and that lives will be lost and wild fires in forests lead to increased risk of large property damaged, regardless of prior human interven- wildfires [8]. tion."
8,"it is clear that better scientific data has the although significant strides have been made in potential to reduce the economic damage from natural providing information about natural hazards, major disasters."
8,what is not clear is the percentage of the total uncertainties about natural hazards and climate remain; losses that can be reduced with better information.
8,"in there seems to be clear scientific scope for narrowing other words, if economic losses are increasing over time, these uncertainties further by additional investments in can the predictive capabilities be used to reduce the earth science."
8,"it is clear that further improving growth of this trend, even if the absolute economic predictions of the onset and progress of natural disasters values continue to increase?"
8,"would lead to significant economic savings to a wide moreover, as noted above, better predictions of variety of individuals and institutions."
8,"however, there climatic changes are relatively useless without some remains a large gap between the scientific knowledge additional action(s) being taken by individuals and about components of the earth’s systems and the ability government agencies."
8,the timing of these actions is of applied users to put this knowledge to work in crucial to the type and magnitude of the impact. reducing the costs of natural disasters.
8,"hence additional further, the type of information also has to be matched efforts need to be made to improve the transition from to the type of disaster being evaluated. research to applied use of data and information about finally, the level of spending on government agency natural disasters. plans for mitigating losses from disasters may not be well correlated with the actual losses incurred from any given disaster."
8,these limitations all feed into the acknowledgements difficulty surrounding the development of accurate estimates of the value of specific data and information this article benefited greatly from the research sets. provided by research assistants tina soulema and nadia afrin.
8,"glen margoles of the broward county, florida emergency management department and 7."
8,summary and conclusions roger pielke of the university of colorado also provided much useful information.
8,research for this past improvements in earth observation capability article was supported by nasa grant no.
8,"nag5- have yielded better information about the onset, 10539. location, and impact of natural disasters and hazards."
8,"armed with this information, both government and private parties have been able take measures to reduce appendix a the costs of living in a sometimes unfriendly natural environment."
8,"table a1 presents evidence of the high levels of nonetheless, despite the increased ability of scientists damage from various types of disasters."
8,"each year, to predict the occurrence and scope of natural disasters, economic losses are in the billions of dollars and a variety of human activities continues to increase the hundreds of lives are lost in the united states alone. costs of natural disasters when they do occur."
8,"us and, in recent years, the value of losses from disasters population density and value of infrastructure, espe- appears to be increasing rapidly for a number of cially along the coasts, has increased over the past two reasons."
8,"in part, losses have increased because many decades."
8,"people continue to build homes and businesses governmental responses to economic incentives and human behavior run counter to the efforts to mitigate 14 improved information provides social, as well as economic, potential future losses from disasters."
8,some of these benefits.
8,the impact on the economy is measurable through the price system and through the estimated value of property and lives lost or incentives include: saved.
8,"however, since the social benefits tend to be much more difficult to quantify, this report focuses on those impacts that can be translated * population growth and migration to coastal areas into monetary terms and will discuss social benefits in qualitative * increases in the value of at-risk property from terms. increased demand"
9,williamson et al.
9,"/ space policy 18 (2002) 57–65 65 table a1 a summary and comparison of the effects of droughts, floods and hurricanes in the usa type of natural disaster economic costs deaths notes droughts in 1995, the federal emergency drought in the united states seldom each year, some part of the us has management agency reported that results directly in the loss of life. severe or extreme drought."
9,"droughts $6–8 billion is lost due to droughts every deaths associated with drought are can last for months, years or decades. year."
9,"the national climatic data usually related to a heat wave or, in sometimes droughts are predicted center estimated the cost of the 1988 developing countries, a disruption in up to a year ahead of time, but often drought to be around $40 billion. food supply leading to malnutrition there is no warning. and, possibly, famine."
9,"the national climatic data center estimates heat-related deaths between 5000 and 10,000 for 1980 and 1988 floods the annual average for the costs and floods have caused an average in the usa, a stream typically losses from floods in the usa was of 94 deaths per year in fiscal years overflows 2 out of 3 years. calculated to be $2.41 billion."
9,all 1986–95.
9,"the 1993 mississippi a flood may last from hours to sources agree that 1993 was the worst valley floods, which is one of the weeks and the warning time varies recent flooding year in terms of costs. worst in recent history, claimed from seconds to months."
9,there are wide discrepancies 48 lives.
9,puerto rico also had on the actual costs and the estimate a flash flood in 1985 that ranges from $15 to 27.6 billion. killed 180 people.
9,"hurricane on average hurricanes lead to annual data presented by the typically, the usa is hit by 1.6 losses of $1.2–4.8 billion."
9,hurricane environmental & societal impact hurricanes/year and a class 4 or 5 andrew (1992) is the most costly group indicated an average of hurricane strikes every 5.75 years. recent hurricane event to affect the 162 hurricane-related hurricanes may last from minutes united states and according to the deaths per year.
9,"however, if the to weeks and the warning time ncdc reports, it cost about value of 6000+ deaths from the typically ranges from 3 days $30.475 billion (on the us mainland) galveston hurricane of 1900 is to months. when adjusted to 1996 dollars. omitted, the yearly average falls to about 100 deaths per year."
9,"the worst hurricane in recent history, hurricane hugo in 1989, caused 49–86 deaths."
9,the information presented in table 1 are crude estimates obtained from the national drought mitigation center (source: http://enso.unl.edu/ndmc/ enigma/compare/htm).
9,the format of the original table was changed to suit the needs of the project.
9,"it is difficult to draw a meaningful comparison between the socioeconomic costs of droughts, hurricanes and floods since they vary widely in terms of frequency, duration and impact area."
9,"the statistics were compiled by ndmc from a variety of sources and although there are some discrepancies in them, they are generally similar."
9,"* federal flood insurance programs references * poor management of river basins and flood plains [1] ross t, lott n."
9,a climatology of recent extreme weather and * use of chemicals and fuels that produce pollution climate events.
9,"national climate data center technical report 2000–02, october, 2000. and possibly contribute to global warming."
9,[2] nigg jm.
9,"predicting earthquakes: science, pseudoscience, and public policy paradox, prediction, science, policy making, and the the table points up the large potential payoffs future of nature."
9,"washington, dc: island press, 2000. p."
9,135–156. from developing better predictive capability.
9,for [3] isabelle bresson le figaro.
9,"july 7, 2001, p."
9,"9. illustration, in the united states if hurricane predic- [4] del jone, forecast: 1 degree is worth $1b in power savings."
9,"usa tions can be improved sufficiently (and planners and today, june 19, 2001, money. citizens are prepared to act appropriately) to result [5] pielke jr ra."
9,"floyd, the fire drill, weatherzine, no."
9,"18, october, in a 10% reduction in the loss of life, then, using us 1999. [http://www.esig.ucar.edu/socasp/zine/18/editorial.html]."
9,"[6] church rl, cova tj."
9,"mapping evacuation risk on transportation data, we could expect in the average year that about 15 networks using a spatial optimization model."
9,transportation lives would be saved.
9,"if we could, at the same research part c: emerging technologies 2000;8(16):321–36. time, reduce damage and preparation costs by 10%, [7] gaskins jr dw, weyant jp."
9,"may 1993: model comparisons of the then approximately $300 million would be saved in costs of reducing co2 emissions, american economic review. one year from hurricanes alone."
9,the actual potential william b.
9,"nordhaus, may 1993: optimal greenhouse-gas reductions and tax policy in the ‘‘dice’’ model, american for cost reductions will depend on many factors, economic review; and john reilly and neil hohmann, may 1993: including the complex relationship between re- climate change and agriculture: the role of international trade, search, the development of relevant applications, and american economic review, 1993. their use by citizens and by local, state, and federal [8] grunwald m."
9,"disasters all, but not as natural as you think."
9,"washington post, may 6, 2001, p."
9,b-1. officials.
