page,p
10,precision agriculture (2023) 24:1380–1400 1389 table 3 fit and validation parameters of the theoretical semivariograms of soil properties and maize yield attribute nugget ­(c0) partial sill (­ c1) range (a) sdd1 cross validation % r2 rmse yield (ton.ha−1) 0.6988 0.7507 903.46 48.21 m 0.3339 0.9549 ec3(0–30 cm) (ms.m−1) 12.4094 9.5265 792.48 56.57 m 0.1398 3.9855 ec(0–90 cm) (ms.m−1) 0.0003 0.0005 748.32 35.44 m 0.3541 0.0202 ca2+ (mmolc.dm−3) 1.8708 0 343.65 100 w 0.0358 1.4097 mg2+ (mmolc.dm−3) 0.0380 0.0328 314.04 53.66 m 0.1492 0.2592 k+ (mmolc.dm−3) 0.0196 0.0128 561.79 60.40 m 0.1721 0.1580 sb4 (mmolc.dm−3) 2.8076 0.1232 346.48 95.80 w 0.0698 1.7274 al3+ (mmolc.dm−3) 0.1480 0.0000 500.92 100 w 0.0384 0.3966 h + al (mmolc.dm−3) 1.2917 0.1300 324.50 90.86 w 0.1828 1.2510 cec75 (mmolc.dm−3) 0 1.3400 391.78 – – − 0.0722 1.1685 bs6 (%) 164.9932 0 346.48 100 w 0.0090 14.2449 m7 (%) 102.0617 0 500.92 100 w 0.0473 10.0874 c8 (g.kg−1) 2.6452 2.2385 273.21 54.16 m 0.3457 2.1009 om9 (g.kg−1) 7.8759 6.6432 273.21 54.24 m 0.3455 3.6231 ph(cacl2) 0.1171 0.0060 324.50 95.12 w 0.1447 0.3530 1 spatial dependence degree coefficients for ­k+ and om.
10,"the highest positive coefficients were observed for bs (0.64) and ph (0.63), in agreement with rodrigues et al."
10,(2012).
10,sun et al. (2003) observed that the spatio-temporal variation of soil attributes (mainly those related to fertility) is one of the factors of greatest influence in soil quality and consequently plant development.
10,"the soil attribute that most affected productivity was the ­al3+ content, the exchangeable alu- minum in the soil increased with the reduction of ph."
10,the association between an increase in ­al3+ and a reduction in ph reduced corn yield.
10,according to abreu et al.
10,"(2003) ­al3+ is toxic to plants, causing a reduction in growth and consequently a reduction in productivity."
10,geostatistical analysis of soils the spatial analyses of soil attributes were performed with field sampled data and geosta- tistical analysis.
10,"the fitted and validated parameters of theoretical semivariograms indi- cated that, in most cases, models adjusted for soil attributes were stable (table 3). ­"
10,"ca2+, ­al3+, bs and a ­ l3+ saturation presented a pure nugget effect."
10,"this result indicates randomly distribution and spatially independent attributes, or a poor sampling scheme with low point density."
10,"high nugget values result in limited prediction capacity and they must be carefully considered in subsequent analyses (webster & oliver, 2008)."
10,"on the other hand, yield, ec in depth and c ­ ec7 had a nugget effect smaller than partial sill."
10,"yield and both electrical conductivity measurements had high range values, corresponding to 903, 792 and 748 m, respectively."
10,these results indicated that sampled variables remained correlated over long distances.
10,"the indexes related to geostatistical model’s performance presented moderated or unsat- isfactory results, depending on the variable (table 3). ­"
10,r2 and rmse indicated that models were unable to explain soil data variability in the study area.
10,according to cambardella 13
11,1390 precision agriculture (2023) 24:1380–1400 fig.
11,"3 yield map with representative points location (a), the yield grows from point 1 to 5 (ton/ha)."
11,"spectral signatures, from landsat satellite images, in 5 representative locations (b–g), as well as the respective infra- red color composite (rgb 543) and ndvi at different dates, representing the different maturity phases."
11,"the rgb 543 was used to was used to highlight the vegetation in the area et al. (1994), the degree of spatial dependence (dsd) was weak for sb, h + al and ph and moderate to the others."
11,"a factor influencing dsd may be the anthropic activities, which resulted in lower performance of interpolators (do amaral and justina, 2019)."
11,"corn yield assessment by remote sensing evaluating the field spectral performance on may 18th (punctual evaluation), it was observed that all representative points had the same spectral pattern (fig. 3a,b)."
11,"reflectance increased from visible to infrared bands, with higher values observed in band 6 (swir-1)."
11,demattê et al. (2005) found similar patterns for a typic oxisol in southeastern brazil.
11,the authors indicated low reflectance in the visible range (lower than 0.1) and higher values (up to 0.25) at infrared wavelengths.
11,"according to daughtry (2000), discriminating soil and crop residue may be a challenging task, especially when working with multispectral sensors."
11,"in this case, it is highly recommended to use a high spectral equipment associ- ated with high spectral resolution, i.e., hyperspectral sensors."
11,the composite image (spatial evaluation) was predominantly blue (fig. 3) and most likely corresponded to a mixture of crop residue and bare soil.
11,"this was already expected, once those plants were still in early germination stages and could not be detected by a 30 m resolution image."
11,pink color 13
12,precision agriculture (2023) 24:1380–1400 1391 patterns in the image were related to emerging seedlings or weed.
12,the ndvi map had the same spatial distribution of the rgb composition (fig. 3b).
12,"the index remained below 0.4 in eastern side of the image, indicating the presence of crop residue (demattê et al., 2018)."
12,"at the northwestern side, values are below 0.23 reinforcing the predominance of a mix- ture between bare soil and crop residue."
12,"the subsequente image corresponded to june 9th, which represented corn at v6 stage (fig. 3c)."
12,"spectral patterns at the reference points was typical of vegetation, with low reflectance at the visible spectrum (specially at blue and red), higher values observed at nir band and a downward trend towards swir bands."
12,"this is confirmed by the composite image, which had predominant pink coloring and purple- colored spots."
12,"the composite and ndvi had a heterogeneous spatial pattern, with vegeta- tions index reaching values of 0.91."
12,"plant development is higher at the northeast portion of the site, where it is possible to notice the dark purple (r5g4b3) or green (ndvi) spots."
12,"such spatial patterns are observed during the whole season and indicate better soil condi- tions and higher yield (fig. 3a,c)."
12,"satellite image from july 5th corresponded to the crop at v8 stage, when plants were at maximum vegetative growth and photosynthetic activity (fig. 3d)."
12,"plant spectral sig- nature was similar to the previous date, except for a higher reflectance in nir (band 5) at the points 4 and 5."
12,"according to taiz et al. (2017), healthier plants reflect more energy in the near-infrared region (taiz et al., 2017)."
12,"this fact was in agreement with our yield maps, which indicated higher values exactly at points 4 and 5 (fig. 3a)."
12,the composite image only differs from the previous date by the contrasting and more intense red tones observed at northeast of the site.
12,such pattern is observed at later dates and persisted until the har- vesting (after august 06th).
12,"ndvi maps followed the same spatial pattern, with higher values at points 4 and 5."
12,these findings corroborate to the fact that vegetations indexes are directly related to plant health and indicate that this data was a relevant variable for corn yield monitoring.
12,"results from july 21st were quite similar to the previous date, with minor differences in bands 6 and 7, especially when comparing spectra from higher productivity locations with the other ones (fig. 3a,e)."
12,"the swir region is influenced by leaf water content and minor variations might result in expressive changes in swir, which is explained by the logarith- mic relationship indicated by ceccato et al."
12,(2001).
12,"as previously described, productiv- ity was significantly correlated to aluminum content and saturation (fig. 2), which has direct influence on plant roots development."
12,"plants with lower productivity were limited by aluminum toxicity and due to the less developed root system, so they were not capable to explore all the available soil moisture content, especially during dry season."
12,"as a result, plants located at the points 1,2 and 3 had less water accumulated in leaf tissue and pre- sented a distinct spectral pattern in bands 6 and 7 (fig. 3e) during july 21st and august 6th (fig. 3e,f)."
12,"the image composite, ndvi and corn spectra were significantly different on august 06th (fig. 3f)."
12,composite image reached a dark opaque red and ndvi had an overall decrease to less than 0.57.
12,"spectra had a decrease in nir reflectance and an increase in red, swir 1 and 2 bands."
12,these changes are explained by the crop phenological stage.
12,the reproductive period has ended and the crop changes to the maturation stage.
12,"at this condi- tion, leaf loses photosynthetic efficiency due to the decrease in tissues pigments and nutri- ents, becoming chlorotic and dry (pinter et al., 2003)."
12,"in addition, leaf cells degrade which explains the reduction of the nir reflection (knipling, 1970)."
12,"the temporal variation of ndvi during the corn cycle has the same pattern of other calculated indexes, including evi, nbr2 and savi (fig."
12,"indexes increase in the first month due to vegetative growth, after that they stabilize and finally decrease in the last 13"
13,1392 precision agriculture (2023) 24:1380–1400 fig.
13,4 temporal variability of vegetation indexes during the period from may to august 2014.
13,the box- plot and the bar graph were created with all the pixels of the satellite images in the study site.
13,the boxplot represents the variation of the data for each vegetation index.
13,"and the bar graph represents the correlation between the vegetation index and the maize yield month, due to corn maturation (pinter et al., 2003)."
13,"differences in the monthly averages of all vegetation indexes (fig. 4) indicates a better discrimination between bare soil/crop residue and vegetation by the evi, with values ranging from 0.5 (in season beginning and end) to 2.5 (during corn vegetative stages)."
13,"evi is able to attenuate soil and atmos- phere effects on the image, being more sensitive to areas with high biomass and there- fore responding better to phenological changes than other indexes (alvino et al., 2020; justice et al., 1998)."
13,"savi also had great variability, especially between vegetative stages (fig."
13,"the index reached values greater than 1 during june and july, remaining above 0.5 until the end of the harvest."
13,nbr2 is commonly used for fire monitoring and few studies evaluated its use in crop monitoring.
13,"the index calculation relies on nir and swir bands, which are strongly related to water content in plant tissue."
13,"once it is influenced by plant water, nbr2 is an interesting option when evaluating crop water stress."
13,"in our study, it presented the low- est values throughout the harvest, staying below 0.5 during the whole evaluated period."
13,"although nbr2 did not present great variations in the average monthly values, the index had the higher correlations with corn yield (0.75; fig."
13,"these correlations are calculated from all matching pixels for each date, which means that higher correlations also indicate a better spatial agreement between the vegetation index and yield maps."
13,"as mentioned before, one of the limiting factors in the site was aluminum toxicity and the poor development of the corn root system."
13,"therefore, the limited capacity of plants to access soil moisture could explain why nbr2 (an index directly related to plant water content) had the best capacity to describe crop productivity."
14,"precision agriculture (2023) 24:1380–1400 1393 just as nbr2, the evi, ndvi and savi had positive correlations with productiv- ity (fig."
14,"the coefficient increased with vegetative development, reaching higher values on july 05th and 21st (0.72 to 0.75)."
14,"these dates corresponded to v8/v9 stages and are in agreement with vian et al. (2018), which also had the highest correlations with yield in such stages."
14,"according to these authors, vegetation indexes retrieved from v5 to v8 provide the best results for site-specific management."
14,"in fact, this is the reason why was selected july 05th indexes to compose the rs-1 and rs-1-ec datasets in management zones design."
14,"different from the other indexes, tvdi had negative correlation with corn yield, i.e., the higher the index, the lower the productivity (fig."
14,"tvdi ranged from 0.22 to 0.83 in the harvest, being lower on july 21st and higher on may 18th and august 22nd."
14,higher correlation was observed on august 6 (-0.58).
14,"this trend of higher humidity in the final dates associated with higher yields for this area has been previously revealed by the swir 1 and 2 bands and can be veri- fied again, since these epochs correspond to the pods and grains formation and filling."
14,the optical and thermal properties measured by remote sensing were compared to corn yield by establishing an evaporative triangle and performing a graphical evaluation between tvdi and ndvi.
14,"in this case, soil–plant interactions and their impact on corn yield were better evaluated (fig."
14,"lower ndvi values were observed on the left side of the graph (fig. 5a), indicating the presence of bare soil, crop residue and very stressed or senescent plants."
14,"different water availability is represented in the y-axis, where wet conditions are located in the upper-side of the triangle, while dry conditions remain in the lower-side."
14,"in gen- eral, the increase on ndvi is followed by a decrease in tvdi."
14,"according to schirmbeck et al, (2017), the ndvi is an indicative of vegetation exuberance."
14,"high ndvi values refer to vigor- ous plants, while low values are associated with stressed plants."
14,field regions with stressed plants have higher temperatures and higher values of tvdi are also observed.
14,these changes in the indices are noticeable throughout the harvest (fig. 5a).
14,"on may 18th and august 22nd, the highest tvdi (around 0.8) and lower ndvi (0.2–0.3) were observed due to absent or very low biomass, which increased the surface temperature."
14,"as the corn grows and biomass increases, plants partially cover the soil (ndvi > 0.5), evapotranspiration increases, while sur- face temperature and tvdi decrease (< 0.5) (fig."
14,"the largest tvdis belonged to the regions with the lowest productivity (fig. 5b), although these points reached high ndvi (up to 0.85, in the case of july 5th)."
14,this indicates that tvdi could be more sensitive to changes in vegetation than ndvi.
14,"besides that, the most productive areas had lower dryness index."
14,"the relationship between productivity and the dryness index has already been used to estimate yield and had a better performance than ndvi (holzman & rivas, 2016; holzman et al., 2018)."
14,"in our study, tvdi was not the best index to describe corn yield."
14,"this can be related to the lower spatial resolution of thermal bands (100 m), while optical bands are represented by 30 m pixel."
14,another important aspect influencing tvdi is the difficulty to establish the dry and wet edges from graphical analyses.
14,"errors in this step are common and the parameters can under or overestimate the tvdi values (sandholt et al., 2002)."
14,"to reduce this uncertainty, some automatic models are proposed, such as the one elab- orated by chen et al."
14,(2020).
14,although sandholt et al. (2002) recognize the difficulty involved in the process and the need for several observations to properly determine the isolines.
14,"relation between soil management zones and corn yield in general, the variables in each dataset were correlated and the indexes were temporally and spatially similar."
14,"to reduce the information redundancy, principal component analy- sis was conducted in each dataset."
14,"for ec, principal component 1 (pc1) represented 13"
15,1394 precision agriculture (2023) 24:1380–1400 fig.
15,"5 behavior of the temperature vegetation dryness index (tvdi) compared with normalized differ- ence vegetation index (ndvi) throughout the season (a), representing the evaporative triangle."
15,"and on july 5th, corresponding to v8 stage (b) for each yield class 91% of the data variance."
15,"measurements at both depths had equal weights in this com- ponent, but the superficial contributed positively while the other negatively."
15,"for the soil dataset, the first two pcs represented more than 80% of variance and were the only ones used in cluster analysis."
15,"carbon content influenced pc1 (loading around 0.5), while pc2 is best represented by aluminum content (0.4), cec and bases (− 0.43)."
15,"for si 1 and si 1-ec, only pc1 was used and it was strongly influenced by lst data, with negative loading (-0.7)."
15,"for si 2 and ec-si2, the components 1, 2 and 3 were considered and vegetation indexes, including tvdi, are clearly discriminated by pc2."
15,"on pc1, the image date resulted in different loadings."
15,"the increase in electrical con- ductivity in si does not seem to have strongly influenced the main components, which reflected in the zoning results."
15,"after selecting which pcs would be used in the different zonings, they cluster analy- sis was applied."
15,"in all situations, the best number of clusters was 2, as indicated by pc and pe (fig."
16,precision agriculture (2023) 24:1380–1400 1395 fig.
16,"6 partition coefficient (pc) and partition entropy (pe) per cluster numbers for a electrical conductivity (ec), b only soil attributes (s), c spectral indexes from july 5th, date that was best correlated to productiv- ity (si 1), d si 1 combined with ec (si 1-ec), and e spectral indexes from all dates (si 2) and f si 2 com- bined with ec (si 2-ec) fig."
16,"7 results from the managements zones maps created with the clusters and confusion indexes (ci), to measure the clustering ambiguity for each cell."
16,"for a electrical conductivity (ec), b only soil attributes (s), c spectral indexes from july 5th, date that was best correlated to productivity (si 1), d si 1 combined with ec (si 1-ec), e spectral indexes from all dates (si 2) and f si 2 combined with ec (si 2-ec) and the original yield map (ton.ha-1), g productivity map generated by interpolation of productivity data acquired at harvest the resulting mzs had similar spatial distribution, however, the ones derived from spec- tral indices had crisper partitions (fig."
16,"this could be explained by the higher spatial res- olution of satellite images, which unlike the other datasets were not interpolated (fig. 7g), a process that usually result in smooth transitions."
16,there was a negligible difference between using images from july 05th and from the whole harvest.
16,"in addition, electrical conductiv- ity did not add information to the zoning, as previously indicated by pca."
16,"to define the datasets that resulted in representative zones, i.e., which information improved the design of yield-limiting zones, were analyzed the mzs and yield map by the wilcoxon mann whitney test and pairwise wilcox test (table 4)."
16,"in this case, significant results (p < 0.05) indicated which resulting mzs were different from each other."
16,"the ec, s and si 1-ec datasets showed no significant difference between their resulting clusters, showing that they were not able to group the field adequately."
16,the lowest p-value 13
17,"1396 precision agriculture (2023) 24:1380–1400 table 4 results from wilcoxon methodology p-value mann whitney test and pairwise wilcox test, considering the mzs pairwise t-test pairwise wilcox test from different datasets, were considered the significant with ec – – p-value < 0.05 s – – 0si 1 1.49e−320 4.25e−288 si 1-ec – – si 2 1.41e-257 2.81e-236 si 2-ec 4.31e-284 1.62e-260 was obtained in si 1 considering both average tests."
17,"therefore, this was the best zoning, as it was more similar to the productivity variation."
17,the results confirm the potential of using spectral data in crop fields as an alternative to access spatio-temporal variability of management zones.
17,"this type of information does not depend on soil sampling and laboratory analysis, reducing costs and overcoming field work (molin & tavares, 2019)."
17,"in addition, the soil data in this case required spatialization, an extra step that depends on the sample density to be satisfactory."
17,"conclusions the study site presented a considerable variability of soil chemical attributes, especially ph, bases saturation and aluminum content."
17,"this variability influenced the crop develop- ment and yield, which was correctly detected by remote sensors."
17,"correlations between veg- etation indexes and yield reached a maximum value of 0.75 for nbr2, but evi, savi and ndvi also presented good results (r > 0.7)."
17,"although tvdi presented lower correlations, the evaluation of the evaporative triangle provided relevant insights about the field spatio- temporal variability."
17,this was only possible due to the capacity of remote sensors detect- ing land surface temperature and the direct relation of such information with crop energy balance and consequently evapotranspiration.
17,"besides the different indexes, another factor with great influence on corn monitoring is the plant phenological stage."
17,"according to our results, the vegetative stage v8 (july 5th) resulted in higher correlations between vegeta- tion indexes and corn yield."
17,"these results indicate that soil conditions can be indirectly evaluated by remote sensing data and methodologies capable of associating the electro- magnetic radiation reflected or emitted by plant canopy (i.e., spectrum) and plant health conditions."
17,"the electrical conductivity was significantly correlated to soil chemical attributes, espe- cially ph and bases saturation (r = 0.76)."
17,"locations with higher ec also presented higher ph, bs and lower m%, while areas with lower ec were the least productive due to soil chemical limitations for plant development."
17,"although ec was correlated to soil, analysis showed that management zones designed solely by electrical conductivity did not result in partitions with significantly different yields."
17,"on the other hand, mzs had the best agree- ment with yield when zones were based solely on vegetation index from corn v8 phe- nological stage."
17,"these results are related to the capacity of rs to generate information at higher density (30 m spatial resolution), while field sampling in precision agriculture usu- ally considers one point every 2–3 ha."
17,"therefore, our results indicate the great potential of 13"
18,precision agriculture (2023) 24:1380–1400 1397 remote sensing to generate good quality and dense data for evaluating corn variability and to define adequate management zones.
18,"further studies should focus on the use of thermal data for mzs design, once that such information has been proved to be directly to plant water stress."
18,acknowledgements the authors would like to thank the national council for scientific and technologi- cal development (cnpq) for the first author scholarship (grant nº 117590/2019-3); the são paulo research foundation (fapesp) (grant 2014-22262-0) for providing essential resources; andré zabini from labo- ratório agrónomico and fábio vechiato from araponga farm for providing the data and finally the geo- technologies in soil science group (geocis– website http://​esalq​geocis.​wixsi​te.​com/​engli​sh) for the support.
18,funding this work was supported by national council for scientific and technological develop- ment (cnpq) and são paulo research foundation (fapesp) (grants nº 2014-22262-0; 2018/23760-4; 2021-05129-8).
18,availability of data and material not applicable.
18,code availability not applicable.
18,declarations conflict of interest the authors declare that they have no conflict of interest.
18,"references abreu, c."
18,"h., muraoka, t., & lavorante, a."
18,(2003).
18,avaliação de alumínio trocável em solos ácidos.
18,"sci- ence in agriculture, 60, 543–548. https://​doi.​org/​10.​1590/​s0103-​90162​00300​03000​20 adams, m."
18,(1995).
18,chemometrics in analytical spectroscopy (2nd ed.).
18,rsc books.
18,"albornoz, e."
18,"m., kemerer, a."
18,"c., galarza, r., mastaglia, n., melchiori, r., & martínez, c."
18,(2018).
18,development and evaluation of an automatic software for management zone delineation.
18,"precision agriculture, 19, 463–476. https://​doi.​org/​10.​1007/​s11119-​017-​9530-9 alvino, f."
18,"g., aleman, c."
18,"c., filgueiras, r., althoff, d., & cunha, f."
18,(2020).
18,vegetation indices for irrigated corn monitoring.
18,"engenharia agricola, 40, 322–333."
18,"arshad, m., li, n., zhao, d., sefton, m., & triantafilis, j."
18,(2019).
18,comparing management zone maps to address infertility and sodicity in sugarcane fields.
18,"soil tillage research, 193, 122–132. https://​doi.​org/​ 10.​1016/j.​still.​2019.​05.​023 benson, n., key, c."
18,"h., northern, u., mountain, r., benson, n."
18,"c., glacier, u., & park, n."
18,(1999).
18,measur- ing and remote sensing of burn severity.
18,"bezdek, j."
18,(1981).
18,"pattern recognition with fuzzy objective function algorithms, pattern recognition with fuzzy objective function algorithms."
18,"springer. https://​doi.​org/​10.​1007/​978-1-​4757-​0450-1 breunig, f."
18,"m., galvão, l."
18,"s., dalagnol, r., dauve, c."
18,"e., parraga, a., santi, a."
18,"l., della flora, d."
18,"p., & chen, s."
18,(2020).
18,delineation of management zones in agricultural fields using cover–crop biomass estimates from planetscope data.
