page,p
1,"agriculture 2014, 4, 113-131; doi:10.3390/agriculture4020113 open access agriculture issn 2077-0472 www.mdpi.com/journal/agriculture article crop dominance mapping with irs-p6 and modis 250-m time series data murali krishna gumma 1,*, kesava rao pyla 2, prasad s."
1,"thenkabail 3, venkataramana murthy reddi 4, gundapaka naresh 5, irshad a."
1,mohammed 1 and ismail m.
1,"rafi 1 1 icrisat, patancheru-502324, india; e-mails: irshad@cgiar.org (i.a.m.); icrisat.gis@cgiar.org (i.m.d.r.)"
1,"2 national institute of rural development, rajendranagar, hyderabad-500068, india; e-mail: kesav.nird@gmail.com 3 us geological survey (usgs), flagstaff, az 86001, usa; e-mail: pthenkabail@usgs.gov 4 sairam engineers, bangalore- 560037, india; e-mail: murthyreddi@gmail.com 5 spatial information technology, jawarharlal nehru technological university, hyderabad-500072, india; e-mail: gundepaka@gmail.com * author to whom correspondence should be addressed; e-mail: m.gumma@cgiar.org; tel.: +91-40-3071-3449; fax: +91-40-3071-3071."
1,received: 6 january 2014; in revised form: 19 march 2014 / accepted: 14 april 2014 / published: 25 april 2014 abstract: this paper describes an approach to accurately separate out and quantify crop dominance areas in the major command area in the krishna river basin.
1,"classification was performed using irs-p6 (indian remote sensing satellite, series p6) and modis eight-day time series remote sensing images with a spatial resolution of 23.6 m, 250 m for the year 2005."
1,temporal variations in the ndvi (normalized difference vegetation index) pattern obtained in crop dominance classes enables a demarcation between long duration crops and short duration crops.
1,the ndvi pattern was found to be more consistent in long duration crops than in short duration crops due to the continuity of the water supply.
1,"surface water availability, on the other hand, was dependent on canal water release, which affected the time of crop sowing and growth stages, which was, in turn, reflected in the ndvi pattern."
1,the identified crop-wise classes were tested and verified using ground-truth data and state-level census data.
1,"the accuracy assessment was performed based on ground-truth data through the error matrix method, with accuracies from 67% to 100% for individual crop dominance classes, with an overall accuracy of 79% for all classes."
2,"agriculture 2014, 4 114 derived major crop land areas were highly correlated with the sub-national statistics with r2 values of 87% at the mandal (sub-district) level for 2005–2006."
2,"these results suggest that the methods, approaches, algorithms and datasets used in this study are ideal for rapid, accurate and large-scale mapping of paddy rice, as well as for generating their statistics over large areas."
2,"this study demonstrates that irs-p6 23.6-m one-time data fusion with modis 250-m time series data is very useful for identifying crop type, the source of irrigation water and, in the case of surface water irrigation, the way in which it is applied."
2,the results from this study have assisted in improving surface water and groundwater irrigated areas of the command area and also provide the basis for better water resource assessments at the basin scale.
2,keywords: irrigated area mapping; crop dominance; krishna basin; remote sensing; nagarjuna sagar; command area; ndvi and modis 250 m 1.
2,introduction spatial information on crop distribution have been restricted by the district-level crop statistics published by state or national governments in different parts of the world.
2,"some efforts have been made to spatially distribute the district level statistics using spatial allocation models and to prepare global maps (spatial allocation modeling (spam) datasets, future harvest, international food policy research institute (ifpri))."
2,"however, remote sensing imagery-based mapping of dominant crops was attempted by many using seasonal imagery from satellites, like landsat [1], but it was not until recently when high temporal resolution imagery from platforms, like modis, became available that it became easier to identify dominant crops with innovative methods [2]."
2,crop dominance mapping in the command area (the area under a reservoir or a dam for irrigation purpose) is very helpful to understand the dynamics of water availability and use in relation to rainfall.
2,"when fine spatial and spectral resolution imagery is combined with high temporal resolution imagery, the hybrid output provides better feature identification."
2,"census data on agricultural production provide a coarse view of how cropped areas change under irrigation supply fluctuations, and satellite imagery can provide spatially detailed maps of where cropping patterns changed the most for a given variation in water supply [3]."
2,"satellite imagery has been increasingly used to quantify water use and productivity in irrigation systems [4,5], but has less frequently been used to identify parts of irrigated command areas that change in response to variations in water supply."
2,"various techniques in satellite image analysis have been applied to study and map agricultural areas using different spatial resolutions [4,6–11]."
2,"however, precise mapping of crops and their water status remains challenging [12,13]."
2,"the use of irs-p6 imagery proved to be fast, cheap and successful in mapping areas dominated by small holding farms."
2,"many studies were conducted using landsat data, to map land use land cover areas."
2,this was demonstrated by draeger [13] in estimating the irrigated land area of the klamath river basin in oregon.
2,"rundquist et al. [14] used these to make an inventory of central pivot irrigation systems in nebraska, and thiruvengadachari et al. [15] used landsat data to"
3,"agriculture 2014, 4 115 identify irrigation patterns in semiarid areas in india."
3,"abderrahman et al. [16] mapped the irrigated areas of the severely arid regions of saudi arabia using temporal landsat multispectral scanner and thematic mapper data, while murthy et al. [17] used irs liss (indian remote sensing satellite with linear imaging self-scanning) data to derive a cropping calendar for a canal operation schedule in india."
3,"thenkabail et al. [18] demonstrated the use of time series coarse-resolution satellite data, such as those from the national oceanic and atmospheric administration’s (noaa) advanced very high resolution radiometer (avhrr), in mapping irrigated areas over the entire world."
3,the most extensive study of irrigation performance assessment was carried out by alexandridis et al. [19] using noaa-avhrr data.
3,they investigated the indus river basin to identify the irrigated areas and assessed the performance of the irrigation systems.
3,boken et al. [20] also demonstrated the potential of noaa-avhrr for estimating irrigated areas of three states of the usa.
3,thenkabail et al. [21] used moderate resolution imaging spectroradiometer (modis) time series data to generate land use land cover (lulc) and a map of the irrigated area for the ganges and indus river basins.
3,"over time, the use of various satellite data has evolved along with diverse and novel techniques in analyzing them."
3,kamthonkiat et al. [22] described a technique called the peak detector algorithm to discriminate between rainfed and irrigated rice crops in thailand.
3,"biggs et al [12] used modis time series combined with ground-truth data, agricultural census data and landsat thematic mapper (tm) data to map surface-water irrigation, groundwater irrigation and rainfed ecosystems of the krishna river basin in the southern indian peninsula."
3,gumma et al. [23] stressed the importance of ndvi time series to identify and separate land use change over the time.
3,"the above literature has consistently reported that single-date fine-resolution imagery, acquired at critical growth stages, is sufficient to precisely identify where irrigation was applied, even including minor and informal irrigation."
3,gumma et al. [11] used fusion techniques to map irrigated areas at the country level using landsat 30-m and modis 250-m data resolution.
3,"however, it is not adequate to derive the intensity of irrigation and the cropping calendar of the crop identified."
3,"in contrast, multi-date time series coarse-resolution imagery can be used to distinguish the differences between irrigated crop types and to derive the irrigation intensity [14,15,18,21]."
3,"therefore, a methodology to integrate the use of both the fine and coarse spatial resolution datasets must be developed [18]."
3,the gap between the use of fine-resolution satellite data and the use of coarse-resolution satellite data must be bridged.
3,"moreover, the existing methodology must be modified to derive irrigated areas using fine-resolution satellite data."
3,"studies reporting the use of multi-temporal image data for classification often include relatively few dates, possibly due to a lack of cloud-free image availability, cost and processing requirements [24]."
3,mapping crop dominance areas is very important for water accounting and water resource allocation.
3,precision can be achieved only when discrepancies among area estimates are effectively eliminated.
3,previous studies have used either only irs-p6 or only modis data for mapping land use and land cover areas.
3,this study aims to map crop dominance areas in the major command area using both irs-p6 at 23.6-m (2005–2006) and modis 250-m data.
3,irrigation types in the command area vary from large-scale surface water to fragmented and shallow groundwater (along the river and inland valleys).
3,"furthermore, very small fragmented supplemental irrigated areas exist."
3,"climate and elevation vary widely, as well."
3,"thus, the fusion of higher spatial resolution data with course-resolution modis data is ideal for mapping crop dominance in the command area."
4,"agriculture 2014, 4 116 2."
4,"study area the nagarjuna sagar (njs) project (16°34′24′′ n, 79°18′47′′ e) is one of the major multipurpose reservoirs in south india (figure 1)."
4,"it is located in the lower krishna basin, which is the fifth largest river basin in india."
4,"the gross capacity of the reservoir is 11,557 mm3 at a full storage level of +179.832 m above sea level, and the live storage capacity is 6841 mm3, with a dead storage of 4716 mm3 at 121.92 m."
4,"dam construction was completed in 1974, although canals started serving the command from 1967."
4,"the njs reservoir, in conjunction with the upstream hydropower reservoir, srisailam (8720 mm3), provides irrigation to the njs command of 895,500 ha, with a water allocation of 8436 mm3 (including releases to njs canals plus reservoir evaporation losses) by the first krishna disputes tribunal [25]."
4,"the reservoir is also committed to supply 2264 mm3 to the krishna delta, which is downstream of the njs."
4,"in addition, in 2004, nagarjuna sagar started to supply water (33 mm3) to hyderabad, a major city of ~7 million inhabitants."
4,"currently, the njs project supplies 123 mm3 to hyderabad, and this is expected to increase to 370 mm3 by 2030 [26]."
4,this expected demand of hyderabad is equivalent to 4% of the water allocated to the nagarjuna sagar irrigation project.
4,"the state-level committee for integrated operation of krishna and pennar basin projects (ciokrip) was formed for the integrated operation of the lower krishna reservoirs, including srisailam, nagarjuna sagar and the krishna delta system (prakasam barrage) for the optimum utilization of the water in an integrated manner."
4,"releases from nagarjuna sagar are made in the following priority: hyderabad water supply, krishna delta and nagarjuna sagar canals."
4,the command area is divided in to five subregions based on the districts in which they fall.
4,figure 1.
4,location map of the nagarjuna sagar (ns) command area in southern india.
4,"in the main panel, the clear polygons and italicized labels are the district boundaries with canal distributaries."
4,the lower right inset shows the lowest administrative boundary.
5,"agriculture 2014, 4 117 the project consists of a dam and two main canals, the nagarjuna left main canal (nslc) and the right main canal (nsrc)."
5,the releases into the main river and both the canals are first used to generate hydropower.
5,"the main power station on the river has a hydropower potential of 960 mw, and nslc and nsrc have a hydropower potential of 60 and 90 mw, respectively."
5,"in 1976, each main canal was allocated 3738 mm3 for cultivable command areas (cca) of 475,500 ha in nsrc and 420,000 ha in nslc."
5,"so far, the potential irrigated area created is 450,000 and 359,200 ha in nsrc and nslc, respectively."
5,"the major crops grown in this region are rice, cotton, chili and maize; these crops are grown in rainy season, and during the second season, most of the rice-grown areas continue to grow rice and/or pulses."
5,rice requires continuous irrigation.
5,cotton and chili require irrigation after the rainy season every fifteen days.
5,data and methods the 23.6-m irs-p6 map of the cropland areas of the study area was developed using the following datasets.
5,"irs-p6 data different period data have different radiometric resolutions [11,27], hence their respective digital numbers (dns) carry different levels of information and cannot be directly compared."
5,"therefore, they were converted to absolute units of radiance (w m−2 sr−1μm−1), then to apparent at-satellite reflectance (%) and, finally, to surface reflectance (%) after atmospheric correction."
5,details on these conversions are provided due to the uniqueness of the sensors involved.
5,dn to radiance: the irs-p6 data is 8-bit.
5,dns were converted to radiances.
5,"spectral radiance is computed using the following equation: ( dn  gain) r (1) 255 radiance to reflectance: a reduction in between-scene variability can be achieved through a normalization for solar irradiance by converting spectral radiance, as calculated above, to planetary reflectance or albedo [27,28]."
5,"this combined surface and atmospheric reflectance of the earth is computed with the following formula: l d 2 p  (2) esun  cos  s where ρp is the at-satellite exo-atmospheric reflectance, lλ is the radiance (w m−2 sr−1 μm−1), d is the earth to sun distance in astronomic units at the acquisition date [27], esunλ is the mean solar exo-atmospheric irradiance (w m−2 sr−1μm−1) or solar flux [29] and θs is solar zenith angle in degrees (i.e., 90 degrees minus the sun elevation or sun angle when the scene was recorded, as given in the image header file)."
6,"agriculture 2014, 4 118 3.2."
6,modis 250-m time series data the modis 250-m data for the krishna river basin were downloaded from calibrated global continuous time series mega datasets [30] composed of the individual files from the nasa website [31].
6,the modis 250-m 2005–2006 every 8 days (table 1) terra sensor data in 2 specific bands (band 2 (near-infrared) and band 1 (red)) are processed for land applications as a modis surface reflectance product (mod09q1).
6,the mod09 is computed from modis level 3 bands 1–2 (centered at 648 nm and 858 nm).
6,the product is an estimate of the surface reflectance for each band as it would have been measured at ground level if there were no atmospheric scattering or absorption.
6,"original modis data is acquired as 12-bit (0 to 4096 levels) and is stretched to 16-bit (0 to 65,536 levels)."
6,table 1.
6,the characteristics of satellite data used in this study.
6,irs-p6-liss3 (indian remote sensing satellite with linear imaging self-scanning (irs liss)) 4-band reflectance and modis terra 2-band reflectance data characteristics used in this study.
6,"band irradiance spatial sensor bands range (w m−2 potential application (meters) −1 −1 (μm) sr mm ) irs-p6 water bodies and also capable of differentiating (5 october 2005, 23.6 2 0.52–0.59 1857.7 soil and rock surfaces from vegetation 21 november 2005) 3 0.62–0.68 1556.4 sensitive to water turbidity differences sensitive to the strong chlorophyll absorption 4 0.77–0.86 1082.4 region and the strong reflectance region for most soils operates in the best spectral region to distinguish 5 1.55–1.70 239.84 vegetation varieties and conditions modis absolute land cover transformation, 250 1 0.62–0.67 1528.2 (june 2005 to may 2006) vegetation chlorophyll cloud amount, vegetation land 2 0.84–0.88 974.3 cover transformation the study area, located at about 18 degrees north latitude, is subject to the influences of the oscillating sub-tropical convergence zone, which include monsoon over the region."
6,"it is during this part of the year that there is the most change in vegetation cover, rapid changes in the dynamics of vegetation and biomass accumulation."
6,it is also a period when cloud cover is high.
6,"in order to retain the maximum number of time series images, we: (1) retained all images with <5 percent cloud cover; and (2) developed a cloud masking algorithm, so as to eliminate areas of cloud cover and retain the rest of the image as it is [21]."
6,"of the 46 images, there were 16 images with 25–40 percent cloud cover."
6,"therefore, it is important to retain non-cloud areas to get the maximum temporal coverage."
6,"the following section contains the specifics about the cloud algorithm development, testing and implementation."
6,the minimum reflectivity of clouds in the modis bands (b1 and b2) provide the best separability in which cloud cover is removed.
6,"if the reflectance value in b1 is more than 18 percent, then the values"
7,"agriculture 2014, 4 119 in b1 are replaced with a null value."
7,"when the b1 value is null, then the corresponding value in b2 is replaced with a null value."
7,"if the reflectance value in b1 is less than 18 percent, then the corresponding value in b2 is retained as it is."
7,"the continuous time series analysis of modis data requires the construction of mega datasets that involve multiple bands [2,32]."
7,a total of 92 bands were stacked into a single mega file.
7,a separate 46 images of ndvi mega file was also created.
7,"the single mega file facilitates: (1) in preparing monthly maximum value composite (mvc) from 46 images of ndvi and 4 bands of irs-p6 single date data; and (2) analyzing the time series data in its entirety (e.g., performing unsupervised classification of monthly mvc data and determining how classes change in magnitude over space and time)."
7,"mega file data cube (mfdc) consists of 50 bands, coming from 4 irs-p6 bands and 46 ndvi bands from mod09q1."
7,"ground-truth datasets ground-truth data was collected during 13–26 october 2005, for 172 sample sites covering major land use/cover classes and its percent in the study area (figure 1)."
7,"in addition, ground-truth observations were made extensively, while driving, by manually marking on topographic maps (1:50,000) obtained from the survey of india for further reference."
7,the geocover 2000 [33] products were also used as additional information in class identification.
7,the approach we adopted was to look for contiguous areas of homogeneous classes within which we can sample.
7,"a large contiguous information class constituted our sampling unit, within which we sample a representative area of 250 m by 250 m."
7,the emphasis was on the ―representativeness‖ of the sample location in representing one of the classes to ensure the precise location of the pixel.
7,class labels were assigned in the field.
7,classes have the flexibility to merge to a higher class or break into a distinct class based on the land cover percentages observed at each location.
7,the precise locations of the samples were recorded by a garmin gps unit.
7,the sample size varied from 5 to 15 samples for each category.
7,"it is ideal to have at least 15 samples per category, which was not feasible, due to limited resources."
7,class labels were assigned in the field.
7,"at each location, the following data were recorded: 1."
7,land use land cover (lulc) classes: crop type and other land use and land cover; 2.
7,"land cover types (% cover): trees, shrubs, grasses, built-up, water, fallow lands, weeds, different crops, sand, snow, rock and fallow farms; 3."
7,"crop types: for kharif, rabi and summer seasons; 4."
7,"cropping pattern: for kharif, rabi and summer seasons; 5."
7,"cropping calendar (sowing to harvesting the crop): for kharif, rabi and summer seasons; 6."
7,"irrigated, rainfed, supplemental irrigation at each location; 7."
7,three hundred forty-four digital photos hot linked at 172 locations.
7,ideal spectra creation ideal spectral signatures were generated using time series data that were extracted from 118 observation points (see figure 2).
7,each of the points chosen to generate the ideal spectral
8,"agriculture 2014, 4 120 signatures represents a definitive crop type and/or cropping system, such as ―irrigated-surface water-rice-rice‖ (meaning the rice field is irrigated by surface water and is rice during two seasons), ―irrigated-surface water-sugarcane‖."
8,"multiple points with the same crop type/system, even though distributed spatially in discrete patches, were combined to create a single ideal spectral signature [2], for that cropping system between 5 and 10 points per spectra, resulting in 6 ideal crop signatures and 4 ideal signatures for other classes."
8,major crop signatures in this study areas are shown in figure 2.
8,figure 2.
8,ideal spectral signatures for different crops in the study area.
8,signatures were extracted from the precise knowledge of crop characteristics using a time series composite.
8,classification methods the modis time series images and irs-p6 images were first converted into at-satellite reflectance and made into a single mfdc composite.
8,"this was then classified using unsupervised iterative self-organized class (isoclass) cluster k-means classification with a convergence value of 0.99 and 50 iterations, yielding 50 classes followed by successive generalization [2,11,34,35]."
8,unsupervised classification was used instead of supervised classification in order to capture the range of variability in phenology over the image across the study area.
8,"for the initial grouping of classes based on decision tree algorithms, a decision tree was applied to the 50 ndvi signatures that resulted from the unsupervised classification."
8,the temporal profiles of each class are derived from the ndvi time series data of a class.
8,"single date imagery cannot provide a temporal profile of a class, so it is advantageous to have time series imagery, like that of modis."
8,"the variability in the phenology of each land use class or crop type is reflected in the ndvi profile, and appropriate thresholds are determined for each class and also cropping intensity, etc."
8,"the threshold ndvis and ndvi signatures over time help us determine the land use type, including crop intensity, surface irrigation areas, groundwater irrigation areas, rainfed and rangelands."
9,"agriculture 2014, 4 121 in order to group them into a manageable number of distinct classes."
9,"the decision tree is based on monthly ndvi thresholds at different crop growth stages in the season [2,32,35]."
9,"the months and threshold values were chosen based on knowledge of the crop calendar from local experts, field observations, as well as published rice crop development stages."
9,"crop dominance class identification and labeling was based on modis ndvi time series plots, ideal spectra, ground-truth data and very high-resolution images (google earth)."
9,ideal spectra were generated using time series imagery with precise field plot data of the same type of land use at spatially distributed locations.
9,"the specific protocols included grouping class spectra based on class similarities and/or comparing them with ideal/target spectra, rigorous protocols for class identification and labeling with the use of large volumes of ground-truth data and very high-resolution imagery."
9,"after a rigorous classification process, most of the classes were identified, except some mixed classes [36]."
9,spectral matching techniques match the class spectra derived from classification with an ideal spectra-derived modis 250-m mfdc [36].
9,"time series data, such as the monthly modis ndvi data, are similar to hyperspectral data (12 months in time series data)."
9,"these similarities imply that the spectral matching techniques (smts), applied for hyperspectral image analysis, also have potential for application in identifying agricultural land use classes from historical time series satellite imagery."
9,"google earth® is a free access, internet-based application that provides very high spatial resolution images down to sub-meter resolution."
9,"this is valuable for the visual interpretation of land cover in the area, especially to ascertain whether a class is an irrigated or rainfed cropland, when the area is well explored."
9,"google earth data was also used to identify the presence of any irrigation structures (e.g., canals, irrigation channels, open wells)."
9,"most of the very high-resolution imagery (vhri: <5 m; e.g., ikonos, quickbird, geoeye) for the study area was acquired from 2000 to 2010."
9,the groundwater irrigated areas were differentiated from surface water irrigated areas using the difference in the time of sowing.
9,"in general, groundwater irrigated areas start early, and these are patchy in spatial distribution, whereas the surface water irrigated areas (canal, stream and tank); do not start until water is allocated through the canal, etc."
9,"this is reflected in ndvi profiles very clearly [12,37]."
9,the mixed classes were resolved using elevation (dem) as an additional variable in the gis environment.
