page,p
1,geocarto international issn: 1010-6049 (print) 1752-0762 (online) journal homepage: www.tandfonline.com/journals/tgei20 remote sensing agricultural crop type for sustainable development in south africa john r.
1,"jensen, maria garcia-quijano, brian hadley, jungho im, zhongwu wang, abraham l."
1,"nel, eduarda teixeira & bruce a."
1,davis to cite this article: john r.
1,"jensen, maria garcia-quijano, brian hadley, jungho im, zhongwu wang, abraham l."
1,"nel, eduarda teixeira & bruce a."
1,"davis (2006) remote sensing agricultural crop type for sustainable development in south africa, geocarto international, 21:2, 5-18, doi: 10.1080/10106040608542378 to link to this article: https://doi.org/10.1080/10106040608542378 published online: 04 jan 2008."
1,submit your article to this journal article views: 228 view related articles full terms & conditions of access and use can be found at https://www.tandfonline.com/action/journalinformation?
1,journalcode=tgei20
2,remote sensing agricultural crop type for sustainable development in south africa john r.
2,"jensen, maria garcia-quijano, brian hadley, jungho im and zhongwu wang department of geography, university of south carolina columbia, south carolina 29208, u.s.a."
2,abraham l.
2,"nel and eduarda teixeira spatial & land information management directorate department of water affairs & forestry pretoria, republic of south africa bruce a."
2,"davis applied sciences directorate nasa stennis space center ssc, ms 39529, u.s.a."
2,"abstract effective water resource management improves food production and conserves scare water resources, especially in developing countries such as south africa."
2,the goal of this project was to assist the republic of south africa department of water affairs & forestry to identify a cost-effective remote sensing methodology to accurately measure and monitor agricultural land use for national water act water management purposes.
2,the most accurate results were obtained using object-oriented image segmentation techniques applied to spot multispectral and panchromatic data (overall accuracy = 89.41%).
2,accurate classifications were also obtained using just the spot multispectral data (85.33%).
2,"when applied to landsat etm+ and tm data in 2003 and 2005, the image segmentation approach out-performed all other algorithms yielding classification accuracies of 85.71% and 84. 30%, respectively."
2,"this is important because landsat tm type data cover more geography (e.g., 185 x 185 km) than 2 spot data (e.g., 60 x 60 km) and are more economical per km ."
2,these findings are of value to the republic of south africa as well as other countries throughout africa that are trying to implement national water acts that rely on remote sensing to provide some of the critical land cover information.
2,"introduction to the registered water use the majority of the country is semi-arid with an average problem in developing countries annual rainfall of 497 mm, a rate well below the world average of 860 mm (walmsley, 1991)."
2,low precipitation the european space agency’s tiger 2004 workshop in and high evaporation rates result in low available runoff.
2,"pretoria, republic of south africa reported that only 8.6% of the rainfall is available as surface water, approximately 3.5 million african children die of water- resulting in one of the lowest conversion rates in the world related causes each year."
2,"the major causes include: no (asmal, 1998)."
2,"nearly two-thirds of the country receives access to potable water, drinking polluted water, too much less than the national rainfall average and about 20% receives water (e.g., flooding), and lack of food due to drought or < 200 mm."
2,successful dryland farming requires 500 mm improper allocation of water resources.
2,"this endemic disaster rainfall per annum (turton et al., 2003)."
2,"therefore, unless takes place each year in many water-scarce developing the precipitation is >500 mm per year, a successful farmer countries."
2,"therefore, it is not surprising that water resource must usually extract irrigation water from rivers, wells or and disaster management are important aspects of the world bore-holes to supplement the meager precipitation."
2,certain summit on sustainable development (2002) follow-on crops such as sugarcane and citrus are especially significant program. consumers of water per hectare.
2,"the republic of south africa is a large country (1,221, to manage water resources wisely in the republic of 2 000 km )."
2,"although there are various climatic zones in south africa, it is necessary to constantly monitor the spatial south africa that include tropical and desert conditions, the distribution of activities that utilize the small amount of country is considered to be scarce of natural water resources. water available."
2,"therefore, the republic of south africa geocarto international, vol."
2,"21, no."
2,"2, june 2006 e-mail: geocarto@geocarto.com 5 published by geocarto international centre, g.p.o."
2,"box 4122, hong kong."
2,website: http://www.geocarto.com
3,"adopted a national water act in 1998 to manage the country’s information is the use of remote sensing to identify agricultural water resources to improve agricultural production, minimize land."
3,"the remote-sensing derived agricultural water use can waste, facilitate greater cooperation between state agencies then be compared with official “registered water use” data. and users (e.g., farmers, residential consumption, industry), this nasa-sponsored research assisted the dwaf to develop and improve the transnational movement of water."
3,"the remote-sensing assisted techniques to obtain the necessary republic of south africa national water act is implemented agricultural water use information (nel et al., 2005). within nineteen water management areas by the south africa department of water affairs & forestry (figure 1) (dwaf, study area 1998)."
3,other developing countries are adopting approaches similar to the south african national water act.
3,a properly the republic of south africa department of water affairs implemented national water act can help minimize the & forestry requested that the remote sensing research be effects of drought and save lives in developing countries. conducted in water management area #6: usutu and one of the foundation concepts of the national water act mhlathuze river catchments (figure 1).
3,the study area is is “registered water use”.
3,this means that the location and along the mhlathuze river north of durban (figure 2).
3,"the amount of water used by an individual, farmer, or industry area contains natural vegetation consisting of forest and must be registered."
3,"this information is placed in the water scrub-shrub (bushveld), non-irrigated dryland farming, and authorization and resource management system (warms) irrigated agriculture consisting primarily of sugarcane, citrus spatial decision support system (sdss)."
3,using this system it and vegetables.
3,"the mhlathuze river catchment also includes is possible to determine the demand for water in a watershed traditional tribal areas that are characterized by scattered (i.e., catchment)."
3,accurate water demand predictions facilitate informal farming activities.
3,"these emerging farmers are more accurate storage and equitable allocation decisions difficult to identify, but will require access to water for (jensen et al., 1977; estes et al., 1978; jensen and chery, irrigation in the future."
3,"1980; dwaf, 2005)."
3,"therefore, one of the greatest challenges in developing countries is to identify the geographic location methodology of “actual water users,” and compare this information with “registered water users” information."
3,the goal of the project was to investigate various digital the republic of south africa allowed all water users to image processing algorithms to inventory the type and spatial register their water use from 1996-1998.
3,the water use distribution of agriculture present along a portion of the registration information was placed in the warms database.
3,mhlathuze river in the republic of south africa.
3,this the information is used as a basis for managing water required: resources and for billing users.
3,"although a certain level of • knowledge of the phenological cycle of the various cross checking was done (title deed numbers, relationship agricultural and non-agricultural land cover in the study between irrigable area and volume consumed etc) no formal area, validation of the information supplied by the water user was • collection of ground reference data to train the undertaken during the registration process nor was it classification algorithms and assess remote sensing- confirmed whether all of the registered water use was lawful derived thematic map classification accuracy, use."
3,"the onus was on the user to provide correct information • collection of remote sensor data, and to use water lawfully."
3,"many farmers and other users • digital image processing of remote sensor data to derive took advantage of this amnesty period to provide accurate agricultural information, and water use information."
3,"unfortunately, many were less than • quantitative accuracy assessment of the remote sensing- forthcoming about their true water use and many users did derived information in conjunction with ground reference not bother to register at all."
3,"in fact, in south africa it is information. currently estimated that as much as 60% of water use in the following sections review the methodology associated certain catchments could be illegal under the national water with each of these activities."
3,"act (nell, 2004)."
3,therein is the problem.
3,"in order to accurately audit or account for how water is allocated in land cover phenological cycle semi-arid south africa which is susceptible to drought and the republic of south africa department of water affairs human suffering, it is necessary to inventory the amount of & forestry collects crop calendar information associated water consumed, especially by agriculture. with the major agricultural activities within each water the dwaf is mandated by the national water act (1998) management area."
3,this phenological information was used to obtain information on the spatial distribution of agricultural to select the most appropriate dates to collect remote sensor activities that utilize water throughout the country — including data to discriminate among the various agriculture and non- social statistics regarding gender and race.
3,all agricultural agricultural land cover.
3,"based on this information, remote water users must become “registered water users” in order to sensor data were obtained by dwaf in january - march of legally utilize scarce water resources."
3,"the dwaf is 2003, 2004, and 2005 which is mid- to late-summer in the responsible for conducting the water use accounting."
3,one of southern hemisphere. the primary methods to obtain the agricultural water use 6
4,"in situ ground reference data collection the department of water affairs & forestry obtained in situ ground reference information on the location (x,y) and type of agriculture present in numerous fields throughout the study area (e.g., citrus, sugarcane) in the 2003 and 2004 growing seasons."
4,"the boundary of each field in the study area was digitized from 1:10,000-scale (1 x 1 ft. spatial resolution) digital black & white orthophotographs of the region obtained in late 2003."
4,an example of a small portion of the study area with the ground reference polygons overlaid is shown in figure 3.
4,"field ground reference information was obtained again in march, 2005."
4,any change in figure 1 map of the republic of south africa department of water affairs & field status or field shape was entered into the 2005 forestry (dwaf) water management areas.
4,this research digital ground reference database.
4,a small proportion investigated agricultural remote sensing techniques in water of the in situ ground reference data was used by the management area #6: usutu and mhlathuze river catchments. image analysts to ‘train’ the various classification algorithms investigated.
4,"the in situ ground reference information was also used to perform an unbiased, quantitative land cover classification accuracy assessment."
4,remote sensor data collection many of the agricultural fields in the usutu and mhlathuze river water management area are < 100 ha.
4,"therefore, it was necessary to utilize remote sensing imagery with a spatial resolution of ≤ 30 x 30 m to identify the crop type within such small fields."
4,"sensors like modis (nasa), meris (esa) and avhrr (noaa) were of no value due to their coarse spatial resolutions (e.g., 250 m, 300 m, and 1100 m, respectively)."
4,"utilizing crop calendar information, dwaf obtained the following remote sensor data (dwaf, 2005): • march 26, 2003 landsat 7 enhanced thematic + mapper-plus (etm ) image: o multispectral bands 1-5, 7 at 30 × 30 m; panchromatic band 8 at 15 × 15 m."
4,"• january 9, 2004 spot 5 high resolution visible infrared (hrvir) image: o multispectral bands 1-4 at 10 × 10 m; panchromatic band 5 at 5 × 5 m."
4,"• march 30, 2005 landsat 5 thematic mapper (tm) image: o multispectral bands 1-5, 7 at 30 × 30 m (no panchromatic band)."
4,landsat 5 data were obtained in 2005 instead of + landsat 7 etm data because the landsat 7 sensor was experiencing serious scan-line correction problems.
4,the dwaf acknowledges that it is unlikely that a single source of remote sensor data will be sufficient for the actual effective implementation of the national water act and that a combination of sources and sensors will likely be used.
4,"the dwaf needs expert figure 2 a portion of water management area #6: usutu and mhlathuze river advice on what can be achieved within the confines of catchments recorded on spot 5 imagery collected on january 9, their resources."
4,"while it would be useful to analyze 2005. very high spatial resolution imagery (e.g., ≤ 4 x 4 m 7"
5,"table 1 some of the land cover information used as input to national water act water authorization and resource management system (warms) spatial decision support system (nel, 2004)."
5,"land cover class 1 sugarcane 2 citrus plantations 3 forest 4 bushveld 5 roads (paved, unpaved) 6 water figure 3 an example of the 1:10,000-scale orthophotography obtained in 7 bare soil december, 2003."
5,the original vertical aerial photography was 8 windbreak (eucalyptus) rectified and digitized to obtain 0.3 x 0.3 m (1 x 1 ft) pixels.
5,the boundary of each field was extracted from the orthophotography.
5,9 banana only those fields with a minimum dimension of ≥100 m were used for accuracy assessment.
5,"the point annotations in these 10 paw-paw (2005 only) fields refer to a) the computed centroid of the field polygon, b) 11 vegetables (2005 only) the four locations where spot derived thematic maps were evaluated, and c) the four locations where landsat 7 etm+ and landsat 5 tm-derived thematic maps were evaluated."
5,the centroid was not used in the accuracy assessment.
5,"the other locations were selected to minimize spatial auto-correlation. • 8-bit original brightness values, and • the same data scaled to percent reflectance."
5,"all of the landsat 7 etm+, landsat 5 tm, and spot 5 space imaging ikonos or < 2.44 x 2.44 m digitalglobe data were radiometrically corrected and scaled to percent quickbird), these data are not economically viable for reflectance using empirical line calibration (jensen, 2005). inventorying the entire country due their cost and small this involved the collection of four pseudo-invariant water geographic coverage per scene."
5,only geographically and bare soil radiometric ground control points per scene. extensive remote sensor data such as that collected by the library spectra for water and sandy loam soil were used as landsat thematic mapper (185 x 185 km per scene) are the reference spectra for the conversion.
5,regression equations capable of inventorying the entire country economically.
5,"in were applied to the multispectral bands for each of the three areas of intensive irrigation farming or when cloud-cover is dates of remote sensor data to convert the brightness values a problem, dwaf may use spot data (5 x 5 m panchromatic into scaled percent reflectance and 10 x 10 m multispectral) or envisat advanced synthetic aperture radar (asar) data (30 x 30 m)."
5,geometric preprocessing: all remote sensor data were geometrically rectified to < 1 digital image processing of remote sensor data pixel rmse using ground control points (gcps) and a first- the goal of this research was to document the most order affine projection using nearest-neighbor resampling appropriate classification algorithms that can be used with logic and a universal transverse mercator map projection.
5,"landsat 5 tm, landsat 7 etm+, and/or spot xs and large-scale digital orthophotos derived from 1:10,000-scale panchromatic data to classify agricultural land cover."
5,this vertical aerial photography were especially useful for required image preprocessing and the examination of various selecting gcps for geometric rectification. image classification algorithms radiometric preprocessing: classification there is debate as to whether or not it is necessary to the republic of south africa dwaf has ambitious land radiometrically correct remote sensor data to remove the cover mapping requirements.
5,this investigation attempted deleterious effects of atmospheric scattering/absorption when to extract information on the land cover classes summarized conducting single-date image classification.
5,some scientists in table 1.
5,"in essence, the dwaf needs to identify water suggest that it is sufficient to use the original brightness use (which includes forestry as a stream flow reduction values (e.g., 8-bit values from 0 - 255) when single-date activity)."
5,"therefore, it is necessary to identify agricultural classification is performed and no attempt is being made to fields and quantify their area in order to determine the water measure biophysical variables [e.g., leaf-area-index (lai) use for a specific irrigation method and crop type."
5,"the or absorbed photosynthetically-active radiation (apar)]. irrigation methods and crop types will have to be determined others suggest that all remote sensor data should be scaled from a combination of remote sensing and actual field to percent reflectance (e.g., values form 0 - 100%)."
5,"therefore, surveys."
5,dwaf would be pleased if they can identify field this study examined numerous image classification algorithms boundaries (polygons) as opposed to per-pixel classification using both: in a semi-automated manner.
6,while at first it might seem a simple matter to discriminate information.
6,"it is clear from figures 2 and 3 that information fields of citrus, banana, vegetables, and sugarcane from all extraction algorithm(s) applied to this study area should other land cover classes using remote sensor data, it is not probably take into account texture and incorporate (thompson, 2004; dwaf, 2005)."
6,"unlike many crops, information on the row and orientation structure of plantation sugarcane is not planted in a single month (e.g., november) agriculture."
6,"the algorithm(s) must also be able to extract and then harvested some months later (e.g., march)."
6,"rather, information from relatively small, irregularly shaped fields sugarcane can be planted year-round in this subtropical associated with indigenous agriculture."
6,this can be environment and has an 18-month growth cycle.
6,"this means accomplished by subjecting the spectral and/or panchromatic that in any given month sugarcane can be recorded in 18 remote sensor data to texture extraction algorithms such as different stages of development in the imagery ranging from “homogeneity” based on gray-scale spatial dependency bare soil, to newly established seedlings with substantial matrices (jensen, 2005)."
6,"in addition, more accurate bare ground, to a mature canopy with 100% closure just agricultural information may be obtained if both spectral prior to harvest. and contextual characteristics are used in the classification conversely, citrus crops go through a very long growth process."
6,"this may be accomplished using object-oriented cycle, often lasting 10-20 years."
6,"thus, in any given month, image segmentation which constructs polygons of pixels remote sensor data might capture a citrus field being prepared, that contain relatively uniform spectral and spatial just emerging with substantial amounts of bare soil present, characteristics (baatz and schape, 2000; baatz et al., 2001; or mature with >70% canopy closure (it is rarely 100% due benz, 2001; laliberte et al., 2004)."
6,the spatial characteristics to wide row spacing).
6,"in addition, the relatively wide rows are derived using landscape ecology metrics such as may be oriented in diverse directions throughout a region. compactness and smoothness (definiens imaging, 2005; consequently, two orange fields planted on the same day but visual learning systems, 2005; jensen, 2005). with different row orientation patterns may appear spectrally it would be ideal to utilize in situ derived spectroradiometer different in the remote sensor data. measurements of the most important landcover types and these considerations suggest that simple per-pixel use a matched-filtering or linear spectral mixture analysis classifiers such as the maximum likelihood decision rule or algorithm to identify all pixels in the scene with the same isodata might not provide the most useful agricultural spectral signature."
6,"unfortunately, no in situ spectroradiometer table 2 experimental design applied to remote sensing datasets using selected digital image classification algorithms."
6,+ radiometric classification algorithm etm spot tm analyst preprocessing and features used 2003 2004 2005 isodata 1 ms 1 2 3 8-bit ms+pan 4 5 no pan band ms+pan+texture (homogeneity from pan) 6 7 8 (homogen) ms 9 10 11 reflectance ms+pan 12 13 no pan band ms+pan+texture (homogeneity from pan) 14 15 16 (homogen) maximum-likelihood 2 ms 17 18 19 8-bit ms+pan 20 21 n/a ms+pan+texture (homogeneity from pan) 22 23 24 (homogen) ms 25 26 27 reflectance ms+pan 28 29 no pan band ms+pan+texture (homogeneity from pan) 30 31 32 (homogen) object-oriented 3 ms 33 34 35 8-bit ms+pan 36 37 no pan band ms 38 39 40 reflectance ms+pan 41 42 no pan band matched-filtering 4 reflectance ms 43 44 45 9
7,measurements were available for the historical remote sensor spatial-dependency matrices.
7,"it was a straightforward task to data (baltsavias, 2002; underwood et al., 2003). compute the hc array for f(x,y), where ∆x and ∆y are integers nevertheless, the spectral characteristics of known fields by counting the number of times each pair of brightness can be used to obtain image-derived spectral endmembers values (or percent reflectance values) occurs at separation c (jensen et al., 2003; segl et al., 2003)."
7,mixture-tuned (∆x and ∆y) in an image.
7,"for example, the following image matched filtering can then be used to identify all pixels in the has just five lines and five columns and contains brightness scene that contain a proportion of the endmembers (e.g., values ranging from 0 to 3: sugarcane, citrus, banana)."
7,"based on these considerations, the remote sensor data 0 1 1 2 3 were subjected to 45 digital image processing classification 0 0 2 3 3 algorithms in an attempt to extract the desired agricultural original image = 0 1 2 2 3 information and to document which algorithm and which 1 2 3 2 2 dataset yielded the most promising results."
7,"the experimental 2 2 3 3 2 design applied to remote sensing datasets using various if (∆x and ∆y) = (1,0), then these numbers are represented digital image classification algorithms is summarized below by the spatial dependency matrix hc: and in more detail in table 2: • unsupervised isodata clustering based on: o spectral properties only 0 1 2 3 o spectral and image-derived textural properties 0 1 2 1 0 • supervised maximum likelihood classification based on: hc = 1 0 1 3 0 o spectral properties only 2 0 0 3 5 o spectral and image-derived textural properties 3 0 0 2 2 • supervised object-oriented image segmentation based on: o spectral data and spatial landscape-ecology derived where the entry in row i and column j of this matrix is the metrics number of times brightness value i occurs to the left of • mixture-tuned matched filtering based on: brightness value j."
7,"for example, brightness value 1 is to the o image-derived endmembers left of brightness value 2 a total of three times in this simplified image [i.e., hc (1,2) = 3]."
7,"it was assumed that all image classification the textural information was contained in the brightness value spatial dependency matrices that were developed for five different image analysts performed the digital image angles 0, 45, 90, and 135 degrees."
7,the more values in the classifications.
7,"each analyst was provided with exactly the diagonal of the spatial dependency matrix, the more same data as the other analysts. homogeneous the area within the image under investigation (e.g., in a 3 × 3 patch of pixels)."
7,image-derived texture extraction five of the treatments summarized in table 2 used image- maximum likelihood classification derived texture.
7,"texture was extracted from the high the maximum likelihood classification algorithm is still resolution panchromatic band when available (i.e., 2003 the most widely used supervised classification algorithm."
7,landsat 7 etm+ panchromatic 15 x 15 m data; 2004 spot maximum likelihood classification without prior probability 5 panchromatic 5 x 5 m data).
