page,p
7,"texture was derived from the information decides unknown measurement vector x is in red multispectral band of the 2005 landsat 5 thematic class i if, and only if, mapper data because the landsat 5 sensor did not record pi ≥ pj for all i and j out of 1, 2, ... m possible classes, and panchromatic data."
7,"the texture information was derived using grayscale spatial dependency matrices (herold et al., 1 (x-m )tv -1(x-m ) pi = 1. loge | vi | -[–– i i i ] 2003; maillard; 2003; jensen, 2005)."
7,"2 2 several texture extraction algorithms were investigated, where mi is the mean measurement vector for class i and vi is including angular second moment (asm), contrast (con), the covariance matrix of class i for bands k through l. correlation (cor), entrophy (ent), and homogeneity (hom)."
7,"therefore, to assign the measurement vector x of an unknown the homogeneity (hom) texture extraction algorithm pixel to a class, the maximum likelihood decision rule (jensen, 2005; puissant, 2005) was selected for this project: computed the value pi for each class."
7,"it assigned the pixel to the class that had the largest (or maximum) value (jensen, quantk quantk 1 2005)."
7,"hom = ∑ ∑—————× 2 hc (i,j) i=0 j=0 1+(i-j) isodata where, unsupervised classification (clustering) involves quantk is the quantization level of band k (e.g., 28 = 0 to numerical operations that search for natural groupings of the 255) and hc(i, j) = the (i, j)th entry in one of the angular spectral properties of pixels in multispectral feature space."
8,unsupervised classification normally requires only a minimal different size polygons.
8,this is referred to as multi-resolution amount of initial input from the analyst because clustering or multi-level image segmentation.
8,the most detailed does not normally require training data.
8,"the clustering process polygons at the lowest segmentation level can be aggregated results in a classification map consisting of m spectral classes. and share the topological characteristics of more general the analyst must then assign a posteriori (after the fact) the polygons at the highest segmentation level (e.g., wulder et spectral classes to thematic information classes (e.g., forest, al., 2004; lamar et al., 2005). sugarcane, citrus, bare soil)."
8,the object-oriented image segmentation and classification isodata (self-organizing data analysis technique) is process involved several steps: one of the most heavily used clustering algorithms.
8,it is 1.
8,"multi-resolution image segmentation: a hierarchical based on heuristic (rules of thumb) procedures incorporated network of image objects was created using multi- into an iterative classification algorithm (stow et al., 2003; resolution image segmentation logic."
8,"the 2003 landsat 7 rees et al., 2003)."
8,"isodata is a modification of the k- etm+ data and the landsat tm 2005 data were segmented means clustering algorithm, which includes a) merging clusters to levels 5 and 10."
8,the spot 2004 data were segmented if their separation distance in multispectral feature space is to levels 10 and 25.
8,"examples of the image segmentation below a user-specified threshold, and b) rules for splitting a process applied to the 2004 spot data are found in single cluster into two clusters."
8,isodata is iterative because figure 4.
8,"the segmentation was based on color/shape and it makes many passes through the remote sensing dataset smoothness/compactness criteria: until specified results are obtained, instead of just two passes • color/shape: this parameter controlled the importance typically used in the chain clustering method (jensen, 2005). of color vs. shape homogeneity during object (i.e., isodata was selected for use in this study because it does polygon patch) creation."
8,"the higher the shape criteria, not allocate its initial mean vectors based on the analysis of the less spectral homogeneity influenced object pixels in the first line of data as in common using typical two- generation."
8,color was 0.9 and shape was 0.1 in this pass clustering algorithms.
8,"rather, an initial assignment of study. all cmax clusters takes place along an n-dimensional vector • smoothness/compactness: when the shape criterion is that runs between very specific points in feature space defined > 0, the user can determine whether objects become using the mean, µk, and standard deviation, σk, of each band . more compact (fringed) or smooth."
8,the smoothness this method of automatically seeding the original cmax vectors parameter was 0.8 and the compactness parameter was makes sure that the first few lines of data do not bias the 0.2 in this study. creation of clusters.
8,the location of the initial cmax mean 2.
8,"collecting training data: the class (e.g., sugarcane, citrus, vectors migrate to partition the feature space better during forest) of several of the polygons (patches) in the segmented multiple passes through the dataset. images was known based on ground reference information."
8,"it was common for the analyst to generate n clusters (e.g., these polygons were identified in the remote sensor data 30) and have no confidence in labeling q of them (e.g., 7) to in a supervised manner and used as training data."
8,the an appropriate information class.
8,"when this occurred, the shape, color, and texture properties of the training data analyst performed cluster busting."
8,"first, all the pixels were extracted."
8,"linear and/or very small features such as associated with the q clusters (e.g., 10) that were difficult to roads, water and wind breaks were collected using the label (e.g., clusters 13, 45, 92) were recoded to a value of 1 lower-level (more detailed) segmented images."
8,more and a binary mask file was created.
8,"a mask program was then geographically extensive classes such as sugarcane, citrus, run using a) the binary mask file, and b) the original remote forest, bushveld, water, banana, paw-paw and vegetables sensor data file."
8,the output of the mask program was a new were collected using the upper-level segmented image. multi-band image file consisting of only the pixels that could 3.
8,classification: individual polygons in the imagery were not be adequately labeled during the initial unsupervised then classified using the training data and fuzzy classification.
8,"the analyst then performed a new unsupervised membership functions. classification on this file, requesting an additional n clusters."
8,"extracting land cover classes (e.g., road, water and wind the analyst displayed these clusters using standard techniques breaks) from lower-level classification images to upper- and labeled as many of these new clusters as possible (e.g., level classification image."
8,"sometimes, there were still some clusters that could not 5."
8,exporting the upper-level classification image as raster be labeled which required the process to be reiterated. format for further analyses.
8,"object-oriented image segmentation classification mixture-tuned matched filtering multi-resolution segmentation is the process of identifying mixture-tuned matched filtering (mtmf) classification meaningful homogeneous polygonal objects (i.e., patches) was applied to the percent reflectance multispectral images. in remote sensor data."
8,"each homogeneous object contains mtmf is a hybrid method based on a combination of linear unique color, shape and texture properties."
8,these properties mixture theory and matched filtering.
8,"a matched filtering is can be used to classify each homogeneous patch to a land a type of spectral mixture analysis, which uses “partial cover class."
8,"each original remote sensing dataset was first unmixing” with user-defined targets (williams and hunt, decomposed into several perfectly registered datasets with 2002)."
8,the reflectance data for each date (6 bands for 2003 11
9,and 2005 landsat data and 4 bands for 2004 spot data) were processed using a minimum noise fraction (mnf) transformation.
9,examination of the eigenvalues and the spatial information contained in the mnf transformed images suggested that all mnf transforms be used in the analysis.
9,visual interpretation allowed extraction of reference point samples for each land cover class from the three dates of imagery using the high spatial resolution orthophotos and the polygonal ground reference data created from the orthophotographs.
9,these samples were then compared to pure pixels derived using a pixel purity index (ppi) analysis of the mnf imagery in n-dimensional feature space (scatterplots).
9,this resulted in two or three pixels to be regarded as pure endmember for each land cover class from the three dates of mnf imagery.
9,the image- derived endmembers were then used in the mtmf analysis.
9,"the output from the mtmf analysis was a dataset consisting of score images showing the relative subpixel abundance of each land cover class, and infeasibility images."
9,"ideally, pixels with a high score value and a low infeasibility value have a high percent cover of each land cover, while those with high infeasibility values were not classified as the corresponding land cover."
9,"pixels with high score values and high infeasibility values may be false alarms, therefore, they were rejected."
9,"most of the study area was sugarcane, citrus, and bushveld, while banana, paw-paw, and vegetable occupied small portions of the study area."
9,"this a prior knowledge allowed figure 4 examples of a portion of the 2004 spot data processed using object- weights to be applied to the major land cover oriented image segmentation. a) level 10 image segmentation. b) level 25 classes by assigning different thresholds of image segmentation, c) level 40 image segmentation, and d) level 60 image segmentation. infeasibility to each land cover (i.e., allow higher infeasibility values for sugarcane and citrus, and limit minor classes to low infeasibility values)."
9,"using these thresholds, each pixel was assigned the land cover class having the highest score."
9,it was also possible to make maps showing the proportion of any endmember in each pixel which can be of value.
9,"results and discussion selected digital image processing algorithms + were used to classify land cover in landsat etm , spot, and landsat tm data in 2003, 2004, and 2005, respectively."
9,this section describes the accuracy of these classifications.
9,accuracy assessment figure 5 spatial distribution of the 2004 ground reference point centroids overlaid on the ground reference points used to determine the orthophotography.
9,the points surrounding the centroids were used to classification accuracy were uniformly distributed assess the accuracy of the 2004 spot classifications (refer to figure 3).
10,table 3 results o a paired t-tested to determine if there was a significant difference between classifications performed using original brightness values versus radiometrically corrected remote sensor data.
10,paired samples test paired differences 95% confidence interval of the std.
10,error difference mean deviation mean lower upper t df sig. (2-tailed) pair all_radiance- -2.40381 5.14317 1.12233 -4.74495 -.06267 -2.142 20 .045 1 all_reflectance table 4 results of a paired t-test to determine if there was a significant difference between classification accuracy reported using original pixels versus the classification accuracy reported after applying a 3 × 3 majority filter to the original classificatin.
10,paired samples test paired differences 95% confidence interval of the std.
10,error difference mean deviation mean lower upper t df sig. (2-tailed) pair reflectance_pixel- -2.928895 2.247761 .515672 -4.012281 -1.845508 -5.680 18 .000 1 reflectance_filtered throughout the study area in fields with a minimum dimension per-pixel versus majority filtering classification results of ≥100 m using the logic shown in figure 3.
10,"the 2003, many decision support systems that incorporate remote 2004, and 2005 accuracy assessments were based on 2680, sensing-derived land cover information routinely apply a 2682, and 2605 ground reference points, respectively."
10,"for majority filter to the output from a per-pixel classification. example, figure 5 depicts all of the 2004 ground reference it is important to know whether or not this is of value. points overlaid on the 2004 spot panchromatic data."
10,"this therefore, each of the per-pixel maximum-likelihood, represents one of the most accurate and comprehensive sets isodata, and mixture-tuned matched filtering classification of ground reference information ever used in a remote sensing maps were post-processed using a 3 x 3 majority filter."
10,a t- investigation.
10,accuracy assessment contingency tables for test with 19 paired observations revealed that there was a all of the classifications can be obtained at ftp://130.184.70/ significant (0.000) difference between the per-pixel and the arc/.
10,the most important contingency tables with their majority filtered classification maps.
10,"the majority filtered associated accuracy (producer’s, consumer’s and overall) maps were 2.9% more accurate than the original per-pixel and kappa coefficient of agreement are presented in this classification maps when compared to ground reference section. information (table 4)."
10,"a graph of all 19 pairs plus the results of the image segmentation classifications (which are radiometric calibration results already composed of homogeneous polygons of pixels) is all of the maximum likelihood, isodata, and object- found in figure 6."
10,"all of the classification accuracy statistics oriented image segmentation classifications were performed that follow are based on the use of a majority filter except for using both the object-oriented image segmentation classification which • original 8-bit brightness values, and was not filtered because the process automatically produced • scaled percent reflectance data. homogeneous patches (polygons)."
10,"a t-test with 21 paired observations (based on analysis of isodata, maximum-likelihood, and object-oriented image maximum-likelihood per-pixel classification results segmentation classifications) revealed that there was a the results of the 16 supervised maximum likelihood significant (0.045) difference between the overall filtered classifications are summarized in table 5."
10,maximum- classification accuracy achieved when using the original likelihood classification yielded the most inaccurate results. brightness values versus percent reflectance data (table 3).
10,the most accurate maximum-likelihood classification was classifications based on percent reflectance data were on obtained using the 2003 landsat 7 etm+ multispectral average 2.4% more accurate than those based on original reflectance (30 x 30 m) data (overall accuracy = 50.26%; brightness values.
10,kappa = 36.31%).
10,the contingency table for this classification 13
11,is found in table 6.
11,"the most accurate classification using and citrus were 94.46% and 93.82%, respectively while the the 2004 spot data was based on the use of multispectral, producer’s accuracies were 93.55% and 86.31%, respectively. panchromatic, and image-derived homogeneity texture this is the only classification technique that successfully information (overall accuracy = 49.92%; kappa = 36.45%). identified banana fields (user’s accuracy = 87%; producer’s the most accurate classification using 2005 landsat 5 tm accuracy = 93.75%)."
11,"the classification map is shown in data was based on multispectral, panchromatic, and image- figure 7."
11,it lacks the salt and pepper noise associated with derived homogeneity texture information (overall accuracy typical per-pixel classifications because the map is based on = 42.65%; kappa = 31.72%). the classification of homogeneous polygons of pixels rather than individual pixels.
11,"isodata per-pixel classification results the object-oriented image segmentation classification the results of the 16 unsupervised isodata based on using spot multispectral data alone (i.e., no classifications are summarized in table 5."
11,"isodata classification yielded improved results when compared with the maximum-likelihood classifications, but were still disappointing."
11,the most accurate classification was achieved using spot 2004 multispectral (10 x 10 m) reflectance data (overall accuracy = 73.53%; kappa = 60.81%).
11,the contingency table for this classification is found in table 7.
11,"+ the most accurate classification using 2003 landsat 7 etm data was based on the use of reflectance multispectral, panchromatic, and homogeneity texture data (overall accuracy = 69.07%; kappa = 53.33%)."
11,the most accurate classification using 2005 landsat 5 tm data was based on the use of reflectance multispectral and derived homogeneity texture data (overall accuracy = 70.67%; kappa = 57.47%).
11,object-oriented image segmentation classification results the object-oriented image segmentation classification methodology yielded the most accurate classification maps of the investigation.
11,the most accurate object-oriented segmentation classification was obtained using spot 2004 combined multispectral radiance (10 x 10 m) and panchromatic (5 x 5 m) data (overall accuracy = 89.41%; kappa = 83.7%).
11,the contingency table for this classification figure 6 results of applying a majority filter to per-pixel classifications is found in table 8.
11,note that the user’s accuracy for sugarcane derived from percent reflectance data.
11,figure 7 classification map derived using 2004 spot multispectral and panchromatic radiance data and object-oriented image segmentation.
11,this was the most accurate classification.
12,table 5 overall classification accuracy of the different methods (kappa coefficient of agreement is in parenthesis).
12,"these results were obtained after applying a 3 × 3 majority filter to the original classifications, except for object-oriented segmenation classifications."
12,+ radiometric classification algorithm etm spot tm analyst preprocessing and features used 2003 2004 2005 isodata 1 58.3 56.67 56.24 ms (42.92) (41.48) (41.28) 8-bit ms+pan 65.32 58.87 no pan band (49.83) (41.57) ms+pan+texture (homogeneity from pan) 63.52 64.54 59.88 (47.18) (47.51) (45.67) 66.68 73.53 59.15 ms (51.16) (60.81) (44.71) reflectance 66.53 70.73 no pan band ms+pan (51.39) (57.09) 69.07 64.54 70.67 ms+pan+texture (homogeneity from pan) (53.33) (47.48) (57.47) maximum-likelihood 2 50.15 48.06 41.46 ms (36.19) (34.62) (30.60) 8-bit 48.54 47.35 ms+pan (34.70) (34.17) no pan band 48.21 49.92 42.65 ms+pan+texture (homogeneity from pan) (34.42) (36.45) (31.72) 50.26 46.60 41.38 ms (36.31) (33.19) (30.57) reflectance ms+pan 48.32 46.12 (34.46) (32.97) no pan band 47.56 48.88 41.57 ms+pan+texture (homogeneity from pan) (33.89) (35.41) (30.66) object-oriented 3 82.01 85.33 84.26 ms (73.22) (78.15) 8-bit 85.71 89.41 ms+pan (78.00) (83.68) no pan band 81.53 85.38 84.30 ms (72.60) (78.99) (76.15) reflectance 85.41 89.11 ms+pan (77.60) (83.24) no pan band matched-filtering 4 66.38 59.09 65.07 reflectance ms (50.17) (42.55) (49.70) panchromatic band) also yielded impressive results (overall kappa = 78%).
12,the most accurate 2005 landsat 5 tm accuracy = 85.53%; kappa = 78.14%).
12,the contingency classification was based on multispectral reflectance data table for this classification is found in table 9.
12,this suggests (overall accuracy = 84.30%; kappa = 76.15%).
12,"it was not that it might be possible to obtain acceptable results using necessary to investigate the usefulness of incorporating texture just the multispectral spot data without the added expense information in the object-oriented image segmentation of purchasing the panchromatic band. classifications because the algorithm already computes and the most accurate image segmentation classification using incorporates texture information through the shape, + 2003 landsat 7 etm data was produced using multispectral smoothness, and compactness parameters previously and panchromatic radiance data (overall accuracy = 85.71%; discussed."
13,+ table 6 maximum-likelihood classification of 2003 landsat 7 etm multispectral reflectance (30 × 30 m) data.
13,class\ref sugarcane citrus forest bushveld roads water bare soil/fallow windbreaks banana row total user’s accuracy (%) sugarcane 857 14 1 0 6 0 0 3 18 899 95.328 citrus 3 263 27 1 0 0 0 21 0 315 83.492 forest 0 19 36 3 0 0 0 1 0 59 61.017 bushveld 4 43 12 58 0 0 1 0 1 119 48.739 roads 207 359 12 33 39 12 22 10 17 711 5.485 water 0 0 0 0 0 34 0 0 0 34 100 bare soil/fallow 45 73 0 4 0 0 31 1 2 156 19.872 windbreaks 0 27 6 2 0 0 0 7 0 42 16.667 banana 236 62 7 2 5 4 0 7 22 345 6.377 column total 1352 860 101 103 50 50 54 50 60 2680 producer’s accuracy (%) 63.388 30.58 35.644 56.311 78 68 57.407 14 36.667 overall accuracy (%) 50.261 kappa coefficient 0.36313 table 7 isodata classification of spot 2004 using only multispectral reflectance (10 × 10 m) data.
13,class\ref sugarcane citrus forest bushveld roads water bare soil/fallow windbreaks banana row total user’s accuracy (%) sugarcane 1086 55 2 3 14 3 2 3 9 1177 92.268 citrus 103 624 15 3 1 1 4 11 34 796 78.392 forest 0 23 54 2 0 0 0 0 0 79 68.354 bushveld 112 128 30 87 3 1 9 15 6 391 22.251 roads 10 2 0 0 19 2 2 0 2 37 51.351 water 1 0 0 0 1 43 5 0 0 50 86 bare soil/fallow 32 26 0 7 12 0 32 1 6 116 27.586 windbreaks 2 1 0 1 0 0 0 20 0 24 83.333 banana 2 3 0 0 0 0 0 0 7 12 58.333 column total 1348 862 101 103 50 50 54 50 64 2682 producer’s accuracy (%) 80.564 72.39 53.465 84.466 38 86 59.259 40 10.938 overall accuracy (%) 73.527 kappa coefficient 0.60815 table 8 object-oriented image segmentation classification of spot 2004 cmbined multispectral radiance (10 × 10 m) and panchromatic (5 × 5 m) data.
13,class\ref sugarcane citrus forest bushveld roads water bare soil/fallow windbreaks banana row total user’s accuracy (%) sugarcane 1261 61 0 4 2 0 1 2 4 1335 94.457 citrus 27 744 5 0 1 2 4 10 0 783 93.821 forest 13 23 87 13 0 2 1 1 0 140 62.143 bushveld 28 25 8 82 1 0 5 0 0 149 55.034 roads 6 1 1 1 45 0 2 1 0 57 78.947 water 0 0 0 0 0 44 2 0 0 46 95.652 bare soil/fallow 7 0 0 2 0 1 39 0 0 49 79.592 windbreaks 2 4 0 0 1 1 0 36 0 44 81.
13,818 banana 4 4 0 1 0 0 0 0 60 69 86.957 column total 1348 862 101 103 50 50 54 50 64 2682 producer’s accuracy (%) 93.546 86.311 86.139 79.612 90 88 72.222 72 93.75 overall accuracy (%) 89.411 kappa coefficient 0.83676 16
14,table 9 object-oriented image segmentation classification of spot 2004 using only multispectral radiance (10 × 10 m) data.
14,class\ref sugarcane citrus forest bushveld roads water bare soil/fallow windbreaks banana row total user’s accuracy (%) sugarcane 1232 59 0 5 2 1 0 1 4 1304 94.479 citrus 36 669 6 0 1 0 1 9 0 722 92.659 forest 13 44 85 13 0 2 1 2 0 160 53.125 bushveld 42 38 8 81 1 0 6 0 0 176 46.023 roads 4 9 1 1 45 0 2 1 0 63 71.429 water 0 0 0 0 0 43 2 0 0 45 95.556 bare soil/fallow 14 21 0 2 0 3 42 0 0 82 51.22 windbreaks 3 18 1 0 1 1 0 37 0 61 60.656 banana 4 4 0 1 0 0 0 0 60 69 86.957 column total 1348 862 101 103 50 50 54 50 64 2682 producer’s accuracy (%) 91.395 77.61 158 78.641 90 86 77.778 74 93.75 overall accuracy (%) 85.533 kappa coefficient 0.78145 + table 10 mixture-tuned matched filtering classification of 2003 landsat etm using only multispectral reflectance (30 × 30 m) data.
14,"class\ref sugarcane citrus forest bushveld roads water bare soil/fallow windbreaks banana row total user’s accuracy (%) sugarcane 1031 27 1 3 20 2 8 5 7 1104 93.388 citrus 164 575 53 11 11 12 2 45 46 919 62.568 forest 2 52 20 3 1 0 1 0 0 79 25.316 bushveld 62 106 27 84 12 0 7 0 4 302 27.815 roads 9 20 0 2 2 0 5 0 0 38 5.263 water 6 0 0 0 1 36 0 0 0 43 83.721 bare soil/fallow 77 80 0 0 3 0 31 0 3 194 15.979 windbreaks 0 0 0 0 0 0 0 0 0 0 0 banana 1 00 0 0 0 0 0 0 0 1 0 column total 1352 860 101 103 50 50 54 50 60 2880 producer’s accuracy (%) 76.257 66.86 19.802 81.553 4 72 57.407 0 0 overall accuracy (%) 66.381 kappa coefficient 0.50169 mixture-tuned matched filtering classification results summary the mixture-tuned matched filtering classification was based on the use of multispectral data (i.e., panchromatic the goal of this project was to assist the republic of data were not used)."
14,the landsat 5 thematic mapper and south africa department of water affairs and forestry to the landsat 7 enhanced thematic mapper plus (etm+) identify a cost-effective methodology to accurately measure have greater spectral resolution than the spot multispectral and monitor agricultural land use for national water act sensor system.
14,"therefore, it was not surprising that the water management purposes."
14,"the most accurate results were mixture-tuned matched filtering algorithm achieved its best obtained using object-oriented image segmentation results using the 2003 and 2005 landsat reflectance data techniques applied to spot multispectral and panchromatic (overall accuracy = 66.38% and 65.07%, respectively; kappa data (overall accuracy = 89.41%)."
14,"accurate classifications = 50.17% and 49.70%, respectively)."
14,the contingency table were also obtained using just the spot multispectral data for the 2003 classification is found in table 10.
14,mixture- (85.33%).
14,"when applied to landsat etm+ and tm data in tuned matched filtering classification of the 2004 spot data 2003 and 2005, the image segmentation approach out- achieved an overall accuracy of 59.09% and a kappa of 42. performed all other algorithms yielding classification 55%. accuracies of 85.71% and 84.30%, respectively."
14,this is 17
15,"important because landsat tm type data cover more jensen, j."
15,"r., 2005, introductory digital image processing: a remote geography (e.g., 185 x 185 km) than spot data (e.g., 60 x sensing perspective."
15,"upper saddle river: prentice-hall, 525 p. 2 60 km) and are more economical per km ."
