page,p
13,"an interesting finding is that compared with the situation where at least one provider is low risk-averse, the pricings and profits of two providers are relatively lower in this case."
13,this further illustrates the possible beneficial effect of low risk aversion and possible adverse effect of high risk aversion for providers.
13,7 | c o n cl u s i o n s this study developed the pricing techniques for data products in a neutrosophic circumstance.
13,"the main advantages of the proposed methods include: first, pricing models were built according to different game settings so that the effects of power structures can be observed."
13,"second, neutrosophic variables were adopted to express the uncertainty of problem parameters (such as consumer demand and elasticity coefficients)."
13,"compared with fuzzy variables or neutrosophic sets, neutrosophic variables provide a more convenient and accessible way for players to suffi- ciently convey ambiguous perceptions."
13,"third, the limited rationality of decision makers were considered based on the optimistic value of neutrosophic variables."
13,the optimistic value theory can reflect the risk aversion behaviours of players by calculating the optimistic value of pro- viders' profits in a certain confidence level.
13,"then, numerical instances were provided after the equilibrium solutions of pricing models were derived."
13,"finally, the impacts of power structures, problem parameters and confidence levels on pricing results were investigated with full sensitiv- ity analyses."
13,"however, there are still some limitations."
13,"for example, the demand function should be improved in the future because it is not always a linear expression with respect to price."
13,"second, only two players were included in the proposed game model, n-person game scenarios will be investi- gated in the future."
13,"moreover, the proposed methods can be modified according to the specific features of other optimization problems for better resolving those issues."
13,"acknowledgemen ts this work was supported by the graduate research and innovation projects of hunan province (cx20190045), and the national natural science foundation of china (61773120)."
13,the first author is supported by china scholarship council (201903170185).
13,conf lict of in te re st the authors declare no conflict of interest.
14,"14680394, 2021, 5, downloaded from https://onlinelibrary.wiley.com/doi/10.1111/exsy.12697 by university of california, wiley online library on [04/10/2024]."
14,see the terms and conditions (https://onlinelibrary.wiley.com/terms-and-conditions) on wiley online library for rules of use; oa articles are governed by the applicable creative commons license 14 of 30 luo and xing author contributions suizhi luo and lining xing conceived and worked together to achieve this work.
14,suizhi luo wrote the paper and lining xing made contribution to the case study.
14,data avai lab ility s tatement data sharing is not applicable to this article as no new data were created or analyzed in this study.
14,"orcid suizhi luo https://orcid.org/0000-0001-9258-5293 lining xing https://orcid.org/0000-0002-6983-4244 re fe r enc e s abdel-basset, m., ali, m., & atef, a."
14,(2020).
14,uncertainty assessments of linear time-cost tradeoffs using neutrosophic set.
14,"computers & industrial engineer- ing, 141, 106286. https://doi.org/10.1016/j.cie.2020.106286 alamdar, s."
14,"f., rabbani, m., & heydari, j."
14,(2018).
14,"pricing, collection, and effort decisions with coordination contracts in a fuzzy, three-level closed-loop sup- ply chain."
14,"expert systems with applications, 104, 261–276."
14,"al-mousa, a., & faza, a."
14,(2019).
14,a fuzzy-based customer response prediction model for a day-ahead dynamic pricing system.
14,"sustainable cities and society, 44, 265–274."
14,"an, j."
14,"j., & li, d."
14,(2019).
14,a linear programming approach to solve constrained bi-matrix games with intuitionistic fuzzy payoffs.
14,"international journal of fuzzy systems, 21(3), 908–915."
14,"brikaaa, m."
14,"g., ammarc, e."
14,"s., & zhenga, z."
14,(2019).
14,solving bi-matrix games in tourism planning management under rough interval approach.
14,"international journal of mathematical sciences and computing, 4, 44–62."
14,"charwand, m., & gitizadeh, m."
14,(2018).
14,optimal tou tariff design using robust intuitionistic fuzzy divergence based thresholding.
14,"energy, 147, 655–662."
14,"de, s."
14,"k., nayak, p."
14,"k., khan, a., bhattacharya, k., & smarandache, f."
14,(2020).
14,solution of an epq model for imperfect production process under game and neutrosophic fuzzy approach.
14,"applied soft computing, 93, 106397. https://doi.org/10.1016/j.asoc.2020.106397 feng, c., li, z., shahidehpour, m., wen, f., & li, q."
14,(2020).
14,stackelberg game based transactive pricing for optimal demand response in power distribution systems.
14,"international journal of electrical power & energy systems, 118, 105764. https://doi.org/10.1016/j.ijepes.2019.105764 jafarian, e., razmi, j., & tavakkoli-moghaddam, r."
14,(2019).
14,forward and reverse flows pricing decisions for two competing supply chains with common col- lection centers in an intuitionistic fuzzy environment.
14,"soft computing, 23(17), 7865–7888."
14,"jamali, m."
14,"b., & rasti-barzoki, m."
14,(2018).
14,a game theoretic approach for green and non-green product pricing in chain-to-chain competitive sustainable and regular dual-channel supply chains.
14,"journal of cleaner production, 170, 1029–1043."
14,"ji, s., zhang, z., zhang, c., wei, s., lu, m., & duan, y."
14,(2020).
14,learning discriminative spatiotemporal features for precise crop classification from multi- temporal satellite images.
14,"international journal of remote sensing, 41(8), 3162–3174."
14,"liu, b."
14,"d., & liu, b."
14,(2009).
14,theory and practice of uncertain programming (vol.
14,berlin: springer.
14,"liu, s., & xu, z."
14,(2014).
14,stackelberg game models between two competitive retailers in fuzzy decision environment.
14,"fuzzy optimization and decision making, 13(1), 33–48."
14,"liu, y., derakhshani, m., parsaeefard, s., lambotharan, s., & wong, k."
14,(2018).
14,antenna allocation and pricing invirtualized massive mimo networks via stackelberg game.
14,"ieee transactions on communications, 66(11), 5220–5234."
14,"long, h."
14,"v., ali, m., khan, m., & tu, d."
14,(2019).
14,a novel approach for fuzzy clustering based on neutrosophic association matrix.
14,"computers & industrial engineering, 127, 687–697."
14,"ma, p., zhang, c., hong, x., & xu, h."
14,(2018).
14,pricing decisions for substitutable products with green manufacturing in a competitive supply chain.
14,"journal of cleaner production, 183, 618–640."
14,"pamucar, d., yazdani, m., obradovic, r., kumar, a., & torres-jiménez, m."
14,(2020).
14,a novel fuzzy hybrid neutrosophic decision-making approach for the resil- ient supplier selection problem.
14,"international journal of intelligent systems, 35(12), 1934–1986."
14,"pramanik, s., & roy, t."
14,(2014).
14,neutrosophic game theoretic approach to indo-pak conflict over jammu-kashmir.
14,"neutrosophic sets and systems, 2(1), 82–101."
14,"safarzadeh, s., rasti-barzoki, m., hejazi, s."
14,"r., & piran, m."
14,(2020).
14,a game theoretic approach for the duopoly pricing of energy-efficient appliances regarding innovation protection and social welfare.
14,"energy, 200, 117517. https://doi.org/10.1016/j.energy.2020.117517 samrandache, f."
14,(1999).
14,a unifying field in logics.
14,"neutrosophy: neutrosophic probability, set and logic, rehoboth."
14,"taleizadeh, a."
14,"a., akhavizadegan, f., & ansarifar, j."
14,(2019).
14,pricing and quality level decisions of substitutable products in online and traditional selling chan- nels: game-theoretical approaches.
14,"international transactions in operational research, 26(5), 1718–1751."
14,"taleizadeh, a."
14,"a., mamaghan, m."
14,"k., & torabi, s."
14,(2020).
14,"a possibilistic closed-loop supply chain: pricing, advertising and remanufacturing optimization."
14,"neural computing and applications, 32(4), 1195–1215."
14,"tan, c., yi, w., & chen, x."
14,(2018).
14,bertrand game under a fuzzy environment.
14,"journal of intelligent & fuzzy systems, 34(4), 2611–2624."
14,"tang, m., & li, z."
14,(2020).
14,a novel uncertain bimatrix game with hurwicz criterion.
14,"soft computing, 24(4), 2441–2446."
14,"wang, h., smarandache, f., zhang, y., & sunderraman, r."
14,(2010).
14,single valued neutrosophic sets.
14,infinite study.
14,"wang, l., & li, n."
14,(2020).
14,pythagorean fuzzy interaction power bonferroni mean aggregation operators in multiple attribute decision making.
14,"international journal of intelligent systems, 35(1), 150–183."
14,"yan, n., liu, y., xu, x., & he, x."
14,(2020).
14,strategic dual-channel pricing games with e-retailer finance.
14,"european journal of operational research, 283(1), 138–151."
14,"yang, d., & xiao, t."
14,(2017).
14,pricing and green level decisions of a green supply chain with governmental interventions under fuzzy uncertainties.
14,"journal of cleaner production, 149, 1174–1187."
15,"14680394, 2021, 5, downloaded from https://onlinelibrary.wiley.com/doi/10.1111/exsy.12697 by university of california, wiley online library on [04/10/2024]."
15,"see the terms and conditions (https://onlinelibrary.wiley.com/terms-and-conditions) on wiley online library for rules of use; oa articles are governed by the applicable creative commons license luo and xing 15 of 30 yang, x., & gao, j."
15,(2017).
15,bayesian equilibria for uncertain bimatrix game with asymmetric information.
15,"journal of intelligent manufacturing, 28(3), 515–525."
15,"zeng, b., zhang, c., hu, p., & wang, s."
15,(2017).
15,spectrum sharing based on a bertrand game in cognitive radio sensor networks.
15,"sensors, 17(1), 101. https:// doi.org/10.3390/s17010101 zhang, l."
15,"l., gang, d."
15,"u., jun, w."
15,"u., & yujie, m."
15,(2020).
15,"joint production planning, pricing and retailer selection with emission control based on sta- ckelberg game and nested genetic algorithm."
15,"expert systems with applications, 161, 113733. https://doi.org/10.1016/j.eswa.2020.113733 author biographi es suizhi luo received the ms degree in management science and engineering from central south university, hunan, china."
15,"she is now pursu- ing her phd degree in management science and engineering in college of systems engineering at national university of defense technology, hunan, china."
15,"her current research interests include product pricing theory and method, intelligent optimization algorithms, data mining, deci- sion analysis under uncertainty."
15,"lining xing received the phd degree in management science and engineering from national university of defense technology, hunan, china."
15,he is currently a professor at the college of systems engineering of national university of defense technology.
15,"his current research interests include intelligent optimization algorithms, resource planning and task scheduling."
15,"how to cite this article: luo s, xing l."
15,neutrosophic game pricing methods with risk aversion for pricing of data products.
15,expert systems. 2021;38:e12697. https://doi.org/10.1111/exsy.12697
16,"14680394, 2021, 5, downloaded from https://onlinelibrary.wiley.com/doi/10.1111/exsy.12697 by university of california, wiley online library on [04/10/2024]."
16,see the terms and conditions (https://onlinelibrary.wiley.com/terms-and-conditions) on wiley online library for rules of use; oa articles are governed by the applicable creative commons license luo and xing ^1 . (d) α-optimistic f i g u r e a 1 influences of c1 under two game scenarios. (a) values of z1*. (b) values of z2*. (c) α-optimistic values of p ^2 ^1 + p ^2 . (e) α-optimistic values of p appendix a values of p 16 of 30
17,"14680394, 2021, 5, downloaded from https://onlinelibrary.wiley.com/doi/10.1111/exsy.12697 by university of california, wiley online library on [04/10/2024]."
17,see the terms and conditions (https://onlinelibrary.wiley.com/terms-and-conditions) on wiley online library for rules of use; oa articles are governed by the applicable creative commons license 17 of 30 ^1 . (d) α-optimistic f i g u r e a 2 influences of c2 under two game scenarios. (a) values of z1*. (b) values of z2*. (c) α-optimistic values of p (b) (d) ^2 ^1 + p (e) ^2 . (e) α-optimistic values of p luo and xing values of p (a) (c)
18,"14680394, 2021, 5, downloaded from https://onlinelibrary.wiley.com/doi/10.1111/exsy.12697 by university of california, wiley online library on [04/10/2024]."
18,see the terms and conditions (https://onlinelibrary.wiley.com/terms-and-conditions) on wiley online library for rules of use; oa articles are governed by the applicable creative commons license luo and xing ^1 . (d) α-optimistic ^1 under two game scenarios. (a) values of z1*. (b) values of z2*. (c) α-optimistic values of p (b) (d) ^2 ^1 + p ^2 . (e) α-optimistic values of p (e) f i g u r e a 3 influences of d values of p 18 of 30 (a) (c)
19,"14680394, 2021, 5, downloaded from https://onlinelibrary.wiley.com/doi/10.1111/exsy.12697 by university of california, wiley online library on [04/10/2024]."
19,see the terms and conditions (https://onlinelibrary.wiley.com/terms-and-conditions) on wiley online library for rules of use; oa articles are governed by the applicable creative commons license 19 of 30 ^1 . (d) α-optimistic ^2 under two game scenarios. (a) values of z1*. (b) values of z2*. (c) α-optimistic values of p (b) (d) ^2 ^1 + p (e) ^2 . (e) α-optimistic values of p f i g u r e a 4 influences of d luo and xing values of p (a) (c)
20,"14680394, 2021, 5, downloaded from https://onlinelibrary.wiley.com/doi/10.1111/exsy.12697 by university of california, wiley online library on [04/10/2024]."
20,see the terms and conditions (https://onlinelibrary.wiley.com/terms-and-conditions) on wiley online library for rules of use; oa articles are governed by the applicable creative commons license luo and xing ^1 . (d) α-optimistic f i g u r e a 5 influences of ^e1 under two game scenarios. (a) values of z1*. (b) values of z2*. (c) α-optimistic values of p (b) (d) ^2 ^1 + p ^2 . (e) α-optimistic values of p (e) values of p 20 of 30 (a) (c)
21,"14680394, 2021, 5, downloaded from https://onlinelibrary.wiley.com/doi/10.1111/exsy.12697 by university of california, wiley online library on [04/10/2024]."
21,see the terms and conditions (https://onlinelibrary.wiley.com/terms-and-conditions) on wiley online library for rules of use; oa articles are governed by the applicable creative commons license 21 of 30 ^1 . (d) α-optimistic f i g u r e a 6 influences of ^e2 under two game scenarios. (a) values of z1*. (b) values of z2*. (c) α-optimistic values of p (b) (d) values of p2 . (e) α-optimistic values of p1 + p2 ^ (e) ^ luo and xing ^ (a) (c)
22,"14680394, 2021, 5, downloaded from https://onlinelibrary.wiley.com/doi/10.1111/exsy.12697 by university of california, wiley online library on [04/10/2024]."
22,see the terms and conditions (https://onlinelibrary.wiley.com/terms-and-conditions) on wiley online library for rules of use; oa articles are governed by the applicable creative commons license luo and xing ^1 . (d) α-optimistic values f i g u r e a 7 influences of g^ under two game scenarios. (a) values of z1*. (b) values of z2*. (c) α-optimistic values of p (b) (d) (e) of p2 . (e) α-optimistic values of p1 + p2 ^ ^ 22 of 30 (a) (c) ^
23,"14680394, 2021, 5, downloaded from https://onlinelibrary.wiley.com/doi/10.1111/exsy.12697 by university of california, wiley online library on [04/10/2024]."
23,"see the terms and conditions (https://onlinelibrary.wiley.com/terms-and-conditions) on wiley online library for rules of use; oa articles are governed by the applicable creative commons license 23 of 30 f i g u r e b 1 influences of (α1 ≤ 0.5, α2 ≤ 0.5) under the bertrand game scenarios. (a) values of z1*. (b) values of z2*. (c) α-optimistic values of (b) (d) ^2 ^1 + p ^2 . (e) α-optimistic values of p (e) ^1 . (d) α-optimistic values of p appendix b luo and xing (a) (c) p"
24,"14680394, 2021, 5, downloaded from https://onlinelibrary.wiley.com/doi/10.1111/exsy.12697 by university of california, wiley online library on [04/10/2024]."
24,"see the terms and conditions (https://onlinelibrary.wiley.com/terms-and-conditions) on wiley online library for rules of use; oa articles are governed by the applicable creative commons license luo and xing f i g u r e b 2 influences of (α1 ≤ 0.5, α2 ≤ 0.5) under the stackelberg game scenarios. (a) values of z1*. (b) values of z2*. (c) α-optimistic values (b) (d) ^2 ^1 + p ^2 . (e) α-optimistic values of p (e) ^1 . (d) α-optimistic values of p 24 of 30 of p (a) (c)"
25,"14680394, 2021, 5, downloaded from https://onlinelibrary.wiley.com/doi/10.1111/exsy.12697 by university of california, wiley online library on [04/10/2024]."
25,"see the terms and conditions (https://onlinelibrary.wiley.com/terms-and-conditions) on wiley online library for rules of use; oa articles are governed by the applicable creative commons license 25 of 30 f i g u r e b 3 influences of (α1 > 0.5, α2 ≤ 0.5) under the bertrand game scenarios. (a) values of z1*. (b) values of z2*. (c) α-optimistic values of (b) (d) ^2 ^1 + p ^2 . (e) α-optimistic values of p (e) ^1 . (d) α-optimistic values of p luo and xing (a) (c) p"
26,"14680394, 2021, 5, downloaded from https://onlinelibrary.wiley.com/doi/10.1111/exsy.12697 by university of california, wiley online library on [04/10/2024]."
26,"see the terms and conditions (https://onlinelibrary.wiley.com/terms-and-conditions) on wiley online library for rules of use; oa articles are governed by the applicable creative commons license luo and xing f i g u r e b 4 influences of (α1 > 0.5, α2 ≤ 0.5) under the stackelberg game scenarios. (a) values of z1*. (b) values of z2*. (c) α-optimistic values (b) (d) ^2 ^1 + p ^2 . (e) α-optimistic values of p (e) ^1 . (d) α-optimistic values of p 26 of 30 of p (a) (c)"
27,"14680394, 2021, 5, downloaded from https://onlinelibrary.wiley.com/doi/10.1111/exsy.12697 by university of california, wiley online library on [04/10/2024]."
27,"see the terms and conditions (https://onlinelibrary.wiley.com/terms-and-conditions) on wiley online library for rules of use; oa articles are governed by the applicable creative commons license 27 of 30 f i g u r e b 5 influences of (α1 ≤ 0.5, α2 > 0.5) under the bertrand game scenarios. (a) values of z1*. (b) values of z2*. (c) α-optimistic values of (b) (d) ^2 ^1 + p ^2 . (e) α-optimistic values of p (e) ^1 . (d) α-optimistic values of p luo and xing (a) (c) p"
28,"14680394, 2021, 5, downloaded from https://onlinelibrary.wiley.com/doi/10.1111/exsy.12697 by university of california, wiley online library on [04/10/2024]."
28,"see the terms and conditions (https://onlinelibrary.wiley.com/terms-and-conditions) on wiley online library for rules of use; oa articles are governed by the applicable creative commons license luo and xing f i g u r e b 6 influences of (α1 ≤ 0.5, α2 > 0.5) under the stackelberg game scenarios. (a) values of z1*. (b) values of z2*. (c) α-optimistic values (b) (d) ^2 ^1 + p ^2 . (e) α-optimistic values of p (e) ^1 . (d) α-optimistic values of p 28 of 30 of p (a) (c)"
29,"14680394, 2021, 5, downloaded from https://onlinelibrary.wiley.com/doi/10.1111/exsy.12697 by university of california, wiley online library on [04/10/2024]."
29,"see the terms and conditions (https://onlinelibrary.wiley.com/terms-and-conditions) on wiley online library for rules of use; oa articles are governed by the applicable creative commons license 29 of 30 f i g u r e b 7 influences of (α1 > 0.5, α2 > 0.5) under the bertrand game scenarios. (a) values of z1*. (b) values of z2*. (c) α-optimistic values of (b) (d) ^2 ^1 + p ^2 . (e) α-optimistic values of p (e) ^1 . (d) α-optimistic values of p luo and xing (a) (c) p"
30,"14680394, 2021, 5, downloaded from https://onlinelibrary.wiley.com/doi/10.1111/exsy.12697 by university of california, wiley online library on [04/10/2024]."
30,"see the terms and conditions (https://onlinelibrary.wiley.com/terms-and-conditions) on wiley online library for rules of use; oa articles are governed by the applicable creative commons license luo and xing f i g u r e b 8 influences of (α1 > 0.5, α2 > 0.5) under the stackelberg game scenarios. (a) values of z1*. (b) values of z2*. (c) α-optimistic values (b) (d) ^2 ^1 + p ^2 . (e) α-optimistic values of p (e) ^1 . (d) α-optimistic values of p 30 of 30 of p (a) (c)"
