page,p
1,hazards earth syst.
1,"sci., 11, 643–657, 2011 www.nat-hazards-earth-syst-sci.net/11/643/2011/ natural hazards doi:10.5194/nhess-11-643-2011 and earth © author(s) 2011."
1,cc attribution 3.0 license.
1,system sciences the economic value of drought information for water management under climate change: a case study in the ebro basin s.
1,"quiroga1 , l."
1,"garrote2 , a."
1,"iglesias3 , z."
1,"fernández-haddad1 , j."
1,"schlickenrieder3 , b. de lama2 , c."
1,"mosso4 , and a."
1,"sánchez-arcilla4 1 department of statistics, economic structure and international organization, universidad de alcala, spain 2 department of civil engineering, universidad politecnica de madrid, spain 3 department of agricultural economics and social sciences, universidad politecnica de madrid, spain 4 international centre for coastal research, universidad politecnica de catalunya, spain received: 22 june 2010 – revised: 21 november 2010 – accepted: 22 november 2010 – published: 2 march 2011 abstract."
1,"drought events in the mediterranean are likely 1 introduction to increase in frequency, duration and intensity due to cli- mate change, thereby affecting crop production."
1,"informa- in the water sector, institutions and users, technology and the tion about drought is valuable for river basin authorities economy interact to achieve a balance between water supply and the farmers affected by their decisions."
1,the economic and demand in water resource systems.
1,this balance would value of this information and the resulting decisions are of be maintained if other factors were held constant.
1,"however, interest to these two stakeholder groups and to the infor- even if climatic conditions were stationary, the socioeco- mation providers."
1,"understanding the dynamics of extreme nomic dynamics of the population act as an external driving events, including droughts, in future climate scenarios for force moving systems away from equilibrium."
1,water policy the mediterranean is being improved continuously.
1,this pa- is designed to correct these and other deviations and to allow per analyses the economic value of information on drought the system to regain balance between supply and demand of events taking into account the risk aversion of water man- water resources. agers.
1,we consider the effects of drought management plans climatic change is an additional external force that should on rice production in the ebro river basin.
1,this enables us be considered in this continuously adaptive process.
1,there to compute the willingness to compensate the river basin is an agreement in climate projections that there will be a authority for more accurate information allowing for better significant reduction of natural runoff in the mediterranean decision-making.
1,"if runoff is reduced, river basin planners region, possibly also linked to an intensification of the fre- can consider the reduction of water allocation for irrigation in quency, duration and magnitude of droughts."
1,the effects of order to eliminate the risk of water scarcity.
1,"alternately, river these changes could be devastating in many water resource basin planners may decide to maintain water allocation and systems, which are already approaching the limits of sustain- accept a reduction of water supply reliability, leaving farmers ability under current climatic conditions. exposed to drought events."
1,these two alternatives offer dif- water managers must adopt flexible measures to account ferent risk levels for crop production and farmers’ incomes for climate change in their river basin management plans. which determine the value of this information to the river when faced with the threat of water scarcity due to climate basin authority.
1,"the information is relevant for the revision change, water managers must take into account the uncer- of river basin management plans of the water framework tainty associated with climate projections."
1,"in this paper we directive (wfd) within the context of climate change. analyze the decision-making process of water managers for adaptation to climate change, focusing on the added value provided by climate projections through the concept of risk aversion."
1,we have selected a simplified decision-making problem: correspondence to: s.
1,quiroga implementing demand reduction measures to adapt system (sonia.quiroga@uah.es) demand to water availability under future climate scenarios.
1,published by copernicus publications on behalf of the european geosciences union.
2,644 s.
2,quiroga et al.: the economic value of drought information for water management 2 methods this paper provides an assessment of the economic value of drought information for water management under climate change applied to rice cultivation in the ebro basin.
2,"first, we provide an overview of climate change information about drought events in the mediterranean (2.1)."
2,"this is followed by a description of the climate change adaptation alternatives analysed in this study (2.2), an overview of the case study area (2.3) as well as the water and policy analysis (wapa) model applied (2.4)."
2,"we then discuss the crop production function (2.5), the decision model (2.6) and the calculation of the economic value of information (2.7)."
2,figure 1 outlines the steps of the methodology.
2,steps of methodology.
2,"2.1 climate change information about drought events in the mediterranean traditionally, water managers have designed water resource under all climate change scenarios, water supplies decrease systems to overcome drought situations."
2,"the degree to which and irrigation demand increases in spain (iglesias et al., droughts produce impacts in water resources systems is an- 2007, 2009)."
2,"climate change projections for the region de- alyzed with the help of water resource system models, and rived from a global climate model driven by socio-economic depends on the relationship between available resources and scenarios (iglesias et al., 2009) result in an increase of tem- demands."
2,"system modelers estimate the demand reliability, perature (1.5 ◦ c to 3.6 ◦ c in the 2050s) and precipitation quantified as the probability that a given demand may suffer decreases in most of the territory (about 10 to 20 percent water shortages during a given time horizon."
2,"this reliabil- decreases, depending on the season)."
2,"this indicates an in- ity index is normally used for decision making, identifying creased likelihood of droughts (kerr, 2005) and variability demands that do not comply with a pre-specified minimum of precipitation – in time, space, and intensity – that would standard."
2,"river basin management plans (rbmps) evalu- directly influence water resources availability and river basin ate the cost and effectiveness of different permanent water management. conservation or yield enhancement actions for these demands under normal – non drought – conditions, many areas in and define a program of measures (pom) to correct any re- spain face significant problems due to the unbalanced distri- liability deficit."
2,"in addition, there are other instruments, such bution of water resources, conflicts among users and between as drought management plans (dmps) that focus on drought regions."
2,recurrent drought episodes in the country have led periods and contemplate the temporary water conservation to the intensification of these problems and added to the com- or yield enhancement actions required to overcome a water plexity of water management.
2,"drought events in spain have shortage situation. been more frequent after 1970 (iglesias et al., 2007) with within this framework, if climate projections suggest a economic and social damage increasing from year to year. reduction of water supplies, water managers must decide since the runoff output from the gcms is not adequate for whether to apply demand management measures in order to the analysis, a downscaling technique must be applied."
2,over facilitate adaptation to climate change.
2,"in this case, demand the last few decades, scientists have developed techniques of reduction should focus on economic water uses like irrigation regionalization or “downscaling” (dynamic and statistical), and power production, because essential uses such as envi- in order to translate the climatic variations into results on a ronmental flows and urban supply have higher priority and regional scale (khan et al., 2006; wilby et al., 2004; vrac et must be maintained."
2,"a simplified version of the decision- al., 2007; brekke et al., 2008)."
2,although there is extensive making process faced by water managers is analyzed in this literature on the strengths and weaknesses of the methods of paper.
2,"this provides an estimation of the value of informa- downscaling climatic variables to smaller cells, less attention tion of incorporating considerations of climate change and has been paid to downscaling to examine the impacts of cli- extreme events into decision-making processes, particularly mate change on water resources systems in terms of runoff in the context of river basin management and related plans or groundwater recharge (fowler et al., 2007; cayan et al., and programs dealing with water allocation and supply relia- 2008)."
2,"some research (zhu et al., 2005) employed hydro- bility. logic response ratios to translate historical streamflow in a system to streamflow under climate change conditions."
2,here we follow two approaches to derive the downscaled runoff for the ebro basin.
2,hazards earth syst.
2,"sci., 11, 643–657, 2011 www.nat-hazards-earth-syst-sci.net/11/643/2011/"
3,quiroga et al.: the economic value of drought information for water management 645 table 1.
3,structure of the decision making problem.
3,"state of nature action occurrence of extreme event no extreme event (drought years) (θ = 1) (non-drought years) (θ = 0) maintain water allocation for agriculture, production loss due to (−l) no production loss (0) accepting a reduction of supply reliability the occurrence of a drought event reduce water allocation for agriculture production loss due to the reduction of production loss due to the reduction of to obtain adequate supply reliability water allocated for irrigation: (−γ l) water allocated for irrigation: (−γ l) 2.2 climate change adaptation measures the system failing is higher in the case of runoff shortages."
3,"so, in this case, in future climate scenarios supply reliability water resources system models can be useful tools to study will be reduced, and farmers will be exposed to water the effects of climate change and to identify adaptation strate- scarcity during drought years."
3,"in normal years (no drought), gies in the water sector."
3,"climate change scenario projections agricultural production will be maintained at the current for the ebro basin imply that current agricultural water de- level, and there will be no net loss."
3,"in drought years, there mands cannot be satisfactorily met. will be water shortages, and agricultural production will in order to analyze the vulnerability of the system, we be reduced accordingly."
3,"if y is average crop yield for need to estimate the evolution of water demand expected in current water allocation in normal years, average crop yield the system during the selected scenarios (period 2071–2100). during drought years will be a fraction of y , ky , with k<1."
3,"then, in order to evaluate system performance and aid in under the occurrence of a drought event, farmers will take a the planning and management decision process, two man- production loss, l, equal to: agement options can help to analyze impact, vulnerability l = y − ky = (1 − k)y and potential adaptation to projected climate change."
3,"sev- eral authors have proposed different indices to condense the in this case, farmers cannot implement adaptation measures results of water resources system management models."
3,re- such as reducing cultivated land or changing crops as possi- liability describes how likely a system is to fail (hashimoto ble responses to reduce the impact of water shortages.
3,"this is et al., 1982a, b; el-baroudy and simonovic, 2004)."
3,"reser- because under this alternative, it is assumed that water short- voir regulation has been one of the most important water re- age cannot be anticipated and the system fails to respond to sources management strategies in spain in recent years and an extreme event (drought)."
3,the yield loss for alternative 1 has generated significant impacts.
3,"the management of water is therefore higher. allocation to reduce the disparity between water supply and the probability of having water shortages in any given demand has to take into account changes on water supply year, pθ , is computed with the help of a water resource sys- reliability. tem simulation model and is given by the supply reliability drought events are a key factor determining water supply of agricultural demand, r: and reliability, since under drought conditions water systems reduce normal conditions and the probability of the system na r= failing increases."
3,"therefore, drought occurrence is an im- nt portant factor to consider when designing water management where na is the number of years in the simulation with ac- plans. ceptable water supply and nt is the total number of years."
3,"in adapting to a possible reduction of water supplies in water systems, we have considered two different alterna- pθ will be : pθ = 1 − r tives: the first considers maintaining water allocation for agriculture, thereby reducing supply reliability and the sec- alternative 2: reduce water allocation for agriculture, in or- ond considers a reduction in water allocation for agriculture, der to obtain satisfactory water supply reliability."
3,if runoff thereby increasing supply reliability.
3,"the hypotheses are is reduced, the probability of the system failing will increase further described below (table 1): unless water allocated to agriculture is reduced, thereby in- creasing the disparity between water supply and demand but alternative 1: maintain current water allocation for allowing the demand to anticipate the shortage (this implies agriculture."
3,"under this alternative, the quantity of water less water but with greater reliability)."
3,"in this case, farmers assigned for irrigation is maintained, but the probability of will not be exposed to water scarcity during drought years, www.nat-hazards-earth-syst-sci.net/11/643/2011/ nat."
3,hazards earth syst.
3,"sci., 11, 643–657, 2011"
4,646 s.
4,quiroga et al.: the economic value of drought information for water management 2.3 description of the case study our study focuses on the ebro river basin.
4,"the ebro basin, located in the northeast of the iberian peninsula, is the largest basin in spain, with an area of 85 000 km2 and a mean an- nual runoff of 16.92 km3 yr−1 ."
4,it currently supplies wa- ter to 2 700 000 people and around 800 000 ha of irrigated land.
4,urban supply and consumptive industrial demand is 0.96 km3 yr−1 and irrigation demand is 6.32 km3 yr−1 .
4,"to illustrate the loss of production generated from dif- ferences in the management of water systems, we analyse rice production, one of the main agricultural crops of the ebro delta (60% of its surface)."
4,rice production in this re- gion plays a crucial role in the economy and ecology of the ebro estuary and was chosen because of its dependence on fig.
4,example of demand-reliability analysis in a basin for a given water for irrigation.
4,"the total production of rice is about climate change scenario. 120,000 metric tonnes per year, the third most important crop of the european union."
4,an extensive irrigation system delivers fresh water from the ebro river to the rice fields.
4,"in addition to the grain harvest, rice fields play a signifi- because the water supply system will be able to overcome cant ecological role in the over-wintering of migratory birds the drought situation."
4,"however, the reduction of water allo- (martı́nez-vilalta, 1995; ibáñez, 2000; forés, 1989)."
4,al- cation implies a production loss every year.
4,"if β is the re- though our analysis uses rice cultivation as an example, we duction of water allocation, the yield in normal and drought have not modelled water for rice production specifically and years will be βαy , where α is the production sensitivity to we assume that reductions of water allocation are equally dis- water availability."
4,"therefore, the net loss taken by farmers tributed between different crops. would be: 2.4 water availability and policy analysis y − αβy = (1 − αβ)y (wapa) model this loss can be expressed as a fraction γ of the loss taken quantitative parameter values for the formulation of the deci- under alternative one: γ l, with coefficient γ equal to: sion problem were obtained using wapa (water availability and policy analysis), a simplified water resources simulation (1 − αβ) γ= model applied to the ebro basin. (1 − k) wapa was used to compute the demand-reliability (dr) curve, providing a simple way to evaluate water availabil- in alternative 2, farmers are assumed to attempt to adapt to ity under different climate change scenarios."
4,"wapa simu- the reduced water availability, which ensures that the yield lates the joint operation of all reservoirs in a basin to sat- loss is less than in alternative 1."
4,"however, this loss is per- isfy a unique set of demands."
4,"basic inputs to the wapa manent and not associated to a particular extreme event, but model are the river network topology, the reservoir charac- rather, to a change in the normal conditions. teristics (monthly maximum and minimum capacity, storage- quantitative parameters for the decision problem can be area relationship and monthly evaporation rates), the natural- obtained from the demand-reliability curve, which is ob- ized stream flow series entering different points of the river tained by computing the evolution of reliability as the de- network, the environmental flow conditions downstream of mand value changes."
4,"for instance, fig. 2 presents an ex- reservoirs and monthly values of urban and agricultural de- ample of demand-reliability analysis in a basin for a given mands for the entire basin."
4,the model is based on the mass climate change scenario.
4,"under the control (current) sce- conservation equation, and the main assumptions refer to nario, the demand-reliability curve provides reliability for how reservoirs are managed in the system: to supply de- current water allocation in the basin, which is above the ac- mands any given month, water is preferentially taken from ceptable threshold."
4,"under the climate change scenario (a2), the most downstream reservoir available, since spills from the demand reliability curve changes."
4,if water allocation is upstream reservoirs can be stored in downstream ones.
4,"in maintained at current level, demand reliability would be low- each time step, the model performs the following operations: ered to a2 reliability, below the acceptable threshold."
4,"if the system manager wants to maintain reliability at least at the acceptable threshold, water allocation has to be reduced ac- cordingly."
4,hazards earth syst.
4,"sci., 11, 643–657, 2011 www.nat-hazards-earth-syst-sci.net/11/643/2011/"
5,quiroga et al.: the economic value of drought information for water management 647 table 2.
5,climate change runoff projections for the ebro basin (cedex).
5,"scenario emission gcm downscaling runoff name scenario model method (1) change % cb b2 cgcm2 statistical method 1 −4 eb b2 echam4 statistical method 1 −25 hb b2 hadam3 statistical method 1 −9 sb b2 hadcm3 statistical method 2 −11 ub b2 echam4 smhi −17 pb b2 hadcm3 ucm −29 average b b2 −16 ca a2 cgcm2 statistical method 1 −17 ea a2 echam4 statistical method 1 −31 ha a2 hadam3 statistical method 1 +3 sa a2 hadcm3 statistical method 2 −40 ua a2 echam4 smhi −30 pa a2 hadcm3 ucm −46 average a a2 −28 (1) statistical method 1 and 2: statisitcal dowscalling by cedex (marm, 2006); smhi: swedish meteorological and hydrological institute downscalling; ucm: uniersidad complutense de madrid."
5,satisfaction of the environmental flow requirement in river network for the period 1940–1996.
5,this data set was as- every reservoir with the available inflow.
5,environmental sumed to correspond to the control situation.
5,climate change flows are passed to downstream reservoirs and added to scenarios were generated for every streamflow point in the their inflows.
5,ebro basin by transforming the mean and coefficient of vari- ation of the original series as suggested by the corresponding 2.
5,computation of evaporation in every reservoir and re- climate projection.
5,environmental flows were fixed at 10% duction of available storage accordingly of mean annual flow in every location.
5,"increment of storage with the remaining inflow, if any."
5,"climate change in the ebro basin is characterised from computation of excess storage (storage above maxi- downscaled global change scenarios obtained from the pru- mum capacity) in every reservoir. dence project (prudence, 2007, christensen and chris- tensen, 2007; fronzek and carter, 2007) and from the span- 4."
5,"satisfaction of demands in order of priority, if possible. ish national adaptation plan (marm 2006)."
5,"tables 2 and 3 use of excess storage first, then available storage start- show how downscaled scenarios were derived in this study. ing from higher priority reservoirs."
5,the socio-economic scenarios used are a2 and b2 (ipcc 5.
5,"if excess storage remains in any reservoir, computation sres, 2001) and define socio-economic conditions and the of uncontrolled spills. greenhouse gas emission levels that are used to derive pro- jected climate change impacts in the gcms."
5,"since no single the result of the joint reservoir operation model is a set of projection is a prediction, scenarios represent alternative fu- time series of monthly volumes supplied to each demand and tures."
5,"here we use 23 climate change scenarios constructed monthly values of stored volume, spills, environmental flows as a combination of four global climate models (had cm3, and evaporation losses in every reservoir."
5,"reliability is com- had am3, echam4, cgcm2) downscaled for europe with puted for every demand by comparing the actual supply val- 11 regional climate models and downscaled for the iberian ues with theoretical demand values during the simulation."
5,a peninsula with one regional climate model and two meth- macro is available to repeat the computations’ changing val- ods of statistical downscaling (tables 2 and 3).
5,"runoff data ues of a given demand type, which allows the computation from climate scenarios was obtained directly from the pru- of the demand-realiability curve. dence project for the scenarios included in table 3."
5,"these the wapa model was applied to the ebro basin system results, which vary in resolution from 50 kms to 22 kms, are composed of 34 rivers, 27 major reservoirs totaling 7.13 km3 publicly available on the web page http://prudence.dmi.dk/. of reservoir storage, an urban demand of 0.96 km3 yr−1 and runoff data from the spanish national adaptation plan current irrigation demand of 6.35 km3 yr−1 ."
5,naturalized scenarios (table 2) was obtained modifying the observed monthly streamflow series are available for 47 points in the streamflow series (period 1967–1990) with monthly changes www.nat-hazards-earth-syst-sci.net/11/643/2011/ nat.
5,hazards earth syst.
5,"sci., 11, 643–657, 2011"
6,648 s.
6,quiroga et al.: the economic value of drought information for water management table 3.
6,climate change runoff projections in the ebro basin taken from prudence project.
6,scenario name emission gcm downscaling runoff change runoff change scenario model method (1) mean % coeff.var.
6,"% dmi1-a a2 hadcm3 dmi −28 −11 dmi2-a a2 hadcm3 dmi −35 −28 dmi3-a a2 hadcm3 dmi −39 −2 eth-a a2 hadcm3 eth −45 +58 gkss-a a2 hadcm3 gkss −31 +19 ictp-a a2 hadcm3 ictp +28 +2 knmi-a a2 hadcm3 knmi −46 +38 mpi-a a2 hadcm3 mpi −42 +6 smhi a2 hadcm3 smhi −33 +31 ucm-a a2 hadcm3 ucm −36 +72 prud-a a2 −31 +18 (1) statistical method 1 and 2: statisitcal dowscalling by cedex (marm, 2006); smhi: swedish meteorological and hydrological institute downscalling; ucm: uniersidad complutense de madrid. of hydrological variables computed for the baseline period in order to determine the effects of water management on and the 2050s decade."
6,"the analysis was conducted by the yield variability, a multiple linear regression model was es- cedex (center of studies and experimentation of public timated by ordinary least squares (ols) using climatic data works of the spanish ministry of the environment, rural as explanatory variables."
6,"to consider the effect of technical affairs and marine affairs, marm, 2006). progress, we have incorporated several management indica- a fixed value of 0.96 km3 yr−1 of urban demand and a tors as input variables."
6,"(quiroga and iglesias, 2009; igle- variable irrigation demand was considered in order to obtain sias and quiroga, 2007)."
6,observed annual rice production the demand-reliability curve for irrigation demand.
6,priority data (1976–2002) at the province level were obtained for the was given to urban demand over irrigation demand.
