page,p
6,"the re- provinces on the ebro river basin, from the statistical divi- liability measure applied to compute the demand-reliability sion of the spanish ministry of agriculture (mapa, 2010). curve was: the specified model has the general form: nak lnyt = α0 + α1 lnmact r k = 100 ntot +α2 lnnitrofert + α3 lnirrigt where, r k is time reliability in percentage, nak is the num- ber of years with acceptable water supply (years where total +α4 lntavgt + α4 prect supply is above a given threshold, k), and ntot is the total +α5 lnfrt + α6 drot + εt number of years."
6,"a threshold of 98% of total demand was selected as an acceptable supply in any given year. where the dependent variable yt is the crop yield in a site in the year t, and the explanatory variables are described on 2.5 crop production functions of yield response table 4."
6,recurrent drought periods affect agricultural production.
6,"statistical models of yield response have proven useful to drought characterisation is difficult due to its spatial and evaluate the effects of extreme events such as drought, frost temporal properties and consequently a range of indicators or floods (dixon et al., 1994; moss and shonkwiler, 1993; are used (hayes, 2004; keyantash and dracup, 2002; brad- chavas et al., 2001; lobell et al., 2005, 2007)."
6,"statisti- ford, 2000)."
6,"we opted for the commonly used standardised cal models of yield response have been used to evaluate the precipitation index (spi, mckee et al., 1993)."
6,"the spi cal- sensitivity and adaptation to climate, e.g., in spain (igle- culates the difference of accumulated precipitation between a sias et al., 2000) and globally (parry et al., 2004; stanger selected aggregation period and the average precipitation for et al., 2008), and can be used to estimate the risk associated that same period."
6,"for its calculation, the precipitation record with climate variability (ferreyra et al., 2001; iglesias and is normalized so that all precipitation values vary around 0 quiroga, 2007) with potential applications in crop insurance and areas with different climates can be relatively compared (luo et al., 1994)."
6,"(mckee et al., 1993; steinmann et al., 2003)."
6,we have se- lected 12 months as the aggregated period for calculation and defined the threshold of drought as values of spi smaller than nat.
6,hazards earth syst.
6,"sci., 11, 643–657, 2011 www.nat-hazards-earth-syst-sci.net/11/643/2011/"
7,quiroga et al.: the economic value of drought information for water management 649 table 4.
7,description of the variables in the crop production function.
7,"name definition units source of data yt crop yield at a site in year t t/ha marm (spanish ministry for mact technification of the crop production in year t n◦ of agrarian fao (food and agriculture organization) machinery agriculture and the environment) nitro fert nitrogenized fertilizers qm fao irrigt net water needs of crops in the ith month in year t mm chebro (ebro river basin authority) t avt average temperature in the agricultural year t ◦c aemet(meteorological spanish service) prect total precipitation in the ith month/ mm aemet 3 month period in year t frt no. of days with temperatures below days aemet 0 ◦ c in the agricultural year t drot dummy variable for drought 0 or 1 own elaboration from years based on spi index precipitation data aemet −1, following previous detailed work in spain (iglesias et al., 2.6 decision model and risk aversion 2007; garrote et al., 2006)."
7,"then, a dummy variable has been constructed that equals 1 if the year t is a drought year (with a decision model is a mathematical formulation of the con- spi smaller than −1) and 0 in the rest of the cases. sequences associated with all combinations of a set of actions to build a proxy variable for irrigation, we used data on net and a set of possible states of the world."
7,the likelihoods of crop water requirements from the ebro basin management the states of the world are represented by probabilities.
7,"if authority (chebro, 2004)."
7,"given that currently there are no information is to have value, the decision rule will differ de- explicit restrictions on the irrigated area in the ebro basin, we pending on the information received by the decision maker. assume that water requirements of crops are being met."
7,"as (meza et al., 2003)."
7,"more details about the economic theory we mentioned before, this is likely due to runoff reductions and valuation of information can be found in johnson and projected under climate change."
7,holt (1986).
7,coefficients were estimated by ols from the observed our decision making problem has the same structure as time series (1976–2002).
7,"in order to improve the particu- that of the more general cost-loss ratio situation problem also lar model estimation for each crop, 95% confidence inter- widely known as the “umbrella problem”."
7,"the cost-loss ra- vals were estimated assuming normality of the residuals, and tio situation is a decision-making problem widely analyzed significant relations in the estimated model were considered. in the literature assessing the economic value of weather akaike (1973) and schwarz (1978) criteria have been used forecasts (e.g., murphy, 1977; murphy et al., 1985, mur- to assist in the selection of suitable models."
7,"the ljung-box phy and ehrendorfer, 1987; katz, 1993; palmer, 2002; katz q test – based on the autocorrelation plot – was used to test and ehrendorfer, 2006)."
7,"the model involves two possible the absence of autocorrelation in the residuals, and white’s actions, protect, and not protect, and two possible events, ad- general test (white, 1980) was used to test conditional het- verse weather, and no adverse weather."
7,"the decision maker eroscedasticity. is assumed to incur a cost c if protective action is taken, and when the parameters αi are estimated, the marginal effect a loss l if protective action is not taken and adverse weather of a change in the explanatory variables is given by: occurs, and no cost or loss otherwise."
7,an expected value approach has been commonly used.
7,"∂e[lny |lnxi ] however, results highly depend on agents’ behaviour with = αi ∂ lnxi respect to risk."
7,"most of the studies consider agents to be neu- tral towards risk, but there is evidence of risk aversion under the signs and magnitude of the marginal effects indicate the most situations."
7,"therefore, in order to use this methodology effect of a particular input variable xi over the crop yield and to evaluate the value of weather information it is necessary the interpretation is: it is the elasticity that is the percent to know: (i) information on the expenses matrix, (ii) climate increase of yields produced by a one percent increase in the information (probability of the extreme event) and, (iii) in- input variable. formation about the risk aversion level."
7,assuming that the www.nat-hazards-earth-syst-sci.net/11/643/2011/ nat.
7,hazards earth syst.
7,"sci., 11, 643–657, 2011"
8,650 s.
8,"quiroga et al.: the economic value of drought information for water management consequences of each combination of actions and state of the world are known a priori, the model allows for the represen- tation of the decision maker’s preferences (i.e. utilities as- sociated with the future outcomes), and sets a decision rule by which an optimal strategy is selected once the expected utility of each decision is calculated (meza et al., 2003)."
8,in cerdá and quiroga (2010) a model is proposed to eval- uate information considering the risk aversion level.
8,the main concept used for this purpose is the certain equivalent.
8,the certain equivalent (ce) can be defined as the amount of money producing the same utility (u) without uncertainty as the expected utility (eu) of a gamble when the risk exists.
8,the role of risk aversion is analyzed here by considering that a manager decides between alternative 1 (more risk) and al- ternative 2 (less risk).
8,in order to evaluate risk influence on managers’ decisions fig.
8,"expected value (ev), expected utility (eu) and certain – and therefore obtain the value of information – we an- equivalent (ce) and sensitivity analysis to risk aversion. alyze the decision considering the risk aversion, which is one of the central concepts in economic analysis (mas-colell et al., 1995)."
8,"we assume that manager preferences can be z which indicates a forecast of adverse weather (z = 1), or represented by the expected utility with the utility function of non adverse weather (z = 0) be introduced."
8,"as in murphy u (−), the cara function (constant absolute risk aver- et al. (1985) it is assumed that pr{z = 1} = pr{θ = 1} = pθ , sion) (mas-colell et al., 1995), being: that is, the forecasting system produces adverse weather sig- nals with the same probability that adverse weather events u (x) = −exp{−ρx} take place, so the forecast is at least as accurate as infor- where: x is the monetary gain and ρ > 0 is the arrow-pratt mation based just on the historical records."
8,"the quality of coefficient of absolute risk aversion, which is constant for information is defined in terms of the following index: this function."
8,"(p1 − pθ ) the arrow-pratt absolute risk aversion coefficient can q = corr(θ,z) = ,where p1 = pr{θ = 1/z = 1} be interpreted as the percentage change in marginal utility (1 − pθ ) caused by each monetary unit of a gain or loss (raskin and table 5 summarizes the variables introduced in the model cochran, 1986)."
8,"if the coefficient does not change across the and the source of information for the case study considered. monetary level, the decision-maker exhibits constant abso- lute risk aversion (cara), which implies that the level of the 2.7 computing the economic value argument of the utility function does not affect his or her de- cisions under uncertainty."
8,"since ρ is not a non-dimensional in order to achieve a monetary value unchanging with lin- measure of risk aversion, its value is dependent on the cur- ear utility transformations in order to compute the amount rency in which the monetary units are expressed (gómez- of money that farmers will pay for the forecast service, we limón et al., 2003), which makes comparison between dif- have considered the certainty equivalence approach."
8,the cer- ferent economic agents difficult.
8,"however, it remains a good tain equivalent (ce) can be defined as the amount of money measure for decision- making problems involving one sole for which the farmer is indifferent between the gamble and economic agent."
8,"this is suitable for the river basin manager’s the certain amount ce (mas-colell et al., 1995), that is the decision problem, while the risk aversion remains indepen- amount of money producing the same utility without uncer- dent of the productivity loss value."
8,the optimal decision in tainty as the expected utility when the risk exists (see fig.
8,"3). this case is obtained maximizing the expected utility, which the certain equivalent allows us to define a value of infor- increases with the decrease of the expected yields reduction. mation in monetary terms."
8,"then, it is possible to compare the (this is the reason for writing the payoffs as negative mone- value of information between the risk-averse and risk-neutral tary costs). cases, and also to compare different agents."
8,"cerdá and as in cerdá and quiroga (2010), we consider the incorpo- quiroga (2010) define the monetary gains (mg), as the dif- ration of additional information to the model."
8,it is introduced ference in certainty equivalent due to the introduction of fore- as an imperfect weather forecasting.
8,"the goal is to obtain the casting information, that is: mg = cef (with forecasting)- optimal decision rule but also to quantify the economic value cenf (without forecasting) and compute the monetary gains of a forecasting system, considering the information value as of an information system."
8,"for the decision problem with risk, the benefit of changing the farmer’s behaviour when he or she defined in table 1, the optimal decision of the manager con- has access to additional information."
8,let the random variable sidering the maximization of the expected utility criterion is: nat.
8,hazards earth syst.
8,"sci., 11, 643–657, 2011 www.nat-hazards-earth-syst-sci.net/11/643/2011/"
9,quiroga et al.: the economic value of drought information for water management 651 table 5.
9,description of the variables included in the decision making model.
9,"name variable source of information θ extreme event variable (θ = 1, spi calculation “drought event”; θ = 0, “no drought event” k reduction coefficient for produc- crop production tion during drought years functions l = y − (k · y ) = (1 − k)y loss when the demand is main- crop production tained during the drought event functions happens (therefore the guarantee is reduced) β reduction coefficient for water wapa simulations demand α yield elasticity to irrigation water crop production availability functions c loss when the water for irrigation wapa simulations is reduced. % of the loss when and crop production the guaranty is reduced: c = y − functions (αβy ) = (1 − αβ)y = γ l ρ arrow-prat absolute risk aversion calibration based on coefficient gómez-limón et al, 2003 pθ climate information: pr[θ = 1] wapa simulations q forecast quality: corr(θ,z) sensitivity analysis where z represents imperfect forecast variable (z = 1, “ad- verse weather”; z = 0, “non adverse weather”) h i i."
9,"alternative 1 if a > pθ , and in this case the expected ln pθ exp{ργ l}+(1−p1−p θ )−pθ (1−exp{ρl})[1−q(1−pθ )−pθ ] θ (1−exp{ρl}) utility is eu(0) = −pθ exp{ρl} + pθ − 1 = , −ρ ii."
9,"alternative 2 if a < pθ , and the expected utility is if a > pθ ."
9,eu(1) = −exp{ργ l} the economic value of the forecast system can be ex- iii.
9,indifference between both alternatives if a = pθ pressed as a function of the quality index.
9,"there is a thresh- old, qa∗ = 1 − paθ , below which the forecast system does not where a = 1−exp{ργ l} 1−exp{ρl} . improve the farmer’s expected utility, that is, the economic the monetary gain of a forecast defined as the difference value is positive if and only if q > qa∗ ."
9,this threshold in- between cef and cenf can be computed as: creases with the absolute risk aversion coefficient of arrow- pratt ρ.
9,"so, with a more risk-adverse agent the information mg(q) quality needed to influence his decision making is higher."
9,"  although individuals’ risk tolerance varies, we assume ln pθ exp{ργ l} + (1 − pθ ) − pθ (1 − exp{ρl})[1 − q(1 − pθ ) + pθ ] that ρ = 0.5 represents the risk aversion coefficient."
9,"palacios- = −ρ huerta (2003) suggested that ρ typically ranges from 0.3 to 0.7, centred on 0.5."
9,"so, using the wapa simulations and the +γ l, production functions results, we have calculated the mon- if 0 ≤ a ≤ pθ , and etary gains or economic value of the extremes information systems."
9,mg(q) www.nat-hazards-earth-syst-sci.net/11/643/2011/ nat.
9,hazards earth syst.
9,"sci., 11, 643–657, 2011"
10,652 s.
10,quiroga et al.: the economic value of drought information for water management table 6.
10,summary of results from the wapa model.
10,projection mean annual change in mean change in coef.var.
10,irrigation demand for 98% required reduction of reliability for probability runoff (km3 yr−1 ) annual runoff (%) annual runoff (%) reliability (km3 yr−1 ) of irrigation current irrigation water shortage demand β demand (%) for current irrigation demand pθ cb 16.25 −4 0 6.35 0.00 98 0.02 eb 12.69 −25 0 5.38 0.15 80 0.20 hb 15.40 −9 0 6.12 0.03 95 0.05 sb 15.06 −11 0 6.12 0.03 95 0.05 ub 14.05 −17 0 5.78 0.09 88 0.13 pb 12.01 −29 0 5.17 0.18 77 0.23 averageb 14.21 −16 0 5.86 0.07 88 0.13 ca 14.05 −17 0 5.78 0.09 88 0.13 ea 11.68 −31 0 5.11 0.19 71 0.29 ha 17.43 3 0 6.71 0.00 98 0.02 sa 10.15 −40 0 4.52 0.28 52 0.48 ua 11.85 −30 0 5.08 0.20 71 0.29 pa 9.14 −46 0 4.06 0.36 41 0.59 averagea 12.18 −28 0 5.25 0.17 77 0.23 dmi1-a 12.18 −28 −11 5.50 0.13 80 0.20 dmi2-a 11.00 −35 −28 5.42 0.14 70 0.30 dmi3-a 10.32 −39 −2 4.61 0.27 54 0.46 eth-a 9.31 −45 58 2.67 0.58 43 0.57 gkss-a 11.68 −31 19 4.41 0.30 64 0.36 ictp-a 21.66 28 2 7.70 0.00 100 0.00 knmi-a 9.14 −46 38 3.15 0.50 41 0.59 mpi-a 9.81 −42 6 4.14 0.34 48 0.52 smhi-a 11.34 −33 31 3.80 0.40 59 0.41 ucm-a 10.83 −36 72 2.72 0.57 54 0.46 pru-a 11.68 −31 18 4.41 0.30 64 0.36 table 7.
10,"descriptive statistics (mean, min, max, range and standard deviation) of the variables used in the crop yield regression equation."
10,variable mean min max range std.
10,yt 5.4 3.0 7.3 4.3 1.0 mact 697225.0 400928.0 946053.0 545125.0 156327.3 nitro fert 987587.6 788072.0 1199000.0 410928.0 132714.3 irrigt 1326.3 565.9 2145.1 1579.2 669.5 t avt 15.4 13.9 16.9 3.0 0.8 prect 430.5 180.1 770.0 589.9 130.3 frt 2.1 0.1 5.3 5.3 1.5 3 results tions of this line with the demand reliability curves in cli- mate change projections correspond to the reliabilities that 3.1 water allocation reductions and water reliability would be obtained if irrigation demand was left unchanged. trade-off numerical values for all projections are presented in table 6.
10,the results obtained are presented in fig. 4 and in table 6.
10,"3.2 water effects on irrigated agricultural production figure 4 presents the demand-reliability curves of irrigation demand, once urban demand has been satisfied, for current table 7 illustrates the descriptive statistics (mean, min, max, conditions and for average projections averageb, averagea range and standard deviation) of the variables used in the and pru-a."
10,desired reliability (98%) is represented as a hor- crop yield regression equation and table 8 shows the result izontal dashed line.
10,intersections of this line with the de- of the statistical function of yield response to water.
10,the mand reliability curves in climate change projections cor- coefficients of the model can be interpreted as direct elas- respond to the maximum irrigation demand values that are ticities since the model presents a logarithmic transforma- allowed to maintain the desired reliability.
10,current demand tion except for the drought effects.
10,"so, the estimated coeffi- (6.32 km3 yr−1 ) is represented as a vertical line."
10,intersec- cients represent the proportional changes on the dependent nat.
10,hazards earth syst.
10,"sci., 11, 643–657, 2011 www.nat-hazards-earth-syst-sci.net/11/643/2011/"
11,quiroga et al.: the economic value of drought information for water management 653 table 8.
11,"estimated coefficients of the crop production function for rice production. ln yt t-statistic ln mact 0.7389 [3.47]*** ln nitro fert −0.2308 [1.11] ln irrigt 0.1067 [2.27]** ln frt −0.0674 [2.25]** drot −0.1454 [2.25]** constant −5.8483 [2.33]** r-squared 0.53 observations 42 f(5,36) 8.23 fig."
11,spi and drought periods for tarragona in the ebro river basin prob>f 0.0000 (1977–2002).
11,"robust t statistics in brackets. * significant at 10%; ** significant at 5%; *** significant at 1% basin is located in the northeast of the iberian peninsula with a primarily continental mediterranean climate, characterized by hot-dry summers and cold-wet winters."
11,"up to the present, there have been no explicit restrictions on the irrigation area in the ebro basin."
11,"however, in a climate change context with more drought events and the water framework directive envi- %) y( ronmental restrictions, the scene could be very different. a i i l bit drought has a considerable negative effect."
11,"agriculture in rel spain is more sensitive to inter-annual rainfall variations than many other european regions because the physical factors affecting production (soils, terrain, and climate) are, in large areas, less suited to farming."
11,drought pseudo-elasticity (k) is estimated to be −0.14.
11,figure 5 shows the spi and the drought periods considered (those bellow −1).
11,"since rice is an irrigated crop, irrigation may go up during droughts fig."
11,"demand reliability curves for current conditions and for cli- masking the effects of drought itself. mate projections average b (average for b2 scenario), average a (average for a2 scenario) and pru-a (average of prudence models 3.3 selecting water management options for a2 scenario)."
11,the payoff matrix for each of the scenarios considered was calculated from the wapa simulations and the crop produc- tion functions.
11,"table 9 shows an example of the decision- variable, when a 1% change is produced on the explana- making problem under the prudence-a scenario."
11,reduction tory variable associated to this coefficient.
11,"the drought vari- of water allocation acts as a non-risk option (similar to insur- able coefficient can be interpreted as semi-elasticity and rep- ance), since the farmers know by how much the water allo- resents the percent variation of yield when drought occurs. cation is going to be reduced."
11,"this reduction takes place in- due to the presence of heteroskedasticity, we used the white dependently of the existence of drought."
11,"on the other hand, test (1980) to obtain robust estimates."
11,"technological change if there is no change in the water allocated, the probability is represented by farm machinery results in yield increases of system failure increases in the case of an extreme event for rice production."
11,this variable is the main driver of pro- (drought).
11,this results in farmers having less water avail- ductivity.
11,"then, irrigation also has a positive impact, so re- able and it eliminates the possibility of anticipating the event ductions in water availability for irrigation will result in a because it is a failure of the system."
11,if drought does not oc- decrease of yields.
11,"the water output elasticity is 0.10, which cur, the system will not fail and farmers won’t suffer water indicates that a decrease of 1% in water for irrigation will shortages, in which case no losses are incurred. lead to a decrease of more than 10% in the crop yield."
11,"this in spain, water allocation means assigning a given annual reduction is not so high, but it is important to notice that amount of water to a certain demand."
11,"it is, in fact, award- during drought events, a reduction of more than 14% has to ing a right to use water, which is done by the water ad- be added (since the elasticity of drought is 0.14)."
11,"the ebro ministration, in the form of an administrative concession. www.nat-hazards-earth-syst-sci.net/11/643/2011/ nat."
11,hazards earth syst.
11,"sci., 11, 643–657, 2011"
12,654 s.
12,quiroga et al.: the economic value of drought information for water management table 9.
12,payoff matrix (reduction of rice yield) for prudence-a scenario.
12,state of nature action occurrence of extreme event no extreme event (drought years) (non-drought years) (θ = 1) (θ = 0) reduction of water allocation for agri- production loss due to the reduction of production loss due to the reduction of culture water allocated for irrigation water allocated for irrigation −0.41% −0.41% no change in the water allocation for production loss due to the occurrence of no production loss 0% agriculture leading to a reduction of wa- a drought event −7.68% ter reliability fig.
12,economic value of perfect information as a function of the fig.
12,optimal policy regions. risk aversion coefficient.
12,"water allocation is then revised periodically in river basin water allocation has a lower associated risk level, and would management plans, based on the estimation of available sup- therefore be preferred by managers that are more risk averse plies."
12,water reliability refers to the average number of years (dark grey).
12,reducing water reliability has a higher associ- with adequate supply for the water currently allocated to that ated risk level and would therefore be preferred by those less demand.
12,if runoff is reduced due to climate change and there risk averse (light grey) (fig.
12,"the results show that there is is no change in water allocation, the same demand has to be no optimal policy response and that this is highly dependent supplied with less resources, and one can expect an increased on the scenario considered."
12,this is indicative of the impor- frequency of shortage situations which leads to a reduction tance and relevance of climate change information. in reliability.
12,"if water allocation is reduced, reliability can be maintained, because there would be less consumption every 3.4 economic value of drought information year."
12,"in this case, agriculture would probably get less water overall, but the supply would be more reliable."
12,in fig. 7 we present the economic value of perfect informa- the optimal policy was calculated as described in tion as a function of the risk aversion coefficient of the water sect.
12,figure 6 shows the optimal policy regions with the management authority and for each of the climate change corresponding trade-off between supply and reliability.
12,for scenarios analysed.
12,"perfect information assumes that quality the scenarios in which the black points pθ are in the white of the prevision is one (q = 1) and can be understood as the area, alternative 2 (reducing the water allocated for irriga- maximum information accuracy. tion) is the optimal decision, independently of the risk aver- each climate change scenario is associated with a differ- sion coefficient considered."
12,"on the other hand, for the sce- ent estimated probability of drought, and as we have seen narios in which the pθ is in the dark grey area, alternative 1 in sect."
