page,p
13,"beyond static partitioning, there is a further goal for dynamic bio-geography at regional scales that would incorporate complexities of a dynamic marine environment and their effect on the phytoplankton."
13,srs will be an invaluable source of inputs in case of such partitioning.
13,changes in spatial extent of the ecological provinces arising from temporal variations in physical forcing can be captured in a srs climatology of ocean colour.
13,"18.4 coupling modelled and srs data for effective fishery management so far in this chapter, we have discussed the usage of environmental data sets from models and srs for various aspects in fisheries research and management."
13,but lack of environmental time series data sets pointed to the need for more data.
13,"coupled with srs, numerical modelling is an alternative tool to generate environmental and biological datasets, which can help to mitigate problems arising from data gaps."
13,some relevant case studies are described below.
13,18.4.1 trophic modelling using srs data as an ecosystem approach to fisheries management trophic levels in the marine ecosystem are similar to those in terrestrial systems starting with primary producers and ending in scavengers.
13,"but, the trophic structure in marine systems is web like, rather than a linear food chain."
13,fishing often alters the ecosystem structure.
13,trophic webs will respond differently to fishing depending on whether the target species is a predator or prey species.
13,single-species fish stock- assessment models ignore food web interactions.
13,ecosystem based fish stock assessment is offered as another option.
13,"eafm models often resort to srs-based pp as an input for forcing at the base of the food web to investigate energy transfers and biomass in an ecosystem without fishing, from lower to upper trophic levels (chassot et al."
13,2011).
14,18 numerical modelling and satellite remote sensing as tools for research. . .
14,443 18.4.2 generating potential fishing zones (pfz) and their dissemination along with ocean state forecasts (osf) identification of pfz involves an understanding of oceanic processes and inter- action of hydro-biological parameters (desai et al.
14,2000).
14,the forage base and the physical gradients of temperature and chl-a help the predatory fish to locate their prey and the same cues are used by fishermen.
14,a number of studies have examined the use of srs as an aid to locate more productive fishing areas (waluda et al.
14,2001).
14,indian remote sensing satellite p4 ocean colour monitor (irs p4 ocm) derived chlorophyll concentration and national oceanographic aerospace administration advanced very high resolution radiometer (noaa avhrr) derived sst images have been used to characterise the relationship between the biological and physical variables in coastal waters and it was observed that chlorophyll concentration and sst were inversely correlated with each other (solanki et al.
14,1998).
14,the relationship between these two parameters was esti- mated by a clustering technique called arnone (ncaer 2010) and the matching features were selected for generating integrated pfz forecasts from the composite images on the basis of latitude and longitude (solanki et al.
14,2005; ncaer 2010).
14,validation of studies of pfz forecasts have shown that the forecast may lead to substantial increase in fish catch (solanki et al.
14,"2001, 2003; nayak et al."
14,2003).
14,pfz forecasts in near-real time indicating the likely availability of fish stocks for the next 2 days are disseminated in the indian eez by incois (fig.
14,18.5) to about 225 nodes for operational use (nayak et al.
14,2003).
14,"a significant increase in total catch by following pfz forecasts has been documented from ani (grinson et al. 2011b, 2013b)."
14,"18.4.3 detection of meso-scale features such as eddies and fronts that may indicate productive fishing grounds oceanographic features such as eddies, currents and meanders are pervasive features in the world’s oceans."
14,"these conspicuous hydrographic features influ- ence the horizontal and vertical distributions of the chemical (e.g. nutrients), physical (e.g."
14,sst) and biological (e.g.
14,chl-a) properties in pelagic systems (yoder et al.
14,1981; seki et al.
14,2001).
14,eddies have been found to be localized regions of higher pp leading to aggregation and development of forage species base communities.
14,"the presence of mesoscale eddies and their detection by the fishing fleet is an important factor in fishery performance, leading to increased catch per effort for most pelagic species (laurs and lynn 1977; laurs et al."
14,1984).
14,"the influence of mesoscale processes at fronts, such as the formation of rings,"
15,444 g.
15,george fig.
15,18.5 an incois pfz imagery for andaman group of islands
16,"18 numerical modelling and satellite remote sensing as tools for research. . . 445 meanders and streamers arising or breaking off from these dynamic current systems, has also been shown to be important in shaping the distribution of pelagic fish and shellfish (waluda et al."
16,2001).
16,"studies linking the physical oceanographic processes with fish have been carried out around the major bound- ary currents and related mesoscale processes, such as in the fishing grounds associated with kuroshio frontal regions (yokouchi et al. 2000), mesoscale eddies and pelagic fisheries off hawaiian waters (seki et al. 2001), upwelling and longline fishery of portuguese waters (santos et al."
16,"2006), atlantic tuna and gulf of mexico circulation (block et al. 2005), oceanographic conditions of spawning grounds of bluefin tuna in the ne indian ocean (matsuura et al. 1997), bluefin and frigate tuna spawning along the balaeric archipelago (garcia et al. 2003a) and tuna exploitation near the mesoscale processes near the sechelles (fonteneau et al."
16,2006).
16,the chlorophyll-sst based advisories depend on the surface manifestation by algal blooms and thermal fronts which result from eddies and upwelling.
16,"using altimetry data however, one would be able to follow the evolution of feature from inception to maturation and dissipation with time."
16,"there is a time lag between physical upwelling of nutrients to the ocean surface and development of phytoplankton blooms, and subsequently the aggregation of planktivorous and piscivorous fish."
16,altimetry data helps to identify the fish-aggregating meso-scale features from the outset giving valuable time to forecast and exploit the consequences.
16,difficulties in getting cloud free imageries sometimes limits the scope of this approach.
16,"altimetry data, especially the ssh have been useful to study the physical oceanography and mesoscale circula- tion."
16,advances in srs altimetry are making it possible to extend the information to the coastal areas where the fishermen are most active.
16,inputs from the altimetry data on the mesoscale features can be used to augment the pfz advisories and also provide data during cloud cover.
16,"18.4.4 forecasting cyclones and ocean state to reduce impacts on coastal fisher folk and resources apart from elucidating the areas of likelihood of fish/shellfish distributions during the pld phase, the wind models used for generating wind inputs in simulation of physical process can be utilized for studying cyclone tracks."
16,fisheries is one of the sectors with high occupational hazard.
16,the extent of direct mortality caused by storms at local or regional scales is severe (gardner et al.
16,2005; done 1992).
16,osf derived as products of numerical models are provided as input to fishermen to mitigate this risk.
16,"osf provides wave and swell height as well as period, ws as well as wind direction (wd), tsunami and rough sea warnings and coastal current details."
16,"to ensure safe navigation and operations at sea, and to forewarn the fishermen community, incois started the osf service in 2005 by issuing forecasts 7 days in advance and at three hourly intervals, with daily updates."
16,fishermen utilize these forecasts to guide their daily operational activities and to ensure safe
17,446 g.
17,george fig.
17,18.6 tropical cyclone wind climatology modelled using wrf for studying the reef damages in andaman sea navigation.
17,"though international agencies such as national centres for environ- mental prediction (ncep), usa and european centre for medium-range weather forecasts (ecmwf) and uk issue sea state forecasts based on models such as wavewatch iii and wam, these forecasts are for the open ocean."
17,"the incois model provide accurate location-specific forecast in the coastal waters using high resolution local bathymetry, and tuning them using observed wave measurements."
17,real-time and on-line validation of the forecast products is disseminated through various means by incois (nair et al.
17,2013).
17,cyclones also render coastal resources vulnerable.
17,the ecological effects of cyclones on coral reefs have been reviewed by harmelin-vivien (1994).
17,"tropical storms cause severe damage to the reefs; their impacts include the removal of reef matrix, scouring and fragmentation (rogers and fish 1991; done 1992), deposition of loosened material onto beaches above sea level or transporting it into deeper sub-reef environments (done 1992)."
17,the reefs in andaman and nicobar islands (ani) suffered severe damage following a tropical cyclone in the bay of bengal off myanmar coast during 13–17 march 2011 (krishnan et. al.
17,2013).
17,the investigation exposed the vulnerability of the reefs to oceanographic features which generally remain unnoticed unless they directly affect the life or the property of coastal inhabitants.
17,the wind tracks of cyclone were generated using weather research and forecasting (wrf) models (fig.
17,18.6) which clearly indicated the passage of cyclone where reefs suffered damage.
18,18 numerical modelling and satellite remote sensing as tools for research. . .
18,447 18.4.5 estimation of potential fishery resources of an exclusive economic zone (eez) for fishing fleet management global marine fish production increased from less than 20 million tons per year in early 1950s to average around 90 million tons per year during the last decade.
18,"if the unreported and discarded catches are also taken into account, the global catches will be around 120 million tons per year (dirk and pauly 2005)."
18,the general trend in shortfall from traditional fishing grounds in the eez’s of developed countries is compensated by the increasing exploitation of resources in developing countries (pauly and watson 2003).
18,the united nations convention on the law of the sea (unclos) bestows the coastal states with the right to exploitation and responsi- bility for management of fishery resources of their eezs.
18,"observations are of paramount importance for managing the resources, and there is a need to establish acccurate catch data collection systems."
18,fish captured are considered to reflect fish abundance in coastal waters.
18,"from marine fish catch data, we can estimate the potential harvestable fish by plotting the catch effort curve, and estimate the maximum sustainable yield (msy)."
18,"but, mere post-mortem analysis of landed fish may lead to imperfect estimates as fish catch data without geotags of catching locations may not provide samples representative of the stock in the sea."
18,"therefore, an estimate of harvestable fish based on in situ water productivity, taking into account the tropho-dynamics in the eez may afford very useful complimentary information."
18,"chlorophyll, which is an index of algal biomass (ml–3) present in a water column (l) is a prerequisite for primary production and subsequent fish production (ml 2 t 1) which is the annual rate of production of fish biomass per unit area of sea bed."
18,"the importance of the potential link between pp and fish was understood decades ago (ryther 1969), but the advent of srs chl-a and modelled pp data sets now available on global and meso-scale prompted policy planners to utilize this for estimation of fishery potential in the eez."
18,past studies relied on in situ datasets resulting from different sampling and processing methods and were generally characterized by low spatiotemporal sampling coverage.
18,"srs chl-a data are now basic to cross-trophic-level analyses of ecosystem production, structure, and func- tion because of the easy and free availability of a wide-ranging, high resolution, and consistent sampling framework (platt et al. 2007) at a reliable accuracy."
18,"18.5 overview this chapter has reviewed some recent advances in numerical modelling, srs and their coupled applications in marine fisheries research and management."
18,"globally, there is considerable potential for phytoplankton data to serve in future as a proxy for estimation of fish biomass."
18,"usually, investigations in fisheries"
19,448 g.
19,george biology lack environmental time series or other biological data sets (longhurst and wooster 1990; madhupratap et al.
19,1994).
19,"data from srs, numerical modelling and their combinations can lead to robust conclusions."
19,numerical simulation is an attempt to supplement the existing decision support systems.
19,the biological rele- vance of numerical modelling and srs at present is restricted to a few operational activities in fisheries.
19,but the issues are complex and there are many uncertainties.
19,the role of coastal processes in fish and shell fish production and dynamics deserves further investigation with improved time series sampling of early life stages in marine organisms.
19,"but in the years to come, numerical modelling, srs and their coupled usage will provide major technological advances supporting operational fisheries research and management."
19,"acknowledgement this chapter was written during the fellowship offered by naip, indian council of agricultural research for my pml visit with dr."
19,trevor platt as my mentor.
19,my previous research associations with dr.
19,"vethamony at nio, goa, dr."
19,dam roy and dr.
19,"krishnan at cari, port blair, dr."
19,srinivasakumar and dr.
19,mahendra at incois and a.
19,"anand at rrsc, nagpur are reflected in this chapter."
19,i acknowledge the support from dr.
19,"meenakumari, ddg (fisheries), icar, india and dr."
19,"gopalakrishnan, director, cmfri, india and the chloriffs project which sponsored this work."
19,"references alvain s, moulin c, dandonneau y, bre’on fm (2005) remote sensing of phytoplankton groups in case 1 waters from global seawifs imagery."
19,"deep sea res i: oceanogr res pap 52:1989– 2004 bahuguna a, nayak s, roy d (2008) impact of the tsunami and earthquake of 26th december 2004 on the vital coastal ecosystems of the andaman and nicobar islands assessed using resourcesat awifs data."
19,"int j appl earth observ geoinf 10(2):29–237 block ba, steven lh, andreas w, boustany a, michael j, stokesbury w, farwell cj, weng kc, dewar h, williams td (2005) electronic tagging and population structure of atlantic blue fin tuna."
19,"nature 434:1121–1127 bruce bd, evans k, sutton ca, young jw, furlani dm (2001) influence of mesoscale oceano- graphic processes on larval distribution and stock structure in jackass morwong nemadactylus macropterus: cheilodactylidae."
19,"ices j mar sci 58:1072–1080 chassot e, bonhommeau s, reygondeau g, nieto k, polovina jj, huret m, dulvy nk, demarcq h (2011) satellite remote sensing for an ecosystem approach to fisheries management."
19,ices j mar sci: j cons 68(4):651–666 cmfri marine fisheries census (2005) volume part i.
19,"central marine fisheries research institute, cochin, 114 pp cowen rk, sponaugle s (2009) larval dispersal and marine population connectivity."
19,ann rev mar sci 1:443–466 cushing dha (1974) the natural regulation of fish populations.
19,"in: jones frh (ed) sea fisheries research, vol 2."
19,"elek sci, london, pp 399–412 cushing dh (1989) a difference in structure between ecosystems in strongly stratified waters and in those that are only weakly stratified."
19,j plankton res 11:1–13 cushing dh (1990) plankton production and year–class strength in fish populations: an update of the match–mismatch hypothesis.
19,adv mar biol 26:249–294
20,18 numerical modelling and satellite remote sensing as tools for research. . .
20,"449 desai ps, honne gowda h, kasturirangan k (2000) ocean research in india: perspective from space."
20,"curr sci 78(3):268–278 dirk z, pauly d (2005) good news, bad news: global fisheries discards are declining, but so are total catches."
20,fish fish 6(2):156–159 done tj (1992) effects of tropical cyclone waves on ecological and geomorphological structures on the great barrier reef.
20,cont shelf res 12:859–887 ekman s (1953) zoogeography of the sea.
20,"sidgwick and jackson, london, 417 pp elith j, graham c (2009) do they?"
20,how do they?
20,why do they differ?
20,on finding reasons for differing performances of species distribution models.
20,"ecography 32:66–77 fanning k (1992) nutrient provinces in the sea – concentration ratios, reaction rate ratios, and ideal covariation."
20,"j geophys res 97:5693–5712 fonteneau a, lucas v, delgado a, demarcq h (2006) meso-scale exploitation of a major tuna concentration in the indian ocean."
20,"document- iotc-2006-wptt-24, 16 pp gaonkar ca, samiksha sv, grinson g, aboobacker vm, vethamony p, anil ac (2012) numer- ical simulations of barnacle larval dispersion coupled with field observations on larval abun- dance, settlement and recruitment in a tropical monsoon influenced coastal marine environment."
20,"j mar syst 94:218–231 garcı́a a, alemany f, velez-belchı́ p, rodrı́guez jm, lópez jurado jl, gonzález pola c, de la serna jm (2003a) bluefin and frigate tuna spawning off the balearic archipelago in the environmental conditions observed during the 2002 spawning season."
20,"col vol sci pap iccat 55(3):1261–1270 garcia sm, zerbi a, do chi t, lasserre g (2003b) the ecosystem approach to fisheries."
20,"issues, terminology, principles, institutional foundations, implementation and outlook."
20,"fao fisheries technical paper, 443, 81 pp gardner ta, gill imca, grant a, watkinson ar (2005) hurricanes and caribbean coral reefs: impacts, recovery patterns, and role in long-term decline."
20,ecology 86(1):174–184 grinson g (2011) fish larval transport in the coastal waters through ecological modelling.
20,"ph.d. thesis, goa university- national institute of oceanography, goa, india, 165 pp grinson g, vethamony p, sudheesh k, babu mt (2011a) fish larval transport in a macro-tidal regime: gulf of kachchh, west coast of india."
20,"fish res 110(1):160–169 grinson g, krishnan p, kamal-sarma kr, goutham-bharathi mp, kaliyamoorthy m, krishnamurthy v, srinivasa kumar t (2011b) integrated potential fishing zone (ipfz) fore- casts: a promising information and communication technology tool for promotion of green fishing in the islands."
20,"indian j agric econ 66(3):513–519 grinson g, bharathiamma m, mini r, srinivasa k, vethamony p, babu mt, xivanand v (2012) remotely sensed chlorophyll: a putative trophic link for explaining variability in indian oil sardine stocks."
20,"j coast res 28(1a):105–113 grinson g, dattesh desai v, chetan gaonkar a, aboobacker vm, vethamony p, arga chandrashekar a (2013a) barnacle larval transport in the mandovi–zuari estuarine system, central west coast of india."
20,"j oceanogr 69(4):451–466 grinson g, krishnan p, roy sd, sarma k, goutham bharathi mp, kaliyamoorthy m, krishnamurthy v, srinivasa kumar t (2013b) validation of potential fishing zone (pfz) forecasts from andaman and nicobar islands."
20,"fish technol 50:1–5 gross tf, werner fe, eckman je (1992) numerical modelling of larval settlement in turbulent bottom boundary layers."
20,"j mar res 50:611–642 grothues tm, cowen r (1999) larval fish assemblages and water mass history in a major faunal transition zone."
20,"cont shelf res 19:1171–1198 guisan a, zimmermann ne (2000) predictive habitat distribution models in ecology."
20,"ecol model 135:147–186 hare ja, fahay mp, cowen rk (2001) spring time icthyoplankton of the slope region off the north-eastern united states of america: larval assemblages, relation to hydrography and implications for larval transport."
20,"fish oceanogr 10(2):1774–1789 hare ja, churchill jh, cowen rk, berger tj, cornillion pc, dragos p, glenn sm, giovoni jj, lee tn (2002) routes and travel rates of larval fish transport from the southeast to the northeast united states continental shelf."
20,limnol oceanogr 47(6):1774–1789
21,450 g.
21,george harmelin-vivien m (1994) the effects of storms and cyclones on coral reefs: a review.
21,j coast res 12:211–231 hjort j (1914) fluctuations in the great fisheries of northern europe viewed in the light of biological research.
21,"rapports et procs-verbaux des runions du conseil permanent interna- tional pour l’exploration de la mer 20:1–228 hooker sb, rees nw, aiken j (2000) an objective methodology for identifying oceanic prov- inces."
21,"prog oceanogr 45:313–338 huntsman sa, brink kh, barber rt, blasco d (1981) the role of circulation and stability in controlling the relative abundance of dino-flagellites and diatoms over the peru shelf."
21,in: richards fa (ed) coastal upwelling.
21,"american geophysical union, washington, dc, pp 357–365 krishnakumar pk, bhat gs (2008) seasonal and interannual variations of oceanographic condi- tions off mangalore coast (karnataka, india) during 1995–2004 and their influences on pelagic fishery."
21,"fish oceanogr 17:45–60 krishnan p, dam-roy s, grinson g, srivastava rc, anand a, murugesan s et al (2011) elevated sea surface temperature during may 2010 induces mass bleaching of corals in the andaman."
21,"curr sci 100(1):111–117 krishnan p, grinson george, vikas n, titus-immanuel t, goutham-bharathi mp, anand a, vinod kumar k, senthil kumar s (2013) tropical storm off myanmar coast sweeps reefs in ritchie’s archipelago, andaman."
21,environ monit assess 185(6):5327–5338 lasker r (1975) field criteria for survival of anchovy larvae: the relation between inshore chlorophyll maximum layers and successful first feeding.
21,"fish bull 73:453–462 laurs rm, lynn rj (1977) seasonal migration of north pacific albacore, thunnus alalunga, into north american coastal water: distribution, relative abundance, and association with transition zone waters."
21,"fish bull us 75:795–822 laurs rm, fiedler pc, montgomery dr (1984) albacore tuna catch distributions relative to environmental features observed from satellites."
21,"deep sea res 31:1085–1099 leis jm, hay ac, trnski t (2006) in situ ontogeny of behaviour in pelagic larvae of three temperate, marine, demersal fishes."
21,mar biol 148:655–669 levin la (1990) a review of methods for labelling and tracking marine invertebrate larvae.
21,"ophelia 32:115–144 li wkw, head ejh, harrison wg (2004) macroecological limits of heterotrophic bacterial abundance in the ocean."
21,"deep sea res i: oceanogr res pap 51:1529–1540 liu g, strong ae, skirving w (2003) remote sensing of sea surface temperature during 2002 barrier reef coral bleaching."
21,"eos 84(15):137–144 longhurst ar, wooster ws (1990) abundance of oil sardine sardinella longiceps and upwelling on the southwest coast of india."
21,"can j fish aquat sci 47:2407–2419 longhurst ar, sathyendranath s, platt t, caverhill c (1995) an estimate of global primary production in the ocean from satellite radiometer data."
21,"j plankton res 17:1245–1271 madhu nv, maheswaran pa, jyothibabu r, sunil v, revichandran c, balasubramanian t, gopalakrishnan tc, nair kkc (2002) enhanced biological production off chennai triggered by october 1999 super cyclone (orissa)."
21,"curr sci 82(12):1472–1479 madhupratap m, shetye sr, nair knvs (1994) oil sardine and indian mackerel: their fishery, problems and coastal oceanography."
21,"curr sci 66s:340–348 mahendra rs, bisoyi h, prakash cm, velloth s, sinivasa kumar t, nayak s (2010) applications of the multi-spectral satellite data from irs-p6 liss-iii and irs-p4 ocm to decipher submerged coral beds around andaman islands."
21,int j earth sci eng 3(5):626–631 margalef r (1961) correlations entre certains caracte ‘res synthe’ tiques des populations de phytoplancton.
21,"hydrobiologia 18:155–164 martins im, dias jm, fernandes eh, muelbert jh (2007) numerical modelling of fish eggs dispersion at the patos lagoon estuary–brazil."
21,"j mar syst 68:537–555 matsuura h, sugimoto t, nakai m, tsuji s (1997) oceanographic conditions near the spawning ground of southern bluefin tuna; northeastern indian ocean."
21,j oceanogr 53:421–434
22,18 numerical modelling and satellite remote sensing as tools for research. . .
22,"451 mohanty pc, mahendra rs, bisoyi h, tummula sk, grinson g, nayak s, sahu bk (2013) assessment of the coral bleaching during 2005 to decipher the thermal stress in the coral environs of the andaman island using remote sensing."
22,"eur j remote sens 46:417–430 moisen gg, freeman ea, blackard ja, frescino ts, zimmermann ne, edwards tc jr (2006) predicting tree species presence and basal area in utah: a comparison of stochastic gradient boosting, generalized additive models, and tree-based methods."
22,"ecol model 199:176–187 moser hg, smith pe (1993) larval fish assemblages and oceanic boundaries."
22,"bull mar sci 53:283–289 nair tb, sirisha p, sandhya kg, srinivas k, sanilkumar v, sabique l, nherakkol a, krishnaprasad b, rakhikumari jc, kaviyazhahu k, rameshkumar m, harikumar r, shenoi ssc, nayak s (2013) performance of the ocean state forecast system at indian national centre for ocean information services."
