page,p
22,"curr sci 105(2):175–181 nayak sr, solanki hu, dwivedi rm (2003) utilization of irs p4 ocean colour data for potential fishing zone – a cost benefit analysis."
22,indian j mar sci 32(3):244–248 ncaer (2010) impact assessment and economic benefits of weather and marine services.
22,"national council of applied economic research, new delhi, 104 p okubo a (1994) the role of diffusion and related physical processes in dispersal and recruitment of marine population."
22,"in: sammarco p, heron m (eds) the bio-physics of marine larval dispersal."
22,"american association for the advancement of science/american geophysical union, washington, dc, pp 5–32 oliver mp, shelton pa (1993) larval fish assemblages of the benguela current."
22,"bull mar sci 53 (2):450–474 pauly d, watson r (2003) counting the last fish."
22,"sci am 289:42–47 pineda j (2000) linking larval settlement to larval transport: assumptions, potentials, and pitfalls."
22,"oceanogr east pac i:84–105 platt t, sathyendranath s (2008) ecological indicators for the pelagic zone of the ocean from remote sensing."
22,"remote sens environ 112:3426–3436 platt t, yaco cf, frank kt (2003) spring algal bloom and larval fish survival."
22,"nature 423:398–399 platt t, sathyendranath s, fuentes-yaco c (2007) biological oceanography and fisheries man- agement: perspective after 10 years."
22,"ices j mar sci: j du cons 64(5):863–869 raghavan b, raman m, chauhan p, kumar bs, shylini s, mahendra r, nayak s (2006) summer chlorophyll-a distribution in eastern arabian sea off karnataka-goa coast from satellite and in-situ observations."
22,"in: frouin rj, agarwal vk, kawamura h, nayak s, pan d (eds) proceedings of spie, vol 6406, remote sensing of the marine environment, volume b 269, goa, india, p 64 rao kh, smitha a, ali mm (2006) a study on cyclone induced productivity in south-western bay of bengal during november-december 2000 using modis (sst and chlorophyll-a) and altimeter sea surface height observations."
22,"indian j mar sci 35(2):153–160 rivonker cu, verlencar xn, reddy mpm (1990) physico-chemical characteristics of fishing grounds off mangalore, west coast of india."
22,"indian j mar sci 19:201–205 rogers dj, fish bc (1991) marine algal lectins."
22,lectin rev 1:129–142 ryther jh (1969) photosynthesis and fish production in the sea.
22,"science 166(3901):72–76 santos amp, fiuza afg, laurs rm (2006) influence of sst on catches of swordfish and tuna in the portuguese domestic longline fishery."
22,int j remote sens 27(15):3131–3152 sathiadhas r (2006) socio-economic scenario of marine fisheries in india – an overview.
22,"in: kurup bm, ravindran k (eds) sustain fish."
22,"paico press, school of industrial fisheries, cochin, pp 84–101 sathyendranath s, longhurst a, caverhill cm, platt t (1995) regionally and seasonally differentiated primary production in the north atlantic."
22,"deep sea res i: oceanogr res pap 42:1773–1802 seki mp, polovina jj, brainard re, bidigare rr, leonard cl, foley dg (2001) observations of biological enhancement at cyclonic eddies tracked with goes thermal imagery in hawaiian waters."
22,geophys res lett 28(8):1583–1586
23,452 g.
23,"george sherman k, o’reilly j, belkin i, melrose c, friedland kd (2011) the application of satellite remote sensing for assessing productivity in relation to fisheries yields of the world’s large marine ecosystems."
23,ices j mar sci 68:667–676 simpson jj (1987) transport processes affecting the survival of pelagic fish stocks in the california current.
23,in: 10th annual larval fish conference: american fisheries society sympo- sium 2.
23,"american fisheries society, pp 39–59 smitha br, sanjeevan vn, kumar kgv, revichandran c (2008) on the upwelling off the southern tip and along the west coast of india."
23,"j coast res 24:95–102 solanki hu, raman m, kumari b, dwivedi rm, narain a (1998) seasonal trends in the fishery resources off gujarat: salient observations using noaa-avhrr."
23,"indian j mar sci 27:438–444 solanki hu, dwivedi rm, nayak sr (2001) synergistic analysis of seawifs chlorophyll concentration and noaa-avhrr sst features for exploring marine living resources."
23,"int j remote sens 22:3877–3882 solanki hu, dwivedi rm, nayak sr, gulati dk, john me, somavanshi vs (2003) potential fishing zone (pfzs) forecast using satellite data derived biological and physical processes."
23,"j indian soc remote sens 31(2):67–69 solanki hu, pradhan y, dwivedi rm, nayak s, gulati dk, somvamshi vs (2005) application of quikscat seawinds data to improve remotely sensed potential fishing zones (pfzs) forecast methodology: preliminary validation results."
23,"indian j mar sci 34(4):441–448 stuart v, platt t, sathyendranath s (2011) the future of fisheries science in management: a remote-sensing perspective."
23,"ices j mar sci: j cons 68(4):644–650 waluda cm, rodhouse pg, trathan pn, pierce gj (2001) remotely sensed mesoscale oceanog- raphy and the distribution of illex argentinus in the south atlantic."
23,"fish oceanogr 10:207–216 yentsch cs, garside jc (1986) patterns of phytoplankton abundance and biogeography."
23,"in: pierrot-bults ac, van der spoel s, zahranec bj, johnson rk (eds) pelagic biogeography, unesco technical papers in marine science, 49."
23,"unesco, paris, pp 153–163 yoder ja, atkinson lp, lee tn, kim hh, mclain cr (1981) role of upwelling on phytoplank- ton patches on the outer southeast shelf."
23,"limnol oceanogr 26:1103–1110 yokouchi k, takeshi k, matsumoto i, fujiwara g, kawamura h, okudak k (2000) octs-derived chlorophyll-a concentration and oceanic structure in the kuroshio frontal region off the joban/ kashima coast of japan."
23,remote sens environ 73:188–197 view publication stats
