page,p
1,"see discussions, stats, and author profiles for this publication at: https://www.researchgate.net/publication/267025546 numerical modelling and satellite remote sensing as tools for research and management of marine fishery resources chapter · september 2014 doi: 10.1007/978-3-319-06326-3_18 citations reads 15 491 1 author: grinson george central marine fisheries research institute 188 publications 1,472 citations see profile all content following this page was uploaded by grinson george on 18 may 2018."
1,the user has requested enhancement of the downloaded file.
2,"chapter 18 numerical modelling and satellite remote sensing as tools for research and management of marine fishery resources grinson george abstract this chapter outlines the use of modelled and satellite remote sensing (srs) data in supporting the research, technology-development and management of marine fishery resources."
2,the value of such methods used in marine fisheries management is emphasized.
2,"state of art techniques in fisheries resource management utilizing numer- ical models, and srs, separately and jointly, are described here."
2,numerical models are useful for studying fish and other aquatic invertebrate larval transport.
2,"srs data are used to locate fish stocks, locate areas of reef stress and delineate areas of high productivity in the wake of cyclone paths."
2,"coupling srs with models helps to manage fishery resources on an ecosystem scale, generate potential fishing zones (pfz), forecast ocean state (osf), detect meso-scale features such as eddies and track cyclones threatening coastal resources."
2,"modelled, srs and in situ data sets in combination can be used in the estimation of potential fishery resources in the exclusive economic zone (eez), which in turn can help in fishing fleet management."
2,"hence, there is a huge scope for application of numerical modelling and srs in marine fisheries research and management."
2,18.1 introduction data collection in an oceanic environment is tedious and expensive.
2,"so as to enable wide use of in situ data, various organizations are hosting their databases on world wide web (table 18.1)."
2,but often marine fisheries research and management lack in situ environmental time series data (platt et al.
2,2007).
2,both modelled and satellite remote sensing (srs) data validated for time and space can be used to fill such gaps.
2,implementation of complex numerical models is frustrated by lack of g.
2,"george (*) fishery resources assessment division, central marine fisheries research institute, ernakulam north p.o., kochi, p.b.no."
2,"1603 682018, india e-mail: grinson@cmfri.org.in; grinsengeorge@gmail.com c.w."
2,finkl and c.
2,"makowski (eds.), remote sensing and modeling: 431 advances in coastal and marine resources, coastal research library 9, doi 10.1007/978-3-319-06326-3_18, © springer international publishing switzerland 2014"
3,432 g.
3,george table 18.1 various organizations maintaining world wide web databases on fish resources organization web address central marine fisheries research institute http://cmfri.org.in/annual- data.html commission for the conservation of southern bluefin tuna http://www.ccsbt.org/ (ccsbt) conservation of arctic flora and fauna (caff) http://www.grida.no/prog/ polar/caff convention on the conservation of antarctic marine living http://www.ccamlr.org/ resources (ccamlr) food and agriculture organization of the united nations (fao) http://www.fao.org/ indian national centre for ocean information services (incois) http://odis.incois.gov.in/ indian ocean tuna commission (iotc) http://www.iotc.org/english/ index.php inter-american tropical tuna commission (iattc) http://www.iattc.org/ international commission for the conservation of atlantic tunas http://www.iccat.int/ (iccat) international council for the exploration of the seas (ices) http://www.ices.dk/ international pacific halibut commission (iphc) http://www.iphc.washington. edu/ international whaling commission (iwc) http://www.iwcoffice.org/ north atlantic salmon conservation organization (nasco) http://www.nasco.int/ north pacific anadromous fish commission (npafc) http://www.npafc.org/ north pacific marine science organization (pices) http://www.pices.int/ north-east atlantic fisheries commission (neafc) http://www.neafc.org/ northwest atlantic fisheries organization (nafo) http://www.nafo.int/ secretariat of the pacific community (spc) http://www.spc.int/ western and central pacific fisheries commission (wcpfc) http://www.wcpfc.int/ data inputs whereas simple models ignore some complexities in the marine eco- system.
3,as a result model outputs have not been analysed to the extent they deserved.
3,"in case of srs, algorithms for data retrieval vary spatially and temporally depending on the nature of optical constituents present, especially in coastal waters."
3,but modelled and srs data can permit at least qualitative inferences when we address some of the major unresolved questions in fisheries biology.
3,"with the advent of improved computing facilities and srs, last two decades have seen increased activity in both ecosystem modelling and ocean biology from space (chassot et al."
3,2011).
3,the results are used for operational and applied marine fisheries research (stuart et al.
3,2011).
3,this chapter discusses some of the applica- tions and illustrates them with particular case studies.
3,18.2 numerical models and their potential application to marine fish and invertebrate larval transport the benefit of numerical modelling is that the necessary state variables can be simulated at each grid point of the study domain.
3,advanced techniques such as finite element mesh and curvilinear contours have made modelling of irregular
4,18 numerical modelling and satellite remote sensing as tools for research. . . 433 coastline easier and decreased the complexities involved in formulating the numer- ical equations.
4,biological processes such as fish larval transport can be modelled based on a clear understanding of the physics of a water body.
4,"knowledge of local hydrody- namics is a pre-requisite to modelling coastal processes, given that physical drivers such as tides and currents control them."
4,there is a major role of diffusion and related physical processes in dispersal and recruitment of marine populations (okubo 1994).
4,tidal flows can move larvae passively in peak tidal velocities (levin 1990; gross et al.
4,1992).
4,"physical processes influence the distribution of larval fish on a variety of scales, ranging from few meters to thousands of kilome- ters (bruce et al."
4,2001; hare et al.
4,2002).
4,there are few larval transport studies in the coastal waters in particular regions (moser and smith 1993; oliver and shelton 1993; grothues and cowen 1999; hare et al.
4,2001).
4,two related studies are discussed in the following section.
4,18.2.1 fish larval transport modelling as an example of bio-physical processes the basic idea in fish larval transport studies is to characterise the passive move- ment of larvae during the planktonic larval duration (pld) phase of the species studied.
4,"during the pelagic larval phase, the larvae may be dispersed or retained in passive response to physical forcing (cowen and sponaugle 2009)."
4,it is a phase that larvae are considered as “poorswimmers” (leis et al. 2006) because the hydrody- namic (hd) forcing on them exceeds their swimming ability.
4,there are various hd models to provide the spatial and temporal current patterns.
4,digitized bathymetry maps are used for defining the study domain.
4,inputs such as tide and wind are given in the model as the major physical forcings driving the current.
4,simulation will produce the hd variables as output at every grid point for the time interval required.
4,the currents generated in these models can be validated using observed data at certain grid points to ascertain the model accuracy.
4,"this hd input, along with the physical forcings, is applied to larval transport models to deduce the dispersion pattern of larvae."
4,simulation results provide information on the retention of larvae (as concentration of larvae) at every grid point (cowen and sponaugle 2009).
4,a common strategy employed in this kind of model is to predict the maximum likelihood of retention of investigated species based on habitat attributes (guisan and zimmermann 2000; moisen et al.
4,2006; elith and graham 2009).
4,"during breeding seasons, the areas of maximum likeli- hood retention of larvae can be demarcated as nursery grounds or marine protected areas for aiding larval survival."
4,numerical modelling of fish egg dispersion at the patos lagoon estuary in brazil was carried out by martins et al.
4,(2007).
4,a similar study combining observational data with a two-dimensional numerical model product has been carried out to
5,434 g.
5,george determine the fate of fish eggs released in a semi enclosed basin (grinson et al. 2011a).
5,"fish eggs were treated as passive particles in the model, and were released from probable spawning sites identified during exploratory surveys."
5,areas with retention of larvae above 30 % were demarcated as nursery areas.
5,model simulation of eggs from different spawning sites showed varying dispersal patterns.
5,about 80 % of the particles were retained in the basin for all the three seasons studied.
5,complete retention of particles occurred in the southern part of study domain.
5,a small quantity is flushed out at the northern boundary.
5,this could be the reason for more fish larvae in the southern part.
5,trawler catches from scientific surveys show a higher abundance of adult fish in the southern part compared to the north.
5,marine protected areas (mpa) in this study region are demarcated based on ecologically significant factors such as the presence of corals and mangroves.
5,the areas of maximum likelihood of retention of fish larvae differentiated by the numerical model reasonably corraborated with the mpa (grinson et al. 2011a).
5,"therefore, this sort of simulation can also help as a decision support tool in rightly demarcating the mpa."
5,similar experiment was carried out along an open coastal region (grinson 2011).
5,hd model results were validated with measurements (fig.
5,18.1a–c).
5,the modelled and predicted tidal levels showed very good match with no phase difference.
5,the modelled u and v-velocities agree well with the measured current velocities.
5,the larval tracks have a uniform pattern of dispersal southwards and they aggregate near the southern boundary during all the seasons (fig.
5,18.1).
5,we can infer that the hydrodynamics of the region promote occurrence of fish assemblages in the south- ern part of study domain.
5,this is consistent with earlier field studies from this region (rivonker et al. 1990) which have shown that the fishing grounds are spread over the southern part of the region without any seasonal change in the pattern.
5,"the scale and predictability of fish larval dispersion or retention remain unknown, largely due to measurement difficulties."
5,"utilization of high-resolution biophysical model allows multiple releases of virtual eggs, thus making each individual simulation equivalent to observations of numerous dispersal events."
5,"18.2.2 modelling larval transport and settling areas in case of bio-fouling organisms from ballast waters biofouling by barnacles poses a major threat to fishing, navigation, tourism and port-related activities."
5,the life cycle of barnacles includes a pelagic larval phase.
5,"therefore, the methodology used for modelling dispersal of larval fish can be applied for larval barnacles."
5,"the scale of dispersal depends on movement of the water masses, larval behaviour and duration of pelagic stages (table 18.2)."
5,this is characteristic of oceanic diffusion with a positive correlation between time and spread (pineda 2000).
6,18 numerical modelling and satellite remote sensing as tools for research. . .
6,435 fig.
6,"18.1 mangalore open coastal waters (a), hd modelling (b), hd validation (c) and fish larval transport indicating their aggregation towards southern boundary of the domain (d), which is a traditional fishing ground"
7,436 g.
7,"george table 18.2 distance pelagic larval duration distance traversed traversed by barnacles for different pelagic larval few hours 100–1,000 m duration scales as calculated 1–2 days 1 km by pineda (2000) 7–14 days 10–20 km 10–15 days 20–30 km 1–2 months 50–100 km 1 year 1,000 km fig."
7,18.2 barnacle larval transport modelling carried out in an open coast of goa and in mandovi- zuari estuary an application was worked out to estimate the extent of larval spread of barnacles from ballast water sources in different seasons.
7,"in the case-study discussed below, the larval dispersal and retention of barnacles in an estuarine mouth was examined (gaonkar et al."
7,2012; grinson et al. 2013a).
7,there is a spatial and temporal variation in the larval dispersal pattern from different spawning sites.
7,northern spawning sites of the study domain contributed larvae to the estuary during december and may.
7,"but, with the reversing wind and current, southern spawning sites contributed larvae to the estuary in october."
7,"larval transport is southward during december and may, reflecting the predominant wind direction."
7,in october the larvae spawned at northern sites were transported to the north and as consequence are lost from the estuary.
7,"larvae spawned at remaining sites in october might be transported either to the north or the south, depending on the timing of the reversal in winds."
7,the net transport in october is usually to the north (fig.
7,18.2).
7,numerical simulations of larval dispersal have limitations arising from the sim- plicity of the model in its biological and ecological aspects.
7,"rates of settling, natural mortality, predation and reproductive output may vary with season and with location."
7,"for example, higher temperatures can lead to early metamorphosis of larvae, leading to earlier settlement than at lower temperatures."
7,heavy rainfall result in lower salinity and increased land runoff leading to turbidity which increases larval mortality.
7,"therefore, the results of the simulations can be interpreted as maximum dispersal"
8,18 numerical modelling and satellite remote sensing as tools for research. . .
8,"437 table 18.3 geo-physical databases useful to fishery scientists website parameters http://218.248.0.134:8080/ocmwebscat/html/con sst, chl-a, ws and wd troller.jsp http://cersat.ifremer.fr/data/products/latest-products ws and wd http://oceandata.sci.gsfc.nasa.gov/readme.html sst, chl-a, pp http://odis.incois.gov.in/index.php/remote-sensing- aerosol, chl-a, fog, humidity, sst, data kd-490 and wind http://podaac.jpl.nasa.gov/coremeasurements sst, sss, occ, ssh, ssha, ws and wd http://www.aviso.oceanobs.com/en/data/products.html ssh, wind and wave http://www.eumetsat.int/website/home/data/products/ sst, wind ocean/index.html http://www.src.com/mm5/mm5_main_page.html ws and wd occ ocean currents and circulation, ssha sea surface height anomaly; kd-490- diffuse attenu- ation coefficient of down-welling irradiance at 490 nm and survival rates."
8,"however, this study did provide some basis for the observed variations in larval abundance, settlement and recruitment of barnacles which repre- sent the major biofouling agent from ballast waters."
8,"18.3 geo-physical datasets from srs in the context of marine fisheries research and management srs datasets are often used in empirical or semi-analytical validated models, either to extrapolate regional datasets in space or to generate derived geo-physical prod- ucts."
8,a simple example for this can be the summation of thermal signals from different wavelengths for generation of sst.
8,"in a similar way, some of the most useful and relevant environmental properties in fisheries research such as sea surface salinity (sss), ws and wd, sea surface height (ssh), chlorophyll-a (chl-a) and chl-a derived primary production (pp) are available online as processed and unprocessed geo-physical datasets (table 18.3)."
8,these datasets can be used to advantage in various fisheries research and management programmes.
8,a few such case studies are illustrated in this section.
8,18.3.1 srs chlorophyll data providing cues on fish stock variability variations between years in the seasonal cycle of srs chl-a have been implicated in fluctuations in fish stock variability (platt et al.
8,2003).
8,in this section we describe the results of an analysis of chl-a with indian oil sardine in the coastal waters of
9,438 g.
9,george india.
9,"fishing effort in the coastal waters of india changed little in the period 1998– 2006, with 238,772 fishing craft in 2005 (cmfri 2005) in comparison with 239,000 craft in 1997 (sathiadhas 2006)."
9,"thus, the variability in sardine landings during the study period, despite steady fishing effort, indicates that other factors such as environment or food to the sardines are involved."
9,"a correlation analysis between available environmental factors (sst, sea bottom temperature, surface salinity, surface dissolved oxygen, bottom dissolved oxygen, ph, nutrients, chlo- rophyll, zooplankton, rainfall, multivariate el niño southern oscillation index, coastal upwelling index, and derived sst) and sardine catch from the study area emphasised the high significance of chlorophyll compared with other environmen- tal factors in explaining the variability in sardine catch (krishnakumar and bhat 2008)."
9,"using their fine branchial apparatus, sardines feed predominantly on phyto- plankton and zooplankton."
9,"in a given area, chl-a is a good index of the food availability to sardines."
9,"summer surface chl-a from the study area lies in the range 0.1–5 mg/m3, and can be very high, from 5 to 10 mg/m3, during bloom periods (raghavan et al."
9,2006).
9,"given the wide dynamic range of chlorophyll concentration in the coastal waters of southwest india and the dominant role of chlorophyll as a determinant of variability in sardine stocks, it seems likely that much will be gained in studying this link in detail."
9,algal bloom in the study area often occurs during upwelling.
9,upwelling in the waters of the southwest coast of india (5–15 n latitude) and the variability in local physical parameters drives changes in the chlorophyll concentration (smitha et al.
9,2008).
9,"physical processes affect not only the magnitude of the plankton biomass, but also its species composition (huntsman et al. 1981), which may in turn affect larval fish feeding and survival (lasker 1975; simpson 1987)."
9,"according to the hjort-cushing match-mismatch hypothesis (hjort 1914; cushing 1974, 1990), the survival rate of fish larvae is a function of the match between timing of hatching of eggs and initiation of spring phytoplankton bloom."
9,the advent of srs provides information at the appropriate temporal and spatial scales for testing this hypothesis (platt et al.
9,2007).
9,"with srs, it is possible to characterize the spring bloom objectively based on the timing of initiation, amplitude and duration."
9,"the statistical moments of all of these properties, and their inter-annual variation, can be calculated and the results used to analyze the effect of ecosystem fluctuations on exploited fish stocks (platt et al."
9,2003).
9,"the case study presented below deals with the interannual variability of indian oil sardine (sardinella longiceps) stock in the southwest coastal waters of india and its relationship with the phytoplankton bloom characteristics computed from srs, with a view to explain larval survival and interannual variability at the synoptic scale (grinson et al."
9,2012).
9,the life cycle of sardines includes an active breeding season from may to september.
9,this coincides with the high chlorophyll concentration seen during may to september every year (fig.
9,18.3).
9,"thus, we find a probable connection between the life history of sardines and phytoplankton bloom dynamics."
9,this supports the finding that the fish itself times its breeding and adjusts its migration
10,18 numerical modelling and satellite remote sensing as tools for research. . .
10,439 fig.
10,"18.3 indian oil sardine migration (a), and seawifs satellite chlorophyll (b) peaks utilized for explaining the trophic link between the upwelling bloom biology (c) and sardine interannual variability along the south west coastal waters of india (source: grinson et al. 2012) to exploit the productive southwest monsoon period."
10,"in this study, magnitude of the bloom during initiation month is selected for characterization of bloom, which naturally falls in the month of may every year."
10,may is the most critical month for sardines because both bloom initiation and the beginning of sardines’ active breeding phase occur during this month.
10,a delay in the initiation of bloom in the area results in a delay in the onset of suitable conditions for survival of sardine larvae (grinson et al.
10,2012).
11,440 g.
11,george fig.
11,"18.4 hs and dhw generated during the bleaching events in 2010 in andaman sea indicating the stress levels reefs faced (provided as advisory by incois) 18.3.2 reef health advisories using srs derived sst globally, there are several instances of mass coral bleaching incidents leading to heavy reef mortality (krishnan et al."
11,2011).
11,the application of srs provides synoptic views of the global oceans in near-real-time for monitoring the reef areas (liu et al.
11,2003; bahuguna et al.
11,2008; mahendra et al.
11,2010).
11,sst during night time is an important parameter for assessment of the thermal conditions inducing the bleaching.
11,"srs provides sst information during day and night routinely, facilitating the development of a coral reef bleaching warning system to generate early warning advisories/bulletins in near real time."
11,"the estimation of monthly maximum mean using night time sst climatology retrieved using noaa, avhrr is used for generating reef health advisories to eliminate the effect of solar glare and reduce the variation in sst caused by the heating during day time."
11,threshold hotspot (hs) and daily heating week (dhw) values for a region are calculated the advisory (mohanty et al.
11,2013).
11,depending on the intensity of hs and dhw there can be advisories such as ‘no stress’; ‘watch’; ‘warning’ and ‘alert levels-i & ii’ which progressively indicate the severity of a potential bleaching event.
11,based on this study incois offers reef stress advisories (fig.
11,18.4) to alert
12,18 numerical modelling and satellite remote sensing as tools for research. . . 441 the reef managers to take appropriate measures to reduce the damage caused to reefs during bleaching events.
12,"18.3.3 srs data for cyclone tracks creating productive fishing grounds even though cyclones are devastating, there are some positive effects of cyclones on the fishery."
12,study of the effect of tropical cyclones on biological processes has gained momentum in the recent past.
12,"in thermally-stratified coastal waters, cyclones trigger the breaking up of nutrient-depleted surface waters and bring in nutrient-rich sub-surface waters inducing sudden algal blooms and enhancing the regional scale pp."
12,"the effect of physical forcings on pp, its variation and associated hydrography in the southwestern bay of bengal during the southwest monsoon (july) and post-cyclone period (november) of 1999 was studied by madhu et al."
12,"in the postcyclone period, the combined effects of well-mixed coastal waters and freshwater injection from the land runoff associ- ated with the cyclone brought nutrients to the mixed layer, which enhanced pp."
12,"potentially, such enhancement of pp results in improving the regional fishery."
12,but cyclone tracks alone will not provide the information on enhanced pp.
12,srs is able to detect the environmental changes caused by tropical cyclones.
12,geo-physical data sets from srs are useful in such studies for indicating possible productive fishing grounds after a lag following the cyclone (rao et al.
12,2006).
12,"18.3.4 demarcation of ecological provinces in support of an ecosystem approach to fisheries management globally, the ecosystem approach to fisheries management (eafm) is preferred as a basis for sustainable management of fish stock (garcia et al. 2003b)."
12,"in this context, it is useful to have a spatial structure for global oceans defined on the basis of ecological provinces rather than geo-political considerations."
12,there are various approaches for classifying the global oceans into ecological provinces (ekman 1953; margalef 1961; yentsch and garside 1986; cushing 1989; fanning 1992; sathyendranath et al.
12,1995).
12,"the classification by longhurst et al. 1995 is the most comprehensive, identifying some 50 biogeochemical provinces globally (longhurst et al."
12,1995).
12,some other methodologies require huge data sets for demarcating ecological provinces (hooker et al.
12,2000; li et al.
12,2004; alvain et al.
12,2005; sherman et al.
12,2011).
12,but there is lack of in situ data to support these approaches.
12,"as oceanic realms are dynamic, there are logistic issues in sampling."
13,442 g.
13,"george consequently, srs data are very useful to classification protocols."
13,pp derived from srs can be a very useful input as pp provinces subsume many oceano- graphic forcing mechanisms on synoptic scales (platt and sathyendranath 2008).
13,these ecological provinces are useful in fisheries management as the physical processes and the ecosystems in each province support characteristic fisheries different from those in nearby provinces (stuart et al.
13,2011).
