page,p
1,"the european journal of health economics (2020) 21:763–773 https://doi.org/10.1007/s10198-020-01171-2 original paper willingness to pay for an early warning system for infectious diseases sebastian himmler1 · job van exel1,2 · meg perry‑duxbury1 · werner brouwer1 received: 5 february 2019 / accepted: 25 february 2020 / published online: 16 march 2020 © the author(s) 2020 abstract early warning systems for infectious diseases and foodborne outbreaks are designed with the aim of increasing the health safety of citizens."
1,"as a first step to determine whether investing in such a system offers value for money, this study used contingent valuation to estimate people’s willingness to pay for such an early warning system in six european countries."
1,"the contingent valuation experiment was conducted through online questionnaires administered in february to march 2018 to cross-sectional, representative samples in the uk, denmark, germany, hungary, italy, and the netherlands, yielding a total sample size of 3140."
1,mean willingness to pay for an early warning system was €21.80 (median €10.00) per household per month.
1,"pooled regression results indicate that willingness to pay increased with household income and risk aversion, while they decreased with age."
1,"overall, our results indicate that approximately 80–90% of people would be willing to pay for an increase in health safety in the form of an early warning system for infectious diseases and food-borne outbreaks."
1,"however, our results have to be interpreted in light of the usual drawbacks of willingness to pay experiments."
1,keywords infectious disease outbreaks · early warning system · willingness to pay · contingent valuation · cross-country comparison jel classification i18 · h41 introduction containing and mitigating large infectious outbreaks more rapidly (http://www.compa​re-europ​e.eu/).
1,increasing the health safety of citizens is an important establishing and maintaining such a system would likely policy goal in countries across the world.
1,recent infectious entail considerable costs.
1,"to determine whether this would outbreaks of, for example, ebola, sars, bird flu, and sal- be money well spent, it is essential to consider all its poten- monella, emphasise that improving safety cannot always tial benefits."
1,the relevant benefits could include a reduc- be realised by countries separately [1].
1,"recently, for exam- tion in disease burden, increased feeling of safety, or the ple, the european union has initiated an interdisciplinary mitigation of economic consequences of infectious diseases research network that investigates the potential for an inter- and food-borne outbreaks, which can be considerable for national, integrated early warning system for identifying, countries, organisations and individuals."
1,"for instance, the economic impact of the ebola crisis in 2014–2015 on sierra leone, guinea and liberia was estimated at $2.8 billion [2]."
1,"however, in general, reliable evidence and estimates of electronic supplementary material the online version of this these potential benefits of an early warning system, sepa- article (https​://doi.org/10.1007/s1019​8-020-01171​-2) contains supplementary material, which is available to authorized users. rately or overall, are scarce and difficult to obtain, especially in the case of multinational initiatives."
1,"in light of this and * sebastian himmler the fact that the full potential benefits would include, besides himmler@eshpm.eur.nl aspects such as health gains, also elements like the improved 1 erasmus school of health policy & management, erasmus feeling of health safety, it is not possible to quantify the over- university rotterdam, p.o."
1,"box 1738, 3000 dr rotterdam, all benefits of such an international early warning system the netherlands based on existing data."
1,"2 erasmus school of economics, erasmus university rotterdam, rotterdam, the netherlands 13 vol.:(0123456789)"
2,764 s.
2,himmler et al.
2,"therefore, in this study, we aim to provide an indication they examined the methodologies of empirical research valu- of the perceived overall value of such a system in terms of ing safety from all relevant fields, including environment, improving citizen’s feelings of health safety."
2,for that pur- transportation and health [5].
2,"of the 33 papers reviewed, 22 pose, we first develop a contingent valuation willingness- were found to use the contingent valuation method to value to-pay approach, which provides such a valuation, given the effects of safety-affecting interventions."
2,the four papers beliefs and sentiments in the population regarding all dif- in the field of health that empirically valued interventions ferent aspects of a warning system.
2,"second, we apply this increasing health safety, all used a form of stated preference approach in six selected countries across europe (i.e., den- methodology."
2,"these papers aimed to estimate the value of mark, germany, hungary, italy, the netherlands, and the reducing mortality risks [6], preventing child maltreatment uk) to derive a range of estimates and assess the potential deaths [7], reducing the risk of sexually transmitted diseases implications of our results on an international level. [8] and vaccinations in pandemic outbreaks [9]."
2,the first this paper summarises our efforts to accomplish these three papers used willingness to pay (wtp) contingent valu- goals and its remainder is divided into four sections.
2,"first, ation method, while the last paper used a discrete choice we briefly summarise the findings from a previous literature experiment to elicit valuations. review surrounding the methods that have been applied in the literature review identified income to be a significant similar contexts, namely valuing health safety, to motivate predictor of wtp in all included contingent valuation stud- the chosen approach further."
2,"after that, we consecutively ies [10]."
2,"a higher level of education was associated with a report on the design and administration of our experiment, higher wtp in six of the nine papers that included infor- the data analysis, present the results of our study, and con- mation on education."
2,age and gender both also had strong clude the paper with a discussion of the limitations and correlations with wtp.
2,"however, these correlations were implications of our findings. positive in some of the studies and negative in others."
2,the literature review also reported results regarding relationships of wtp with risk (perception).
2,"for example, individuals background that had been directly or indirectly exposed to the outcome of interest reported a higher wtp, as did those who had a the introduction of an international integrated warning sys- higher level of perceived risk, were more knowledgeable or tem to increase health safety would not be necessary if com- more concerned about the issue, or were more concerned municable or infectious diseases were not a significant factor than others about the outcome under study."
2,"finally, study in the global burden of disease."
2,the burden of communi- design elements were shown to affect wtp estimates.
2,"for cable diseases in europe project found an average disease example, presenting scenarios with higher baseline risk was burden in germany alone of 33,116 disability adjusted life associated with a higher wtp."
2,"in addition, different stud- years (dalys) per year for influenza and 19,115 dalys ies found that presenting higher intervention costs or more per year for salmonella [3]."
2,"on a european level, influenza information about the intervention in the scenario descrip- was estimated to be responsible for 81.8 dalys lost per tion also affected the estimated wtp."
2,"however, the direc- 100,000 population between 2009 and 2013, correspond- tion of the effect differed between studies."
2,"the information ing to 412,673 dalys using the eu population size from provided by the literature review guided some of the meth- 2011 [4]. odological choices of our study, which are described next."
2,"considering these substantial effects of infectious dis- eases, some of the potential benefits of an international integrated warning system become clearer."
2,"of course, the methods real benefits also depend on the translation from warnings to effective interventions that prevent or mitigate the conse- survey administration and piloting quences of outbreaks."
2,"besides possible health gains resulting from this, there are also less tangible benefits from having a to estimate the wtp for an international integrated early warning system, which include an increase in health safety warning system for infectious diseases and food-borne out- and feeling more secure."
2,"the valuation of these benefits may breaks, we conducted contingent valuation experiments be less straightforward than calculating potential dalys utilising general population samples from six european averted. countries: denmark, germany, hungary, italy, the neth- the valuation of interventions affecting safety is relevant erlands, and the uk."
2,sampling and administration of the both within and outside the health care setting.
2,"for example, wtp questionnaire were conducted by a professional sam- environmental and transportation research is concerned with pling agency, from february to march 2018, using an online interventions, which aim to improve the safety of recipients. survey format."
2,the sampling agency recruited participants perry-duxbury et al. conducted a literature review in which from existing online panels.
2,the survey was administered 13
3,willingness to pay for an early warning system for infectious diseases﻿ 765 to citizens aged between 18 and 65.
3,"individuals aged 65 and to a reference point (home contents insurance1), which was above were not included for two reasons: first, recruiting included in the surveys."
3,the initial payment scale performed elderly respondents from online panels can be challenging in best and was therefore used in all surveyed countries. some of the included countries.
3,"second, we wanted to limit our population to the (income) taxpayers, as we used a tax survey design increase as payment vehicle in the experiment."
3,"the samples were aimed to be representative for national populations the general design of the wtp experiment followed the regarding age, gender and level of education, with a sample structure of an existing survey, which was purposely size of around 500 individuals per country."
3,participants were designed to elicit the wtp for a quality-adjusted life year able to complete the questionnaire on a computer or mobile (qaly) [13].
3,after a brief introduction to the topic at hand device.
3,"they did not receive a personal financial reward and the purpose and design of the questionnaire (see online for engaging in the experiment but could choose a charity, appendix a), respondents had to state their age and gender which would receive a small donation after completing the before describing their current health using a generic health survey."
3,"participants had to consent to their information being instrument (eq-5d-5l). used for research purposes and were free to drop out of the the following part of the questionnaire started with a experiment at any time. “warm-up” wtp exercise, where participants had to state the reasoning behind the country selection was to cover their wtp for a pair of shoes."
3,this elicitation task was a variety of cultural perspectives relevant to the valuation included to familiarise respondents with the procedure and of safety and public intervention.
3,the latter was assessed to test whether the chosen approach resulted in reasonable by applying the three most relevant dimensions of hofst- estimates for a common market good.
3,"next, respondents ede’s cultural dimensions theory in this context: individual- started with the central wtp task: valuing the early warn- ism vs collectivism, masculinity, and uncertainty avoidance ing system."
3,a two-stage procedure consisting of a two-step [11].
3,the included countries furthermore constitute a mix payment scale approach and an open-ended question was of different levels of social and economic development in applied to elicit individuals’ wtp.
3,the motivation for this europe.
3,"the questionnaire, which was initially developed approach has been outlined elsewhere [13–15]."
3,"in summary, in english, was translated into danish, german, hungarian, it intends to provide precise and direct maximum wtp valu- italian, and dutch by professional translators and checked ations, using a stepwise procedure that helps respondents to for comprehensibility and consistency by native speakers. form and articulate their preferences."
3,"in designing the experiment and payment scales, gbp and the scenario outlined to respondents was that establish- eur values were assumed to be equivalent, while monetary ing and maintaining an international integrated warning values and payment scales were converted from gbp into system, which could contain and mitigate infectious disease dkk and huf using the mean exchange rate from february and food-borne outbreaks, naming ebola, sars, bird flu and 2018."
3,"in the case of hungary, this was additionally adjusted salmonella as examples, is not without costs."
3,participants for purchasing power [12].
3,payment scales were rounded to then were asked to imagine that the funding of such an inter- natural integer values in all survey versions to prevent pecu- national warning system would take place through national liar payment options.
3,the payment scale of the uk survey taxation in the participating countries.
3,all eligible people in and the equivalent monetary values for danish crowns and their country (aged 18 and above) would have to contribute hungarian forint can be found in online appendix d. via monthly instalments starting immediately.
3,"the payment before the launch of the main survey, the questionnaire was framed as a recurrent tax since most respondents in was tested in both a group of experts in infectious diseases european countries are likely familiar with similar forms and food-borne outbreaks associated with the compare of payments."
3,this scenario did not include information on research network (n = 22) and a representative sample of the the magnitude of the potential health benefits.
3,the reason- public in the uk (n = 134) in january 2018.
3,"the length of ing behind that was to emphasise the perceived feelings of the survey was slightly reduced following the pilot tests. health safety due to such a system in the elicitation rather after this stage of piloting, the questionnaire was fielded than a particular hypothetical gain in health, also because in a representative sample of uk citizens (n = 533)."
3,to test the potential benefits are uncertain at this stage.
3,"this could the payment scale used in the experiment, we administered provide a broad valuation based on the beliefs and attitudes two additional surveys (n = 500 each): one with smaller pay- of the respondents themselves."
3,"information on the types ment options, and the other asking for yearly contributions instead of monthly contributions."
3,"the validity of the results of the three survey versions was assessed based on whether 1 home contents insurance is a common type of insurance, which wtp was influenced by income and based on a comparison covers the possessions in your home against risks like fire, theft and storm."
4,766 s.
4,himmler et al. of local systems already in place and how these would be ex-ante mitigation [16].
4,the design and the exact wording integrated into this international system was also omitted. of the wtp questions can be found in appendix c.
4,"the not only would this be cognitively burdening, the chosen questionnaire continued with two additional wtp valuation approach also conformed more closely to the general defi- scenarios involving different degrees of risk reduction and nition of the compare project and hence warning system disease severity, which will not be discussed in this paper. at this stage."
4,"while this leaves respondents with imperfect subsequently, respondents had to provide further socio- information, this was intentional, as our goal was to value demographic information."
4,"estimates for household income a warning system which features are not yet fully clear, in were obtained in a two-step process."
4,respondents first terms of the incremental feelings of health safety that comes selected an income range before indicating an exact amount. with it.
4,"missing exact income amounts were imputed based on the in the first step of the initial stage of the willingness- sample means of the income interval selected in the first to-pay experiment, respondents were asked to indicate the step, if applicable. amounts they would definitely be willing to pay per month respondents were furthermore asked about whether they for having this international, integrated warning system, or their family had ever been exposed to an emerging infec- using a payment scale ordered from low to high gbp or tious disease or outbreak (yes/no), and about their general eur values (0, 1, 2, 3, 4, 5, 10, 15, 20, 25, 30, 40, 50, awareness related to emerging infectious diseases and food- 60, 70, 80, 100, 120, 150, 200, more)."
4,"the payment scale borne outbreaks, which was queried using 12 statements and for the uk contained the same values in gbp, the version a 7-point likert scale."
4,"the statements comprised of a collec- for denmark contained the same values converted to dkk tion of aspects found to be relevant in this context based on (and rounded), and the version of hungary was adjusted for the findings from the literature review (see online appendix purchasing power and converted to huf (and rounded)."
4,the b).
4,"finally, respondents completed a brief version of the hungarian and the danish scale are included in appendix d. health-risk attitude scale (hras) [17], which consists of six individuals who chose the “more” option on the payment statements about resolving risky health decisions that need scale subsequently had to indicate a value higher than 200 to be ranked on a 7-point likert scale ranging from “totally in an open-ended question."
4,"individuals who chose 0 as their disagree” to “totally agree”. maximum wtp had to select one of the following options the survey ended with a module asking respondents to specify the reason for this answer, with the following pre- whether they had home contents insurance, the size of the defined options: (i) not worth more than 0, (ii) unable to corresponding yearly premiums and how they would value pay more than 0, (iii) government task, or (iv) the option to the described early warning system in comparison to their formulate another reason in an open text field."
4,"the former contents insurance (lower, roughly the same or higher). two options were considered to indicate a true wtp of zero, these results of this final module were intended to serve while “government task” was designated as a protest zero. two purposes: first, they were used to test different types of entries in the open text field were evaluated and labelled payment scales before the rollout of the main survey."
4,sec- as either true zero or protest zero.
4,"individuals who chose a ond, comparing the contents insurance premiums people value between 1 and 200 were subsequently asked to mark actually pay and the stated relative value of early warning the amounts they would definitely not be willing to pay per system and contents insurance serves as a validity check of month on the same payment scale, excluding the wtp val- the stated wtp values."
4,"in addition to the survey data, we ues they had selected in the preceding step. collected country aggregate estimates on the relevant dimen- jointly, these two steps generated a wtp interval between sions of hofstede’s cultural dimension theory (masculinity, the highest amount that a respondent definitely was willing individualism, and uncertainty avoidance) and the level of to pay and the lowest amount he or she was definitely not trust in public institutions [18]. willing to pay."
4,"in the second stage of the wtp procedure, respondents had to indicate an exact amount within this data analysis interval that was closest to the maximum that they would be willing to pay per month."
4,"respondents could specify before analysing the data, we converted all monetary decimals in this second stage, not limiting the wtp to inte- values from danish, uk, and hungarian respondents to ger values."
4,"the elicited wtp amounts in the second step euro values using the average exchange rates during the were taken as the best approximation of people’s wtp for month of sampling (7.45 dkk/€, 1.14 £/€, 312 huf/€). the (health safety benefits from an) international integrated in the next step, cross-country data validity and compara- early warning system for infectious diseases."
4,"throughout bility were assessed by exploratory, descriptive analysis. the two steps, participants were reminded to keep their abil- we first inspected the proportions of and reasons for zero ity to pay in mind (their net monthly household income) wtp answers, distinguishing between true and protest before indicating any interval or specific value to prevent zeros."
4,we excluded protest zeros and wtp outliers from 13
5,willingness to pay for an early warning system for infectious diseases﻿ 767 table 1 descriptive statistics uk denmark germany hungary italy netherlands total monthly household income in ­eura 3339 (2974) 6417 (9004) 3076 (1919) 1214 (1149) 2495 (1662) 2715 (1632) 3214 (4372) age 42.06 (13.65) 40.99 (14.55) 43.08 (13.35) 41.76 (13.23) 41.65 (13.94) 43.52 (14.91) 42.18 (13.97) female 0.50 (0.50) 0.49 (0.50) 0.52 (0.50) 0.51 (0.50) 0.52 (0.50) 0.49 (0.50) 0.51 (0.50) no finished secondary education 0.02 (0.15) 0.08 (0.28) 0.02 (0.15) 0.03 (0.16) 0.02 (0.12) 0.03 (0.16) 0.03 (0.18) finished high school (or similar) 0.50 (0.50) 0.54 (0.50) 0.65 (0.48) 0.55 (0.50) 0.60 (0.49) 0.59 (0.49) 0.57 (0.50) tertiary education 0.48 (0.50) 0.38 (0.49) 0.33 (0.47) 0.42 (0.49) 0.39 (0.49) 0.38 (0.49) 0.40 (0.49) marriedb 0.60 (0.49) 0.52 (0.50) 0.58 (0.49) 0.62 (0.49) 0.57 (0.50) 0.57 (0.49) 0.58 (0.49) employed 0.56 (0.50) 0.49 (0.50) 0.58 (0.49) 0.66 (0.48) 0.44 (0.50) 0.52 (0.50) 0.54 (0.50) self-employed 0.09 (0.29) 0.06 (0.24) 0.10 (0.30) 0.08 (0.27) 0.19 (0.39) 0.08 (0.27) 0.10 (0.30) unemployed 0.06 (0.24) 0.08 (0.27) 0.04 (0.21) 0.04 (0.19) 0.10 (0.29) 0.06 (0.24) 0.06 (0.24) homemaker 0.11 (0.31) 0.03 (0.16) 0.07 (0.26) 0.04 (0.19) 0.09 (0.29) 0.06 (0.24) 0.07 (0.25) student 0.06 (0.23) 0.17 (0.37) 0.08 (0.27) 0.07 (0.25) 0.10 (0.30) 0.11 (0.31) 0.10 (0.30) retired 0.08 (0.27) 0.13 (0.33) 0.12 (0.32) 0.10 (0.30) 0.08 (0.27) 0.06 (0.23) 0.09 (0.29) unable to work 0.05 (0.21) 0.05 (0.22) 0.01 (0.12) 0.02 (0.15) 0.00 (0.06) 0.11 (0.31) 0.04 (0.20) eq-5d-5l sum score (0–100) 86.76 (18.05) 83.86 (17.99) 85.41 (16.98) 88.99 (14.49) 87.50 (14.64) 88.94 (14.14) 86.91 (16.24) awareness of o­ utbreaksc 52.89 (8.06) 50.91 (7.79) 51.64 (8.51) 52.68 (8.21) 55.15 (8.04) 49.95 (8.26) 52.21 (8.31) % with no past exposure 0.90 (0.30) 0.67 (0.47) 0.72 (0.45) 0.38 (0.49) 0.87 (0.33) 0.69 (0.46) 0.71 (0.45) % with no family past exposure 0.06 (0.23) 0.18 (0.38) 0.13 (0.34) 0.17 (0.37) 0.05 (0.22) 0.11 (0.31) 0.11 (0.32) % with no personal past exposure 0.06 (0.23) 0.21 (0.41) 0.18 (0.38) 0.48 (0.50) 0.09 (0.28) 0.23 (0.42) 0.20 (0.40) hrasd 29.32 (5.99) 27.17 (5.55) 28.87 (5.92) 28.68 (4.89) 30.10 (5.32) 28.83 (5.88) 28.84 (5.68) observations 553 514 522 504 523 524 3140 standard deviation in brackets a income information was only available for 2772 respondents b includes registered partnerships or cohabiting c scored from 12 to 84 (12 questions with seven levels) d health risk attitude scale scored from 6 to 42 (6 questions with seven levels) the remainder of the analysis.
5,the latter was defined as results wtp values larger than 5% of monthly household income.
5,descriptive statistics were calculated based on the remain- characteristics of country samples ing wtp valuations.
5,linear regression analysis was conducted on the wtp the total number of completed surveys from the six cho- valuations from all six countries to examine which factors sen european countries was 3140.
5,"unfortunately, infor- influenced the wtp answers and whether the observed mation on the response rate or the share of respondents effects were in line with theoretical considerations as well starting, but not finishing the survey could not be obtained as previous empirical findings of wtp determinants (see from the sampling agency."
5,"on average, it took respondents section “background”)."
5,the regression analysis thus func- 18.9 min (sd 11.2) to complete the questionnaire.
5,"the tions as a validity check for our experimental design and six samples were well balanced regarding age, gender and wtp results."
5,"we also explored the suitability of tobit education in their respective countries for the aimed subset or two-part-models for the regression analysis, however of individuals aged between 18 and 65."
5,descriptive statis- using root mean squared error and mean absolute error tics of the respondents per country are shown in table 1. as performance criteria revealed that standard linear the average gross monthly household income ranged from regression provided the best model fit.
5,calculations were €1214 in hungary to €6417 in denmark.
5,"employment sta- conducted using the pooled total sample, as well as the tus and educational attainment varied between countries, separate country-level samples."
5,descriptive analysis and as to be expected.
