page,p
5,the sub-samples also differed consider- regression analyses were performed using stata 15.0 ably in the rate of past exposure to infectious diseases and (stata corp.
5,stata statistical software: release 15. food-borne outbreaks (10% in the uk vs 62% in hungary).
5,"college station, tx: stata corp lp)."
6,768 s.
6,himmler et al.
6,"table 2 percentage of % share of zeros “true zero wtp” “protest zero” responses with wtp of zero (total) not worth it unable to pay gov’t task + protest uk 12.8 31.0 15.5 53.5 denmark 11.9 23.0 19.7 57.3 germany 15.7 20.7 15.9 63.4 hungary 23.2 9.4 12.0 78.6 italy 7.3 21.1 15.8 63.2 netherlands 18.1 15.8 15.8 68.4 total 14.8 18.8 15.3 66.0 table 3 wtp per month in mean sd median min max n eur excluding protest zeros and outliers uk 20.74 32.63 9.11 0.00 284.80 496 denmark 28.33 42.43 13.42 0.00 460.98 473 germany 21.01 30.27 10.00 0.00 250.00 457 hungary 8.89 13.80 3.85 0.00 144.21 397 italy 27.32 33.05 15.00 0.00 202.00 457 netherlands 22.71 29.04 10.00 0.00 250.00 433 total 21.80 32.32 10.00 0.00 460.98 2713 outliers defined as wtp exceeding 5% of monthly household income zero responses and protest answers outliers and willingness to pay estimates overall, 14.8% of respondents stated a wtp of zero, with turning to the actual wtp estimates, the elicited values a share of 7.3% in italy at the lower end and 23.2% in hun- for the lower interval of the first stage of the wtp exer- gary at the upper end."
6,"of those with a wtp of zero, most cise (“definitely be willing to pay”) had a mean of €14.68 respondents chose the pre-specified option “government (sd 23.65)."
6,the corresponding mean for the upper interval task” (57.3%) and only to a lesser extent the options “not (“definitely not willing to pay”) was €42.63 (sd 67.15).
6,"the worth it” (17.2%) and “unable to pay” (15.3%) to justify second stage produced a mean stated wtp for an interna- a wtp of zero, with considerable differences between tional integrated early warning system for infectious dis- countries."
6,"of the 47 qualitative responses in the category eases and food-borne outbreaks of €25.17 (median €10.07) “other”, 40 were classified to be similar to “government per month per household."
6,the standard deviation of €42.87 task” or as protest answers.
6,the remaining seven qualita- exemplifies a considerable heterogeneity in wtp within and tive responses were more related to whether the system across countries. would be worth installing.
6,"these, therefore, were included several outliers with values up to €1000 per month influ- in the “not worth it” category, which, together with “una- ence the mean wtp."
6,"the proportion of respondents with ble to pay” category, represent true zeros."
6,the entirety of a wtp above €100 in the analysed sample was 5.0% and “government task” and further protest answers (n = 306) ranged from 0.7% in hungary to 8.8% in italy.
6,"some of was treated as protest zeros and, therefore, not included these outliers might represent the real wtp of respondents, in the following wtp estimates and regression analysis. while others may be deliberate or incidental overstatements."
6,"table 2 presents the share of zero values per country as applying the above-described criterion, 4.8% of responses well as the indicated reasons for the zero valuations."
6,the qualified as outliers (n = 121) and were excluded from share of protest zeros among zeros varied between 53.5% the remainder of the analysis.
6,doing so reduced the mean in the uk and 78.6% in hungary.
6,individuals who pro- monthly wtp from €25.17 to €21.80 in the remaining sam- vided protest answers had a significantly lower income ple of 2713 observations.
6,"table 3 presents the corresponding (p = 0.010), higher age (p < 0.001), lower level of educa- values and further summary statistics, while."
6,"figure 1 pre- tion (p = 0.046) and only little awareness of outbreaks sents the distributions of all wtp values on country level. (p < 0.001) in comparison to respondents with non-protest for readability, values over €100 (4% of the total sample) answers. are trimmed off."
6,the mean monthly wtp varied from €8.89 in hungary and €28.33 in denmark.
7,willingness to pay for an early warning system for infectious diseases﻿ 769 fig.
7,"1 distribution of wtp values per country results from the included reference point, home con- both approaches were highly similar."
7,"moreover, the linear tents insurance, revealed that for 51.1% of insurance hold- specification avoided having to drop zero wtp values and ers (68.9% had this type of insurance) the perceived value provides a more straightforward interpretation."
7,the log of the warning system was more or less equal to the value wtp results can be made available upon request. of the contents insurance.
7,"in the subgroup that provided income had a highly significant and positive non-linear information on their monthly premiums, the mean differ- effect on the wtp, while age significantly reduced the ence between wtp and stated insurance premium was €5.28 wtp."
7,education did not affect wtp.
7,the highest levels of (50.7% within a €10 range).
7,"a higher perceived value of awareness of outbreaks and health risk aversion (hras) the warning system (24.7%) coincided with a wtp, which seemed to influence wtp, although the coefficient of the was larger than the insurance premium in 56.6% of cases."
7,a former was not significant.
7,"past exposure, marital status, lower perceived value (24.3%) fell in line with a relatively or not being employed, did not significantly affect wtp. lower wtp in 56.5% of cases."
7,the remaining columns of table 4 present the results on country level.
7,factors affecting wtp differed con- determinants of willingness to pay siderably between countries with some coefficients even switching signs.
7,"household income significantly increases table 4 column one lists the results of regressing the wtp in all six countries, whereas age was significantly wtp values on multiple individual characteristics using negatively associated with wtp in three of the countries. the pooled data from all six countries, excluding protest consistently positive (but not always significant) coef- answers and outliers."
7,"to account for the correlation of ficients were found for the highest quartiles of outbreak errors within countries, we used cluster-robust standard awareness and hras, i.e. being relatively most aware errors on country level in the regression models."
7,"the of the associated risks and being relatively most health number of observations dropped from 2713 to 2583, as risk-averse in general."
7,better health was associated with some respondents did not provide any information on their lower wtp throughout all countries.
7,alongside the differ- household income.
7,"as the wtp data were skewed, we ences in coefficients, the explanatory power of our model also analysed the data using log-transformed wtp val- changed substantially between countries."
7,the r2 varied ues.
7,"however, here we present the results using the raw between 0.117 for the german model and 0.247 for the wtp values as the general results, and implications of 13"
8,770 s.
8,himmler et al.
8,table 4 ols regressions on wtp excluding wtp outliers and protest zeros (1) (2) (3) (4) (5) (6) (7) pooled uk dk ger hun it nl log income 10.0*** (0.54) 7.95*** (2.34) 14.4** (4.58) 8.01*** (2.37) 5.55*** (1.77) 10.1*** (2.38) 8.08*** (2.65) age − 0.94** (0.29) − 1.29* (0.72) − 1.04 (0.92) 0.23 (0.71) − 1.27** (0.53) − 1.71** (0.85) − 0.27 (0.69) age-squared 0.01 (0.00) 0.01 (0.01) 0.003 (0.01) − 0.01 (0.01) 0.01** (0.01) 0.02 (0.01) − 0.002 (0.01) female − 3.85 (2.38) − 3.87 (2.95) − 13.4*** (3.50) − 6.28** (2.78) − 0.48 (1.24) 0.67 (3.25) 0.67 (3.16) tertiary educa- 2.41 (1.80) 4.76* (2.46) 10.65** (4.51) − 1.64 (3.19) 0.63 (1.49) 0.95 (3.37) − 1.11 (2.97) tion married 1.94 (1.33) 6.40** (2.51) − 0.14 (5.00) 2.27 (3.22) − 0.91 (1.67) 3.82 (3.22) − 2.13 (2.62) self-employed 2.55 (2.12) − 5.79 (4.40) 7.87 (11.91) − 0.31 (5.80) − 1.11 (3.44) − 0.01 (4.26) 11.1 (11.2) not employed − 2.13 (2.19) − 3.12 (2.56) 6.74 (4.68) − 4.10* (2.32) 0.05(1.90) − 6.47* (3.57) − 9.03*** (3.13) eq-5d-5la − 0.1** (0.07) − 0.08 (0.06) − 0.23 (0.18) − 0.03 (0.08) − 0.06 (0.06) − 0.43*** (0.14) − 0.05 (0.11) awareness 2nd − 1.09 (0.56) 1.36 (3.28) − 1.27 (5.96) − 2.83 (3.77) − 1.19 (1.83) 2.66 (4.42) − 1.15 (3.83) quart.
8,awareness 3rd − 2.43 (1.65) 4.88 (3.44) − 4.70 (5.78) − 5.41 (3.56) 0.93 (1.81) − 2.87 (4.11) − 3.89 (3.62) quart.
8,awareness 4th 4.26 (2.31) 11.03** (4.56) 2.04 (6.23) − 1.24 (4.54) 2.48 (2.52) 7.08 (4.47) 4.36 (5.50) quart.
8,no past expo- − 3.02 (2.77) − 3.21 (4.87) − 7.61** (3.80) − 5.46* (3.29) 2.25 (1.62) − 18.5*** (5.66) − 3.19 (3.21) sure hras 2nd − 0.38 (1.17) − 1.01 (2.91) − 0.98 (4.29) 5.52 (3.60) − 0.66 (2.06) − 4.55 (4.92) 0.06 (4.21) quart.
8,hras 3rd − 0.17 (1.69) 3.47 (3.12) 0.18 (4.59) 5.00 (3.50) − 0.83 (1.715) − 8.98* (4.58) − 1.76 (4.68) quart.
8,hras 4th 4.92* (2.04) 5.37 (3.97) 14.7** (6.31) 5.94 (3.94) 1.55 (2.11) 1.91 (5.14) − 1.07 (4.15) quart.
8,"constant − 10.8 (10.7) − 4.7 (26.1) − 34.1 (30.5) − 30.2 (27.9) 3.33 (12.4) 44.4 (30.0) − 13.5 (30.6) observations 2417 457 421 420 374 403 342 r2 0.16 0.17 0.22 0.12 0.17 0.25 0.16 aic 23,173 4409 4288 3981 2980 3875 3238 bic 23,202 4477 4357 4049 3047 3943 3303 rmse 29.3 29.6 38.6 27.1 12.7 29.0 26.9 hras health risk attitude scale; standard errors in parentheses; *p < 0.10, **p < 0.05, ***p < 0.01; outliers defined as wtp over 5% of monthly income a sum score rescaled from 0 to 100 italian model."
8,differences in model fit as measured by discussion aic/bic and rmse were even more substantial.
8,"when including variables in a stepwise procedure, the to estimate the value of an international integrated early conclusions for the pooled regression were reasonably stable warning system for infectious diseases and food-borne out- across model specifications (see online appendix e)."
8,"add- breaks aimed at increasing health safety, we developed a ing country dummy variables to the pooled model slightly two-stage contingent valuation experiment."
8,a survey con- diminished the effect of income.
8,"the respective coefficients taining the experiment was administered to balanced samples of hungary, italy and the netherlands were significant com- from denmark, germany, hungary, italy, the netherlands, pared to the uk as reference category."
8,this result indicates and the uk.
8,"the share of respondents indicating a wtp that even after controlling for socioeconomic characteristics, of zero varied between 7.3% in italy and 23.2% in hun- including income, wtp significantly differed between coun- gary, of which most were protest zeros."
8,excluding protest tries.
8,"hofstede’s cultural dimensions masculinity, individu- answers and outliers (with a wtp exceeding 5% of income), alism, and uncertainty avoidance, as well as trust in public the elicited overall mean monthly wtp per household was institution further explained these differences (see online €21.80 (median = €10.00)."
8,this value ranged from €8.89 appendix e). (median = €3.85) in hungary to €28.33 (median = €13.42) in denmark.
8,the corresponding standard deviations were 13
9,"willingness to pay for an early warning system for infectious diseases﻿ 771 substantial, expressing either diverse or ill-formed prefer- more detailed information on the actual functioning and ences."
9,differences between countries can partly be explained effectiveness of such a system.
9,"we also do not know about by the variation in purchasing power, hofstede’s cultural respondents’ expectations concerning potential future dimensions and trust in public institutions."
9,"the results, in (health safety) benefits through such a system."
9,"besides general, indicate that the majority of respondents see a cer- these tangible benefits, individuals might also have incor- tain value in the early warning system."
9,"regression analyses porated potential improvements in the feeling of safety showed that throughout countries and models, income, as due to the system in their wtp valuation, as well as other expected, was the most important determinant of the wtp benefits."
9,"respondents may have unrealistic expectations values elicited in our experiment. regarding the potential (health) benefits of the early warn- ing system, leading to distorted wtp valuations."
9,"however, limitations and validity as mentioned earlier, individuals make similar decisions without complete knowledge of real risks or benefits when before discussing the implications of our findings, we must deciding on specific types of insurance coverage."
9,"in both acknowledge several limitations inherent to our analysis and cases, they include perceived risks and benefits in their the contingent valuation approach."
9,individual wtp esti- decision-making. mates are susceptible to the design and framing of a wtp one further noteworthy limitation of our study is the exercise (see for example [19]).
9,"for instance, by instructing exclusion of individuals aged 65 and above."
9,"one could argue respondents to consider other similar contributions to inform that the wtp would be higher in the excluded group as they their wtp (see online appendix c), we may have intro- are in general more vulnerable to infectious diseases."
9,"we do duced a possible anchor point for some individuals, biasing not find strong evidence for this hypothesis, considering that our results [20]."
9,"furthermore, by listing very serious (but the coefficients of age-squared are not significant in general low probability) threats like ebola, sars and bird flu in the and small in size."
9,"future studies could investigate this age description of what the system aims to contain and mitigate, group further. respondents may have overestimated the potential health despite these limitations, there are several aspects, which gains of the system."
9,"however, as the aim of our analysis generate some confidence in the validity of the chosen was to capture gains in their feelings of safety in the valu- design and our findings."
9,"for instance, the included warm-up ation, this is of less concern."
9,"a possibly more problematic exercise eliciting the wtp for the market good shoes pro- concern of this type of contingent valuation studies is the vided plausible results, with means ranging between €61.09 respondent’s sensitivity to the chosen payment scale [19, in hungary and €138.54 in denmark."
9,these results suggest 21].
9,it has also been reported that valuations are relatively that the respondents understood the question format and the insensitive to framing the payment as a monthly or yearly wtp elicitation exercises and answering formats.
9,"results instalment [22]. from the survey module about contents insurance further- to reduce the effects of such potential biases in our more indicate, that the stated wtp, i.e. the perceived value study, we tested two additional versions of our survey, of the system, somewhat corresponded to an actual wtp. varying payment scale and frequency of payment, and this can be inferred from comparing elicited wtp and pre- chose the survey version, which provided the most inter- miums paid for home contents insurance (as reported by nally consistent results."
9,"the two-stage approach, asking respondents) in relation to respondents’ indication of their respondents for a value they would definitely pay and a relative value."
9,"for example, respondents who indicated the value they would definitely not pay before the actual valu- values of the warning system and home contents insurance ation, also aims to reduce midpoint bias and scale sensitiv- to be similar, the mean difference in premiums and estimated ity."
9,including a “more” option in the payment scale was wtp was €5.28 with half of the differences lying within an intended to decrease endpoint bias.
9,a further limitation of (admittedly arbitrary) €10 range.
9,"wtp studies, in general, is the hypothetical nature of the the results from our regression analysis, moreover, dem- experiment itself."
9,"whether respondents would indeed pay onstrated that, in general, wtp behaved as expected."
9,wtp the elicited amounts in real life is questionable.
9,research increased with income and to some extent with the aware- has shown that hypothetical wtp questions typically lead ness of outbreaks and risk aversion.
9,"the positive effect of to an overestimation of actual wtp [23, 24]. the level of trust in public institutions and the significance a limitation specific to our analysis is that the actual of the included cultural dimensions were further reassuring unit of valuation, an international integrated early warning findings. system for infectious diseases and food-borne outbreaks, is considering that most of the mentioned limitations are also a hypothetical construct, as it is not in existence yet. inherent to willingness-to-pay approaches, one could wonder the survey included a concise description of its general whether other methodologies, not based on stated prefer- purpose (online appendix a), but we did not provide any ences, would have been the more appropriate methodological 13"
10,772 s.
10,himmler et al. choice.
10,such methods could entail using valuations of statis- national spending on preventive measures aimed at infec- tical life years or monetising the potential health gain using tious diseases of €261.46 per capita (inflation-adjusted qaly threshold values [25].
10,"however, there are two main €333.16 in 2018) [26]."
10,"this national spending includes vac- reasons, concerning feasibility (mainly due to the limited cinations but in particular, infrastructure aimed at protection current knowledge about the warning system) and scope of from infectious diseases like waste disposal and clean water the analysis, why this is not the case."
10,"first, the statistical life technologies."
10,an early warning system could be seen as an year approach requires the availability of certain types of add-on to this existing infrastructure.
10,"on a per capita level (international) data, which, at this stage of the compare (17.3 m citizens), the aggregated wtp in the netherlands project are not available, yet, if they can be provided at all, or would be €23.71, which corresponds to 7.1% of the previ- are difficult to obtain in general."
10,"using qaly thresholds, on ously calculated comprehensive national spending on infec- the other hand, requires the availability of threshold values tious disease prevention. in all countries of interest, while explicit threshold values assuming that the calculated aggregate wtp corresponds are only available for the uk and the netherlands."
10,"note- to actual yearly costs and that the early warning system worthy in this context is also that some of the estimates of would reduce the burden of disease of influenza of 81.8 the value of statistical life years and qalys are based on dalys per 100,000 in the six included european countries willingness-to-pay studies, which had similar drawbacks as by 20%, e.g. through rapid sequencing of new types of influ- our study."
10,"second, and more importantly, applying either enza and timely vaccinations, the costs per daly averted of these methodologies would shift the focus exclusively would amount to €164,190."
10,this ratio does not yet include on valuing direct health gains of the warning system.
10,"we dalys averted in other infectious diseases or food-borne opted for the current methodology and operationalisation outbreaks, nor does it account for the economic burden of as we intended to also capture the society’s valuation of the such outbreaks, which can be considerable [2], or more perceived feeling of safety that comes with the envisaged intangible benefits like the increased feeling of safety. system."
10,"the applied methodology is admittedly not perfect, in terms of the methodology used in this study and the with results also reflecting beliefs and imperfect information specification of the contingent valuation approach, future of respondents, which, next to methodological limitations, research should investigate the use of more precise assump- warrants caution in their interpretation. tions about the actual benefits of such a warning system and how this impacts the wtp valuations."
10,"as soon as infor- implications of study findings mation on the effectiveness of a compare like warning system is available, it could also be of interest to explore the notwithstanding this, our study provides results, which have value of the direct health gains, e.g. using a statistical life implications for policymakers and stakeholders in the con- year approach or different national estimates of the value of text of interventions increasing health safety of the popula- health gains. tion in european countries."
10,"for instance, in a more general sense, our results indicate that most european citizens seem to value an early warning system when using additional taxa- conclusion tion as a payment mechanism in an experimental setting."
10,"aggregating our wtp estimates to a national or interna- overall, our analysis provided first estimates of the perceived tional level can inform discussions about appropriate fund- value of this type of early warning system in european coun- ing of the warning system, given current knowledge and tries."
10,while the used approach is clearly not without limita- perceptions of the effectiveness of such a system.
10,"while tions, the results of our analysis can be relevant to policy- we stress the explorative nature of our study, based on the makers when discussing investments in health safety on a median wtp estimates from table 3, the relevant number of european level in general, and an early warning system for households (excluding the share of protesters), and assuming infectious diseases in particular."
10,"however, future research 50% of those households would be eligible to pay the addi- will have to provide further information on what this sys- tional tax, an aggregate wtp of €6.5bn for all six included tem would look like, the costs associated with installing and countries per year would be estimated (see online appen- maintaining such a system, and how effective it would be at dix f)."
10,"considering that health care spending on preven- actually increasing health safety, i.e. reducing the risks of tion is rather modest in the included countries (compared to pandemics and outbreaks as well as mitigating their impact, spending on curative care), this may be considered a high among european citizens."
10,"only then, it is possible to assess amount."
10,"while the mentioned limitations related to estimates whether the investment in such a system is money well spent of individual wtp apply to the aggregate as well, it can and health and welfare improving. help to give such a number a bit more context."
10,a study from the netherlands in 2007 estimated a yearly comprehensive 13
11,willingness to pay for an early warning system for infectious diseases﻿ 773 acknowledgements we would like to thank johan von ophem and 8.
11,"dealy, b.c., horn, b.p., callahan, t.j., bryan, a.d.: the eco- other discussants at the lolahesg conference 2018 for their construc- nomic impact of project mars (motivating adolescents to tive feedback on a previous version of this paper."
11,reduce sexual risk).
11,heal psychol.
11,"32(9), 1003–1012 (2013) 9."
11,"determann, d., korfage, i.j., lambooij, m.s., et al.: acceptance funding the data collection was funded by the european commission of vaccinations in pandemic outbreaks: a discrete choice experi- under the horizon 2020 research and innovation programme (grant ment."
11,"reddy j, ed."
11,"plos one. 9(7), e102505 (2014) agreement no. 643476) and part of the compare project (http:// 10."
11,"perry-duxbury m., van exel j., brouwer w.: the value of safety: www.compa​re-europ​e.eu/)."
11,s.f.w.
11,himmler receives funding from a a literature review.
11,forthcoming marie sklodowska-curie fellowship financed by the european com- 11.
11,"hofstede, g.: national cultures in four dimensions: a research- mission (grant agreement no."
11,721402). based theory of cultural differences among nations.
11,manag.
11,organ.
11,"13(1–2), 46–74 (1983) 12."
11,eurostat: gdp per capita in pps.
11,index (eu28 = 100) compliance with ethical standards 13.
11,"bobinac, a., van exel, n.j.a., rutten, f.f.h., brouwer, w.b.f.: willingness to pay for a quality-adjusted life-year: the individual conflict of interest the authors declare that they have no conflict of perspective."
11,"value heal. 13(8), 1046–1055 (2010) interest."
11,"johnson, f.r., banzhaf, m.r., desvousges, w.h.: willingness to pay for improved respiratory and cardiovascular health: a informed consent all individual participants included in this study multiple-format, stated-preference approach."
11,"health econ. 9(4), provided informed consent."
11,295–317 (2000) 15.
11,"donaldson, c., thomas, r., torgerson, d.j.: validity of open- ended and payment scale approaches to eliciting willingness to open access this article is licensed under a creative commons attri- pay."
11,"econ. 29(1), 79–84 (1997) bution 4.0 international license, which permits use, sharing, adapta- 16."
