page,p
1,"environmental science & policy 6 (2003) 487–500 the potential of remote sensing data for decision makers at the state, local and tribal level: experiences from nasa’s synergy program s."
1,"kalluri∗ , p."
1,"gilruth, r."
1,"bergman raytheon, 1616 mccormick drive, upper marlboro, md 20774, usa abstract nasa’s earth observation system (eos) satellite data are contributing to the development of policy relevant, remote sensing appli- cations."
1,"to promote the use of eos data for application development, nasa funded the synergy program in 2000 in partnership with academia, end users, and industry."
1,"three examples of remote sensing applications from the synergy program are presented here and include agriculture, range management, and water resource management."
1,"these examples show that remote sensing products have the potential to be useful to a variety of decision makers and policy makers because of the opportunity to reduce chemicals in the environment, improve crop yields and better manage range lands and water resources."
1,"transitioning from research and development to successful applications must overcome challenges such as the lack of awareness by end users of these technologies, inadequate feedback mechanism between application developers and end users, and unproven cost benefits of remote sensing data."
1,"experience from the synergy program indicates that these issues could be mitigated by educating and training end users, demonstrating the utility of remote sensing data in improving de- cision making, and establishing and maintaining a continuous dialogue between developers and end users."
1,sustainability of remote sensing applications ultimately depends on users continuing reliance on products and benefits from remote sensing data.
1,the synergy program also demonstrates that remote sensing data sets that are collected primarily for global change research contribute to the development of applications in a variety of disciplines at the regional and local level.
1,© 2003 elsevier ltd.
1,all rights reserved.
1,keywords: remote sensing applications; precision agriculture; range management; water resources management; synergy program; eos data 1.
1,introduction teorology among others.
1,"the traditional sources of coarse (>250 m) and moderate resolution (10–250 m) satellite im- remote sensing data from nasa’s earth observing agery within the united states have been federal agencies system (eos) satellites are valuable for understanding such as nasa and the national oceanic and atmospheric global change, particularly at decadal time scales."
1,the eos administration (noaa).
1,several commercial companies program consists of a constellation of satellites such as (e.g.
1,"space imaging and digital globe) are now providing landsat 7, terra, aqua, and aura, which are designed to high spatial resolution (<10 m) satellite data."
1,"with this continuously collect measurements of the earth’s land sur- combination of data types, users have a variety of options face, atmosphere, cryosphere, and the oceans to understand to choose the data that best suits their needs and budget."
1,"a earth system science (asrar et al., 2001; king, 1999)."
1,"with brief list of earth observing satellites launched by nasa the maturity of remote sensing algorithms and techniques and other organizations within the us that are suitable for over time, these data have found increasing use in decision developing applications for state/local/tribal agencies is making at regional and local scales."
1,one of the goals of given in table 1 along with their main characteristics.
1,nasa’s earth science enterprise application division’s remote sensing applications are growing at a rapid pace.
1,"strategy is to expand and accelerate the realization of soci- several studies have been conducted primarily by nasa etal and economic benefits from earth science, information, and noaa to understand the requirements and barriers and technology (nasa, 2002). for adoption of this technology by state and local govern- over the years, applications of remote sensing have ments."
1,"for example, nasa organized four workshops dur- emerged in agriculture, urban planning, disaster mitigation ing 2000–2001 to better understand the information and and monitoring, forestry, hydrology, and operational me- technology requirements of state/local/tribal governments within the united states (nasa, 2001)."
1,these workshops ∗ corresponding author. indicated a strong desire among different user agencies to e-mail address: skalluri@eos.hitc.com (s.
1,"kalluri). replace conventional field or aerial photography with faster, 1462-9011/$ – see front matter © 2003 elsevier ltd."
1,all rights reserved. doi:10.1016/j.envsci.2003.08.002
2,488 s.
2,kalluri et al.
2,"/ environmental science & policy 6 (2003) 487–500 table 1 characteristics of different earth observing satellite instruments that have potential use in application development for decision makers at the state/local and tribal level satellite instrument spectral bands (␮m) spatial resolution temporal resolution costa landsat 7 etm+ 3 visible 30 m 16 days $600 per scene 1 nir 2 swir 1 tir 60 m 1 panchromatic (b&w) 15 m noaa-k, l, m avhrr 1 visible, 1 nir, 1 swir, all at 1.1 km daily free 1 mwir, 2 tir terra, aqua modis 1 visible and 1 nir 250 m 1–2 days free 5 visible, nir, swir 500 m 29 visible, nir, swir, 1 km mwir, tir terra aster 2 visible 15 m 16 days free 1 nir 15 m 6 swir 30 m 5 tir 90 m ikonos ikonos 1 panchromatic (b&w) 1m 3 days $10.50/km2 for archived 3 visible 4m data (geo) 1 nir 4m quickbird quickbird 1 panchromatic (b&w) 0.61 m 2–6 days $18/km2 for archived 3 visible 2.4 m data (standard) 1 nir 2.4 m goes goes imager 1 visible 1 km 30 min free 1 mwir 4 km 1 thermal 8 km 2 thermal 4 km seastar seawifs 6 visible, 2 nir all at 1.1 km daily free to nasa researchers satellites launched by nasa and other us organizations only are shown here."
2,"visible = 0.4–0.7 ␮m, nir = 0.7–1.3 ␮m, swir = 1.3–3 ␮m, mir = 3–5 ␮m, lwir (thermal) = 5–14 ␮m."
2,"abbreviations: aster, advanced spaceborne thermal emission and reflection radiometer; avhrr, advanced very high resolution radiometer; etm+, enhanced thematic mapper+; goes, geostationary operational environmental satellite; modis, moderate resolution imaging spectroradiometer; seawifs, sea-viewing wide field-of-view sensor. a the prices quoted here are those that are published on the internet by data providers at the time this manuscript was written."
2,these prices are given for the sake of information and comparison purposes only and are not guaranteed.
2,"prices vary by level of processing, date of acquisition, and location."
2,"people interested in acquiring these data should contact the data providers directly for more accurate and up to date pricing. cheaper, and/or more accurate remote sensing methods."
2,"this from investment in remote sensing technology by end users nasa study also indicated that state, local and tribal users were identified as potential activities that need to be un- want to use remote sensing data primarily to improve mon- dertaken by federal and private agencies that develop these itoring and prediction capabilities of the local environment technologies to promote useful, operational applications of for regulatory compliance."
2,"the cost of remote sensing data satellite remote sensing data. and software, lack of personnel skilled in these technologies, even though eos data were designed primarily to col- and unproved cost/benefit ratios for investment in remote lect global change research measurements, these data could sensing data were noted as some of the common barriers for be potentially used to develop various applications that are adoption of this technology. relevant to policy makers at state and local governments."
2,"to the space studies board of the national research coun- explore the use of remote sensing data collected by the eos cil (nrc, 2001) conducted a similar study to identify the satellites for the development of applications that are rele- opportunities, approaches and bottlenecks for adoption of vant to state, local and tribal agencies as well as individual remote sensing data by state/local agencies."
2,"this study fo- users, the synergy program was started in 2000."
2,the syn- cused on the use of remote sensing data for management of ergy program is funded by nasa through its application coastal environment to determine barriers and opportunities division and is managed by raytheon company.
2,six appli- in transferring remote sensing technology and applications cation areas were identified under the synergy program and to end users.
2,"several factors such as education and training include agriculture, urban planning, natural resource man- of end users, and successful demonstration of cost benefits agement, water resource management, disaster management"
3,kalluri et al.
3,"/ environmental science & policy 6 (2003) 487–500 489 and weather, climate and human health (http://www.earth- made at a field level without taking into consideration spa- outlook.com). tial variability of soil properties and crop condition."
3,"the the synergy program is a partnership between end users, adoption of precision agriculture, where crop variability academia, and industry."
3,"this program has a three-fold is actively managed, optimizes fertilizer and pesticide ap- objective: plications and reduces environmental contamination while maximizing profitability."
3,"• identify issues at the state/local/tribal governments that a typical example of environmental benefits of precision can be addressed by using remote sensing data and deter- farming is the potential to decrease anthropogenic contribu- mine their requirements. tions of nitric oxide and nitrous oxide into the atmosphere, • develop sustainable remote sensing applications using which are both considered as greenhouse gases."
3,"atmo- eos data and demonstrate benefits. spheric concentration of nitrous oxides has reached its high- • educate and train the end users in using these technologies est recorded levels in recent years (316 ppb in year 2000) to promote these data sets within their communities. since the pre-industrial era (watson et al., 2001)."
3,"volatiliza- as a part of the synergy program, scientists at differ- tion of inherent organic soil nitrogen and that applied as ent universities in the usa have been developing products fertilizer release these greenhouse gases from agricultural primarily from nasa’s remote sensing data based on the areas through denitrification."
3,emissions of nitrous oxides analysis of specific user requirements.
3,these products are from cultivated agriculture are estimated to contribute 50 then distributed through interactive web-based tools hosted to 70% of the anthropogenic sources to the environment at 11 centers called infomarts.
3,"this paper will highlight (nakicenovic and swart, 2000)."
3,"typically, 10–30% of the some of the impacts on policy and decision making by end total nitrogen input to common grain-production systems is users and discuss lessons learned in promoting nasa’s lost through leaching of water-soluble nitrates (meisinger remote sensing technologies for application development. and delgado, 2002), which could lead to contamination of the main objectives of this paper are to: surface and ground water (follett and delgado, 2002)."
3,"during the past 35 years, global food production dou- • describe the applicability of eos sensors for state/local/ bled, and if past trends in fertilization were to continue, tribal users. global nitrogen fertilization would be 1.6 times greater than • highlight impacts on policy and decision making by end present amounts by 2020 (tilman et al., 2001)."
3,"several users who are using nasa’s remote sensing data. factors such as the rate and amount of fertilizer application, • identify opportunities and barriers to adoption of remote tillage practices, irrigation, cropping systems, and soil and sensing data by these users. weather variability determine the amount of nitrogen that is • identify ways to promote remote sensing technologies and transported from the soil to the environment."
3,"among these applications within state/local/tribal agencies. factors, the uniform fertilizer treatment of entire fields, with- presenting results from each of the six remote sensing out taking into consideration inherent variability in soil and applications within the synergy program would be duplica- historic yield patterns, is a major factor for nitrate leaching tive."
3,"instead, we will focus on three application themes and diffusion into the environment (power et al., 2000). and present findings from a broad spectrum of remote the adoption of precision agriculture, where crop vari- sensing applications."
3,"the material presented here is based ability is actively managed, optimizes fertilizer and pesti- on authors meetings with application developers and end cide applications and reduces environmental contamination. users, and annual progress reports from infomarts over a precision farming has created a growing need for geospa- 3-year time period since 2000."
3,"to date, there are no other tial data, and remote sensing techniques are appropriate for published independent reviews of the synergy program or collecting such data. comparative assessment of experiences from the synergy vegetation indices such as the normalized difference program with other similar activities within nasa.1 vegetation index (ndvi) derived from polar orbiting in- struments such as the advanced very high-resolution ra- diometer (avhrr) are routinely used for operational crop 2."
3,"remote sensing applications in precision agriculture condition assessment over large areas (hutchinson, 1991; in the northern great plains kogan, 1997)."
3,"these vegetation indices are mathematical transformations of visible and near ir reflectances, and historically, agronomic practices such as the application have been used to derive variables related to crop growth of fertilizers and pesticides, and irrigation have largely been such as the fraction of photosynthetically active radiation (0.4–0.7 ␮m) absorbed by crops (fpar) and leaf area index 1 the authors are not involved either in developing specific applications (asrar et al., 1984)."
3,"these variables are then used as inputs or in the day-to-day management of these activities at the universities to deterministic crop growth models (moulin et al., 1998)."
3,(infomarts).
3,"the analysis presented here is intended to be a candid and critical assessment of remote sensing application development based on temporal profiles of vegetation indices are used to monitor the authors experience in managing a broad spectrum of applications at crop growth and, furthermore, seasonally integrated values different university infomarts. are known to correlate with crop yields."
3,ndvi measurement
4,490 s.
4,kalluri et al.
4,/ environmental science & policy 6 (2003) 487–500 from the moderate resolution imaging spectrometer crop growth within the field.
4,"additionally, these images can (modis) at 250-m spatial resolution provide significant be integrated with field data such as soil properties, irriga- spatial detail compared to avhrr (1 km)."
4,"not surprisingly, tion, and fertilizer practices using geographic information several avhrr users have begun to adopt modis data systems (gis), and global position system (gps) tech- sets (see for example, townshend and justice, 2002). nology to generate field maps and databases for optimum while these coarse and moderate resolution data sets allocation of resources and investment. are valuable tools for crop condition assessment at county, as a part of the synergy program, the university of north regional, and state levels, they are not adequate for oper- dakota (http://www.umac.org) has provided several farm- ational monitoring of crops at the individual field level. ers, ranchers, and land managers from the native american farmers with large land holdings are interested in precision community with frequent near real-time remotely sensed crop management tools that help them identify and monitor data throughout the growing season."
4,"as of august 2003, 246 variations in crop condition within the field, so that they can farmers and ranchers have been receiving ndvi composite selectively apply herbicides, pesticides, fertilizer, and seed imagery from avhrr and modis, as well as visible and for maximum benefit at reduced cost."
4,"with the availability near ir imagery from landsat 7 etm+ over their farms of unrestricted, low-cost, high-quality imagery from land- in north dakota, south dakota, wyoming, and montana. sat 7 enhanced thematic mapper (etm+) and high spatial a few farmers have been receiving visible and near ir resolution satellite imagery from commercial sensors such reflectances from the ikonos satellite as well (fig."
4,"1). as ikonos and quickbird, new opportunities have emerged farmers located in remote rural areas do not have access for remote sensing in agriculture."
4,images generated from to high-speed internet connectivity.
4,"not surprisingly, deliv- combinations of reflectance bands from these satellites are ery of large image files (typically in the order of several being made available to the farmers by various organiza- megabytes) to them via 56 kb modems is an obstacle."
4,to tions.
4,"these images are ideal for examining variations in overcome this problem, end users were connected via a fig."
4,false color composite image from ikonos acquired over an agricultural area in n.
4,"dakota taken on september 27, 2001."
4,"the red, green, and blue colors show reflectances in the near ir, red, and green wavelengths, respectively."
4,"crops appear as red in this image, because of their high reflectance in the near ir wavelength."
4,"different tones of brightness in the near ir wavelength are associated with differences in crop condition, vigor and maturity."
4,arrows indicate areas where there are problems with crop condition as indicated by low near ir reflectances.
4,"(for interpretation of the references to colour in this figure legend, the reader is referred to the web version of this article.)"
5,kalluri et al.
5,/ environmental science & policy 6 (2003) 487–500 491 high-bandwidth satellite link to a central distribution center were willing to use the imagery on an ‘experimental basis’ at the university of north dakota.
5,"end users were provided and were enthusiastic to participate in the program as long training in the basics of remote sensing, image interpre- as data were free."
5,they were not willing to change farm tation and manipulation and were given free software to practices based on image data alone until the technology visualize satellite imagery on a pc. was proven in the field.
5,"since their livelihood depends upon the users of these data sets can be classified as innova- making the right decision at the right time, decisions based tors and early adopters depending on their level of use of solely on unproven technologies were considered high risk. the products."
5,innovators among the farmers started using farmers initially compared patterns in satellite imagery imagery when the technology was first introduced in their collected during the growing season with yield data after community and are now integrating the geo-referenced im- harvest to determine relationships.
5,"subsequently, a farmer agery into a gis for variable rate application of fertilizer treated a small part of the field differently with fertilizers and herbicide."
5,"early adopters, motivated by the innovators, and fungicide compared to the rest of the crop to determine are now beginning to use imagery for crop condition assess- how it would appear in a satellite image."
5,quantitative com- ment through mostly visual interpretation methods.
5,farmers parison of chemical application rates with yield data and are able to determine fertilizer and herbicide allocation associated patterns of reflectances observed in remote sens- based on crop condition determined from the image of their ing imagery helped the farmers in relating imagery to field farm during the growing season.
5,farmers then apply these conditions.
5,farmers gained confidence in the technology resources at variable rates across their field using a gps through repeated studies.
5,"use over several growing seasons receiver mounted on a combine sprayer for navigation. appears to be necessary before any new technology is fully by integrating field data such as yield, moisture, and soil adopted by this community of users."
5,"information products condition with positional information sampled uniformly derived from satellite data which show spatial patterns in a on an evenly spaced, two-dimensional grid across the farm, field associated with properties such as moisture, nitrogen farmers create zone maps and identify areas that require content, crop vigor, etc. were considered more valuable than higher resource inputs."
5,when data from several growing raw imagery by the farmers.
5,"it was also evident from the seasons are combined into a database and analyzed, spatial users that product diffusion could be highly successful if the patterns of yield variability within a field emerge."
5,farmers derived products were accompanied by specific recommen- in montana who relied on satellite imagery for variable dations on improving crop productivity through prescriptive rate application of nitrogen reported a saving of $12 per spraying of chemicals over problem areas identified in the acre in fertilizer costs.
5,"variable rate application, therefore, imagery."
5,"creation of peer learning communities in which minimizes the cost of fertilizer and herbicide applied. advanced users share their experiences and demonstrate selective application of chemicals on farms reduces at- benefits within a community enhances potential user’s mospheric contamination as well (nrc, 2000a)."
5,"in addition confidence and promotes faster product penetration. to the economic benefits accrued to farmers, is the decrease farmers in the us northern great plains typically manage in the amount of fertilizer, pesticides, and fungicides that is their fields using spraying, planting, and harvesting equip- leached into the soil, thereby reducing the contamination of ment that typically has a swath of 10 m."
5,the minimum farm streams and rivers from run-off.
5,this has further economic management unit in these studies can thus be considered benefit in terms of fishing and recreation activities as well as 10 m wide.
5,"imagery with a 10-m spatial resolution was, as contributing to the health of environmental habitats, and therefore, considered appropriate for precision farming by in some cases, drinking water (shortle and abler, 2001). the farmers interviewed."
5,"even though commercial satellite some other uses of remote sensing data by farmers imagery from ikonos and quickbird provides multispectral participating in this project have been to map tillage prac- imagery at spatial resolution larger than 10 m, the high cost tices using landsat 7 etm+ data, and estimating losses of these data make them financially impractical at present in acreage due to water inundation for insurance claims. for routine use in precision farming."
5,"nevertheless, high spa- conventional tillage practices lead to reduction in soil or- tial resolution imagery is needed for defining drainage needs ganic matter, increase soil erosion by wind and runoff, and and assessment of damage due to wind, water, pests, hail, destroys macropores which are conduits of water flow in overspray, etc."
5,the high cost of these data become afford- the soil.
5,"zero or low-till practices can, over time, lead to able only if groups of farmers share the cost of imagery. storage of more carbon and nutrients in soils by preserving however, the use of landsat etm+ data (30-m spatial res- residue from previous crops."
5,these practices are more cost olution) has been successful in introducing remote sensing effective than conventional tillage since less energy is used technology to a large number of farmers.
5,"in this project, (padgitt et al., 2000; calderón et al., 2001)."
5,satellite im- landsat etm+ data has been demonstrated as a valuable agery can be used indirectly to determine tillage practice by tool in identifying broad anomalies within fields to help in monitoring the level of the senescent residues in the field. management decisions particularly since its cost per scene several farmers who were using remote sensing data is less than half of the commercial satellite data that pro- actively were interviewed for feedback to determine the vide higher spatial resolution.
5,while the existing suite of suitability of satellite data for precision farming.
5,farmers nasa’s space-borne sensors has limitations for precision
6,492 s.
6,kalluri et al.
6,"/ environmental science & policy 6 (2003) 487–500 farming, the most promising approach would be a combina- understanding historical variations in greenness as the most tion of data from multiple instruments using physical models important benefits they would derive from the web-enabled, to provide the necessary information (moran et al., 1997). spatially dynamic, time-series animations."
6,"ranchers indi- cated that the rangeview products would allow them to (a) monitor the immediate response of vegetation to rainfall, (b) 3."
