page,p
6,"range management in the southwest monitor overall range conditions, (c) determine the relative amount of vegetation growth between pastures that will oc- even though similar remote sensing principles and data cur in response to rainfall or climate events such as el niño, sets could be used to monitor both agricultural fields and and (d) observe patterns of vegetation growth during a year. rangelands, the requirements for each application differ users wanted the ability to either print a professional looking because agricultural lands are managed more intensely. map from the images displayed on the screen or to down- rangelands in the western us support a variety of uses load the images to their computers for further modification such as cattle ranching, recreation, forestry, and water- and use."
6,ranchers and agency personnel both emphasized shed.
6,"most rangelands in the west are public lands (nrcs, the role rangeview could play in encouraging dialogue 1999)."
6,"thus, several federal, state, and tribal agencies are when disagreements over vegetation trends occur, particu- responsible for managing the rangelands and often there is larly during periods of drought or wildfire risk, or where elk competition between different user communities for lim- and cattle might be expected to use the same pasture in the ited resources."
6,competition for grazing between cattle and months ahead.
6,"the high temporal resolution and landscape native wildlife on rangelands is one of many important coverage helped in longer term planning as well as shorter issues that evokes considerable debate in the west among term identification of areas that needed specific ground mon- ranchers, hunters, environmentalists, and developers."
6,the itoring.
6,"moreover, the coarse spatial resolution was actu- potential for conflict among varying uses emphasizes the ally applauded by agency personnel and ranchers alike: too need for an integrated strategy to manage rangelands ef- coarse to be used in regulatory applications, and yet power- fectively, and remote sensing data provide valuable in- ful enough to provide visual insight on vegetation trends as a formation on rangeland conditions."
6,managing rangelands basis for dialog where resource management strategies were requires routine surveys to monitor range conditions for in dispute.
6,"there are 770 million acres of rangeland in the determining the carrying capacity of land and remote sens- united states (nrc, 1994), and the rangeview approach ing is an appropriate tool for such analysis (tueller, 1989). could enhance natural resource management and vegetation of particular need are tools that can capture vegetation monitoring activities at scales that would not be practical to dynamics through time and over large areas."
6,through the monitor with medium or high spatial resolution imagery.
6,"synergy program, the office of arid land studies at the rangeland management requires a concerted effort among university of arizona set up a web-based information sys- natural resource agency personnel, ranchers, other land tem called rangeview (http://www.rangeview.arizona.edu) users, and developers for a longer term, sustainable use of that provides web-based user access to near real-time veg- public land in the western us bridging the knowledge gap etation indices derived from avhrr and modis at 1-km among these groups in terms of new tools and technologies and 250-m spatial resolutions, respectively."
6,this activity is key to effective communication and management.
6,the is specifically designed to provide accurate and timely role of a new cooperative extension program initiated by a geospatial information about vegetation dynamics to natural nasa-land grant partnership was critical to the success of resource managers including ranchers and members of fed- the project.
6,"termed the “geospatial extension program,” a eral, state and tribal government agencies responsible for university extension specialist focused on bridging the gap rangeland resources in the western us users can plot and between geospatial research/technology and its use by the visualize temporal trends in greenness and deviations from general public and was central to the technology transfer long-term averages."
6,multi-temporal vegetation indices com- strategy pursued by the rangeview team.
6,the “diffusion puted as bi-weekly maximum value composites can be used of innovation” model embraced by the project required a as a surrogate for vegetation response to climate and other marketing research component to identify the key factors influences along a 1-km grid (fig.
6,internet map server facilitating and constraining adoption.
6,"this project iden- technology permits the users to interactively map an area of tified the pivotal role university extension agents within their interest along with ancillary vector data layers to help natural resource programs would have to play in introduc- locate and monitor a particular forest, ranch, or watershed. ing rangeview to lead users among both agency personnel several workshops and training sessions were held to in- and ranchers. form the county extension agents, agency personnel and typical extension agents are not experts in remote sens- ranchers about the tools available through the rangeview ing data and technologies, and thus rangeview initiated project and to get their feedback on product use."
6,"natu- a “train the trainer” scheme to train extension agents, a ral resource managers from government agencies listed (a) crucial element in promoting remote sensing products to comparing current greenness to long-term normal levels, (b) uninitiated users."
6,"holding frequent regional workshops and forecasting greenness based on historical patterns, and (c) training sessions was essential to enhance product use."
7,kalluri et al.
7,/ environmental science & policy 6 (2003) 487–500 493 fig.
7,"the image on the top (a) shows the maximum ndvi or maximum greenness over arizona for the 2-week period ending september 19, 2002 as observed by the advanced very high-resolution radiometer (avhrr)."
7,the image on the bottom (b) shows the deviation in ndvi relative to the same time during previous year.
7,images like these help track and monitor range conditions.
7,these images are available at http://www.rangeview.arizona.edu.
7,"involvement of user communities in product development and vegetation dynamics, the rangeview web site allows from the beginning of the project and soliciting periodic different federal and state agencies as well as individual feedback that aided in enhancing the services and prod- ranchers to identify and synoptically visualize areas that are ucts was critical for a broader adoption of remote sensing under stress due to abnormal weather patterns."
7,this allows data.
7,"lack of access to faster internet connectivity was one informed decision making for sustainable and ecologically of the technological hurdles in product use, but the users sound management of rangeland resources by optimizing themselves have provided solutions: community library ac- plant growth and grazing. cess, and the proposal of special rangeview kiosks in local cooperative extension offices."
7,"the use of eos data in this project, despite being much 4."
7,"water resources management in the northwest coarser in spatial resolution compared to commercial data, allowed prototyping and demonstrating practical benefits of a variety of remote sensing techniques continue to evolve remote sensing data at a low cost."
7,"by providing open and free for estimating different components of the terrestrial hydro- access to geospatial information regarding rangeland health logical cycle, particularly precipitation (sorooshian et al.,"
8,494 s.
8,kalluri et al.
8,"/ environmental science & policy 6 (2003) 487–500 2000), evapotranspiration (choudhury, 1994), and runoff to estimate et from landsat data, idwr adopted an en- (hsu et al., 1995)."
8,"three applications have been funded ergy balance model called sebal (surface energy balance under the synergy program in the field of water resource algorithm for land; bastiaanssen et al., 1998a,b)."
8,"since management: monitoring evapotranspiration (et) in the idwr is a regulatory and planning agency with limited snake river aquifer in southern idaho, estimating snow resources for remote sensing research and application devel- water equivalent in arizona, and determination of runoff opment, idwr teamed with scientists from the university coefficient maps for use in models to compute peak flood of idaho who have previous experience in this field to help in discharges in missouri."
8,"here, we present experience from developing viable et models that use remote sensing data. estimating et in southern idaho."
8,"before the sebal method could be adopted, the model water availability played a key role in the settlement had to be validated and demonstrated to show that the of the american west."
8,"population pressure causes an in- satellite estimates of et were at least as good and less crease in both demand and price of water (nrc, 1996). costly than traditional methods that idwr is currently us- precipitation, snow water melt, et, land use, extraction of ing."
8,"among the various instruments and methods that are ground water, and stream flow are important factors that af- available to measure et, measurements made by lysimeters fect water management."
8,"when surface water from streams are considered to be the most accurate (rosenberg et al., and reservoirs does not meet irrigation demands, tapping 1983)."
8,et was computed using data from landsat 5 tm aquifers for groundwater is a common practice.
8,"therefore, sensor for seven overpass dates in 1989, and the results water resource managers have to model and monitor sur- were compared with coincident measurements collected face and ground water conjunctively for a planned, reliable, using a lysimeter in idaho."
8,"the absolute error of daily et and coordinated water supply (winter et al., 1998; nrc, between the satellite derived estimates and ground data was 2000b)."
8,"a similar comparison of et for four days in 1985 in general, states west of the mississippi award the right showed an error of 15% between landsat estimates and to use water to individuals based on the principle of prior lysimeter measurements (allen et al., 2001)."
8,encouraged by appropriation.
8,"according to this doctrine, a person does not these results, idwr has begun to utilize et estimates from have the right to own ground water by virtue of owning landsat etm+ for monitoring water use in irrigated areas the land from which the water is pumped."
8,individuals need of the snake river basin on an experimental basis (fig.
8,"3). to obtain permits from the state governments, and the al- several training sessions were held by the university of location of water rights is issued through the maxim “first idaho scientists who developed the et algorithm to train in time, first in right.”"
8,"this means that the first person to the idwr personnel in the basic principles of remote sens- obtain a right (senior appropriator) has priority to pump ing, theory of surface energy balance and et, and methods water compared to another person who acquired water right to derive et from satellite data."
8,these training classes were at a later time (junior appropriator).
8,"during times of wa- designed to ensure a smooth transfer of technology from ter shortage, water pumps of junior appropriators could be the academic community to the user domain. shut down before the senior’s (idaho code, §42-106)."
8,"be- the state of idaho spends nearly half a million dollars cause of intense competition for water, administering water annually to monitor water use in the irrigation districts us- rights has profound socioeconomic, environmental and legal ing labor intensive field surveys."
8,"considering the cost of implications. imagery and processing, water use in the snake river plain in areas where irrigation is the main source of water sup- can be predicted through et estimates from landsat data ply to crops, et can be used as a good indicator of water for a fraction of that cost in a growing season."
8,about 15 use.
8,"in fact, it is a common practice to use estimates of ac- landsat scenes are required to monitor water rights in the tual and potential et to implement irrigation scheduling in snake river plain during the growing season, and the cost of several parts of the world (allen et al., 1998; shuttleworth, acquiring, processing and modeling et from these scenes is 1991)."
8,"knowledge of depletion and recharge rates from estimated to be about $30,000 annually including staff time. aquifers is important for calculating water balance."
8,"using satellite estimates of et, water masters, selected the idaho department of water resources (idwr), a by communities to administer water rights, will be able to synergy partner, has been investigating the use of landsat tell whether or not water has actually stopped being used for data to estimate et in the snake river system in idaho."
8,the irrigation after a well has been ordered to shut off.
8,spatial intent is to use et as an indicator of water depletion from and temporal estimates of et offer other benefits as well. the aquifers.
8,"traditionally (before ground water and surface estimates of actual and potential et are useful for yield water rights were administered conjunctively), idwr di- modeling and to accurately characterize the hydrological rectly measured and regulated surface water, but not ground cycle and water balance. water."
8,identifying irrigators who are using water “in excess critical to the success of this project was the buy-in and of the elements or conditions of a water right” has become continuous involvement of the end user agency from the necessary in order for idwr to conjunctively adminis- initiation of the project.
8,several factors contributed to the ter water rights.
8,estimating et would help idwr assure success of the project: the end user had a critical need for a pumpage in compliance with the terms of water rights. technology for decision making; the end user has some initial
9,kalluri et al.
9,/ environmental science & policy 6 (2003) 487–500 495 fig.
9,these images show evapotranspiration (et) estimates from landsat 5 and 7 derived over an area in south jerome county in idaho during 2000.
9,the circular areas show the sequence of et for four dates over a hay field and indicate harvest and regrowth during this period.
9,et computed from these images can be directly related to water use.
9,"(image courtesy: tony morse, idaho department of water resources.) experience and capacity to understand and process remote for realizing an impact on decision-making."
9,the products sensing data; the end user already had an established working and datasets that are developed have to be driven by a relationship with scientists from a university for collabora- compelling requirement by the user community.
9,"adequate tion; and most importantly, the spatial, spectral, and temporal feedback mechanisms should exist through periodic meet- and economic aspects of remote sensing data were suitable ings and workshops between developers (e.g. scientists to address the issues faced by the end user."
9,"there is, however, in academia and government, industry) and product users one important factor that determines the adoption of any new for continuous innovation and improvement."
9,"workshops technology by users, and it relates to data continuity."
9,users with users from multiple agencies help in overcoming of any new technology should be assured of longevity of a institutional barriers by bringing together different user data stream before they can make permanent changes to their groups with similar requirements and facing similar chal- decision-making procedures.
9,thermal measurements from lenges.
9,such workshops provide a forum for exchange the landsat etm+ sensor are critical to et estimates for of ideas among various groups.
9,the product developers this project.
9,future landsat data continuity missions are not should ensure progressive alignment of products between likely to collect thermal measurements and that could signif- meetings with the end users.
9,there is a strong tendency icantly impact the long-term sustainability of this applica- to conduct user surveys through postal and email survey tion by idwr.
9,"this issue is not unique to this project alone. questionnaires, and while these mechanisms are useful, not surprisingly, users are unwilling to adopt data products they are not as effective as regular face-to-face dialogues from experimental sensors that do not have longevity. between application developers and their users, where the users have the opportunity to engage in a collective discussion."
9,"lessons learned within a technology adoption life cycle, users can be classified as innovators, early adopters, early majority, late based on the case studies that were reviewed here, the majority and laggards based on their level of adoption findings in promoting remote sensing technologies for de- (moore, 1999)."
9,adopters of remote sensing applications cision making by state/local users can be summarized as can be similarly classified as well.
9,winning the support of follows. the early adopters who can showcase the benefits of remote sensing technology over conventional methods of resource 5.1.
9,user involvement analysis is essential to a wider adoption by a larger user group.
9,"users must, therefore, be involved as stakeholders early and continuous involvement of the users is critical within the life cycle of the project, and the application devel- for the success of application development, and ultimately opers should factor in stakeholder’s interests for successful"
10,496 s.
10,kalluri et al.
10,/ environmental science & policy 6 (2003) 487–500 transfer of technology from application to decision making transitioning research missions that have demonstrated or policy making. opportunities for practical applications in to operational missions has been either slow or have gone unrealized 5.2.
10,"training and education altogether (nrc, 2003)."
10,"users expect consistency in data format and content over at present, remote sensing technologies are not widely time and need to be assured of data longevity before they are used within state/local/tribal agencies, and training and edu- willing to switch to remote sensing data products and tech- cating these users is critical for successful adoption of these niques for operational decision making."
10,decision makers technologies.
10,users familiarity in remote sensing techniques and policy makers require datasets and techniques that can also helps in building an informed consensus between end provide consistent results each time the tool is used.
10,"it is also users and developers on the product specifications. critical that the remote sensing data have the right spectral, after the development of a technique or a data product, spatial and temporal characteristics and be economically routine operational activities should be handed off to the viable in terms of cost for successful application develop- end users or some other intermediary, thereby freeing up ment."
10,"because of these factors, eos data may face diffi- the research community to pursue additional investigations. culties in being accepted universally by all decision-makers the basic model adopted for the synergy program was that who rely on remote sensing data unless data continuity is the scientists from academia would develop and prototype assured. an application by working closely with the end users."
10,after remote sensing data and products are generated by var- successful demonstration of the benefits of remote sensing ious agencies in a variety of formats.
10,"these formats may products, these products and methods would then be trans- be suitable for researchers, but end users in non-research ferred to the agencies who would then adopt and maintain organizations require data in a format that can be readily them."
10,"training and education are, therefore, critical to trans- displayed and analyzed using simple software packages. fer of technology and knowledge from the application de- end users at the state/local/tribal level typically do not have velopers to the end users within state/local/tribal agencies. access to high-end image processing software and tools."
10,"establishing peer learning groups, in which an advanced products from remote sensing imagery should, therefore, user of a product teaches his peers within the same user com- be generated in formats that can be readily ingested into munity enhances product diffusion."
10,"for example, a group of a variety of popular low cost image visualization and gis farmers is more comfortable adopting a product when a fel- packages and should be compatible with user’s existing low farmer endorses it and shares his positive experiences systems and infrastructure."
10,"to promote wider use of eos with them compared to marketing by an outsider. data, nasa and its partners are developing translation tools that convert data into a variety of formats and projections 5.3."
10,"data accessibility, continuity, and formats for input to existing image processing and gis packages."
10,remote sensing imagery often consists of large digital 5.4.
10,proven benefits files.
10,"fast network connectivity is, therefore, essential for efficient transfer of imagery among data providers, devel- one of the major obstacles to date for adoption of remote opers, users, and decision makers."
10,"applications that rely on sensing data for applications has been the lack of proven continuous, operational satellite data require real time ac- benefits, particularly in relation to cost."
10,adopting remote quisitions.
10,"in response to user demand for immediate data sensing imagery requires investment in hardware, software, access, nasa has developed “data pools,” which are large, and training."
10,"before a group of users adopt this technol- online caches of real-time satellite data collected within the ogy as an alternate to existing methods, they need to be us (carr et al., 2003). convinced that remote sensing solutions are economically similar to other technologies, remote sensing technology viable and save time and money or enable the realization of is evolving."
10,nasa is continually improving sensors with other environmental benefits.
10,using traditional financial cost each generation of satellites.
10,"a number of remote sensing benefit analysis models, it is feasible to show the monetary applications require data collected over multiple years for savings for applications that directly use remote sensing temporal analysis to observe patterns, trends and changes. techniques for regulation and allocation of resources and nasa’s eos satellites are often precursors to operational where there is direct impact on marketable products such monitoring satellites managed by noaa."
10,since nasa is as crops and timber.
10,"it is, however, more difficult to assign not an operational agency, there is rarely a redundancy in a monetary value to benefits to the environment and qual- data collection or backup satellites in case an operating ity of life which resulted from policy changes."
10,monetizing sensor or satellite fails within its planned lifetime.
10,"also, indirect benefits from using remote sensing data is complex some eos instruments (e.g."
10,advanced spaceborne thermal and challenging.
10,"nevertheless, demonstrating tangible ben- emission and reflection radiometer, multi-angle imaging efits of remote sensing through either cost savings or cost spectro-radiometer) are unique and experimental in nature, avoidance would build a strong case for investing in these and data continuity is not always assured."
10,"in some cases, technologies by government agencies."
11,kalluri et al.
11,/ environmental science & policy 6 (2003) 487–500 497 5.5.
11,"incubation period for a specific dataset or application, and indicators of will- ingness of end users to invest in remote sensing technology new users of remote sensing technology are not willing to could be used to gauge the performance and diffusion of invest unless the application has been proven to be a viable application development."
11,metrics associated with policy alternative to current practices.
11,"experiences from the syn- impact are most difficult to quantify, but would have the ergy program show that 3–5 years are required before the most significance."
11,other metrics such as web transaction end users gain confidence in using remote sensing data and logs showing the number and volume of data sets distributed institutionalize their use.
11,diffusion and adoption of these from a data center are easy to quantify and help in tracking technologies is faster in agencies that have prior experience the number of users and the datasets that are more popular. (even if limited).
11,"during the initial phases of application some of the measurable impacts of an application on diffusion, the end users need hands-on training and advice, decision making include factors such as the reliability and access to free data and processing software, technical sup- quality of decisions, time saved in using these new tech- port, and sometimes access to equipment as well."
11,"the rate niques, and the number of instances a decision has been of diffusion is directly related to the perceived value that made as a direct use of the new product compared to ex- remote sensing data has by users responsible for policy de- isting approaches to decision making."
