page,p
1,international journal of remote sensing issn: 0143-1161 (print) 1366-5901 (online) journal homepage: www.tandfonline.com/journals/tres20 application of the remote-sensing communication model to a time-sensitive wildﬁre remote-sensing system christopher d.
1,"lippitt, douglas a."
1,stow & philip j.
1,riggan to cite this article: christopher d.
1,"lippitt, douglas a."
1,stow & philip j.
1,"riggan (2016) application of the remote-sensing communication model to a time-sensitive wildﬁre remote-sensing system, international journal of remote sensing, 37:14, 3272-3292, doi: 10.1080/01431161.2016.1196840 to link to this article: https://doi.org/10.1080/01431161.2016.1196840 published online: 28 jun 2016."
1,submit your article to this journal article views: 731 view related articles view crossmark data citing articles: 4 view citing articles full terms & conditions of access and use can be found at https://www.tandfonline.com/action/journalinformation?
1,journalcode=tres20
2,"international journal of remote sensing, 2016 vol."
2,"37, no. 14, 3272–3292 http://dx.doi.org/10.1080/01431161.2016.1196840 application of the remote-sensing communication model to a time-sensitive wildﬁre remote-sensing system christopher d."
2,"lippitta,b, douglas a."
2,stowb and philip j.
2,"rigganc a department of geography and environmental studies, university of new mexico, albuquerque, nm, usa; b department of geography, san diego state university, san diego, ca, usa; cusda forest service, paciﬁc southwest research station, riverside, ca, usa abstract article history remote sensing for hazard response requires a priori identiﬁcation received 29 september 2015 of sensor, transmission, processing, and distribution methods to accepted 23 may 2016 permit the extraction of relevant information in timescales suﬃ- cient to allow managers to make a given time-sensitive decision."
2,"this study applies and demonstrates the utility of the remote sensing communication model (rscm) to improve a tactical wild- ﬁre remote-sensing system to better meet the time-sensitive infor- mation requirements of emergency response managers in san diego county, usa."
2,a thermal infrared airborne remote-sensing system designed and operated by the united states forest service paciﬁc southwest research station for active wildﬁre monitoring is documented and updated based on the rscm.
2,analysis of the thermal infrared remote-sensing system in the context of the rscm identiﬁed three conﬁguration changes that can improve the eﬀectiveness of the information produced when employed by wildﬁre incident commanders for suppression prioritization: (1) limit spectral sampling collection to a single waveband; (2) complete image processing steps on-board the aircraft; and (3) provide information on wildﬁre locations to incident commanders in the form of a static map.
2,introduction remote sensing holds signiﬁcant promise to address the time-sensitive information requirements of hazard response managers (joyce et al.
2,2009; brucewicz 2003; ceos 2005).
2,"the use of remote sensing to address time-sensitive information requirements, however, requires that acquisition, transmission, processing, and product dissemination methods be optimized to take place within time frames that permit response to the observed phenomenon (bernsdorf et al."
2,"2010; lippitt, stow, and clarke 2014a; stow et al."
2,2015).
2,"given that research into the eﬀective use of giscience to inform hazard response has shown that all data sources, transmission channels, and processing ﬂows must be determined a priori for hazard response managers to adopt the technology (cutter 2003; contact christopher d."
2,"lippitt clippitt@unm.edu department of geography and environmental studies, university of new mexico, 1 university of new mexico, albuquerque, nm, usa © 2016 informa uk limited, trading as taylor & francis group"
3,"international journal of remote sensing 3273 brucewicz 2003), remote-sensing methods appropriate to time-sensitive information requirements must be optimized a priori."
3,"the remote sensing communication model (rscm) provides a framework for the design and optimization of remote-sensing systems (rsss) that maximize the eﬀective- ness of information they produce with respect to a given user (lippitt, stow, and clarke 2014a)."
3,it also provides a tool (i.e. capacity) for estimating the consequences of changes in rss conﬁguration on the timeliness of information delivery to a user.
3,"here, the rscm is applied to evaluate and recommend reﬁnements for some uses of an extant wildﬁre rss operated by the united states forest service (usfs)."
3,"the usfs-operated fire imaging system (fis) is described, evaluated based on the rscm, updated based on evaluation results, and then original and updated fis information timeliness estimates are compared to meet the two objectives of this study: (1) to assess the utility of the rscm for the optimization of the fis to meet the time-sensitive information require- ments of wildﬁre response managers in southern california and (2) to identify conﬁg- urations of the fis that better meet some of the information requirements of wildﬁre response managers."
3,the remote sensing communication model the rscm is a conceptual model useful for relating remote-sensing methods and tools to the decision contexts in which they are employed and for the design of time-sensitive rsss.
3,"it employs the metaphor of a communication system relaying information to conceptualize the collection of hardware, software, and people required to acquire, transmit, analyse, and employ remote-sensing data as fundamentally a system for the relay of information, where that information produces a varied eﬀect depending on its and its employer’s nature."
3,it draws on shannon’s (1948) mathematical model of com- munication and the concept of information eﬀectiveness proposed by shannon and weaver (1963) to relate rss conﬁguration to decision quality.
3,"the rscm considers remote sensing a communication system where the reality of scene conditions and states is the information source, the sensor is the transmitter, data transmission and distribution systems the channel, the analyst the interpreter, and the user the destination, as illustrated in figure 1."
3,"the sensor samples and encodes reality, the channel transmits that encoded reality to an analyst, and the analyst interprets what the sensor has encoded and passes it to a user."
3,"based on the three levels of communication identiﬁed by shannon and weaver (1963) to determine the eﬀectiveness of information, the rscm dictates that to max- imize the value of information produced by a rss, the data delivered to an analyst must accurately characterize the phenomena of interest (a), the analyst must properly inter- pret those data into information that is relevant to the user (b), and the information must produce an eﬀect when delivered to the user (c)."
3,"through the concept of information travelling over a channel, where that channel has a given capacity in volume per unit time, rscm highlights the eﬀect of various rss parameters on information timeliness."
3,"the rscm considers transmitters (sensors), chan- nels (i.e. transmission and distribution systems), and receivers (i.e. analysts) to all have a capacity that, in aggregate, determine the capacity of the system (lippitt and stow 2015b)."
4,3274 c.
4,lippitt et al.
4,figure 1.
4,the remote sensing communication model.
4,"information ﬂows from reality to a user through the remote-sensing system, where the properties of that user and the decisions they intend to inform determine the optimal conﬁguration of the remote-sensing system."
4,"remote sensing of hazards disaster management is typically conceptualized as a cycle with four phases: (1) reduc- tion, (2) readiness, (3) response, and (4) recovery, in all of which gis and remote sensing can play a signiﬁcant role (cutter 2003)."
4,"while it is easy to see the potential beneﬁts of access to remote-sensing-derived information in all phases of disaster management, the response phase presents a unique challenge to the remote-sensing community; infor- mation in the response phase is always time-sensitive."
4,the adoption of remote-sensing techniques to address information requirements in the time-sensitive response phase has therefore been slow when compared to other phases (joyce et al.
4,2009; ceos 2005; alexander 2002).
4,programmes to provide information in support of the response phase are increasing in number (joyce et al.
4,2009; ceos 2005).
4,"the founding of several programmes seeking to better enable the use of remote sensing for hazard response, such as sentinal asia (kaku et al. 2006) and the international space charter (stryker and jones 2009), make evident the growing importance of remote sensing as a hazard response tool."
4,see joyce et al. (2009) and gillespie et al. (2007) for a thorough review of remote sensing of natural hazards.
4,the most common hazard response remote-sensing application is wildﬁre detection (ambrosia et al.
4,"1998; galindo, lopez-perez, and evangelista-salazar 2003; visser and dawood 2004; laneve, castronuovo, and cadau 2006; davies et al."
4,2009).
4,remote sensing of wildﬁre satellite-based wildﬁre occurrence monitoring has matured to provide a sophisticated suite of information products to managers and continues to improve in terms of the size
5,"international journal of remote sensing 3275 ﬁres that can be detected and the frequency of observation (schroeder et al. 2014), but remote sensing for tactical wildﬁre response remains a challenge."
5,"tactical remote sensing of wildﬁre was demonstrated by the wildfire programme (ambrosia et al. 1998), which developed a rss that transmitted data from the airborne infrared disaster assessment system (airdas) thermal line scanner to a portable incident command centre nearby via cell phone modem."
5,maps of the controlled burn were produced at the portable command centre and made available within 20 min of acquisition.
5,"building on wildfire, the first response experiment (fire) again demonstrated tactical wildﬁre imaging with the airdas thermal line scanner, but from the altus ii unmanned aerial system (uas) platform (ambrosia et al."
5,2003).
5,"autonomous sensor control, on-board orthorectiﬁcation, and an integrated ground-satellite communication system enabled delivery of orthorectiﬁed image products within 10 min."
5,"building on the developments of fire, the western states fire mission (merlin 2009) deployed a modiﬁed modis simulator known as the autonomous modular scanner (ams) on board a modiﬁed predator a, known as ikhana."
5,the mission demonstrated operational tactical wildﬁre mapping over series of ﬁres in the western united states and consistently delivered orthorectiﬁed thermal image data to incident commanders (ic) in less than 10 min.
5,"these programmes demonstrate the potential use of remote sensing to address tactical wildﬁre response information requirements, but they are all experimental in nature."
5,"there are, however, operational tactical ﬁre mapping programmes, the two most well tested of which are the united states forest service (usfs) national infrared operations program (nirops, nirops 2015b) and the fis (fm, riggan and hoﬀman 2003; riggan, tissell, and hoﬀman 2003) operated by the usfs paciﬁc southwest research station (psw)."
5,"nirops is a long-standing thermal imaging programme that began at project fire scan in the 1960s (nirops 2015a) while fis began operations in 2001 (riggan, tissell, and hoﬀman 2003)."
5,nirops primarily images at night during periods of relatively low ﬁre activity to provide updated ﬁre perimeters to ﬁreﬁghters at their morning brieﬁng.
5,fis operates at all times of day and is the focus of this study.
5,"the united states forest service ﬁre imaging system the usfs-psw operates the fis to map active wildﬁre and wildﬁre-related properties such as vegetation density, burn severity, and structure damage."
5,"the conﬁguration of the system when assessed in this study consisted of a king air ﬁxed-wing, twin propeller aircraft equipped with computing hardware, a northrop-grumman ln100gt inertial navigation system, and thermal infrared and multispectral imaging sensors."
5,"while the various imaging sensors on board (see table 1 for a detailed description of the sensors) are useful for the variety of tasks conducted with the system, it is the thermal infrared imaging sensor, firemapper 2.0®, that is primarily used to map intensity, spread, and extent of active wildﬁres."
5,"fis is, among other activities, used to support the prioritization and allocation of ﬁreﬁghters and equipment by leveraging its ability to provide informa- tion on wildﬁre intensity and extent to wildﬁre ics in time scales appropriate to support tactical wildﬁre suppression prioritization."
5,"while fis is operated for a variety of wildﬁre remote-sensing tasks, the rscm requires identiﬁcation of a speciﬁc user or class of user in order to assess the eﬀectiveness of a given rss to inform that user’s decision."
5,analysis of the fis is therefore limited to its use for monitoring of active wildﬁre for tactical
6,3276 c.
6,lippitt et al.
6,table 1.
6,the fire imaging system (fis) sensor speciﬁcations.
6,"image focal image wavelength dimensions length pixel size ground resolution at footprint at size on encoding waveband sensor (μm) (pixels) (mm) (μm) 5,000 m agl (m) 5,000 m agl (m) disk (kb) (bits) primary use ir2 firemapper™ 8.1–9.0 327 × 205 26.4 46.25 8.75 2864 × 1796 134 16 ir3 firemapper™ 11.4–12.4 327 × 205 26.4 46.25 8.75 2864 × 1796 134 16 hot ﬁres ir4 firemapper™ 8.1 to 12.4 327 × 205 26.4 46.25 8.75 2864 × 1796 134 16 cool fires and smoulders va kodak megaplus 0.615–0.685 1528 × 1024 20.2 9 2.25 3404 × 2281 3030 12 vegetation and 1.6i situational awareness vb kodak megaplus 0.815–0.885 1528 × 1024 20.2 9 2.25 3404 × 2281 3030 12 vegetation and 1.6i situational awareness nir sensors unlimited 1.5–1.65 320 × 240 24.4 40 8.2 2623 × 1967 144 10 moisture detection 320 m"
7,international journal of remote sensing 3277 table 2.
7,standard operating procedure to provide fire imaging system (fis) derived information to wildﬁre incident commanders.
7,"procedure estimated time number procedure (min) 1 contacted by incident commanders – deploy assets 60–360 2 image requested incidents and proceed to incident-local airﬁeld 20–120 3 conversion from raw ﬁles to image formats via custom software <5 4 conversion of quantized thermal radiance values to apparent kinetic <1 temperature estimates 5 correlate image data to inertial navigation system (ins) measurements via excel® 15–60 6 upload to server via portable disk and ﬁle transfer protocol (ftp) and download 60–360 by analyst 7 direct projection via custom script in legacy image processing package 20–120 8 ftp upload coarsely registered image mosaic to server and email users to notify 15–20 of availability 9 production of gis ready vector temperature map 15–120 10 ftp upload of gis ready vector temperature map to server and email user to 15–60 notify of availability 11 orthocorrection, mosaic, and conversion to temperature map 1140–7200 (1–5 days) 12 ftp upload of reﬁned temperature map 15–60 decision support, which can include suppression activities, but also management of prescribed or naturally occurring wildﬁres in general, regardless of the need to suppress."
7,"when deployed in tactical wildﬁre mapping mode, fis is tasked by wildﬁre ics."
7,"typical deployments consist of the standard operating procedure (sop) and estimated operation times depicted in table 2, according to fis operators (p."
7,"riggan, personal communication, may 12, 2011; san diego, ca)."
7,note that only steps 1–8 are completed for tactical ﬁre response while steps 9–12 are typically conducted for applications out- side of suppression prioritization.
7,"the decision context information from fis has been used to make decisions about where to deploy ﬁre- ﬁghters and airborne ﬁre retardant tankers, where to light backﬁres, and who should be evacuated."
7,"decisions made using this information aﬀect the safety of citizens and property (eg&g technical services 2008) and, as recent events have demonstrated (karels and dudley 2013), ﬁreﬁghters."
7,"those critical decisions require a range of informa- tion; at a minimum, information on terrain, infrastructure, resources available, and wild- ﬁre location."
7,wildﬁre extent information derived from fis is used by ics in conjunction with these and other ancillary information sources to allocate resources.
7,resources are reallocated as often as is required.
7,"when asked how quickly they need information on wildﬁre progression, ics will always answer with some variant of ‘yester- day’, but major strategy decisions typically take place during brieﬁngs held every 6 or 12 h as personnel change shifts."
7,"during these brieﬁngs, maps play a critical role in both the strategic allocation of resources and in the relay of orders to subordinates (alexander 2002)."
7,"absent the data from fis, the primary source of wildﬁre location information available to ics at these brieﬁng sessions is typically a wildﬁre perimeter line."
7,"wildﬁre perimeter lines are derived from a range of sources, typically including visual estimation of the wildﬁre boundary, global positioning system (gps) equipped"
8,3278 c.
8,"lippitt et al. personnel walking portions of the perimeter, and when available, a gps equipped helicopter ﬂying the approximate wildﬁre boundary."
8,2.1.1.
8,the user the primary decision-maker that fis serves is the ic of the wildﬁre being mapped.
8,"typically from calfire or the usfs in the case of california, ics are experienced ﬁre- ﬁghters who are specially trained to manage the range of ﬁreﬁghting assets at their disposal to protect life and property."
8,this often but not always means extinguishing the wildﬁre to which they are assigned.
8,ics are deployed to and responsible for a single wildﬁre.
8,"for the duration of that wildﬁre ics are in the ﬁeld, which typically means a remote area with limited connectivity and computing resources."
8,"in some instances, mobile command centres with satellite broadband connectivity and computing resources are available."
8,"geographic information system (gis) and image processing capacity is beginning to be available to ics, but expertise and availability are variable; the paper map remains the preferred medium of display for many ics (r."
8,"serabia, personal communication, june 29, 2009; ramona, ca)."
8,"fis as a communication system the fis can be analysed in terms of how well it addresses problems associated with the three levels of communication identiﬁed by the rscm (i.e. eﬀectiveness analysis): (1) the technical problem of communicating appropriate data, (2) the semantic problem of interpreting those data into appropriate information, and (3) the eﬀectiveness problem of employing that information to produce an eﬀect of value."
8,an evaluation of how well fis addresses these three problems is intended to identify portions of the fis conﬁg- uration that are not optimized to address the information requirements of ics and suggest alternative conﬁgurations that better meet those requirements.
8,the timeliness of fis is estimated using rscm capacity analysis under both current and proposed conﬁgurations to determine the eﬀect of proposed conﬁguration changes on informa- tion timeliness (lippitt and stow 2015a).
8,2.2.1.
8,"the technical problem the rscm describes the technical problem (level a) as the problem of acquiring, transmitting, storing, and distributing remote-sensing data of appropriate spectral, spatial, radiometric, and temporal resolution and of suﬃcient ﬁdelity to address a given information requirement (lippitt, stow, and clarke 2014a)."
8,"to optimize level a, sensors at appropriate wavelengths must sample the land surface at suitable spatial and radiometric detail and at an appropriate point in time over a suﬃcient extent, and data must be delivered to the analyst with a minimal level of compression related noise or errors."
8,"the technical capacity of the fis programme to acquire, transmit, and distribute remote-sensing data has been demonstrated through extensive ﬁeld campaigns."
8,the firemapper ii® sensor (fm) records wavebands appropriate for the detection and inten- sity measurement of both active wildﬁre fronts (i.e.
8,ir3) and cooler smouldering ﬁres (i.e.
8,"a focal length of 26.4 mm results in a nominal ground sampling resolution of 8.75 m from the fis standard operating ﬂight altitude above ground (agl) of 5000 m,"
9,international journal of remote sensing 3279 which can be reﬁned to 2.6 m nominal ground sampling distance by reducing agl to 1500 m.
9,"image data are recorded at 16-bit radiometric resolution, which is suﬃcient to diﬀerentiate wildﬁre occurrence and intensity (riggan, hoﬀman, and brass 2009)."
9,"as an airborne asset, fis has the ability to image areas on time scales limited only by the ﬂight speed of the aircraft (cruise airspeed = about 472 km h−1, or 255 kn) relative to wind speed and swath width of the sensor."
9,"processing and transmitting those data, however, limits the rate at which image data or other information products can be provided to ics."
9,"in the case of deploying fis to provide wildﬁre location information for tactical suppression decision support on a six-hour (360 min) brieﬁng cycle, the time- liness of information delivery is the primary constraint on the utility of fis produced information to ics."
9,"this suggests that rss conﬁguration changes that reduce the time required to transmit fis acquired information to analysts, currently estimated to require 75–420 min, will better address the technical problem."
9,2.2.2.
9,"the semantic problem the rscm describes the semantic problem (level b) as the problem of interpreting the received data into information of an appropriate type, reliability, and timeliness to meet the information requirements of a given user."
9,"to optimize level b, data must be interpreted or processed in such a manner that information that is relevant to the user is produced."
9,"for fis, addressing the semantic problem requires that the data collected be interpreted by the receiver into information appropriate for the prioritiza- tion of suppression activities by ics."
9,"in the fis rss, the receiver is a system of people, computers, and algorithms that complete steps 3–5, 7, and optionally steps 9 and 11 of the sop described in table 2."
9,"the information produced by steps 3–5 and 7 of the sop are all of suﬃcient spatial and thematic reliability to allow ics to allocate resources, though steps 9 and 11 improve the thematic and spatial reliability, respectively."
9,"the type of information produced (i.e. apparent kinetic temperature estimates) provides ics with detailed information on wildﬁre extent, intensity, and progression."
9,"the timeliness with which the data are interpreted into information and the multiple transmissions (i.e. extended channel) that are required mean that from the time data capture is complete, 130–720 min are required to present information to ics."
9,"given a 6 h (360 min) brieﬁng cycle and preference for information as quickly as possible, there is potential that the information will not reach ics within the required time period; suggesting that the timeliness of analyst portions of the rss should be targeted for improvement to better address the semantic problem."
9,the single most time consuming analysis step of the fis sop is not analysis at all but rather the transfer of data between various portions of the analysis sequence.
9,the transfer of data from a local airport nearby an incident to an oﬀ-site analyst (i.e.
9,sop step 5) requires 60–360 min.
9,"to deliver the ﬁrst viable information product to ics, the analyst uses a custom script within a legacy image processing package to project apparent kinetic temperature estimates to ground coordinates and mosaics the resultant projected frames (sop step 7)."
9,that mosaic is then uploaded to a publically available web site for viewing or download by ics.
9,"to eliminate step 6, step 7 can be conducted on board the aircraft."
9,using a software utility that permits projective orthocorrection of image frames on low-resource computers like a laptop (e.g.
9,fraley 2011) will eliminate
10,3280 c.
10,lippitt et al. the need for redundant data transfer.
10,software can also readily automate the correlation of image frames and inertial navigation system (ins) records (step 5).
10,"elimination of step 6 and optimization of steps 5 and 7 hold potential to improve the timeliness of information to ics without changing the type or reliability of that information and, therefore, better address the semantic problem."
10,2.2.3.
10,"the eﬀectiveness problem the rscm describes the eﬀectiveness problem (level c) as the problem of providing information to a user that enables a decision-maker, whether human or machine, to make a decision that produces an eﬀect of value."
10,"to produce an eﬀect of value, the decision-maker (i.e. user) must be able to readily ingest and understand the information presented, which requires consideration of the decision-maker’s properties."
