page,p
10,"for the fis to produce information that maximizes the eﬀectiveness of decisions prioritizing resources for the suppression of wildﬁre, the information presented to ics must be readily ingestible, understood, and related to other key information sources."
10,"the proper- ties of a given information product that might inﬂuence the ability of a decision-maker to ingest information are numerous, but in the case of wildﬁre ics in california, there are some well-understood needs owing to an established sop."
10,"currently, fis supplies information to ics by making available web viewable map products and downloadable gis ready temperature products."
10,"these oﬀer several advan- tages: ease of use, ﬂexibility, and straightforward production."
10,"assuming that there are appropriate analyst, computing, and connectivity resources available, the current deliv- ery mechanism provides the required information in a highly ﬂexible format that can be adapted to the needs of ics."
10,"the availability of analyst, computing, and connectivity resources to ics in the ﬁeld is highly variable, however."
10,"in particular, connectivity can be a challenge in the remote locations in which wildﬁres often occur."
10,"given this, the variable proﬁciency of ics with digital mapping technologies, and general reliance on paper and other static map media, the optimal format to provide information on wildﬁre presence is in the form of a static map, either paper or ﬁle (ambrosia et al."
10,1998).
10,"since a static map does not easily integrate with other critical information (e.g. elevation, slope, critical infrastructure, roads), wildﬁre presence information must be integrated with appropriate ancillary information prior to delivery."
10,the standard operat- ing procedure of ics points to a ready solution in this case also; ics in california regularly use maps produced under the thomas series by rand mcnally (san diego county 2010) (r.
10,"serabia, personal communication, june 29, 2009; ramona, ca)."
10,"these maps, known more commonly as ‘thomas brothers maps’, provide detailed elevation contours, road- ways, and location information."
10,"integration of wildﬁre temperature information with thomas brother’s maps, or similarly formatted maps with similar information, allows ready ingestion of wildﬁre presence information by ics and should, subsequently, improve the eﬀectiveness of resource allocation decisions made by ics."
10,figure 2 shows an example of one such map.
10,"system capacity the timeliness of the fis can be estimated based on the capacity of the sensor, transmission system, and receiver."
10,"we can estimate the sensor, channel, and receiver"
11,international journal of remote sensing 3281 figure 2.
11,an example static map product produced using the firemapper thermal-imaging radio- meter.
11,"analysis of the fis using the remote sensing communication model revealed that a static map with thermal data contextualized by other relevant information can improve the eﬀectiveness of fis produced information by better integrating with calfire standard operating procedures. capacities based on the sensor and platform, transmission, and image processing characteristics of the fis."
11,"to explore the net eﬀect of various possible fis conﬁgurations, system capacity is estimated for sop steps 2–8 under current fis conﬁguration and alternate conﬁgurations suggested by the eﬀectiveness analysis above."
11,"to explore the bounds of possible missions, the capacity of the fis is estimated for two contrived wildﬁres: a 809 ha (2000 acre) ﬁre and a 121,406 ha (300,000 acre) ﬁre."
11,the ﬁrst is intended to simulate smaller more typical wildﬁres in southern california while the second is intended to simulate larger more catastrophic wildﬁres like the cedar fire of 2003 (eg&g technical services 2008).
11,"the time required to deploy to a wildﬁre from lancaster, ca (td) will have a linear eﬀect on the time requires to image a scene (tacq), but given that the aircraft can also operate from other airports closer to the ﬁre, we hold"
12,3282 c.
12,lippitt et al.
12,"td constant at 12.71 min, or the time required to travel 100 km, as an estimate of the distance from a given wildﬁre to a nearby staging airport."
12,2.3.1.
12,"sensor capacity the fis employs a king air a100 aircraft; a dual engine, pressurized cabin, ﬁxed wing aircraft with a maximum operating altitude of 10,700 m and max cruise speed of about 472 km h−1."
12,"while there are a series of sensors operated on fis, thermal infrared data from the fm sensor are prioritized when deployed in the context of tactical suppression decision support."
12,the cruise speed and altitude of the aircraft interact with the camera model of the fm sensor to determine the sensor capacity (cacq) in bits per unit time: cacq ¼ βba ; (1) where β is the rate of acquisition in area per unit time assuming no end lap or side lap and ba is the number of bits per unit ground area.
12,"acquisition time (tacq) can then be estimated by bs tacq ¼ þ td þ tm ðn  1þ; (2) cacq where bs is the number of bits required to image a scene, td is the time required to deploy the sensor to the scene, and tm is the time required to manoeuvre the platform between ﬂight lines or paths, and n is the number of ﬂight lines or paths required to image the scene."
12,under current conﬁguration fis is operated at an acquisition altitude of 5000 m and therefore acquires data at a ground sampling distance of 8.75 m using the fm sensor.
12,"with typical total redundancy of 68% and all three channels (ir2–4) captured (i.e. conﬁgurations 1–4), sensor capacity (cacq) can be calculated as 203,265 bits s−1 with an acquisition rate (β) of 324,218 m2 s−1."
12,"to image an 809 ha scene (i.e. conﬁguration 1), total acquisition time (tacq) is estimated to be about 42 s."
12,"to image a 121,406 ha scene (i.e. conﬁguration 2), tacq = about 105 min."
12,"adjusting the sensor conﬁguration to acquire only ir4 results in unreliable kinetic temperature estimates for hot ﬁres because of saturation, but still allows accurate retrieval of active ﬁre location for both cool and hot ﬁres."
12,"limiting acquisition to only the ir4 channel (i.e. conﬁgurations 1 s–4s), sensor capacity is reduced (cacq = 67,755), while the time required to image (tacq) the example 809 and 121,406 ha scenes remains the same."
12,"because the sensor capacity is reduced, the data quantity collected is reduced substantially, as shown in table 3."
12,2.3.2.
12,channel capacity fis is not currently conﬁgured for wireless data transmission.
12,"the channel is therefore typically composed of writing data to an external hard drive, walking that hard drive to an internet enabled computer at or nearby the staging airport, uploading the data to a ﬁle transfer protocol enabled server, download of the data from that server to an analyst (i.e. collectively sop step 6), and upload of the derived information product to a publicly accessible webpage (i.e."
12,sop step 8).
12,"the channel, in this case, is described by ﬁve sub- channels each with a capacity: disk write capacity (cc1), disk read capacity (cc2), internet upload capacity from the airport (cc3), internet download capacity (cc4), and internet"
13,table 3.
13,alternative fire imaging system (fis) conﬁgurations assuming a 68% redundant acquisition (es).
13,"system conﬁguration numbers 1–4 are remote sensing communication model (rscm) capacity calculations for current fis conﬁgurations for example 809 ha and 121,406 ha scenes."
13,"subsequent conﬁgurations are proposed modiﬁcations to current conﬁgurations where letters in the conﬁguration number represent the updated component: s, sensor; c, channel; r, receiver."
13,transmi- receiver total time system number of ground area of total sensor ssion capacity required to time diﬀerence conﬁgu- spectral sampling (ba) rate of scene to acquisition capacity time (creca) receiver produce from current ration wavebands distance (bits acquisition be imaged time (tacq) (cacq) (tchan) (records time (trec) information conﬁguration number (rλ) (rg) (m) m−2) (β) (m2 s−1) (as) (ha) (min) (bits s−1) (min) s−1) (min) (trss) (min) (δtrss) (min) current 1 3 8.75 0.63 324218 809 0.70 203265 26.25 2814.5 8.16 35.11 - conﬁguration 2 3 8.75 0.63 324218 121406 104.85 203265 55.42 18.7 70989.00 71149.27 - 3 3 2.62 6.99 97265 809 2.33 680138 28.24 252.3 397.42 427.99 - 4 3 2.62 6.99 97265 121406 349.50 680138 353.60 1.6 8829454.85 8830157.95 - sensor changes 1s 1 8.75 0.21 97265 809 0.70 67755 26.12 8338.8 5.35 32.17 −2.94 2s 1 8.75 0.21 97265 121406 104.85 67755 35.85 56.2 7892.03 8032.73 −63116.54 3s 1 2.62 2.33 97265 809 2.33 680138 26.79 757.0 48.63 77.75 −350.24 4s 1 2.62 2.33 97265 121406 349.50 680138 135.24 5.1 981212.76 981697.50 −7848460.45 channel changes 1c 3 8.75 0.63 324218 809 0.70 203265 19.20 2814.5 8.16 28.06 −7.05 1sc 1 8.75 0.21 324218 809 0.70 67755 19.10 8438.9 5.35 25.15 −9.96 2c 3 8.75 0.63 324218 121406 104.85 203265 40.43 18.8 70989.00 71134.28 −14.99 2sc 1 8.75 0.21 324218 121406 104.85 67755 26.18 56.3 7892.03 8023.06 −63126.21 3c 3 2.62 6.99 97265 809 2.33 680138 20.65 252.4 397.42 420.40 −7.59 3sc 1 2.62 2.33 97265 809 2.33 226713 19.59 757.0 48.63 70.55 −357.44 4c 3 2.62 6.99 97265 121406 349.50 680138 257.47 1.7 8829454.85 8830061.82 −96.13 4sc 1 2.62 2.33 97265 121406 349.50 226713 98.53 5.1 981212.76 981660.79 −7848497.16 analyst changes 1cr 3 8.75 0.63 324218 809 0.70 203265 19.20 2814.5 28.16 48.06 12.95 1scr 1 8.75 0.21 324218 809 0.70 67755 19.10 8438.9 25.35 45.15 10.04 2cr 3 8.75 0.63 324218 121406 104.85 203265 40.43 18.8 71009.00 71154.28 5.01 2scr 1 8.75 0.21 324218 121406 104.85 67755 26.18 56.3 7912.03 8043.06 −63106.21 3cr 3 2.62 6.99 97265 809 2.33 680138 20.65 252.4 417.42 440.40 12.41 3scr 1 2.62 2.33 97265 809 2.33 226713 19.59 757.0 68.63 90.55 −337.44 4cr 3 2.62 6.99 97265 121406 349.50 680138 257.47 1.7 8829474.85 8830081.82 international journal of remote sensing −76.13 4scr 1 2.62 2.33 97265 121406 349.50 226713 98.53 5.0 981232.76 981680.79 −7848477.16 3283
14,3284 c.
14,lippitt et al. upload capacity from the analyst location (cc5).
14,"the fis channel timeliness (lippitt and stow 2015b), tchan, can be estimated by bs bs bs bs bs d tchan ¼ þ l1 þ þ l2 þ þ l3 þ þ l4 þ þ l5 þ  tct ; (3) cc1 cc2 cc3 cc4 cc5 v where d is the distance of the scene from an airport with an internet enabled computer, v is the cruise speed of the aircraft, l is latency, and tct is the total time of concurrent transmission by channels."
14,"assuming an airport distance (d) of 100 km, disk write capacity (cc1) of 320 mbit s−1, disk read capacity (cc2) of 320 mbit s−1, internet upload capacity (cc3) of 1.0 mbit s−1, internet download capacity (cc4) of 8 mbit s−1, internet upload capacity (cc5) of 4 mbit s−1, and latency (l1,2,3,4,5) of 120, 120, 20, 300, and 120 s, respectively, and that the disk is written in transit (tct = cc1), transmission time (tchan) can be estimated at approximately 26.25 min for an 809 ha scene and 55.42 min for a 121,406 ha scene, for the standard operating procedure of 5000 m acquisition altitude and acquisition of ir2-4 (i.e. conﬁgurations and 1–2)."
14,"limiting acquisition to only the ir4 channel (i.e. conﬁgurations 1s–4s) reduces the total quantity of data to travel over the channel and therefore reduces total transmission time (tchan), as shown in table 3."
14,"under the revised conﬁguration suggested by the eﬀectiveness analysis above, the channel is revised to eliminate sop step 6 (i.e."
14,cc3 and cc4).
14,"the time required to transmit information, in this case, is estimated by bs bs bs d tc ¼ þ l1 þ þ l2 þ þ l3 þ  tct : (4) cc1 cc2 cc5 v assuming the same sub-channel capacities outlined above, (tchan) can be estimated at approximately 19.2 min for an 809 ha scene (i.e. conﬁguration 1c) and 40.43 min for a 121,406 ha scene (i.e. conﬁguration 2c), for the sop of 5000 m acquisition altitude and acquisition of ir2–4."
14,"with the updated channel, limiting acquisition to only the ir4 channel reduces total transmission time (tchan) to 19.1 min for a 809 ha scene (i.e. conﬁguration 1sc) and 26.18 min for a 121,406 ha scene (i.e. conﬁguration 2sc)."
14,see table 3 for details.
14,2.3.3.
14,"receiver capacity interpretation of fis generated data into information digestible by ics requires steps 3–5, 7, and optionally 9 and 11 from the fis sop outlined in table 2."
14,"under the current sop, these steps are completed by a combination of human and automated procedures."
14,conversion of raw data to image formats (i.e.
14,sop step 3) and conversion from thermal infrared radiance to apparent kinetic temperature estimates (i.e.
14,sop step 4) are auto- mated procedures triggered by the fis sensor operator.
14,the correlation of image data to ins data (sop step 5) is currently completed in microsoft excel® by the fis sensor operator.
14,initial data organization and editing is followed by automated correlation of ins ﬁelds to image frames based on gps and central processing unit clock times.
14,direct projection of image data to ground coordinates based on the sensor model and orientation (i.e.
14,sop step 7) similarly requires an initial data organization followed by an automated processing procedure.
14,"the rscm provides methods for estimating the capacity of automated and human receivers (lippitt, stow, and clarke 2014a)."
14,"for automated receivers, receiver capacity"
15,international journal of remote sensing 3285 (creca) is estimated based on the complexity of the algorithms employed.
15,"‘big o’ notation can be used to describe the complexity of algorithms in terms of the upper bound of the computation ‘work’ required, and subsequently estimate the maximum number of computational cycles per record (ϕ) required to process a given data set using those algorithms (burger and burge 2008)."
15,"adding two bands, for example, can be described as having a linear complexity, or o(n), meaning the number of computations required is linearly related to data volume."
15,"the single operation of addition must be performed rc times, where r is the number of rows and c is the number of columns, such that ϕ increases linearly with the number of records input."
15,"in remote sensing, the number of records is a function of the number samples collected, ps, so adding two bands can also be said to have complexity of o(ps), or more simply stated, ps."
15,conversion of raw data to image formats and conversion from thermal radiance to apparent kinetic temperature estimates are both automated procedures.
15,conversion of raw data to image formats is a simple conversion that requires query of each pixel once.
15,"estimation of apparent temperature requires relating each pixel to its associated black body calibration value by regression, which requires query of all pixels in the image once and all pixels in the black body calibration image once."
15,the algorithm complexity for steps 3 and 4 can therefore be estimated as ps and collectively 3ps.
15,the correlation of image data to ins data is conducted by brute force matching after initial data organization.
15,"initial data organization is not dependent on the quantity of data or size of area captured but rather the proﬁciency of the analyst; fis sensor operators estimate this process to consistently require ﬁve minutes to complete, regard- less of dataset size (p."
15,"riggan, personal communication, may 12, 2011; san diego, ca)."
15,the correlation of image data to the appropriate ins record requires a query of all gps time ﬁeld entries once for each image frame time stamp.
15,the complexity of matching ins ﬁelds to image time stamps can therefore be estimated as n log2 n.
15,the total number of ins records (rins) can be estimated by rins ¼ hins ta ; (5) where hins is the sampling rate of the ins in hertz.
15,"the total number of frames and therefore the total image time stamps acquired (fs) can be estimated by ps fs ¼ ; (6) ijð1 þ es þ where i is the number of detectors samples in the x direction, j is the number of detectors in the y direction, and es is the redundancy of acquisition."
15,"the total number of ins records (rins) and total number of image time stamps (fs) can therefore be estimated to be 491 and 30 for an 809 ha ﬁre and 73,706 and 4,433 for a 121,406 ha ﬁre, respectively."
15,"under the current sop, direct projection of image data to ground coordinates based on the sensor model and orientation (i.e."
15,"sop step 7) requires several steps from an algorithmic perspective: (1) initial data reformatting for import into a legacy image processing software, (2) projection of image coordinates to a surface described by a digital elevation model, (3) resampling of kinetic temperature values to the new projected grid, and (4) mosaicking of the resultant images into a single product."
15,reformatting data requires a single query of each sample and can
16,3286 c.
16,lippitt et al. therefore be considered to have a complexity of ps.
16,"projection of image coordinates is completed by projecting the location of each pixel to a digital elevation model and requires query of each pixel, p, and its corresponding value in the digital elevation model once."
16,the complexity of projection can be estimated to be ps log2 ps.
16,nearest neighbour resampling of projected images requires query of each pixel and its nearest neighbour in the unprojected image as deﬁned by the projective camera model and can be estimated to have a complexity of ps.
16,"mosaicking with a ‘most nadir’ rule requires calculation of angle for each sample, followed by a sorting to determine the sample of lowest angle, followed by population of a new grid encompassing the scene, and can be considered to have a complexity of ps2."
16,"to deﬁne the upper bound of complexity for the fis receiver conﬁguration outlined here, complexities are aggregated to the most complex weighting, ps2."
16,"if we consider the problem as the upper bound of all complexities, the computational cycles per record (ϕ) can be estimated as ðps þ rins þ fs þ2 ¼ : (7) ps þ rins þ fs for the estimated 532,797 records (ps) required to image an 809 ha scene at 8.75 m ground sampling distance with ir2–4 (i.e. system conﬁguration 1), ϕ is estimated as 532,953 cycles per record."
16,"on the 1.5 ghz processor deployed on fis, creca is estimated as 2815 records s−1."
16,"receiver time (trec) is then estimated to be ≤ 3.16 min, excluding the 5 min required for the sensor operator to organize ins and image time stamps."
16,total receiver time (i.e.
16,sop steps 3–5 and 7) is estimated to be ≤ 8.16 min.
16,"for the approximately 79.9 million records (ps) required to image a 121,406 ha scene with ir2–4 (i.e. system conﬁguration 2), ϕ = 79,942,938 cycles per record and total receiver time can be estimated to be ≤70,989 min, or 1183.23 h."
16,imaging a 809 ha scene at 2.62 m ground sampling distance with ir2–4 (i.e. system conﬁguration 3) requires 5.94 million records (ps) and receiver time (trec) is estimated to be ≤6.62 h including the 5 min required for the sensor operator to organize ins and image time stamps.
16,"for the approximately 297.13 million pixels (ps) required to image a 121,406 ha scene with ir2–4 (i.e. system conﬁguration 4), total receiver time is estimated to be ≤981,212.76 h, or 16,353.55 days."
16,"when only ir4 is utilized (i.e. conﬁgurations 1scr–4scr), the number of records (ps) is reduced signiﬁcantly, resulting in increased receiver capacities (creca) and therefore reduced receiver time (trec)."
16,see table 2 for details.
16,"assuming that ancillary data for the scene are compiled in advance of the imaging mission, integration of the kinetic temperature mosaic into a map product that approx- imates thomas brother’s maps requires that the analyst open the required data sets in an appropriate gis or mapping software and output the resultant product into a printable document format, such as the portable document format ®adobe."
16,the process is independent of data quantity and requires a static amount of time for the analyst to complete.
16,the estimated maximum time to complete the process is 20 min.
16,conﬁgurations 1cr–4cr and 1scr–4scr (in table 3) show the range of diﬀerent sensor
17,international journal of remote sensing 3287 and channel conﬁgurations with the receiver modiﬁed to include integration into a static map product.
17,"proposed time-sensitive fis the analysis above of how well fis addresses the three problems of eﬀective commu- nication reveals that the information provided to ics is of suﬃcient reliability and appropriate type to address their information requirement for suppression prioritization, but that under some conditions, fis could fail to provide information to ics in the required time period."
17,it also reveals that information is provided in a format that is not readily ingested by some ics.
17,"to modify the fis to better meet the timeliness require- ments imposed by a six-hour brieﬁng cycle and provide information that is readily ingested by all ics, changes to the fis sensor, channel, and receiver are proposed and the impact of the proposed changes on fis timeliness is estimated in table 4."
17,"limiting acquisition to ir4 (i.e. conﬁgurations 1s–4s) does not change the amount of time required to acquire data (tacq), but does reduce the time required to transmit and process it, as seen in table 4."
17,reduction of the total number of sub-channels required to transmit the acquired data and derived information further reduces the estimated amount of time required to transmit data (tchan).
17,"by conducting image processing steps on board the aircraft instead of at an oﬀ-site location, sop step 6 is eliminated and transmission time is reduced by up to 62%."
17,modiﬁcation of the receiver (i.e. analyst) to permit image processing on board does not result in a change to the estimated time required to produce information (trss); the image processing steps conducted in sop steps 3–5 and 7 remain the same.
17,integration of kinetic table 4.
17,"change in fire imaging system (fis) timeliness under the proposed changes to sensor, channel, and receiver conﬁguration."
17,"change in (δ) acquisition time (tacq), transmission time (tchan), receiver time (treca), and total system timeliness (trss) are listed in minutes, where negative is a reduction in time and positive is an increase in time when compared to the current system conﬁguration."
17,"system δ acquisition time δ transmission time δ receiver time δ total (trss) conﬁguration (tacq) (min) (tchan) (min) (treca) (min) (min) sensor changes 1 - −0.13 −2.81 −2.94 2 - −19.57 −63,096.97 −63,116.54 3 - −1.45 −348.79 −350.24 4 - −218.36 −7,848,242.09 −7,848,242.09 channel changes 1 - −7.05 - −7.05 2 - −14.99 - −14.99 3 - −7.59 - −7.59 4 - −96.13 - −96.13 receiver changes 1 - - +20.00 +20.00 2 - - +20.00 +20.00 3 - - +20.00 +20.00 4 - - +20.00 +20.00 total 1 - −7.15 +17.19 +10.04 2 - −29.24 −63,076.97 −63,106.21 3 - −8.65 −328.79 −337.44 4 - −255.07 −7,848,222.09 −7,848,477160"
18,3288 c.
18,"lippitt et al. temperature estimates to a map, however, requires an estimated 20 min to complete, and therefore increases receiver time (trec) proportionally."
18,see tables 3 and 4 for details.
18,"given that the time savings introduced by updating the fis sensor conﬁguration to only acquire ir4 and that doing so still allows fis to produce suﬃciently reliable information on the location of active wildﬁre, acquiring only ir4 is recommended when imaging in support of suppression prioritization."
18,"as ics identify ways to take advantage of the more detailed temperature information permitted by acquiring ir3 and ir4 and transmission rates increase with technological innovation, however, this recommendation is likely to change."
18,"similarly, given the reduction in transmission time (tchan) and no change in information reliability oﬀered by the proposed changes to fis channel conﬁguration, it is recommended that sop step 6 be eliminated by conducting image processing steps on board the aircraft."
18,"given the widespread reliance on paper map products by ics, it also recommended that the current receiver conﬁguration be amended to allow the integration of the fis produced information into a static medium map with appropriate ancillary information (e.g. roads, terrain, structures)."
18,"production of a map product does necessitate additional receiver time, but also ensures that the information produced can be eﬀectively employed by all ics, even in limited connectiv- ity or computing resource environments."
18,discussion and conclusions the rscm provides a useful framework for identifying portions of the fis that should be targeted for optimization or reconﬁguration.
18,"analysis of a rss such as the fis, in terms of how well it addresses the three problems of eﬀective communication (i.e. eﬀectiveness analysis) clariﬁes the dependencies between technical conﬁguration, analysis proce- dures, and the needs of the user for which the information is intended."
18,"coupled with the ability to test assumptions about the impact of proposed changes on the timeliness of information delivery, the rscm provides an eﬀective framework in which to consider the design of rss for time-sensitive applications."
