page,p
9,classification of the forest cover of tver oblast using hyperspectral airborne imagery.
9,"izvestiya, atmospheric and oceanic iv."
9,conclusions physics.
9,2014;50(9):929-42.
9,"[5] hidayat r, ando k, masumoto y, luo j, editors."
9,"interannual pleiades imagery with 0.5 m spatial resolution suitable to variability of rainfall over indonesia: impacts of enso and iod and support large-scale mapping, this can be seen by an their predictability."
9,iop conference series: earth and environmental assessment on the geometric accuracy and thematic science; 2016: iop publishing. extraction.
9,pre-processing on improving the geometric [6] indonesia national agency for disaster management (bnpb).
9,"information data natural disaster in indonesia: bnpb; 2018. accuracy can be divided based on the types of two-level [7] li j, li y, chapman ma."
9,high-resolution satellite image sources for product produced by the ground station.
9,improvement disaster management in urban areas.
9,geo-information for disaster accuracy to meet standard mapping scale for 1:5000 can be management.
9,"2005:1055-70. achieved using a primary product data which processed by [8] agrafiotis p, georgopoulos a."
9,comparative assessment of very high-resolution satellite and aerial orthoimagery.
9,"the international using an insertion of gcps and selecting the better dsm, archives of photogrammetry, remote sensing and spatial while the improvement of the standard ortho product can be information sciences."
9,2015;40(3):1. achieved using shifting the coordinate position.
9,"assessment [9] alrajhi m, janjua ks, khan ma, alobeid a."
9,updating maps using of the thematic extraction detected visually shows that the high-resolution satellite imagery.
9,"the international archives of photogrammetry, remote sensing and spatial information sciences. imagery meet the information for large-scale mapping 2016;41:711."
10,"[10] sukojo bm, nabilah s, editors."
10,analysis of accuracy [16] head of big.
10,the accuracy of base map.
10,"in: geospatial information orthorectification pleiades and quickbird imagery to creation of agency (big), editor."
10,no 15 the year 2014.
10,cibinong: the ministry based map of detail spatial plan for open green space (case study: of law and human rights of indonesia.
10,part of tuban urban area).
10,"iop conference series: earth and [17] deng h, huang s, wang q, pan z, xin y."
10,"geometric accuracy environmental science; 2018: iop publishing. assessment and correction of imagery from chinese earth observation [11] felbier a, esch t, heldens w, marconcini m, zeidler j, roth a, et satellites (hj-1 a/b, cbers-02c, and zy-3)."
10,"the international al., editors."
10,"the global urban footprint—processing status and cross- archives of photogrammetry, remote sensing and spatial comparison to existing human settlement products."
10,geoscience and information sciences.
10,2014;40(2):71.
10,"remote sensing symposium (igarss), 2014 ieee international; [18] aguilar m, agüera f, aguilar f, carvajal f."
10,geometric accuracy 2014: ieee. assessment of the orthorectification process from very high- [12] airbus ds.
10,"pleiades user guide and application guide 2018. resolution satellite imagery for common agricultural policy [13] de oliveira cg, paradella wr, da silva adq."
10,assessment of purposes.
10,international journal of remote sensing. 2008;29(24):7181- radargrammetric dsms from terrasar-x stripmap images in a 97. mountainous relief area of the amazon region.
10,"isprs journal of [19] alganci u, besol b, sertel e."
10,accuracy assessment of different photogrammetry and remote sensing.
10,2011;66(1):67-72.
10,digital surface models.
10,"isprs international journal of geo- [14] gim jh, shin sh."
10,evaluating positional accuracy of pleiades 1a information.
10,2018;7(3):114. satellite imagery in exploiting foreign natural resources.
10,spatial information research.
10,2016;24(2):85-92.
10,"[15] fraser c, hanley h, yamakawa t, editors."
10,sub-meter geopositioning with ikonos geo imagery.
10,"proceedings of joint isprs workshop on high-resolution mapping from space; 2001: hannover, germany."
