page,p
20,"vegetation optical depth is derived from microwave data, often in concert with soil moisture retrievals (pan et al., 2014) and pro- vides an approximation of vegetation water content and therefore the hydrological functioning of plants."
20,"there is a long legacy of retrievals based on vir indices such as lai and normalized difference vegetation index (ndvi), although there is an argument that the reliance on narrowband indices is missing opportunities to use multispectral and hyperspectral information from current and proposed missions."
20,"long-term time ser- ies of ndvi, lai, and fpar exist from a range of satellites including the avhrr-based gimms product (pinzon & tucker, 2014)."
20,"more recently, modis has been used to develop the enhanced vegetation index (huete et al., 2002), which is increasingly used and has the advantage of being correlated with lai but without saturation at high lai values that hampers legacy products."
20,"vegetation functioning in terms of photosynthesis (and its relation to transpiration via stomatal conductance) can also be estimated from solar-induced fluorescence, and interest has increased recently in the use of remote sensing derived estimates."
20,"for example, there have been global retrievals based on the japanese greenhouse gases observing satellite (frankenberg et al., 2011) that have shown great promise in constrain- ing estimates of the terrestrial carbon cycle, and applications to crop monitoring based on global ozone monitoring experiment-2 sensor (guan et al., 2016)."
20,these early retrievals will be built upon with the recent launch of the nasa orbiting carbon observatory-2 spectrometer and the upcoming sentinel-5 precursor mission that hosts the tropospheric monitoring instrument.
20,"these two sensors improve upon the resolution of greenhouse gases observing satellite to 3 and 8 km, respectively, making retrievals relevant to decision-making."
20,the upcoming (2022) esa fluorescence explorer is the ﬁrst dedicated solar-induced fluorescence mission.
20,the sentinel-2 mission provides unprecedented information from which vegetation variables can be derived.
20,the 13 spectral bands from visible and nir to swir at a range of resolutions from 10 to 60 m are suitable for monitoring vegetation health.
20,"sentinel-2 is providing data on several vegetation indices such as lai, leaf chlorophyll content and leaf water content, and importantly, it is the ﬁrst sensor to include bands in the sheffield et al."
21,"water resources research 10.1029/2017wr022437 red edge, which are suitable for estimating canopy chlorophyll and nitrogen content (clevers & gitelson, 2013)."
21,"again, nasa’s proposed hyspiri sensor is well suited to vegetation retrievals (section 4)."
21,the recently launched global ecosystem dynamics instrument on the iss will be the ﬁrst high-resolution laser ranging sensor.
21,"the 2-year mission is focused on measuring forest canopy height, canopy vertical structure, and surface elevation, with research applications on the carbon balance and forest structure, but with poten- tial also for observing water body levels and glaciers."
21,"current use of rs for decision-making in the lac region remote sensing information is progressively ﬁnding its way into the decision-making context of countries in the region, although mostly focused on the use of precipitation and vegetation indices."
21,two types of usages can be identiﬁed.
21,single source remote sensing products are widely used for monitoring speciﬁc aspects of the water cycle on a regular basis.
21,"in this case, precipitation products are often used to complement the exist- ing gauge measurement networks."
21,a second type of use of remote sensing products for decision-making is integrated in modeling frameworks.
21,"in addition to the latin american and caribbean flood and drought monitor (lacfdm) already mentioned, national efforts have been developed to generate locally relevant pro- ducts for decision-making."
21,we provide some examples of these two types of efforts.
21,3.8.1.
21,"monitoring precipitation in the case of peru, a merging procedure has been developed to combine the observed rain gauge network with the chirps data set, providing a monthly rainfall product termed pisco (lavado et al., 2016), and which is designated as the ofﬁcial rainfall estimate for the country."
21,"a relevant data product for decision-making is the standardized precipitation index, which has been deﬁned by the world meteorological organization as an essential parameter for drought monitoring (world meteorological organization and global water partnership, 2016)."
21,"as a sufﬁciently long observation period of 30 years is required to determine the index, the observed rain gauge network is often insufﬁcient for this purpose."
21,"for the same reason, only a limited number of rs products can be used for this purpose."
21,"taking advantage of the high-resolution (0.05°) pisco merged data set, peru generates the standardized precipitation index for drought monitoring which is made available through the national drought observatory (senamhi, 2018a)."
21,"for ﬂood risk management, the gpm-imerg data set is currently used by senamhi to identify potential immi- nent ﬂood hazards."
21,"a similar effort was developed in chile, using the persiann rainfall product."
21,"using the extensive database of more than 700 historical rain gauge stations (figure 2a), a two-step procedure has been developed to calibrate persiann in real time using a bias correction (yang et al., 2016), in combination with a merging approach (yang et al., 2017)."
21,"this signiﬁcantly improved the quality of the remote sensing product, and it has been therefore made available within the national agroclimatic observatory (chile national agroclimatic observatory, 2018) for rainfall monitoring."
21,3.8.2.
21,"integrated crop, drought, and flood monitoring vegetation indices are also actively used in a decision-making framework."
21,"uruguay has developed the instituto nacional de investigacion agropecuaria (2018) monitoring system to identify the drought hazards in its agricultural sector, which uses the ndvi anomalies as one of its main indicators."
21,"a similar system has been implemented in brazil, called agritiempo (2018), which uses a combination of station data and trmm and modis remote sensing data."
21,"mexico has implemented the national drought management plan pronacose (korenfeld-federman et al., 2014), which includes the establishment of a national drought monitor."
21,"this has been built around the chirps and ndvi data sets, providing continuous updates of drought conditions in the country."
21,"mexico has adopted the leaky bucket model (fan & van den dool, 2004) from cpc/noaa to provide soil moisture estimates for the national drought monitor."
21,several countries are experi- menting with the integration of rs data to support early warning of water related hazards.
21,"an example is the daily monitoring and early warning of the main rivers of peru, which uses the high-resolution persiann precipitation data set (0.04°) to drive a hydrological model to evaluate potential ﬂood hazards in the coming hours (senamhi, 2018b)."
21,"the food and agriculture organization has developed the agricultural stress index system (food and agriculture organization, 2018), which uses ndvi to calculate crop-speciﬁc drought stress during the growing season, including some forecast capabilities."
21,"national spin-offs of the global system are currently being set up, with case studies implemented in nicaragua, bolivia, chile, and peru during 2016 and 2017, in collaboration with their ministries of agriculture."
21,sheffield et al.
22,water resources research 10.1029/2017wr022437 4.
22,"future planned and proposed missions there is a wealth of planned and proposed missions that seek to continue our current capabilities, and several that have the promise for transforming the way we monitor the earth’s surface, with implications for improved water management, including drought and ﬂood monitoring, in terms of accuracy, resolution, and repeat times."
22,the impetus for new missions and opportunities is shaped by scientiﬁc community consen- sus such as the second u.s.
22,"national decadal survey (national research council, 2007) and latest national decadal surveys (national academies of sciences, engineering, and medicine, 2018), which prioritize research areas, observations, and potential missions to make those observations, including high-priority observations of relevance to wrm."
22,"of relevance to wrm, designated program elements include for precipita- tion, changes in water storage on land, changes in glaciers and terrestrial vegetation, and recommendations for missions focused on land cover change and snow."
22,"overcoming the main limitations of optical systems for day-night and all-weather retrievals, and low repeat intervals, and the spatial resolution limitations of micro- wave sensors, points at the use of combined systems and constellations of satellites."
22,"here we provide a review of recently launched, upcoming and proposed operational and earth observation missions, including technical speciﬁcations of the retrieved products and planned dates."
22,"next generation geostationary satellites the goes-r series is the next generation of geostationary weather satellites for the united states, although it covers the western hemisphere and so is of relevance to lac."
22,the goes-r series is a four-satellite program (goes-r/s/t/u) operated by nasa/noaa that will extend the availability of the operational goes satellite system through 2036.
22,"the main instrument of relevance on the goes-r satellites is the advanced baseline imager, which has 16 spectral bands (compared to 5 on goes): two visible channels, four near-infrared channels, and 10 infrared channels, and will have four times higher spatial resolution from 0.5 to 2 km depending on the band, with repeat time of 5–15 and 5 min over the conus."
22,a retrieval mode will focus on two small regions with a 60-s repeat for storm activity that will be relevant to ﬂooding.
22,"other next generation geostationary satellites that cover other continents, include the meteosat third generation, which covers europe and africa, to be launched in 2019 and will be the ﬁrst of the next genera- tion up until 2038."
22,fengyun-4 is a series of satellites ﬁrst launched in 2016 operated by the china meteorological agency covering eastern asia and australasia.
22,himawari third generation is operated by the japanese meteorological agency to cover operational weather monitoring for the asia-paciﬁc region.
22,the jpss jpss is an upcoming polar-orbiting operational environmental satellite system jointly run by noaa and nasa.
22,"satellites will provide global coverage twice per day, and includes a range of sensors including the visible infrared imaging radiometer suite (viirs)."
22,the viirs multispectral instrument was ﬁrst launched in 2011 aboard the nasa/noaa suomi national polar-orbiting partnership satellite with the intention of bridging between modis and the operational joint polar satellite system (jpss).
22,viirs will be one of the instruments on the jpss.
22,"its large swath width (3,060 km) provides near-global coverage in 1 day."
22,the sensor measures in 22 bands in the vir spectra.
22,with a spatial resolution between 375 and 750 m depending on the band wavelength.
22,"viirs builds on avhrr and modis to provide daily time series of multispectral data with applications in energy and water balance, vegetation dynamics, land cover land use change, and the cryo- sphere."
22,"of relevance here are retrievals of lst and et, and vegetation parameters such as fpar, leaf water content, and lai, and snow cover products."
22,"for example, a global 400-m viirs-based et product is under development based on hain et al. (2017), beginning with regional data sets for the middle east/north africa, united states, and brazil."
22,"hyperspectral missions several hyperspectral imaging missions are planned or have been proposed, which can help improve retrie- vals of snow and vegetation properties, and deliver new water quality and soil property products, through continuous spectral sampling of the vnir and swir regions."
22,"nasa’s proposed hyspiri has an imaging spectrometer measuring from the vswir range in 10-nm contiguous bands and a multispectral imager measuring from 3 to 12 μm in the tir range at 60-m resolution at nadir and revisit of 19 and 5 days, respec- tively."
22,"this has a number of applications, including for snow retrievals, vegetation monitoring, and et (lee et al., 2015)."
22,other missions include the italian space agencies prisma demonstrator mission (stefano sheffield et al.
23,"water resources research 10.1029/2017wr022437 et al., 2013), which uniquely combines a hyperspectral imager (~250 bands, 400–2,500 nm, 30-m spatial resolution), and a panchromatic imager (5-m spatial resolution), that together can further enable retrievals relevant to water quality of inland waters."
23,"the german space agency enmap mission (guanter et al., 2015) is a hyperspectral imager in the spectral range of 420–2,450 nm, with bands of 10- to 40-nm width, at 30-m spatial resolution, with a revisit time of at least 4 days, with potential research applications in crop and forest monitoring, inland and coastal waterways, and soil science, among others."
23,"groundwater from grace-ii and nisar the grace follow-on (grace fo) mission launched in may 2018 and will provide continuation of the grace record, eventually bridging to the next generation grace-ii mission."
23,"grace fo is technologically similar to grace, using accurate measurements of the intersatellite range between two coplanar, low-altitude polar orbiting twin satellites using a k/ka-band microwave tracking system, and the continuation of radio occulta- tion measurements."
23,"grace-ii is expected to launch in 2020 and proposes a technology upgrade from the microwave interferometer to a laser (that will be tested on grace fo) to provide much higher spatial resolu- tion (~10,000 km2 compared to 500,000 km2 for grace and grace fo) and accuracy than the microwave instrument."
23,the pair of satellites will be ﬂown at a lower altitude with a drag free system.
23,"this will enable perhaps an order of magnitude improvement in spatial resolution, making grace ii directly applicable to a wider range of water resource characterization and management activities globally."
23,"the further use of sar sensors for estimating groundwater through the minute variations in surface topogra- phy will continue with planned missions such as the joint u.s.-indian nasa-isro synthetic aperture radar (nisar) polar-orbiting mission, due to launch in 2021."
23,this will carry a l-band sar and s-band sar and pro- vide meter-scale retrievals of land surface height that can indicate groundwater storage changes.
23,"swot the upcoming swot mission that is set to launch in 2021 will address many of the issues associated with the along-track retrievals of current altimeters by providing images of surface height using a ka-band radar inter- ferometer, for a 120-km swath for river reaches and water bodies that are 100 m or wider (biancamaria et al., 2015; pavelsky et al., 2014)."
23,"as well as surface water heights, it will also provide measurements of water level slopes and inundated areas, at a repeat interval of about 21 days, which will provide about two measure- ments for each point within that period."
23,"the biggest challenge for swot is the derivation of channel depths and discharge, and several methods have been tested based on various approaches from simple methods based on manning’s equation that would use river width and slope from swot, to more complex methods based on approximations of the 1-d saint venant equations that use swot observations of water surface elevation, width and slope to derive depth and discharge (durand et al., 2016)."
23,"all these methods rely on in situ data to estimate depth and ﬂow velocities limiting their universal application, particularly in ungauged regions."
23,"model assimilation approaches will undoubtedly be necessary because of the low temporal repeat of the retrievals and the need for continuous measurements of discharge (e.g., munier et al., 2015)."
23,"much work has been done in this area for current sensors with improvements in model predictions compared to in situ gauges in a variety of settings (e.g., paiva et al., 2013)."
23,nasa’s upcoming icesat-2 mission will complement swot; although it is focused on measuring ice sheets it will provide information for water body elevation.
23,"water cycle observation missions china has targeted the water cycle observation missions for a launch in 2020 (dong et al., 2016)."
23,"the system will measure a range of relevant variables including soil moisture, swe, freeze-thaw, and precipitation, using simultaneous measurements from active and passive microwave sensors for a range of frequencies."
23,"these are the imi fully polarized interferometric radiometer that will provide soil moisture (as well as ocean salinity); the dual-frequency polarized scatterometer for retrievals of swe and freeze/thaw; and 3 polarimetric microwave imager at 6.8–89 ghz that will resolve temperature, rainfall and water vapor."
23,"this approach is likely essential to help address the problems of leveraging from nonwater cycle focused missions with suboptimal frequen- cies, lack of supporting data, and independent retrievals for different variables."
23,"biomass biomass (esa, 2012b) is an esa planned satellite focused on quantifying forest biomass and height globally (tropical, temperate, and boreal), including disturbance and forest ﬂooding, with a launch date for 2020, and sheffield et al."
24,water resources research 10.1029/2017wr022437 expected mission of 5 years.
24,"it will carry a p-band sar, with a resolution of 50–60 m, although limited to global coverage every 25 days."
24,it also has applications to land and glacier topography.
24,this will be ﬁrst global p-band mission.
24,"challenges, opportunities, and outlook the wealth of information available from past and current satellite missions has enabled the routine evalua- tion and monitoring of hydrological variables that are being used for or have the potential for management of water resources and the impacts of hydrological hazards."
24,these do come with challenges that are intense topics of current research to understand how to improve retrievals and translate to applications.
24,"the gamut of newly launched and upcoming missions, from agencies, commercial enterprises, and the private sector, has the potential to transform this capability to address many of these challenges."
24,"at the same time, new challenges are emerging, particularly in how we handle the tremendous streams of data and interpret them for water resources applications."
24,"key challenges of relevance to wrm are discussed next, followed by ongoing research and emerging opportunities to address these challenges: 5.1."
24,challenges 5.1.1.
24,"validation and hydrological consistency remote sensing retrievals are most often developed using a retrieval model that brings with it errors due to uncertainties in how to represent the known physical processes and parameterize these, and due to unknown processes and feedbacks."
24,"validation of retrievals, and potentially calibration of the models, is there- fore vital."
24,"unfortunately, this is not done as comprehensively as one would like due to the lack of in situ data that the remote sensing retrieval attempts to supplement."
24,"individual retrievals are generally validated against in situ data that have a limited footprint or are region speciﬁc, and in isolation from other variables of the water balance (zhang, zhang, et al., 2017)."
24,"however, this often represents a disjoint picture from the applica- tion context, which may require data over large river basins, for multiple variables, in real time, and so on."
24,this is further complicated by the fact that remotely sensed variables have unique spatial and temporal character- istics that make it difﬁcult to use multiple variables in concert without some kind of downscaling or integra- tion.
24,"for example, estimating the water budget across a river basin from remote sensing could require integrating coarse scale estimates of total water storage from grace (~500 km, 30 day), precipitation from tmpa (25 km, 3-hourly), et from modis (1 km, once daily) and streamﬂow (single river reach, 15 day)."
24,"however, the limited assessment to date of the consistency among remotely sensed variables at scales rele- vant to wrm shows a range of errors across variables and nonclosure of the water budget when combined (e.g., armanios & fisher, 2014; azarderakhsh et al., 2011; gao et al., 2010; sahoo et al., 2011; shefﬁeld et al., 2009)."
24,"as an example, figure 9 shows the representation of the 2005 drought in the amazon basin for all components of the water budget and vegetation, based on a suite of satellite products and also compared to outputs from a land surface model."
24,"there are obvious resolution differences between, for example, the tmpa (0.25°) and the gpcp (1.0°) precipitation products, and between the grace retrieval of total water storage (~500 km) and the amsr-e-based surface soil moisture (40 km; as well as differences in the physical variable being represented), which ensure that direct comparisons are difﬁcult."
24,"however, the qualitative consistency among related products in representing drought conditions (e.g., less precipitation is consistent with less surface soil moisture and total water storage) is encouraging and physically reasonable (e.g., higher rnet in drought periods because of less precipitation and clouds, leads to positive et anomalies)."
24,"a range of opportunities exist to overcome the limitations, as discussed below, including integrating retrievals with in situ observations and observation-based analyses, or with modeling via assimilation."
24,5.1.2.
24,"resolution, continuity, and latency wrm applications generally require information at the catchment scale, which can vary from a few square kilometers to several hundred thousand."
24,"at the same time, information may be needed for subcatchments or gridded to be consistent with models and other data sets."
24,"for remote sensing retrievals based on tir sensors, this is not generally a problem, but for microwave based retrievals, such as for soil moisture, the resolution is too coarse (10s km) for most applications."
24,"downscaling of soil moisture data via merging with higher-resolution active microwave radar and tir imagery, via statistical models or via assimilation into physical models is therefore necessary (peng et al., 2017)."
24,sheffield et al.
25,water resources research 10.1029/2017wr022437 figure 9.
25,"multisensor view of the august–september 2005 amazon basin drought. (top row) anomalies or percentiles of precipitation from tmpa, gpcp, pgf (princeton global forcings, shefﬁeld et al., 2006; http://hydrology.princeton.edu/data.php, which is a blend of reanalysis and cru monthly data) and air tempera- ture from pgf. (middle row) anomalies or percentiles of grace total water storage, modeled 2-m soil moisture from the vic land surface model (forced by the pgf; http://hydrology.princeton.edu/data.php), amsr-e soil moisture (with account for vegetation optical depth), and vic top 10-cm soil moisture. (bottom row) anomalies or percentiles of avhrr ndvi, isccp-based et, vic et, and srb net radiation."
25,anomalies for august–september 2005 are calculated based on the monthly anomalies calculated for the time period of each data set.
25,percentiles are also based on monthly values estimated from the empirical cumulative density function over the same time period for each data set.
25,"conversely, the temporal repeat (and cloud interference) of tir retrievals hampers their use for daily scale decision-making or quantifying rapid changes, but these can be complemented by higher temporal repeat retrievals based on sensors on polar-orbiting satellites."
25,"this has been successfully used for precipitation retrievals, which leverage the accuracy of microwave retrievals and the higher resolution of tir retrievals."
25,"merging of soil moisture data is less well developed for applications, but progress has been in understanding the potential (peng & loew, 2017)."
25,"data record length and temporal consistency are also a challenge for wrm, which rely on long-term and homogeneous time series to identify extreme events and calculate risk, especially for planning and engineer- ing design."
25,"the use of remote sensing based data is therefore generally hampered by short mission lengths, and continuity issues for ongoing programs, for example, for landsat and for operational weather monitor- ing."
25,"similar constraints do also apply to in situ data, for which even several decades of data may not encom- pass the likely range of extremes that are possible (klein tank et al., 2009)."
25,"in addition to ongoing programs, efforts are under way to stitch together data from multiple sensors (e.g., the ecv soil moisture record, dorigo et al., 2017; the hirs-based lst record, siemann et al., 2016), but careful intersatellite calibration is necessary, which is not a trivial task."
25,latency refers to how near to real-time data are available.
25,"this is vital for some wrm applications, in particular for drought and ﬂood warning, and irrigation forecasting."
