page,p
1,water resources research review article satellite remote sensing for water resources management: 10.1029/2017wr022437 potential for supporting sustainable development in key points: • satellite remote sensing is being data-poor regions incorporated into water resources j.
1,"shefﬁeld1 , e."
1,"wood2 , m."
1,"pan2 , h."
1,"beck2 , g."
1,"coccia3 , a."
1,"serrat-capdevila4, management but is generally underutilized and k."
1,"verbist5 • new and proposed missions have the 1 potential to transform water geography and environment, university of southampton, southampton, uk, 2department of civil and environmental resources management for engineering, princeton university, princeton, nj, usa, 3risk engineering+design spa, pavia, italy, 4world bank, washington, sustainable development, especially dc, usa, 5unesco, paris, france in data-poor regions • ongoing challenges of accuracy, sampling, and continuity and capacity development need to be abstract water resources management (wrm) for sustainable development presents many challenges in addressed, as well as new challenges areas with sparse in situ monitoring networks."
1,the exponential growth of satellite based information over of information volume and diversity the past decade provides unprecedented opportunities to support and improve wrm.
1,"furthermore, traditional barriers to the access and usage of satellite data are lowering as technological innovations provide opportunities to manage and deliver this wealth of information to a wider audience."
1,"we review data correspondence to: needs for wrm and the role that satellite remote sensing can play to ﬁll gaps and enhance wrm, focusing on j."
1,"shefﬁeld, the latin american and caribbean as an example of a region with potential to further develop its resources justin.shefﬁeld@soton.ac.uk and mitigate the impacts of hydrological hazards."
1,"we review the state-of-the-art for relevant variables, current satellite missions, and products, how they are being used currently by national agencies across the citation: latin american and caribbean region, and the challenges to improving their utility."
1,"we discuss the potential shefﬁeld, j., wood, e."
1,"f., pan, m., beck, h., coccia, g., serrat-capdevila, a., & of recently launched, upcoming, and proposed missions that are likely to further enhance and transform verbist, k."
1,(2018).
1,satellite remote assessment and monitoring of water resources.
1,"ongoing challenges of accuracy, sampling, and continuity sensing for water resources still need to be addressed, and further challenges related to the massive amounts of new data need to be management: potential for supporting sustainable development in data-poor overcome to best leverage the utility of satellite based information for improving wrm. regions."
1,"water resources research, 54, 9724–9758. https://doi.org/10.1029/ 2017wr022437 1."
1,introduction received 20 dec 2017 accepted 15 oct 2018 water resources management (wrm) is a key global challenge.
1,"water is essential to life through drinking accepted article online 29 oct 2018 water and sanitation and is fundamental to the provision of food, energy, and health."
1,"extremes of the water published online 5 dec 2018 cycle (ﬂoods and droughts) can have tremendous impacts on all human activities, especially for vulnerable populations."
1,"water is therefore of central importance to development and has been recognized as one of the united nations (un) sustainable development goals (sdgs; un, 2015): sdg6 clean water and sanitation."
1,"addressing water challenges to the provision of clean water and protection from water hazards will help address many of the other sdgs, particularly for food security (sdg2: zero hunger), public health (sdg3: global health and well-being), and poverty alleviation (sdg1: no poverty; grey and sadoff, 2007)."
1,"since the early civilizations when water was ﬁrst managed for public beneﬁt, there has been a revolution in manage- ment from simple storage, diversions and abstractions to mega engineering projects for water transfer (e.g., china north-south transfer project) and reservoir storage (e.g., grand inga dam in the democratic republic of congo)."
1,"however, the equitable, efﬁcient and sustainable provision of water still poses considerable challenges."
1,"lack of water is a perennial problem, through low availability of water supply and poorly managed demand for water that combines to result in water scarcity (veldkamp et al., 2015)."
1,"water supply is primarily deﬁned by the mean and variability of precipitation, and its translation into available water through surface water sup- plies and aquifer recharge, but also on how we are able to store and sustainably manage reservoirs and aqui- ©2018."
1,the authors.
1,this is an open access article under the fers.
1,"dependency of communities and nations on single sources of water (e.g., from aquifers) and upstream terms of the creative commons rivers (with or without transboundary agreements) can easily lead to short-term crises and long-term unsus- attribution license, which permits use, tainable use (e.g., müllera et al., 2016; munia et al., 2016; weinthal et al., 2005), although conﬂict is rare (wolf distribution and reproduction in any medium, provided the original work is et al., 1998)."
1,"demand for water is also poorly understood and managed in many regions, in part because of properly cited. lack of effective governance and institutional structures capable to equitably and sustainably balance sheffield et al."
2,water resources research 10.1029/2017wr022437 competing needs with limited resources.
2,this is set in the context of ongoing and future projected changes in supply and demand that make addressing these challenges imperative.
2,"on the supply side, climate change is expected to lead to regional changes in water resources, including declines through decreased precipitation and increased evapotranspiration (et), especially in the subtropics, increases mainly from more precipitation, particularly in the tropics and high latitudes, and changes in seasonality, such as via earlier snowmelt linked to warming."
2,"at the same time, there is potential for increased variability in climate leading to more droughts (shefﬁeld & wood, 2008)."
2,"precipitation is expected to come in fewer but more intense storms and has the potential to increase ﬂood risk (hirabayashi et al., 2013)."
2,"on the demand side, population increase, rapid urba- nization, and increased demands from agriculture and energy production are expected to lead to challenges for water quality and allocation of resources (o’connell, 2017) that may outweigh the uncertain impacts of climate change."
2,achieving water security and increased resilience to hydrological extremes requires a good understanding of water resources dynamics at the basin scale.
2,"this knowledge and understanding can only be based on data and observations, and it is the foundation for managing water optimally and efﬁciently in economic and social terms, as well as with regard for environmental impacts and downstream users."
2,"in particular, informa- tion is needed on hydrological variables that constitute the hydrological cycle on land, how they vary over time and space, and how they manifest in extremes and therefore hazard risk (garcía et al., 2016; hering, 2014; walker, 2000)."
2,"this could be in the form of hazard monitoring and early warning to help communities prepare for potential and evolving impacts (pozzi et al., 2013; shefﬁeld et al., 2014; todini, 2017)."
2,"in the con- text of drought, information is needed on the state of water resources (e.g., surface water such as rivers, reser- voirs, and snowpack, and subsurface water: soil moisture and groundwater) as well as the related health of natural vegetation and crops."
2,"for ﬂoods, data on riverine ﬂows and inundated areas are required to assess impacts."
2,"for early warning, short-term and seasonal forecasts of hydrologic variables and potential agricul- tural impacts are also necessary to provide the lead time to enact measures to reduce impacts, and these forecasts need to be initialized and veriﬁed with observational data (shefﬁeld et al., 2014; tang et al., 2016; yuan et al., 2015)."
2,"at the same time, long-term, multisite time series (several decades) of relevant variables are required to estimate risk of ﬂood/drought hazards as inputs into resource utilization and design of infra- structure for reduction of the hazard itself and mitigation of impacts (e.g., serinaldi & kilsby, 2016)."
2,"in many regions, hydrometeorological and agricultural monitoring networks are often sparse and have large latency and so are impractical for real-time decision-making."
2,"in developing regions where the need for infor- mation is arguably greatest, the data collection infrastructure and human capacity to monitor and forecast hazards is generally low because of the decline in hydro-meteorological and agricultural monitoring net- works over the past 30 years (lorenz & kunstmann, 2012) and ongoing lack of investment in infrastructure and training (fay et al., 2017)."
2,"satellite remote sensing is increasingly being used as a complementary source of information to in situ mon- itoring networks and, in many cases, is the only feasible source."
2,"satellite-based sensors are now capable of making direct and indirect measurements of nearly all components of the hydrological cycle (lettenmaier et al., 2015; mccabe et al., 2017; y."
2,"zhang et al., 2016)."
2,"these include precipitation, evaporation, lake and river levels, surface water, soil moisture, snow, and total water storage (surface and subsurface water)."
2,"these sensors are therefore capable of providing critical information in support of managing water and monitoring the evolution of hazards and their impacts (van dijk & renzullo, 2011)."
2,"there is also a long legacy of remote sensing retrievals of the variation in vegetation state and thus plant productivity and health, with applications in agricultural monitoring and planning."
2,"the large coverage (up to global) of satellite data also enables the assessment of risk in the context of regional water security, food production, storage, and trade (e.g., dalin et al., 2017; jones et al., 2009)."
2,"although some of these satellite remote sensing products are in their infancy, and there are signiﬁcant limitations, challenges, and caveats in their use for wrm, the large spatial coverage and high temporal resolution (subdaily for geostationary and equatorial orbiting satellites) means that they can provide near-global information in near real time."
2,"this paper provides an overview of the current and potential future role of satellite remote sensing in improv- ing wrm, with a focus on examples for latin america and the caribbean (lac)."
2,"our discussion is applicable to other developing regions where improved wrm would help deliver the sdgs, but where this is hampered by lack of in situ data."
2,the paper is a contribution to activities by the inter-american development bank to sheffield et al.
3,water resources research 10.1029/2017wr022437 improve management and planning of water resources in the lac region.
3,the lac region includes a wide range of climatic and hydrologic regimes and is thus confronted with a broad range of management challenges and the need for an integrated approach to support wrm.
3,"the population is unevenly distributed and access to clean water and sanitation is inequitable, particularly in large urban areas."
3,"the lac met the millennium development goal for drinking water ahead of schedule, with 95% coverage by 2015."
3,"progress toward halving the number of people without access to basic sanitation was less successful, with access increasing from 67% in 1990 to 83% in 2015 (un, 2015)."
3,"projections for the sdg goal 6.1 of universal access to sanitation indicate that while about a quarter of countries are on track, several countries in the caribbean are projected to make no progress at all, and rates of progress have to increase by several times in many countries (nicolai et al., 2016)."
3,"improved water management also plays a crucial role in achieving many other sdgs, most directly for agricultural (sdg2) and energy production (sdg7), and hydrological hazards (sdg6 and sdg13), and also those related to poverty (sdg1), education (sdg4), and child mortality (sdg3), for example (inter-american development bank, 2005)."
3,"the continent is also playing a larger role in agricultural production and global food security, which requires careful water management to optimize trade-offs with environmental impacts (flachsbarth et al., 2015)."
3,"in turn, addressing other sdgs, such as inequality, will help achieve the water-related sdgs."
3,"the lac region represents a diverse set of contexts in terms of monitoring networks, information sharing, and capacity to manage resources (donoso & bosch, 2012), which is in part due to gaps and fragmentation in water governance across sectors and levels (akhmouch, 2012) and problems in developing and ﬁnancing infrastructure (fay et al., 2017)."
3,"the region represents diversity in how water policy is governed and resources are managed with a tendency overall to have decentralized governance, which is typical of more developed countries, and also a relatively larger role of central government."
3,"however, the region would beneﬁt from greater intersectoral coordination, capacity building, and governance across levels that is ﬂexible and espe- cially targeted at the poor (akhmouch, 2012)."
3,"furthermore, climate change has the potential to exacerbate water resources challenges and natural disaster impact mitigation, with expected regional changes in avail- able water, particularly through impacts on glaciers and seasonal snow, and increases in ﬂoods and drought severity and frequency (reyer et al., 2017)."
3,"the exponential growth of satellite-based information over the past decade, through increased numbers of satellites launched with ever increasing resolution, and multiple derived products, provides unprecedented opportunities to support and improve wrm in the lac region and worldwide."
3,"furthermore, traditional barriers to the access and usage of satellite data are lowering as technological innovations provide opportu- nities to manage and deliver this wealth of information to a wider audience."
3,"nevertheless, ongoing chal- lenges of accuracy, sampling and continuity still need to be addressed, and new challenges are presented by this wealth of new data that need to be overcome to best leverage the utility of satellite based information for improving wrm."
3,"here we review data needs for wrm and the role of remote sensing (rs), particularly in regions of sparse in situ data (section 2)."
3,"in section 3 we review the state-of-the-art for relevant variables, current satellite missions and products, and the challenges to improving their utility."
3,an overview of current use of rs in the lac region for decision-making is also provided.
3,"we discuss upcoming and proposed missions in section 4, and the opportunities and challenges of rs for wrm in section 5."
3,"data needs for wrm wrm entails the efﬁcient and sustainable use of water resources for beneﬁcial use and environmental protec- tion (loucks, 2009)."
3,"in practice, this covers a range of activities from operational management of existing resources, development of new resources, and planning and design of associated infrastructure, as well as early warning of hydrological hazards and management and reduction of risks."
3,"to this end, information on resources and hazard risk is essential."
3,"wrm also includes issues related to administration and governance, although these are not discussed here."
3,"there are a range of wrm decisions that beneﬁt from hydrometeorological information, as well as land cover and use."
3,"these include land management and water allocation at the basin scale for an array of interrelated sectors (agriculture, ecosystems, forest management, energy production, water supply, etc.); environmental management and protection; the design and operation of water infrastructure for hydropower, ﬂood control, drought preparedness and mitigation, irrigation, water supply, and wastewater treatment; management of sheffield et al."
4,"water resources research 10.1029/2017wr022437 table 1 summary of wrm decisions, the data products required to make these decisions, and the traditional sources of such data (based on garcía et al., 2016) water-related data products used water resources management decision to make decision traditional data sources planning and design design of ﬂood control (design of ﬂood long-term records (decades) of precipitation rain gauge networks; stream gauge networks; storage, routing, and alleviation) and streamﬂow; long-term records of swe in snow courses and pillows cold regions design of hydropower systems (for reliable long-term records (decades) of streamﬂow; rain gauge networks; stream gauge networks; power production given available resources) long-term records of swe in cold regions snow courses and pillows design of irrigation systems (including long-term records (decades) of precipitation, rain gauge networks; stream gauge networks; extraction and distribution and water use) streamﬂow and groundwater."
4,"estimates of wells, piezometers; meteorological networks crop water use design of wastewater treatment systems records of feed sources such as streamﬂow stream gauge networks; wells, piezometers (capture, treatment, reuse, and release) and groundwater design of water supply systems (for effcient records of precipitation, streamﬂow, and rain gauge networks; stream gauge networks; supply of desired quality water) groundwater wells, piezometers transboundary water agreements (to long-term (decades) streamﬂow and stream gauge networks; wells, piezometers understand use and needs and to design groundwater records; water use records agreements and management strategies) management and operations water resources management (to satisfy real-time precipitation, evapotranspiration, rain gauge networks; eddy-covariance towers; water demand given supply) streamﬂow, and groundwater stream gauge networks; wells, piezometers water supply operations (to ensure reliable real-time precipitation, evapotranspiration, rain gauge networks; eddy-covariance towers; water supply) and groundwater stream gauge networks; wells, piezometers hydropower operations (maximize power real-time precipitation, evaporation, streamﬂow, rain gauges; stream gauges; meteorological production under other constraints) precipitation forecasts stations; weather forecasts flood control operations (reservoir real-time precipitation, streamﬂow and snow rain gauges; stream gauges; snow courses and operation to regulate and dampen ﬂoods) water equivalent, precipitation forecasts snow pillows; weather forecasts wastewater management (efﬁcient treatment, real-time streamﬂow and groundwater data stream gauges; wells, piezometers reuse, and disposal) irrigation systems operation (efﬁcient real-time precipitation, streamﬂow, groundwater, rain gauge networks; stream gauge networks; extraction and distribution of water to meet and soil moisture."
4,"estimates of evapotranspiration wells, piezometers; soil moisture probes; crop water needs) eddy-covariance towers; meteorological stations ecosystem management (to maintain recent data on precipitation, streamﬂow, water rain gauges; stream gauges; stage gauges; water ecosystem services) levels, soil moisture, water quality quality sampling disaster management crop monitoring and food security (monitor real-time vegetation characteristics, crop water field crop sampling; eddy-covariance towers; food production and availability; early needs, soil moisture, precipitation forecasts meteorological stations; soil moisture probes; warning of food insecurity and famine) weather forecasts drought early warning and management real-time precipitation, soil moisture, streamﬂow, rain gauges; soil moisture probes; stream gauges; (mitigate risk and manage impacts) groundwater, precipitation forecasts wells, piezometers; weather forecasts flood early warning and management real-time precipitation, streamﬂow, precipitation rain gauges; stream gauges; weather forecasts (mitigate risk and manage impacts) forecasts water-related health (monitoring and real-time precipitation, surface water, water quality rain gauges; stream gauges; stage gauges; water managing water quality, pollution, parameters quality sampling disease vectors) water for agriculture, energy production, industry, forest and range management, and health applications; hydrological disaster risk management and reduction; and broader issues related to water resources development, planning policy, and governance (garcía et al., 2016)."
4,"table 1 provides a summary of the main wrm decisions, the types of variables required, and how these are obtained traditionally."
4,"in addition, there are many other decisions that require information on water related variables, such as land use planning and environmental planning and management that are not covered here."
4,"the main variables considered here as useful for wrm are precipitation, et, vegetation indices, streamﬂow, soil moisture, groundwater (including recharge and levels), snow (extent and snow water equivalence, swe), soil ice, and water quality."
4,"supporting meteorological information (temperature, wind speed, surface radiation, etc.) and physiographic information (land cover change, topography [elevation and aspect], soils, sheffield et al."
5,water resources research 10.1029/2017wr022437 figure 1.
5,"distribution of record start year, end year, and total number of years for (a) precipitation from the integrated surface database (isd) database and (b) streamﬂow from the global runoff data centre (grdc) database."
5,"the isd (smith et al., 2011) consists of global hourly and synoptic observations from over 35,000 stations worldwide."
5,"the grdc (2018) is an international archive of river discharge data for more than 9,500 stations in 160 countries. etc.) are also useful or essential."
5,knowledge of these variables enables an understanding of the hydrological cycle over a region and how it interacts with different uses and sectors.
5,"in particular, it is important to quantify existing water resources in relation to current demand and sustainable development of resources in the context of future demand, where demand also includes the needs of other sectors, in particular natural ecosystems."
5,"for example, groundwater is an essential resource in many regions, to enable development or gain resilience by diversifying sources."
5,"however, knowledge of the sustainability of these resources is often lacking but is imperative if they are to be beneﬁcial to current and future generations."
5,"each of these variables plays a role in the terrestrial hydrological cycle either as a driver (e.g., precipitation), a feedback (e.g., et), or a state (e.g., soil moisture and snow) that also acts as a mediator of the various ﬂuxes (e.g., soil moisture controls on et)."
5,"the connectivity between these variables and propagation of anomalies through the hydrological system (e.g., the propagation of drought) is one of its key features that has implications for how resources are managed within river basins, implying that management based on individual variables is unlikely to be optimal."
5,"the wealth of in situ observations in some parts of the world is sometimes sufﬁcient to manage and plan water resources; for example, in the united states the extensive (in time and space) network of river gauging stations in some regions is generally sufﬁcient to quantify renewable resources based on surface water, but the lack of in situ information on et or snowpack means that upstream changes in resources, land cover/use, sheffield et al."
6,water resources research 10.1029/2017wr022437 and management cannot be evaluated.
6,"less developed regions tend to have less dense in situ measurement networks that do not provide ade- quate coverage of even the most essential variables such as precipitation, and this can be a barrier to successful water management."
6,"figure 1 shows the distribution of precipitation and streamﬂow gauges in the lac region that are currently available from global data centers that accumulate sub- sets of national databases, and highlights regions with very few gauges, particularly for streamﬂow."
6,"some of these gauges are reporting in real time via national or global teleconnection networks, most are not; and many only have data up to several years to decades ago, making it difﬁcult to accurately quantify water resources and extreme event risk."
6,"figure 2 shows the available data record for central chile, indicating that national networks may have dense historical gauge networks, relative to what is available in global data centers, but often with many caveats to their use for wrm (older stations, not reporting in real time, data in paper form, accumulated values, difﬁcult to access and use)."
6,"table 2 summarizes the variables required for wrm, and their various sources (in situ, rs, models)."
6,we also include the characteristics of typical networks and how this enables or constrains different wrm activities.
6,"of key importance is the temporal availability of data: either long-term time series for risk assessment, design and planning, or real-time data for opera- tions and early warning of hazards."
6,"often in situ data are inaccessible for logistical, political, or security reasons, or not available in real time."
