page,p
25,"for example, gpm imerg products are provided at latencies of a few hours, with potential to access some subproducts within 30 min, which is approaching real-time monitoring."
25,"the latency of other products can be longer, due to temporal repeat and cloud sheffield et al."
26,"water resources research 10.1029/2017wr022437 cover, or by design."
26,providing data in near real time is also a challenge to the supporting computational and network infrastructure (section 5.2.4).
26,5.1.3.
26,"adaptation to applications key to the uptake of rs to support wrm is the adaptation of remote sensing products to planning, design, and operational activities."
26,"there are many technical and human barriers to translating research products into retrospective products that can be used for design and planning, or operational products that can be used for day-to-day management and early warning, as discussed above."
26,"this depends greatly on user needs in terms of the spatial and temporal consistency, accuracy, latency, and so on, as well as the technical capacity of the user."
26,"for example, informal surveys by the authors with agency staff from several lac and african countries carried out during training workshops on the use of rs and models for drought monitoring, indicate that accuracy, timeliness, and spatial representativeness of information are key requirements to help improve wrm in their region."
26,"this is echoed by others (e.g., schaeffer et al., 2013) that indicate that cost, accuracy, con- tinuity, and agency approval for using rs were the key concerns for water managers when using rs-based water information."
26,"cost issues may be related to previous experience with rs imagery; for example, landsat data were previously charged for by the u.s."
26,geological survey.
26,"in terms of accuracy, quantitative error estimates are required for uptake, and users are most interested in site-speciﬁc evaluations that are not always available."
26,evaluations need to take into account in situ measurement errors and scale mismatches between in situ and rs data.
26,"at the same time, users also need to identify their accuracy requirements to rs providers."
26,"concerns about continuity are often cited because of worries that products will not be available in the future, and therefore efforts are needed by rs agencies to ensure that continuity is provided including standardizing retrieval methods, data formats and access, and providing intersatellite calibration."
26,"continuity also relates to challenges in transitioning to using different data sources that may conﬂict with existing wrm methods and practices that are based on traditional, in situ measurements."
26,"successful implementation of locally tailored applications often suffers from several bottlenecks in local end- user agencies: lack of sufﬁcient human and technical capacity, lack of a stable environment to ensure conti- nuity, maintenance and updating, lack of funding, poor internet connection, and others."
26,"lack of capacity and human resources is identiﬁed as a key constraint to the uptake of rs information (world bank group, 2018)."
26,"there is a need for training in methodologies, software, and databases, and backing from agency manage- ment is vital to provide the education, training and support."
26,"as rs information becomes more complex, espe- cially for the uptake of more recent research products that do not have a long legacy of provision to a wide variety of users, training in speciﬁc software and methodologies is required, and this should be focused on wrm applications rather than generic rs techniques."
26,"on the other hand, rs agencies should provide pro- ducts that are ready for analysis, in standardized formats."
26,the use of user friendly platforms such as the lacfdm and the use of cloud computing services can remove much of this overhead (see later).
26,"however, this raises questions about the sustainability of products and data platforms, in particular who should fund them, who decides what is done, and for whom?"
26,"overall, effective dialog is needed between scientists who produce, evaluate, and apply rs information, and managers and stakeholders who use this information to make decisions."
26,"often there is a disconnect between research carried out in academic institutions and management agencies, even within the same country."
26,"this is because water management is site speciﬁc and is mediated by the behavior or local actors and institutions, and many applications will need to be locally customized (adapted, calibrated, validated with ground data, etc.) to address the local needs of management."
26,stronger partnerships between agencies and identiﬁed aca- demic institutions are needed.
26,application scientists should continue to understand user needs; stakeholder involvement and codevelopment of products is not always feasible but should be done where possible.
26,"transparency in rs methodologies, and even transition to standardized approaches so that users can readily understand how products are developed is also required."
26,opportunities 5.2.1.
26,integration with in situ data and modeling integration with in situ data and hydrological models is perhaps the most promising way to leverage remote sensing data for wrm.
26,"for example, assimilation of soil moisture data into hydrological models can improve predictions of soil-column water, et, and streamﬂow (brocca et al., 2012; chen et al., 2011; ridler et al., 2014)."
26,the use of remote sensing-based actual et estimations to constrain hydrological models can also signiﬁcantly sheffield et al.
27,"water resources research 10.1029/2017wr022437 improve simulations (roy et al., 2017)."
27,"assimilation of snow covered area and swe into models has a long legacy and is being used to forecast seasonal water availability for systems that rely on seasonal snowpack for water supply (e.g., western united states)."
27,"integration of in situ data from meteorological networks can be used to improve satellite based gridded products (chaney et al., 2014)."
27,"bias correction of satellite-based precipitation with just a handful of gauges can signiﬁcantly improve hydrological predictions (serrat- capdevilla et al., 2014)."
27,"where national networks are less prevalent, low-cost sensors (e.g., buytaert et al., 2014) and even nontraditional data networks (e.g., eilander et al., 2016) can also provide data for correcting and updating retrievals."
27,"one promising approach is to use the water budget to enforce closure by distributing errors across individual water budget components based on their errors (e.g., pan et al., 2012; zhang, pan, et al., 2017)."
27,"these approaches do require an estimate of errors of individual products, but comparison with competing and alter- native products (e.g., from remote sensing, modeling and gridded observational analyses) through methods such as triple colocation (e.g., anderson, zaitchik, et al., 2012) can provide a ﬁrst-order approximation."
27,5.2.2.
27,"forecasting and early warning hydrological forecasts can play an important role in early warning of hazards, complementing hydrological monitoring based on remote sensing, and in turn being initialized by land surface states based on remote sensing."
27,"climate forecasts have advanced in terms of skill and resolution over past decades such that they can provide some predictability in regions that have strong teleconnections with ocean temperatures, and at spatial resolutions (order of 1–10 km) required for decision-making."
27,"for example, forecasts of el niño– southern oscillation from dynamical climate models are now outperforming statistical forecasts (barnston et al., 2012), and with potential for skillful forecasts of regional climate in the tropics and subtropics (e.g., kumar et al., 2013)."
27,"in midlatitudes, skillful forecasts are more elusive because of the high variability of weather systems, but longer-lead forecasts for temperature at least are emerging (e.g., mckinnon et al., 2016; scaife et al., 2014)."
27,remote sensing can play a direct role in enhancing hydrological predictions via updating of initial conditions.
27,"data needed to initialize forecast models (e.g., soil moisture, snow, and river levels/discharge) can be derived from remote sensing and many studies have shown the beneﬁts of updating hydrological forecasts (hirpa et al., 2013; lü et al., 2016) particularly increasing predictability in snow- dominated and dry regions of the world (shukla et al., 2013)."
27,"several experimental, operational systems that provide satellite-based monitoring and initialization of hydrological forecasts include the lacfdm (2017), african flood and drought monitor (shefﬁeld et al., 2014), and the european flood alert system (thielen et al., 2009)."
27,5.2.3.
27,"commercial satellites an increasingly important source of remote sensing information is from the commercial sector, in particular constellations that can overcome the trade-offs between resolution and repeat interval (mccabe et al., 2017)."
27,notable recent and upcoming missions include the following: 1.
27,"planet labs launched demonstration cubesats (miniaturized satellites) called doves in 2013 and subse- quently launched several flocks of dove that provides global optical imagery coverage at 5-m resolution, including 88 doves in one launch in 2017."
27,"the urthedaily constellation is a constellation of eight satellites providing global coverage that provides multispectral imagery at 5-m resolution, daily (10:30 a.m.)."
27,the expected launch is 2018.
27,"optisar is a proposed constellation of eight pairs of satellites, one carrying an optical imager and video (50-cm resolution) and the other a sar providing 1-m x-band and 5-m l-band images."
27,"this combination will have global at least once daily coverage, with day/night retrievals in the presence of clouds."
27,the com- bination of optical and sar allows for the calibration of the sar based on the optical images.
27,the constel- lation is proposed for operations as early as 2020.
27,pangeo alliance.
27,"of interest is the provision of combined access to various sensors via the pangeo alliance that currently brings together eight earth observation operators to provide multispectral imagery and high-resolution video, globally and daily."
27,table 4 lists the sensors in the alliance and their characteristics.
27,5.2.4.
27,analytical platforms and data services one of the biggest challenges is the provision of services to access and utilize the voluminous amounts and rapid ﬂow of information being generated by current and planned missions.
27,"for example, the sentinel-1 satellite delivers approximately 1 tb of raw data each day, which translates into 10 pb (1016 bytes) over the expected lifetime of the mission (wagner et al., 2009)."
27,when the derived data sets for various sheffield et al.
28,"water resources research 10.1029/2017wr022437 table 4 characteristics of current and planned sensors within the pangeo alliance (http://www.pangeo-alliance.com/) sensor country sensor type spatial resolution spectral bands swath width launch date deimos 1 spain optical mr 20 m 3 650 km 2009 landmapper bc united states optical mr 20 m 3 220 km 2016 kazstsat kazhakstan optical mr 18 m 6 300 km 2017 theia canada optical mr 5m 4 50 km 2013 kazeosat 2 kazhakstan optical mr 5m 5 77 km 2014 landmapper hd united states optical hr 2.5 m 5 25 km 2017 dubaitsat 1 uae optical hr 2.5 m pan +4 20 km 2009 th-1 china optical hr 2m pan +4 60 km 2010, 2012, 2015 deimos 2 spain optical vhr 75 cm pan +4 12 km 2014 dubaitsat 2 uae optical vhr 1.0 m pan +4 12 km 2013 khalifasat uae optical vhr 70 cm pan +4 16 km 2018 kazeosat 1 kazhakstan optical vhr 1.0 m pan +4 20 km 2014 teleos 1 singapore optical vhr 1.0 m pan 12 km 2015 iris canada video 4 k 1.0 m 3 (rgb) 6 × 4km 2013 applications (hydrological, water resources, agriculture, health, etc.) are added, this number will increase further, which becomes a logistical and computational challenge likely beyond any single data facility."
28,"another example is the landsat program, which now represents an almost 40-year record and over a pb of data."
28,"nasa facilities process over 5 tb of data per day and the nasa earth observing system data and information system holds over 7.5 pb (as of 2015) of satellite data across connected data centers (sugumaran et al., 2015)."
28,"this ﬂood of big data poses many challenges in how we collect, manage, store, archive, analyze, visualize, and distribute it (sugumaran et al., 2015)."
28,"high-performance computing that encompasses the concepts of supercomputing, cluster computing, and distributed/grid computing, is required to meet these challenges, yet traditional facilities at research institu- tions and government agencies are out of the reach of the majority of users, despite large strides in the pro- vision of data management and visualization tools by large data centers."
28,new approaches are therefore needed that draw from the power of parallel computing but that are affordable and accessible.
28,"the solution is likely to be cloud computing services that provide “ubiquitous, convenient, on-demand network access to a shared pool of conﬁgurable computing resources” (horak et al., 2008; mell & grance, 2011)."
28,cloud computing also encompasses the concepts of distributed and grid computing but refers more generally to resources that are scalable and available on demand.
28,cloud computing also allows sharing of data and code that has impor- tant implications for knowledge transfer and capacity building.
28,"some examples of commercial pay-as-you-go cloud computing services are amazon’s elastic compute cloud (ec2) that is accessible via amazon web services, google’s cloud platform, and microsoft’s azure, which variously provide access to the computing infrastructure (e.g., virtual machines such as google’s compute engine) that requires the user to install, conﬁgure, and run their own processing software, or computing platforms that abstract the software and ﬁle system from the operating system (e.g., apache’s hadoop), or software platforms that abstract into a single software application (e.g., google earth engine)."
28,"the scalability and on-demand nature of these resources, coupled with relatively low cost, are key beneﬁts."
28,"in particular, the abstraction of the hardware and operating/ﬁle system is key to enabling users to access the vast quantities of remote sensing information."
28,"these platforms are increasingly being leveraged for analyzing satellite imagery and more recently for wrm applications, such as the climate engine that uses google earth engine for drought monitoring and other natural resources management applications (huntington et al., 2017)."
28,"despite the provision of reliable, and scalable access to distributed computer power, the overhead of training users should not be underestimated, especially for applications that are not straightforward parallel proces- sing of subsets of satellite imagery."
28,"outlook satellite remote sensing is now able to provide near-real-time retrievals of nearly all components of the terrestrial water cycle, albeit with many challenges including those related to accuracy, consistency, continuity, and utility."
28,although much work is needed to enable and improve approaches for retrieving sheffield et al.
29,"water resources research 10.1029/2017wr022437 groundwater, water quality, surface water levels, and river ﬂows, most of these retrievals are also global in coverage, and at the spatial, temporal, and spectral resolutions to resolve hydrological processes and their interaction with human activities."
29,they are therefore well poised to provide information for wrm for opera- tional and tactical decision-making.
29,"in particular, satellites can provide information in regions where in situ data are scarce, unreliable, or unavailable as a real-time information source."
29,these opportunities should be leveraged to also support disaster risk management and reduction.
29,"remote sensing products are progres- sively being integrated in national monitoring and early warning systems at the national and regional level, as the examples show in section 3 for the lac region."
29,"to fully realize the potential, however, requires an understanding of the multiple, independent, complemen- tary, and competing data products, and their utility for a range of diverse management applications, includ- ing ﬂood/drought risk assessment and the monitoring of water availability."
29,"speciﬁcally, capacity needs to be built to work with satellite data and translate it into information that can inform the decision-making pro- cess."
29,"this, in turn, requires continuing and building on existing training programs and initiatives (e.g., unesco international hydrology programme capacity development initiatives; nasa servir, arset, and develop programs; esa tiger initiative) to translate the often complex satellite data into formats and data delivery platforms that are easy to use for a range of users."
29,"furthermore, a large gap remains between the availability of these products, and their uptake for decision-making."
29,"therefore, an opportunity remains to engage more actively with the national stakeholders to strengthen capacities to use these remote sensing products, especially in data scarce regions, in order to build solutions and capabilities for monitoring and early warning applications of natural hazards in support of effective disaster risk reduction policies at the national level."
29,"to this effect, and to keep up with this fast-evolving ﬁeld, the role of knowledge networks linking government agencies, universities and research centers, and international development organiza- tions is essential."
29,acknowledgments references this work was supported by the inter- american development bank (idb) and agritiempo (2018).
29,"brazil agrometeorological monitoring system. http://www.agritempo.gov.br/agritempo/index.jsp uk research and innovation as part of akhmouch, a."
29,(2012).
29,"water governance in latin america and the caribbean: a multi-level approach, oecd regional development working the global challenges research fund, papers, 2012/04, ()."
29,oecd publishing. https://doi.org/10.1787/5k9crzqk3ttj-en grant number ne/p021093/1.
29,"the data anderson, m."
29,"c., allen, r."
29,"g., morse, a., & kustas, w."
29,(2012).
29,"use of landsat thermal imagery in monitoring evapotranspiration and used are listed in the references, tables, managing water resources."
29,"remote sensing of environment, 122, 50–65. and ﬁgure captions."
29,"anderson, m."
29,"c., hain, c."
29,"r., wardlow, b., mecikalski, j."
29,"r., & kustas, w."
29,(2011).
29,evaluation of a drought index based on thermal remote sensing of evapotranspiration over the continental u.s.
29,"journal of climate, 24(8), 2025–2044. https://doi.org/10.1175/ 2010jcli3812.1 anderson, m."
29,"c., norman, j."
29,"m., mecikalski, j."
29,"r., otkin, j."
29,"a., & kustas, w."
29,(2007).
29,a climatological study of evapotranspiration and moisture stress across the continental u.s. based on thermal remote sensing: 1.
29,model formulation.
29,"journal of geophysical research, 112, d10117. https://doi.org/10110.11029/12006jd007506 anderson, w."
29,"b., zaitchik, b."
29,"f., hain, c."
29,"r., anderson, m."
29,"c., yilmaz, m."
29,"t., mecikalski, j., & schultz, l."
29,(2012).
29,towards an integrated soil moisture drought monitor for east africa.
29,"hydrology and earth system sciences, 16, 2893–2913."
29,"andrew, r."
29,"a., guan, h., & batelaan, o."
29,(2017).
29,estimation of grace water storage components by temporal decomposition.
29,"journal of hydrology, 552, 341–350."
29,"aonashi, k., awaka, j., hirose, m., kozu, t., kubota, t., liu, g., et al."
29,(2009).
29,gsmap passive microwave precipitation retrievals: algorithm description and validation.
29,"journal of applied meteorology, 87a, 119–136."
29,"armanios, d."
29,"e., & fisher, j."
29,(2014).
29,"measuring water availability with limited ground data: assessing the feasibility of an entirely remote- sensing-based hydrologic budget of the ruﬁji basin, tanzania, using trmm, grace, modis, srb, and airs."
29,"hydrological processes, 28(3), 853–867. https://doi.org/10.1002/hyp.9611 azarderakhsh, m., rossow, w."
29,"b., papa, f., norouzi, h., & khanbilvardi, r."
29,(2011).
29,diagnosing water variations within the amazon basin using satellite data.
29,"journal of geophysical research, 116, d24107. https://doi.org/10.1029/2011jd015997 barnes, j."
29,"c., & bowley, c."
29,(1968).
29,snow cover distribution as mapped from satellite photography.
29,"water resources research, 4, 257–272. https://doi.org/10.1029/wr004i002p00257 barnett, t."
29,"p., adam, j."
29,"c., & lettenmaier, d."
29,(2005).
29,potential impacts of a warming climate on water availability in snow-dominated regions.
29,"nature, 438(7066), 303–309."
29,"barnston, a."
29,"g., tippett, m."
29,"k., l’heureux, m."
29,"l., li, s., & dewitt, d."
29,(2012).
29,skill of real- time seasonal enso model predictions during 2002 to 2011: is our capability increasing?
29,"bulletin of the american meteorological society, 93, 631–651."
29,"beck, h."
29,"e., van dijk, a."
29,"m., levizzani, v., schellekens, j., miralles, d."
29,"g., martens, b., & de roo, a."
29,(2016).
29,"mswep: 3-hourly 0.25° global gridded precipitation (1979–2015) by merging gauge, satellite, and reanalysis data."
29,"hydrology and earth system sciences, 21, 589–615."
29,"beck, h."
29,"e., vergopolan, n., pan, m., levizzani, v., van dijk, a."
29,"m., weedon, g., et al."
29,(2017).
29,global-scale evaluation of 23 precipitation datasets using gauge observations and hydrological modeling.
29,"hydrology and earth system sciences discussions. https://doi.org/10.5194/ hess-2017-508 berry, p."
29,"m., garlick, j."
29,"d., freeman, j."
29,"a., mathers, e."
29,"l., (2005)."
29,global inland water monitoring from multi-mission altimetry.
29,"geophysical research letters, 32, l16401. https://doi.org/10.1029/2005gl022814 biancamaria, s., hossain, f., & lettenmaier, d."
29,(2011).
29,forecasting transboundary river water elevations from space.
29,"geophysical research letters, 38, l11401. https://doi.org/10.1029/2011gl047290 sheffield et al."
30,"water resources research 10.1029/2017wr022437 biancamaria, s., lettenmaier, d."
30,"p., & pavelsky, t."
30,(2015).
30,the swot mission and its capabilities for land hydrology.
30,"surveys in geophysics, 37(2), 307–337. https://doi.org/10.1007/s10712-015-9346-y birkett, c."
30,(1994).
30,radar altimetry—a new concept in monitoring global lake level changes.
30,"eos transactions american geophysical union, 75(24), 273–275. https://doi.org/10.1029/94eo00944 brocca, l., moramarco, t., melone, f., wagner, w., member, s., hasenauer, s., & hahn, s."
30,(2012).
30,assimilation of surface- and root-zone ascat soil moisture products into rainfall–runoff modeling.
30,"ieee transactions on geoscience and remote sensing, 50, 2542–2555."
30,"brodzik, m."
30,j. and r.
30,armstrong (2013).
30,"northern hemisphere ease-grid 2.0 weekly snow cover and sea ice extent, version 4."
30,[indicate subset used].
30,"boulder, colorado usa."
30,"nasa national snow and ice data center distributed active archive center. https://doi.org/10.5067/ p7o0hgjlyuqu buytaert, w., zulkaﬂi, z., grainger, s., acosta, l., alemie, t."
30,"c., bastiaensen, j., et al."
30,(2014).
30,"citizen science in hydrology and water resources: opportunities for knowledge generation, ecosystem service management, and sustainable development."
30,"frontiers in earth science, 2(26), 1–21."
30,"cammalleri, c., anderson, m."
30,"c., gao, f., hain, c."
30,"r., & kustas, w."
30,(2013).
30,a data fusion approach for mapping daily evapotranspiration at ﬁeld scale.
30,"water resources research, 49, 4672–4686. https://doi.org/10.1002/wrcr.20349 chaney, n."
30,"w., shefﬁeld, j., villarini, g., & wood, e."
30,(2014).
30,development of a high-resolution gridded daily meteorological dataset over sub-saharan africa: spatial analysis of trends in climate extremes.
30,"journal of climate, 27, 5815–5835."
30,"chen, f., crow, w."
30,"t., starks, p."
30,"j., & moriasi, d."
30,(2011).
30,improving hydrologic predictions of a catchment model via assimilation of surface soil moisture.
30,"advances in water resources, 34, 526–536. https://doi.org/10.1016/j.advwatres.2011.01.011 chile national agroclimatic observatory (2018). http://www.climatedatalibrary.cl/imp-dgir/maproom/ clevers, j."
30,"w., & gitelson, a."
30,(2013).
30,remote estimation of crop and grass chlorophyll and nitrogen content using red-edge bands on sentinel-2 and -3.
30,"international journal of applied earth observation and geoinformation, 23, 344–351."
30,"crow, w."
30,"t., berg, a."
30,"a., cosh, m."
30,"h., loew, a., mohanty, b."
30,"p., panciera, r., et al."
30,(2012).
30,upscaling sparse ground-based soil moisture obser- vations for the validation of coarse-resolution satellite soil moisture products.
30,"reviews of geophysics, 50, rg2002. https://doi.org/10.1029/ 2011rg000372 dalin, c., wada, y., kastner, t., & puma, m."
30,(2017).
30,groundwater depletion embedded in international food trade.
30,"nature, 543, 700–704."
30,"dee, d."
30,"p., uppala, s."
30,"m., simmons, a."
30,"j., berrisford, p., poli, p., kobayashi, s., et al."
30,(2011).
30,the era-interim reanalysis: conﬁguration and performance of the data assimilation system.
30,"quarterly journal of the royal meteorological society, 137, 553–597. https://doi.org/10.1002/ qj.828 demaria, e."
30,"m., & serrat-capdevila, a."
30,(2016).
30,part iii: validation of remote sensing estimated meteorological variables.
30,"garcía, d."
