page,p
1,"agris on-line papers in economics and informatics volume xiv number 1, 2022 the role of remote sensing in agriculture and future vision václav šafář1, karel charvát1, tomáš mildorf2, patrick crehan2, david kolitzus3, tomas orlickas4, martynas rimgaila4, aušrius kučinskas4, salomėja rybokienė4, šárka horáková1 and hana kubíčková2 1 wirelessinfo, litovel, czech republic 2 plan4all z.s., horní bříza, czech republic 3 geoville information systems and data processing gmbh, innsbruck, austria 4 nacionalinė mokėjimo agentūra, vilnius, lithuania abstract the sustainability of agriculture became one of the key priorities for policy frameworks at global and european levels."
1,the global initiative of the united nations that defined the sustainable development goals and the european green deal.
1,use of remote sensing to achieve sustainable practices in the entire agriculture value chain can significantly contribute to fulfil the set goals by the policy frameworks.
1,"this paper analyses the stakeholders involved in agriculture including the agri-food, public, financial and food security sectors, and their needs."
1,in situ and virtual workshops with relevant stakeholders including an online survey served as a primary source of input for the user requirements analysis and as a platform for feedback and discussion.
1,"as a result, a set of key documents including a white paper, a policy roadmap and a strategic research agenda were published."
1,recommendations for future utilisation of remote sensing in agriculture are described in this paper.
1,"keywords earth observation, agriculture, white paper, strategic research agenda, policy roadmap, technology watch, hackathon, webinars, questionnaires."
1,"šafář, v., charvát, m., mildorf, t., crehan, p., kolitzus, d., orlickas, t., rimgaila, m., kučinskas, a., rybokienė, s., horáková, š. and kubíčková, h."
1,"(2022) ""the role of remote sensing in agriculture and future vision"", agris on-line papers in economics and informatics, vol."
1,"14, no. 1, pp."
1,107-124.
1,issn 1804-1930.
1,doi 10.7160/aol.2022.140109.
1,"introduction to managing and reducing risks from natural disasters such as floods, droughts, landslides, the increasing economic, social and environmental and avalanches (sivakumar, 2005; fao, 2020). needs of agriculture pose many challenges farming with its close contact to nature provides for the upcoming years."
1,this topic of sustainable the socio-economic infrastructure to maintain agriculture is closely related to the strategies cultural heritage.
1,"farmers are also conservers of the united nations and the european union of forests, pastures, fallow lands, and their natural on sustainability."
1,"the united nations adopted resources and, in turn, of the environment (jedlička 17 sustainable development goals in 2015 as part et al., 2019; montañana et al., 2020; navrozidis of the 2030 agenda for sustainable development. et al., 2019; diacono et al., 2021)."
1,"agriculture the european union presented in 2019 today is a composite activity involving many actors the european green deal - a roadmap to make and stakeholders in agri-food chains (fao, 2017) the european economy sustainable (campbell that produce and provide food and agricultural et al., 2018; lampridi et al., 2019). commodities to consumers."
1,"in addition to farmers, agriculture comprises vital economic sectors there are farm input suppliers, processors, producing food, agro-industrial feedstock, transporters, and market intermediaries each and energy and provides environmental services playing their roles to make these chains efficient through managing soil, water, air, and biodiversity (horizon 2020 work programme, 2018-2020). holistically."
1,"an overview of all these aspects is more than 10 years ago the futurefarm project given in this publication (baer and birgé, 2018)."
1,"(charvat and gnip, 2009) recognized that agriculture including forestry also contributes [107]"
2,"the role of remote sensing in agriculture and future vision the agriculture sector is under a strong influence results and discussion chapter presents the results of several external drivers including climate in the form of a white paper and set change, demographics, energy cost, food quality of recommendations related to technology and safety, policies, economical and financial improvements, scientific priorities and organisation instruments, sustainability, and public opinion. related issues."
2,interactions between different drivers influence the agri-production and the food market is then materials and methods dependent on regulations and common policies.
2,"eo4agri methodology for user requirements due to the complexity of sustainable agriculture collection we need to better understand all processes involved and build for each agriculture sector a new the eo4agri methodology was initially based knowledge management system (zhao et al., on foresight approach (crehan and harper, 2020)."
2,the main focus of paper is on the use 2008).
2,"the goal was not to create new user of earth observation, and particularly on copernicus requirements, but to make sense of the great number satellite data, in support of agriculture."
2,"this of requirements that have been created in the past paper analyses the role of earth observation (eo) via the efforts of projects funded by eu framework as a knowledge management system for sustainable programmes such as h2020, esa or ad-hoc agriculture including its current gaps and limitations projects and programmes funded by eu member (anderson et al., 2017; whitcraft et al., 2015). states."
2,"foresight is a strategic management tool, the main focus is on copernicus satellite data. originally employed in the public sector as an aid copernicus is a european asset for space-based in the design of research programmes."
2,"nowadays, monitoring of the earth, consisting of a complex it is much more widely applied, not only set of systems, which collect data from multiple in the public but in the private sector as well. sources: earth observation (eo) satellites typically, a foresight exercise produces outputs and in-situ sensors such as ground stations, such as vision statements, roadmaps and actions airborne and sea-borne sensors."
2,the data are plans for implementation.
2,"in general, a foresight processed providing users with reliable exercise involves: and up-to-date information through a set - a systematic approach to generate of services related to environmental and security knowledge about the future - insights issues."
2,"as it became clear, the key to unleash about future copernicus services and how the huge potential of copernicus is easy to access these will benefit the four focus groups its data and information products."
2,"in this regard, of the eo4agri project, namely the european commission (ec) created the agrifood, public, financial and food the baseplate for establishing an integrated ground security sectors."
2,"these four groups are using system (igs) for copernicus that will empower services of technical providers including the user communities to have the maximum benefits infrastructure providers, software providers from eo data and information (annex 1 to the ga, and eo data analytics sector; part b eo4agri)."
2,"eo data needs to be augmented with local expertise and this means that a deep - a wide range of actors relevant to the domain cooperation model needs to be incorporated. of focus of the activity including decision- makers and domain experts, as well as the research in this paper was performed during enablers, beneficiaries and other stakeholders the eo4agri project funded by the h2020 from the focus groups mentioned above. programme."
2,"the main objective of this paper is the purpose of their participation is to help to catalyse the evolution of the european capacity them learn about the domain or focus for improving operational agriculture monitoring of the activity, understand how change from local to global levels based on information happens in that domain, contribute derived from copernicus satellite observation data to the shaping of the evolution of that and through exploitation of associated geospatial domain, and get ready to playa part and socio-economic information services. in the implementation of recommendations materials and methods chapter introduces that might emerge from the activity; the research methods used to gather and analyse the outputs of the four focus groups were integrated gaps in exploitation of eo data for agriculture into a set of key documents including a white paper, including the methodology for user requirements strategic research agenda (sra), policy roadmap collection, stakeholder analysis, online survey and a collaboration framework presented as results and policy and implementation frameworks."
3,the role of remote sensing in agriculture and future vision in this paper.
3,this set of documents should help services to improve their productivity to mobilise and structure support for the further in both agricultural production and business development of copernicus services with a view administration.
3,"the agri-food sector is to accelerating the process of the common composed of different players with different agriculture policy (cap) reform, improving interests."
3,"these users can be subdivided the livelihood of farmers in europe and increasing into: europe’s overall level of resilience and security - a subgroup connected directly or indirectly of food systems in europe (crehan et al., 2019). with precision agriculture."
3,"this subgroup stakeholder analysis can include agricultural producers, service providers, advisers, machinery, and also eo4agri performed an analysis of the needs the food sector."
3,"the relations between of different groups of stakeholders from the four the involved stakeholder groups are depicted focus areas including agri-food, public, financial in figure 1. and food security."
3,"these areas are connected with agriculture, not only on the level of production - a subgroup related to the analysis of agricultural products and food, but also and prediction of the food market. on the level of developing policies for agriculture currently, customers of this information and financing (cap payment system)."
3,the four are mainly in the food industry.
3,"however, focus groups include: the importance of this information will grow in the future also for the primary sector - agri-food sector - agricultural producers, concerning planning production."
3,"figure 2 service providers, advisers, machinery, shows the relation of this group in relation and food sectors that use data-intensive source: own processing."
3,figure 1: data access and information services actors (eo4agri - user requirements and gap analysis in different sectors).
3,source: own processing.
3,figure 2: scheme of agro-industry sector and raw segments in the food industry (eo4agri - user requirements and gap analysis in different sectors).
4,"the role of remote sensing in agriculture and future vision to the previous group (figure 1); public and basic services provided by copernicus sector organizations (and in particular into services adapted to the needs of the four national paying agencies responsible main stakeholder groups mentioned above. for the management of the agriculture - the range of services that can be provided subsidies) that use eo data as an input is in constant evolution thanks to the efforts to agricultural policy formulation of researchers and data entrepreneurs and for implementation of new farm leveraging the latest knowledge subsidies payment systems based and know-how in plant and animal on monitoring (instead of inspection) sciences, environment and climate sciences, and performance (instead of compliance). economic, social, and geophysical sciences - agricultural finance institutions as well as new and emerging domains that provide the agri-food industry of ict based on the application of artificial with credit and insurance services, as well intelligence, machine learning or data as related services such as re-insurance learning in big data analytics. and decision support services to commodities policy framework, sustainable development and derivatives traders. goals, green deal and destination earths - - organizations that support global food new challenges security, in particular donors involved policy frameworks for utilisation of eo in infrastructure and capacity building in agriculture are mainly given by the un in third countries with security in food sustainable development goals (sdg) and nutrition."
4,"the activities of the donors at the global scale and the european green can be related to other issues such as climate deal initiative and destination earth strategy and the environment, and the management at the european level."
4,"from the research of scarce resources such as water, soil, and implementation frameworks points of view, and nitrate-based fertilizers."
4,"this group the group on earth observations (geo) work includes also local farm organizations, programme in the global scale, horizon europe, researchers, and the public sector digital strategy for europe and space strategy in developing countries."
4,"the main incentive for europe can be identified. of this group should be to combine top-down and bottom-up approaches the un sdgs are a universal call to action to end to solve the problem of food security. poverty, protect the planet and improve the lives and prospects of everyone, everywhere."
4,"in addition to the main four focus groups, 17 goals were adopted by all un member states the following stakeholder groups were identified: in 2015, as part of the 2030 agenda for sustainable - the growing industry of data service development which set out a 15-year plan providers that transform raw data to achieve the goals (figure 3)."
4,source: own processing.
4,figure 3: the un sustainable development goals (the sustainable development agenda).
5,"the role of remote sensing in agriculture and future vision the un sdgs (the sustainable development in destine will give users access to high-quality agenda) were approved in may 2019 information, services, models, scenarios, forecasts by the european commission and many of them and visualisations (e.g., in climate modelling, are directly addressed to agriculture, forestry weather forecasting and hurricane evolution). and environment."
5,"digital twins are based on the integration of continuous observation, modelling and high the european green deal (annex performance simulation, resulting in highly to the communication on the european green deal, accurate predictions of future developments. 2019) is a package of european commission’s measures announced in december 2019 that should destine will be implemented gradually over the next ensure citizens and companies in european union 7-10 years, starting in 2021."
5,"the operational core the transition to a more sustainable and greener platform, the digital twins and services are scheduled economy by 2050."
5,"the green deal consists to be developed as part of the commission’s digital of a set of measures that enhances resource europe programme, whilst horizon europe will efficiency through the transition to a clean circular provide research and innovation opportunities that economy, prevents biodiversity loss and reduces will support the further development of destine. pollution."
5,"these measures are related to the policy synergies with other eu programmes, such areas depicted in figure 4. as the space programme, and related national initiatives will also be explored."
5,"together with publishing the green deal, the commission is adopting the eu industrial common agriculture policy and earth strategy destination earth (destine) to address observation the twin challenge of the green and the digital the cap is the largest and most promising area transformation."
5,"the goal is to use the potential of copernicus and galileo data use in the public of the digital transformation, to be a key enabler sector, with farming being one of the main for reaching the green deal objectives economic sectors using such data."
5,"the overall (the european green deal, 2019)."
5,"the commission objective for cap period 2021-2027 is to move is planning to initiate a ‘greendata4all’, from the process of controlling agricultural activity with focus on reviewing the directive establishing compliance with the requirements to the increase an infrastructure for spatial information of operational efficiency."
5,"for that, the area in the eu (inspire and combine it monitoring system (ams) should be with the access to environment information in place by 2024."
5,ams requires joining satellite directive).
5,"as part of this will be the ‘destination observation data (e.g., from copernicus) earth’ initiative. with gis data originating from territorial land a digital twin is a digital replica of a living or non- parcel identification systems (lpis). living physical entity."
5,"the digital twins created source: the european green deal, 2019."
5,figure 4: european green deal and key policy areas.
6,"the role of remote sensing in agriculture and future vision one of the ams parts – checks by monitoring for all eligibility requirements, using the copernicus (cbm) component, based on satellite data and photos sentinel satellite data, instead of checking sent by farmers about the carried out agricultural 5% on the spot."
6,"this approach offers significant activities – is in the process of implementation, simplification and streamlining of iacs and should but implementation is not as fast as it could be. reduce the number of costly inspections in the field."
6,based on that all eu member states could each eu member state and paying agency has use data from the eu’s copernicus sentinel satellites to ensure that farmers rightfully receive subsidies and other eo data as evidence when checking for their good practices.
6,"the current practice is farmers’ fulfilment of requirements under the cap that these entities mainly perform on-farm checks for area-based payments (either direct payments (on a randomly selected and risk analysis-based to farmers or rural development support payments), sample of farmers), the so called on-the-spot as well as cross-compliance requirements, such checks, and farmers with poor performances as stubble burning."
6,"other new forms of evidence in relation to their subsidies’ requirements such as geo-tagged photos, information are subject to penalties which may include from drones and relevant supporting documentation exclusion from participation in funding schemes from farmers, such as seed labels, also are acceptable and/or monetary fines."
6,"this system partly relies for the first time, as part of a broader shift towards on control with remote sensing (cwrs) a so-called ‘monitoring approach’ that will lead with the use of eo data: very high resolution to a decrease in the number of on-farm checks."
6,"visits – vhr and high resolution – hr (10-20 m) images, to the field will be only necessary when the digital with the possibility to use the other available evidence is not sufficient to verify compliance. satellite data as complementary data source."
6,cooperation framework on-farm checks entail serious drawbacks.
6,"they provide only a “snapshot” verification of farmers’ in order to discuss our achievements practices and the state of their farmland, taken with the broader community, eo4agri was active at a specific moment in time; they are conducted in cooperation with international and european only on a small sample of farmers (in the case initiatives and projects."
6,"during the first year, of farmers applying for eu subsidies); they are eo4agri succeeded to meet most of the key time-consuming and their cost is significantly players on the global and european scene."
6,one high (especially when there is a need for follow of them is the food and agriculture organization up on-farm inspections); and when performed (fao) as the main means of communication with the support of remote sensing images at fixed with the un.
6,"the target of the discussion was time windows, they are not adequate for capturing on how eo can support global food and nutrition most of the temporal agronomic practices security and un sdgs focused on agriculture. and farming activities."
6,"the cooperation with fao was done mainly through common activity in the agricultural data aiming to solve the above-mentioned problems interest group (igad) of the research data and to make the farm inspections a more efficient, alliance (rda)."
6,"eo4agri established a contact transparent and flexible process, the cbm concept with the group on earth observations (geo) mainly was introduced."
6,cbm does not represent a standard through cooperation with geoglam.
6,"there was on-the-spot checks (neither cwrs), but rather also an intensive cooperation with the global open a different approach of integrated administration data for agriculture and nutrition (godan), where and control system (iacs) mechanism."
6,eo4agri organised a number of meetings together the ambition is to completely replace on-farm with godan mainly on igad rda meetings checks with the use of automated checks based and also cooperated in the preparation and promotion on eo data which enable specific “snapshot” of inspire hackathons.
6,"eo4agri also organised verification of sustainable agricultural practices, a common workshop with geoglam and godan applying the same logic as in the field, but through for the geo ministerial meeting in canberra. a computer-assisted environment, or the continuous the direction of the future cooperation activities (through the year) monitoring of farmland. with godan are mainly in promotion of open cbm was introduced in 2017, and the new rules data and capacity building."
6,the standardisation came into force in may 2018.
6,"starting from 2018 of information in agriculture, including eo is done (art. 40a of ec regulation 809/2014) the cbm through igad and ogc, where there is broad became part of iacs and there is now an option cooperation (druml et al., 2020). to carry out cbm on 100% of beneficiaries [112]"
7,the role of remote sensing in agriculture and future vision analysis of previous recommendations and user and another 42% of respondents require data requirements with a gsd of less than 5 m.
7,"only 10.5% of respondents are satisfied with the current one of the main tasks of the eo4agri project was gsd of sentinel 2 satellites which is 10, 20 to gather recommendations from previous research and 60 m depending on the native resolution projects and activities."
7,more than 80 projects were of the different spectral bands; analysed and 410 user requirements were identified and reduced to final 69 user requirements.
7,most - two thirds of respondents state that they buy analysed projects are from the copernicus library data at a price of less than 5 euro per hectare. of research projects listed in appendix a (eo4agri the same number of respondents indicates - analysis of previous projects).
7,the requirements that the yield from hectares will rise were mapped to the stakeholder groups mentioned by up to 20 euros thanks to eo information. in the previous section.
7,"requirements that are common if we select only responses from the private to three or more stakeholder groups were labelled sector, then their answers correspond as gold requirements, overlapping requirements to answers of other stakeholder groups between two stakeholder groups were labelled with one exception."
7,"the exception is as silver requirements and bronze requirements the requirement for a higher gsd which is are those belonging to just one stakeholder group. only 50% compared to almost 90% of other the user requirements categorised as gold, silver stakeholder groups."
7,a half of the respondents and bronze requirements are presented from the private sector are satisfied in appendix b (eo4agri - user requirements with what they work with (usually and gap analysis in different sectors).
7,gsd = 10-30 m).
7,questionnaire analysis the statistical summary and responses are an online questionnaire conducted by the eo4agri in appendix c (eo4agri - the statistical project resulted in more than sixty responses that summary and response to the main user were analysed.
7,"the main results of the questionnaire requirements). include: analysis of outputs from workshops, webinars - 75% of respondents state that they are well and hackathons acquainted with eo issues."
7,this proportion the gap analysis and foresight activities started is similar in all stakeholder groups; during the year 2019 and ran until january 2020. - 80% of respondents who grow cereals are during this period eo4agri organized four in situ mainly interested in the effect of using eo meetings in order to identify gaps with the main information in the form of increased yield stakeholders groups mentioned in stakeholder and profit and sustainability of their farming analysis and provided foresight exercises to build and businesses; a new vision of eo for agriculture for future periods.
