page,p
7,"the gap analysis and future vision were - 55% of respondents farm on less than 30 ha discussed during the follow up in-situ events (of which 20% for less than 5 ha) and 35% including the nairobi inspire hackathon 2019, farm on more than 250 ha; eo4agri stakeholder workshop in pilsen, geo - respondents see difficulties in interpreting week 2019 and the geo ministerial summit remote sensing data and real-time in canberra, november 19ogc tc/pc meetings unavailability of data as the main obstacles - toulouse, france 2019 and prague week on big of more extensive use of eo in agriculture; and open data and innovation hubs 2020. - 80% of respondents use data made available the covid 19 outbreak created an unprecedented through public servers and the same number and unpredictable situation that made it impossible use multispectral data from sentinel to organize face-to-face conferences, workshops, and landsat satellites for their work at least seminars and hackathons."
7,"therefore, all planned once a week; meetings and workshops were organized as fully - rgb data is used by 40% of respondents; virtual events."
7,"about ten virtual events were organised in order to validate the eo4agri results. - respondents consider the ground sample distance to be insufficient, when 32% during both in situ and virtual events new of respondents require data with a ground requirements for the agri-food and public sectors sample distance (gsd) of less than 1 m and data requirements were defined and become [113]"
8,"the role of remote sensing in agriculture and future vision part of the eo4agri recommendations and future - more focus should be on time series analysis vision (šafář et al., 2020), (šafář et al., 2020), of eo data in short and also long time (kubíčková et al., 2021). periods in order to better prepare new models and adopt ai tools for future scenarios; agri-food sector: - metadata models and views on metadata - to assess risks/threats to sensitive need to be updated in order to guarantee ecosystems like forests and wetlands."
8,"forests better monitoring of data life cycles and wetlands area known as contributors to support destination earth. to food security particularly when sustainably used; public sector: - accurate monitoring of crop phenology to aid - assessment of hydrological flows through the application of farm inputs like fertilizers, a combination of field observations irrigation and farm management; and output from satellite image analysis workflows; - crop growth scenarios under different weather events."
8,"growth plan – a time interval - augmenting weather and climate monitoring when to start planting to maximize yield through the use of affordable in-situ as possibilities are nitrogen plan – a time weather sensors and remote sensed weather interval when to insert nitrogen fertilization estimates; to maximize its effect, insect pests alert - landsat can particularly be used – alert when a risk of insect pest attack is for awareness creation on issues like land high; degradation and land-use change and its - prediction of disease susceptibility of crop influence on land health and the potential using the temporal crop dynamics areas that can be used for farming; from earth onservation data."
8,"using historical - need to access very high-resolution data, data of crop disease and connecting which are mainly available as commercial them with features extracted from earth services; onservation data for generating alert of probable crop disease; - gap filled time series of high-resolution eo data; - from the analysis of the agri-food sector, the main additional requirement is to support - detection of emergence and harvest data; food traceability. - even though the main driver for ams is data requirements: the cost savings, there are no real calculations of how much it will be saved - the cost - used weather data and biomass to generate of iacs increased over the years and ams index-based services for banking for sure will not decrease that cost (how and insurance such as weather and yield; to calculate?)"
8,; - sampling plots from different agro-climatic - calculation of how much use of the european zones and monitoring growth using data and information access services earth observation techniques together (dias) can save total cost; with ancillary data like weather data and biophysical data; - list of available and future copernicus core services and their possible usage in ams; - sentinel 1 and 2 has a spatial resolution of 20 m (some bands have 10 m) so small farmers - data and predictions of the occurrence can be benefited by the products developed of voles and the system of protection against using images from these satellites; them; - semantic data and metadata - data and procedures for the protection for the description of different types of data of animals during haymaking; in order to assess their applicability to eo; - data and procedures for predicting - requirement for implementation of ogc grasshopper invasion; standards in all eo data services; [114]
9,"the role of remote sensing in agriculture and future vision - historical data for the needs of multitemporal to deal with current issues (small parcels, studies; complex subsidy system with few monitorable eligibility criteria, doubts about - data for the creation of 4d and 5d data the future audits approach, lack of skills, models for agricultural production; funding, infrastructure, etc.); - it is important to re-use previous financing - to conduct a survey about usage of developed and previously developed platforms tools of international projects: it is still from h2020 projects as building blocks not clear how pa’s are planning to test all for destination earth; the tools as well as free and open source - in order to reach the sustainable software (foss), that are/will be developed development goals and european green through those international projects; deal goals, it is necessary to build public - to organise a cycle of webinars about private partnership; existing and future copernicus core service - there is a need for additional multi-actor products: it is a need of learning how these research across domains (agriculture, food, products could be used for cap (27 pa’s out biodiversity, space, it), which will help of 29 in 2020); to use the full potential of earth observation - ec should be the main provider of all for agriculture. the needed algorithms for ams (crop type, results and discussion grass mowing detection, etc.)"
9,; the white paper was the first presentation - production of centralized vegetation indices of the eo4agri vision about the role of eo and provision of “signals as a services” in agriculture.
9,it was recognised that the increasing (eea and va industry).
9,"eea has placed economic, social, and environmental needs a contract for systematic production of agriculture pose many challenges for upcoming from sentinel-2 of “high resolution years."
9,"this topic is closely related to the strategies vegetation phenology & productivity” of the un sdgs and the european green deal (hr vpp) products (ndvi, lai, fapar, on sustainability."
9,"the white paper stresses seasonal trajectories, productivity the importance of knowledge management parameters) for access via the clms; for agriculture to help to solve new challenges geographic coverage is eea39."
9,dg- in the agriculture sector.
9,"the white paper focuses on agri, jrc and eea should jointly assess the definition of key problems, analysis data gaps, the suitability of hr vvp and the possibility delivery platforms, analytical platforms, and final to steer production and data dissemination recommendations for future policies and financing. for cap monitoring purposes; the document serves as an input for the policy - it should be made easy for value-added roadmap and the strategic research agenda."
9,"industry (e.g., data cube service providers) as two main final results are: to integrate with the clms for implementing parcel-based signal and marker services - policy roadmap - set of recommendations based on hr vpp, if adequate; towards cap reform; - necessity to define the minimum scope - strategic research agenda - list of priorities of cbm as a legal part of the area monitoring for future research activities in different system (ams): list of minimum requirements programmes and initiatives. (measures, criteria) for setting cbm should policy roadmap be prepared."
9,current performance output the policy roadmap prepared set of recommendation indicators are not adapted to be moved for future update of common agriculture policies to the new ams.
9,"eu ms are overloaded with to benefit better from earth observation different requirements in different countries, technologies: which are not designed for direct monitoring with eo data, e.g., permanent crops rows - the current frequency of sentinel data is mowing, etc., therefore there is an urgent sufficient, but the spatial resolution would need of simplification and reduction of their still be preferred to be at 5 or even 1 meter; number; - to prepare a horizontal action plan how [115]"
10,the role of remote sensing in agriculture and future vision - developing a good practice knowledge the proactive use of products and data database of controlling different from eo; requirements.
10,the ec could take over this - centralised card4l production (dias): responsibility.
10,"the knowledge database jrc (via esa contract mechanisms) has should be shared among the eu ms; been tasking the four industrial dias’s - the ec should include a reference to demonstrate large-scale production in its respective ams regulation of sentinel-1 backscatter and coherence about conditionality: instructions on using as well as sentinel-2 l2a; satellite data related to conditionality - dias individually reported to be ready (replacing cross-compliance) and remote as presented to expert group for direct sensing requirements, e.g., control payments (egdp) during the info event of spreading manure; fallow; burning, etc; on 24 january 2020; - an overall ec leadership on conditionality - follow up by the ec dg agri and jrc (cross-compliance) and agri-environmental with paying agencies in promoting these schemes is still missing; dias production capabilities further - more suitable eu legislation for using and of a higher technical level. of copernicus sentinels: higher threshold strategic research agenda of minimum eligible parcel for support (when cbm applies); simplification the eo4agri strategic research agenda (sra) of greening, agro-environmental and other (šafář et al., 2020). is a set of recommendations cap non-monitorable requirements for future research activities in the area of earth (e.g., specific plants for crop diversification, observation for agriculture."
10,"it is one two different crops for catch crops); of the key deliverables in eo4agri and there are two objectives of this deliverable: - it is necessary to update the respective ec regulations to lower the requirements - to prepare an input for the european for ms for monitoring approach (e.g., raise commission, european space agency level of traffic light threshold (eur 50/250); and group on earth observations (geo) how to build future research and innovation - it is necessary to improve ec standards activities in this domain; for “geotag” tools, aiming to increase harmonization among different countries; - to help the research and innovation community to discover potential topics - geo-tagged photos & in-situ data: for their future research in the frame the initiatives by gsa and dg-agri of the current financial mechanisms for developing tools (e.g., fast) for helping and initiatives. farmers to collect and communicate in-situ information with the paying agencies are the eo4agri sra is based on a synthesis considered important and shall be pursued of the current requirements coming from political towards “de-facto” standard practices; and research frameworks, and gap and technological analysis provided by eo4agri."
10,"the eo4agri sra - “planet scope time-stacks data” are generated is a list of recommendations for future activities for parcels which cannot be monitored in the geo, horizon europe) and the digital by sentinel due to geometric resolution."
10,europe programmes.
10,"it is not a revision of these there shall be guidelines on how to use programmes, but additional recommendations vhr eo data and the ec shall continue or tasks, which are important for future revisions to support demonstration projects and of these programmes."
10,most of the gaps identified communicate lessons learnt to the paying by eo4agri are well addressed by the current agency’s community.
10,"furthermore, programmes."
10,"in some cases, revisions of these the information shall be made widely programmes will be inevitable. available on how paying agency systems can integrate with vhr eo data dissemination figure 5 depicts the approach for defining the sra. services (via api); - it is necessary to educate the general public and farmers as end users of eo to increase [116]"
11,"the role of remote sensing in agriculture and future vision source: šafář et al., 2020."
11,figure 5: basic schema of the sra definition approach.
11,"final recommendations - provision of super-resolution approaches to increase the spatial resolution on the basis of previous analysis, the eo4agri of the sentinel missions using commercial prepared three sets of recommendations, for future vhr/hhr data as calibration and validation better utilisation of earth observation technologies points. in agriculture."
11,it could be divided as: a major benefit would also be to integrate field - technological recommendations polygons as open government data and directly - future scientific priorities allow analysis on field level and lifting the burden - organisation recommendations on field parcel delineation.
11,"on top, the integration technology recommendations of various other in-situ data is advised: overall, a wide range of agricultural applications - agricultural in-situ data like jecam supported by copernicus data and services (joint experiment for crop assessment already exist including a long list of success and monitoring). etc. wherever possible; stories."
11,"however, there is still a large potential - option to integrate your own data: for improvements."
11,"concrete short term and long - (agricultural) machinery data, support term actions were identified including the agenda for agro-xml for future research (kolitzus, 2020). - drone data technical aspects - iot for many applications in agriculture the spatial - farm management tools such as fast and temporal resolutions of the sentinel missions as a consequence, the support and further are not sufficient, and the upcoming open satellite development of various agriculture missions will not close this gap entirely."
11,data fusion for research (ard) initiatives is recommended in with commercial data providers seems absolutely the short term.
11,"in long-term, a closer collaboration necessary and two potential copernicus products between open eo data service providers with huge added value are possible: and commercial providers are recommended: - provision of a gap-filled time series - further finance and support such as data of vegetational and biophysical parameters cube; (with s-1/s-2/s-3 and commercial vhr/ hhr data) going towards daily observation; - consider sensor alignment with commercial [117]"
12,the role of remote sensing in agriculture and future vision service providers already in the design phase limited to a narrow phenological window (1 or 2 of new sensors; weeks) where the decision-making capabilities of copernicus are needed.
12,the required temporal - invest in research dedicated to data fusion resolution for many agricultural applications is techniques and cross-sensor calibration therefore very high as well. - close collaboration with existing and possible the existing copernicus missions already future providers to ensure compatibility cover many of the identified requirements in the long run; of the agriculture domain.
12,"additionally, the foreseen - for new projects it could be suggest evolution of the existing copernicus missions and or made mandatory to contribute and upcoming candidate missions further fulfil and share available data (following standard the requirements."
12,"however, some conclusions can procedures and protocols) with one be made for the evolving mission specifications or several of the available initiatives (dias, of the sentinel programme in the long term, euro data cube); especially with regards to spatial resolution (~5m) and revisit times (1-3 days)."
12,"a number - furthermore, newly developed methods of gaps not covered were identified, in particular and applications in the field of precision concerning vhr optical data, hhr optical data agriculture and overall in the domain and high-resolution x-band sar data, all of which of remote sensing are often only trained are available from commercial providers. and tested in small areas of interest and their with respect to microwave and thermal data accuracies are often much lower or highly (i.e., lstm and cims), further developments may uncertain when applied in other geographic inform future more detailed data requirements regions."
12,the lack of standardized on these topic. and designated testing areas across the globe and the provision of reference ict aspects datasets (including ground truth) would the copernicus satellite observation capacities facilitate the comparability of existing are operational and are routinely providing methods and the assessment of their high-cadence monitoring data.
12,in addition accuracies.
12,"especially the provision of parcel/ to the copernicus open data hub, five dias are field level might will drastically improve operationally providing data access as well as usability and enable new applications. computational resources."
12,"however, it must be satellite mission noted that no certainty about sustainability of dias future operations beyond 2021 exists."
12,"the copernicus sentinel fleet is offering unprecedented data and is the most ambitious the continuation of at least one of the dias endeavour in the domain of land monitoring so far. providers is highly recommended to facilitate the use in the context of agricultural monitoring, a couple of copernicus data and services."
12,"the functionality of aspects are noteworthy. to process and provide higher pre-processing level data and (c)ard have been demonstrated and is given that for agriculture the natural unit is advised to continue. a field/parcel, the spatial resolution is dictated by this aspect."
12,"field sizes vary largely overall, the interoperability with other satellite over the globe of course, but overall, spatial data as well as in-situ data from all parts resolution is not satisfactory for a large number of the agricultural value chain still has room of applications, a spatial resolution between 1 and 5 for improvements."
12,"this includes data such as direct meters is desirable. meteorological data (forecast as well as historical data), climatic data or other machinery or ground- in contrast to the monitoring of other landscapes based soil data."
12,"activities such as the euro data and landscape objects, agriculture is highly cube and the agricultural virtual laboratory are variable (more variable than forest) and due to crop further follow-up on this approach. rotation or other management practices, it might be a different phenology every other year."
12,"future scientific priorities in addition to that, during a single growing season, on the basis of the analysis of stakeholder needs various types of plants will grow and the overall a set of future scientific priorities were defined. phenological fluctuation is larger than for other these priorities could help to policy makers land cover and land use."
12,"on top of that, the window prepare new research programmes and scientific of opportunity for precision farming is very often communities to identify new research directions."
13,the role of remote sensing in agriculture and future vision the priorities are divided into four thematic groups: and guarantee sustainability and profitability of agriculture; ◦ biodiversity - current precision agriculture is mainly - analysis of historical development focused on site specific operations (where). and understanding of interrelation between our analysis demonstrates that for future changes in biodiversity and climate.
13,"there we need much more consider right timing exists historical data from eo with relatively of operation (when), based on analysis high frequency for more than 40 years. of eo and climatic data and also for such periods are also available detailed on selection of rights species, chemicals, climatic data."
13,using artificial intelligence operations (what); on this historical data can help us to improve understanding of biodiversity decline; - combining satellite data and climatic data from different zones to build strategy - earth onservation data will be ideal source for smart farming; for real time monitoring in large scale and early warning. - build new crop growth scenarios under different weather events.
13,"plan optimal ◦ sustainable farming timing for different field operations; - there is necessary research in different - prediction of disease susceptibility of crop methods of monitoring and data fusion using the temporal crop dynamics of satellite data, with iot data and also from earth onservation data; integration of climatic data and also existing terrestrial data."
13,"it is also important - accurate monitoring of crop phenology; to include commercial very high resolution - assessment of hydrological flows through data, aerial and uaw data."
13,"there will a combination of field observations be necessary cost benefit analysis and output from satellite image analysis and selection of best monitoring methods. workflows; the research has cover selection of bands, - augmenting weather and climate analysis of time series, data fusion; monitoring through the use of affordable - future precision farming has to be focused in-situ weather sensors and remote sensed on reducing the use of usage chemicals, weather estimates; but guarantee production."
13,"so, there is - usage of satellites with very high necessary research in nutrition and crop resolution. protection, but also in methods of seeding ◦ innovation governance or tillage."
13,"research needs to compare the potential of different approaches - the research has to be focused, how eo to utilisation of precision agriculture. can support forming regional, national for example, now in fertilisation are used and local policies."
13,"the focus will be two different strategies the yield-oriented on analysis of agriculture production, strategy is based on the principle of a higher biodiversity and provide impact assessment requirement for nitrogen nutrient to cover of governmental decisions; a higher level of expected crop - to be able to fully use the potential yield, which is spatially distributed of environmental observation it is by the yield productivity zones. a necessary guarantee in global scale the second strategy homogenization easy discoverability of data."
13,metadata is based on the concept of agronomic is necessary to include all history and nutritional practice developed since of processing (provenance).
13,"there is need the 1980´s, when nitrogen is considered for supporting better interoperability a yield-limiting factor and low-yielded of earth onservation data. areas are supported by higher doses the recommendation is to organise of n."
13,"there exist number of similar coordination and support action to support agronomic problems, for example fair and interoperability among existing tillage and non-tillage, etc. and there is platforms; necessary provide comparison of all such possibilities and select, such which will - the fair principles, metadata help fulfil requirements of green deal and interoperability need to be topic; [119]"
14,"the role of remote sensing in agriculture and future vision - effective agricultural knowledge technologies; and innovation systems (akis) are key - development and integration of different drivers to enhance co-creation and thus data like data from iot technologies speed up innovation and the take-up and citizens science; of results needed to achieve the green deal - advanced 2/3/4 d visualisation methods, objectives and targets."
14,there is now a large virtual reality; investment into digital innovation hubs (smartagrihubs).
14,"the model of digital - how to guarantee storage, easy discovery innovation hubs has to be implemented and fast access extremely large data sets; to increase knowledge and awareness - hpc computing including parallelization about earth observation methods. of code; the existing infrastructures (dias, - development of new hyperspectral systems euxdat, eosc, etc.). with high resolution; ◦ enabling technologies - increase resolution of new systems; - object recognition from satellite and other - analysis of hyperspectral data including images."
14,from in situ cameras (on board new indexes; cameras on agriculture machinery) strong - temporal analysis of data; focus will be on embedding of ai directly - data fusion with other data sources; into on board computers with possibility - better utilisation of radar and lidar data. to detect objects directly on board for example to detect on the fly pest organisational recommendations or weeds.
14,this will be also closely related the last set of recommendations was focused to robotics system.
