page,p
1,computers and electronics in agriculture 38 (2003) 175 /198 www.elsevier.com/locate/compag reducing the cost of multi-spectral remote sensing: combining near-infrared video imagery with colour aerial photography g.g.
1,"wright a, k.b."
1,"matthews a,*, w.m."
1,"cadell a, r."
1,"milne b,1 a land use systems, macaulay land use research institute, craigiebuckler, aberdeen ab15 8qh, uk b department of engineering, the robert gordon university, schoolhill, aberdeen ab10 1fr, uk received 24 april 2002; received in revised form 19 august 2002; accepted 26 september 2002 abstract land managers are often confronted with management problems that could be addressed using decision support or management information systems."
1,"the use of such tools, however, depends on the availability of appropriately resolved spatial data."
1,one source of such data is multi-spectral remotely sensed imagery.
1,"the cost of such imagery, particularly where environmental goals are most important, is often prohibitive."
1,"even when the cost of such imagery can be met, other factors, such as cloud cover for satellite-based systems or sensor scheduling for sophisticated airborne systems, may mean that imagery is not available."
1,this paper investigates the utility of a system that combines near-infrared imagery from a video camera with conventional medium-format aerial photography deployed in a light aircraft platform.
1,"previously, imagery obtained from video cameras has suffered from limited spectral range and from significant image motion effects."
1,these problems were eliminated by the use of an electronic-shutter charge-coupled device video camera with a strong ir response.
1,the systems components and the approach to their operational deployment are described and the options for transforming the raw imagery into survey coverage discussed.
1,the image quality and cost is presented for a site characterisation application where the aim is the generation of normalised difference vegetation index values.
1,it is concluded that the system has significant potential utility for decision support and land-management applications.
1,# 2002 elsevier science b.v.
1,all rights reserved.
1,keywords: videography; multi-spectral; metric; survey; ndvi * corresponding author.
1,tel.: /44-1224-498200; fax: /44-1224-311556 e-mail address: k.matthews@macaulay.ac.uk (k.b.
1,matthews).
1,1 tel.: /44-1224-262400; fax: /44-1224-262444. 0168-1699/02/$ - see front matter # 2002 elsevier science b.v.
1,all rights reserved.
1,pii: s 0 1 6 8 - 1 6 9 9 ( 0 2 ) 0 0 1 4 1 - 2
2,176 g.g.
2,wright et al.
2,/ computers and electronics in agriculture 38 (2003) 175 /198 1.
2,introduction 1.1.
2,"context developers of computer-based decision support and management information systems have sought to assist land managers making a wide range of increasingly complex decisions (matthews et al., 1999)."
2,"management objectives include increas- ing efficiency, minimising environmental impact or achieving an acceptable balance between multiple objectives."
2,"whatever the goal of such systems, their operational success depends on the provision of appropriately resolved spatial data within acceptable cost."
2,insufficiently resolved data produces unacceptable uncertainty in prediction whilst excessive cost prohibits employing such data at all.
2,"this paper presents an approach to reducing the cost of gathering high-resolution multi-spectral spatial data, suitable for a wide range of land-management applications, using off- the-shelf sensors deployed on a light aircraft platform."
2,rationale spatial data may be acquired with the intention of characterising a site at a single date or the intention may be to monitor the site to observe the nature and degree of change.
2,"achieving the required coverage and accuracy for either application using conventional ground-based survey methods alone is often either impractical or excessively expensive particularly in heterogeneous environments (um and wright, 1996)."
2,"remotely sensed, multi-spectral imagery (typically imagery with four or more bands, for example blue, green, red and near-infrared (nir)) can significantly improve the quality or reduce the cost of site characterisation and monitoring."
2,"multi-spectral imagery can be used as a primary data source, for example in vegetation surveys or as a secondary source to structure the pattern of ground-based surveys maximising the benefit of the sampling."
2,"multi-spectral data may also be usefully employed as ‘carrier surfaces’ for the spatial interpolation of point survey data to give mapped coverage (wright and birnie, 1986; leone et al., 1995)."
2,"the market for remotely sensed data and services has grown approximately 6% per annum between 1994 and 1997 (olby, 1999)."
2,"the rate of growth it is, however, lower than had been predicted given the increasing number and sophistication of the sensors available (esa-esrin, 2002)."
2,"the importance is recognised of spatial data for planning the management of environmentally sensitive areas (wascher, 2000)."
2,"for such applications, however, the take-up of remotely sensed data is hampered by the lack of clear financial benefits to offset against the costs of a monitoring programme."
2,"there remains an unfulfilled requirement for a sensor system that can be inexpensively purchased, deployed and analysed (tarussov et al., 1996; thomas, 1997)."
3,wright et al.
3,/ computers and electronics in agriculture 38 (2003) 175 /198 177 1.3.
3,"multi-spectral imagery sources the most ubiquitous sources of multi-spectral imagery are satellite-based sensors (moran et al., 1997)."
3,"such sensors are capable of capturing imagery across a wide spectrum (from ultra-violet to mid-infrared, 450/1500 nm) and have steadily increased their spatial resolution (for example the ikonos satellite with a spatial resolution of 1 m)."
3,limitations of satellite systems include the fixed schedule of coverage that may not allow imagery of specific events to be captured and the significant cost of geometrically corrected data for the sensors with the best resolution.
3,"the principal limitations of such systems for applications in western europe and other areas prone to cloud cover is, however, the lack of days on which cloud free imagery can be obtained (legg, 1991)."
3,"using airborne systems, it is possible to obtain imagery from below high-level, evenly distributed cloud cover with acceptable image quality degradation."
3,"indeed depending on the season, image quality may be improved by eliminating harsh shadowing."
3,"a number of airborne multi- and hyper-spectral imaging systems have been developed and tested during the last decade (moran et al., 1997; denniss and bunn, 2000)."
3,the cost of these instruments and the commissioning costs of the aircraft in which they are installed means that they can only be deployed by most land managers on a contractual rather than an ownership basis.
3,"even if the commission- ing cost can be met, limits on the schedule of availability can mean the sensor has to be deployed in less than ideal conditions."
3,the quality of results from these systems is impressive but the cost is prohibitive for most land managers.
3,"conventional aerial photography is one of the oldest and most widely-applied forms of sensors, capable of providing information in the visible and nir spectrum."
3,for multi-spectral imaging using conventional aerial photography two cameras are usually required.
3,"the first captures images with the three visible bands (red, green and blue) and the second either monochrome nir or false-colour nir (kodak, 2001)."
3,conventional photography provides a high quality product that is compatible with analysis by digital photogrammetry.
3,"for nir photography optimising negative exposures, maintaining stocks of ir film and the availability of processing facilities can be problematic."
3,the need for a second camera increases the capital cost and potentially makes operational deployment more difficult.
3,an alternative to conventional aerial photography as a source of imagery is the video camera.
3,"off-the-shelf video cameras are commonly used by video survey companies, but mainly to give a visual check of ground conditions."
3,"mass production of video cameras has reduced their capital cost, they are simple to operate and, since 25 frames are captured every second, it is possible to extract stereo coverage without the need to explicitly capture overlapping images using an intervalometer (vlcek, 1983)."
3,"the utility of video cameras for airborne remote sensing can be limited by their image capture process, with images blurred or smeared due to the movement of the sensor platform."
3,video cameras’ spectral sensitivity is in many cases permanently limited to the visible spectrum.
3,frame selection and capture from video tape can be time consuming and geometric rectification may be hampered by lower quality camera optics.
4,178 g.g.
4,wright et al.
4,/ computers and electronics in agriculture 38 (2003) 175 /198 1.4.
4,"approach adopted this paper describes a multi-spectral imaging system using nir imagery, captured by an improved video camera, merged with conventional metric aerial photography."
4,the imaging system is suitable for deployment on a light aircraft platform.
4,all the components of the imaging system and the process used to convert the imagery into geo-referenced data use off-the-shelf technology with the aim of minimising all costs while achieving an acceptable image quality.
4,"the paper sets out the salient features of video cameras for airborne imaging applications, in particular the recent improvements in spectral response, resolution and image capture."
4,"the components of the imaging system are then detailed, with particular focus on the characteristics of the video camera employed."
4,"issues of operational deployment, data processing and digital image processing are also presented."
4,the results of tests comparing the image quality of conventional and the improved video camera are given.
4,examples of the initial airborne testing of the system are also presented.
4,"the aim for this testing was to examine the practicality and cost of combining imagery from the metric camera with the ir video data, in particular the creation of false-colour ir composites for visual interpretation and vegetation indices suitable for use in quantitative analyses."
4,"video image gathering several developments in the field of videography are relevant to the development of an airborne multi-spectral site characterisation system, in particular the control of exposure using automatic gain control (agc), the alternative image capture strategies and electronic shuttering."
4,automatic gain control effective imaging of varied terrain requires a camera capable of capturing a wide range of feature brightness across its spectral range.
4,the agc compensates for changes in light intensity.
4,agc means that in all but exceptional circumstances the video camera can cope with the range of lighting conditions experienced during the mission without the need to vary the aperture setting of the lens.
4,"this is particularly useful for airborne applications as it eliminates the need for powered, auto-iris lenses which add to the cost, bulk and power requirements of any system."
4,agc simplifies the task of processing imagery into a single mosaic by reducing differences in exposure between individual images and between flight lines.
4,"agc also improves the quality of the imagery achieved by increasing the digital number (dn) range of values (richardson et al., 1992)."
5,wright et al.
5,/ computers and electronics in agriculture 38 (2003) 175 /198 179 fig.
5,"frame and interline-transfer ccds (after macdonald, 2001)."
6,180 g.g.
6,wright et al.
6,/ computers and electronics in agriculture 38 (2003) 175 /198 2.2.
6,image capture images are captured in video cameras using charge-coupled devices (ccds) (fig. 1(a)).
6,progressive-scan ccds capture a whole image simultaneously with full vertical and horizontal resolution.
6,"in contrast, interlace ccds capture an image in two half resolution phases."
6,the delay between these image capture events can lead to blurring of objects moving across the field of view.
6,"two types of ccd support full frame capture, interline-transfer and frame-transfer (macdonald, 2001)."
6,these ccds differ in their approach to translating the charges from the pixels into a video signal.
6,"after transfering the pixel charges to the vertical shift registers, the interline-transfer ccd passes the charges to a horizontal shift register to form a single line of the video image, fig. 1(b)."
6,these lines are integrated by the cameras electronics to form a standard video signal.
6,"frame-transfer, by contrast, transfers charges vertically within the ccd, in effect the ccd acts as its own vertical shift register, fig. 1(c)."
6,in addition to the horizontal register the frame capture ccd has a storage area where charges from the ccd are accumulated before they are passed to the horizontal register.
6,the significant difference between interline and frame-transfer ccds for airborne imaging is that frame-transfer ccds require additional mechanical rather than integrated electronic shuttering to eliminate image motion.
6,mechanical shuttering increases the cost and weight of the lenses required and decreases reliability.
6,"electronic shuttering the quality of images captured by progressive-scan, interline-transfer ccds is improved by the incorporation of an electronic-shutter mechanism."
6,"the duration of the charge accumulation, (effectively the duration that the ccd is exposed for), is fixed and set manually, with a range typically between 1/50 and 1/16 000 of a second."
6,the very short exposure times can be achieved without increased bulk or loss of reliability since the shutter employed is electronic rather than mechanical.
6,the time taken to capture an image is independent of that required for data processing.
6,the ccd still captures a standard 25 frames every second but each image can be the product of an exposure lasting 1/16 000 of a second.
6,the video signal from the ccd is usually adjusted by an agc within the camera to give best possible image quality within the constraints of the shutter speed and lens aperture chosen.
6,the electronic shuttering combined with agc and lens aperture settings give a wide range of options for ensuring optimal picture quality.
6,"the benefits of the progressive-scan ccd with electronic-shutter and agc are particularly noticeable in the reduction of image motion, discussed in the following section."
6,"image motion, shutter speed, and ground resolution cell image motion, seen as blurring or smearing, occurs due to aircraft forward motion, roll, pitch, yaw and as a response to various frequencies of vibration while"
7,wright et al.
7,/ computers and electronics in agriculture 38 (2003) 175 /198 181 the shutter is open.
7,the degree to which the image is degraded is determined to a great extent by the duration over which the image is obtained.
7,"in videography, this is determined by either the shutter speed or the scan rate depending on the ccd employed."
7,"even for short exposure or scan times, there will always be image motion due to the continuous movement of the platform."
7,tolerable image motion may be usefully determined by calculating the ground resolution cell (grc) for the sensor and relating this to the speed of movement of the platform.
7,the grc is the size of the minimum resolvable target for the combination of: ground clearance; resolution and dimensions of the ccd and the focal-length of lens used.
7,"the relationship between these factors can be formulated as follows: grc gs=lr where g is the ground clearance (m), s is the size of the ccd array across the swath (m) (for ccds with rectangular rather than square elements the grc will be orientation specific), l is the lens focal-length (m), r is the resolution (the number of ccd pixels across the swath)."
7,"fig. 2 shows the relationship of ground clearance to ground resolution for three lenses (8, 16 and 25 mm) deployed on a generic ccd."
7,a heuristic for tolerable image motion is that less than half a pixel is acceptable.
7,"assuming a typical light aircraft travelling at around 130 km h1 (or 36 ms 1) and a period of 1/25 of a second to capture the image, then the distance travelled by the fig."
7,relationship of ground resolution and ground clearance for three lens sizes using a generic ccd specified in the legend.
8,182 g.g.
8,wright et al.
8,/ computers and electronics in agriculture 38 (2003) 175 /198 aircraft is 1.44 m.
8,the shaded zone of the graph in fig. 2 shows the 1.44 m zone with the darker shading showing the half distance of 0.72 m.
8,"as the practical ground clearance is 2000 m, in all but cloud free conditions, it is clear that conventional interlaced ccd cameras, operating at 1/25 of a second, can suffer significant image motion."
8,"electronic-shutter ccds taking images in 1/2000 of a second will, in contrast, experience negligible image motion."
8,this makes them highly suitable components of an airborne imaging system.
8,image analysis 3.1.
8,"data fusion data fusion typically involves combining remotely sensed imagery from different portions of the electromagnetic spectrum or imagery with other data sources such as digital elevation data (guneriussen et al., 1996)."
8,"data fusion may also combine data with different spatial or temporal resolutions linking them to a common map base, and if necessary re-sampling them to a common spatial representation (chavez, 1991)."
8,the aim of this process is to combine images in such a way that resulting outputs provide either improved visualisation of the phenomena being investigated or allow the integrated analysis of both datasets to improve the results achieved.
8,the fusion process does not create new information but rather arranges data such that its information content can be more easily accessed.
8,"when sources of visible spectrum data and nir can be brought together then it is possible to consider, for example, using a range of vegetation indices for site characterisation purposes."
8,"site characterisation with vegetation indices remote sensing has long been used for estimating vegetation attributes, a strong correlation existing between the ratio of nir to red reflectance (ir/r) and the vegetation’s leaf area or biomass (kanemasu et al., 1974)."
8,the more robust vegetation index is the normalised difference (spectral) vegetation index (ndvi).
8,a number of formulations exist for calculating ndvi but generically ndvi ((infraredred)=(infraredred))sf; where infrared and red are the infrared and red image values and sf is a scaling factor used to convert the floating-point ratio values into integers between 0 and 255 for display.
8,the ratio has a range of values from /1.0 to /1.0.
8,higher ndvi values indicate larger quantities of plant biomass.
8,the transition from vegetated to bare soil conditions occurs around the zero ndvi value but is dependent on the dn range of the sensor(s) employed.
8,"ndvi is strongly correlated with the fraction of photosynthetically active radiation intercepted by the canopy (hatfield et al., 1984) and a near linear relationship exists between ndvi and both leaf area and biomass."
8,the index has been used as an input to a rangeland-management tool to assist the setting of
9,wright et al.
9,"/ computers and electronics in agriculture 38 (2003) 175 /198 183 appropriate stocking densities to preserve the vegetative diversity of a rangeland (wright et al., 1997)."
9,materials and methods 4.1.
9,"the ccd video camera the ccd camera system used was the monochrome pulnix tm765i2, shown with the other components of the system in fig."
9,the tm765i is typical of ccd cameras developed by pulnix and other manufacturers to meet the needs of the industrial-vision and surveillance markets.
9,"these instruments, available off-the-shelf, are ideal components for a reduced-cost imaging system."
9,"the video camera has an electronic-shutter mechanism, providing a sharp picture at speeds (between 1/50 and 1/16 000 s) without smearing or blurring."
9,"in order to maintain an acceptably bright image, a shutter speed of 1/2000 was used with optimum exposure maintained by the agc."
9,the tm765i ccd has a resolution of 756x581 pixels and was deployed with a pentax 8.5 mm cctv lens at a ground clearance of 1000 m giving a grc of 0.38 m.
9,the ccd has a strong response across a wide wavelength spectrum.
9,this is illustrated in fig. 4 showing that for nir radiation the ccd has a 50% response when compared to the potential for visible light.
9,this is a significant improvement on previously available ccds which typically had a 10/20% relative response.
9,"for the purposes of the development study, a visually opaque 750 nm nir filter (kodak wratten 88a) was used to isolate the nir band."
9,the tm765i is 42 /32 /130 mm and weighs 190 g.
9,this compactness simplifies the operational deployment of the camera on a light aircraft platform since structural modification is not required.
9,"the small size and weight of the camera also makes it possible to consider deploying the camera from even lower cost platforms such as blimps, kites and model aircraft with limited payloads (silbernagel et al., 1998; benton, 2001; cousins, 2001)."
9,"operational deployment the video camera was paired with a medium-format (120/220) metric camera, a rolleiflex 60063 fitted with a zeiss planar f2.8/80 mm lens."
9,"this allowed the capture of four bands of information: red, green and blue from conventional colour film and nir from the video camera."
9,"for the metric camera system, a rig had been designed that attaches to the front seat rails of a cessna 172 (ekin and deans, 1986; ekin, 1987)."
9,when over the target this carriage is moved out through a window fitted into the base of the door.
9,"the rig 2 pulnix america, inc. http://www.pulnix.com."
9,3 rolleimetric http://www.rolleimetric.de.
10,184 g.g.
10,wright et al.
10,/ computers and electronics in agriculture 38 (2003) 175 /198 fig.
10,"camera within the pod, power pack and recorder."
11,wright et al.
11,/ computers and electronics in agriculture 38 (2003) 175 /198 185 fig.
11,relative response of pulnix tm765i ccd.
12,186 g.g.
12,wright et al.
12,/ computers and electronics in agriculture 38 (2003) 175 /198 is required to be retractable as when deployed it introduces significant drag to the aircraft.
12,the rig for the video camera is a pod attached to the aircraft door so as to be in-line with the conventional camera when it has been deployed.
12,"from the pod, a power cable runs to a high capacity (3 /4 h) 12 v battery pack within the aircraft."
12,a second cable runs from the tm765i to a sony portable hi8 video walkman.
12,battery power was used for both video camera and recorder since fluctuations in the power from the aircraft tended to reduce the image quality achieved.
12,fig. 5 shows external and internal views of the camera rigs.
12,the external views show the metric camera rig deployed as it would be during image capture and the pod used to house the video camera.
12,the internal view shows the controls for the metric camera (on a single board near the camera) and the video recorder/monitor.
12,simultaneous operation of the metric and video camera only requires the pilot to power on the video camera and recorder to begin recording and then concentrate on the operation of the metric camera.
12,"flight lines are pre-planned to give the desired stereo coverage with the metric camera, (approximately 60% overlap-lap and 10% side-lap)."
12,the video recorder is left running continuously during the course of the flight lines with individual frames captured on return to base.
12,"the coordinates for the start-, way- and end-points of the flight lines are stored in the gps based navigational system."
12,once the aircraft is set fig.
12,external and internal views of the camera rigs.
13,wright et al.
13,"/ computers and electronics in agriculture 38 (2003) 175 /198 187 on the required heading the metric camera is triggered at fixed time intervals by an intervalometer along the flight line (ekin, 1994)."
13,"data processing the land-management application may require real-time monitoring, simple visual identification of phenomena, field-map navigation in collaboration with other media or a fully map-referenced product."
13,fig. 6 shows the process used to turn the raw data from the metric- and video-cameras into digital images suitable for manipulation by photogrammetric and image processing software.
13,4.3.1.
13,image capture the medium-format metric camera films were developed and printed.
13,the prints were then scanned on a hp 7440c flatbed scanner giving raw full-colour images of 900 /900 pixels with 24 bits per pixel (2.43 mb per image).
13,"the data processing of the video camera data is a two-stage process, identifying the frames required and then capturing them as digital images."
13,frame identification requires the replay of the video tape to identify the frames required.
13,this means the matching of the features on the video tape either with existing imagery or baseline mapping.
13,individual frames are converted from analogue (on the video tape) to digital format (on the pc hard-drive) using a frame-grabber; in this case the quantum snapmagic4.
13,the images captured are single-band (8-bit) with the full sensor resolution (0.44 mb).
13,this low-cost unit can capture up to one frame every 2 s.
13,"to achieve the appropriate image overlap, a frame is grabbed once every 5/10 s depending on the aircraft ground speed."
13,4.3.2.
