page,p
13,"digital image processing two software packages were used for creating site coverage, imageassembler5 and orthobase6."
13,"imageassembler is a share-ware package for creating composite images, typically from sets of digital photographs."
13,"it mosaics images together by rubber sheeting the images, using two tie points per image."
13,this mosaicing operation does not create a geo-referenced image.
13,orthobase was also used to create a seamless mosaic using the more sophisticated ortho-rectification process.
13,"ortho-rectification is similar to rubber sheeting but also removes distortions in the imagery introduced by the sensor’s lens, platform attitude and terrain."
13,removal of lens distortions uses data provided by metric-lens calibration.
13,"lacking such data for the tm765i lens, partial data (focal-length and radial distortion) for a generic lens was used when rectifying the video-imagery7."
13,"removing terrain and attitude distortions uses: ground control points (gcps), 4 quantum leap software ltd http://www.quanleap.co.uk."
13,5 panavue http://www.panavue.com.
13,6 leica geosystems http://www.erdas.com.
13,7 pentax http://pentax.co.uk.
14,188 g.g.
14,wright et al.
14,/ computers and electronics in agriculture 38 (2003) 175 /198 fig.
14,data processing.
15,wright et al.
15,"/ computers and electronics in agriculture 38 (2003) 175 /198 189 features identified in the imagery with known x , y and z coordinates; tie points that record the location of features between pairs of images and a digital elevation model (dem)."
15,both the aerial photographs and the video camera images were linked to the ordnance survey (os) map base and with a dem derived from the os 5 m contours dataset.
15,"once linked to the common map base and mosaiced, the rgb and nir images are brought together in a multi-spectral image stack within erdas imagine."
15,"this enables the visualisation of false-colour composites (green, red and nir mimicking false-colour ir film), and allows the calculation of per pixel ndvi values using the red and nir bands."
15,results 5.1.
15,ground-based testing the series of images in fig. 7 illustrate the reduction in blurring from image motion achieved by the tm765i compared to a conventional video camera.
15,"the pairs of images were taken from a moving vehicle (85 km h1) using a conventional shutterless video camera with an interlaced ccd (1a and 2a) and the tm765i (1b and 2b), the tm765i images are nir."
15,the increased sharpness of the tm765i imagery is particularly obvious for the near subjects (1a and 1b) though still significant for the more distant scenes (2a and 2b).
15,"airborne testing the images presented in this section are for an area of farmland and woodland in north east scotland, obtained on 15th september 1999 at midday, with a variety of land covers identifiable."
15,fig. 8 is a seamless mosaic of 11 tm765i images.
15,the resulting image is not referenced to a map base and retains distortions introduced by the terrain and the camera optics.
15,this means it is not possible to combine this tm765i image with those from the metric camera.
15,"imageassembler does, however, allow the rapid creation of site coverage that may be used to visually identify features of interest; the 11 image mosaic was created in only 15 min."
15,this approach is potentially of use for reconnaissance or as a secondary data source when used in conjunction with other data referenced to a map-base.
15,fig. 9 shows examples of the ortho-rectified metric and tm765i imagery.
15,fig. 9(a) shows the medium-format metric colour-photography.
15,fig. 9(b) shows the nir imagery from the tm765i for the same site.
15,it is noticeable that the tm765i imagery appears less sharp than the metric colour-photography despite their identical 1 m resolution.
15,this is probably because the metric colour-photography was re-sampled from a higher resolution.
15,the dn range for the nir imagery is 17 /246; this results in a more than adequate level of contrast across the image.
16,190 g.g.
16,wright et al.
16,/ computers and electronics in agriculture 38 (2003) 175 /198 fig.
16,"near and distant scenes captured with a conventional video camera (1a and 2a) and the tm765i (1b and 2b), from a moving vehicle."
17,wright et al.
17,/ computers and electronics in agriculture 38 (2003) 175 /198 191 fig.
17,imageassembler mosaic.
18,192 g.g.
18,wright et al.
18,/ computers and electronics in agriculture 38 (2003) 175 /198 fig.
19,wright et al.
19,/ computers and electronics in agriculture 38 (2003) 175 /198 193 fig. 9(c) shows a false-colour composite of the metric and tm765i images.
19,the match for images shows no bleeding of colours characteristic of mis-registration.
19,fig. 9(d) presents the ndvi image.
19,"for the fields identified in fig. 9(d), histograms are presented showing the proportion of each field with particular ndvi values, fig. 10(a /d)."
19,"fig. 10(a) shows eight pasture fields, fig. 10(b) two fields with standing cereals, fig. 10(c) three fields with bare soil or recently harvested cereals and fig. 10(d) a single fodder crop field."
19,it is possible both from fig. 10(a) and visually in plate 1(d) to contrast the degree of grazing of the pastures from heavily grazed to ungrazed.
19,discussion the success or failure of an imaging system can depend less on the capital cost of the equipment and more on the recurrent costs of data processing.
19,capital costs can be amortised over the lifetime of the sensor.
19,the costs of processing the raw imagery into the form required for analysis has an immediate impact on individual projects.
19,of particular significance is the amount of labour required.
19,table 1 presents the costs of the two sensors deployed.
19,"the relative effort required for ortho-rectification and two measures of the data quality, the maximum ground resolution and the residual errors are also presented for the two sensors."
19,capital costs it is clear from table 1 that the metric camera represents a large capital investment and has higher calibration and consumables cost than the video camera.
19,"the expense, weight and mechanical nature of the metric camera also means that it is unsuitable for use in any platform less expensive than a light aircraft."
19,"the higher capital, calibration and consumables costs must, however, be set against the lower cost of processing the imagery to create survey coverage."
19,the software required to create geo-referenced maps is also significantly more expensive than that needed create a photo-mosaic.
19,"cost and quality of survey coverage while the costs of commissioning and flying a light aircraft based survey are not inconsiderable, they are significantly outweighed by those of the labour-intensive data processing of the imagery."
19,ortho-rectification is faster for the imagery obtained with the metric camera firstly since fewer images per unit area are required.
19,"secondly, fewer gcps are required to achieve a given level of accuracy as the fig."
19,examples of the imagery.
20,194 g.g.
20,wright et al.
20,/ computers and electronics in agriculture 38 (2003) 175 /198 fig.
20,histograms of ndvi values for selected fields.
21,wright et al.
21,"/ computers and electronics in agriculture 38 (2003) 175 /198 195 table 1 costs and features of the imaging system item capital cost ($us) depreciation period/straight-line cost per annum ($us) ccd camera, lens, video recorder, 2250 5/450 peripherals metric camera, lens, peripherals 12 900 5/2500 imageassembler software 66 3/20 orthobase software 3000 3/1000 survey costs ccd camera ($us) metric camera ($us) calibration (per annum) n/a 300 consumables (per flight) 15 150 commissioning (per flight) 450 survey (per hour) 150 data processing costs ccd camera metric camera ground control (h km2) c.18 c.7 mosaicing (h km2) c.6 c.4 images (km2) 27 18 gcp (pts. per image) 3.7 2.2 data required dem, base-map, dem, base-map dgps(?)"
21,"image analysis (h km 2) 2 data quality ccd camera metric camera maximum ground resolution 1.0 m /0.25 m rectification errors (xyz in m) 1.1, 1.1, 2.4 0.5, 0.5, 1.0 internal geometry of the metric lens is more accurately known, and since the metric camera lens has less distortion."
21,"distortions in the video camera imagery were only eliminated by increasing the overlap between adjacent images, thereby utilising only the central portions of each frame."
21,the labour required to ground control and mosaic the metric camera imagery is thus significantly less than that required for the video camera imagery.
21,"the need for larger numbers of gcps may be difficult to meet in areas such as semi-natural rangeland, where there are limited numbers of mapped features available."
21,"in such areas, it may be necessary to collect additional ground control information for features that are visible on the imagery but not mapped on the base- mapping."
21,this can be accomplished using differential gps but does significantly increases the cost of the final imagery.
21,"for ground resolution, the metric photography is limited not by the resolution of the sensor but by the accuracy of ground control."
21,"where accurate ground control is available, particularly feature elevation values, imagery from the metric camera with 0.25 m resolution has been rectified successfully (miller et al., 1994)."
21,"for the metric imagery used here, the mean errors in x - and y -axes were acceptable, being half the resolution of the rectified imagery."
21,"for the video camera imagery, despite the additional ground control used, the errors were approximately double the metric"
22,196 g.g.
22,wright et al.
22,/ computers and electronics in agriculture 38 (2003) 175 /198 photography.
22,developments of the video camera component of the system will focus on reducing these errors by using lenses with improved optics and if necessary calibrated lenses.
22,alternative tools and methodologies alternatives to the data capture methods used here are possible depending on equipment available.
22,"in particular professional quality digital stills cameras are becoming avaliable with sufficient resolution (for example the nikon d1x, with 5 megapixel resolution)."
22,"these have the advantage of maintaining an entirely digital workflow, eliminating the processing and printing phases that are time consuming and potentially introduce additional distortions to the imagery."
22,"digital stills cameras eliminate: the need for access to a professional quality photographic processing laboratory, the delay between capture and analysis that can be unacceptable for real- time monitoring applications and the risk of in-transit risk of damage to light- sensitive media."
22,"such cameras, do however, represent a substantial investment (6750 $us) and the workflow benefits may not outweigh the costs of replacing existing equipment."
22,"if required, film-based medium-format metric cameras can still deliver image resolution significantly greater than even the best digital stills cameras."
22,if a film-based image is captured then negative scanning avoids the distortions introduced by printing and may also improve the dynamic range of colour values achieved.
22,negative scanners with sufficient resolution are becoming increasingly available at decreasing cost.
22,"the errors in geo-referencing introduced by flatbed scanning of a print are, however, in most cases negligible."
22,with the limited numbers of gcps available in rural imagery the residual errors from the ortho-rectification process are at least an order of magnitude larger than those introduced by flatbed scanning.
22,"furthermore, clients frequently specify hard copy prints in addition to the digital products."
22,"partly this is for convenience of use in field or office-based discussions, but is also a product of the aesthetic appeal of analogue prints with their sharp edges and ability to resolve very small features."
22,this aesthetic appeal operates despite knowledge that the resolution of conventional photographic imagery is far greater than necessary to provide an adequate basis for most land-management decisions.
22,"video image capture may be significantly simplified by the use of a digital video recording device, again increasingly available at low-cost."
22,digital video recording means that individual video frames may simply be sampled direct from the recorder and used immediately within a digital image processing system.
22,data processing for digital video data simply becomes a matter of frame identification.
22,"the process of frame identification from video imagery can be time consuming, particularly with the less familiar nir band."
22,"the use of contemporary stills imagery, in this case from the metric camera, while not essential, does significantly help in the identification of the start and end points of the flight lines."
22,the success of fixed- interval frame-grabbing depends on the skill of the survey pilot in maintaining a steady rate of advance and the flight conditions being relatively calm or at least not
23,wright et al.
23,/ computers and electronics in agriculture 38 (2003) 175 /198 197 gusty.
23,the process of frame-grabbing could be semi-automated by tagging frames with gps coordinates.
23,"conclusions combining video camera imagery with metric aerial photography has provided a method of collecting high-resolution, multi-spectral imagery with potential utility for decision support and land-management."
23,"the quality of imagery achieved to date has been evaluated as visually acceptable, with none of the characteristic blurring associated with earlier videography and achieving a good match between the two data sources and the map base features."
23,since the system can be implemented using off-the-self components it has a capital cost lower than comparable custom-built systems.
23,the processing costs are principally defined by the labour required.
23,the amount of labour required depends firstly on whether a geo-referenced product is needed and secondly on the accuracy required.
23,"improvements to both image recording hardware and the software used to process imagery can, based on recent experience, be expected to reduce the labour required per unit area."
23,acknowledgements the research for this paper is funded by grant-in-aid from the scottish executive environment and rural affairs department and the macaulay development trust.
23,"the authors also acknowledge the assistance provided by pulnix (uk), pentax (uk), dr w.h."
23,ekin and mr d.
23,riley.
23,"references benton, c., 2001."
23,kite aerial photography (online).
23,"available from: http://arch.ced.berkeley.edu/kap/, aug, 2002."
23,"chavez, p., 1991."
23,comparison of three different methods to merge multi-resolution and multispectral data: landsat tm and spot panchromatic.
23,"photogrammetric engineering and remote sensing 57 (3), 295 /303."
23,"cousins, d., 2001."
23,microlite offers true picture of crop condition.
23,"farmers weekly, 63."
23,"denniss, a., bunn, a., 2000."
23,shac uk’s first sar and hyperspectral airborne campaign.
23,"geoinfor- matics 4, 12 /15."
23,"ekin, w., 1987."
23,a new lightweight camera rig.
23,"photogrammetric record 12 (69), 343 /348."
23,"ekin, w., 1994."
23,the use of a low-cost gps receiver for block aerial vertical photography.
23,"photogram- metric record 14 (84), 875 /886."
23,"ekin, w., deans, n., 1986."
23,further developments of an inexpensive retractable vertical camera rig for a light aircraft.
23,"photogrammetric record 12 (68), 227 /236."
23,"esa-esrin, 2002."
23,"european eo services: activities, achievements, issues and future prospects, summary report of esa-industry workshop: eo market development, esaesrin, frascati, italy."
23,"guneriussen, t., johnson, h., sand, k., 1996."
23,dem corrected ers-1 sar data for snow monitoring.
23,"international journal of remote sensing 17 (1), 181 /195."
24,198 g.g.
24,wright et al.
24,"/ computers and electronics in agriculture 38 (2003) 175 /198 hatfield, j.l., asrar, g., kanemasu, e.t., 1984."
24,intercepted photosynthetically active radiation estimated by spectral reflectance.
24,"remote sensing of environment 14, 65 /75."
24,"kanemasu, e.t., niblett, c.l., manges, h., lenhart, d., newman, m.a., 1974."
24,wheat: its growth and disease severity as deduced from etrs-1.
24,"remote sensing of environment 3, 255 /260."
24,"kodak, 2001."
24,kodak aerial imaging products (online).
24,"available from: http://www.kodak.com/us/ en/government/aerial/products/index.shtml, aug, 2001."
24,"legg, c., 1991."
24,"a review of landsat mss image acquisition over the united kingdom, 1976 /1988, and the implications for operational remote sensing."
24,"international journal of remote sensing 12 (1), 93 / 106."
24,"leone, a., wright, g., corves, c., 1995."
24,the application of satellite remote sensing for soil studies in upland areas of southern italy.
24,"international journal of remote sensing 16 (6), 1087 /1105."
24,"macdonald, k., 2001."
24,introduction to video 101 (online).
24,"available from http://www.pulnix.com/imaging/ pdfs/primer.pdf (aug, 2002)."
24,"matthews, k., sibbald, a., craw, s., 1999."
24,implementation of a spatial decision support system for rural land use planning: integrating gis and environmental models with search and optimisation algorithms.
24,"computers and electronics in agriculture 23, 9 /26."
24,"miller, d., finch, p., fon, t., 1994."
24,a model of dem and orthophotograph quality using aerial photography.
24,"in: pröbsting, t."
24,"(ed.), photogrammetrie and forst."
24,"albert-ludwigs universität freiburg, freiburg im breisgau, pp."
24,227 /239.
24,"moran, m., inoue, y., barnes, e., 1997."
24,opportunities and limitations for image-based remote-sensing in precision crop management.
24,"remote sensing of the environment 61, 319 /346."
24,"olby, n., 1999."
24,"eopole newsletter, earth observation data policy and europe, issue 1, university college, london."
24,"richardson, a.j., everitt, j.h., escobar, d.e., 1992."
24,"calibration of gain compensated aerial video remote sensing imagery using ground reflectance standards, proceedings of the thirteenth biennial workshop, american society for photogrammetry and remote sensing, orlando, florida, pp."
24,87 /97.
24,"silbernagel, j., lang, n., wample, r., smithyman, r., hendrix, w., 1998."
24,"geospatial analysis of blackleaf in vitis, in: petoskey, b. (ed.), first international conference, geospatial information in agriculture and forestry, decision support, technology and applications, vol."
24,"1, erim international, inc., lake buena vista, florida, pp."
24,1257 /1264.
24,"tarussov, a., dubois, j.m.m., wenzl, m., 1996."
24,light airborne remote-detection systems for the earth sciences.
24,"international journal of remote sensing 17, 2699 /2718."
24,"thomas, m., 1997."
24,diy remote sensing.
24,"mapping awareness, 32 /33."
24,"um, j., wright, r., 1996."
24,"pipeline construction and reinstatement monitoring: current practice, limitations and the value of airborne videography."
24,"the science of the total environment 186, 221 /230."
24,"vlcek, j., 1983."
24,"videography: some remote sensing applications, proceedings of the fiftieth meeting, american society for photogrammetry and remote sensing, washington, d.c., 63 /69."
24,"wascher, d. (ed.), 2000."
24,"the face of europe-policy perspectives for european landscapes, ecnc technical report series, european centre for nature conservation, chapter 4, methodological approaches, 43 /50."
24,"wright, g.g., birnie, r., 1986."
24,detection of surface soil variation using high-resolution satellite: results from the uk spot simulation investigation.
24,"international journal of remote sensing 7 (6), 757 /766."
24,"wright, g.g., sibbald, a.r., allison, j., 1997."
24,"the integration of a satellite spectral analysis into a heather moorland management model (hgmm): the case of moidach more, northeast scotland."
24,"international journal of remote sensing 18 (11), 2319 /2336."
