page,p
10,"even as late as 2017, 10 percent of monitors available to calculate design values to compare with the naaqs operated no more than 80 days per year."
10,data on attainment status are taken from epa’s green book.11 10.
10,"in exceptional events that are outside state regulators’ control, such as wildfires, state regulators may petition to have monitor readings from those events excluded from design value averages."
10,epa then chooses whether to concur that the event was exceptional and allow it to be excluded from the design value.
10,see https://www.epa.gov/green-book/green-book-data-download.
11,4.2 satellite-derived concentration data the satellite-derived pm2.5 concentration data come from a variety of sources (van donkelaar et al. 2015; van donkelaar et al.
11,2016).12 the data are primarily gathered by satellite-based instruments that measure aerosol optical depth (aod).
11,"the best known of these instruments among economists are the modis instruments aboard the terra and aqua satellites (see, e.g., zou 2018; grainger, schreiber, and chang 2018; gendron-carrier et al."
11,2018).
11,"as these satellites orbit earth, the modis instruments on board capture data on the density of airborne particles."
11,it does this by comparing the intensity of solar radiation at the top of the atmosphere with how much radiation is reflected by earth’s surface.
11,"the more airborne particles there are to scatter and absorb this radiation, the less radiation is reflected to the satellite."
11,"both satellites follow a polar orbit, going from the north pole to the south pole and back to the north pole every 100 minutes or so."
11,"as the satellites orbit pole to pole, earth continues to rotate, giving the satellites a new swath of ground to scan."
11,the satellites’ orbits are calculated so that they pass over and scan any given point on earth at approximately the same time every day.
11,"on the sun-facing side of earth, terra crosses the equator at approximately 10:30 a.m. local time with each orbital pass, while aqua crosses the equator at approximately 1:30 p.m."
11,"thus, every location is scanned by each satellite approximately once per day at roughly the same time every day."
11,these once-a-day readings are temporally sparser than hourly readings available from ground monitors.
11,"however, as discussed in the previous section, few monitors report hourly data, and most do not collect data every day."
11,van donkelaar et al. (2015) and van donkelaar et al. (2016) combine the aod data from the modis misr (also aboard terra) and seawifs (aboard orbview-2 satellite) instruments with results from the chemical transport model geos-chem.
11,geos-chem provides information about how pollutants are transported from one area to another by the wind and how chemical compounds change as they travel.
11,this combination of measurements and simulation is calibrated using ground-based monitored observations of pm2.5 at a monthly timescale.
11,"the data are then averaged by year for every 0.01-by-0.01-degree grid cell, which is approximately 1 km2 in area."
11,while satellite-derived data on air pollution provide unique opportunities for 12.
11,"the data we use here are an updated version of the north america data developed in van donkelaar et al. (2015), which uses advances presented in van donkelaar et al."
11,(2016).
11,we are very grateful to aaron van donkelaar for giving us access to these data.
12,"researchers and policy makers, they also come with a few caveats."
12,"first, the satellites do not measure pm2.5 directly."
12,"they measure aod, which must be scaled to pm2.5 based on local conditions."
12,"this is not altogether straightforward even for researchers with atmospheric sciences training, but aod itself can sometimes be used to estimate comparative pm2.5 levels in localized areas."
12,"however, when comparing data with general policy thresholds such as the naaqs, they must be accurately scaled."
12,"second, satellites cannot measure ground-level conditions on cloudy days."
12,this is one reason the satellite-derived data are more reliable at large timescales (months or years) than small ones (hours or days).
12,"third, the accuracy of the data depends on the sample of ground-based monitors used for calibration."
12,"for example, data calibrated globally could have mean-zero error globally, but sub-samples of the data (e.g., the data for north america) may not be mean zero."
12,"to avoid this problem, we use data specifically calibrated for north america, which are quite accurate.13 figure 1 plots the correlation between the van donkelaar et al. satellite-derived data (vertical axis) and annual average readings from ground-based monitors (horizontal axis)."
12,the satellite data for each monitor is taken from the 0.01-by-0.01-degree cell in which the monitor is located.
12,"faint markers indicate individual monitor–grid cell pairs; bold markers indicate the average for every bin centered at integers on the horizontal axis (i.e., satellite average for monitor readings of 1 ± 0.5 µg/m3 )."
12,the shape and color of each marker indicates how frequently the monitor operates: red circles for monitors that operate no more than 80 days per year; yellow triangles for 81–120 days; blue squares for 121–300 days; and green pentagons for those operating more than 300 days per year.
12,dashed gray lines show the 12 µg/m3 naaqs threshold for nonattainment classification.
12,"in general, the satellites show strong agreement with the monitors, especially at lower monitor readings."
12,"at higher monitor readings, the satellites tend to underestimate pollution concentrations relative to the monitors."
12,this would imply that our methodology may be somewhat conservative in determining areas that are misclassified as attainment.
12,4.3 population and demographic data block-level data on population counts and race/ethnicity come from the 2010 census.
12,block group–level data on educational attainment and household income come from 13.
12,"compare correlation between monitors and satellite data calibrated for north america shown in figure 1, discussed below, and the equivalent figure for globally calibrated data restricted to north america in figure a1, which shows a systematic upward bias relative to the monitors."
13,the 2005–2010 american community survey (acs).
13,data on county-level all-cause mortality come from the centers for disease control and prevention’s (cdc’s) compressed mortality file.14 5 results 5.1 monitor coverage and nonattainment status we begin by looking at the locations of pm2.5 monitors in the continental united states.
13,figure 2 shows the location of each of the monitors that were used to make the 2015 attainment determinations.
13,it also labels monitors based on how many days per year the monitor is required to operate following the same scheme as in figure 1.
13,we see significant heterogeneity across states in both the density of monitors and the frequency of their use.
13,"some states have dense monitor networks that operate daily or near daily (e.g., california, pennsylvania)."
13,"others are hardly monitored at all (e.g., montana, maine, mississippi, nebraska, nevada, idaho).15 still others have many monitors, but each of those monitors does not operate more than 80 days per year (e.g., wisconsin, wyoming)."
13,"even within states, coverage can vary."
13,"most of california is densely monitored, but in central california the monitors operate nearly every day, while in the los angeles basin they operate no more than once every six days."
13,figure 3 shows the designated nonattainment areas established in 2015 for the annual pm2.5 standard promulgated in 2012.
13,"these nonattainment areas cover central california; the los angeles basin; west silver valley, idaho; cleveland; pittsburgh; and philadelphia."
13,all these areas were designated as nonattainment because of high monitor readings and not because they contributed to a downwind nonattainment area.
13,the key question the satellite data can answer is whether other counties also exceed the naaqs.
13,5.2 satellite-measured concentrations and misclassified areas figure 4 shows the difference between the satellite-measured three-year average pm2.5 concentrations and the annual naaqs for the continental united states in 2015.
13,blue 14.
13,see https://wonder.cdc.gov/cmf-icd10.html.
13,illinois is a special case where the monitors present in the state were deemed by epa to be of insufficient quality to be used for naaqs assessment.
13,"therefore, all the data were thrown out, and the entire state was classified as attainment/unclassifiable."
14,"areas correspond to those for which the satellite predicts a design value below the naaqs (12 µg/m3 ), red areas are those predicted above the naaqs, and white areas are those right at the naaqs."
14,"this map shows many areas above the naaqs, particularly in california, where figure 3 also showed large nonattainment areas."
14,"however, figure 4 also suggests that a large share of the midwest is close to the naaqs, and several areas have concentrations well above the naaqs despite being classified as attainment areas."
14,"figure 5 focuses on some of these hot spots, highlighting the area bounded by chicago on the north and west, louisville on the south, and pittsburgh on the east."
14,"again, red corresponds to concentrations over the naaqs, white about equal to the naaqs, and blue under the naaqs."
14,"county boundaries are plotted in white, official nonattainment areas are bounded in orange, and monitor locations are represented by black dots."
14,this map gives several examples of misclassified areas.
14,"first are areas with concentrations exceeding the naaqs but that have no monitors in their counties (e.g., logansport, indiana, north of indianapolis and southeast of chicago)."
14,"second are areas exceeding the naaqs that are not detected because the monitors are too far away from the hot spots (e.g., southeast of logansport)."
14,"third are cities with multiple monitors, but those monitors are located on the edges of the hot spots and miss peak concentrations (e.g., indianapolis, louisville, and cincinnati)."
14,figure 6 shows all the misclassified counties—those that were designated as attainment but contain areas that exceed the naaqs—in the continental united states.
14,"there are 54 such counties across 11 states.16 table 2 lists the number of people living in misclassified counties in each state, with separate counts for counties with monitors and without."
14,"for counties that include areas that are both attainment and nonattainment, we treat the attainment part of the county as a distinct county.17 all told, 24.4 million people live in misclassified areas."
14,"of these, 10.9 million live in counties with no monitors."
14,"the states with the largest populations of unmonitored and misclassified people are illinois (6.4 million misclassified, all unmonitored); california (4.9 million misclassified, of which 0.8 million are unmonitored); and texas (4.5 million misclassified, with 0.4 million unmonitored)."
14,two other states have sizable 16.
14,table a1 lists all misclassified counties and their core-based statistical areas.
14,"if the satellite data find that the attainment portion should also be nonattainment, we count only people living in the attainment portion as misclassified."
14,"similarly, if the nonattainment portion has pollution monitors but the misclassified attainment portion does not, we describe the attainment “county” as having no monitors."
15,"misclassified populations that are unmonitored: kentucky (1.2 million misclassified, 1 million unmonitored) and ohio (2.2 million misclassified, 0.9 million unmonitored)."
15,"the total number of people living in misclassified counties is 24.4 million, slightly more than the number of people currently living in official nonattainment areas (23.3 million).18 5.3 distribution of people across attainment groups table 3 summarizes how various demographic groups are distributed across correctly classified attainment areas and nonattainment areas, as well as misclassified areas."
15,"to calculate these figures, we use 2010 census block-level data on population, race/ethnicity, and share urban, and 2005–2010 american community survey (acs) block group–level data on education and income."
15,the first three columns show what percentage of the listed group resides in each type of classification area; these columns sum to 100 by construction.
15,"for example, the first row shows that of the 306.6 million people in our sample, 84.5 percent were correctly classified as attainment, 8.0 percent (24.4 million people) were misclassified as attainment, and 7.6 percent (23.2 million) were classified as nonattainment."
15,column 4 shows the percentage of the given group that live in an area that satellite data show should be nonattainment (the sum of columns 2 and 3).
15,column 5 shows the ratio of people misclassified by monitors to the number of people flagged by satellites as nonattainment (column 2 divided by column 4).
15,we refer to this ratio as the false negative rate of the monitoring network.
15,"for the whole population, the satellite data found that 15.5 percent (column 2 plus column 3) should have been classified as nonattainment (misclassified population plus officially nonattainment), but of these over half (8 percent over 15.6 percent) were misclassified, for a false negative rate of 51 percent."
15,"similarly, the second row of table 3 shows that the false negative rate in rural areas is 68.6 percent (2.4 percent divided by 3.6 percent)."
15,"by contrast, urban areas (third row) have a false negative rate was 50.5 percent."
15,this false negative rate is likely lower than that for rural areas because monitors are more concentrated in urban areas and are thus more likely to detect when urban areas exceed the naaqs compared to rural areas.
15,"similarly, pollution concentrations are likely to be higher in urban areas where pollution is more concentrated."
15,we include in these counts chicago (and the rest of illinois) and houston whose designation is attainment/unclassifiable because their monitoring was not deemed reliable enough to determine naaqs compliance.
16,there are also large disparities in both pollution concentrations and monitors’ false negative rates across racial and ethnic groups.
16,"white (non-hispanic) individuals are the least likely to live in areas that the satellites flagged as nonattainment (misclassified or official nonattainment), with 11.3 percent living in such areas."
16,the monitors’ false negative rate for whites is 59.6 percent.
16,"the fraction of black individuals flagged by the satellite as nonattainment is 14.6 percent, with a false negative rate of 65.1 percent."
16,"hispanics as a group are the most likely to live in an area that exceeds the naaqs, with 30.0 percent living in these areas."
16,"however, their false negative rate is somewhat lower than that of whites and blacks at 38.5 percent."
16,asians have a comparable rate of living in nonattainment and misclassified areas (26.3 percent) but have the lowest false negative rate of all groups (32.8 percent).
16,"there are similar disparities across educational attainment groups, which are defined as the highest level of education attained by people at least 25 years old."
16,"those without a high school diploma are the most likely to live in areas exceeding the naaqs (19.0 percent), but the least likely to be missed by monitors (45.0 percent false negative rate)."
16,those with only a high school diploma are less likely to live in an exceedance area (13.3 percent) but more likely to be missed by monitors (54.5 percent).
16,"those with a partial college education are similar (14.9 percent over the naaqs, 51.4 percent false negative rate) as are those with a college degree or more (15.3 percent over the naaqs; 53.3 percent false negative rate)."
16,"looking at households by income, there is surprisingly little variation in both their likelihood of living in an exceedance area and their false negative rate."
16,"5.4 excess deaths from being misclassified as attainment a nonattainment designation requires local regulators to develop and implement plans to bring their jurisdiction into attainment.19 had misclassified counties been designated nonattainment, they might have experienced health benefits from the ensuing improvement in air quality."
16,"in this section, we estimate the extent of these unrealized health benefits in two ways, first considering how regulator behavior affects air quality, and then without such considerations."
16,"see chay and greenstone (2003), currie et al. (2014), and bishop, ketcham, and kuminoff (2018)."
17,"5.4.1 effect on air quality from regulator behavior as discussed in section 3, the structure of the caa and naaqs create an incentive for regulators to specifically target improvements around those monitors that exceed the naaqs rather than across their jurisdiction as a whole (auffhammer, bento, and lowe 2009; grainger 2012; bento, freedman, and lang 2015)."
17,"following past research, equation (1) outlines our difference-in-differences strategy to estimate the effect of this behavior on air quality."
17,"before estimating equation (1), we want to assess the validity of the parallel trends assumption by estimating the event study equivalent of equation (1), x  pm t = β1,y nonattainmentm × over naaqsm × 1{t = y } + y 6=2015 x  β2,y nonattainmentm × under naaqsm × 1{t = y } + (2) y 6=2015 δ t + δ m + ""m t which takes attainment monitors (group iii) as the baseline and estimates how the trends of group i and group ii deviate from group iii."
17,"for example, the coefficient β1,2016 is the difference between group i in 2016 and 2015, minus the difference in group iii between 2016 and 2015."
17,"if β1,2016 = 0, then group i and group iii followed the same trend between 2015 and 2016."
17,"if β1,2016 < 0, group i saw larger improvements in air quality."
17,"the coefficients for 2015 are omitted, so each coefficient is the change relative to 2015."
17,"figure 7 plots the β̂1,y and β̂2,y estimates and their 95 percent confidence intervals."
17,"the group i coefficients (red solid line) are not statistically significant before 2015, showing a slight downward trend relative to the group iii monitors."
17,the large error bands are likely due to the small number of monitors in group i (14 monitors) and the different local shocks faced by each monitor.
17,"however, in 2016, the first year after the new nonattainment desigations, the confidence interval narrows considerably and the trend takes a slightly negative turn."
17,"the 2016 coefficient is 66 percent larger in magnitude than the 2014 coefficient, but this difference is not statistically significant."
17,"the group i monitors make a considerable break from trend in 2017, with a decrease of 3.3 µg/m3 pm2.5 relative to group iii."
17,"the group ii coefficients are also somewhat noisy, hovering around zero with a slight drop in 2017."
17,table 4 reports the difference-in-difference regression results.
17,column 1 reports the 17
18,pooled diff-in-diff of monitor readings on year indicators and a single nonattainment–post interaction.
18,"the “post” period is 2016 and 2017, following the nonattainment designations made in 2015."
18,"the preferred specification in column 2 adds a variable identifying monitors in nonattainment areas operating in 2016–2017 and showing violation of the naaqs (nonattainment–post–over naaqs), a triple interaction term."
18,both regressions also account for any idiosyncrasies attributable to specific monitors through monitor-level fixed effects.
18,all standard errors are clustered by monitor.
18,column 1 shows that the average monitor in nonattainment areas records 1.02 µg/m3 less pm2.5 after the 2015 nonattainment designations relative to monitors in attainment areas.
18,column 2 allows for a separate effect on monitors over the naaqs and shows that the overall decrease in pollution is being driven mostly by monitors over the naaqs.
18,"under-naaqs nonattainment monitors see pollution drop 0.64 µg/m3 relative to attainment monitors, while over-naaqs monitors see a 2.35 µg/m3 decrease."
18,"5.4.2 calculating excess mortality to calculate excess mortality from misclassification, we suppose that if misclassified areas had been designated as nonattainment, they would have experienced an average decline in pollution levels similar to that in areas properly designated as nonattainment."
18,"specifically, areas over the naaqs would have their pm2.5 decrease by an additional 2.35 µg/m3 , while pm2.5 in non-exceeding areas in the same county would decrease by 0.64 µg/m3 ."
18,we translate these pollution decreases into decreased mortality risk by multiplying them by the concentration-response coefficient from lepeule et al. (2012) of 14 percent increase in all-cause mortality per additional 10 µg/m3 pm2.5 .
18,this leads to a 3.3 percent increase in all-cause mortality in areas over the naaqs and a 0.8 percent increase in mortality in the rest of the county.
18,"finally, we multiply these figures by county-specific death rates from the cdc and block-level population from the census."
18,"we find that misclassified counties would have avoided 2,826 premature deaths per year had they been correctly classified."
18,"using epa’s standard vsl of $9 million, the social cost of this excess mortality is approximately $25.4 billion per year (epa 2016, p."
18,4-16).
18,"while the excess mortality effect is measured annually, it eventually gets eliminated as pollution trends in nonattainment areas equalize with those in 18"
19,attainment areas.
19,a conservative assumption would be that the trends shown in figure 7 will equalize after 2017 (after our regression sample) so that all benefits are realized in 2016 and 2017.
19,"this would imply that total excess mortality of misclassification was 5,652, with a social cost of $51 billion."
19,we can also make back-of-the-envelope calculations of excess mortality that ignore regulator behavior.
19,"one way is to scale concentrations in misclassified counties so that all areas are under the naaqs (12 µg/m3 ) and then calculate the mortality savings.20 this results in an average decrease in pm2.5 of 0.5 µg/m3 across all misclassified blocks, leading to 1,398 fewer deaths per year, a welfare gain of $12.6 billion per year."
19,"a second way is “peak shaving”, the scenario where areas that exceed the naaqs and are located in misclassified counties have their pm2.5 decreased to exactly 12 µg/m3 while all other areas are left unchanged.21 this would lead to an average decrease in exposure in over-naaqs areas (the group i equivalent) of 0.43 µg/m3 , and no change in the group ii and group iii equivalents by construction."
19,"the resulting excess mortality is 261 deaths per year, with a social value of $2.4 billion per year."
19,6 conclusion the clean air act is the primary air quality regulation in the united states.
19,"however, its success in improving health and environmental quality depends on a limited network of stationary pollution monitors to provide regulators with information about local pollution levels."
19,"if pollution levels in an area exceed the naaqs but there is no monitor nearby, that area is unlikely to exercise mitigation actions to reduce its pollution."
19,"in this paper, we have used satellite data to provide evidence that significant portions of the country are indeed exceeding the annual pm2.5 naaqs standard but are nevertheless designated as being in attainment."
19,"estimates of how regulators impact air quality in response to a nonattainment designation suggest that correctly classifying misclassified areas could have save thousands of lives, a potential welfare gain to society of $51 billion for 2016 and 2017."
19,"a more conservative estimate, ignoring  20."
19,"specifically, let the new hypothetical concentration in block b be x̃ b ,c = x b ,c 12/x cmax where x cmax is the maximum concentration in county c ."
19,"following the notation in footnote 20, ¨ 12 if x b ,c > 12 x̃ b ,c = x b ,c else 19"
20,"regulator behavior, values the gains from satellite-corrected classification at $2 billion per year."
20,"while the value to health and social welfare provided by satellite information on air quality appears to be very large, a few caveats are in order."
20,"the main caveat is that while satellite data are far more spatially dense than ground-based monitoring data, the conversion of what is actually measured by the satellites (aerosol optical depth) to pm2.5 is not without error or bias when compared with monitor readings at the same place."
20,"in our case, the bias works to make our surprisingly large estimates of the misclassified population conservative."
20,the other caveat is the relative temporal sparseness of reliable satellite data.
20,to achieve high spatial resolution (while maintaining accuracy) requires aggregating to larger time scales.
20,"yet, on a more macro scale, the satellites provide data for every day, while in 2016 at most 37 percent of monitors were operating daily."
20,"when the caa first became law in 1970, legislators could not have envisioned the capability of measuring air quality on a spatially precise basis from satellites."
20,our results suggest that epa should examine whether there is scope for satellite data to be used as one of the factors that enter into the designation decision.
20,"alternatively, satellite data can be used as a guide in monitor placement and a check that vulnerable populations are being protected by the clean air act."
