page,p
1,using satellite data to fill the gaps in the us air pollution monitoring network* daniel m.
1,sullivan alan krupnick first draft: september 2018 this draft: january 2019 abstract compliance with the clean air act’s national ambient air quality standards (naaqs) is determined using local pollution monitors.
1,"however, most counties have zero or one monitor, and monitors may not represent exposure across wide areas."
1,we use satellite-derived data on fine particulate matter (pm2.5 ) to revisit the compliance determinations for the pm2.5 annual naaqs made in 2015.
1,"mirroring current regulatory practice, we flag counties as “nonattainment” if they contain areas that exceed the naaqs."
1,"comparing the satellite-based list of nonattainment areas to the official determinations, we estimate that 24.4 million people live in attainment areas that the satellite data suggest should be nonattainment."
1,"we then estimate how air quality changes in areas targeted by regulators for improvement, as occurs around ground-based monitors that are designated nonattainment."
1,"the estimates suggest that proper classification would have prevented 5,652 premature deaths between 2016 and 2017, a welfare gain of $51 billion."
1,"jel codes: q51, q53, q58 keywords: environmental regulation; clean air act; air pollution * resources for the future, 1616 p st nw, washington, dc 20036."
1,"email: sullivan@rff.org, krupnick@ rff.org."
1,we thank alex de sherbinin and david diner for advice on using satellite data on particulate matter.
1,we are particularly grateful to aaron van donkelaar for sharing data.
1,we also thank mark nepf for excellent research assistance.
1,"we benefited greatly from feedback from corbett grainger, dave cohen, and seminar participants at wcere, haqast4, and epa."
1,this research was supported through nasa cooperative agreement number nnx17ad26a with rff to estimate the value of information obtained from satellite-based remote sensing.
2,1 introduction the clean air act (caa) is the foundation of air quality regulation in the united states.
2,"under the caa, the us environmental protection agency (epa) establishes national ambient air quality standards (naaqs) for several air pollutants: pm2.5 , pm10 , ozone, nox , so2 , co, and lead."
2,"the naaqs themselves are statistics describing concentration levels over various time horizons, e.g., the three-year daily average or the 98th percentile of daily maxima over three years."
2,air pollution monitors across the country regularly measure concentrations of the regulated pollutants and regulators calculate “design values” from these measurements to compare against the naaqs.
2,"if a monitor reports a design value above the naaqs, the monitor’s jurisdiction (usually the county) is classified as “nonattainment” for that pollutant standard and is subject to a series of requirements to bring its design value within the standard.1 past research has found that air quality improves significantly faster in nonattainment areas than in attainment areas, resulting in concomitant health and welfare benefits (see, e.g., currie et al."
2,"2014; bishop, ketcham, and kuminoff 2018)."
2,"but these air quality standards are only as effective as the epa’s monitoring network, which is limited."
2,"the majority of us counties lack monitors altogether, and readings at an air pollution monitor do not necessarily represent concentrations across a wide area like a county."
2,"of 3,100 counties in the united states, only 651 (21 percent) have any pm2.5 monitors."
2,"of these, 48 percent have a single monitor."
2,"in such cases, standard practice is to assume that the concentrations registered by that monitor are representative of concentrations throughout the county."
2,"good monitor placement is obviously critical to this assumption, but recent research shows that some monitors appear to be placed in areas of low pollution relative to elsewhere in the county, such as upwind of major point sources (grainger, schreiber, and chang 2018)."
2,the purpose of this research is to measure how many people live in gaps in the monitoring network where pollution levels are high but undetected by monitors and therefore undetected by regulators.
2,we use high-resolution satellite-derived data (∼1 km2 ) on ground-level pm2.5 concentrations to find counties that are designated as attainment but contain areas that violate the naaqs according to the satellite data.
2,"we find that 54 counties in 11 states, home to 24.4 million people, are misclassified 1."
2,"there are some additional factors that epa may consider when making nonattainment designations, which we describe in more detail in section 2.1."
3,according to satellite data from the time period epa used to originally assign attainment designations (2011–2013).
3,"of these, 10.9 million live in counties that do not contain any pm2.5 monitors."
3,"reclassifying all these misclassified individuals as nonattainment would more than double the total nonattainment population, currently 23.2 million."
3,"we also find that the misclassification rate varies considerably across demographic groups, with rural individuals and black individuals the most likely to be misclassified."
3,one consequence for these misclassified counties is that their residents did not enjoy the same accelerated improvements in air quality that properly classified nonattainment counties did after their nonattainment designation.
3,we estimate the value of these forgone health benefits by measuring the effect of a new nonattainment designation on pollution concentrations near a monitor.
3,"auffhammer, bento, and lowe (2009) find that when regulators take action to bring their counties into attainment, they specifically target high-pollution monitors—the immediate cause of the nonattainment designation—for improvements."
3,"we measure the effect of this targeting after the 2015 nonattainment designation using a difference-in-differences design with monitor data and find that pm2.5 around targeted monitors (monitors over the naaqs in nonattainment counties) decreased by 2.3 µg/m3 more than it did around attainment monitors, which we take to be the counterfactual of targeted monitors absent the regulatory intervention."
3,"untargeted monitors in nonattainment areas (monitors that did not exceed the naaqs) also saw relative decreases, though smaller than those of targeted monitors."
3,"to calculate the social benefits of using the satellite data in the regulatory process, we consider the hypothetical where local regulators target all areas that exceed the naaqs instead of just those areas exceeding the naaqs according to ground-based monitors."
3,"using a standard concentration-response estimate from lepeule et al. (2012) and the estimated effect of regulators’ targeting of monitors, we calculate the excess mortality due to misclassification."
3,we estimate the decrease in pm2.5 that misclassified counties would have experienced had they been properly classified and use our estimates to calculate the number of premature deaths that would have been avoided.
3,"we find that improved air quality would have prevented 5,652 premature deaths in misclassified areas between 2016 and 2017."
3,"using the value of a statistical life (vsl), this would result in $51 billion in benefits to misclassified counties had states acted as quickly to reduce pm2.5 levels in these areas as they have in nonattainment areas."
4,2 air quality regulation with sparse monitoring 2.1 background on the clean air act the clean air act (caa) of 1970 and its subsequent amendments form the basis of current air quality regulation in the united states (revesz 2015).2 the caa directs the administrator of the epa to issue naaqs for certain pollutants.
4,"limits must be imposed on air pollutants that “may reasonably be anticipated to endanger public health or welfare” (42 usc § 7408(a)(1)(a)), and these limits should be set to “protect the public health” with “an adequate margin of safety” (§ 7409(b)(1)).3 the naaqs are supposed to be reviewed and possibly revised no later than every five years, although this schedule is rarely met."
4,"these assessments are made in consultation with an independent scientific review committee, the clean air scientific advisory committee (casac), which provides scientific and technical advice."
4,the current primary standards for pm2.5 were set in 2012 as (1) an annual average of no more than 12 micrograms per cubic meter (µg/m3 ) (down from 15 µg/m3 in 2005) and (2) a 98th percentile of daily readings no more than 35 µg/m3 (unchanged from 2005).
4,both metrics are calculated using the three most recent years of monitor data.
4,"as we discuss further in section 5, this study focuses on the annual standard of 12 µg/m3 ."
4,"once a naaqs is established for a pollutant, each state formally recommends to epa which areas (generally counties) should be classified as in attainment with the naaqs, which should be classified as nonattainment areas (§ 107(d)(1)), and which are nonclassifiable (effectively attainment) areas."
4,"the state is required to use the latest three years of monitoring data to do this, but it also may use atmospheric modeling, emissions inventories, and other tools.4 states also identify areas that contribute to 2."
4,"in general, see revesz (2015), chapter 5, for detailed history and review of air quality regulation in the united states at the federal level."
4,3. § 7408(a)(1)(b) also requires that the presence of the pollutant be due to “numerous or diverse mobile or stationary sources.”
4,the public health standard prescribed in § 7409(b)(1) is known as the “primary” standard. § 7409(b)(2) provides for “secondary” standards that “protect the public welfare.”
4,"welfare “includes, but is not limited to, effects on soils, water, crops, vegetation, manmade materials, animals, wildlife, weather, visibility, and climate, damage to and deterioration of property, and hazards to transportation, as well as effects on economic values and on personal comfort and well-being” (§ 7602(h))."
4,"note, however, that the costs of meeting the standards may not be considered when setting standards."
4,"when the pm2.5 standards were set in 2012, epa directed states to use air quality monitoring data from 2010 through 2012 in their initial recommendations for nonattainment areas and said it would use data from 2011 through 2013 in its final determination if 2013 data were available in time."
5,downwind air quality violations and include them in their nonattainment recommendations.
5,"epa examines the state submission and then makes its determination on nonattainment designations, which states can appeal."
5,the caa also permits reclassifications of an area’s status as conditions change.
5,most reclassifications are made after states or other groups petition to move from nonattainment status to attainment.
5,"epa can also reclassify in the other direction on its own or if asked to by petitioners, but this rarely happens."
5,"epa data show that only one area has ever been reclassified from attainment status to nonattainment for any pm2.5 standard.5 once an area is officially designated nonattainment, the state or states in which the area is located must submit a state implementation plan (sip) to epa that outlines how the naaqs will be met (e.g., what restrictions will be placed on which industries in which parts of the state)."
5,"polluters in nonattainment areas face more stringent regulations than those in attainment, such as a requirement to use the best available control technology."
5,areas with more severe nonattainment designations face tighter restrictions but have longer deadlines to reach attainment.
5,states that continually fail to make “reasonable further progress” in reaching attainment may face federal funding sanctions or other consequences.
5,understanding the schedule and speed of nonattainment areas in reaching attainment is important when we estimate the health benefits of making proper designations.
5,2.2 problems with a limited network of air pollution monitors the naaqs and the attainment designations depend on epa’s pollution monitors to provide an accurate measure of how much pollution people are exposed to.
5,"however, there are several problems with using a limited network of monitors to measure exposure to a spatially dispersed population."
5,"the fundamental issues are that (1) air pollution varies significantly over short distances, with spikes around every factory, every road, and every refinery;6 and (2) pollution can travel long distances from its source."
5,"as such, the correlation between a monitor’s readings and concentration on the ground decays quickly with distance; the farther you get from a monitor, the less the 5."
5,"pinal county, arizona, was reclassified in 2011 as nonattainment with the pm2.5 2006 rule (24-hour standard) two years after initial classifications were made for that rule in 2009."
5,reclassification from attainment to nonattainment for any pollutant is rare.
5,it has happened only 59 times across all 13 criteria pollutant standards.
5,"of these, 34 percent were changes to counties’ so2 status (2010 rule) and occurred in the last three years."
5,"see, e.g., hu et al."
5,(2009).
6,monitor can tell you.
6,"but in 2015, 79 percent of counties did not have a pm2.5 monitor, 10 percent had one monitor, 5 percent had two monitors, and 6 percent had three or more."
6,"in addition to physical problems of measuring pollution, there are two problems with regulatory air pollution monitors that arise because air pollution is generated by economic activity."
6,"the first problem is goodhart’s law: once a metric of economic activity becomes a regulatory target, it is no longer a good metric of the underlying activity."
6,"this is because economic actors may adapt their behavior to affect the metric, like when a teacher changes his curriculum to better fit the standardized tests used to evaluate his performance."
6,"for air pollution, this “teaching to the test” could happen in a number of ways: strategically placing monitors in less-polluted parts of the county, strategic timing of abatement by polluters when monitors are in operation, or the gradual relocation of polluters over time from locations upwind of monitors to locations downwind."
6,"grainger, schreiber, and chang (2018) present evidence of strategic monitor placement."
6,"zou (2018) presents evidence that firms reduce their pollution on days that pm2.5 and pm10 monitors are in operation, since some monitors operate only on select days and their schedule is published in advance.7 our paper does not test for these problems directly, but our results are likely driven in part by them."
6,"the second problem is that monitors are fixed in space and time, while the location of pollution is constantly changing."
6,"a pollution monitor provides a sample concentration from a single point in what could be a large area with varying topography, wind conditions, traffic patterns, and density of industry."
6,"since air quality regulation is ultimately aimed at improving health, how people, pollution, and polluters are differentially distributed across space cannot be ignored."
6,"furthermore, none of these distributions are static."
6,"as polluters in different locations change their polluting behavior and as establishments relocate or open for the first time, the spatial distribution of emissions changes, and in turn the overall exposure to nearby residents changes."
6,"as neighborhoods grow in some parts of a city and shrink in others, overall exposure changes."
6,"as the local climate becomes hotter, airborne pollutants react in different ways and total exposure changes."
6,"meanwhile, the monitor observes the air at 7."
6,intermittent operation is primarily a problem with older monitors and pm10 monitors.
6,"in our sample, 56 percent of pm2.5 monitors gathered data on fewer than 121 days in 2015, and 23 percent of those gathered data on fewer than 80 days."
7,the same physical location and is blind to all these changes.
7,"if a monitor initially corresponds to the median concentration in a county, a year later it may correspond to the 40th percentile, the 60th percentile, or some other order statistic from the population exposure distribution."
7,"these problems together motivate a closer look at how well the monitors in the united states measure resident exposure to air pollution and, in turn, at whether the process of designating areas can be improved."
7,a natural next question is ask is whether the county is the best unit of designation.
7,"given how much pollution can vary over short distances, it may be more efficient to determine attainment status for areas smaller than the county."
7,this would reduce the number of people living under a nonattainment designation who themselves have air quality within the naaqs.
7,"however, abatement becomes harder at smaller scales—imagine a single residential neighborhood or apartment building being designated nonattainment and tasked with reducing their local pollution."
7,this problem of the optimal unit of designation is separate from whether satellite data can improve the existing regulatory system.
7,"as such, we leave it for a future paper."
7,3 research design are there areas exceeding the naaqs that epa’s monitor network has missed?
7,what might the mortality benefits have been had these areas been correctly classified as nonattainment?
7,"to answer the first question, we compare the satellite-derived data on ground-level pm2.5 with official nonattainment designations to flag census blocks which (1) have satellite pm2.5 readings over the naaqs and (2) are classified as attainment/unclassifiable."
7,"we refer to counties with any such areas as “misclassified,” since they would have been classified as nonattainment had epa’s monitor network had the same spatial coverage as the satellite data, i.e., one monitor for every square kilometer."
7,our primary answer to the second question takes a two-step approach.
7,"first, we estimate the effect that regulators have on local air quality when they target an area for improvements."
7,a nonattainment designation pushes local regulators to lower pollution in order to get their county to attainment status.
7,past research has found that regulators can be effective at targeting monitors that cause their county to be in nonattainment.
7,"as auffhammer, bento, and lowe (2009) observe, regulators in 7"
8,"nonattainment areas have less incentive to target monitors that are not over the naaqs because the nonattainment designation depends on readings at the highest monitor.8 we take an empirical approach similar to that of auffhammer, bento, and lowe (2009); grainger (2012); and bento, freedman, and lang (2015) to estimate the effect of pm2.5 nonattainment status on violating monitors."
8,"we estimate a difference-in-differences regression to measure the effect on pm2.5 concentrations over time for monitors in nonattainment areas that register readings over the naaqs (termed group i) versus monitors in nonattainment areas that register concentrations below the naaqs (termed group ii) versus monitor readings in attainment areas (termed group iii):  pm t =β1 nonattainmentm × over naaqsm × postt +  β2 nonattainmentm × under naaqsm × postt + (1) δ t + δ m + ""m t where pm t is the pollution reading for monitor m at time t ."
8,the indicator variables δt and δm control for year and monitor effects.
8,"nonattainment and “over naaqs” status are taken from the year 2015, the first year nonattainment determinations were made for the 2012 pm2.5 rule."
8,here β1 captures the change in targeted monitors in nonattainment areas (group i) relative to changes in attainment monitors (group iii).
8,likewise β2 captures the change in untargeted monitors in nonattainment areas (group ii) relative to group iii.
8,"because these monitors are not targeted, we would anticipate β2 to have a smaller magnitude than β1 , with much of the effect on untargeted monitors coming as a side effect from efforts to reduce pollution at the nearby targeted monitors."
8,"(because a counties in our sample were not designated nonattainment without a violating monitor, all group ii monitors must have a group i monitor in the same county.)"
8,"we invoke the usual parallel trends assumption that, absent the regulatory intervention, the trends of group i and group ii monitors would have continued to follow the trend of group iii monitors."
8,"under this assumption, β̂1 and β̂2 measure the casual effect of regulators’ response to a nonattainment designation."
8,“the federal regulation creates an incentive for the local regulator to closely track the monitors that put the county at ‘risk’ of becoming out of attainment.
8,the regulator then allocates effort in terms of monitoring and enforcement activities to the different monitors by comparing the future costs of getting out of attainment to the present costs associated with the reduction in the emissions around ‘risky’ monitors.
8,"the resulting equilibrium is a schedule of heterogeneous monitoring and enforcement efforts such that more effort is allocated to dirtier monitors” (auffhammer, bento, and lowe 2009, p."
9,"after estimating β̂1 and β̂2 , we consider a scenario where federal regulators have monitors for every square kilometer."
9,this gives local regulators the incentive to target all areas that exceed the naaqs instead of one or two specific points as in the current case with sparse monitoring.
9,"we assume that if areas over the naaqs in misclassified counties had been correctly classified, they would have experienced declines in pm2.5 similar to those experienced by targeted monitors after their nonattainment designation, i.e., β̂1 ."
9,"similarly, we assume areas under the naaqs in misclassified counties would get the spillover improvement β̂2 ."
9,"we then calculate excess mortality using the estimate of concentration-mortality response from lepeule et al. (2012) which is commonly used in epa regulatory impact analyses (see, e.g., epa 2012; 2014; 2015)."
9,we define excess mortality as the number of deaths would have been avoided if misclassified counties had been classified as nonattainment.
9,"we also go through a secondary, much simpler exercise to calculate excess mortality that ignores regulator behavior and abatement spillovers."
9,"in the non-behavioral method, we consider only the health benefits of bringing misclassified areas exactly in line with the naaqs."
9,"specifically, we estimate what health benefits would have been if areas over the naaqs in misclassified areas had their pm2.5 decreased exactly to the naaqs (12 µg/m3 ) while all areas under the naaqs—including those in misclassified areas—follow their current trends."
9,"after calculating the potential air quality improvements, we again use the concentration-response from lepeule et al. (2012) to calculate excess mortality and its social cost."
9,"we focus on the most recent revision to the pm2.5 naaqs, which was made in 2012, lowering the limit for annual average pm2.5 to 12 µg/m3 ."
9,"states submitted recommendations for their nonattainment designations in 2014 using monitor data from 2011 to 2013, and official designations were announced in 2015."
9,"we focus our regression analyses on the five year window around 2015, from 2013 through 2017."
9,we do this for a few reasons.
9,"first, we want to use a balanced panel of monitors in the regression so that monitors leaving or entering the sample do not bias the results."
9,"after restricting to monitors in continuous operation from 2013 through 2017, we have 14 monitors in group i, 49 in group ii, and 852 in group iii.9 increasing the time span of the sample increases the length of the pre-treatment period, but also removes monitors 9."
9,"here we really mean “continuously according to schedule,” so a monitor that was supposed to operate every sixth day is considered to have “continuously” operated if it did so for the entire period in question."
10,from the sample.
10,"the second reason for this restriction is that a new daily standard for pm2.5 was implemented in 2009, and we want to limit the influence of this event on our estimates."
10,4 data 4.1 air pollution monitors and attainment designations data on epa’s air pollution monitoring system come from epa and cover every air pollution monitor from 1999 through 2017.
10,"the data include latitude and longitude, days of operation, pollution readings, and whether the monitor can be used to determine naaqs compliance."
10,"when used, average annual readings for each monitor exclude concurred exceptional events.10 table 1 reports the number of monitors available for naaqs compliance during our period of study."
10,panel a reports the number of monitors designated as naaqs primary compliance monitors that operated in the given year.
10,"column 1 reports how many monitors operated no more than 80 days during that year, column 2 reports how many operated 81–120 days, and so on."
10,the strongest time trend is the addition of monitors operating more than 300 days a year.
10,panel b reports how many monitors had sufficient data over the prior three years to calculate a design value.
10,"for any given year and frequency, the number of monitors with three years of data is generally less than those with one year of data, though small anomalies can occur when monitors move across the frequency categories year to year."
10,both panels show that a significant proportion of monitors operate less than once every three days (columns 1 and 2).
