page,p
1,"policy and practice reviews published: 22 march 2022 doi: 10.3389/fenvs.2022.788843 on-going european space agency activities on measuring the beneﬁts of earth observations to society: challenges, achievements and next steps alessandra tassa *, stephanie willekens, arne lahcen, laurent laurich and charlotte mathieu european space agency (esa), paris, france understanding the earth system and its physical and societal processes is crucial for edited by: helping humankind develop in a sustainable way, and for designing effective policies brian alan johnson, across a wide range of applications that include mitigating the effects of climate change, institute for global environmental strategies, japan the sustainable management of natural resources, food security and public health."
1,"earth reviewed by: observation (eo) satellites provide regular and accurate observations of the entire planet steffen fritz, that can greatly support improvements in such understanding."
1,"the european space international institute for applied agency (esa) is committed to supporting international efforts to decipher the processes systems analysis (iiasa), austria masami onoda, and phenomena that regulate life on earth, by building world class eo space missions and japan aerospace exploration agency making data available to scientists and citizens across the world."
1,"how successful is esa in (jaxa), japan valentina morretta, this endeavour?"
1,"given the variable and dynamic nature of eo data use, it is difﬁcult to university of milan, italy answer the question through established ﬁgures."
1,"yet, it is crucial that esa be able to *correspondence: discriminate and assess the beneﬁts brought by the use of its eo missions, in order to alessandra tassa demonstrate its achievements, to keep improving its systems, to better design and plan alessandra.tassa@esa.int future missions, and to promote further uptake."
1,"in this article, after recalling its specialty section: commitments in support of earth system sciences, esa’s attempts to conduct this article was submitted to valuations of the impact of its own space missions are described."
1,"in particular, the environmental informatics and remote sensing, challenges encountered in measuring such impacts and the solutions pursued by the a section of the journal agency to improve its assessment capabilities are detailed, together with the open issues frontiers in environmental science and the current lines of work."
1,"received: 04 october 2021 accepted: 25 february 2022 keywords: satellite earth observations, socio-economic impacts, impacts assessment, indicators, value of published: 22 march 2022 information citation: tassa a, willekens s, lahcen a, laurich l and mathieu c (2022) on- introduction going european space agency activities on measuring the beneﬁts of a better understanding of the complexities of the earth and about its changing climate is essential for earth observations to society: challenges, achievements and international efforts and decision-makers to address challenging environmental and societal issues."
1,"it next steps. is, therefore, no surprise that the need for authoritative information is growing at an ever-increasing front."
1,environ.
1,10:788843. rate.
1,"earth observations (eo) satellites provide a wealth of data which can be used to answer doi: 10.3389/fenvs.2022.788843 important earth-science questions, to reveal interactions between the atmosphere, biosphere, frontiers in environmental science | www.frontiersin.org 1 march 2022 | volume 10 | article 788843"
2,tassa et al.
2,"esa activities on measuring eo beneﬁts hydrosphere, cryosphere and the earth’s interior, and to forecast it is worth highlighting that, in order to maximize opportunities the weather, and so the data support decision-making in a and beneﬁts, most eo data are now provided under a free and open number of everyday applications. access policy."
2,"the logic for this choice—which was not a self-evident esa is europe’s gateway to space, mandated to shape the one in the conceptual phase of public operational eo—had arisen as development of europe’s space capabilities and to ensure that its part of an evolving understanding on the key role of the public sector investments in space deliver beneﬁts to the citizens of europe and in creating goods to allow new commercial markets to form and grow the world."
2,the agency has long-standing activities in earth around publicly provided services.
2,"open data, as a public good, offer observation, which develop along the following three main incredible opportunities for exploitation: it stimulates research and programmatic lines (see esa, 2021a): innovation and leads to the promotion of education at every level."
2,"the earth explorer missions, that are designed to improve the free accessibility tears down the barriers that hinder proper cross- our understanding of earth using cutting-edge space fertilization in research and market entry for entrepreneurship. technologies and, in many cases, pave the way for future behind open and free data also lies the key for better governance, operational eo missions."
2,"importantly, they address as it contributes to better informed public decision-making and scientiﬁc questions that help predict the effects of climate transparency."
2,"as a matter of fact, the considerable and diverse change and have a direct bearing on societal issues that forms of public value generated by earth observation-related humankind is likely to face in the coming decades. information and knowledge are largely the result of the deliberate examples of these missions are cryosat, the gravity field choice to have a full, free and open data policy in public programmes and steady-state ocean circulation explorer, the soil (see, for instance, wulder et al., 2012; harris and baumann, 2015; moisture and ocean salinity mission, the atmospheric nextspace, 2019)."
2,"this is coupled with an increased focus on data dynamics mission aeolus-1 (esa, 2021b), and others. exploitation: increasingly, wide and diverse user communities have the copernicus sentinel missions, that are developed been gaining a central position in the deﬁnition of the user needs and speciﬁcally for the european union’s copernicus efforts are made by most space agencies to maximise user uptake in programme—the largest environmental monitoring all layers of society (see e.g., european commission, 2016)."
2,"from a programme in the world (european commission, 2021a)."
2,"each technical point of view, this results in stronger integration of sentinel mission carries state-of-the-art technology to deliver a technology-push and demand-pull approaches, with continued stream of complementary imagery and data tailored to the needs efforts to deliver quality-proof and reliable data streams, pre- of copernicus."
2,"by providing a set of key information services for a process ever larger data sets and translate them into easily wide range of practical applications, the programme is making a exploitable information up to embedding eo-based solutions into step change in the way we manage the environment, understand collaborative digital solutions aimed at tackling urgent societal needs, and tackle the effects of climate change and safeguard everyday such as climate change mitigation measures and adaptation."
2,in this lives (see e.g.
2,"eea, 2020; von schukmann et al., 2021; copernicus context, the eu’s destination earth initiative (european climate change service, 2020)."
2,"commission, 2021b) is expected to trigger further improvements the meteorological missions, that respond to the requirements of in modelling and predictive capacities to be able to e.g. help anticipate the meteorological community, aimed at allowing people to make and plan measures in case of events having potentially major socio- informed decisions, whether it be harvesting a crop before it rains, economic impacts such as extreme weather and natural disasters."
2,"the gritting the roads to prevent accidents, routing aircraft and marine initiative will provide a platform supporting digital modelling of the trafﬁc to avoid adverse conditions or simply plan everyday activities."
2,"earth’s physical resources but also of related phenomena on a global thanks to the cooperation between esa and eumetsat, europe scale."
2,"data-intensive “digital twins” of the earth will integrate has a ﬂeet of meteorological satellites, in both geostationary and polar continuous observations, modelling and high-performance orbits, to provide essential information for weather forecasts. simulations to enable predictions across many intertwined information from these satellites is also used to understand domains and bringing together also social and economic models climate change. with the aim of supporting the delineation of potential overarching in addition to building and operating satellite missions, esa “what-if?”"
2,scenarios.
2,notwithstanding the future adoption of works hard to ensure that its data are optimally exploited to destination earth as a policy-making tool and its consequential maximize the beneﬁts for science and society.
2,"for instance, esa impacts on society, the role of eo data lakes at its core will has been instrumental in setting up a number of initiatives related to certainly prove a key development for the use of eo data. the use of eo to support climate change studies or to protect citizens."
2,"as the main procurement and implementation public agency the climate change initiative (climate.esa.int), aimed at generating for the european space programmes, esa is responsible for long-term datasets on key indicators of climate change, and the steering the european space industrial and scientiﬁc international charter ‘space and major disasters’ (disastercharter. communities in responding to critical societal needs and org), which provides rapid access to satellite data to help disaster maximising beneﬁts to europe’s society and economy1."
2,"in management authorities in the event of natural disasters, are just two short, whilst each space programme has its own speciﬁc concrete examples in this respect."
2,"through its “science for society” objective, designing innovative space solutions that can activities and its accelerators, esa forges new scientiﬁc discoveries address earth system science and societal challenges and and pioneers new services, stimulating downstream industrial and economic growth (see eo4society.esa.int and https://vision.esa.int/ category/ambition/accelerate-the-use-of-space/)."
2,1 see esa convention.
2,frontiers in environmental science | www.frontiersin.org 2 march 2022 | volume 10 | article 788843
3,tassa et al.
3,"esa activities on measuring eo beneﬁts deliver value for society is at the core of practically all esa’s earth esa, eumetsat, and the eu) was €11.5 billion3, posting a observations programmes."
3,"in this context, the ability to assess 9% growth especially following the success of esa’s the societal and economic impacts of its own activities is ministerial conference in 2019 (space19+)."
3,"however, it is identiﬁed as key for the agency, to evaluate its ability to fulﬁl worth highlighting that global public space expenditures had its mandates."
3,"this rationale has matured and signiﬁcantly suffered from a signiﬁcant slowdown after the 2007–2008 evolved over time: the agency has gone from demonstrating global ﬁnancial crisis and almost 8 years had been needed the beneﬁts generated from past esa programmes (ex-post) to return to the pre-crisis growth path (see e.g., euroconsult, towards the analysis of new programmes proposed to 2020a)."
3,the economic shock increased constraints on overall ministerial representatives (ex-ante).
3,"the latter have the public budgets and grew the need to justify government objective of introducing the socio-economic perspective as spending in space activities, demonstrating return on early as possible in the activity design process, with the investment and the sector’s contribution to economic strategic objective of informing decision-makers about the growth and addressing of critical social issues."
3,this has potential beneﬁts of the proposed programmes.
3,"as an renewed efforts for esa to engage into regular structured example, a currently on-going economic analysis is assessments. investigating a set of potential new space activities based on since 2012, esa has started preparing regular reports on their socio-economic beneﬁt potential."
3,"this could imply that, in the space economy to support the preparation of esa council the future, socio-economic impact assessments could be meetings at ministerial level."
3,"these reports include key introduced much earlier in the mission deﬁnition phase to ﬁgures on the space economy, national analyses of the assess different options i.e., instead of estimating the expected socio-economic impact of space activities from esa socio-economic impact from an already deﬁned future mission, member states and the results of the socio-economic the socio-economic impacts could concur to drive its deﬁnition. impact assessments of esa programmes across all esa in contrast with this increased need, however, the studies activities (including e.g. navigation, telecommunications, and methodologies analysed so far consistently seem to fall space exploration and human spaceﬂight)."
3,"they follow the short of providing a complete overview of all the value european commission’s best practices (european underpinned by space activities, particularly regarding a commission, 2021) as well as the deﬁnition of the space sector fertile for societal applications such as earth economy developed by the organisation for economic co- observation."
3,"so how can beneﬁts studies be enhanced to operation and development (oecd), which comprises the meet esa needs?"
3,we present in this article a wide-ranging space industry’s core activities in space manufacturing and in overview of different approaches being explored by the satellite operations but also other consumer activities that agency to widen its notion of value.
3,we start from have been derived over the years from governmental research describing how esa currently carries on studies about the and developments.
3,"crucially, it also includes all public and impact of its own space missions (in section 2) and then we private factors involved in developing, providing and using explain the encountered challenges and the solutions being space-related outputs, space-derived products and services explored to address these challenges (section 3)."
3,"conclusions and the scientiﬁc knowledge arisen from space research (see in section 4 provide a summary of the currently identiﬁed oecd, 2012). open issues, areas of interest and planned lines of action."
3,"by throughout the years, esa has sought to adopt providing a user perspective and highlighting the identiﬁed increasingly robust and standardised methodologies, shortcomings, we hope to support improvements in value investigating their applicability from the economic theory assessments and stimulate further research in the ﬁeld. to measure the socio-economic beneﬁts generated by public-funded space activities."
3,"with the aim to obtain ever more robust and consistent measures of the impact of its space programmes, esa cooperates with national space agencies but on-going esa activities to measure also with international partners and communities such as the the benefits of its earth oecd space forum, which investigates the economic and observation satellites to society innovation dimensions of the whole space sector within the larger economy and society."
3,"the space economy reports build background and rationale of esa socio- on available information from relevant trusted sources and economic assessment framework pertinent organisations (e.g., pwc, 2019a; euroconsult, committed to provide evidence and transparency about its 2020b; earsc, 2020) but also on dedicated esa-procured effectiveness to secure returns on member states’ assessments, where appropriate and needed."
3,"since 2014, more investments, esa has been studying the socio-economic than a dozen independent studies have been conducted beneﬁts of its activities and programmes since the 1990s. covering different esa activities (see esa, 2021c)."
3,"among at that time, space programmes worldwide were these, a recent example for eo is an ex-ante socio-economic beneﬁtting from a rather continuous increase of public impact assessment which was carried out in 2019 in support of investments and in 2020 the european space budget the proposal for esa’s envelope programme for innovative (including national programmes for upstream and earth observations (also known as futureeo) (see pwc, downstream activities and member states’ contributions to 2019b)."
3,esa studies are based on stakeholders frontiers in environmental science | www.frontiersin.org 3 march 2022 | volume 10 | article 788843
4,tassa et al.
4,esa activities on measuring eo beneﬁts table 1 | examples of esa’s socio-economic indicators used in socio-economic impact studies of esa space programmes.
4,"impact impact indicator description relevant stakeholders examples of studies category across which assessed the the space value indicatora chain economic additional sales sales from additional business (recurring units, upstream space industry; euroconsult for esa (2019) socio- excl."
4,"esa contract value) enabled by the project downstream space segment; economic impact assessment of selected implementation non-space verticals esa telecommunication partnership projects gross value- contribution to gdp from the investment (esa the entire economy pwc for esa (2019) socio-economic added (gva) contract value) and additional sales impact assessment of access to space in europe: an ex-post analysis of the ariane 5 and vega programmes government revenues contribution to taxes from the investment (esa the entire economy pwc for esa (2019) socio-economic contract value) and additional sales impact assessment of access to space in europe: an ex-post analysis of the ariane 5 and vega programmes jobs supported by the full time equivalent (fte) or man-year upstream space industry; pwc for esa (2019) assessment of the project maintained or enabled by the project downstream space segment; socioeconomic impact of the esa implementation non-space verticals participation to the international space station (iss) programme strategic market share measure of industry upstream space industry; euroconsult for esa (2019) socio- competitiveness—increased share of an entity’s downstream space segment; economic impact assessment of selected sales in a speciﬁc market non-space verticals esa telecommunication partnership projects cost competitiveness measure of industry competitiveness –improved upstream space industry; know.space for esa (2021a) socio- product cost/quality ratio downstream space segment; economic beneﬁts from future aircraft non-space verticals composite firewall - using space-grade materials to enhance next generation aircraft technological in orbit demonstration/ in-orbit demonstration or validation enabled by upstream space industry euroconsult for esa (2019) socio- in orbit validation the project economic impact assessment of selected (iod, iov) esa telecommunication partnership projects technological technology readiness level (trl) increase upstream space industry euroconsult for esa (2019) socio- advancement enabled by the project economic impact assessment of selected esa telecommunication partnership projects technology transfers technology transfers for (spin-in) or from (spin- upstream space industry; non- know.space for esa (2021b) socio- off) the project execution space verticals economic beneﬁts from space technology for energy providers through automated complex system coordination increased efﬁciency improvement of internal processes and upstream space industry; earsc for esa (2021c) copernicus operations enabled by the project downstream space segment; sentinels’ products economic value: a non-space verticals case study of winter navigation in the baltic intellectual property proxy measure of innovation—e.g. patent ﬁling upstream space industry; euroconsult for esa (2019) socio- downstream space segment; economic impact assessment of selected non-space verticals esa telecommunication partnership projects societal societal value creation key social issues (e.g."
4,un sdgs) on which the upstream space industry; euroconsult for esa (2019) socio- project has a positive contribution downstream space segment; economic impact assessment of esa’s non-space verticals; end-users activities on secure satcom for safety and security environmental value key environmental issues (e.g.
4,"european green upstream space industry; know.space for esa (2021a) socio- creation deal) on which the project has a positive downstream space segment; economic beneﬁts from esa technology contribution non-space verticals; end-users transfers - from waste to resource scientiﬁc knowledge number and proﬁle of publications, citations, upstream space industry; pwc for esa (2019) socio-economic production scientiﬁc community width, scientiﬁc downstream space segment; impact assessment of esa’s science breakthrough. . ."
4,non-space verticals; end-users programme a executive summaries of the studies are publicly available on esa space economy website restricted area https://space-economy.esa.int/restricted-area (free registration).
4,frontiers in environmental science | www.frontiersin.org 4 march 2022 | volume 10 | article 788843
5,tassa et al.
5,"esa activities on measuring eo beneﬁts consultations (e.g., how many new ftes the project level advancements, in orbit demonstration and supported) or on well-known methodologies from the validation)."
5,"leveraging on this taxonomy, a socio- economic theory (e.g., cost beneﬁt analysis, input-output economic indicators framework is being generated, a modelling, multi criteria analysis) but limitedly to the preliminary example of which is provided in table 1."
5,the approaches and indicators that are considered as the most table provides a general framework intended to support robust and appropriate for the programme/s under esa’s assessment activities across all its programmes which evaluation.
5,"typically, they provide in-depth information on has been progressively enriched via an empirical approach, various economic parameters that provide an essential alongside the generation of increasingly complete socio- perspective on the general state of the market and on the economic assessments."
5,"it is anticipated that, being returns on investments for member states, based on economic developed across very different types of activities within outputs and gdp contributions, such as the status, trends and different directorates, the framework provides beneﬁt from evolution of the upstream manufacturing industry and of the some degree of fertilization across the various programmes, data market, revenues from so-called value-added services with methodological advances in one area propagated to other (vas), levels of employment as well as contribution to areas as applicable."
5,member states’ gdp (in terms of gross value-added).
5,"it is worth highlighting that the framework includes however, the scope of the studies is generally framed diverse indicators but that very often only a subset of them depending on the needs (and resources) of the speciﬁc is considered as relevant for the assessment, depending on the programme under investigation and this means that they speciﬁc nature, scope and objectives of the space activity often are not meant to assess indicators across the entire being addressed."
5,"for example, indicators such as the gross value chain but rather focus on a speciﬁc part of it."
5,"as an value-added or the contribution to gdp are not deemed example, in a 2019 study of selected esa artes appropriate (too small to be signiﬁcant) to assess the beneﬁts telecommunication partnership projects, the additional of small-size missions, while the number of peer-reviewed sales generated by the satcom missions were assessed only scientiﬁc publications might not be relevant to demonstrate for the prime manufacturers and for a selection of primary the value of a new satcom solution."
5,"speciﬁcally for eo, even subcontractors (in terms of recurring sales of the hardware or though a vast set of the indicators is recognized as potentially software developed speciﬁcally under the esa programme) relevant, a tailoring may be applied depending on the speciﬁc and for the satcom operator (in terms of generated satcom nature of the satellite mission/s at stake."
5,"as an example, the service revenues)."
5,"additional sales potentially generated futureeo study (pwc, 2019b) included a wide range of further down the value chain, from e.g. the use of the indicators: next to economic ones (e.g., contribution to developed satcom service in non-space user verticals or any gdp in terms of gross-value added generated, additional sales which could have arisen from technology government revenues in terms of taxes, employment transfers, were knowingly neglected."
