page,p
5,"these limitations are supported in both the space and non-space sectors but also generally well known and recognized, as they serve the speciﬁc estimates of innovation spill-overs), others were included to cost/beneﬁts trade-off of the study itself. show trends in scientiﬁc exploitation (annual academic in order to widen its oversight of relevant suitable publication rates) as well as in the growth of the users methodologies and indicators that can be leveraged and community (e.g., monthly trafﬁc on esa’s data access tailored to ﬁt the needs of the speciﬁc studies at stake, esa platforms, attendance to esa eo events)."
5,"notably, societal is increasingly screening the available knowledge."
5,"and, with impacts were also highlighted through example use cases of the aim to improve its understanding about the reliability and innovative technologies in support of e.g., crop monitoring, robustness of the available methodologies, it is increasingly water management, international development aid or coastal reaching out to the practitioners and the academic management. community."
5,"starting with a critical review of the literature as the set of socio-economic impact assessments of esa and of all former studies, it has adopted an empirical approach programmes has been developed and its results presented, it to identify an encompassing set of socio-economic indicators has been clearly identiﬁed that they currently fail to capture that could be relevant for all esa activities and span across the full extent of the value brought by space activities to different segments of the space value chain (e.g., upstream and society."
5,"for instance, it was increasingly evident that various downstream space sectors, non-space verticals2 and end- parameters traditionally used by the eo community to users)."
5,"efforts have also been made to review and collectively look at its own achievements were not captured consolidate a relevant taxonomy which is generated from in the current assessments (e.g., scientiﬁc outputs, value of eo economic theory through a comprehensive literature review data for decision-makers in the decision-making processes, of socio-economic analyses as well as vocabulary speciﬁcities contribution to global environmental goals)."
5,"thus, esa has from the space sector at large (e.g., technology readiness been working, along with its member states and reference partners such as the oecd, to further investigate the applicability of new and complementary approaches."
5,"in 2 non-space vertical segments are economic sectors which make use of space data particular, esa is progressively consolidating the socio- and or services, such as aviation, agriculture, energy, but also insurance, tourism or economic indicator framework and reviewing its disaster response. applicability as it enlarges the scope of its analyses, aiming frontiers in environmental science | www.frontiersin.org 5 march 2022 | volume 10 | article 788843"
6,tassa et al.
6,"esa activities on measuring eo beneﬁts at extending further the understanding and robustness of its r&d in space is at the core of esa’s purpose, so the agency is valuation, especially for the non-monetary beneﬁts that space actively exploring improvements in this respect."
6,"as an example, programmes bring to society, with new approaches being the futureeo study which has been mentioned (pwc 2019a) tested to capture aspects that are not yet part of its space included an attempt to measure knowledge spillover impacts mission valuation protocols. (including spillovers from both manufacturing and data and recent efforts, therefore, tend to increasingly extend the processing activities with esa)."
6,"these were not captured in analysis by considering additional relevant parameters, as we the gdp impact calculations (which instead focused on will explain in the following chapters. transactional impacts derived from the initial public spending) and were taken to represent innovation and knowledge creation externalities derived from the past development of previous esa valuing esa’s earth observation as support eo r&d programmes (i.e., earth observation envelope to knowledge and innovation programmes eoep4 and eoep5)."
6,"in order to estimate these innovation and technological and scientiﬁc pursuit are key impacts, pwc consulted 93 entities previously contracted by esa endeavours for a thriving society and, in a context of immense (collectively accounting for about eur 516.4 m of esa economic constraints and critical social issues, the demonstration procurements between 2013 and 2018) to observe that 88% of the value of eo data in support of science and technological considered that they have generated spillovers thanks to their breakthrough is considered of primary importance."
6,but the ability participation in the eoep programmes.
6,"some of these entities to estimate knowledge beneﬁts is a recognised challenge for were able to provide the associated monetary estimations, on the research and technological agencies all over the world when basis of which pwc postulated total spillover beneﬁts in the range trying to justify public investments (see e.g., mazzuccato, 2013; of eur 794.9 to 1,089.1 m, with associated weighted spillover florio, 2019). multipliers ranging between 1.63 and 2.24."
6,"as recognized by the as already discussed, eo data provide fundamental contributions authors, the calculation was certainly approximate and it was to improvements in understanding about earth system science, intended only to provide a “minimal estimation of a very complex particularly with respect to climate change."
6,"but designing, building phenomenon (i.e., innovation and knowledge development) to and operating eo satellites can also represent, by itself, an innovation demonstrate its existence rather than over estimating it”."
6,"even so, endeavour and result in improvements in human capital in terms of the resulting ﬁgures were comparable to the gdp transactional e.g., skills and experience acquired, competitive advantages for the ones, highlighting that the phenomenon is not negligible and contracted ﬁrms (that learn from technological collaboration with would deserve to be taken into account for the evaluation of r&d major space agencies), technological transfers from space to other intensive programmes such as the space ones. industrial sectors."
6,"in perspective, beneﬁts from research and development (r&d) lie in the potential of growing into new or improved operational technologies, contributing to the creation of valuing esa’s earth observation as support new services and new markets with consequential economic and to decision making societal growth."
6,but these impacts frequently materialize after long- eo is well established as an effective tool to support decision- lead times and have to be balanced against (sometimes substantial) making across many different applications and at different levels risks.
6,"this makes their assessment very challenging but, at the same (see e.g., onoda and young, 2016; kruse et al., 2019; pwc 2019a; time, all the more compelling."
6,"hanan et al., 2020)."
6,"from this perspective, eo missions have traditionally, the most common indicators used to measure value insofar as they provide information which is useful for beneﬁts derived from science and innovation are the number of taking decisions."
6,"this notion is generally framed as the value of patents ﬁled upon deployed solutions and the (weighted) number information or voi theory: this was originally developed in the of academic publications stemming from the design of new late 1960s to support public policy evaluation in the areas of systems or from the use of the data (see e.g., oecd, 2016). health, environment and climate change, to appreciate the value esa maintains a patent portfolio for technological transfers and of public goods, and was then transposed to the valuation of eo regularly looks at the number of scientiﬁc publications that make data (see e.g., macauley, 2006) and used to assess the value of reference to its own missions."
6,"in this respect, thousands of peer- several past or future projects in earth observation and earth reviewed scientiﬁc publications have been tracked, with more science (see e.g., kruse et al., 2019)."
6,"voi analysis, leveraging on than 5,000 related to the eo scientiﬁc missions and a rate of bayesian decision theory and the theory of the economics of publication that has more than tripled in the last years (pwc, information, essentially addresses the decisions taken under 2019b)."
6,"however, these only provide a partial view and additional uncertainty with, and without, information."
6,decisions taken elements should be considered.
6,"for example, assimilating outer relying on alternative types of data (e.g., often, ground-based space probes to public research infrastructures the likes of large measurements) represent the so-called “counterfactual”, against particle accelerators and genomics platforms, florio (2019) takes which an improvement is measured (and value attributed). into account aspects such as beneﬁts to the work of scientists and depending on the degree of the uncertainty and on what is at students; knowledge spillovers for ﬁrms; beneﬁts to users of stake, decision makers may be willing to pay for information, information technology and science-based innovation; welfare either additional or improved, as long as the expected beneﬁt effects on the general public and even willingness of taxpayers to exceeds the cost of the information."
6,"the technique, therefore, fund scientiﬁc knowledge creation. includes conceptualizing a decision problem, developing a frontiers in environmental science | www.frontiersin.org 6 march 2022 | volume 10 | article 788843"
7,tassa et al.
7,"esa activities on measuring eo beneﬁts decision model, identifying the relevant parameters, conducting a schemes, against which the relevance of esa’s eo data can be probabilistic analysis and estimating the subsequent value of exposed in a straightforward way."
7,one example in this respect information (as opposed to the counterfactual) to derive the comes from the set of geophysical parameters deﬁned as expected net beneﬁt for the decision maker.
7,"all these steps are “essential” to support international climate research, for which extremely sensitive to the speciﬁc case under analysis."
7,"in it has been estimated that eo missions contribute to about 60% of particular, the counterfactual is not always available or only the 54 essential climate variables (ecvs) deﬁned by the global partially ﬁtting as in some cases space-based solutions allow climate observing system (gcos, 2021)."
7,"in addition to for improvements in the public services that cannot be easily providing own data sources, esa’s cci speciﬁcally produces monetized and compared."
7,"moreover, one must consider that the data records of 21 ecvs over the whole world, stretching back eo-derived information is rarely based on eo data only but is more than 30 years, based on its full satellite archive."
7,these frequently intertwined with other types of data and this implies contribute to a rapidly expanding body of scientiﬁc knowledge that the value of the eo data must be disentangled from the voi and provide signiﬁcant input to the studies of the international in order to attribute to the data its correct share.
7,"again, such panel on climate change (see ipcc, 2021)."
7,"alongside ecvs, a set attribution cannot be determined a-priori and requires a precise of essential biodiversity variables (or ebvs) has emerged to knowledge of the speciﬁc process."
7,"to address this challenge, real- provide a ﬁrst level of abstraction between low-level primary life examples offer the advantage of being intimately related to the observations and high-level indicators of biodiversity (pereira use beneﬁts in a way that no general ﬁt-for-all assessment can et al., 2013)."
7,"although the framework, and especially its links with credibly attempt."
7,"however, this reliability cannot be easily respect to remotely sensed parameters, is still under consolidation extrapolated and a large number of case analyses and on-the- (see skidmore et al., 2021), this represents another benchmark to ﬁeld investigations would be ideally required, covering at least be considered when assessing the contribution of esa’s eo data core inﬂuential applications."
7,"indeed, micro-diffusion models to global environmental efforts. have been used even to assess the end-user beneﬁts of large through supporting environmental protection and programmes such as copernicus (pwc, 2019a)."
7,"ultimately, contributing to the advancement of earth and approaches based on concrete use cases could contribute solid environmental sciences—particularly in support of foundations for meta-analyses and provide useful information to resilience and adaptation to climate change - eo can also feed economic models in a “bottom up” perspective (see e.g., be seen as relevant to a surprisingly broad range of efforts to tassa, 2019). ensure human well-being and societal progress around the the “use cases” also offer the additional advantage of world."
7,"in this sense, eo contributes to the united nation’s providing a convincing tool for communication and user 2030 agenda for sustainable development and helps to uptake purposes, as shown by the experience of the sentinels address the un’s sustainable development goals (sdgs) beneﬁts study (sawyer and papadakis, 2020)."
7,this also explains and 169 of the associated speciﬁc targets.
7,"the un, in fact, why “use case collections” have become increasingly popular to explicitly recognizes the role of eo in supporting the showcase the copernicus programme (european commission, achievement of the sdgs (unoosa, 2018), and over half 2021a)."
7,"through dedicated procurements within the eu of the sdgs are recognized to be affected positively by eo copernicus programme, esa has also embraced the collection (with almost 40% of the associated speciﬁc targets directly and analysis of use cases, with particular regards to cases of use beneﬁtting from the use of navigation and copernicus from scientiﬁc users (e.g., copernicus sentinels success stories) services) either through permanent monitoring of the and from public authorities (see nereus, european space evolution of the indicators or through active contribution agency and european commission, 2018). to their accomplishment (e.g., using eo data to optimize use case analyses are fundamental to deepen the agricultural practices, thereby contributing to the understanding of the beneﬁts and can be extremely effective to achievement of the second sdg on zero hunger). showcase the value of the data in speciﬁc contexts, but they lack obviously, the more abstract the target indicators, the more the amplitude and the global perspective that represents a key complex the assessment of the eo contribution, which might asset brought by earth observations. require a deeper analysis."
7,"in order to unambiguously assess the suitability of eo-derived data for measuring the sdg indicators, andries et al. (2019) developed a maturity matrix framework valuing esa’s earth observation as that took into account multiple dimensions such as: contribution to established global indicator frameworks 1) uncertainty (i.e., the level of bias and the possibility of an effective way to illustrate the global value of eo data is estimating said bias), through its contribution to established frameworks of indicators 2) directness (i.e., the level of direct measure of the indicator by underpinning international treaties and cooperation efforts, like eo data), those established through the un conferences of the parties."
7,"3) completeness (i.e., the level of support of eo data to an eo data are recognized as a vital source of information when indicator), tracking progress with respect to global environmental 4) requirement for non-eo information (i.e., the level of non- commitments."
7,"often, this contribution is framed through well- eo information needed to complete the contribution of eo deﬁned and internationally agreed bio-geophysical indicator data to an indicator), frontiers in environmental science | www.frontiersin.org 7 march 2022 | volume 10 | article 788843"
8,tassa et al.
8,"esa activities on measuring eo beneﬁts 5) practicability (i.e., the extent to which the approach of using substantial factors and conditions that led to a major eo data is integrated by end-users for decision-making), and european achievement."
8,"possible developments for esa in this 6) cost-effectiveness (i.e., the extent to which eo data is the area could then be to improve its tracking capabilities through most cost-efﬁcient and advantageous approach to measure the e.g., the retrospective analyses of past achievements and legacies, indicator). at least for breakthrough developments."
8,"such analyses could also improve the awareness and understanding of the factors even through this more critical scrutiny, eo data (mostly free contributing to major achievements (or failures), providing copernicus and landsat data) are conﬁrmed to be largely and concrete elements to inform forward-looking perspectives. effectively contributing to a substantial number of sdgs and their a second line of action concerns the assessment of the beneﬁts indicators. accrued through the use of eo data to support decision-making in (semi) operational applications."
8,progress in this area is pursued in many directions.
8,"for instance, esa is seeking to widen the areas for improvement and future applicability of the voi theoretical approach: so far, this has only perspectives been applied in a relatively limited number of sentinel data use cases but, following requests from member states, the throughout the years, esa has been evaluating the suitability of applicability is being tested within ex-ante studies in support different standards and practices through the deﬁnition and the of programme proposals for the ministerial council meetings."
8,a procurement of different studies.
8,"the continued efforts to pursue pilot activity has just been started to study the voi for two esa methodological robustness lead to the understanding that current earth explorers missions: the currently ﬂying aeolus-1 (esa, socio-economic impact analyses do not sufﬁciently capture the 2021b) and the upcoming aeolus-2, which is to be proposed at beneﬁts for humanity and that a more holistic approach is the next esa council at ministerial level in 2022."
8,"as part of the needed. project, voi will be used to measure the willingness to pay the agency is, therefore, progressively widening its notion of (wtp) of european decision-makers, based on how new or value, by exploring possible ways to include non-economic improved information derived from aeolus has changed (or is aspects in a way that is sufﬁciently robust and structured and supposed to change) their prior knowledge about uncertainties, widely acceptable to its decision makers."
8,"possible areas for and the decision which he or she would make if the uncertainty improvements are described below, expanding on the current were reduced or resolved ahead of time."
8,"in addition, the estimated lines of action identiﬁed in the previous section."
8,"wtp value of the mission will have to be attributed by understandably, due to its r&d vocation, the ability to disentangling its relative contribution to the weather forecasts demonstrate the beneﬁts derived from investments in research within the european centre for medium-range weather and development is considered a key area for improvement for forecasts numerical weather prediction model (see also esa."
8,"as introduced in sub-section 2.2, expert advice has been ecmwf, 2021) which will also serve as the basis for the leveraged to perform some preliminary assessments of the counterfactual."
8,"as described previously, this technique is economic value of the (accrued and potential) knowledge particularly challenging because it crucially requires the externalities derived from some speciﬁc esa r&d availability and cooperation of the data users, so the programmes."
8,this certainly highlights the importance of the availability and acquisition of detailed decision-maker data phenomenon but is not sufﬁcient.
8,to secure improvements in represents the most challenging step of the analysis.
8,"the this direction, the ability to expose the links between beneﬁts study, to be completed in 2022, is expected to bring to the accrued in the past and their enabling r&d activities, is perceived esa member states ministries a complementary perspective as crucial."
8,"after all, the key convincing argument of the futureeo beyond the industrial economic multiplier and the programme proposal was that it can pave the way to future technological and scientiﬁc effects."
8,results from this operational programmes like copernicus.
8,"the argument experience will not only provide inputs for the esa ministers, implicitly rested on past track records, and on the wide but will also be critical for esa to understand the potential recognition that, without the legacy from the previous challenges of applying voi to assess the potential of new eo missions (such as envisat and cryosat) and esa’s preparatory missions in a more systematic way for its future programmes. actions (such as the gmes service elements), the copernicus the valuation of eo-derived information is also to be programme would not have been possible, at least not in its improved through an expanded notion of value."
8,"since eo current shape (pwc, 2019b)."
8,"however, such legacy tributes are applications support public decision-making related to not systematically tracked in esa, and heritage attribution is disparate sectors such as urban planning, smart mobility, substantially linked to occasional experience which might be water and air quality monitoring, consideration must be taken fading relatively quickly."
8,"as an example, if envisat’s (and also into parameters related to overall societal improvements spot’s and landsat’s) legacies are well recognized for the including in terms of e.g., life quality, well-being, social progress copernicus sentinel satellites, that of the gmes service and even the happiness of world populations."
8,such impacts are elements (as precursors of the copernicus services) is much obviously complex to measure: they often rely on subjective less so.
8,such knowledge is embedded in the personal memories of factors and cannot always be quantiﬁed.
8,"yet clearer the people who participated but, with time, the message might be appreciation of value to citizens is becoming increasingly fading and, with this, the opportunity to reﬂect upon the relevant, the more so in the wake of a triple health, economic frontiers in environmental science | www.frontiersin.org 8 march 2022 | volume 10 | article 788843"
9,tassa et al.
9,esa activities on measuring eo beneﬁts and climate crisis.
9,esa explores possible ways to include non- 2021).
9,"this new international statistical framework is regarded to economic aspects in a way that is sufﬁciently robust and potentially bring a paradigm shift in the appreciation and structured and widely acceptable to its decision-makers and is valuation of natural resources, allowing countries worldwide to making efforts to widen the number of non-economic indicators, use a common set of rules and methods to track changes in including those that cannot be measured in quantitative ways. ecosystem assets (e.g. ecosystem extent and conditions) and one way to build knowledge around these is through the analysis related ﬂow of services (i.e. ecosystem services), thereby of beneﬁts already accrued, at least for mature use cases of interest linking ecosystem information to economic and development and for strategically relevant areas of application."
9,"in this respect, activities."
9,"in a similar vein at european level, the european sawyer et al. (2022) propose to make systematic use of ﬁve mapping and assessment of ecosystems and their services additional dimensions other than economic (maes) framework can be considered."
9,"this is used to (i.e., environmental, regulatory/policy, innovation, scientiﬁc measure change in ecosystems over the entire eu territory and societal) when analysing use cases."
9,"the different and to inform all related policies, helping member states and dimensions of value are certainly straightforward to stakeholders to carry out national ecosystem assessments through acknowledge, although the emphasis can be variable both an agreed analytical framework and indicators (maes et al., depending on the programme being addressed."
9,"for instance, 2020)."
9,"as of today, eo and copernicus data already contribute to for a public programme such as copernicus, regulatory monitoring an important share of maes indicators, across its beneﬁts are of primary interest: the assessment about how far various assessed thematic ecosystems, thus conﬁrming the eo data potentially and actually contribute to support increasing use of such data by the european commission environmental policy making across esa member states and within the eu’s conspicuous legislative corpus (e.g., kucera in europe is a key measure of the overall programme’s success. et al., 2020)."
